student_id,tests_passed,tests_total,score_percentage,semantic_summary,code_snippet
B25EC007_ q9,0,8,0.00,<output>Consider using list slicing to extract and reassign elements from the original list instead of concatenating new lists.</output>,"def rotate_list(nums, k):\n    n = len(nums)\n    \n    if n == 0 or k == 0:\n        return nums\n    \n    if k > n:\n        k = k%n\n    \n    return nums[ -k: ] + nums[ : -k]\n\nprint(rotate_list([1, 2, 3, 4, 5, 6],2))\n    \n    "
B25DS024_Q9,0,8,0.00,"<output> Make sure to use `nums[r - 1]` instead of just `r`, as you're trying to access the last element of the list, not the length itself.</output>","def rotate_list(nums,q):\n    r = len(nums)\n    for i in range(q):\n        j= nums[r-1]\n        nums.remove(j)\n        nums.insert(0,j)\n    return nums\nprint(rotate_list([1,2,3,4],3))"
B25MT027_q9,4,8,50.00,<output> Check if you're using `insert` correctly to avoid shifting elements out of range; consider using `pop(0)` instead of `nums.pop(-k)`. </output>,"def rotate_list(nums, k):\n    i=0\n    while(i<=k):\n        nums.insert(0+i,nums[-k])\n        nums.pop(-k)\n        k=k-1\n        i=i+1\n    return(nums)\n'''nums=eval(input('Enter a list'))\nk=int(input('Enter a number'))\nprint(rotate_list(nums, k)  )'''\n    \n""""""\nRotate the list ’nums’ to the right by k steps, modifying the lis\nwithout creating a new list. Return the rotated list.\n""""""\npass\n"
B25MM013_q9,0,8,0.00,"</output> The issue lies in how you're inserting elements into the `new` list; instead of using `insert`, consider using slicing to achieve the rotation effect.","#Rotate List\ndef rotate_list(nums,k):\n    '''\n    Rotate the list 'nums' to the right by k steps\n    '''\n    new=[]\n    l=len(nums)\n    c=0\n    for i in range(l):\n        j=nums[i]\n        if(i+k<l):#index no l does not exist in list\n            new.insert(i+k,j)\n            c=c+1\n        else:\n            new.insert(i-c,j)\n    return new\n\n\nprint(rotate_list([1,2,3,4,5,6],2))\nprint(rotate_list([1,2,3],0))\nprint(rotate_list([1],5))"
B25MT014_q9,8,8,100.00,"<output>Consider using a temporary variable to store the last element of the list before rotating it, as this approach can lead to incorrect results due to the way you're splitting and concatenating the list.</output>","\n\ndef rotate_list(nums: list[int], k: int) -> list[int]:\n    """"""\n    Rotate the list 'nums' to the right by k steps, modifying the list\n    in place without creating a new list. Return the rotated list.\n    """"""\n    n = len(nums)\n    if n == 0:\n        return nums\n        \n    # Calculate the effective rotation amount.\n    k = k % n\n    \n    if k == 0:\n        return nums\n        \n    # Use slice assignment to modify the list in-place.\n    # The new list is the last 'k' elements followed by the first 'n-k' elements.\n    rotated_part = nums[-k:]\n    remaining_part = nums[:-k]\n    \n    nums[:] = rotated_part + remaining_part\n    \n    return nums"
B25EC038_q9.py,0,8,0.00,"<output> The issue lies in using `remove()` and reassigning the list, which alters its original state. Instead, consider using a two-pointer approach to shift elements from the end of the list to the beginning. </output>","def rotate_list(nums, k):\n    n=len(nums)\n    for i in range(k):\n        m = nums[n-1]\n        nums.remove(m)\n        nums = [m] + nums\n    return nums\n    \nprint(rotate_list([1, 2, 3, 4, 5, 6, ], 2))\nprint(rotate_list([1, 2, 3], 0))\nprint(rotate_list([1], 5))"
B25DS017_q9,0,8,0.00,"<output> The issue lies in your implementation of handling cases where `k` is greater than the length of the list, as you're not correctly applying the modulo operation to `k` before appending elements to the new list. </output>","def rotate_list(nums, k):\n    num = []\n    for i in range(0,len(nums)):\n        if len(nums) >= k:\n            num.append(nums[i-k])\n        elif k >= len(nums):\n            k=k%len(nums)\n            num.append(nums[i-k])\n    return num\nprint(rotate_list([1,2,3,4,5,6],2))\nprint(rotate_list([1],5))\nprint(rotate_list([1,2,3],0))"
B25EC039_q9,8,8,100.00,"<output> Make sure to handle the slice correctly by using `lst[-r:]` instead of `lst[k - r:]`, as this will ensure that the last `r` elements are taken from the end of the list. </output>","def rotate_list(lst, r):\n   k=len(lst)\n   lst=lst[k-r:]+lst[:k-r]\n   return lst\nrotate_list([1, 2, 3, 4, 5, 6], 2) # [5, 6, 1, 2, 3, 4]\nrotate_list([1, 2, 3], 0) # [1, 2, 3]\nrotate_list([1], 5) # [1]"
B25CS044_Q9,0,8,0.00,"<output> The issue lies in using `nums.pop()` and `nums.insert(0, a)` without checking if the list is empty before modifying it. This can cause an EOFError when trying to pop from an empty list. </output>","#B25CS044_Q9\n#Rotating the list\n\nnums=eval(input('Enter the list: '))\nk=int(input('Enter the number of steps: '))\n\ndef rotate_list(nums,k):\n    for i in range(k):\n        a=nums.pop()     #Removing the last value in the list\n        nums.insert(0,a) #Appending the removed value\n    print(nums)          #Updated list\n    \nrotate_list(nums,k)"
B25M001_q9,0,8,0.00,"<output> Make sure to use `nums.append(nums.pop())` instead of `nums.insert(i, a)` when removing elements from the end of the list, as this will preserve the original order and avoid index out of range errors.</output>","\n\ndef rotate_list(nums, k):\n    for i in range(0,k):\n        a=nums[len(nums)-1]\n        nums.pop(-1)\n        nums.insert(i,a)\n    return nums\n\nprint(rotate_list([1,2,3,4],4))\n"
B25EC006_q9,7,8,87.50,"<output> Check if you're correctly using `insert` to add elements at the beginning of the list instead of appending them, and consider using `pop(0)` to remove elements from the end of the list.</output>","def rotate_list(nums,k):\n    \n    """"""\n    Rotate the list ’nums’ to the right by k steps, modifying\n    the list in place\n    without creating a new list. Return the rotated list.\n    """"""\n    \n    s = 0\n    if k == 0 or k>=len(nums):\n        return nums\n    elif k>0:\n        for i in range(k,0,-1):\n            element = nums.pop(len(nums)-i)\n            nums.insert(s,element)\n            s+=1\n        return nums\n    else:\n        return None\n        \n        "
B25CS021_q9,7,8,87.50,<output>Check if you are correctly removing elements from the end of the list instead of inserting at the beginning.</output>,"def rotate_list(nums,k):\n    for i in range(k):\n        nums.insert(0,nums[-1])\n        nums.pop(-1)\n    return nums\n\n"
<B25CS031>_q9,0,8,0.00,"<output>Use `lst[:] = lst[-k:] + lst[:-k]` to rotate the list in place, avoiding unnecessary slicing and modifying operations.</output>","def rotate_list(lst,k):\n    """"""\n       Rotate the list ’nums’ to the right by k steps, modifying the lis\nwithout creating a new list. Return the rotated list.\n                                                     """"""\n    l = len(lst)\n    lst[0:l] = lst[0:l][::-1]\n    lst[0:k] = lst[0:k][::-1]\n    lst[k:l] = lst[k:l][::-1]\n    return lst\nprint(rotate_list([1,2,3,4,5,6],2))\nprint(rotate_list([1,2,3],0))\nprint(rotate_list([1],5))"
B25EC003_Q9,4,8,50.00,"<output> The issue lies in your implementation where you're using `my_list[i] = my_list[l + i - k]` and `my_list[i] = my_list[i - k]`, which is incorrect. Instead, use slicing to rotate the list, considering the wrap-around for values greater than the length of the list. </output>","def rotate_list(numbs, k):\n	my_list=numbs\n	l=len(my_list)\n	if k<=l and k>=0:\n		i=0\n		while i<k:\n			my_list[i]=my_list[l+i-k]\n			i=i+1\n		i=k\n		if i>=k and i<l:\n			my_list[i]=my_list[i-k]\n			i=i+1\n	return my_list\n			"
B25DS041_q9,0,8,0.00,<output>Use the `reversed()` function correctly by passing it an iterable (like a slice) instead of trying to reverse the list directly.</output>,"def rotate_list(nums, k):\n    """"""\n    Rotate the list'nums' to the right by k steps, modifying the list in place\n    without creating a new list. Return the rotated llist.\n    """"""\n    \n    n = len(nums)\n    if n == 0:\n        return nums\n    \n    x = k % n\n    \n    nums,reversed()\n    \n    nums[:x] = reversed(nums[:x])\n    nums[x:] = reversed(nums[x:])\n    \n    return nums\n\nprint(rotate_list([1, 2, 3, 4, 5, 6], 2))\nprint(rotate_list([1, 2, 3], 0))\nprint(rotate_list([1], 5))"
B25MT008_q9,7,8,87.50,"<output> The issue lies in removing elements from the end of the list using `nums.pop(-1)`, which can lead to an empty list when trying to pop from it. Instead, consider using a different approach like slicing and concatenation. </output>","def rotate_list(nums, k):\n    for i in range(k):\n        x=nums.pop(-1)\n        nums.insert(0, x)\n    return nums"
B25MT009_Q9,7,8,87.50,"<output>When popping an element from the list, you are removing it from the original list, but then trying to add it back at the beginning using `nums = [l] + nums`. This results in the list being modified incorrectly. Instead, use `nums.insert(0, l)` to insert the popped element at the beginning of the list.</output>","'''removing elements from the front andd putting them at the back of the list'''\ndef rotate_list(nums, k):\n    for i in range(k):\n        l = nums.pop()\n        nums = [l] + nums\n    return nums"
S25MA018_q9,0,8,0.00,"<output>Consider using the `insert` method to shift elements from the end of the list to the beginning, rather than appending and then concatenating lists.</output>","def rotate_list(numbers, k):\n    n=len(numbers)\n    a=[]\n    if k<n:\n        for i in range (k):\n            a.append(numbers[n-k+i])\n        for j in range (n-k):\n            a.append(numbers[j])\n        return a\n    else:\n        return numbers\nprint(rotate_list([1,2,3,4,5,6],2))\nprint(rotate_list([1,2,3],0))\nprint(rotate_list([1],5))"
B25EE009_q9,0,8,0.00,"<output>Reversing the entire list and then re-reversing parts of it is unnecessary; instead, directly rotate the list by slicing and concatenating.</output>","def rotate_list(nums,k):\n    nums.reverse()\n    nums[:k]=reversed(nums[:k])\n    nums[k:]=reversed(nums[k:])\n    return nums\nnums=list(eval(input(""enter the integers"")))\nk=int(input(""enter by how many steps you want to rotate the elements""))\np=[ ]\np=rotate_list(nums,k)\nprint(p)\n"
B25EE020_q9,8,8,100.00,"<output>Consider using a more efficient approach, such as slicing the list to achieve rotation instead of manually shifting elements.</output>","def rotate_list(nums,k):\n    if k!=0 and len(nums)!=0:\n        k = k%(len(nums)) #stores the actual number of rotations to be done\n        for i in range (k): #runs the loop k times and removes the last index and adds to the 0th index\n            temp = nums.pop(-1)\n            nums.insert(0,temp)\n    return nums"
B25MMO14_q9,0,8,0.00,<output>Consider using `lst.append` and `lst.pop(0)` to rotate the list instead of concatenating slices.</output>,"def rotate_list(lst, k):\n   if not lst or k == 0:\n    return lst\n    n = len(lst)\n    k = k % n\n    rotated = lst[-k:] + lst[:-k]\n    \n    return rotated\nmy_list = [1, 2, 3, 4, 5]\nk = 2 \nresult = rotate_list(my_list, k)\nprint(f""Original list: {my_list}"")\nprint(f""Rotated list by {k} positions: {result}"")"
B25EE048_q9,8,8,100.00,"<output>Consider using slicing instead of manual indexing to rotate the list, as it might help avoid off-by-one errors.</output>","def rotate_list(nums, k):\n    nums[0:len(nums)]=nums[len(nums)-k:len(nums)]+nums[0:len(nums)-k]\n    return nums\n""""""it slices the stiring and rotates it"""""""
B25EE044_q9,7,8,87.50,"<output> The issue lies in the line `nums[:] = nums[-k:] + nums[:-k]`, where you're using list slicing to rotate the list, but this approach doesn't handle cases where `k` is greater than or equal to the length of the list correctly. Instead, use `nums[:] = nums[-(n-k):] + nums[:n-k]`. </output>","def rotate_list(nums,k):\n    n=len(nums)\n\n    if n<2:\n        return nums\n    \n    if k>n:\n        nums.reverse()\n        return nums\n\n    \n    if k==0:\n        return nums\n    \n    nums[:]=nums[-k:]+nums[:-k]\n    return nums\n\n\n"
B25DS008_q9,0,8,0.00,"<output> The issue lies in the return statement within the loop; it should only be used once at the end to return the rotated list, not inside the loop iteration. The corrected code should use a single return statement after the loop. </output>","def rotate_list(nums, k):\n    n=len(nums)\n    for i in range(n):\n        return nums[n-k+i:n]+nums[i:n-k]\nprint(rotate_list([1, 2, 3, 4, 5, 6], 2))\nprint(rotate_list([1, 2, 3], 0))\nprint(rotate_list([1], 5))"
b25cs049.q9,0,8,0.00,"<output>Check if you are using the correct method to reverse a sublist in Python; instead of using `nums[start], nums[end] = nums[end], nums[start]`, consider using slicing (`nums[start:end+1] = nums[start:end+1][::-1]`) or the built-in `reversed` function.</output>","def rotate_list(nums: list[int], k: int) -> list[int]:\n    """"""\n    Rotate the list 'nums' to the right by k steps, modifying\n    the list in place without creating a new list. \n    Return the rotated list.\n    """"""\n    if not nums:  # handle empty list\n        return nums\n\n    n = len(nums)\n    k %= n  # in case k > n\n\n    # In-place reversal algorithm\n    def reverse(start: int, end: int) -> None:\n        while start < end:\n            nums[start], nums[end] = nums[end], nums[start]\n            start += 1\n            end -= 1\n\n    # Step 1: reverse whole list\n    reverse(0, n - 1)\n    # Step 2: reverse first k elements\n    reverse(0, k - 1)\n    # Step 3: reverse remaining elements\n    reverse(k, n - 1)\n\n    return nums\n\n\n#testcases\n\nprint(rotate_list([1, 2, 3, 4, 5, 6], 2))  # [5, 6, 1, 2, 3, 4]\nprint(rotate_list([1, 2, 3], 0))           # [1, 2, 3]\nprint(rotate_list([1], 5))                 # [1]\n"
B25DS007_q9,0,8,0.00,"<output>Use the `insert` method to add elements from the end of the reversed sublist to the beginning of the original list, instead of using slicing and concatenation.</output>","def rotate_list(nums,k):\n    if not nums:\n        return nums:\n            \n    n=len(nums)\n    k=k%n\n    nums.reverse()\n    nums[:k]=reversed(nums[:k])\n    nums[k:]=reversed(nums[k:])\n    return nums"
B25ec025_q9 (5),0,8,0.00,"<output> You are likely using the wrong function name `custom_bool` instead of `rotate_list`, which is causing the runtime error.</output>","def custom_bool(value) -> bool:\n    if value is None:\n        return False\n   \n    if isinstance(value, (int, float, complex)) and value == 0:\n        return False\n    if hasattr(value, ""__len__"") and len(value) == 0:\n        return False\n    return True\n"
B25EC029.q9,0,8,0.00,"<output> The issue lies in using `remove()` and then concatenating a single element to the end of the list, which can lead to inefficient and incorrect results. Instead, consider using `insert()` to shift elements from the end towards the beginning. </output>","def rotate_list(nums,k):\n   l=len(nums)\n   for i in range(k):\n       m=nums[l-1]\n       nums.remove(m)\n       nums=[m]+nums\n   return nums\n       \n       \nprint(rotate_list([1,2,3,4,5,6],2))\nprint(rotate_list([1,2,3,],0))\nprint(rotate_list([1],5))\n   "
B25EC030_q9,0,8,0.00,"<output> The issue lies in modifying the original list `n` instead of the variable `nums`, which should be used to store the result. </output>","def rotate_list(n, k):\n  \n  n = len(n)\n  \n  \n  if n == 0 or k % n == 0:\n    return n\n    \n  \n  k = k % n\n\n \n  def reverse(start, end):\n    while start < end:\n     \n      n[start], n[end] = n[end], n[start]\n      start += 1\n      end -= 1\n \n\n  \n  reverse(0, n - 1)\n  \n  \n  reverse(0, k - 1)\n  \n  \n  reverse(k, n - 1)\n  \n  return n"
B25MT016_q9,0,8,0.00,"<output>Verify that you are using the correct Python module for list data types, as 'List' is not a built-in type. Instead, use 'list' or import it from 'typing'.</output>","def rotate_list(nums: List[int], k: int) -> List[int]:\n    """"""\n    Rotate the list to the right by k steps.\n    Example: rotate_list([1,2,3,4], 2) → [3,4,1,2]\n    """"""\n    n = len(nums)\n    if n == 0:\n        return nums\n    k %= n\n\n    # Reverse sections of the list (no new list needed)\n    def reverse(a, start, end):\n        while start < end:\n            a[start], a[end] = a[end], a[start]\n            start += 1\n            end -= 1\n\n    reverse(nums, 0, n - 1)\n    reverse(nums, 0, k - 1)\n    reverse(nums, k, n - 1)\n    return nums"
B25EE031_q9,0,8,0.00,"<output> The issue lies in your line `nums[i + k - len(nums)] = copy[i]`, where you're trying to access an index that's out of range when `i` is close to the end of the list. Instead, use `nums[(i - k) % len(nums)] = copy[i]` to wrap around the indices. </output>","def rotate_list(nums, k):\n    nums=list(nums)\n    copy=nums[:]\n    for i in range(0,len(nums)):\n        if (len(nums)-k)<=i:\n            nums[i+k-len(nums)]=copy[i]\n        else:\n            nums[i+k]=copy[i]\n            \n    return nums\nprint(rotate_list([1, 2, 3, 4, 5, 6], 2))\nprint(rotate_list([1, 2, 3], 0))\n# To be continued......\n\n        "
B25EE017_q9,0,8,0.00,"<output>Use `nums.pop()` and `nums.insert()` instead of `remove()` and `insert()`, as removing an element from the list while iterating over it can lead to unexpected behavior.</output>","""""""\n Rotate the list ’nums’ to the right by k steps, modifying\n the list in place\n without creating a new list. Return the rotated list.\n """"""\n\nnums=[1,2,3,4,5,6,7,8,9]\nk=int(input(""enter a number""))\ndef rotate_list(nums, k):\n    i=len(nums)-1\n    count=0\n    while count==k:\n        nums.remove(nums[i])\n        nums.insert(0,nums[i])\n        i=i-1\n        count=count+1\n    print(nums)\n\n"
B25EC041_q9,7,8,87.50,"<output> Consider modifying your function to utilize list slicing instead of appending elements to a new list, as this approach can lead to inefficient memory usage and potential issues with the original list's integrity.</output>","def rotate_list(nums, k):\n    l=[]\n    if(k>len(nums)):\n        return nums\n    else:\n        for x in range(len(nums)-k,len(nums)):\n            l.append(nums[x])\n        for x in range(0,len(nums)-k):\n            l.append(nums[x])\n        return l"
B25CS009_q9,7,8,87.50,"<output> The issue lies in using `insert` and `pop` operations to rotate the list. Instead, consider using slicing to achieve the rotation, which is more efficient and less prone to errors.</output>","def rotate_list(nums, k):\n """"""\n Rotate the list ’nums’ to the right by k steps, modifying\n the list in place\n without creating a new list. Return the rotated list.\n """"""\n for i in range (1, k+1) :\n     nums.insert ( 0 , nums[-1])\n     nums.pop(-1)\n     \n return nums\n\n"
B25CS007_Q9,0,8,0.00,<output>Check that you're using indexing correctly when slicing the list `nums[k:]` and `nums[:k]`. Remember to handle negative values for `k` as well.</output>,"def rotate_list(nums, k):\n    \n    n = len(nums)\n    if n == 0:\n        return nums\n    k %= n\n    if k == 0:\n        return nums\n\n    def reverse(l, i, j):\n        while i < j:\n            l[i], l[j] = l[j], l[i]\n            i += 1\n            j -= 1\n\n    \n    reverse(nums, 0, n - 1)\n    \n    reverse(nums, 0, k - 1)\n    \n    reverse(nums, k, n - 1)\n    return nums\n\nprint(rotate_list([1,2,3,4,5,6],2[5,6,1,2,3,4]))\n\n"
B25EE037_q9,8,8,100.00,<output>Consider using list slicing to extract the rotated elements instead of creating new lists `a` and `b`. This will ensure that the original list is modified in place.</output>,"def rotate_list(nums, k):\n    l=len(nums)\n    a=nums[l-k:l]\n    b=nums[0:l-k]\n    D=a+b\n    return D\n"
B25EE034_q9,7,8,87.50,"<output> The issue lies in removing elements from the list while iterating over it, as this can lead to an ""IndexError: list index out of range"" error. Consider using a different approach that avoids modifying the list during iteration. </output>","def rotate_list(nums, k):\n    i = 0\n    while i<k:\n        x = nums[-1]\n        nums.remove(x)\n        nums.insert(0, x)\n        i+=1\n    return nums\n\nrotate_list([1, 2, 3, 4, 5, 6], 2)\nrotate_list([1, 2, 3], 0)\nrotate_list([1], 5)\n"
B25DS025_q9,7,8,87.50,<output> Check if you are using `pop(0)` instead of `nums.remove(nums[0])` when k is negative to avoid the ZeroDivisionError.</output>,"def rotate_list(nums, k):\n    """"""\n    Rotate the list ’nums’ to the right by k steps, modifying\n    the list in place\n    without creating a new list. Return the rotated list.\n    """"""\n    k = k % len(nums) # this is added for making code efficient so that computer will not update the list very large number of times if k is very large.\n    \n    if k>=0: # condition for positive and negative movement.\n        \n        for a in range(k): # for positive movement, it pops item from end and inserts at 0 index.\n            b=nums.pop()\n            nums.insert(0,b)\n    \n    else:\n        \n        for a in range(k,0): # for negative movement, pops first item and appends at last.\n            b=nums.pop(0)\n            nums.append(b)\n        \n    return nums # returns nums after rotating."
B25MM021_q9,8,8,100.00,<output>Consider using a more explicit approach to handle the circular shift by taking advantage of Python's slice notation and modular arithmetic.</output>,"#Rotate List\n\ndef rotate_list(nums, k):\n    n = len(nums)\n    if n==0:\n        return nums\n    \n    k = k%n\n    nums[:] = nums[-k:] + nums[:-k]\n    return nums\n    \n"
B25MT005_q9,7,8,87.50,"<output> Check if you're using `k % len(nums)` to handle cases where `k` is greater than the length of the list, as this can cause a ZeroDivisionError when calculating `nums[-k:]`. </output>","def rotate_list(nums, k):\n    """"""\n    Rotate the list ’nums’ to the right by k steps, modifying\n    the list in place\n    without creating a new list. Return the rotated list.\n    """"""\n    n = len(nums)  # Length of the given list\n    k %= n \n    if k == 0:\n        return nums  # No change in the order\n    nums[:] = nums[-k:] + nums[:-k]  # Order according to the k value by using slicing\n    return nums\n"
B25CS055_q9,7,8,87.50,<output> The issue lies in modifying the original list while iterating over it; you should create a temporary copy of the list before rotating it to avoid this problem.</output>,"def rotate_list(nums, k):\n    """"""\n    Rotate the list ’nums’ to the right by k steps, modifying\n    the list in place\n    without creating a new list. Return the rotated list.\n    """"""\n    for i in range(k):\n        a=nums.pop()\n        nums.insert(0,a)\n    return nums\n\n"
B25CS039_q9,7,8,87.50,"<output> The loop iterates over `k` times, but it should only iterate until `k % len(nums)` to handle cases where `k` is greater than the list length, and this could be causing an ""IndexError: list index out of range"" error. </output>","def rotate_list(nums, k):\n    '''for every step rotate the list store last element\n    in temporary variable and shift all values towards right\n    and place that value at index 0, repeat it for k times'''\n    for i in range(0,k):\n        t=nums[len(nums)-1]\n        for j in range(len(nums)-1,0,-1):\n            nums[j]=nums[j-1]\n        nums[0]=t\n    return nums"
B25EE021_q9,8,8,100.00,"<output> The issue lies in the line `return nums[-k:] + nums[:-k]`, where you're returning a new list instead of modifying the original list in place. You should use slicing to assign the rotated elements back to the original list. </output>","def rotate_list(nums, k):\n    L = []\n    """"""\n    Rotate the list ’nums’ to the right by k steps, modifying\n    the list in place\n    without creating a new list. Return the rotated list.\n    """"""\n    \n    n = len(nums)\n    if n == 0 :\n        return nums\n    k = k % n \n    return nums[-k : ]   +  nums[ : -k]\n    \n\n"
B25CS016_q9,7,8,87.50,"<output>Consider using a different approach to rotate the list in place, such as using a temporary list to store the first 'k' elements and then concatenating them with the rest of the list.</output>","def rotate_list(nums, k):\n    for i in range(k):\n        nums.insert(0,nums[-1])\n        nums.pop(-1)\n    return nums"
q9_B25ME046,0,8,0.00,<output> The issue lies in the way you're creating a new list and returning it instead of modifying the original list in place.</output>,"def rotate_list(numbers,p):\n    n=len(numbers)\n    if n>0:\n        p=p%n\n    else:\n        return numbers\n    list=numbers[-p:]+numbers[:-p]\n    return list\n\n\nprint(rotate_list([1, 2, 3, 4, 5, 6], 2)) # [5, 6, 1, 2, 3, 4]\nprint(rotate_list([1, 2, 3], 0)) # [1, 2, 3]\nprint(rotate_list([1], 5)) # [1]\n "
B25ME050_q9,0,8,0.00,<output> Check if you are using the correct indexing method when slicing the list. Consider using `nums[-(k % len(nums)):]` and `nums[:-(k % len(nums))]` instead of `nums[-k:]` and `nums[:-k]`. </output>,"def rotate_list(nums, k):\n    if nums == []:\n        return nums\n    n = len(nums)\n    k = k%n # if k > n then k%n is the net numbers sould be rotated\n    rotated = nums[-k:] + nums[:-k]\n    return rotated\nprint(rotate_list([1,2,3,4,5,6],2))\nprint(rotate_list([1,2,3],0))\nprint(rotate_list([1],5))"
