student_id,tests_passed,tests_total,score_percentage,semantic_summary,code_snippet
B25EC037_q9,7,8,87.50,"<output> The issue lies in your approach to appending and removing elements from the list, which is causing an index out of range error when you try to pop the last element after rotating. Consider using a different method like slicing or a temporary list to avoid this issue.</output>","def rotate_list(nums,k):\n    for i in range(k):\n        nums=[nums[len(nums)-1]]+nums\n        nums.pop(len(nums)-1)      # removes by index and not element.\n        \n    return nums\n"
B25EC036_q9,0,8,0.00,<output> Make sure to handle the case when you're inserting an element at index 0 by shifting all existing elements one position forward instead of directly inserting the last element.</output>,"def rotate_list(nums, k):\n    n = len(nums)\n    if n == 0:\n        return nums  \n    k = k % n\n    for i in range(k):\n        last = nums.pop()\n        nums.insert(0, last)\n    return nums\n\n\nprint(rotate_list([1, 2, 3, 4, 5, 6], 2))  \nprint(rotate_list([1, 2, 3], 0))  \nprint(rotate_list([1], 5))  \nprint(rotate_list([], 3))  \n"
B25EE022_q9,0,8,0.00,"<output> The issue lies in the line `num.append(nums[i - k])`, which assumes that the list is 0-indexed, but the problem description states that rotating by zero steps leaves the list unchanged, implying that the list should be 1-indexed. </output>","def rotate_list(nums, k):\n    num = []\n    for i in range(0,len(nums)):\n        if len(nums) >= k:\n            num.append(nums[i-k])\n        elif k >= len(nums):\n            k=k%len(nums)\n            num.append(nums[i-k])\n    return num\nprint(rotate_list([1,2,3,4,5,6],2))\nprint(rotate_list([1],5))\nprint(rotate_list([1,2,3],0))"
B25EE007_q9,1,8,12.50,<output> The issue lies in the way you're updating the `start` variable within the inner loop; it should be a separate variable to avoid overwriting the previous value. Change `start = start + 1` to `start += 1`. </output>,"def rotate_list(nums, k):\n    n = len(nums)\n    k %= n    \n    def r(st, end):\n        while ( st < end):\n            nums[st], nums[end] = nums[end], nums[st]\n            start = start+1\n            end = end-1\n\n    r(0, n - 1)       \n    r(0, k - 1)       \n    r(k, n - 1)    \n    return nums"
B25EC022_q9,0,8,0.00,<output>Consider using list slicing instead of reversing and reassigning to modify the original list in place.</output>,"#########################################################################################\n#KOYYA SUMANTH BABU\n#B25EC022\n#ELECTRONICS AND COMMUNICATION ENGINEERING\n#INDIAN INSTITUTE OF TECHNOLOGY BHILAI\n########################################################################################\n\ndef rotate_list(nums, k):\n    n = len(nums)\n    if n == 0:\n        return nums\n    k = k % n  \n    nums.reverse()\n    nums[:k] = reversed(nums[:k])\n    nums[k:] = reversed(nums[k:])\n    return nums\nprint(rotate_list([1, 2, 3, 4, 5, 6], 2)) \n"
B25EC045_q9,0,8,0.00,<output>Consider using a more efficient approach by utilizing Python's list slicing feature to rotate the list in place.</output>,"def rotate_list(nums,k):\n    l = len(nums)\n    new_list = []\n    for i in range(l):\n        new_list.append(nums[(i-k)%l]) #Rotating list by using negative index\n    return new_list\nprint(rotate_list([1, 2, 3, 4, 5, 6], 2))\nprint(rotate_list([1, 2, 3], 0))\nprint(rotate_list([1], 5))"
B25DS026.q9,0,8,0.00,"<output>Check that the function name `rotate_list` matches the problem statement, as it appears to be a different module (`B25DS026`) is being imported.</output>","def rotate_list(nums, k):\n    n = len(nums)\n    if n == 0:\n        return nums \n    k %= n  \n    def reverse(start, end):\n        while start < end:\n            nums[start], nums[end] = nums[end], nums[start]\n            start += 1\n            end -= 1\n    reverse(0, n - 1)\n    reverse(0, k - 1)\n    reverse(k, n - 1)\n    return nums\nprint(rotate_list([1, 2, 3, 4, 5, 6], 2))  \nprint(rotate_list([1, 2, 3], 0))           \nprint(rotate_list([1], 5))                 \n                "
B25DS003_q9,7,8,87.50,"<output> The issue lies in removing elements from the list while iterating over it, which causes an IndexError because the index of the removed element becomes invalid. </output>","def rotate_list(nums, k):\n    x = len(nums)\n    for i in range(k): # removes last element of list and adds it to first one\n        a=nums[-1]\n        nums.remove(a)\n        nums.insert(0,a)\n    return nums\n"
B25ME047_Q9,0,8,0.00,"<output>Verify that the function `rotate` takes a list `a` as its first argument, not a variable `a`. In Python, variables are passed by object reference, so when you pass `a`, it's actually passing the entire list, including any local modifications made to it. This can lead to unexpected behavior and type mismatches.</output>","def rotate(a, k):\n    l = len(a)\n    if l == 0:\n        return a\n\n    k = k % l\n    if k == 0:\n        return a\n    \n    for _ in range(k):\n        t = a[l - 1]\n        for i in range(l - 1, 0, -1):\n            a[i] = a[i - 1]\n        a[0] = t\n        \n    return a"
B25EE038.Q9,0,8,0.00,<output>Use `M % l` instead of just `M` to ensure that the rotation wraps around correctly when `k` is greater than the length of the list.</output>,"def rotate_list(lst,M):\n    """"""\n       Rotate the list ’nums’ to the right by k steps, modifying the lis\nwithout creating a new list. Return the rotated list.\n                                                     """"""\n    l = len(lst)\n    lst[0:l] = lst[0:l][::-1]\n    lst[0:M] = lst[0:M][::-1]\n    lst[M:l] = lst[M:l][::-1]\n    return lst\nprint(rotate_list([1,2,3,4,5,6],2))\nprint(rotate_list([1,2,3],0))\nprint(rotate_list([1],5))"
B25MT030_q9 (1),0,8,0.00,"<output>Consider using list slicing to rotate the list, as it is more efficient and Pythonic than manual indexing.</output>","def rotate_list(nums, k):\n    num = []\n    for i in range(0,len(nums)):\n        if len(nums) >= k:\n            num.append(nums[i-k])\n        elif k >= len(nums):\n            k=k%len(nums)\n            num.append(nums[i-k])\n    return num\nprint(rotate_list([1,2,3,4,5,6],2))\nprint(rotate_list([1,2],5))\nprint(rotate_list([1,2,3],0))"
B25MT020_Q9,0,8,0.00,"<output> The issue lies in using `reversed()` to slice the list, which creates a new reversed iterator and assigns it back into the original list. Instead, you should use slicing with a step of `-1` to achieve the same effect without creating a new iterator. </output>","def rotate_list(nums, k):\n    """"""\n    Rotate the list 'nums' to the right by k steps, modifying\n    the list in place without creating a new list.\n    Return the rotated list.\n    """"""\n    n = len(nums)\n    if n == 0:\n        return nums\n\n    k = k % n  # Normalize k if it's larger than list length\n\n    # Reverse the entire list\n    nums.reverse()\n\n    # Reverse the first k elements\n    nums[:k] = reversed(nums[:k])\n\n    # Reverse the remaining elements\n    nums[k:] = reversed(nums[k:])\n\n    return nums\nprint(rotate_list([1, 2, 3, 4, 5, 6], 2)) "
B25MM004_q9,8,8,100.00,"<output> Check if you are correctly using the `pop` and `insert` methods to manipulate the list in place. Instead of popping from the end and inserting at the beginning, try using slicing to rotate the list.</output>","def rotate_list(nums, k):\n    n = len(nums)\n    if n == 0:\n        return nums\n\n    k = k % n\n    for i in range(k):\n        last = nums.pop()      \n        nums.insert(0,last)   \n    return nums\n\n\n\n"
B25DS011_q9,0,8,0.00,<output>Consider using slicing to extract a subset of elements from the original list and then concatenating it with the remaining elements in reverse order.</output>,"def rotate_list(nums, k):\n    l = len(nums)\n\n    for i in range(l):\n        return nums[l-k+i : l] #+ nums[i :l-k]\n\nprint(rotate_list([1, 2, 3, 4, 5, 6], 2))\nprint(rotate_list([1, 2, 3], 0))\nprint(rotate_list([1], 5))"
B25DS034_q9,0,8,0.00,<output>Check if you're using `append` to add elements to the end of the list and `del` to remove elements from the beginning; consider using `insert` instead.</output>,"\ndef rotate_list(nums, k):\n\n    if k ==0 :\n        return nums\n    \n    if k > len(nums):\n        return nums\n    \n    for j in range(0,len(nums) - k):\n        nums.append(nums[0])\n        del nums[0]\n        \n    return nums\n    \n        \n# Test Cases:\nprint(rotate_list([1, 2, 3, 4, 5, 6], 2)) # [5, 6, 1, 2, 3, 4]\nprint(rotate_list([1, 2, 3], 0)) # [1, 2, 3]\nprint(rotate_list([1], 5)) # [1]\n\n\n\n\n"
B25EC043_q9,0,8,0.00,"<output> The issue lies in removing elements from the list while iterating over it, causing the list to become empty and resulting in an IndexError when trying to pop an element. Instead, consider using a separate data structure or approach that doesn't involve modifying the list during iteration.</output>","def rotate_list(nums, k):\n    for i in range (k):\n        element=nums.pop()\n        nums.insert(0,element)\n    return nums\nprint(rotate_list([1,2,3,4,5,6],2))\n\n"
B25ec025_q9 (3),0,8,0.00,"<output>The function `sort_digits` is not related to rotating a list, it seems to be intended for sorting digits of an integer.</output>","def sort_digits(n: int) -> int:\n    return int("""".join(sorted(str(n))))\n#n=int(input(""enter a number""))\nprint(sort_digits(n))"
B25EE025_q9,0,8,0.00,"<output> The issue lies in the line `return nums[-k:] + nums[:-k]`, where you're using negative indexing to access elements from the end of the list. However, when rotating a list to the right by k steps, you should be adding elements from the beginning of the list to the end, not the other way around. </output>","def rotate_list(nums, k):\n	if not nums:\n		return nums\n	k %= len( nums)\n	return nums[-k:] + nums[:-k]\n	\n# test cases\nprint(rotate_list([1,2,3], 0))\nprint(rotate_list([1], 5))"
B25ec025_q9 (7),0,8,0.00,"<output> The issue lies in the `helper` function where you're trying to add integers and floats together, which is causing a type mismatch. You should only be adding numbers of the same data type. </output>","def smart_sum(*args):\n    total = 0\n    \n    def helper(item):\n        nonlocal total\n        if isinstance(item, (int, float)):\n            total += item\n        elif isinstance(item, (list, tuple)):\n            for sub in item:\n                helper(sub)\n        else:\n            raise TypeError(f""Unsupported type: {type(item)}"")\n    \n    for arg in args:\n        helper(arg)\n    \n    return total\n"
B25EE027_Q9,7,8,87.50,<output> Check if you are correctly using the `append` method to add elements to the original list instead of creating a new list with `nlist`. This will ensure that the modifications are made in place.</output>,"def rotate_list(nums, k):\n   """"""Rotate the list ’nums’ to the right by k steps, modifying\n   the list in place\n   without creating a new list. Return the rotated list.""""""\n   nlist=[]\n   if len(nums)>k:\n      for i in range(len(nums)-k,len(nums) ):\n         nlist.append(nums[i])\n      for j in range(len(nums)-k):\n         nlist.append(nums[j])\n      return nlist\n   else:\n      return nums\n# print(rotate_list([1,2,3],0))\n# print(rotate_list([1,2,3,4,5,6],2))\n# print(rotate_list([1],5))\n# print(rotate_list([1, 2, 3, 4, 5, 6], 2)) # [5, 6, 1, 2, 3, 4]\n# print(rotate_list([1, 2, 3], 0)) # [1, 2, 3]\n# print(rotate_list([1], 5)) # [1]"
B25MM009 Q9,0,8,0.00,"<output> The issue lies in using `list = nums[-k:] + nums[:-k]`, which creates a new list instead of modifying the original list in place. Consider using `nums[:]` to create a copy-free slice. </output>","def rotate_list(nums,k):\n    dis=len(nums)\n    k=k%dis\n    \n    list=nums[-k:]+nums[:-k]\n    return list\n\nprint(rotate_list([1, 2, 3, 4, 5, 6], 2)) # [5, 6, 1, 2, 3, 4]\nprint(rotate_list([1, 2, 3], 0)) # [1, 2, 3]\nprint(rotate_list([1], 5)) # [1]"
B25ME058_q9,7,8,87.50,"<output> The issue lies in the inner while loop where you're not handling the case when `nextindex` becomes equal to 0 after applying modulo. This causes a division by zero error because you're trying to swap `prev` with `nums[0]`, which is not allowed. </output>","def rotate_list(nums, k):\n    n = len(nums)\n    k%=n  # handle k >n. If k is larger than n, rotating by k is the same as rotating by k % n. if less, then k%n=k itself. \n    count = 0  # how many elements we have moved\n    start = 0  # start position for cycle\n    \n    while count<n:\n        current=start      \n#pick a starting index.\n        prev=nums[start]\n# store the value because it will be overwritten.\n        while True:\n            nextindex=(current+k)%n\n            nums[nextindex],prev=prev,nums[nextindex]\n            current=nextindex\n            count+=1\n            if start==current:\n                break\n        start+=1\n    \n    return nums\n\n""""""This function rotates a list of numbers to the right by k positions. \nEvery element moves k positions to the right, and those that\nexceed the list length circle back to the start."""""""
B25ec025_q9 (2),0,8,0.00,"<output>The variable 'x' is not defined in the function, suggesting that a parameter should be passed to this function instead of using a global variable.</output>","\n\ndef getCostOfCoffee(x:int,p:float) ->float:\n    \n    z=x//9   #free coffee cost #x=number of coffees,y=price per\n    y=x-z     # y is total coffee to pay\n    \n    \n    i=y*p\n    \n    return float(i)\n     \n     \nprint(""total cost:"",getCostOfCoffee(x,y))\n    \n\n\n    \n    "
B25MM025_q9,0,8,0.00,"<output> The issue lies in using `pop()` and `insert()` methods which are not suitable for modifying a list in-place. Instead, consider using slicing to achieve the rotation effect.</output>","k = int(input(""Enter number by which list should be rotated : ""))\nnums = eval(input(""Enter a list: ""))\ndef rotate_list(nums, k):\n    for i in range(-1,-k-1,-1):\n        a=nums.pop()\n        nums.insert(0,a)\n    print(""Rotated list is: "",nums)\n    \nrotate_list(nums,k)"
B25EE060_q9,7,8,87.50,"<output> The issue lies in the inner loop where you're iterating over the list from right to left, but you should be moving elements from the end towards the beginning of the list instead of shifting them from one position to another. </output>","def rotate_list(nums, k):\n    for i in range(0, k):\n        Last_element = nums[-1]\n        for j in range(len(nums) - 1, 0, -1):\n            nums[j] = nums[j - 1]\n        nums[0] = Last_element\n        i = i + 1\n    return nums"
B25ME060_q9,6,8,75.00,<output> Consider using slicing to rotate the list instead of manually iterating over it and appending elements to a new list. </output>,"def rotate_list(nums, k):\n    if k == 0:\n        return nums\n    if len(nums) == 1:\n        return nums\n    new_list = []\n    for i in range (len(nums)-k,len(nums)):\n        new_list.append(nums[i])\n    for j in range (0,len(nums)-k):\n        new_list.append(nums[j])\n    nums.clear()\n    nums.extend(new_list)\n    return nums\n\n"
B25MT019_q9,0,8,0.00,"<output>Check if you're using `nums[-k:]` and `nums[0:l - k] = ...`, which can be misleading due to Python's slice notation. Instead, consider using `nums[:]` for assignment and explicit indexing.</output>","#B25MT019_q9\ndef rotate_list(nums:list[int],k:int):\n    l=len(nums)\n    if k==0 or l==1 or l==0:# will print the same list \n        print(nums)\n    else:\n        nums[-k:],nums[0:l-k]=nums[0:l-k],nums[-k:]#used slicing took from -k to last and from start to l-k and replaced them \n        print(nums)\nrotate_list([1, 2, 3, 4, 5, 6], 2)\nrotate_list([1, 2, 3], 0)\nrotate_list([1], 5) "
B25CS062_q9,0,8,0.00,"<output>Consider using list slicing to achieve rotation, as it is more efficient and Pythonic than manually indexing into the list.</output>","def rotate_list(nums, k):\n    num = []\n    for i in range(0,len(nums)):\n        if len(nums) >= k:\n            num.append(nums[i-k])\n        elif k >= len(nums):\n            k=k%len(nums)\n            num.append(nums[i-k])\n    return num\nprint(rotate_list([1,2,3,4,5,6],2))\nprint(rotate_list([1],5))\nprint(rotate_list([1,2,3],0))"
B25ME007_q9,7,8,87.50,"<output> Check if `k` is zero before rotating, as this would cause a ZeroDivisionError when calculating `k % n`. </output>","def rotate_list(nums,k):\n    n=len(nums)\n    k%=n\n    def rotate(start,end):\n        while start<end:\n            nums[start],nums[end]=nums[end],nums[start]\n            start+=1\n            end-=1\n    rotate(0,n-1)\n    rotate(0,k-1)\n    rotate(k,n-1)\n    return nums\nrotate_list([1, 2, 3, 4, 5, 6], 2)\nrotate_list([1, 2, 3],0)\nrotate_list([1],5)"
B25CS014_q9,8,8,100.00,"<output>The issue lies in the repeated reversal of the entire list, which is unnecessary and can cause the original order to be lost.</output>","def rotate_list(nums, k):\n    """"""\n    Rotate the list 'nums' to the right by k steps, modifying\n    the list in place without creating a new list.\n    Return the rotated list.\n    """"""\n    n = len(nums)\n    if n == 0:\n        return nums\n    \n    k %= n  # handle k larger than list length\n\n    def reverse(start, end):\n        while start < end:\n            nums[start], nums[end] = nums[end], nums[start]\n            start += 1\n            end -= 1\n\n    # Step 1: reverse whole list\n    reverse(0, n - 1)\n    # Step 2: reverse first k elements\n    reverse(0, k - 1)\n    # Step 3: reverse remaining n-k elements\n    reverse(k, n - 1)\n\n    return nums"
B25EC032_ABHISHEK UJVAL_Q9,0,8,0.00,"<output>The issue lies in the removal and insertion of elements from the list, which can lead to an IndexError when trying to access the last element (index -1) after it's been removed. Consider using a different approach that avoids modifying the list while iterating over it.</output>","def rotate_list(nums,k):\n    """"""Rotate the list ’nums’ to the right by k steps, modifying the lis\n       without creating a new list. Return the rotated list.""""""\n    for i in range(k):\n        l=nums[-1]  #last item in the list\n        nums.remove(nums[-1])\n        nums.insert(0,l)  #insert at the beginning of the list\n    print(nums)\n    \n    \n    \nrotate_list([1,2,3,4,5,6],2)\nrotate_list([1,2,3],0)\nrotate_list([1],5)\nrotate_list([1,2,3,4,5,6,7,8,9],6)\nrotate_list([5,6,7,8,9,1,2,3,4],4)"
B25CS008_Q9,0,8,0.00,<output>The issue lies in the recursive call to `rotate_list_once(nums)` which does not exist in your code; you should instead be using list slicing to achieve the rotation.</output>,"def rotate_list_once(nums):\n    l = len(nums)-1\n    nums = nums[l:]+ nums[:l]\n    return nums\n\ndef rotate_list(nums,k):\n    while k != 0:\n        nums = rotate_list_once(nums)\n        k -= 1\n    print(nums)\n        \nrotate_list([1,2,3,4,5,6],2)\nrotate_list([1,2,3],0)\nrotate_list([1],5)"
B25CS047_q9,0,8,0.00,"<output> Check if `k` is zero before performing any operations, as it would cause a ZeroDivisionError when calculating `nums[i - k]`. </output>","def rotate_list(nums,k):\n    n = len(nums)\n    k = k % n \n    if k == 0:\n        return nums\n    temp = nums[-k:]\n    for i in range(n - 1, k - 1, -1):\n        nums[i] = nums[i - k]\n    for i in range(k):\n        nums[i] = temp[i]\n    return nums\nprint(rotate_list([1,2,3,4,5,6],2))"
B25MT017_q9,4,8,50.00,<output>Replace `last = nums.pop()` with `last = nums[-1]` to correctly access the last element of the list.</output>,"def rotate_list(nums, k):\n    if not nums:\n        return nums\n    n = len(nums)\n    e_k = k % n\n    \n    for _ in range (e_k):\n        last = nums.pop()\n        nums.insert(0, last_element)\n        \n    return nums"
B25ME013_q9,0,8,0.00,"<output>Instead of using `nums.insert(0, nums[l - 1])` and `nums.pop(l)`, consider using `nums.append(nums.pop())` to maintain the list's original order while rotating it in place.</output>","def rotate_list(nums, k):\n    """"""\n    Rotate the list ’nums’ to the right by k steps, modifying the\n    list without creating a new list. Return the rotated list.\n    """"""\n    l=len(nums)\n    if(l==0):\n        return nums\n    elif(k==0):\n        return nums\n    else:\n        while(k>l): #List matches original list for every l(length) rotations, thus subtract the rotations \n            k=k-l\n        c=k\n        while (c>0): #Until k items have been rotated\n            nums.insert(0,nums[l-1])#Insert the last item at the front\n            nums.pop(l)#Remove second last item which became last after previous step\n            c=c-1\n        return nums\n\nprint(rotate_list([1, 2, 3, 4, 5, 6], 2))\nprint(rotate_list([1, 2, 3], 0))\nprint(rotate_list([1], 5))\n        \n"
B25DS020_Q9,0,8,0.00,"<output> The issue lies in the way you're appending and removing elements from the list, which is causing duplicates to be added to the end of the list. Instead, consider using the `insert` method to shift elements to the right. </output>","def rotate_list(n,k):\n   for i in n[:len(n)-k]:#i use logic of append and remove to the list \n       \n       n.append(i)#append last of the list\n       n.remove(i)#remove start of the list\n   return(n)\nprint(rotate_list([1,2,3,4,5],2))"
B25CS011_q9,4,8,50.00,<output>Check if you are correctly using the `append` method to add elements to the end of the list instead of inserting them at a specific index.</output>,"def rotate_list(nums, k):\n    """"""first i added zero where\n       rotated numbers had to come\n       replaced this zeroes with the rotated\n       numbers and then removed the duplicates\n       created in process""""""\n    i = 1\n    nums = nums[::-1]\n    nums = nums + [0]*k\n    nums = nums[::-1]\n    while i <= k:\n        nums[i-1] = nums[-i]\n        i+=1\n    for j in range(1,k+1):\n        nums.pop(-1)\n    return nums\n\n        \n        \n        \n        "
B25EE058_q9,4,8,50.00,"<output> Make sure to use `nums[:]` instead of `temp` when assigning back to `nums`, as you're modifying the original list in place. This is because `temp` is a reference to a new list, and simply reassigning it doesn't update the original list. </output>","def rotate_list(nums, k):\n    if k >= len(nums) or k==0:\n        return nums\n    else:\n        temp=[]\n        for i in range(k,len(nums)):\n            temp.append(nums[i])\n        for i in range(k):\n            temp.append(nums[i])\n        nums=temp\n        return nums\nA=rotate_list([1, 2, 3, 4, 5, 6], 2)\nB=rotate_list([1, 2, 3], 0)\nC=rotate_list([1], 5)"
B25EE050_q9,6,8,75.00,"<output>Consider using a different approach to reverse the list, such as slicing and concatenation, to avoid modifying the original list's indices.</output>","def rotate_list(nums, k):\n    n = len(nums)\n    if n == 0:\n        return nums\n    def reverse_list(start, end):\n        while start < end:\n            nums[start], nums[end] = nums[end], nums[start]\n            start += 1 ; end -= 1\n\n    reverse_list(0, n - 1)\n    reverse_list(0, k - 1)\n    reverse_list(k, n - 1)\n    return nums\n"
B25ME004_Q9.py,0,8,0.00,"<output> Make sure to handle the case when k is greater than the length of nums by using k % len(nums) instead of just k, as this will ensure that the rotation wraps around appropriately.</output>","def rotate_list(nums, k):\n    n = len(nums)\n    if n == 0:\n        return nums\n    k = k % n\n    nums[:] = nums[-k:] + nums[:-k]   # modifies in place\n    return nums\nprint(rotate_list([1,2,3,4,5,6],2))\nprint(rotate_list([1,2,3],0))\nprint(rotate_list([1],5))"
B25EE055_q9,7,8,87.50,"<output> The issue lies in the line `nums.pop(l)`, which attempts to remove an element at index equal to the length of the list, causing the ""index out of range"" error. Instead, use `nums.pop()` without specifying an index. </output>","def rotate_list(nums,k):\n    nums:list[int]\n    l=len(nums)\n    for i in range(0,k):\n        nums.insert(0,nums[-1])\n        nums.pop(l)\n    return nums\n    "
B25CS056_q9,4,8,50.00,<output>Consider using a different approach to remove elements from the beginning of the list instead of appending them to a new list and then concatenating it with the original list.</output>,"def rotate_list(nums, k):\n    """"""\n    Rotate the list ’nums’ to the right by k steps, modifying\n    the list in place\n    without creating a new list. Return the rotated list.\n    """"""\n    \n    if k > len(nums):\n        return nums\n    else:\n        add = []\n        for i in range(k):                          #Removes k items from begining and \n            add.append(nums.pop(0))                 #appended at the end.\n        return nums+add\n\n# print(rotate_list([1, 2, 3, 4, 5, 6],2))\n# print(rotate_list([1, 2, 3],0))\n# print(rotate_list([1],5))"
"B25ME022_q9(PS5,6)",0,8,0.00,"<output>Consider using list slicing instead of nested loops to achieve rotation, which can simplify and optimize your code.</output>","def rotate_list(nums, k):\n\n    n = len(nums)\n    if n == 0:\n        return nums\n\n    k = k % n\n    if k == 0:\n        return nums\n\n    for x in range(k):\n        last = nums[-1]\n        for i in range(n - 1, 0, -1):\n            nums[i] = nums[i - 1]\n        nums[0] = last\n\n    return nums\n\n\n\nprint(rotate_list([1, 2, 3, 4, 5, 6], 2))  # [5, 6, 1, 2, 3, 4]\nprint(rotate_list([1, 2, 3], 0))           # [1, 2, 3]\nprint(rotate_list([1], 5))                 # [1]"
B25EE004_q9,7,8,87.50,<output> Make sure to handle the case when popping an element from an empty list by checking if `nums` is not empty before calling `pop()`. </output>,"def rotate_list(nums,k):\n    l=len(nums)\n    for i in range(k):\n        a=nums.pop(l-1)\n        nums.insert(0,a)\n    return nums\n\n        \n"
