student_id,tests_passed,tests_total,score_percentage,semantic_summary,code_snippet
q9(B25MM016),0,8,0.00,<output> Make sure to correctly split the list into two parts using slicing (`n[-p:]` and `n[:-p]`) instead of indexing (`n[p:]` and `n[:p]`). The current implementation will result in incorrect rotation. </output>,"def rotate_list(n,p):\n    k=len(n)\n    if k>0:\n        p=p%k\n    else:\n        return n\n    list=n[-p:]+n[:-p]\n    return list\n\n\nprint(rotate_list([1, 2, 3, 4, 5, 6], 2)) # [5, 6, 1, 2, 3, 4]\nprint(rotate_list([1, 2, 3], 0)) # [1, 2, 3]\nprint(rotate_list([1], 5)) # [1]"
B25MM002 q9,8,8,100.00,"</output>  The issue lies in the last line of code where `reverse(nums, k, n - 1)` is called. This step reverses the entire list again, effectively undoing the previous two reversal steps, resulting in the original list being restored instead of rotating it to the right by k steps.","def rotate_list(nums, k):\n    """"""\n    Rotate list nums to right by k steps in-place.\n    """"""\n    n = len(nums)\n    if n == 0:\n        return nums\n    k = k % n\n\n    def reverse(sublist, start, end):\n        while start < end:\n            sublist[start], sublist[end] = sublist[end], sublist[start]\n            start += 1\n            end -= 1\n\n    reverse(nums, 0, n - 1)\n    reverse(nums, 0, k - 1)\n    reverse(nums, k, n - 1)\n    return nums\n"
B25MM006_q9,7,8,87.50,"<output> Make sure to pop from the end of the list (`nums.pop(-1)`) instead of from the beginning (`nums.pop(len(nums) - 1)`), as you're trying to rotate it to the right. </output>","def rotate_list(nums, k):\n    for j in range(k):\n        a=nums.pop(len(nums)-1)\n        nums.insert(0,a)\n    return nums"
B25ME018_q9,7,8,87.50,"<output> The issue lies in using `nums.pop(-1)` and `nums.insert(0, a)`, which removes the last element from the list and adds it to the beginning. This approach is incorrect because it doesn't handle the case where you're rotating by more than one step. Instead, use two pointers to track the current position and the new tail of the list. </output>","def rotate_list(nums, k):\n    """"""\n    Rotate the list ’nums’ to the right by k steps, modifying\n    the list in place\n    without creating a new list. Return the rotated list.\n    """"""\n    for i in range(k):\n         a=nums.pop(-1)\n         nums.insert(0,a)\n    return nums"
B25MM008_q9,0,8,0.00,"<output> The issue lies in handling cases where k equals 0, as it will result in a ZeroDivisionError when calculating k % n. Consider adding a special case to handle this scenario explicitly.</output>","def rotate_list(nums, k):\n    n = len(nums)\n    k %= n\n    return nums[-k:] + nums[:-k]\n\n#test cases\nprint (rotate_list([1, 2, 3, 4, 5, 6], 2))\nprint (rotate_list([1, 2, 3], 0))\nprint (rotate_list([1], 5))"
B25ME008_Q9,7,8,87.50,"<output> Make sure to use the `append` method instead of `remove` and `insert`, as removing an element from a list can lead to shifting indices, causing the `IndexError`. </output>","def rotate_list(nums, k):\n    i = 0\n    while i<k:\n        x = nums[-1]\n        nums.remove(x)\n        nums.insert(0, x)\n        i+=1\n    return nums\n\nrotate_list([1, 2, 3, 4, 5, 6], 2)\nrotate_list([1, 2, 3], 0)\nrotate_list([1], 5)"
B25DS004_q9,7,8,87.50,"<output> The issue lies in removing elements from the end of the list using `nums.pop(len(nums) - 1)` which causes an empty list to be left after removal, leading to the subsequent `IndexError` when trying to pop from it. </output>","def rotate_list(nums, k):\n    for r in range(0,k):\n        m = nums.pop(len(nums) - 1)\n        nums.insert(0, m)\n    return(nums)\n\n""""""\ni took the number that was at the end of the list\nand put it in the begining of the list\ni did this in for loop for k number of times\nso the list was rotated.\n"""""""
B25ME041_q9,8,8,100.00,"<output> The issue lies in the line `nums[i] = nums[i - 1]`, which shifts elements from the end of the list to the beginning, effectively reversing the entire list. Instead, you should shift elements from the beginning to the end. </output>","def rotate_list(nums, k):\n    n = len(nums)\n    if n == 0 or k==0:        \n        return nums\n    k = k % n        \n    for _ in range(k):\n        last = nums[-1]       \n        for i in range(n - 1, 0, -1):\n            nums[i] = nums[i - 1]\n        nums[0] = last        \n    return nums\n"
B25ME012_q9,0,8,0.00,"<output> The issue lies in removing elements from the list while iterating over it; this causes the list to become empty, leading to an IndexError when trying to pop from an empty list. Instead, consider using a different approach that avoids modifying the list during iteration. </output>","def rotate_list(nums, k):\n    l=len(nums)\n    for i in range(k): #will keep rotating the numbers k times\n        lastchar=nums.pop() #removing the last character everytime and inserting it ahead in list\n        nums.insert(0,lastchar)\n    \n    return nums\n\nprint(rotate_list([1,2,3,4,5,6],2))\nprint(rotate_list([1,2,3],0))\nprint(rotate_list([1],5))"
B25EE023_q9,8,8,100.00,"<output> The function should be modifying the original list in place by using a two-pointer approach to shift elements from the beginning to the end and then placing them at the end, rather than simply concatenating and returning new lists. </output>","def rotate_list(nums, k):\n    n = len(nums)\n    if n == 0:\n        return nums\n    k = k % n\n    return nums[-k:] + nums[:-k]\n\n\n                 \n"
B25ME002_q9,7,8,87.50,"<output>Instead of using a nested loop to swap elements from both ends, consider using Python's built-in `append` method to build the rotated list in reverse order and then extend it to the original length.</output>","def rotate_list(nums,k):\n    a=len(nums)\n    if(a==0):\n        return k\n    else:\n        for i in range(k):\n            for j in range(a-1,0,-1):\n                temp=nums[j]\n                nums[j]=nums[j-1]\n                nums[j-1]=temp\n        return nums   \n"
B25ME035_q9,0,8,0.00,"<output>Consider using a different approach to rotate the list in place, such as using two pointers to swap elements from both ends towards the center.</output>","def rotate_list(nums,k):\n    n=len(nums)\n    if n==0:\n        return nums\n    k=k%n\n    def reverse(lst,left,right):\n        while left<right:\n            lst[left],lst[right]=lst[right],lst[left]\n            left=left+1\n            right=right-1\n    reverse(nums,0,n-1)\n    reverse(nums,0,k-1)\n    reverse(nums,k,n-1)\n    return nums\nprint(rotate_list([1,2],5))"
B25CS004_q9,7,8,87.50,<output>Consider using list slicing and concatenation to efficiently rotate the list instead of appending elements to a new list.</output>,"def rotate_list(nums, k):\n    l=len(nums)\n    if(k<=l):\n        list=[]\n        for i in range(l-k,l):\n            list.append(nums[i])\n        for i in range(0,l-k):\n            list.append(nums[i])\n        return list\n    else:\n        return nums"
b25cs005_q9,0,8,0.00,"<output>Use `int(input(""enter sequence: ""))` instead of `list(input(""enter sequence: ""))` to convert the input into a list of integers.</output>","a=list(input(""enter sequence: ""))\nk = int(input(""enter rotations: ""))\nb=len(a)\nif k<b: \n    for i in range(k,b):\n        print(a[i], end=(""""))\n    for i in range(0,k):\n        print(a[i],end=(""""))\nif k>=b: \n    k=k%b\n    for i in range(k,b):\n        print(a[i], end=(""""))\n    for i in range(0,k):\n        print(a[i],end=(""""))"
12240110_q9,0,8,0.00,N/A,No Code Found
B25EC008_ q9,7,8,87.50,"<output> You are trying to rotate the list by a certain number of steps, but you're not considering the case where `k` is 0. When `k` is 0, the function should return the original list without any modifications. </output>","def rotate_list(nums, k):\n    ## this function rotates the list to the right by k steps in place.\n    n = len(nums)\n    k = k % n\n\n    def reverse(start, end):\n        while start < end:\n            nums[start], nums[end] = nums[end], nums[start]\n            start += 1\n            end -= 1\n\n    reverse(0, n - 1)\n    reverse(0, k - 1)\n    reverse(k, n - 1)\n    \n    return nums\n\n\n\n\n\n\n\n"
B25EE035.Q9,0,8,0.00,"<output>Use a different approach to find the index `i` instead of using the `remove()` and `insert()` methods, which are not efficient for large lists.</output>"," """"""\n Rotate the list ’nums’ to the right by k steps, modifying\n the list in place\n without creating a new list. Return the rotated list.\n """"""\n\nnums=[1,2,3,4,5,6,7,8,9]\nk=int(input(""enter a number""))\ndef rotate_list(nums, k):\n    i=len(nums)-1\n    count=0\n    while count==k:\n        nums.remove(nums[i])\n        nums.insert(0,nums[i])\n        i=i-1\n        count=count+1\n    print(nums)\n\n\n \n\n\n "
B25CS051_q9,0,8,0.00,<output>Use `nums[:]` instead of `reversed(nums[:k])` and `nums[k:]` to avoid creating new lists.</output>,"def rotate_list(nums,k):\n    if not nums:\n        return nums:\n            \n    n=len(nums)\n    k=k%n\n    nums.reverse()\n    nums[:k]=reversed(nums[:k])\n    nums[k:]=reversed(nums[k:])\n    return nums"
B25CS054_q9,7,8,87.50,"<output> The issue lies in the way you're removing elements from the list using `nums.pop()`. This method modifies the original list and also returns the removed element. However, when you call it repeatedly without replacing the removed element with a new one, you end up modifying the list's indices, leading to an empty list being returned. </output>","def rotate_list(nums, k):\n\n    # loop will rum k times and rotate the nums list k times\n    for i in range (k):\n\n        x = nums.pop()  # removes the element at the end of the list and stores it in x\n\n        nums.insert(0,x)  # inserts the element at 0 th index (begining) \n\n    return nums\n\n\n\n"
B25DS015_q9,7,8,87.50,"<output> Make sure to handle the case where you're removing an element from the list and then trying to access its index after it's been removed. Instead of `nums.remove(s)` followed by `nums.insert(0, s)`, try using a different approach like shifting elements to the right without actually modifying the list until the end. </output>","def rotate_list(nums,k):\n    '''\n    Rotate the list ’nums’ to the right by k steps,\n    modifying the list without creating a new list.\n    Return the rotated list.\n    '''\n    p = len(nums)\n    for i in range(k):\n        s = nums[p-1]\n        nums.remove(s)\n        nums.insert(0,s)\n    return nums\n\n#Test Cases:\n#print(rotate_list([1,2,3,4,5,6],6))\n#print(rotate_list([1],5))\n#print(rotate_list([1,2,3],0))\n    \n        "
b25me036_q9,8,8,100.00,"<output> The issue lies in the way you're reversing the list segments. Currently, you're reversing the entire list twice, which cancels out the rotation effect. Instead, you should reverse only the last segment of the original list to achieve the desired rotation. </output>","def rotate_list(nums, k):\n    """"""\n    Rotate the list 'nums' to the right by k steps in place.\n    Return the rotated list.\n    """"""\n    n = len(nums)\n    if n == 0:\n        return nums\n\n    k = k % n\n\n    def reverse(sublist, start, end):\n        while start < end:\n            sublist[start], sublist[end] = sublist[end], sublist[start]\n            start += 1\n            end -= 1\n\n    reverse(nums, 0, n - 1)\n    reverse(nums, 0, k - 1)\n    reverse(nums, k, n - 1)\n\n    return nums\n"
B25ME032_q9,0,8,0.00,<output>It seems that you're trying to reverse parts of the list instead of rotating it. Consider using slicing and the `reverse` method correctly.</output>,"def reverse(num,start,num):\n    \n    while(start<end):\n        temp=num[start]\n        num[start]=num[end]\n        num[end]=temp\n        start+=1\n        end+=-1\n    return num\n        \n        \ndef rotate_list(nums,k):\n    n=len(nums)\n    reverse(0,n-k-1)\n    reverse(n-k-1,n-1)\n    reverse(0,n-1)\n    "
B24MT001_Q9,7,8,87.50,"<output> The issue lies in your approach where you create a new list `nlist` instead of modifying the original list in place. You should be using `nums.append(nums.pop())` to shift elements from the end to the beginning, effectively rotating the list. </output>","def rotate_list(nums, k):\n   """"""Rotate the list ’nums’ to the right by k steps, modifying\n   the list in place\n   without creating a new list. Return the rotated list.""""""\n   nlist=[]\n   if len(nums)>k:\n      for i in range(len(nums)-k,len(nums) ):\n         nlist.append(nums[i])\n      for j in range(len(nums)-k):\n         nlist.append(nums[j])\n      return nlist\n   else:\n      return nums\n# print(rotate_list([1,2,3],0))\n# print(rotate_list([1,2,3,4,5,6],2))\n# print(rotate_list([1],5))\n# print(rotate_list([1, 2, 3, 4, 5, 6], 2)) # [5, 6, 1, 2, 3, 4]\n# print(rotate_list([1, 2, 3], 0)) # [1, 2, 3]\n# print(rotate_list([1], 5)) # [1]"
B25CS020_q9,8,8,100.00,"<output> Make sure to handle the elements before and after the rotation boundary correctly by using `nums[k:]` instead of `nums[0:k]`, which would cause index out of range errors. </output>","def rotate_list(nums,k):\n    j = len(nums)\n    k = j-k\n    return nums[k:j] + nums[0:k]\n\n#here i am slicing the list according to the given number then adds the list \n        "
B25EE003.q9,0,8,0.00,"<output> Make sure to use `nums.append(m)` instead of `nums = [m] + nums`, as the latter creates a new list and doesn't modify the original list in place.</output>","def rotate_list(nums,k):\n   l=len(nums)\n   for i in range(k):\n       m=nums[l-1]\n       nums.remove(m)\n       nums=[m]+nums\n   return nums\n       \n       \nprint(rotate_list([1,2,3,4,5,6],2))\nprint(rotate_list([1,2,3,],0))\nprint(rotate_list([1],5))\n   "
B25EE019_q9,0,8,0.00,"<output> The issue lies in using `reversed` function directly on list elements (`nums[:k] = reversed(nums[:k])` and `nums[k:] = reversed(nums[k:])`). Instead, use slicing to extract the desired sublists. </output>","def rotate_list(nums,k):\n    if not nums:\n        return nums:\n            \n    n=len(nums)\n    k=k%n\n    nums.reverse()\n    nums[:k]=reversed(nums[:k])\n    nums[k:]=reversed(nums[k:])\n    return nums"
B25EC042_q9,0,8,0.00,"<output> The student's code is not correctly handling the case when `k` is greater than the length of the list, as it should wrap around to the beginning of the list instead of modifying the original list in place. </output>","def rotate_list(nums, k):\n    num = []\n    for i in range(0,len(nums)):\n        if len(nums) >= k:\n            num.append(nums[i-k])\n        elif k >= len(nums):\n            k=k%len(nums)\n            num.append(nums[i-k])\n    return num\nprint(rotate_list([1,2,3,4,5,6],2))\nprint(rotate_list([1],5))\nprint(rotate_list([1,2,3],0))"
B25DS028_q9,7,8,87.50,<output> The issue lies in the fact that you're removing elements from the list using `nums.pop()` and then inserting them at the beginning without checking if the list is empty first. This causes an IndexError when trying to pop from an empty list. </output>,"def rotate_list(nums, k):\n    """"""\n    Rotate the list ’nums’ to the right by k steps, modifying\n    the list in place\n    without creating a new list. Return the rotated list.\n    """"""\n    for i in range(k):\n        a=nums.pop()\n        nums.insert(0,a)\n    return nums"
B25DS014_q9,7,8,87.50,"<output> The issue lies in the fact that you're removing elements from the list using `pop(0)` which shifts all remaining elements to the beginning, effectively rotating the list. However, when you pop an element, it also removes it from the list, causing an error when trying to pop from an empty list. </output>","def rotate_list(nums, k):\n    for _ in range(k):\n        a=nums.pop()\n        nums.insert(0,a)\n    return nums"
B25ME014_q9.py,0,8,0.00,<output>Check if you are using `append` and `insert` correctly to rotate the list to the right by `k` steps.</output>,"def rotate_list(nums, k):\n    """"""\n    Rotate the list ’nums’ to the right by k steps, modifying\n    the list in place\n    without creating a new list. Return the rotated list.\n    """"""\n    k = k % len(nums)\n    if k == 0:\n        return nums #if k is 0 then rotation won't occur\n    elif k > 0:\n        for i in range(k):\n            j=nums.pop()\n            nums.insert(0,j)\n        return nums\n    else:\n        for i in range(k,0):\n            j=nums.pop(0) #performs rotation\n            nums.append(j)\n        return nums "
B25CS059_q9,7,8,87.50,"<output> Make sure to handle the case where `k` equals zero by not using `tmp`, as this will cause a ZeroDivisionError when trying to access `nums[i - k]`. </output>","def rotate_list(nums, k):\n    """"""\n    Rotate the list ’nums’ to the right by k steps, modifying\n    the list in place\n    without creating a new list. Return the rotated list.\n    """"""\n    k=k%len(nums)\n    tmp=nums[len(nums)-k:]\n    for i in range(-1,-(len(nums)-k+1),-1):\n        nums[i]=nums[i-k]\n    \n    for i in range(k):\n        nums[i]=tmp[i]\n\n    return nums\n"
B25DS035_q9,0,8,0.00,"<output>Consider using the `append` and `pop` methods instead of `insert` and `remove`, as they are more efficient and less prone to errors.</output>","def rotate_list(nums,k):\n    while(k>=len(nums)):\n        k=k-len(nums)\n    n=-k\n    for i in range(0,k):\n        m=nums[n]\n        nums.remove(m)\n        nums.insert(n+k,m)\n        n=n+1\n    return nums\nprint(rotate_list([1,2,3,4,5,6],2))\nprint(rotate_list([1,2,3],0))\nprint(rotate_list([1],5))            \n            "
S25MA001_q9,0,8,0.00,"<output>Make sure to handle the case when k is equal to n, as this would result in an empty list being returned, which might not be the intended behavior.</output>","def rotate_list(nums, k):\n    n = len(nums)\n    if n == 0: return nums\n    k %= n  # Handle k > n\n    nums[:] = nums[-k:] + nums[:-k]\n    return nums\n\n# Test cases\nprint(rotate_list([1, 2, 3, 4, 5, 6], 2))  # [5, 6, 1, 2, 3, 4]\nprint(rotate_list([1, 2, 3], 0))           # [1, 2, 3]\nprint(rotate_list([1], 5))                # [1]"
B25DS043_q9,0,8,0.00,"<output>Consider using a different approach to reverse the list, as your current implementation only reverses two parts of the list and does not correctly handle the rotation by k steps.</output>","def rotate_list(nums, k):\n    """"""\nRotate the list ’nums’ to the right by k steps, modifying\nthe list in place\nwithout creating a new list. Return the rotated list.\n""""""\n    n = len(nums)\n    if n == 0:\n        return nums\n\n    k = k % n                                 #rotating by length or more is handled\n    if k == 0:\n        return nums\n\n    def reverse_range(left, right):\n        while left < right:\n            nums[left], nums[right] = nums[right], nums[left]\n            left += 1\n            right -= 1\n\n    reverse_range(0, n - 1)       #Reverse the whole list.\n    reverse_range(0, k - 1)       #Reverse the first k elements.\n    reverse_range(k, n - 1)       #Reverse the remaining n - k elements\n    return nums\n\nprint(rotate_list([1, 2, 3, 4, 5, 6], 2)) # [5, 6, 1, 2, 3, 4]\nprint(rotate_list([1, 2, 3], 0)) # [1, 2, 3]\nprint(rotate_list([1], 5)) # [1]"
B25EE006 Q9,0,8,0.00,"<output> Check that you're not modifying the indices while reversing the list, causing an out-of-bounds error when `k` equals the length of the list. Instead, use a temporary variable to store the value at index `i - 1`, and then shift it to the beginning of the reversed part. </output>","def rotate_list(nums, k):\n    i =len(nums)\n    k=k%i #for cases in which k>nums\n#s=start\n#e=end\n    def reverse(s, e):\n        while s < e:#whole list is reversed\n            nums[e], nums[s]=nums[s], nums[e]\n            \n            s+=1\n            e-=1\n    reverse(0, i-1)#reverse complete list\n    reverse(0,k-1)#reverse first k numbers\n    reverse(k, i-1)#reverse remaining numbers\n    return nums\n    \nprint(rotate_list([1],5))"
B25EC035_q9,0,8,0.00,"<output> The issue lies in how you're building the rotated list. You're appending elements from the end of the original list (`nums[l - (2 - i)]`), but you should be prepending them instead. </output>","""""""\n Rotate the list ’nums’ to the right by k steps, modifying the list in place\n without creating a new list. Return the rotated list.\n """"""\n\ndef rotate_list(nums, k):\n    l = len(nums)\n    rlist = []\n    for i in range(k):  #rlist appen last k numbers\n        rlist.append(nums[l-(2-i)])\n    for j in range(l-k):\n        rlist.append(nums[j])\n    return rlist\n\nprint(rotate_list([1, 2, 3, 4, 5, 6], 2))"
B25DS027_q9,7,8,87.50,"<output> The issue lies in the line `reverse(nums, k, n - 1)`, where you're trying to reverse the list from index `k` to the end. However, after reversing the first `k` elements, you should be starting from the beginning of the list, not from index `k`. Change it to `reverse(nums, 0, k - 1)` to fix the zero division error.</output>","def rotate_list(nums, k):\n    n = len(nums)\n    k %= n \n    if n == 0:\n        return nums\n    def reverse(list1, go, end): \n        while go < end:\n            list1[go], list1[end] = list1[end], list1[go]\n            go += 1\n            end -= 1\n    \n    reverse(nums, 0, n - 1) # Reverse the list\n    reverse(nums, 0, k - 1) # Reverse first k numbers\n    reverse(nums, k, n - 1) # Reverse remaining numbers\n    return nums\n\n# rotate_list([1, 2, 3, 4, 5, 6], 2)  \n# rotate_list([1, 2, 3], 0)       \n# rotate_list([1], 5)               \n"
B25MT018_q9,7,8,87.50,<output> Check if you're using `insert` to add elements at the beginning of the list and then removing a slice from the end of the list. This approach can lead to incorrect results because it doesn't handle wrap-around correctly for larger values of `k`. Consider using `pop` and `append` instead. </output>,"def rotate_list(nums, k):\n    l=len(nums)\n    for i in range(k):            \n        nums.insert(0,nums[l-1])    #last element ko insert krta jagega first place pe\n        \n    del nums[l:l+k]                  #last wale fir extra ho jaenge usko delete kr dega\n    return nums\n\n\n        "
B25EC044_Q9,0,8,0.00,"<output>Consider using list slicing to achieve a more efficient rotation, as your current implementation involves creating a new list and modifying the original one.</output>","\n\n\ndef rotate_list(nums,k):\n    if k>len(nums) or k==0:\n        return nums\n    else:\n        L=nums\n        nums=[]\n        nums.extend(L[len(L)-k:len(L)]+L[0:len(L)-k])\n        return nums\n\n\nprint(rotate_list([1, 2, 3, 4, 5, 6], 2))\nprint(rotate_list([1, 2, 3], 0))\nprint(rotate_list([1], 5))\n                    \n"
B25MT031_q9,0,8,0.00,N/A,No Code Found
b25me039_q9,0,8,0.00,<output> Use `nums.remove()` instead of `nums.pop()` to avoid modifying the list while iterating over it.</output>,"def rotate_list(nums, k):\n    for i in range (k):\n\n        x = nums.pop()  \n\n        nums.insert(0,x)   \n\n    return nums"
B25MT011_q9,0,8,0.00,"<output> The issue lies in the line where you're removing and inserting elements from the list. You're removing the last element (`nums.pop(len(nums) - 1)`), which is correct, but then you're inserting it at the beginning of the list without checking if there are enough elements left to do so. This can lead to an IndexError when trying to insert an element into an empty list. </output>","def rotate_list(nums:list,k:int):\n    for i in range(0,k):\n        new=nums[len(nums)-1]\n        nums.pop(len(nums)-1)\n        nums.insert(0,new)\n    return nums\nprint(rotate_list([1,2,3,4,5,6],2))\nprint(rotate_list([1,2,3],0))\nprint(rotate_list([1],5))"
B25ec025_q9 (6),0,8,0.00,"<output>Check if you're calling a list method correctly, as `nums` appears to be a list but your code is treating it like a set.</output>","def largest_unique_subarray(nums):\n    seen = set()\n    left = 0\n    max_len = 0\n\n    for right in range(len(nums)):\n        while nums[right] in seen:\n            seen.remove(nums[left])\n            left += 1\n        seen.add(nums[right])\n        max_len = max(max_len, right - left + 1)\n\n    return max_len"
B25CS019_q9,0,8,0.00,"<output> Consider using list slicing to extract the last k elements and append them to the beginning of the list, rather than concatenating the two parts separately. This will ensure that the original order is preserved when rotating by a value greater than the length of the list.</output>","def rotate_list(nums, k):\n    \n    if k == 0 or k> len(nums) :\n         return nums\n    else :                             # taking last k number in list first and then add to list which has starting number to k number\n        nums = nums[-k:] + nums[:-k]  \n        return nums\n        \nprint(rotate_list([1,2,3,4,5,6], 2))\nprint(rotate_list([1,2,3], 0))\nprint(rotate_list([1], 5))\n\ndef rotate_list(nums, k):\n    if k == 0 or k> len(nums) :\n        return nums\n    else :\n        for i in range(0,k):\n            num_1 = nums.pop(-k +i)   # pop helps to take out particular index number from list \n            nums.insert(i,num_1)      # (insert) add the number at specified index in list\n            \n        return nums\n        \nprint(rotate_list([1,2,3,4,5,6], 2))\nprint(rotate_list([1,2,3], 0))\nprint(rotate_list([1], 5))\n\n        \n    "
