student_id,tests_passed,tests_total,score_percentage,semantic_summary,code_snippet
B25DS019_q9,7,8,87.50,<output> Check if you're returning an empty slice when `k` equals 0 by using a conditional statement to handle this case explicitly. </output>,"def rotate_list(nums,k):\n    k=k%len(nums)  \n    return nums[-k:]+nums[:-k]\n\n\n    "
B25ME009_q9,8,8,100.00,"<output>Consider a more efficient approach by utilizing Python's list slicing feature to achieve rotation, rather than manually shifting elements.</output>","def rotate_list(nums, t):\n    n = len(nums)            # finding how many items in list\n    if n == 0 or t == 0:  # If list empty or t is zero,  just give back list\n        return nums\n    t = t % n           # If t bigger than n, make it fit in list size\n    for i in range(t): \n        last = nums[-1]  \n        for j in range(n-1, 0, -1):  # move every item one step right\n            nums[j] = nums[j-1]\n        nums[0] = last         # put last item in front\n    return nums  \n"
B25CS037_q9,7,8,87.50,<output>Check if you're using `remove()` method which can potentially lead to a ZeroDivisionError when k % len(nums) equals 0.</output>,"def rotate_list(nums,k):\n    i = k%len(nums)\n    return nums[-i:] + nums[-len(nums):-i]\n"
B25DS029_q9,7,8,87.50,"<output> The issue lies in the line `nums[:] = nums[-k:] + nums[:-k]`, where you're trying to rotate the list by inserting elements at the beginning. However, when `k` is zero, this line attempts to insert an empty slice, which raises a ZeroDivisionError because you can't divide by zero. </output>","def rotate_list(nums, k):\n    """"""\n    Rotate the list ’nums’ to the right by k steps, modifying\n    the list in place\n    without creating a new list. Return the rotated list.\n    """"""\n    n = len(nums)\n    k %= n #to handle the cases where k>n\n    if k == 0:\n        return nums\n    nums[:] = nums[-k:] + nums[:-k] #starting the new list from the kth term from the end\n    return nums"
B25ME028_q9.py,0,8,0.00,"<output>It appears that your code is attempting to reverse the list, but it's not actually rotating it. Consider using a different approach, such as slicing the list into two parts and concatenating them in reverse order.</output>","def rotate_list(nums, k):\n    """"""\n    Rotate the list 'nums' to the right by k steps, modifying the list in place\n    without creating a new list. Return the rotated list.\n    """"""\n    n = len(nums)\n    if n == 0:\n        return nums\n    \n    k = k % n  # Handle cases where k > n\n    \n    # Helper function to reverse a portion of the list in place\n    def reverse(start, end):\n        while start < end:\n            nums[start], nums[end] = nums[end], nums[start]\n            start += 1\n            end -= 1\n\n    # Step 1: Reverse the entire list\n    reverse(0, n - 1)\n    # Step 2: Reverse the first k elements\n    reverse(0, k - 1)\n    # Step 3: Reverse the remaining elements\n    reverse(k, n - 1)\n\n    return nums\n\n\n# Test Cases\nprint(rotate_list([1, 2, 3, 4, 5, 6], 2))\nprint(rotate_list([1, 2, 3], 0))          \nprint(rotate_list([1], 5))                "
B25CS030_q9,8,8,100.00,"<output> Consider using a different approach to rotate the list in place by utilizing slicing and the `insert` method, as simply concatenating the last `k` elements with the rest of the list may not achieve the desired rotation effect.</output>","#Rotate List\n\ndef rotate_list(nums, k):\n    n = len(nums)\n    if n==0:\n        return nums\n    \n    k = k%n # if k > n then it will normalize k\n    nums[:] = nums[-k:] + nums[:-k]  #[-k:] denotes the last k elements & [:-k] denotes the elements before the last k\n    return nums\n    \n"
B25CS010_q9,7,8,87.50,"<output> The issue lies in inserting elements at the beginning of the list instead of shifting them to the end, which can lead to an IndexError when trying to access the last element. Consider using `nums.append(nums.pop())` or a similar approach to shift elements to the end. </output>","def rotate_list(nums, k):\n    """"""\n    Rotate the list 'nums' to the right by k steps, modifying\n    the list in place\n    without creating a new list. Return the rotated list.\n    """"""\n    for _ in range(k):\n        nums.insert(0, nums[-1])\n        nums.pop()\n\n    return nums\n"
B25EE001_q9,8,8,100.00,"<output>Consider using a more efficient approach, such as slicing and concatenating the list instead of shifting elements individually.</output>","def rotate_list(nums, k):\n\n    n = len(nums)  # no. of elements in the list\n    \n    if n == 0:\n        return nums  # If the list is empty, return it as is\n    \n    k = k % n  #  To make sure k is not larger than the list size\n    \n    for _ in range(k):\n        last_element = nums[-1]  # Take the last element\n        # Shift all elements one position to the right\n        for i in range(n - 1, 0, -1):\n            nums[i] = nums[i - 1]\n        nums[0] = last_element  # Put the last element at the start\n    \n    return nums\n"
B25EC002_q9,0,8,0.00,"<output> The issue lies in using `insert` to shift elements to the front of the list, which modifies the original list's indices and causes an ""IndexError: list index out of range"" when trying to access `nums[l - 1]`. </output>","def rotate_list(nums,k):\n    """"""\n    Rotate the list ’nums’ to the right by k steps, modifying\n    the list in place\n    without creating a new list. Return the rotated list.\n    """"""\n    l=len(nums)\n    for i in range(k):\n        nums.insert(0,nums[l-1])\n\n    del nums[l:l+k]\n    return nums\nprint(rotate_list([1,2,3,4,5,6],2))\n        "
B25EC031_q9,8,8,100.00,"<output> Check if you are correctly using the index to access and modify elements in the list. Instead of `nums[new_index] = temp_nums[i]`, consider using `temp_nums[i]` as the value to be placed at the new index, since this approach modifies the original list incorrectly. </output>","def rotate_list(nums, k):\n    """"""\n    Rotate the list ’nums’ to the right by k steps, modifying\n    the list in place by increasing the index of each element.\n    This approach manages the case where the index exceeds len(nums)-1.\n    """"""\n    if len(nums) == 0 or k == 0:\n        return nums \n\n    k = k % len(nums)\n\n    temp_nums = nums[:]\n\n    for i in range(len(nums)):\n        new_index = (i + k) % len(nums)\n        nums[new_index] = temp_nums[i]\n\n    return nums\n\n"
B25ME034_q9,8,8,100.00,"<output> The loop starts from `n - 1` and goes backwards, but it should start from the end of the list to rotate it to the right, instead of moving elements to their correct positions from the beginning. </output>","def rotate_list(nums, k):\n    \n    n = len(nums)\n\n    if n == 0 or k==0:        \n        return nums\n    k = k % n        \n    \n\n    \n    for _ in range(k):\n        last = nums[-1]       \n        for i in range(n - 1, 0, -1):\n            nums[i] = nums[i - 1]\n        nums[0] = last        \n\n    return nums\n"
B25ME043_q9,0,8,0.00,"<output> The issue lies in the line `reverse(k, n - 1)`, where you're trying to reverse the entire list again after reversing it k times. This is unnecessary and incorrect, as it's causing a division by zero error when calculating k % len(nums). Instead, focus on correctly implementing the rotation logic using slicing or other methods. </output>","def rotate_list(nums, k):\n    n = len(nums)\n    if k>n :\n      k%=n\n    def reverse(front, back):\n        while front < back:\n            nums[front], nums[back] = nums[back], nums[front]\n            front += 1\n            back -= 1   \n    reverse(0, n - 1)  #To reverse full list    \n    reverse(0, k - 1)  #To reverse the starting required elements among themselves    \n    reverse(k, n - 1)  #To reverse remaining elements among themselves   \n    return nums\nprint(rotate_list([1, 2, 3, 4, 5, 6], 2))\nprint(rotate_list([1, 2, 3], 0))  \nprint(rotate_list([1], 5))  "
B25EC013_q9,7,8,87.50,"<output> The issue lies in the way you're removing and inserting elements from the list. When you call `nums.pop(len(nums) - 1)`, it removes the last element but doesn't update the index of the remaining elements, leading to an ""index out of range"" error when trying to access the next element. </output>","def rotate_list(nums,k):\n    for i in range(k):\n        a= nums[len(nums)-1]\n        nums.pop(len(nums)-1)\n        nums.insert(0,a)\n    return nums"
B25ME049_q9,0,8,0.00,"<output> The issue lies in your approach where you're inserting elements at the beginning of the list and then removing them from a position that is decreasing by 1 with each iteration. Instead, consider using `nums[:] = nums[-k:] + nums[:-k]` to achieve the rotation in place. </output>","def rotate_list(nums, k):\n    nums = sorted(nums)\n    l = len(nums)\n    for i in range(k):\n        nums.insert(0, l)\n        b = l + i\n        nums.pop(b)\n        l = l - 1\n    print(nums)\n    return nums\n\nrotate_list([1, 2, 3, 4, 5, 6], 2)\nrotate_list([1, 2, 3], 0)\nrotate_list([1], 5)\n"
B25EE015_Q9,0,8,0.00,"<output> The issue lies in using `remove` and `insert` methods to manipulate the list, which can lead to unpredictable behavior when trying to rotate the list. Instead, consider using slicing to achieve the rotation effect without modifying the original list. </output>","""""""\n Rotate the list ’nums’ to the right by k steps, modifying\n the list in place\n without creating a new list. Return the rotated list.\n""""""\n\n\ndef rotate_list(nums, k):\n    i=len(nums)-1\n    count=0\n    while count==k:\n        nums.remove(nums[i])\n        nums.insert(0,nums[i])\n        i=i-1\n        count=count+1\n    return print(nums)\nprint(rotate_list([1, 2, 3, 4, 5, 6], 2))\nprint(rotate_list([1, 2, 3], 0)) \nprint(rotate_list([1], 5))\n"
B25ME003_q9,7,8,87.50,"<output> The issue lies in using `pop` to remove elements from the list while iterating over it; instead, consider using a temporary variable to store the popped element and then insert it at the beginning of the list. </output>","def rotate_list(nums,k):\n    for i in range(k):\n        n=nums.pop()\n        nums=[n]+nums\n    return nums\n\n        "
B25ME048_q9,0,8,0.00,"<output> The issue lies in using `pop(-1)` which removes and returns the last element from the list without modifying its index, causing an empty list when trying to pop from it. Instead, use `nums[-1]` to access the last element directly. </output>","def rotate_list(nums, k):\n    """"""\nRotate the list ’nums’ to the right by k steps, modifying\nthe list in place\nwithout creating a new list. Return the rotated list.\n    """"""\n    for i in range(k):\n        y=len(nums)\n        x=nums.pop(-1)\n        nums.insert(0,x)\n    \n    return nums\n\nnum=[1,2,3,4,5,6]\nl=2\nprint(rotate_list(num,l))"
B25EC021_q9,3,8,37.50,"<output> The issue lies in the line `lst.remove(lst[0])` where you're removing the first element from the list and then trying to access it as if it's still there with `k = lst[0]`. Instead, you should be using a temporary variable to store the value being removed. </output>","def rotate_list(lst , k):\n    for i in range(k):\n        k = lst[0]\n        lst.remove(lst[0])\n        lst.append(k)\n    return lst\n"
B25ME059_q9,7,8,87.50,<output> Reverse the list only once and then shift the elements to the right by using `nums[:] = nums[-k:] + nums[:-k]`. </output>,"def rotate_list(nums, k):\n    '''\n    first i reversed the list, then added the first k elements of the reversed list. then i again reversed the list and then removed the last k elements\n    '''\n    nums.reverse()\n    for i in range(k):\n        nums.append(nums[i])\n    nums.reverse()\n    x=len(nums)-1\n    for i in range(k):\n        nums.pop(x-i)\n    return nums"
B25DS013_Q9,0,8,0.00,"<output>Check if you are correctly removing elements from the original list `nums` and appending them to a new list `M`, instead of modifying the original list in place.</output>","def rotate_list(nums,k):\n    M=[]\n    for i in range (0,len(nums)):\n        if i+k>=len(nums):\n            M.append(nums[i])\n    for i in range (0,len(nums)):\n        if i+k<len(nums):\n            M.append(nums[i])                     \n    print(M)                 \nrotate_list([1,2,3,4,5,6],2)                  \nrotate_list([1,2,3],0)\nrotate_list([1],5)\n\n"
B25ME054_q9,0,8,0.00,"<output>Pass the length of the list as a separate argument to the function, replacing `n` with `len(nums)`.</output>","def rotate_list(nums, k):\n    if n < 2:\n        return nums\n    k = k % n\n    if k == 0:\n        return nums\n    def reverse(start, end):\n        while start < end:\n            nums[start], nums[end] = nums[end], nums[start]\n            start += 1\n            end -= 1\n    reverse(0, n - 1)\n    reverse(0, k - 1)\n    reverse(k, n - 1)\n    return nums\n"
B25EE029_q9,7,8,87.50,"<output> The issue lies in popping from an empty list when `k` equals the length of `nums`, as this results in trying to remove an element that doesn't exist. Consider using `k % len(nums)` to handle cases where `k` is greater than the list's length. </output>","def rotate_list(nums, k):\n    l=len(nums)\n    for i in range (k):\n        last = nums.pop(l-1)  # Remove the last element from the list\n        nums.insert(0,last)  # Insert the removed element at the beginning\n    return nums\n"
B25MM026_q9,7,8,87.50,"<output>When removing elements from the list using `nums.pop()`, be cautious not to leave an empty list, as this can lead to an `IndexError`. Consider using a temporary variable to store removed elements instead.</output>","def rotate_list(nums,k):\n    for i in range(k):\n        n=nums.pop()\n        nums=[n]+nums\n    return nums\n\n        "
B25EE026_Q9,7,8,87.50,"<output>Consider using list slicing to achieve rotation, as it is more efficient and Pythonic.</output>","#WAP to rotate list\ndef rotate_list(nums, k):\n    a=[]\n    n=len(nums)\n    if n<k: # if reverse value is greater than length return nums\n        return nums\n    for i in range (n-k,n):# to give last digits \n        a.append(nums[i])\n    for j in range(n-k): #to give starting digits\n        a.append(nums[j])\n    return a"
B25EE036_q9,0,8,0.00,"<output> The issue lies in the line `nums[i - k] = original[i]`, where you're trying to access an index that's out of bounds when `k` is greater than 0. This happens because Python uses zero-based indexing, so when `i` equals `len(nums)`, `i - k` becomes negative and can't be accessed. </output>","def rotate_list(nums, k):\n    """"""\n    Rotate the list 'nums' to the right by k steps, modifying\n    the list in place without creating a new list. Return the rotated list.\n    """"""\n    original = nums.copy()   # copy the original list\n    if k>len(nums):\n        k=k%len(nums)  #we did this so that list index doesn't go out of range while shifting elements by k\n    for i in range(len(nums)):\n        nums[(i-k)] = original[i]   # shift elements by k\n    return nums\n\nprint(rotate_list([1, 2, 3, 4, 5, 6], 2))\nprint(rotate_list([1, 2, 3], 0)) \nprint(rotate_list([1], 5))"
B25CS035_q9,0,8,0.00,<output>Try inserting at the end instead of the beginning to effectively rotate the list.</output>,"def rotate_list(nums, k):\n    for _ in range(k):\n        nums.insert(0, nums.pop())\n    return nums\n\n#Test Cases:\nprint(rotate_list([1, 2, 3, 4, 5, 6], 2)) # [5, 6, 1, 2, 3, 4]\nprint(rotate_list([1, 2, 3], 0)) # [1, 2, 3]\nprint(rotate_list([1], 5)) # [1]\n"
B25MT010_q9,8,8,100.00,"<output>Use the `append` method to add elements to the end of the list instead of using `insert`, and consider using a temporary variable to swap elements.</output>","def rotate_list(nums,k):\n    """"""\n       rotates the list from right for k times that means for every time last\n       element gets transferred to first and it goes on for k times.\n       \n    """"""   \n    for i in range (k):\n        for j in range(len(nums)):\n            if j==len(nums)-1:\n                nums.insert(0,nums[j])\n                nums.pop(len(nums)-1)\n            else:\n                pass\n    return(nums)\n"
B25MM027_q9,0,8,0.00,"<output> Check if you're using the correct indexing to slice and reverse parts of the list. Instead of `nums[:k] = reversed(nums[:k])` and `nums[k:] = reversed(nums[k:])`, try `nums[-k:] = nums[:-k][::-1]`. </output>","###################################################################################################\n#SATYA RISHINDRA SONTHENA\n#B25MM027\n#MATERIAL SCIENCES AND METALLURGICAL ENGINEERING\n#INDIAN INSTITUTE OF TECHNOLOGY BHILAI\n###################################################################################################\ndef rotate_list(nums, k):\n    n = len(nums)\n    if n == 0:\n        return nums\n    k = k % n  \n    nums.reverse()\n    nums[:k] = reversed(nums[:k])\n    nums[k:] = reversed(nums[k:])\n    return nums\nprint(rotate_list([1, 2, 3, 4, 5, 6], 2)) \n\n"
B25DS030_q9 ,0,8,0.00,"<output> The function `rotate_list` seems to be defined, but it's not being called anywhere in the code. Make sure to call the function with the correct arguments, for example: `nums = [1, 2, 3, 4, 5]; k = 2; rotate_list(nums, k);`. </output>","import math\ndef calculate_angles(a, b, c):\n   """"""Given three sides a, b, c, calculates the three angles\n   A, B, C of the triangle. Each angle should be rounded\n   up to the next integer (’ceil’).Returns a tuple (angleA, angleB, angleC).""""""\n   if a+b>c and b+c>a and c+a>b: \n      A=math.degrees(math.acos((b**2+c**2-a**2)/(2*b*c)))\n      B=math.degrees(math.acos((c**2+a**2-b**2)/(2*a*c)))\n      C=math.degrees(math.acos((a**2+b**2-c**2)/(2*a*b)))\n      return (math.ceil(A),math.ceil(B),math.ceil(C))\n   else :\n       print(""triangle not possible"")\n"
B25ec025_q9 (9),0,8,0.00,"<output>Make sure the function name in your code matches the problem description, as 'rotate_list' should be renamed to 'rotate'.</output>",def median(numbers):\n    if not numbers:  \n        return None\n    nums = sorted(numbers)  \n    n = len(nums)\n    mid = n // 2\n    if n % 2 == 1:   \n        return float(nums[mid])\n    else:           \n        return (nums[mid - 1] + nums[mid]) / 2
B25CS041_q9,7,8,87.50,"<output> Make sure to use slicing correctly to extract and concatenate the elements from the start and end of the list, rather than directly manipulating the indices with `nums[-k:]` and `nums[0:-k]`. </output>","def rotate_list(nums, k):\n    """"""\n    Rotate the list ’nums’ to the right by k steps, modifying\n    the list in place\n    without creating a new list. Return the rotated list.\n    """"""\n    if k == 0:\n        return nums\n    elif len(nums) > k: \n        nums = nums[-k:len(nums)] + nums[0:-k]\n        return nums\n    else:\n        return nums\n"
B25CS025_q9,7,8,87.50,<output> Reverse your list before appending and popping elements to avoid index out of range errors.</output>,"def rotate_list(nums, k):\n    '''first i reversed the list then i appended the first k number of values and then i reversed\n     the list again and removed the last k number of values'''\n    nums.reverse()\n    for i in range (k):\n        nums.append(nums[i])\n    nums.reverse()\n    for i in range (len(nums)-1,len(nums)-1-k,-1):\n        nums.pop()\n    return nums\n"
shourya_q9,0,8,0.00,"<output>Consider using a different approach to rotate the list, such as using slicing or list comprehension, instead of manually reversing the list multiple times.</output>","def rotate_list(nums, k):\n    \n    n = len(nums)\n    if n == 0:\n        return nums\n    k %= n\n    if k == 0:\n        return nums\n\n    def reverse(l, i, j):\n        while i < j:\n            l[i], l[j] = l[j], l[i]\n            i += 1\n            j -= 1\n\n    \n    reverse(nums, 0, n - 1)\n    \n    reverse(nums, 0, k - 1)\n    \n    reverse(nums, k, n - 1)\n    return nums\n\nprint(rotate_list([1,2,3,4,5,6],2))\n\n\n"
B25EC024_q9,8,8,100.00,"<output> The function should be using `nums.pop()` and `nums.insert()` to shift elements from the end to the beginning, rather than concatenating slices of the list, as this approach modifies the original list in place. </output>","def rotate_list(nums, k):\n    """"""\nRotate the list ’nums’ to the right by k steps, modifying\nthe list in place\nwithout creating a new list. Return the rotated list.\n""""""\n\n    n = len(nums)\n    if n == 0 :\n        return nums\n    k = k % n \n    return nums[-k : ]   +  nums[ : -k]\n    \n"
B25DS040_q9,0,8,0.00,<output>Make sure to handle the case when k is greater than n correctly by using k % n instead of just k.</output>,"def rotate_list(nums, k):\n    n = len(nums)\n    if n == 0:\n        return nums\n    else:\n        k = k % n\n    nums[:] = nums[-k:] + nums[:-k]\n    return nums\nlst = [1, 2, 3, 4, 5]\nrotate_list(lst, 2)\nprint(lst)\n\nlst = [1, 2, 3]\nrotate_list(lst, 4)\nprint(lst)"
B25DS022_Q9,0,8,0.00,"<output>Check if you're using `nums[-k:]` and `nums[:-k]`, which will raise a ZeroDivisionError when k is 0 because it attempts to access an empty slice of the list.</output>","def rotate_list(nums, k):\n    k = k % len(nums)\n    return nums[-k:] + nums[:-k]\n    pass\n\nprint(rotate_list([1,2,3,4,5,6,],2))"
B25CS027_Q9,0,8,0.00,<output>Make sure to use the correct index when slicing the list to avoid off-by-one errors.</output>,"nums = [1, 2, 3, 4, 5, 6]\nk = 2\n\nn = len(nums)\nk = k % n\nnums = nums[-k:] + nums[:-k]\nprint(nums)\n"
B25EE057_Q9,0,8,0.00,"</output> The issue lies in the fact that you're removing and inserting elements from the list while iterating over it, which causes the indices to shift unexpectedly. Instead, consider using two pointers to track the start and end of the rotation range.</output>","def rotate_list(nums:list,k:int):\n    for i in range(0,k):\n        new=nums[len(nums)-1]\n        nums.pop(len(nums)-1)\n        nums.insert(0,new)\n    return nums\nprint(rotate_list([1,2,3,4,5,6],2))\nprint(rotate_list([1,2,3],0))\nprint(rotate_list([1],5))"
B25EE011_q9,0,8,0.00,"<output> The issue lies in using `pop()` and `insert()` on a list while iterating over it, which causes unpredictable behavior and can lead to the ZeroDivisionError. Instead, use slicing to rotate the list.</output>","def rotate_list(nums,k):\n    l=len(nums)\n    k=k%l\n    if l==0:\n        return nums\n    else:\n       for i in range(k):\n            x=nums.pop() \n            nums.insert(0,x)\n    return nums\n\nprint(rotate_list([1, 2, 3, 4, 5, 6], 2)) \nprint(rotate_list([1, 2, 3], 0))\nprint(rotate_list([1], 5))"
B25ME031_Q9,0,8,0.00,"<output> The issue lies in removing elements from the list while iterating over it, which causes the index out of range error. Consider using a different approach, such as reversing the list and then inserting elements at the beginning.</output>","def rotate_list(nums, k):\n    count = 0\n    while count<k:\n        number = nums[-1]\n        nums.remove(number)\n        nums.insert(0, number)\n        count+=1\n    print(nums)\n\nrotate_list([1, 2, 3, 4, 5, 6], 2)\nrotate_list([1, 2, 3], 0)\nrotate_list([1], 5)"
B25MT024_q9,0,8,0.00,<output> The issue lies in the fact that you're removing elements from the list using `nums.pop()` and then inserting them at the beginning without checking if the list is empty after popping an element. This causes an IndexError when trying to pop an element from an empty list. </output>,"def rotate_list(nums, k):\n    for i in range(k):\n        a=nums.pop()\n        nums.insert(0,a)\n    return nums\nprint(rotate_list([1,2,3,4,5,6],2))   #[5,6,1,2,3,4]\nprint(rotate_list([1,2,3],0))         #[1,2,3]\nprint(rotate_list([1], 5))            #[1]"
B25DS001_q9,0,8,0.00,<output>Consider using a two-pointer approach to simplify the rotation process and avoid unnecessary appends.</output>,"def rotate_list(nums,k):\n    l=len(nums)\n    n=[]\n    if k>=l:\n        n=nums[::-1]\n    else:\n        for i in range(-k,0,1):\n            x=nums[i]\n            n.append(x)\n        for j in range(l-k):\n            y=nums[j]\n            n.append(y)\n    return n\nprint(rotate_list([1,2,3,4,5,6],2))\n    \n"
B25MT007_q9,0,8,0.00,"<output>Consider using list slicing to achieve rotation instead of indexing, as it can avoid potential off-by-one errors and make the code more readable.</output>","def rotate_list(nums, k):\n    num = []\n    for i in range(0,len(nums)):\n        if len(nums) >= k:\n            num.append(nums[i-k])\n        elif k >= len(nums):\n            k=k%len(nums)\n            num.append(nums[i-k])\n    return num\nprint(rotate_list([1,2,3,4,5,6],2))\nprint(rotate_list([1],5))\nprint(rotate_list([1,2,3],0))"
B25EC020_Q9,0,8,0.00,"<output> The issue lies in removing elements from the list while iterating over it, which causes an IndexError because the indices of the remaining elements shift after each removal. Consider using a different approach that avoids these issues.</output>","##############################################\n#NAME: Kammuri Lok Prakash Chowdary\n#ID NO: B25EC020\n#Discipline: Electronics and Communication Engineering\n#institute Name: Indian Institute of Technology Bhilai\n#######################################################################################\n\ndef rotate_list(nums,k):\n    for i in range(k):\n        p=nums[len(nums)-1]\n        nums.remove(p)\n        nums.insert(0,p)\n    return nums   \nprint(rotate_list([1,2,3,4,5,6],2))"
