student_id,tests_passed,tests_total,score_percentage,semantic_summary,code_snippet
B25DS036_q6,4,5,80.00,"<output>Check if the list is empty before iterating over it, as the initial value of `max` will be out of range when the list is empty.</output>",\n\n\ndef find_max(numbers):\n    max=numbers[0]\n    for i in numbers:\n        if i>max:\n            max=i\n    return max        \n
B25CS035_q6,5,5,100.00,"<output>Consider using a more efficient approach, such as sorting the list first and then returning the last element, which would eliminate the need to iterate over all elements.</output>","def find_max(numbers):\n    """"""\n    Return the m element of 'numbers' without using max(). Return None for empty list.\n    """"""\n    if not numbers:\n        return None\n    m = numbers[0]\n    for num in numbers:\n        if num > m:\n            m = num\n    return m\n"
B25EE049_q6,5,5,100.00,"<output> You are correctly checking if a number is greater than the current maximum, but you should also check if `num` is less than `ma`, not just greater. Try changing `if num > ma:` to `if num < ma:`. </output>",def find_max(numbers):\n    if not numbers:\n        return None\n    ma = numbers[0]\n    for num in numbers:\n        if num > ma:\n            ma = num\n    return ma\n
B25ME032_q6,5,5,100.00,"<output>Consider using a more efficient approach, such as keeping track of the maximum value found so far, rather than comparing every element to the current max.</output>",def find_max(numbers):\n    if len(numbers)==0:\n        return None\n    max=numbers[0]\n   \n    for i in numbers:\n        if i>max:\n            max=i\n            \n    return max\n\n\n
B25EE051_q6,5,5,100.00,"<output>Consider using a two-pointer approach to find the maximum element, as your current implementation has a time complexity of O(n^2) due to the nested loops.</output>",def find_max(numbers):\n    if len(numbers) == 0:\n        return None\n    else:\n        maxi = numbers[0]\n        for i in numbers :\n            if i >= maxi :\n                maxi = i\n        return maxi\n
B25ME006_Q6,0,5,0.00,"<output> You are comparing each number with every other number, which is not necessary and has a time complexity of O(n^2). Instead, iterate through the list only once to find the maximum element, checking if it's greater than the current max. </output>","def find_max(numbers):\n    for i in numbers:\n        max=i\n        for j in numbers:\n            if max<j:\n                max=j\n    if numbers==[]:\n        return None\n                \n                \n    return max\nprint(find_max([1,5,3,9,2]))\nprint(find_max([-10,-5,-2]))\nprint(find_max([]))"
B25CS017_Q6,0,5,0.00,<output>Examine why you're swapping elements instead of comparing them to find the maximum value.</output>,"def find_max(n):\n    if n == []:\n        print(""none"")\n    else:\n        for i in range(len(n)):\n            for j in range(i,len(n)):\n                if n[i]>n[j]:\n                    n[i],n[j] = n[j],n[i]\n        print(n[len(n)-1])\nfind_max([1, 5, 3, 9, 2]) \nfind_max([-10, -5, -2]) \nfind_max([])"
B25EC020_q6,0,5,0.00,"<output>Check if you are using the correct comparison operator for finding the maximum value in a list, as your current implementation is comparing with the minimum value instead.</output>",def max_numbers(n):\n    if n!=[]:\n        k=min(n)\n        for i in n:\n            if i>k:\n                k=i\n        return k\n      \n        \n        
B25EC026_q6,5,5,100.00,"<output>Consider using a more efficient approach, such as sorting the list and returning the last element, to avoid unnecessary comparisons.</output>",def find_max(numbers):\n    if numbers==[]:\n        return None\n    max=numbers[0]\n    for i in numbers:\n        if max<i:\n            max=i\n    return max\n
B25EE039_q6,5,5,100.00,"<output>Check the condition where you update `max_val` to ensure it's being updated for every number in the list, not just the first one.</output>","def find_max(numbers):\n    """"""\n    Return the largest element of 'numbers' without using max().\n    Return None for empty list.\n    """"""\n    if not numbers:\n        return None\n    max_val = numbers[0]\n    for num in numbers:\n        if num > max_val:\n            max_val = num\n    return max_val\n"
B25ME057_q6,5,5,100.00,"<output>Consider using a more efficient approach, such as the two-pointer technique, to find the maximum element in the list, especially for large inputs.</output>",def find_max(numbers):\n    if numbers ==[]:\n        return None\n    else:\n        x= numbers[0]\n        for num in numbers:\n            if num > x:\n                x= num\n        return x
{B25CS013}_q6,1,5,20.00,"<output> The issue lies in the variable name; it should be `num` instead of `nums` to match the loop iteration, and also, there is no need for the first element comparison as the list is already sorted. </output>",#Q6\n\n\n\ndef find_max(number):\n    \n    if not number:\n        return None\n    \n    largest_1 = number[0]\n    for num in number:\n        if nums > largest_1:\n            largest_1 = nums\n    return largest_1\n\n
B25ME011_q6,0,5,0.00,"<output>Check the initial value of `maximum_number` to ensure it's set to the first element of the list, as you're iterating over the rest of the elements later.</output>","def find_max(numbers):\n    """"""\n    returning the max value element of numbers\n    \n    """"""\n    if (len(numbers) == 0 ) :\n        return None\n    maximum_number  = numbers[0]\n    for i in range (1,len(numbers)):\n        if (numbers[i] > maximum_number):\n            maximum_number = numbers[i]\n    return maximum_number\nprint(find_max([1,5,3,9,2]))\nprint(find_max([-10 , -5 ,-2]))\nprint(find_max([]))\n                "
B25CS019_q6,5,5,100.00,"<output> The student's code uses sorting, which has a time complexity of O(n log n), whereas the problem can be solved with a single pass through the list, resulting in a time complexity of O(n). Consider using the two-pointer technique to find the maximum element efficiently.</output>",def find_max(numbers):\n    if numbers == [] :\n        return None\n    else:\n        n = sorted(numbers)\n        a = n[-1]\n        return a
B25MT014_q6,5,5,100.00,"<output> The function is currently using the first element of the list as the initial maximum value, which might not always be the case, especially for lists with negative numbers or zero. Consider initializing `max_val` to a very small number (e.g., `-float('inf')`) instead. </output>",def find_max(numbers):\n    if not numbers:\n        return None\n    \n    max_val = numbers[0]\n    for number in numbers:\n        if number > max_val:\n            max_val = number\n    return max_val
B25DS006_q6,5,5,100.00,"<output>Consider using a two-pointer approach to find the maximum element, as your current implementation only checks each number once and is not necessary to iterate through the entire list.</output>","def find_max(numbers):\n    if len(numbers)==0:\n        return None\n    max=numbers[0]\n    for i in range(1,len(numbers)):\n        if numbers[i]>max:\n            max=numbers[i]\n    return max\n    "
B25ME033_Q6,0,5,0.00,"<output>Replace 'numzf' with 'num' to fix the NameError, as 'num' is the variable that holds each number in the list.</output>","def find_max(l):\n    max_val=0\n    if len(l)==0:\n        return None\n    for num in l:\n        if num>max_val:\n            max_val=numzf\n    return max_val\n\na=[1,2,34,5,]\nprint(find_max(a))\n        \n"
B25CS044_Q6,5,5,100.00,"<output>Consider initializing `bigval` to a very small number, so that any valid number will be greater than it initially.</output>","#B25CS044_Q6\n\ndef find_max(numbers):\n    """"""\n    Return the largest element of ’numbers’ without using max\n    ().\n    Return None for empty list.\n    """"""\n    bigval = None\n    for i in numbers:\n        if bigval == None or i>bigval:\n            bigval = i\n            \n    return bigval\n\nfind_max([1, 5, 3, 9, 2]) # 9\nfind_max([-10, -5, -2]) # -2\nfind_max([]) # None"
B25CS002_q6,5,5,100.00,"<output>Consider using a two-pointer approach instead of iterating over the list to find the maximum element, as your current implementation has a time complexity of O(n^2) due to the nested loop.</output>",def find_max(numbers):\n    if (len(numbers) == 0):\n        return None\n    m = numbers[0]\n    for i in numbers:\n        if (i>m):\n            m = i\n    return m
B25EC010_q6,5,5,100.00,"<output> Consider examining the initial value of `current` to ensure it's initialized with the first element of the list, as using 0 might result in incorrect comparisons if all elements are negative. </output>",def find_max(numbers):\n    if not numbers:\n        return None\n    current = numbers[0]\n    for x in numbers[1:]:\n        if x > current:\n            current = x\n    return current\n
B25EE009_q6,1,5,20.00,"<output>Consider initializing `c` with a sentinel value (e.g., negative infinity), so that it can be updated correctly even when no elements are present in the list.</output>","def find_max(numbers):\n    if len(numbers)!=0:\n        c=numbers[0]\n        for i in range(0,len(numbers)):\n            if numbers[i]>c:\n                c=numbers[i]\n                return c\n    else:\n        return None\n    \n        "
B25CS030_q6,5,5,100.00,"<output>Check the initial assignment of `max_val` to ensure it's initialized with the first element of the list, rather than just being set to the first element without considering other possibilities.</output>",def find_max(numbers):\n    if numbers == []:\n        return None\n    max_val=numbers[0]\n    for i in range(len(numbers)):\n        if numbers[i] > max_val:\n            max_val = numbers[i]\n    return max_val\n
B25DS010_Q6,0,5,0.00,"<output> Check if you're modifying the list while iterating over it, which is causing the index error. Consider using a different approach, such as using the built-in `max()` function or sorting the list first. </output>","def find_max(numbers):\n    maximum=numbers[0]\n    for i in range(len(numbers)) :\n        if numbers[i]>=maximum:\n            maximum=numbers[i]\n    return maximum\nprint(find_max([1,2,3,4,5]))"
B25ME049_q6,0,5,0.00,"<output>Check if you are updating the largest_element correctly by comparing with all numbers, not just the first one.</output>","def find_max(numbers):\n    if not numbers:  \n        print(""None"")\n    else:\n        largest_element = numbers[0]\n        for number in numbers:\n            if number > largest_element:\n                largest_element = number\n        print(largest_element)\n    \nfind_max([1, 5, 3, 9, 2])\nfind_max([-10, -5, -2])\nfind_max([])"
B25EE056_q6,0,5,0.00,"</output> The loop is iterating over each number in the list, but it should compare with the current maximum value instead of the first number in the list.","def find_max(numbers):\n    if numbers==[]:\n        return None\n    else:\n        Max=numbers[0]\n        for i in numbers:\n            if Max<i:\n                Max=i\n        return Max\n    \nprint(find_max([1,5,3,9,2]))\nprint(find_max([-10,-5,-2]))\nprint(find_max([]))\n"
B25ME008_Q6,5,5,100.00,"<output>Consider using a two-pointer approach with the smallest and largest numbers initialized to negative infinity, allowing you to find the maximum value without iterating over the entire list.</output>",def find_max(numbers):\n    if len(numbers)==0:\n        max = None\n    else:\n        max = numbers[0]\n        for i in numbers:\n            if i>=max:\n                max = i\n    \n    return max
B25DS032_q6,0,5,0.00,"<output> The issue lies in using `sort()` which sorts in ascending order, whereas you want to find the largest element; consider using a different sorting method like descending order. </output>","def find_max(numbers):\n    new_numbers = list(set(numbers))\n    if len(numbers) < 1:\n        return None\n    new_numbers.sort()\n    return new_numbers[-1]\n    \n\nprint(find_max([1,5,3,9,2]))\nprint(find_max([-10,-5,-2]))\nprint(find_max([]))"
B25MT022_q6,0,5,0.00,"<output>Check the initial assignment of `largest` to ensure it's being set to the first element of the list, rather than just comparing with other elements.</output>",def find_max(numbers):\n    if not numbers:\n        return None\n\n    largest = numbers[0]\n    for num in numbers:\n        if num > largest:\n            largest = num\n    return largest\n    \n    \nprint(find_max([]))
B25DS029_q6,5,5,100.00,"<output>Consider using the built-in `sorted()` function to find the largest element, as it is more efficient than iterating through the list manually.</output>","def find_max(numbers):\n    """"""\n    Return the largest element of 'numbers' without using max().\n    Return None for an empty list.\n    """"""\n    if not numbers:        \n        return None\n    largest = numbers[0]   \n    for num in numbers:    \n        if num > largest:\n            largest = num  \n    return largest\n"
B25ME034_q6,5,5,100.00,"<output>Consider using a two-pointer approach to find the maximum value, as your current implementation has a time complexity of O(n^2) due to the nested loop.</output>",def find_max(numbers):\n    if numbers==[]:\n        return None\n    else:\n        max_number=numbers[0]\n        for i in numbers:\n            if i>max_number:\n                max_number=i\n        return max_number\n\n\n\n
B25EC007_q6,5,5,100.00,"<output> Consider using a single pass through the list to find the maximum value, as your current implementation involves comparing each element with the previous maximum, which is unnecessary and potentially inefficient.</output>",def find_max(numbers) :\n    if numbers==[] :\n        return None\n    maximum=numbers[0]\n    for i in numbers :\n        if i>maximum :\n            maximum=i\n    return maximum\n
B25EE026_q6,5,5,100.00,"<output>Consider using the built-in `sorted()` function to find the largest element, as it is more efficient and Pythonic than manually iterating through the list.</output>","""""""\n Returnthelargestelementof’numbers’withoutusingmax\n ().\n ReturnNoneforemptylist.\n """"""\ndef find_max(numbers):\n    if len(numbers)==0:\n        return None\n    max=numbers[0]\n    for i in numbers:\n        if i>max:\n            max=i\n    return max"
B25DS043_q6,5,5,100.00,"<output>Consider using a two-pointer approach where one pointer starts from the beginning and another from the end of the list, meeting in the middle to find the largest element efficiently.</output>","def find_max(numbers):\n ''' Return the largest element of 'numbers' without using max(). Return None for empty list.'''\n if numbers==[]:\n    return None\n max=numbers[0]\n for i in range (1, len(numbers)):\n    if max<numbers[i]:\n        max=numbers[i]\n return max\n"
B25DS002_q6,4,5,80.00,"<output> Ensure that you're returning the largest element before the list is sorted, as sorting will change the original order of elements. </output>",def find_max(numbers) :\n    \n    numbers.sort() \n    n= len(numbers)\n    \n     \n    return numbers[(n-1)]
B25CS037_q6,5,5,100.00,"<output>Consider initializing `max_value` with the first element of the list (`numbers[0]`) instead of setting it to `numbers[0]`, which would overwrite any larger numbers found later in the iteration.</output>",def find_max(numbers):\n    if len(numbers) == 0:\n        return None\n    else:\n        max_value = numbers[0]\n        for num in numbers:\n            if num > max_value:\n                max_value = num\n        return max_value
B25MT009_Q6,4,5,80.00,"<output>Try sorting in descending order instead of ascending, as this will ensure you're getting the largest number.</output>",def find_max(numbers):\n    numbers.sort()\n    return numbers[-1]
B25DS038_q6,5,5,100.00,"<output>Consider using the built-in `len()` function to get the number of elements in the list and then use indices to access each element, rather than iterating through the list.</output>",def find_max(numbers):\n    if not numbers:\n        return None\n    max_val = numbers[0]\n    for num in numbers[1:]:\n        if num > max_val:\n            max_val = num\n    return max_val\n
B25EC036_q6,0,5,0.00,"<output>Consider using a two-pointer approach instead of a single iteration to find the maximum element, as your current implementation only checks each number once and may not handle all edge cases correctly.</output>","def find_max(numbers):\n   if numbers==[]:\n      return None\n   max_number=numbers[0]\n   i=0\n   while i <len(numbers):\n      if numbers[i]>max_number :\n         max_number=numbers[i]\n      i=i+1\n   return max_number    \n        \nprint(find_max([1, 5, 3, 9, 2]))        \n"
B25DS020_Q6,4,5,80.00,"<output> The inner loop is unnecessary and can be replaced with a single comparison to find the maximum value, simplifying the code and improving its efficiency. </output>","def find_max(numbers:list):\n    if len(numbers)==0:\n        return ""None""\n    else:\n        for i in numbers:\n             for j in numbers:\n                if i<j:\n                   break\n             else:\n                 return i\n\n    \n        "
B25ME002_q6,5,5,100.00,"<output> Re-examine your loop to ensure you're updating `max` correctly; consider using a single pass through the list with the index, rather than comparing each value to the current max. </output>",def find_max(numbers):\n    if(len(numbers)==0):\n        return None\n    max=numbers[0]\n    for i in numbers:\n        if(i>max):\n            max=i\n    return max\n
B25ME024_q06,5,5,100.00,"<output> Consider examining the initial value of `maximum` to ensure it is initialized with the first element of the list, rather than just being assigned the first element without comparison, which could lead to incorrect results if subsequent elements are larger. </output>",def find_max(numbers):\n    if not numbers:\n        return None\n\n    maximum = numbers[0]\n    for num in numbers[1:]:\n        if num > maximum:\n            maximum = num\n    return maximum\n\n\n\n
B25MM018_q6,0,5,0.00,"<output>Consider using a two-pointer approach instead of comparing each number to the current maximum, as this could lead to unnecessary comparisons and slow down the function.</output>","def find_max(numbers):\n    """"""\n    Return the largest element of 'numbers' without using max().\n    Return None for empty list.\n    """"""\n    if not numbers:\n        return None\n    max_num = numbers[0]\n    for num in numbers:\n        if num > max_num:\n            max_num = num\n    return max_num\nprint(find_max([1,5,3,9,2]))"
B25EE003_q6,5,5,100.00,"<output>Consider using the built-in `max()` function instead of implementing your own logic to find the maximum value in the list, as it is more efficient and accurate.</output>",##q6\ndef find_max(numbers):\n    if not numbers:\n        return None\n    max_val = numbers[0]\n    for n in numbers:\n        if n > max_val:\n            max_val = n\n    return max_val\n
B25ME026_q6,5,5,100.00,"<output> The student's implementation incorrectly assumes that sorting the list is efficient, whereas it has a time complexity of O(n log n), which can lead to performance issues for large lists. Consider using a more efficient algorithm like finding the maximum element in one pass through the list. </output>",def find_max(numbers):\n    l = len(numbers)\n    if l == 0:\n        return None\n    else:\n        numbers.sort()\n        maximum = numbers[l - 1]\n    return maximum\n\n\n
B25CS004_q6,5,5,100.00,"<output>Consider using two pointers, one starting from the beginning and one from the end of the list, to find the maximum value without comparing every single element.</output>",def find_max(numbers):\n    if(len(numbers)==0):\n        return None\n    maximum=numbers[0]\n    for i in range(len(numbers)):\n        if(numbers[i]>maximum):\n            maximum=numbers[i]\n    return maximum
B25EE043_q6,0,5,0.00,"<output> You are initializing `num` with the first element of the list, but you're comparing it to every other element in the list. This means that if all elements are equal, `num` will remain the same as the first element, not the largest. Try using a different initialization for `num`. </output>","def find_max(lst):\n    for i in range (len(lst)):\n        num=lst[0]\n        if num<lst[i]:\n            num=lst[i]\n    return num\nprint(find_max([-1,-5,-10]))       "
B25DS039_Q6,4,5,80.00,"<output> The issue lies in the line `if i >= maxx`, where you're checking if each number is greater than or equal to the current maximum, instead of checking if it's greater than the current maximum. This will cause an incorrect update when a smaller number is found, leading to the IndexError. </output>",def find_max(numbers):\n    maxx=numbers[0]\n    for i in numbers:\n        if i>=maxx:\n            maxx=i\n        else:\n            continue\n    return maxx\n
B25DS025_q6,5,5,100.00,"</output> The issue lies in the fact that you're updating `num` with the first element of the list, instead of comparing it to each subsequent element. You should initialize `num` with negative infinity or a very small number to ensure the first comparison yields a correct result.  </output>","def find_max(numbers):\n    """"""\n    Return the largest element of 'numbers' without using max().\n    Return None for empty list.\n    """"""\n    if len(numbers)==0: # empty list\n        return None\n    elif len(numbers)==1: # single element\n        return numbers[0]\n    else:\n        num=numbers[0]\n        for i in numbers: # checking all elements and storing the largest so far in 'num'\n            if num<i:\n                num=i\n        return num"
B25DS004_q6,5,5,100.00,"<output>Be cautious of the inner loop, as it's iterating over the same list that you're comparing against the current number, which could lead to incorrect results.</output>",def find_max(numbers):\n    if len(numbers) == 0:\n        return None\n    for n in numbers:\n        count = 0\n        for m in numbers:\n            if n>= m:\n                count += 1\n        if count == len(numbers):\n            return n\n\n
B25DS012_Q6,4,5,80.00,"<output> Initialize `max_` to the first element of the list, not 0.</output>",def find_max(numbers):\n    if len(numbers) == 0:\n        return None\n    else:\n        max_ = 0\n        for number in numbers:\n            if number > max_:\n                max_ = number\n        return max_\n
B25EC042_q6,0,5,0.00,"<output> The issue lies in the fact that you're modifying the list `l` while iterating over it, which can lead to unexpected behavior and incorrect results. Consider using a different approach, such as keeping track of the maximum value seen so far without modifying the original list. </output>","def find_max(numbers):\n    if len(numbers)==0:\n        return None\n    l=[numbers[0]]\n    for i in numbers:\n        if l[0]>=i:\n            continue\n        else :\n            l[0]=i\n    return l[0]\nprint(find_max([1,5,3,9,2]))\nprint(find_max([-10,-5,-2]))\nprint(find_max([])) "
B25CS048_q6,5,5,100.00,"<output>Consider using a more efficient algorithm, such as sorting the list first, which would have a time complexity of O(n log n) compared to your current implementation's O(n^2) due to the nested loops.</output>","def find_max(numbers):\n    """"""\n    Return the largest element of ’numbers’ without using max\n    ().\n    Return None for empty list.\n    """"""\n    if numbers==[]:\n        return None\n    else:\n        c=float('-inf')\n        for i in numbers:\n            if i>c:\n                c=i\n        return c\n\n            "
B25CS050_q6,4,5,80.00,<output>Check if you are returning a string ('None') instead of comparing with the first element directly.</output>,"def find_max(numbers):\n    max=numbers[0]\n    if len(numbers) ==0:\n            return ""None""\n    else:\n        for i in numbers:\n            if i > max:\n                max=i\n        return max\n       \n"
B25EE048_q6,5,5,100.00,"<output>Sorting the list is not necessary, as you can find the maximum element by comparing it with the first element and then iterating through the rest of the list.</output>",def find_max(numbers):\n    if numbers==[]:\n        return None\n    numbers.sort()\n    return numbers[-1]\n    
B25CS009_q6,5,5,100.00,"<output>The nested loop approach is not suitable for finding the maximum element, as it only swaps adjacent elements and does not consider all possible comparisons.</output>","def find_max(numbers):\n """"""\n Returnthelargestelementof’numbers’withoutusingmax\n ().\n ReturnNoneforemptylist.\n """"""\n if len(numbers) == 0:\n     return None\n else :\n     for i in range(len(numbers)) :\n         for j in range(len(numbers)-1) :\n             if numbers[j] < numbers[j+1] :\n                 numbers[j],numbers[j+1] = numbers[j+1],numbers[j]\n     return numbers[0]\n"
B25MT023 Q 6 ,0,5,0.00,"<output>Consider the case where the input list contains negative numbers, as your current implementation only updates `largest` with the first positive number it encounters.</output>","def find_max(numbers):\n    if not numbers :\n        return None\n    largest = numbers[0]\n    for num in numbers:\n        if num > largest :\n            largest = num\n    return largest\nprint(find_max([1, 5, 3, 9, 2]))\nprint(find_max([-10, -5, -2]))\nprint(find_max([]))"
