student_id,tests_passed,tests_total,score_percentage,semantic_summary,code_snippet
B25CS016_q6,4,5,80.00,"<output> The issue lies in the initial value of `MAX` being set to the first element of the list, assuming it's always the largest. However, if the list is empty (i.e., has no elements), this will raise an IndexError. </output>",def find_max(numbers):\n    MAX = numbers[0]\n    for i in numbers:\n        if i > MAX:\n            MAX = i\n    return MAX\n
b25me047_q6,4,5,80.00,"<output> Check if you're iterating over all elements in the list by adding a condition to handle the case when the list is empty, e.g., `if not numbers: return None`. </output>",def find_max(numbers):\n    max_num = numbers[0]\n    for num in numbers:\n        if num > max_num:\n            max_num = num\n    return max_num
B25MM006_q6,4,5,80.00,"<output> Check if you are iterating over the list from the beginning to the end, and consider using the built-in `len()` function to get the length of the list before starting the iteration, as this can prevent index out-of-range errors. </output>",def find_max(numbers):\n    max_num=numbers[0]\n    for i in numbers:\n        if i>max_num:\n            max_num=i\n    return max_num\n
B25EE012_q6,5,5,100.00,"<output>Consider using a two-pointer approach instead of iterating through the list to find the maximum value, as this can lead to unnecessary comparisons.</output>",def find_max(numbers):\n    if numbers == []:\n        return None\n    max_num = numbers[0]\n    for i in numbers:\n        if i > max_num :\n            max_num = i\n    return max_num\n        \n         \n                \n    \n\n    
B25CS012_q6,5,5,100.00,"<output>Consider using a two-pointer approach instead of iterating through the entire list, as this can lead to unnecessary comparisons and slow performance.</output>","def find_max(numbers):\n    """"""\n    Return the largest element of ’numbers’ without using max\n    ().\n    Return None for empty list.\n    """"""\n    if len(numbers)==0:\n        return None\n    max_elem=numbers[0]\n    for num in numbers:\n        if num>max_elem:\n            max_elem=num\n    return max_elem\n\nfind_max([1, 5, 3, 9, 2]) # 9\nfind_max([-10, -5, -2]) # -2\nfind_max([]) # None"
B25CS047_q6,0,5,0.00,"<output> Re-examine your loop condition to ensure you're not trying to access indices beyond the list's length, as this could lead to an ""IndexError: list index out of range"" when dealing with empty lists. </output>","def find_max(numbers):\n    a=numbers[0]\n    if numbers==[]:\n        return None\n    else:\n        for i in numbers:\n            if i>a:\n                a=i\n        return a\nprint(find_max([1,2,3]))\nprint(find_max([-10,-5,-2]))"
B25CS055_q6,5,5,100.00,"<output>Consider using a two-pointer approach, starting from both ends of the list and moving towards the center, to avoid comparing every element with the current maximum.</output>","def find_max(numbers):\n    """"""\n    Return the largest element of 'numbers' without using max().\n    Return None for empty list.\n    """"""\n    if len(numbers)==0:\n        return None\n    else:\n        M =numbers[0]\n        for i in numbers:\n            if i>= M:\n                M =i\n        return M\n                "
B25CS054_q6,5,5,100.00,"<output>Check if you are updating `max` with each number, not just the first one.</output>","def find_max(numbers):\n    if len(numbers)>0:\n        max = numbers[0]\n        for i in range (1,len(numbers)):\n            if numbers[i]>max: max=numbers[i]\n        return max"
B25DS041_q6,0,5,0.00,"<output> The code sorts the entire list, which has a time complexity of O(n log n), when a linear scan would suffice to find the maximum element in O(n) time. Consider using the built-in `max()` function or implementing a more efficient algorithm like binary search. </output>","def find_max(numbers):\n    \n    if not numbers:\n        \n        return None\n    \n    sorted_list = sorted(numbers)\n        \n    return sorted_list[-1]\n\nprint(find_max([1, 5, 3, 9, 2]))\nprint(find_max([-10, -5, -2]))\nprint(find_max([]))"
B25ME017_q6,4,5,80.00,"<output> The code is trying to sort the list in-place using bubble sort, but it's not actually finding the maximum value; instead, it's rearranging the elements. Instead of sorting, focus on iterating through the list only once and keeping track of the maximum element found so far.</output>","def find_max(l:list):\n    if len(l)== 0:\n        return ""[]""\n    else:\n        for i in range(len(l)):\n            for j in range(len(l)):\n                if l[i] > l[j]:\n                    l[i] , l[j] = l[j] , l[i]\n    return l[0]\n"
B25EC004_Q6,0,5,0.00,"<output>Try renaming your function from 'max_num' to 'find_max', as the runtime error suggests this might be the issue.</output>",def max_num(numbers):\n    if not numbers:\n        return None\n    largest=numbers[0]\n    for num in numbers:\n        if num>largest:\n            largest=num\n            \n    return largest\n\n\n            \n    \n    
B25ME037_q6,5,5,100.00,"<output>Check the initial value of `max_val` to ensure it's initialized with the first element of the list, as you're starting the comparison from `numbers[1:]`.</output>",def find_max(numbers):\n    if not numbers:\n        return None\n    max_val = numbers[0]\n    for num in numbers[1:]:\n        if num > max_val:\n            max_val = num\n    return max_val\n
B25DS008_q6,0,5,0.00,<output>Consider using the built-in `max()` function with a default value of None to simplify the code and avoid unnecessary iterations.</output>,"def find_max(numbers):\n    if len(numbers)==0:\n        return None\n    else:\n        M=numbers[0]\n        for i in range(len(numbers)):\n            if M<numbers[i]:\n                M=numbers[i]\n        return M\nprint(find_max([1, 5, 3, 9, 2]))\nprint(find_max([-10, -5, -2])) \nprint(find_max([]))"
B25EE035_Q6,0,5,0.00,"<output> The student's implementation is comparing each item with the first item, which is not efficient and will always return the first item instead of the largest one. Use a two-pointer approach to find the maximum element in the list.</output>","""""""\nReturn the largest element of ’numbers’ without using max\n().\nReturn None for empty list.\n""""""\ndef find_max(numbers):\n    if len(numbers)==0:\n        print(""none"")\n    else:\n        tem=numbers[0]\n        for item in numbers:\n            if tem<item:\n                tem=item\n            else:\n                tem=tem\n        print(tem)\n    \nfind_max([1, 5, 3, 9, 2]) # 9\nfind_max([-10, -5, -2]) # -2\nfind_max([]) # None\n"
B25ME019_q6,0,5,0.00,"<output> Check if you are comparing each number with all other numbers in the list, which is O(n^2) time complexity. Consider using a single pass through the list to find the maximum element, which would be O(n) time complexity. </output>","def find_max(numbers):\n	max_number = numbers[0]\n	for i in numbers:\n		if i > max_number:\n			max_number = i\n	return max_number\n	\nprint(find_max([1,9,8,4,5]))"
B25EE007_q6,5,5,100.00,"<output> The loop iterates through each number, but it should also compare with the current maximum found so far, not just the first one. The initial value of `max` should be set to negative infinity instead of the first number in the list. </output>",def find_max(numbers):\n    if(len(numbers)==0):\n        return None\n    max=numbers[0]\n    for i in numbers:\n        if(i>max):\n            max=i\n    return max \n
B25CS018_q6,0,5,0.00,"<output>Consider using a more efficient approach, such as initializing `maximum` to negative infinity instead of the first number in the list, to avoid unnecessary comparisons.</output>","def find_max(numbers):\n    \n    if numbers==[]:\n        return None\n    \n    maximum = numbers[0]\n    \n    for number in numbers:\n        if number > maximum:\n            maximum = number\n    \n    return maximum\n\nprint(find_max([1, 5, 3, 9, 2]))\nprint(find_max([-10, -5, -2]))\nprint(find_max([]))"
B25EC001_q6,5,5,100.00,"<output>Consider initializing `max_value` with the first element of the list instead of 0, as this can affect the result when the list contains negative numbers or zero.</output>",def find_max(numbers):\n    if not numbers:\n        return None\n    max_value = numbers[0]\n    for num in numbers[1:]:\n        if num > max_value:\n            max_value = num\n    return max_value\n\n
B25DS024_Q6,0,5,0.00,"<output>Check the initial value of `n` to ensure it's initialized with the first element of the list, as the current implementation only checks against the first number and may not consider other elements.</output>","def find_max(numbers):\n    if not numbers:\n        return None\n    n = numbers[0]\n    for num in numbers[1:]:\n        if num > n:\n            n = num\n    return n\n\nprint(find_max([1,5,3,9,2])) #9\nprint(find_max([-10,-5,-2])) #-2\nprint(find_max([])) #None"
B25EE017_q6,4,5,80.00,"<output>Check if you are iterating through all elements of the list, considering edge cases like empty lists.</output>",def find_max(numbers):\n    max_number = numbers[0]\n    for num in numbers:\n        if num > max_number:\n            max_number = num\n    return max_number
B25EE054_q6,5,5,100.00,"<output>Consider using a more efficient approach, such as sorting the list first and then selecting the last element, which would avoid unnecessary comparisons.</output>",def find_max(numbers):\n    if numbers==[]:\n        return None\n    a=numbers[0]\n    for i in numbers:\n        if i>a :\n            a=i\n    return a              
S25MA002_Q6,0,5,0.00,"<output>Consider using a two-pointer approach instead of iterating through the entire list to find the maximum element, as this can lead to inefficiencies for large lists.</output>","def find_max(numbers):\n\n    if not numbers:  # this to give the output 'none' for the empty lists\n        return None\n\n    max_num = numbers[0]\n    for i in numbers:\n        \n        if i > max_num:  # 'i' iterate over given list elements and every time 'i' got a greater number \n                         # it will update the max_number \n            max_num = i\n    return max_num   \n\nprint(find_max([1,2,3,4,9,5,8,11,99]))\nprint(find_max([1,5,3,9,2]))\nprint(find_max([-10,-5,-2]))\nprint(find_max([]))\n\n"
B25EE001_q6,5,5,100.00,"<output>Consider using a two-pointer approach to find the maximum element, as your current implementation has a time complexity of O(n^2) due to the nested loop.</output>",def find_max(numbers):\n    if numbers == []:\n        return None\n    max_num = numbers[0]\n    for num in numbers[1:]:\n        if num>max_num:\n            max_num=num\n    return max_num
B25ME023 q6,5,5,100.00,"<output>Consider using a more efficient approach, such as sorting the list first and returning the last element, to avoid iterating over all elements in case of large lists.</output>",def find_max(numbers):\n    if not numbers:\n        return None\n    biggest = numbers[0]\n    for num in numbers:\n        if num > biggest:\n            biggest = num\n    return biggest\n
B25MT025_q6,5,5,100.00,"<output>Consider using a two-pointer approach to find the maximum value, as your current implementation has a time complexity of O(n^2) due to the nested loop.</output>",def find_max(numbers):\n    if len(numbers)==0:\n        return None\n    else:\n        greatest=numbers[0]\n        for i in numbers:\n            if i>greatest:\n                greatest=i\n        return greatest       
B25MMO14_q6,0,5,0.00,<output>Check if the 'find_max' function is defined within the provided code snippet and ensure it's correctly returning the maximum value.</output>,\n\n\n\n
B25ME031_q6,1,5,20.00,"<output> The loop iterates over each number, but it should compare with the current maximum value instead of a constant value (1), which is always less than any actual number in the list.</output>","def find_max(numbers):\n    if len(numbers)==0:\n        max=None\n    else:\n        max = numbers[0]\n        for i in numbers:\n            if i>=max:\n                max = 1\n    return max\nfind_max([1, 5, 3, 9, 2]) # 9\nfind_max([-10, -5, -2]) # -2\nfind_max([]) # None\n"
B25CS032_q6,4,5,80.00,"<output> The inner loop is comparing each element to the current maximum, but it should be comparing to the previous maximum instead.</output>","def find_max(numbers):\n    c=0\n    m=""None""\n    for i in range(0,len(numbers)):\n        c=0\n        for j in range(0,len(numbers)):\n            if numbers[j]<=numbers[i]:\n                c=c+1\n        if c==len(numbers):\n            m=numbers[i]\n    return(m)"
B25MM004_q6,2,5,40.00,"<output>Reassign the variable 'biggest' to 'large' when you find a number that is greater than 'large', and remove the unnecessary reassignment of 'largest'.</output>",def find_max(numbers):\n    if (len(numbers) == 0):\n        return None\n    \n    large=numbers[0]\n    for num in numbers:\n        if(num>large):\n            biggest=num\n    return biggest\n\n\n
B25EE044_q6,5,5,100.00,"<output>Consider using the built-in `max()` function with a generator expression instead of implementing your own loop to find the maximum value, as this can be more efficient and concise.</output>",def find_max(numbers):\n    list=numbers\n\n    if not list:\n        return None\n    \n    large=list[0]\n    for i in list:\n        if i>large:\n            large=i\n\n    return large\n\n\n
B25EE037_q6,0,5,0.00,"<output>The inner loop should iterate until `j + 1 == l - i`, not `l - 1 - i`, to ensure all elements are compared.</output>","def find_max(numbers):\n    if not numbers:\n        return None\n    l=len(numbers)\n    for i in range (l):\n        for j in range (l-1-i):\n            if numbers[j] > numbers[j + 1]:\n                numbers[j], numbers[j + 1] = numbers[j + 1], numbers[j]\n    return numbers[-1]\nprint(find_max([1, 5, 3, 9, 2])) \nprint(find_max([-10, -5, -2])) \nprint(find_max([]))"
B25ME010_q6,5,5,100.00,"<output>Your current implementation has a time complexity of O(n^2) due to the nested loops, which is not efficient for large lists. Consider using a single pass through the list to find the maximum element.</output>","def find_max(numbers):\n    if len(numbers)==0:\n        return None\n    else:\n        for i in range(len(numbers)):\n            for j in range(i+1,len(numbers)):\n                if numbers[i]<numbers[j]:\n                    numbers[j],numbers[i]=numbers[i],numbers[j] \n        return numbers[0]\n"
B25EC035_q6,0,5,0.00,"<output> The loop iterates over each number in the list, but it starts with the first number (`l = numbers[0]`) instead of the smallest one, which could lead to an incorrect result if there are negative numbers or zero in the list. </output>",def find_max(numbers):\n    if numbers == []:\n        return None\n    else:\n        l = numbers[0]\n        for i in numbers:\n            if i > l:\n                l = i\n        return l\n\nprint(find_max([]))
B25EC039_q6,4,5,80.00,"<output>Consider initializing `x` to the first element of the list instead of 0, as this could lead to incorrect results if all elements are negative.</output>",def find_max(numbers):\n    x=0\n    if numbers==[]:\n        return None\n    for i in numbers:\n        if i>x:\n            x=i\n    return x
B25MT015_q6,5,5,100.00,"<output> Check the initial value of `max_num` to ensure it's initialized with the first element of the list, as the current implementation only updates it when a larger number is found, but doesn't consider the case where all numbers are equal or less than the first one. </output>",def find_max(numbers):\n    \n    if not numbers:\n        return None\n\n    max_num = numbers[0]\n    for num in numbers:\n        if num > max_num:\n            max_num = num\n    return max_num
B25CS046_q6,5,5,100.00,"<output> The inner loop will always find the first element in the list that is greater than itself, which means it's essentially finding the smallest element instead of the largest. Consider using a different approach, such as comparing each element to the current maximum value. </output>",def find_max(n):\n    for i in n:\n        for j in n:\n            if i<j:\n               break\n        else:\n            return i
b25cs040.q6,0,5,0.00,"<output>It seems like you're trying to divide by the number of elements in the list, which will be 0 when the input is empty, causing a ZeroDivisionError. Instead, check if the list is not empty before finding the maximum element.</output>","def find_max():\n    n = int(input(""How many numbers you want to enter: ""))\n    numbers = []  \n\n    for i in range(n):\n        num = int(input(""Enter number: ""))\n        numbers.append(num)  \n    big = numbers[0]  \n    for num in numbers:\n        if num > big:\n            big = num\n\n    print(""List:"", numbers)\n    print(""Maximum number is:"", big)\n\nfind_max()\n"
b25me058_q6,0,5,0.00,"<output> The issue lies in the line `for p in numbers:` which should be indented under the `else` block, as it's a separate block of code that needs to be executed only if the initial condition is false. </output>",def find_max(numbers):\n    if len(numbers)==0:\n        return None\n    else:\n    maxx=numbers[0]\n    for p in numbers:\n        if p>maxx:\n            maxx=p\n    return maxx\n    
B25EC009_q6,5,5,100.00,"<output> Consider using a more efficient approach, such as iterating through the list once instead of sorting it, which has a time complexity of O(n log n) compared to your current implementation's O(n log n), to reduce unnecessary comparisons. </output>",def find_max(numbers):\n    l = []\n    if len(numbers)==0:\n        return None \n    k = sorted(numbers)\n    return k[len(numbers)-1]\n\n    \n
B25MT020_Q6,0,5,0.00,"<output>Consider initializing `max_num` with the first element of the list, as you're comparing it to each subsequent number in the loop.</output>","def find_max(numbers):\n    if not numbers:\n        return None\n    max_num = numbers[0]\n    for n in numbers:\n        if n > max_num:\n            max_num = n\n    return max_num\n    pass\nprint(find_max([1,2,3,4,5,6]))"
B25CS060_q6,5,5,100.00,"<output>Re-examine your inner loop to ensure you're updating the largest_element correctly, considering the possibility that a smaller number might be larger than the current largest_element.</output>",def find_max(numbers):\n    if numbers==[]:\n        return None\n    else:\n        largest_element=numbers[0]\n        for i in numbers:\n            if i>largest_element:\n                largest_element=i\n        return largest_element\n\n
B25EC019_q6,5,5,100.00,"</output> The loop iterates through each number only once, but it starts by comparing the first number with itself, which is unnecessary and can lead to incorrect results.","def find_max(numbers):\n    """"""\n    Return the largest element of ’numbers’ without using max\n    ().\n    Return None for empty list.\n    """"""\n    if len(numbers) == 0:\n        return None\n    max_num = numbers[0]\n    for num in numbers:\n        if num > max_num:\n            max_num = num\n    return max_num\n"
B25EC002_q6,0,5,0.00,"<output> The issue lies in the inner loop where you're comparing and swapping elements, which is unnecessary and causes the `max` variable to become `None`. Instead, iterate through the list once and keep track of the maximum value seen so far. </output>","def find_max(numbers):\n    max= None\n    n=len(numbers)\n    for i in range(n):\n        for j in range(i+1,n):\n            if numbers[i]>numbers[j]:\n                max= numbers[i]\n                numbers[j]= numbers[i]\n        if i==n-1 and max < numbers[n-1]:\n            max= numbers[n-1]\n            \n\n    return max\nprint(find_max([-10,-5,-2]))\n        "
B25DS028_q6,5,5,100.00,"<output> Re-examine the initialization of `largest` to ensure it's correctly set to the first element, and consider using a more efficient approach like comparing with the first element directly instead of iterating through the list.  </output>",def find_max(numbers):\n    if numbers == []:\n        return None\n\n    largest = numbers[0]\n    for num in numbers:\n        if num > largest:\n            largest = num\n    return largest
B25EC022_q6,0,5,0.00,"<output>Consider initializing `max_val` with the first element of the list, so it's updated even when the first element is not the largest.</output>","def find_max(numbers):\n    if not numbers:\n        return None\n    max_val = numbers[0]\n    for num in numbers:\n        if num > max_val:\n            max_val = num\n    return max_val\n\nprint(find_max([6, 5, 9, 1, 7, 3]))"
B25ME048_q6,5,5,100.00,"<output> The loop should iterate over all elements, not just the first one, to find the maximum value.</output>","def find_max(numbers):\n    """"""\nReturn the largest element of ’numbers’ without using max\n().\nReturn None for empty list. \n    """"""\n    if len(numbers)==0:\n        return None\n    \n    else:\n        maxlist=[numbers[0]]\n        for i in numbers:\n            if i>maxlist[0]:\n                maxlist[0]=i\n        return maxlist[0]\n\n\n        \n    "
B25ME001_q6,1,5,20.00,<output>Check if the initial largest element is being updated correctly in case of multiple large numbers.</output>,def find_max(numbers):\n    if not numbers: \n        return None\n    \n    largest = numbers[0]  \n    for num in numbers:\n        if num > largest:\n            largest = num  
B25EE029_q6,5,5,100.00,"<output>The variable `max_count` is being reassigned to a single value, but it should hold the maximum value found so far, which is stored in `x`. Change `_` to `x` in the line `max_count = _` to fix the bug.</output>",def find_max(numbers):\n    if not numbers:      \n        return None\n    x = float('-inf')\n    for _ in numbers:\n        if _ > x:\n            max_count = _\n            x = _\n    return max_count\n\n\n
B25EE027_Q6,5,5,100.00,"<output>Consider using a two-pointer approach where you initialize one pointer at the start and another at the end of the list, then move towards each other to find the maximum element.</output>","def find_max(numbers):\n    """"""Return the largest element of ’numbers’ without using max\n    ().\n    Return None for empty list.""""""\n    if len(numbers)==0:\n        return None\n    m=numbers[0]\n    for i in range(len(numbers)):\n        if m<numbers[i]:\n            m=numbers[i]\n    return m\n\n\n# print(find_max([1, 5, 3, 9, 2])) # 9\n# print(find_max([-10, -5, -2])) # -2\n# print(find_max([]))"
B25MM001_Q6,0,5,0.00,"<output>Consider using a more efficient approach, such as comparing adjacent elements or utilizing Python's built-in sorting functions to find the maximum value.</output>","def find_max(nums):\n    if nums == []:\n        return None\n    else:\n        max = nums[0]\n        for n in nums:\n            if n>max:\n                max = n\n    return max\n\nprint(find_max([1, 5, 3, 9, 2]))\nprint(find_max([-10, -5, -2]))\nprint(find_max([]))\n"
B25ME012_q6,0,5,0.00,"<output>Consider using the built-in `sorted()` function to find the largest element, which is more efficient than iterating through the list multiple times.</output>","def find_max(num_list):\n    if num_list==[]:\n        return None\n    max=num_list[0]\n    for i in num_list:\n        if i>max:\n            max=i\n    return max\nprint(find_max([1,5,3,9,2]))\nprint(find_max([-10,-5,-2]))\nprint(find_max([]))\n    \n        "
B25DS013_Q6,0,5,0.00,"<output>Consider using a two-pointer approach, starting from both ends of the list and moving towards the center to find the maximum value efficiently.</output>","def find_max(numbers):\n    if len(numbers)==0:\n        return None\n    else:\n        k=numbers[0]\n        for i in range(0,len(numbers)):\n            if numbers[i]>k:\n                k=numbers[i]\n        return k\nprint(find_max([1, 5, 3, 9, 2]))\nprint(find_max([-10, -5, -2]))\nprint(find_max([]))\n\n"
B25EE013_q6,5,5,100.00,<output>Check if the initial largest element is being updated correctly in case of numbers with more than one element.</output>,"'''Return the largest element of ’numbers’ without using max()\nReturn None for empty list\nfind_max([1, 5, 3, 9, 2]) # 9\nfind_max([-10, -5, -2]) # -2\nfind_max([]) # None '''\n\ndef find_max(numbers):\n    if not numbers:  \n        return None\n    largest = numbers[0]\n    for num in numbers:\n        if num > largest:\n            largest = num\n    return largest\n\n               \n"
B25ME050_q6,0,5,0.00,"<output> The inner loop should iterate over each number individually, not all numbers again, to compare with the current maximum found so far.</output>","def find_max(numbers):\n    for i in range(len(numbers)):\n        for j in range(len(numbers)):\n            if i != j and numbers[i] < numbers[j]:\n                break\n        else:\n            return numbers[i]\n\nprint(find_max([1, 5, 3, 9, 2]))\nprint(find_max([-10,-5,-2]))\nprint(find_max([]))"
B25MT021_q6,0,5,0.00,"<output>Consider using a two-pointer approach to find the maximum element in the list, starting from both ends and meeting in the middle.</output>","def find_max(numbers):\n    if len(numbers) == 0:\n        return None\n    biggest = numbers[0]\n    for n in numbers:\n        if n > biggest:\n            biggest = n\n    return biggest\n\nprint(find_max([1, 5, 3, 9, 2]))\nprint(find_max([-10, -5, -2]))\nprint(find_max([]))"
