student_id,tests_passed,tests_total,score_percentage,semantic_summary,code_snippet
B25MT024_q6,4,5,80.00,"<output> The issue lies in the initial assignment of `max_number`, which assumes that the first element is always the maximum, but this assumption fails when the list is empty. Consider initializing `max_number` to a value that will be smaller than any actual number in the list, such as negative infinity. </output>","def find_max(numbers):\n    max_number=numbers[0]\n    for i in range(1,len(numbers)):\n        if numbers[i]>max_number:\n            max_number=numbers[i]\n    return max_number\n"
B25CS005_q6,0,5,0.00,"<output>Convert the input from a string to an integer using int() or float(), as input() returns a string, not a number.</output>","def find_max():\n    a=list(input(""enter no.:""))\n    a.sort(reverse=True)\n    print(a[0])\nfind_max()"
B25MT017_q6,5,5,100.00,"<output>The issue lies in the line `max_num = numbers[0]`, which assumes the first element is always the maximum, but this is not guaranteed for all lists.</output>",def find_max(numbers):\n    if not numbers:\n        return None\n    max_num = numbers[0]\n    for num in numbers:\n        if num > max_num:\n            max_num = num\n    return max_num
B25ME016_q6,0,5,0.00,"<output> The student's implementation only checks the first number and then stops, ignoring the possibility that a larger number might exist later in the list. Consider keeping track of the maximum value seen so far as you iterate through the entire list.</output>","def find_max(numbers):\n    \n    if not numbers:  \n        return None\n\n    large = numbers[0]  \n    for num in numbers[1:]:\n        if num > large:\n            large = num  \n    return large\nprint(find_max([6,7,4,9,45,-1]))"
B25EE059_q6,5,5,100.00,"<output> Check the initial value of `max_val` to ensure it's initialized with the smallest possible number, as you're comparing it with subsequent numbers in the list. </output>",def find_max(numbers):\n    if not numbers:\n        return None\n    max_val = numbers[0]\n    for num in numbers:\n        if num > max_val:\n            max_val = num\n    return max_val
B25DS027_q6,5,5,100.00,"<output>Check if the initial largest element is being updated correctly in the loop, as the first number might be the smallest instead of the largest.</output>",def find_max(numbers):\n    if not numbers:\n        return None\n\n    largest = numbers[0]\n    for num in numbers[1:]:\n        if num > largest:\n            largest = num\n    return largest
B25MM020_q6,0,5,0.00,"<output>Check if the list is empty before iterating over it, and consider using a more efficient algorithm to find the maximum value.</output>","a = eval(input(""Enter list : ""))\n\ndef find_max(lst):\n    if lst==[]:\n        return ""None""\n    for i in range (len(lst)):\n        for j in range (len(lst)-1):\n            if lst[i]>lst[j]:\n                lst[i],lst[j] = lst[j],lst[i]\n    return lst[0]\n\nprint(find_max(a))"
B25DS018_q6,0,5,0.00,"<output> The code is correctly iterating through the list to find the maximum value, but it's not utilizing the most efficient approach; it should use the built-in `max()` function instead of manually iterating through the list. Consider replacing the manual iteration with a call to `max()`, which would simplify and speed up the process. </output>","def find_max(numbers):\n    if not numbers:\n        return None\n    max = numbers[0]\n    for number in numbers:\n      if (number > max):\n         max = number\n\n    return max\n\nprint(find_max([1,5,3,9,2]))\nprint(find_max([-10,-5,-2]))\nprint(find_max([]))"
B25Me045_q6,0,5,0.00,"<output> Check that you are not trying to add a tuple or list to the total, as this will result in a TypeError. Ensure your function is only handling integers and floats. </output>","def smart_sum(*args):\n    total=0\n    for x in args :\n         if type(x) in (int,float):\n             total=total+x\n         elif type(x) in (tuple,list):\n             total=total+smart_sum(*x)\n    return total\n\n\n\n"
B25EC034_q6,0,5,0.00,"<output>Reconsider the inner loop, as it iterates through all elements, making it less efficient and unnecessary.</output>","def find_max(numbers):\n    if numbers == []:\n        return None\n        print(find_max(numbers))\n    else:\n        for ele in numbers:\n            maxi = numbers[0]\n            for r in range(len(numbers)-1):\n                if maxi < numbers[r+1]:\n                    maxi = numbers[r+1]\n        return maxi\nprint(find_max([1, 5, 3, 9, 2])) \nprint(find_max([-10, -5, -2]) )\nprint(find_max([]))\n\n"
B25ME013_q6,5,5,100.00,"<output>Consider using a two-pointer approach instead of iterating over the list, as this can lead to unnecessary comparisons and slow performance.</output>",def find_max(numbers):\n    if(len(numbers)==0):\n        return None\n    max=numbers[0]\n    for i in numbers:\n        if(i>max):\n            max=i\n    return max\n
B25DS015_q6,5,5,100.00,"<output> Review your loop condition to ensure it's updating the max value correctly, as the current implementation only checks if the first number is greater than any subsequent numbers, which won't find the actual maximum.</output>",def find_max(numbers):\n    if len(numbers) == 0:\n        return None\n    p = numbers[0]\n    for i in numbers:\n        if p < i:\n            p = i\n    return p\n
B25ME059_q6,5,5,100.00,"<output> The loop should iterate until it finds the maximum value, not just check if each subsequent number is greater than the current max; consider using a conditional to update maxxy instead of an if statement. </output>",def find_max(numbers):\n    if(len(numbers)!=0):\n        maxxy=numbers[0]\n        for i in numbers:\n            if(i>maxxy):\n                maxxy=i\n    else:\n        maxxy=None\n    return maxxy
B25DS011_q6,0,5,0.00,"<output>Check if you are updating `max` with each new number correctly, and consider using a more efficient approach like comparing with the first element initially.</output>","def find_max(numbers):\n    if len(numbers) != 0 :\n        max = numbers[0]\n        for i in numbers:\n            if max < i :\n                max = i\n        return max\n    elif numbers == [] :\n        return None\n        \n\n\nprint(find_max([1,5,3,9,2]))    #9\nprint(find_max([-10,-5,-2]))    #-2\nprint(find_max([]))             #None\n"
{B25MM017]}_q6,5,5,100.00,</output> The issue lies in the fact that you're comparing each number with the first element of the list (`largest_1 = number[0]`) instead of keeping track of the maximum value as you iterate through the entire list.,#Q6\n\n\n\ndef find_max(number):\n    \n    if not number:\n        return None\n    \n    largest_1 = number[0]\n    for num in number:\n        if num > largest_1:\n            largest_1 = num\n    return largest_1\n
B25MM002_q6,5,5,100.00,"<output>Check the initial value of `max_val` to ensure it's initialized with the first element of the list, as starting with 0 could lead to incorrect results if all numbers are negative.</output>",def find_max(numbers):\n    if not numbers:\n        return None\n    max_val = numbers[0]\n    for num in numbers:\n        if num > max_val:\n            max_val = num\n    return max_val\n\n    
B25CS025_q6,5,5,100.00,"<output>Consider using a two-pointer approach, starting from both ends of the list and moving towards the center to find the maximum value efficiently.</output>",def find_max(numbers):\n    if len(numbers)==0:\n        max=None\n    else:\n        max=numbers[0]\n    for i in numbers:\n        if i>max:\n            max=i\n    return max
B25EE053_q06,4,5,80.00,"<output>Consider using a more efficient approach, such as iterating through the list only once and keeping track of the maximum value encountered.</output>","def find_max(numbers):\n    if numbers==[]:\n        return ""None""\n    for i in numbers:\n        count=0\n        for j in numbers:\n            if i>=j:\n                count+=1\n            if count==len(numbers):\n                return i\n\n\n\n\n\n\n\n\n\n\n"
B25DS030_q6 (1),4,5,80.00,"<output>Check that you're updating `count` with each new number, not just assigning it to itself.</output>","def find_max(numbers):\n   """"""Return the largest element of’numbers’ without using max().\n   ReturnNoneforemptylist.""""""\n   count=numbers[0]\n   if not numbers:\n       return None\n   else:\n       for i in numbers:\n            if count<i:\n                count=i\n       return count"
B25EE002_q06,0,5,0.00,"<output> The variable name in the for loop condition is misspelled as 'n' instead of 'numubers', which is not defined outside the loop. Correct it to 'numbers'.</output>",def find_max(numbers):\n    if len(numubers) ==0:\n        return None\n    max_value = numbers[0]\n    for n in numbers:\n        if n>max_value:\n            max_value = n\n    return max_value\n        
B25ME039_q6,0,5,0.00,"</output> The issue lies in the function signature; the parameter name should be 'numbers' instead of 'num' to match the problem description, and also add a check for an empty list at the beginning.",def find_max(num):\n    max=0\n    for i in num:\n        if i>max:\n            max=i\n    \n    return max\n        \nfind_max()\n
B25CS029_q6,5,5,100.00,"<output> The loop iterates over each number in the list, but it starts from the first element (numbers[0]) and updates max_num only when a larger number is found. Consider starting the loop from the second element (numbers[1]) to find the largest element. </output>",def find_max(numbers):\n    if len(numbers) == 0:\n        return None\n    max_num = numbers[0]\n    for num in numbers:\n        if num > max_num:\n            max_num = num\n            \n    return max_num\n
B25CS028_q6,0,5,0.00,"<output>Consider using a two-pointer approach instead of iterating through the list, as your current implementation has a time complexity of O(n^2) due to the nested loop.</output>","def find_max(numbers):\n    \n    if len(numbers)==0:\n        return None\n    else:\n        maxi = numbers[0]\n        for j in numbers:\n            if maxi < j :\n                maxi = j\n    return maxi\n    pass\nprint(find_max([1,5,3,9,2]))\nprint(find_max([-10,-5,-2]))\nprint(find_max([]))\n        \n        "
B25EE019_q6,5,5,100.00,"<output>Consider initializing `max_val` with the first element of the list, rather than assuming it's always the smallest value.</output>",def find_max(numbers):\n    if not numbers:\n        return None\n    \n    max_val = numbers[0]\n    for number in numbers:\n        if number > max_val:\n            max_val = number\n    return max_val
B24DS035_Q6,5,5,100.00,"<output>Check if the initial max_num is being overwritten when a larger number is found, as this could lead to incorrect results.</output>",def find_max(numbers):\n    if not numbers:\n        return None\n    max_num = numbers[0]\n    for num in numbers:\n        if num > max_num:\n            max_num = num\n    return max_num\n    pass
B25EC025_q6,0,5,0.00,"<output>Sorting the list is not necessary to find the maximum element, as Python's built-in `sorted()` function returns a new sorted list and leaves the original list unchanged. Use `max()` instead.</output>","def find_max(numbers):\n    if not numbers:\n        return None\n    \n    numbers.sort()\n    return numbers[-1]\nprint(find_max([1,5,3,7,9,2,5,9]))"
B25MM015_Q6,5,5,100.00,"<output>Check if you're updating the max_num variable correctly in your loop, as it's possible that you might be comparing with the previous maximum instead of the current number.</output>",def find_max(numbers):\n    \n    if not numbers:  \n        return None\n    \n    max_num = numbers[0]  \n    \n    for num in numbers:\n        if num > max_num:\n            max_num = num\n    \n    return max_num\n\n
B25EC008_q6,5,5,100.00,"<output> Your current implementation has a time complexity of O(n^2) due to the nested loop, which is inefficient. Consider using the built-in `len()` function and iterating through the list only once to achieve an optimal solution.</output>",def find_max(numbers):\n    if(numbers==[]):\n        return None\n    else:\n        for i in numbers:\n            count=0\n            for q in numbers:\n                if(i>=q):\n                    count+=1\n            if(count==len(numbers)):\n                return i\n
B25MT018_q6,0,5,0.00,"<output>Consider using a more efficient approach, such as keeping track of the maximum value encountered so far, rather than comparing each element to the current maximum.</output>","def find_max(numbers):\n    if len(numbers)==0:\n        return\n    max=numbers[0]\n    for i in numbers:\n        if i>max:\n            max=i\n    return max\nprint(find_max([-10, -5, -2]))\n"
B25EE033_q6,1,5,20.00,<output>The variable 'numbers' is not defined within the function scope; consider initializing it with the list of numbers or passing it as an argument.</output>,def find_max(number):\n    \n    if len(number) == 0:\n        return None\n    \n    largest = number[0]\n    \n    for num in numbers[1:]:\n        if num > largest:\n            largest = num\n            \n    return largest
B25DS040_q6,5,5,100.00,"<output>Consider using the built-in `len()` function to check if the list is empty, and initialize `maximum` with a value that will always be smaller than any number in the list, such as negative infinity.</output>",def find_max(numbers):\n    if not numbers:\n        return None\n    maximum = numbers[0]\n    for num in numbers:\n        if num > maximum:\n            maximum = num\n    return maximum
B25EC011_Q6,5,5,100.00,"<output>Consider using a two-pointer approach to find the maximum value, starting from both ends of the list and moving towards the center.</output>","def find_max(numbers):\n    """"""\n    Return the largest element of 'numbers' without using max().\n    Return None for empty list.\n    """"""\n    if not numbers:\n        return None\n    current = numbers[0]\n    for x in numbers[1:]:\n        if x > current:\n            current = x\n    return current\n"
B25EE038_Q6,0,5,0.00,"<output>Consider using a single pass through the list to keep track of the maximum value seen so far, rather than iterating over the entire list again.</output>","def find_max_in_list(numbers):\n    max_num = numbers[0]\n    for n in numbers:\n        if n > max_num:\n            max_num = n\n    return max_num\n\n\n\nnums = [int(x) for x in input(""Enter numbers separated by spaces: "").split()]\nprint(""Maximum number is:"", find_max_in_list(nums))"
B25CS020_q6,5,5,100.00,"<output>Consider using a more efficient approach, such as sorting the list first and then returning the last element, which would eliminate the need to iterate through the entire list.</output>",def find_max(numbers):\n    if numbers == []:\n        return None\n    max = numbers[0]\n    for i in numbers:\n        if i>max:\n            max = i\n            \n    return max\n\n\n\n
B25EE021_q6,0,5,0.00,"<output>Consider using a two-pointer approach instead of a single variable to keep track of the maximum value, as this can lead to inefficiencies when dealing with large lists.</output>","def find_max(numbers):\n    if numbers == []:\n        return None\n    j = numbers[0]\n    for i in numbers[1:]:\n        if i>j:\n            j = i\n    return j \n\nprint(find_max([-10, -5, -2]))   "
B25EE025_q6,0,5,0.00,"<output> The issue lies in comparing strings (`chr`) with integers (`max`), which is causing the ""list index out of range"" error. The comparison should be between integers, not characters. </output>","def find_max(numbers):\n    max = numbers[0]\n    for chr in numbers:\n        if chr > max:\n            max = chr\n    return max\n\n#example\nprint(find_max([1,5,3,9,2]))\nprint(find_max([-10,-5,-2]))"
B25MM023_q6,4,5,80.00,"<output> The issue lies in initializing `max` with the first element of the list, assuming it will always have at least one element; however, if the list is empty, this approach results in an ""IndexError: list index out of range"" exception. </output>","def find_max(numbers):\n    max=numbers[0]\n    for x in numbers:\n        if x>max:\n            max=x\n    return max\nfind_max([-10, -5, -2])"
B25DS001_q6,5,5,100.00,"<output>Consider using a two-pointer approach to find the maximum value, starting from both ends of the list and meeting in the middle.</output>",def find_max(l):\n    if len(l)==0:\n        max=None\n    else:\n        max=l[0]\n        for i in l:\n            if i>max:\n                max=i\n            else:\n                pass\n    return max
B25CS026_q6,0,5,0.00,"<output> The nested loop is not necessary and can lead to unnecessary comparisons, consider using a single pass through the list with an index that keeps track of the maximum value found so far. </output>","def find_max(numbers):\n    if numbers == []:\n        return None\n    for i in range(len(numbers)):\n        for j in range(len(numbers)):\n            if numbers[i]>numbers[j]:\n                numbers[i],numbers[j] = numbers[j],numbers[i]\n    return numbers[0] \nprint(find_max([1,5,3,9,2]))\nprint(find_max([-10,-5,-2]))\nprint(find_max([]))\n"
B25MT005_q6,5,5,100.00,"<output>Consider using the built-in `sorted` function to find the largest element, and then access its last index to get the maximum value.</output>","def find_max(numbers):  # To find the maximum in all numbers of a list\n    """"""\n    Return the largest element of 'numbers' without using max().\n    Return None for empty list.\n    """"""\n    if not numbers:  # If there are no numbers in the list\n        return None  # Then return none as output\n    maximum = numbers[0]  # Takes the first value of the list to find maximum and iterates through the list in a manual way\n    for num in numbers:  # Checks the numbers in the list\n        if num > maximum:  # If taken number is maximum then finalises it\n            maximum = num\n    return maximum\n"
B25EC044_Q6,0,5,0.00,"<output> The loop variable `Max` is initialized with the first element of the list, but it should be initialized with a value that can hold the maximum number, such as negative infinity or a very small number. </output>","\n\ndef find_max(numbers):\n    if len(numbers)==0:\n        return None\n    else:\n        Max=numbers[0]\n        for i in numbers:\n            if i>Max:\n                Max=i\n        return Max\n\nprint(find_max([1, 5, 3, 9, 2])) # 9\nprint(find_max([-10, -5, -2])) # -2\nprint(find_max([])) # None\n"
B25EC038_Q6,0,5,0.00,"<output>Consider using a two-pointer approach to find the maximum element in the list, as your current implementation has a time complexity of O(n^2) due to the nested loop.</output>","def find_max(numbers):\n    if len(numbers) == 0:\n        return None\n    else:\n        maxi = numbers[0]\n        for i in range(len(numbers)):\n            if numbers[i]>maxi:\n                maxi = numbers[i]\n            else:\n                maxi = maxi\n        return maxi\n\nprint(find_max([1,5,3,9,2]))\nprint(find_max([-10,-5,-2]))\nprint(find_max([]))"
B25ME046_q6,0,5,0.00,"<output>Consider initializing `largest` with the first element of the list instead of comparing it to `n[0]`, as this would lead to a wrong result if all elements in the list are smaller than the first one.</output>","def find_max(n:list):\n    if len(n)==0:\n        return ""None""\n    else:\n        largest=n[0]\n        for i in range (len(n)):\n            if n[i]>largest:\n                largest=n[i]\n        return largest\n\nprint(find_max([1,5,3,9,2]))#9\nprint(find_max([-10,-5,-2]))#-2\nprint(find_max([]))#none\n"
s25ma010_q6,0,5,0.00,"</output> The issue lies in the initial assignment of `num` to the first element of the list, assuming it's always the largest, which is not guaranteed for an empty list.","def find_max(numbers):\n    num=numbers[0]\n    for i in numbers:\n        if i >= num:\n            num = i\n    return num\nnumbers=[1,3,4,8]           \nprint(find_max([-10,-5,-2]))"
B25EE028_q6,0,5,0.00,"<output> The student's code sorts the entire list in ascending order, which is unnecessary and incorrect for finding the maximum element. Instead, they should use a single pass through the list to find the largest element. </output>",def find_max(num):\n    num = sorted(num)\n    if num == []:\n        return None\n    return num[-1]\nprint(find_max([]))\n    
B25EE058_q6,0,5,0.00,"<output> You are trying to find the maximum element in a list using `remove_duplicates` function which is meant to remove duplicates from a list. Instead, use the built-in `max()` function with a custom logic to handle empty lists. </output>",def remove_duplicates(items):\n    return list(set(items))\n
B25DS005_q6,5,5,100.00,"<output> The code is using a linear search algorithm, which has a time complexity of O(n), whereas the problem can be solved with a single pass through the list to find the maximum element, reducing the time complexity to O(1) if the input list is sorted. </output>",def find_max(numbers):\n    if len(numbers) == 0 :\n        return None\n    maxnum = numbers[0]\n    for i in numbers :\n        if i > maxnum:\n            maxnum = i\n    return maxnum\n\n\n                
B25EC027_q6,0,5,0.00,"<output>Consider using a more efficient approach, such as sorting the list first and then returning the last element.</output>","def find_max(numbers):\n    if len(numbers)==0:\n        return None\n    for i in range(len(numbers)):\n        for j in range(i,len(numbers)):\n            if numbers[i]<numbers[j]:\n                numbers[j],numbers[i]=numbers[i],numbers[j]\n    return numbers[0]\nprint(find_max([1,5,3,9,2]))\nprint(find_max([-10,-5,-2]))\nprint(find_max([]))\n"
B25CS011_q6,5,5,100.00,"<output>Check if the list is empty before iterating over it, as the current implementation will return None for an empty list.</output>",def find_max(numbers):\n    curr_great= None\n    for i in numbers:\n        if  curr_great== None or i > curr_great:\n            curr_great = i\n    return curr_great\n\n\n
B25MM016_Q6,0,5,0.00,"<output>Consider using a single pass through the list to keep track of the maximum value seen so far, rather than iterating over each element in the list twice.</output>","def find_max(l):\n    p=len(l)\n    n=0\n    if len(l)==0:\n        return ""None""\n    for j in range(p):\n        for i in l:\n\n            if abs(i)>n:\n                n=i\n            else:\n                n=n\n    return n\nprint(find_max([1,5,3,9,2]))\nprint(find_max([-10,-5,-2]))\nprint(find_max([]))"
B25EC014_q6,5,5,100.00,"<output> You are using `max()` which is exactly what you're trying to avoid, instead use a two-pointer approach where one pointer starts from the beginning and another from the end of the list and move towards each other. </output>","def find_max(numbers):\n    """"""\n    Return the largest element of ’numbers’ without using max\n    ().\n    Return None for empty list.\n    """"""\n    if len(numbers) ==0:\n        return None\n    return(max(numbers))\n\n"
B25EC028_q6,0,5,0.00,"<output> The loop iterates over each number in the list, but it starts with the first number as the maximum, which is not necessarily the largest. Consider starting with the last element of the list instead. </output>","def find_max(numbers):\n    if len(numbers)==0:\n        return None\n    else:\n        maximum=numbers[0]\n        for i in numbers:\n            if i>maximum:\n                maximum=i\n    return maximum\nprint(find_max([1,5,3,9,2]))\nprint(find_max([-10,-5,-2]))\nprint(find_max([]))\n    "
S25MA014_q6,5,5,100.00,"<output> The loop iterates through each number, but it should start from the second number (index 1) to avoid comparing the first number with itself initially.</output>",def find_max(numbers):\n    if numbers==[]:\n        return None\n    a=numbers[0]\n    for n in numbers:\n        if n>a:\n            a=n\n    return a
B25CS036_q6,5,5,100.00,"<output>Consider using the built-in `len()` function to check if the list is empty before iterating over it, as your current implementation will raise an ""index out of range"" error when the list has only one element.</output>","def find_max(numbers):\n    """"""\nReturn the largest element of ’numbers’ without using max\n().\nReturn None for empty list.\n""""""\n    if numbers == []:\n        return None\n    maxx = numbers[0]\n    for numb in numbers :\n        if numb > maxx:\n            maxx = numb\n    return maxx               "
B25MM012_Q6,1,5,20.00,"<output>Consider a more efficient approach, such as using the built-in `max()` function with a generator expression to find the largest element in one pass.</output>",def find_max(numbers):\n    if not numbers:\n        return None\n    biggest = numbers[0]\n    for num in numbers:\n        if num > biggest:\n            biggest = num\n            return biggest
B25CS043-q6,0,5,0.00,"<output> The issue lies in the fact that your function `find_max` is not defined anywhere in the code, whereas you're trying to use it to find the maximum element in the list. You should replace `find_max` with a name like `return_max`. </output>",def is_palindrome(s):\n    s = s.lower()\n    if s == s[::-1]:\n        return True\n    else:\n        return False
B25ME052_q6,4,5,80.00,"<output> The variable 'none' should be 'None', as Python is case-sensitive and 'none' is not a defined name, which is causing the NameError.</output>",def find_max(numbers):\n    if len(numbers) == 0:\n        return none\n        \n    largest = numbers[-1]\n    for x in numbers:\n        if x > largest:\n            largest = x\n    return largest\n    \n\n\n         
