student_id,tests_passed,tests_total,score_percentage,semantic_summary,code_snippet
B25EE022_q6,0,5,0.00,"<output>Consider using a single pass through the list to find the maximum value, starting from the last element and moving backwards, as this approach avoids unnecessary comparisons.</output>","def find_max(numbers):\n\n    l=len(numbers)\n    \n    if l==0:\n        return None \n    else:\n        maxi=numbers[0]\n        for i in range(1,l):\n            if maxi<numbers[i]:\n                maxi=numbers[i]\n        return maxi    \n    \n\nprint(find_max([1,5,3,9,2]))\nprint(find_max([-10,-5,-2]))\nprint(find_max([]))\n"
B25DS037_Q6.py,0,5,0.00,"<output> The nested loop is not necessary to find the maximum element; a simple iteration would suffice, and using `len(numbers) - 1` instead of just `numbers[len(numbers) - 1]` will avoid an IndexError. </output>","def find_max(numbers):\n    for j in range (len(numbers)):\n       for i in range (len(numbers)-1):\n            if numbers[i]>numbers[i+1]:\n               numbers[i],numbers[i+1]=numbers[i+1],numbers[i]\n            else:\n                i==j\n                continue\n    if numbers == []:\n        return None\n    return numbers[(len(numbers))-1]\n\n\nprint(find_max([1,5,3,9,2]))\nprint(find_max([-10,-5,-2]))\nprint(find_max([]))"
B25EE055_q6,5,5,100.00,"</output> The code is using a linear scan approach, which has a time complexity of O(n), making it efficient for small lists but potentially slow for large ones. Consider using a more efficient data structure like a heap or sorting the list first to achieve a better time complexity.",def find_max(numbers):\n    if numbers == []:\n        return None\n    temp = numbers[0]\n    for i in numbers :\n        if i > temp:\n            temp = i\n    return temp\n
B25EC012_q6,5,5,100.00,"<output>Consider checking the first element of the list against negative infinity instead of just the next number, to handle edge cases where the maximum is less than any other number in the list.</output>",def find_max(numbers):\n    if not numbers:\n        return None\n    max_num = numbers[0]\n    for num in numbers[1:]:\n        if num > max_num:\n            max_num = num\n    return max_num\n\n
B25EC043_q6,4,5,80.00,"<output> The student's code starts by assuming the first element of the list is the maximum, which will fail when the list is empty, causing an IndexError. Instead, consider checking if the list is empty before initializing max_no. </output>",def find_max(numbers):\n    max_no=numbers[0]\n    for i in numbers:\n        if i>max_no:\n            max_no=i\n    return max_no
B25MT002_q6,5,5,100.00,"<output>Consider using a two-pointer approach, starting from both ends of the list and moving towards the center to find the largest element efficiently.</output>","def find_max(numbers):\n    """"""\n    Return the largest element of ’numbers’ without using max\n    ().\n    Return None for empty list""""""\n    if numbers==[]:\n        return None\n    rand=numbers[0]\n    for i in range(len(numbers)):\n        if numbers[i]>rand:\n            rand=numbers[i]\n            \n    return rand\n    \n"
B25DS031_q6,5,5,100.00,"<output>Consider using a two-pointer approach instead of iterating through the list, as your current implementation has a time complexity of O(n^2) due to the nested loop.</output>","def find_max(numbers):\n """"""\n Return the largest element of ’numbers’ without using max().\n \n Return None for empty list.\n """"""\n if numbers==[]:\n     return None\n largest=numbers[0]\n for num in numbers[1:]:\n     if num>largest:\n         largest=num# updating the largest if any number grater then first number\n return largest\n"
B25ME005_q6,4,5,80.00,"<output> Check if you're returning the largest element from the entire list, not just the elements after the first one.</output>","def find_max(numbers):\n    maxmum = numbers[0]\n    for i in range(1, len(numbers)):\n        if numbers[i] > maxmum:\n            maxmum = numbers[i]\n    return maxmum\n\n\n"
B25EE046_Q6,3,5,60.00,"<output>Consider initializing the maximum value with the first element of the list, instead of setting it to 0, to avoid potential issues when dealing with negative numbers or zero.</output>",def find_max(numbers):\n    m=0\n    for i in numbers:\n        if i>m:\n            m=i\n    return m\n
B25MT011.q6,0,5,0.00,"<output> The issue lies in the fact that you're using `count = numbers[0]` instead of `count = float('-inf')`, which is not initialized with a specific value, causing it to be overwritten by the first element in the list. This approach will always return the first element as the maximum, not the largest. </output>","def find_max(numbers):\n    if numbers==[]:\n        return None\n    count=numbers[0]\n    for k in numbers:\n        if k>count:\n            count=k\n                   \n    return count\nprint(find_max([1,5,3,9,2]) )\nprint(find_max([-10, -5, -2]) )\nprint(find_max([]) )"
B25DS035_q6,0,5,0.00,"<output>Consider using a two-pointer approach, starting from both ends of the list and meeting in the middle to find the largest element without comparing every pair of elements.</output>","def find_max(numbers):\n    if len(numbers)==0:\n        return ""None""\n    else:\n        m=numbers[0]\n        for i in range(0,len(numbers)):\n            if numbers[i]>m:\n                m=numbers[i]\n        return m\nprint(find_max([1,5,3,9,2]))\nprint(find_max([-10,-5,-2]))\nprint(find_max([]))\n"
B25MM030_Q6,0,5,0.00,"<output> Make sure to update the initial largest variable with each new number as you iterate through the list, instead of just using the first number as the starting point.  </output>","def find_max(numbers):\n    if not numbers:\n        return None\n    largest = numbers[0]\n    for num in numbers:\n        if num > largest:\n            largest = num\n    return largest\n    \nprint(find_max([1,5,3,9,2]))\nprint(find_max([-10,-5,-2]))\nprint(find_max([]))\n"
B25EC037_q6,5,5,100.00,"<output> Check if the initial value `n` is negative, as a large number will always be greater than a small one. </output>",def find_max(numbers):\n    n=-10**10000    # a really small number which is not likely a part of the list\n    if numbers==[]:\n        return None\n    for i in numbers:\n        if i>n:\n            n=i\n        else: \n            pass\n    return n\n\n
B25CS039_q6,0,5,0.00,"<output>Consider using a more efficient approach, such as comparing adjacent elements instead of scanning the entire list, to reduce the time complexity of your algorithm.</output>","def find_max(numbers):\n    if(len(numbers)==0):\n        return None\n    else:\n        m=numbers[0]\n        for i in numbers:\n            if(i>m):\n                m=i\n        return m\nprint(find_max([1, 5, 3, 9, 2])) # 9\nprint(find_max([-10, -5, -2])) # -2\nprint(find_max([])) # None"
B25EC041_q6,5,5,100.00,"<output>Consider using a two-pointer approach instead of iterating through the list from both ends, as your current implementation has a time complexity of O(n^2) due to the nested loop.</output>","def find_max(numbers):\n    if(len(numbers)==0):\n        return None\n    max=numbers[0]\n    for x in range(1,len(numbers)):\n        if(numbers[x]>max):\n            max=numbers[x]\n    return max"
B25EE052_q6,0,5,0.00,"<output>Consider using a more efficient approach, such as comparing the first and last elements of the list to determine if it's sorted in ascending order, which would allow you to find the maximum element without iterating over the entire list.</output>","def find_max(numbers):\n    if numbers == []:\n        return None\n    else:\n        mx_nu = numbers[0] #i have assumed 1st number as maxnum  \n    for i in numbers:\n        if i > mx_nu :\n            mx_nu = i\n        \n    return mx_nu\n        \nprint(find_max([1, 5, 3, 9, 2]))\n# 9\nprint(find_max([-10, -5, -2]))\n# -2\nprint(find_max([]))\n#None"
B25DS033_Q6,0,5,0.00,"<output>Check if the initial largest variable is being assigned the first element of the list, and consider using the built-in `len()` function to handle edge cases where the list might be empty.</output>","def find_max(numbers):\n    if not numbers:\n        return None\n    largest = numbers[0]\n    for num in numbers:\n        if num > largest:\n            largest = num\n    return largest\n    \nprint(find_max([1,5,3,9,2]))\nprint(find_max([-10,-5,-2]))\nprint(find_max([]))"
B25ME045_q6,5,5,100.00,"</output> The student's code is iterating over all elements to find the maximum, which is not necessary; they should initialize `maximum` with the first element and only update it if a larger number is found.",def find_max(numbers) :\n    if numbers==[] :\n        return None\n    maximum=numbers[0]\n    for i in numbers :\n        if i>maximum :\n            maximum=i\n    return maximum\n\n
B25ME021_q6,0,5,0.00,"<output> The code is correctly finding and printing the highest number in the list, but it's not returning the value as required by the problem statement; instead, it should return the last element of the sorted list.</output>","#find max number\n\n\ndef find_max(numbers):\n    numbers.sort()\n    if numbers !=[]:\n        \n       print(""heighest number present in the given list is : "",numbers[-1])\n    else:\n       print(""none"")\nprint(find_max([-1,-2,-3]))\n"
B25EC021_q6,0,5,0.00,"<output>Check if the variable name 'max' is in the same scope as the loop, and consider using a more Pythonic approach like `return max(numbers) if numbers else None` to avoid reassigning the variable.</output>",def max_numbers(numbers):\n    max = 0\n    if len(numbers) ==0 : return None\n    for i in numbers:\n        if max < i: max = i\n    return max
B25MT006_Q6,0,5,0.00,"<output>Check the type of `n` in the line `for char in n:` to ensure it's a sequence of numbers, not individual characters.</output>","def find_max(n):\n    if n == []:\n        return None\n    else:\n        maxno = n[0]\n        for char in n:\n            if char>maxno:\n                maxno = char\n        return maxno\n           \nprint(find_max([1,5,3,9,2]))\nprint(find_max([-10,-5,-2]))\nprint(find_max([]))\n        \n            "
B25EC015_q6,4,5,80.00,"<output>Consider using the built-in `len()` function to check if the list is empty before processing its elements, as your current implementation does not handle this case correctly.</output>","def find_max(n):\n    if len(n)!=0:\n        m=n[0]\n        for i in n:\n            if i>m:\n                m=i\n        return(m)\n    return(""None"")\n"
B25MT010_q6,4,5,80.00,"<output>Consider changing the comparison to `max = numbers[i + 1] if numbers[i] < numbers[i + 1] else max` to ensure that you're updating the maximum value correctly, and also consider using a more efficient algorithm like the two-pointer technique or sorting.</output>","def find_max(numbers):\n    if len(numbers)==0:\n        return(""None"")\n    max=numbers[0]\n    for i in range(len(numbers)-1):\n        if numbers[i]<numbers[i+1]:\n            max=numbers[i+1]\n        else:\n            continue\n    return(max)\n\n            \n"
b25cs015.q6,0,5,0.00,"<output>Check if the function is designed to handle the case when the input list contains non-numeric values, as the current implementation will throw an error when encountering such values.</output>",def find_max(numbers):\n    if not numbers:\n        return None\n    max_num = numbers[0]\n    for num in numbers:\n        if num > max_num:\n            max_num = num\n    return max_num\n
B25CS010_q6,5,5,100.00,"<output>Check if you're actually returning the largest number, not checking if it's the only one greater than itself.</output>","def find_max(numbers):\n    """"""\n    Return the largest element of ’numbers’ without using max\n    ().\n    Return None for empty list.\n    """"""\n    return None if len(numbers) == 0 else [i for i in numbers if len([j for j in numbers if j > i]) == 0][0]\n"
B25ME051_q6,0,5,0.00,"<output>Consider using a two-pointer approach instead of iterating through the list once, which has a time complexity of O(n), to improve efficiency.</output>","def find_max(numbers):\n    if len(numbers) == 0:\n        return None\n    biggest = numbers[0]\n    for n in numbers:\n        if n > biggest:\n            biggest = n\n    return biggest\n\nprint(find_max([1, 5, 3, 9, 2]))\nprint(find_max([-10, -5, -2]))\nprint(find_max([]))"
B25MM028_q6,0,5,0.00,"<output> The nested loop is unnecessary and can lead to O(n^2) complexity, whereas a single pass through the list would suffice, making it more efficient. </output>","def find_max(numbers):\n    max=None\n    for i in numbers:\n        for j in numbers:\n            if j>i:\n                max=j\n    return max\nprint(find_max([1,5,3,9,2]))\nprint(find_max([-10,-5,-2]))\nprint(find_max([]))\n            "
B25CS042_Q6,5,5,100.00,"<output> Consider using a two-pointer approach to find the maximum element in the list, as your current implementation has a time complexity of O(n^2) due to the nested loop.</output>","def find_max(numbers):\n    if len(numbers)==0:\n        return None\n    maxi=numbers[0]\n    for i in numbers:\n        if i > maxi:\n            maxi = i\n    return maxi\n\nfind_max([1, 5, 3, 9, 2]) # 9\nfind_max([-10, -5, -2]) # -2\nfind_max([])"
b25cs049_q6,0,5,0.00,"<output>Consider initializing the maximum value with the first element of the list instead of 0, as this could lead to incorrect results when the first element is negative or zero.</output>","def find_max(numbers):\n    if not numbers:\n        return None\n    n = numbers[0]\n    for num in numbers[1:]:\n        if num > n:\n            n = num\n    return n\n\nprint(find_max([1,5,3,9,2])) #9\nprint(find_max([-10,-5,-2])) #-2\nprint(find_max([])) #None"
S25MA001__q6,0,5,0.00,"<output> You are trying to use the non-existent variable 'none' instead of Python's built-in None, which is used for representing the absence of a value. Replace 'none' with 'None'.</output>","def find_max(numbers):\n    if not numbers:\n        return none\n    max_no = numbers[0]\n    for number in numbers :\n        if number > max_no:\n            max_no = number\n    return max_no\n\ns1 = [1,5,7,9,3,5,6]\nr1 = find_max(s1)\nprint(r1)\n    "
(B25DS042)_Q6,0,5,0.00,<output>The student's function should be defined as a standalone function instead of a method within a class.</output>,"''' question no. 5 '''\ndef max_find(l):\n    l=list(l)\n    m=l[0]\n    for i in l :\n        if i>m :\n            m=i\n    return m\n\n\nprint(max_find([1,2,3,8,6,9,3,5]))"
B25EC024_q6,5,5,100.00,"<output>Consider using a single pass through the list to keep track of the maximum value seen so far, rather than comparing each element with the current maximum.</output>","def find_max(numbers):\n    if len(numbers) == 0:\n        return None\n    max_numbers = numbers[0]\n    for i in numbers:\n        if i > max_numbers:\n            max_numbers = i\n    return max_numbers\nfind_max([1,5,3,9,2])\nfind_max([-10,-5,-2])\nfind_max([])\n        "
B25DS003_q6,5,5,100.00,"<output>Consider using a more efficient algorithm, such as sorting the list first and then returning the last element.</output>",def find_max(numbers):\n    if numbers ==[]:\n        return None\n    largest = numbers[0]\n    for number in numbers:\n        if number>largest:\n            largest = number\n    return largest\n\n        
B25CS034_q6,5,5,100.00,"<output> The loop iterates over each number in the list, but it doesn't keep track of the maximum value seen so far; instead, it updates `m` only when a smaller number is found, which will never happen. Update `m` to store the largest number encountered. </output>",def find_max(numbers):\n    \n    if numbers==[]:\n        return None\n    else:\n        m=numbers[0]\n        for k in numbers:\n            if k>m:\n                m=k\n    return m\n\n
B25DS019_q6,5,5,100.00,"<output>Consider using a two-pointer approach instead of iterating through the list multiple times, which can be optimized to find the maximum element in O(n) time complexity.</output>",def find_max(numbers):\n    if len(numbers)==0:\n        return None\n    else:\n        max=numbers[0]\n        for i in range (len(numbers)):\n            if max<numbers[i]:\n                max=numbers[i]\n    return max
B25ME043_q6,5,5,100.00,"<output> Review your loop condition; you're updating `slt` with each new value instead of keeping track of the maximum seen so far, leading to unnecessary iterations.</output>",def find_max(numbers) :\n    if  len(numbers)==0 :\n        return None\n    slt=numbers[0]\n    for i in numbers :\n        if i>slt :\n            slt=i\n    return slt    
B25EC013_q6,5,5,100.00,"<output>Consider using a more efficient approach, such as the two-pointer technique, to find the maximum value in the list.</output>","def find_max(numbers):\n    if not numbers:\n        return None\n    else:\n        n = len(numbers)\n        for i in range(n-1):\n            for j in range(n-i-1):\n                if numbers[j] < numbers[j+1]:\n                    numbers[j], numbers[j+1] = numbers[j+1], numbers[j]\n        return numbers[0]"
B25DS026.q6,0,5,0.00,"<output>Check if the module 'B25DS026' exists in your Python environment, as it seems to be required for the function to work.</output>","def find_max(numbers):\n    if not numbers:           \n        return None\n    \n    max_number = numbers[0]\n    for number in numbers:\n        if number > max_number:\n            max_number = number\n    return max_number\n\nprint(find_max([1, 5, 3, 9, 2]))   \nprint(find_max([-10, -5, -2]))     \nprint(find_max([]))                "
B25ME041_q6,5,5,100.00,"</output> The student's code is using a linear search approach, which has a time complexity of O(n), making it inefficient for large lists. Consider implementing a more efficient algorithm like finding the maximum element in a single pass by initializing with the first element and comparing each subsequent element.",def find_max(numbers):\n    if numbers==[]:\n        return None\n    a=numbers[0]\n    for n in numbers:\n        if n>a:\n            a=n\n    return a
B25CS062_q6,0,5,0.00,"<output>Consider using a more efficient algorithm, such as sorting the list first and returning the last element, to avoid checking every number individually.</output>","def find_max(numbers):\n    if numbers==[]:\n        return None\n    max=numbers[0]\n    for i in numbers:\n        if i>max:\n            max=i\n    return max\nprint(find_max([1,5,3,9,2]))\nprint(find_max([-10,-5,-2]))\nprint(find_max([]))"
B25ME004_q6,0,5,0.00,"<output>Consider using the built-in `len()` function to get the length of the list and then iterate through the list, comparing each number with the first one, instead of iterating through the entire list from the beginning.</output>","def find_max(numbers):\n    if not numbers:\n        return None\n    max=numbers[0]#assumption\n    for num in numbers:\n        if num>max:\n            max=num\n    return max\nprint(find_max([1,5,3,9,2]))\nprint(find_max([-10,-5,-2]))\nprint(find_max([]))\n            "
S25MA004_q6,0,5,0.00,"<output>The loop should iterate over all elements, not just from index 1, to ensure the largest number is found.</output>","def find_max(numbers):\n    """"""Return the largest element of ""numbers"" without using max().\nReturn None for empty list.\n""""""\n    if not numbers:\n        return None\n    max=numbers[0]\n    for num in numbers[1:]:\n        if num >max:\n            max=num\n    return max\n            \nprint(find_max([1,5,3,9,2]))\nprint(find_max([-10,-5,-2]))\nprint(find_max([]))\n"
B25EE020_q6,0,5,0.00,"<output> The loop iterates through each number once, but it should start from the second number (index 1) to find the maximum, not the first one. Try changing `max = numbers[0]` to `max = numbers[1]` and then iterate through the rest of the list. </output>","def find_max(numbers):\n    if (numbers == []):\n        return None\n    else:\n        max = numbers[0]\n        for i in numbers:\n            if i>max:\n                max = i\n        return max\n\nprint(find_max([1, 5, 3, 9, 2]))\nprint(find_max(([-10, -5, -2])))\nprint(find_max([]))"
q6,5,5,100.00,"<output> The loop iterates through each number, but it should also consider the last number as a potential maximum if the list only contains one element. </output>",def find_max(numbers):\n    if len(numbers) == 0:\n        return None\n    max_num = numbers[0]\n    for num in numbers:\n        if num > max_num:\n            max_num = num\n    return max_num\n
B25CS061_q6,4,5,80.00,"<output> The issue lies in the initial assumption that `numbers[0]` is always a valid index, but when the list is empty, it raises an `IndexError`. Consider handling this edge case by checking if the list is not empty before proceeding with the algorithm. </output>",def find_max(numbers):\n    maxi=numbers[0]\n    for num in numbers:\n        if num>maxi:\n            maxi=num\n    return maxi
B25MT008_q6,5,5,100.00,"<output>Consider using a more efficient approach, such as keeping track of the maximum value encountered so far, rather than comparing each number with the current maximum.</output>",def find_max(numbers):\n    if numbers != []:\n        m = numbers[0]\n        for i in numbers:\n            if i > m:\n                m = i\n        return m\n    elif numbers == []:\n        return None
B25ME014_q6.py,0,5,0.00,"<output>It seems like you're using a module named 'B25ME014_q6' which is not defined anywhere in your code; however, based on the problem description, it should simply be 'numbers'.</output>","def find_max(numbers):\n    """"""\n    Return the largest element of 'numbers' without using max\n    ().\n    Return None for empty list.\n    """"""\n    if not numbers:\n        print(""None"")\n        return(None)\n    \n    max=int(numbers[0])\n    for i in numbers:\n        if i>max:\n            max=i\n    \n    return(max)\n    pass\n            \n\n\n\n\n\n"
B25MM008_Q6,0,5,0.00,"<output>Consider adding an else clause to handle the case where the loop completes without updating the largest variable, which would happen if all numbers in the list are equal.</output>","def find_max(numbers):\n    if not numbers:\n        return None\n    largest = numbers[0]\n    for num in numbers:\n        if num > largest:\n            largest = num\n    return largest\n    \nprint(find_max([1,5,3,9,2]))\nprint(find_max([-10,-5,-2]))\nprint(find_max([]))"
S25MA008 Q6,0,5,0.00,"<output>Consider using a two-pointer approach to find the maximum element, starting from both ends of the list and moving towards the center.</output>","def find_max(numbers):\n    if len(numbers)==0:\n        return None\n    else:\n        b=len(numbers)\n        c=numbers[0]\n        for i in range (b):\n            if c<numbers[i]:\n                c=numbers[i]\n        return c\nprint(find_max([1,5,3,9,2])) \nprint(find_max([-10,-5,-2])) \nprint(find_max([]))"
B25EE016_q6,0,5,0.00,"<output> The issue lies in comparing characters instead of numbers, as the function expects a list of integers but is being passed a list of characters. Change `if char > max:` to `if num > max:`, where `num` is the current number in the iteration. </output>","def find_max(numbers):\n    max=numbers[0]\n    for char in numbers :\n        if char>max:\n            max=char\n            \n    return max\n    \nprint(find_max([-1,-2,-3,-4,-5,-6,-7,0]))\n"
B25ME027_Q6,4,5,80.00,"<output>Check if you are iterating through the entire list by changing `i + 1` to `i`, as this could lead to an IndexError when `i` is the last index of the list.</output>",def find_max(numbers):\n    max=numbers[0]\n    for i in range (len(numbers)):\n        try:\n            if numbers[i+1]>numbers[i]:\n                max=numbers[i+1]\n        except:\n            continue\n    return max\n\n            
B25EE030-q6,0,5,0.00,"<output>Consider using the built-in `sorted()` function to find the maximum value, which is more efficient than iterating through the list manually.</output>","def find_max(numbers):\n    if numbers==[]:\n        return None\n    max= numbers[0]\n    for num in numbers:\n        if num>max:\n            max=num\n    return max\n\n#test cases\nprint(find_max([1,5,3,9,2]))\nprint(find_max([-10,-5,-2]))\nprint(find_max([]))\n"
B25MT027_q6,3,5,60.00,"<output> The issue lies in the range of your for loop, which should go up to `len(numbers)`, not `len(numbers) - 1`. Try changing it to `range(1, len(numbers))` to fix the error.</output>","def find_max(numbers):\n    c=numbers[0]\n    for i in range(1,len(numbers)-1):\n        if numbers[i]>c:\n            c=numbers[i]\n    return c\n""""""\nReturn the largest element of ’numbers’ without using max\n().\nReturn None for empty list.\n""""""\npass\n"
B25MT026_q6,5,5,100.00,"<output>Consider using a built-in function like `max()` with a default value to return None if the list is empty, and also consider using a more efficient algorithm for finding the maximum element in the list.</output>","def find_max(numbers):\n    """"""\n    Returns the largest element of 'numbers'\n    Returns None for empty list\n    """"""\n\n    if numbers:\n        maximum = numbers[0]\n    \n        for num in numbers:\n            if isinstance(num, int) or isinstance(num, float):\n                if num > maximum:\n                    maximum = num\n\n        return maximum\n    \n# print(find_max([1, 5, 3, 9, 2]))          # 9\n# print(find_max([-10, -5, -2]))            # -2\n# print(find_max([]))                       # None\n"
