student_id,tests_passed,tests_total,score_percentage,semantic_summary,code_snippet
B25EE026_q29,5,5,100.00,<output>Consider initializing `nes_list` with the first row of Pascal's triangle (`[1]`) instead of an empty list to ensure the correct calculation of each subsequent row.</output>,"""""""\n Return the first n rows of Pascal’s triangle as a list of\n lists.\n For n <= 0, return [].\n""""""\ndef pascal_triangle(n):\n    lis=[]\n    nes_list=[1]\n    if n<=0:\n        return []\n    for i in range(n):\n        lis.append(nes_list)\n        nes_list=[]\n        a=[0]+lis[i]+[0]\n        for j in range(len(a)-1):\n            s=a[j]+a[j+1]\n            nes_list.append(s)\n            s=0\n    return lis\n    "
B25CS039_q29,0,5,0.00,"<output>Consider examining the calculation of `fact(i)`, as incorrect values could lead to division by zero errors.</output>","def fact(n,p=1):\n    if(n==0):\n        return p\n    else:\n        return fact(n-1,p*n)\ndef pascal_triangle(n):\n    if(n<=0):\n        return []\n    else:\n        l=[]\n        for i in range(n):\n            temp=[]\n            for j in range(i+1):\n                temp.append(int(fact(i)/(fact(i-j)*fact(j))))\n            l.append(temp)\n        return l\nprint(pascal_triangle(5))"
B25DS039_Q29,0,5,0.00,"<output> The loop should iterate until `i` equals `len(nes_list)`, not `len(a)`. </output>","def pascal_triangle(n):\n    lis=[]\n    nes_list=[1]\n    if n<=0:\n        return []\n    for i in range(n):\n        lis.append(nes_list)\n        nes_list=[]\n        a=lis[i]\n        a.insert(0,0)\n        a.insert(len(a),0)\n        for j in range(len(a)-1):\n            s=a[j]+a[j+1]\n            nes_list.append(s)\n            s=0\n    ans=[]\n    for i in lis:      #lis is kind of [[0,1,0],[0,1,2,1,0],...]\n        i.pop(0)\n        i.pop(-1)\n        ans.append(i)\n    return ans\nprint(pascal_triangle(5))"
B25CS044_Q29,5,5,100.00,"<output> Consider handling the edge case where `n` is 0 by returning an empty list immediately in your function, rather than attempting to calculate the factorial of a non-positive number. This will prevent potential errors and improve the overall robustness of your code.</output>","#B5CS044_Q29\n\ndef pascal_triangle(height):\n    """"""\n    Return the first n rows of Pascal’s triangle as a list of\n    lists.\n    For n <= 0, return [].\n    """"""    \n    def factorial(n):\n        if n == 0:\n            return 1\n        else:\n            return n*factorial(n-1)\n    \n    def nCr(n,r):\n        return factorial(n)/(factorial(r)*factorial(n-r))\n    \n    #Making a list of (list of binomial coefficients) \n    lst = [[int(nCr(n,r)) for r in range(0,n+1)] for n in range(0,height)]\n    \n    return lst\n\npascal_triangle(5)\n# [[1], [1,1], [1,2,1], [1,3,3,1], [1,4,6,4,1]]"
B25EC033_q29,0,5,0.00,"<output>Consider using the bitwise XOR operator (^) to combine the elements of each row instead of addition, as this will produce the correct binomial coefficients for Pascal's triangle.</output>","def pascal_triangle(n):\n    if n <= 0:\n        return []\n    triangle = [[1]]\n    for i in range(1, n):\n        prev = triangle[-1]\n        row = [1]\n        for j in range(1, len(prev)):\n            row.append(prev[j - 1] + prev[j])\n        row.append(1)\n        triangle.append(row)\n    return triangle\nprint(pascal_triangle(5))"
B25EC027_q29,5,5,100.00,"<output>Verify that `l[i - 1]` is a list before indexing it with `[j - 1]`, as it may be empty or not exist if `i` is less than the index in the previous row.</output>","def pascal_triangle(n):\n    l=[]\n    for i in range(0,n):\n        le=[]\n        for j in range(0,i+1):\n            if(i-1>=0 and j-1>=0 and j<len(l[i-1])):\n                x=l[i-1][j-1]+l[i-1][j]\n            else:\n                x=1\n            le.append(x)\n        l.append(le)\n    return l\n            "
B25EE031_Q29,0,5,0.00,"<output>Consider using the `or` operator to handle the case where `n` is 0, which would result in an empty list being returned.</output>","def pascal_triangle(n):\n    if n<=0:\n        return []\n    Mylist=[[1]]\n    for i in range(1,n):\n        Thislist=Mylist[-1]\n        Addrow=[1]\n        for j in range(1,len(Thislist)):\n            Addrow.append(Thislist[j-1]+Thislist[j])\n        Addrow.append(1)\n        Mylist.append(Addrow)\n    return Mylist\nprint(pascal_triangle(5))\n    \n        \n            \n"
B25CS016_q29,5,5,100.00,<output>Consider initializing `previous_element` with a single-element list `[1]` instead of an empty list to correctly calculate the next row in Pascal's triangle.</output>,"def pascal_triangle(n): \n    """"""\n    Return the first n rows of Pascal's triangle\n    as a list of lists.\n    For n <= 0, return []. \n    """"""\n    if n <= 0:\n        return []\n    \n    pascal = []\n    \n    for i in range(1,n+1):\n        l = []\n        if i == 1:\n            l.append(1)\n            pascal.append(l)\n        elif i == 2:\n            l = [1,1]\n            previous_element = [1,1]\n            pascal.append(l)\n        else:\n            l.append(1)\n            for j in range(len(previous_element)-1):\n                l.append(previous_element[j] + previous_element[j+1])\n            l.append(1)\n            previous_element = l\n            pascal.append(l)\n\n    return pascal\n\n                \n"
B25ME046_q29,0,5,0.00,<output>Consider using an if-else statement instead of nested if statements to handle edge cases like negative input.</output>,"def pascal_triangle(n):\n    t=[]\n    if n<0:\n        return t\n    else:\n        t=[]\n        for a in range(n):\n            row=[1]*(a+1)\n            for b in range (1,a):\n                row[b]=t[a-1][b-1]+t[a-1][b]\n            t.append (row)\n    return t\nprint(pascal_triangle(5))#[[1], [1, 1], [1, 2, 1], [1, 3, 3, 1], [1, 4, 6, 4, 1]]\n"
(B25DS042)_Q29,5,5,100.00,"<output>Consider using a more efficient method to calculate the binomial coefficient, such as the math.comb function, which is available in Python 3.8 and later versions.</output>",''' question no. 29 '''\ndef fact(k):\n    if k == 1 or k == 0:\n        return 1\n    else:\n        return k*fact(k-1)\n\ndef pascal_triangle(n):\n    result = []\n    for i in range(n):\n        row = []\n        for j in range(i+1):\n            element = int(fact(i)/(fact(j)*fact(i-j)))\n            row.append((element))\n        result.append(row)\n    return result\n
B25EE019_q29,4,5,80.00,"<output> The issue lies in the fact that you're including an empty row at the end of Pascal's triangle by appending `1` to each row, but in reality, the last row should only have one element, which is 1. </output>","def pascal_triangle(n):\n    if n == 0:\n        return []\n    triangle = [[1]]\n    for i in range(1, n):\n        prev_row = triangle[-1]\n        new_row = [1]\n        for j in range(1, i):\n            new_row.append(prev_row[j-1] + prev_row[j])\n        new_row.append(1)\n        triangle.append(new_row)\n    return triangle"
B25EE007_q29,0,5,0.00,<output>Make sure to initialize the first row of the triangle correctly by setting `row[0]` to 1 before the inner loop starts.</output>,"def pascal_triangle(n):\n    if(n<=0):\n        return []\n    triangle=[]\n    for i in range(n):\n        row=[1]*(i+1)  # start with 1s\n        for j in range(1, i):\n            row[j]=triangle[i-1][j-1]+triangle[i-1][j]\n        triangle.append(row)\n    return triangle\nprint(pascal_triangle(5))\n"
B25EC007_q29,3,5,60.00,"<output> The recursive call to `pascal_triangle` is missing an argument, causing it to be called with only one element (`res`) instead of two, leading to the function not returning correctly and resulting in a maximum recursion depth exceeded error. </output>","def pascal_triangle(n,res=[[1]],i=1):\n    if i==n:\n        return res\n    i+=1\n    lst=[]\n    for j in range (i):\n        if j==0 or j==i-1:\n            lst.append(1)\n        else:\n            lst.append(res[i-2][j-1]+res[i-2][j])\n    res.append(lst)\n    return pascal_triangle(n,res,i)\n                       \n            \n    \n        "
B25CS062_q29,0,5,0.00,"<output>Be cautious of the incorrect assumption that all elements in Pascal's triangle are always 11 raised to the power of their position, as this approach does not correctly calculate the binomial coefficients.</output>","def pascal_triangle(n):\n    lst=[]\n    if n<=0:\n        return []\n    else:\n        for i in range(0,n):\n            lst.append([int(x) for x in str(11**i)])\n        return lst\nprint(pascal_triangle(5))"
B25MM009(q29),0,5,0.00,"<output>Exponentiation is typically used for repeated multiplication, but it's also used here to generate numbers that would be the binomial coefficients. Consider using `math.comb` function instead of exponentiation.</output>",def pascal_triangle(n):\n    list1=[]\n\n    for i in range(n):\n        l=11**i\n        p=str(l)\n        o=list(p)\n        t=[]\n        for u in o:\n            t.append(int(u))\n        list1.append(t)\n\n    return list1\nprint(pascal_triangle(5))
B25ME033_Q29,0,5,0.00,"<output> The issue lies in the way you're handling the first row of Pascal's triangle. Currently, it's initialized as `triangle = [[1]]`, but according to the problem description, it should be `triangle = [1]` since we only need one element for the first row. </output>","def pascal_triangle(n):\n    \n    if n <= 0:\n        return []\n\n    triangle = [[1]]\n    for i in range(1, n):\n        prev = triangle[-1]\n        row = [1]\n        for j in range(1, len(prev)):\n            row.append(prev[j - 1] + prev[j])\n        row.append(1)\n        triangle.append(row)\n\n    return triangle\n\n\n\nprint(pascal_triangle(5))\n\n"
B25EE009_q29,5,5,100.00,"<output>Check if you're correctly handling the last row of Pascal's triangle by initializing it with [1] instead of [1] * (i + 1), as this would result in an extra element being added to each row.</output>","def pascal_triangle(n):\n    triangle=[]\n    for i in range(n):\n        row=[1]*(i+1)\n        for j in range(1, i):\n            row[j] = triangle[i - 1][j - 1] + triangle[i - 1][j]\n\n        triangle.append(row)\n    return triangle\n\n    "
B25MT003_q29,5,5,100.00,"<output>Consider adding an initial row of all ones to your triangle when n is 1, as this is the first row of Pascal's triangle.</output>","def pascal_triangle(n):\n    if n <= 0:\n        return []\n    triangle = [[1]]\n    for i in range(1, n):\n        prev = triangle[-1]\n        row = [1] + [prev[j - 1] + prev[j] for j in range(1, len(prev))] + [1]\n        triangle.append(row)\n    return triangle\n"
B25MM023_q29,5,5,100.00,"<output> The issue lies in the condition `for j in range(1, i):`, where you should be iterating up to `i-1` instead of `i`, since indexing starts at 0 and you want to access the elements at indices `j` and `j+1` in the previous row. </output>","def pascal_triangle(n):\n    if n<=0:\n        return []\n    triangle=[[1]]\n    for i in range(1,n):\n        prev_row=triangle[i-1]\n        row=[1]\n        for j in range(1,i):\n            row.append(prev_row[j-1]+prev_row[j])\n        row.append(1)  \n        triangle.append(row)\n    return triangle\npascal_triangle(5)"
B25EE054_q29,5,5,100.00,"<output>Consider adding an initial row of ones to the triangle when n is 1, as this is a common convention for generating Pascal's triangle.</output>","def pascal_triangle(n):\n    if n<=0:\n        return []\n    triangle=[[1]]   \n    for i in range(1, n):\n        prev_row=triangle[-1]    \n        new_row=[1]                 \n        for j in range(1, len(prev_row)):\n            new_row.append(prev_row[j-1]+prev_row[j])\n        new_row.append(1)       \n        triangle.append(new_row)     \n    return triangle "
B25DS001_q29,3,5,60.00,<output> Check if `n` is 0 and return an empty list immediately after the base cases to avoid unnecessary computations. </output>,"def pascal_triangle(n):\n    t=[[1],[1,1]]\n    if n<=0:\n        return []\n    elif n==1:\n        return [[1]]\n    elif n==2:\n        return [[1],[1,1]]\n    else: \n        for i in range(2,n+1):\n            a=t[-1]\n            l=[1]\n            for j in range(len(a)-1):\n                b=a[j]+a[j+1]\n                l.append(b)\n            l.append(1)\n            t.append(l)\n        return t"
B25EE027_Q29,5,5,100.00,"<output> Check if you're correctly combining the fact values for each row. Try using the `or` operator to ensure that at least one of the factors is non-zero, instead of hardcoding the division result.</output>","def pascal_triangle(n):\n    """"""Return the first n rows of Pascal’s triangle as a list of\n    lists.\n    For n <= 0, return [].\n    """"""\n    #TO MAKE THIS TRIANGLE I HAVE TO MAKE A FUNCTION TO CALL FACTORIAL \n    def fact(n):\n        if n==1 :\n            return 1\n        elif n==0:\n            return 1\n        else :\n            return n*fact(n-1)\n    l=[]\n    for k in range(n):\n            l2=[]\n            for i in range(k+1):\n                l2.append(fact(k)//(fact(k-i)*fact(i)))\n            l.append(l2)\n    return l\n\n    \n\n\n# print(pascal_triangle(5))\n# # [[1], [1,1], [1,2,1], [1,3,3,1], [1,4,6,4,1]]"
B25CS042_Q29,0,5,0.00,<output>Consider using list comprehension to simplify the generation of Pascal's triangle rows and improve code readability.</output>,"def pascal_triangle(n):\n    if n <= 0:\n        return []\n\n    lst = []\n    list2 = [1]\n    list3 = [1, 1]\n\n    if n == 1:\n        return [list2]\n    if n == 2:\n        return [list2, list3]\n    else:\n        lst.append(list2)\n        lst.append(list3)\n\n        for i in range(2, n):\n            prev = lst[-1]  \n            new_row = [1]  \n            for j in range(len(prev) - 1):\n                new_row.append(prev[j] + prev[j + 1])\n            new_row.append(1) \n            lst.append(new_row)\n\n        return lst\n\nprint(pascal_triangle(5))\n\n"
B25EC002_q29,5,5,100.00,"<output>Check if the inner loop should iterate up to `i` instead of `i + 1`, as this would cause an index out of range error.</output>","\ndef factorial(x):\n    m=1\n    for i in range(1,x+1):\n        m *= i\n    return m\ndef pascal_triangle(n):\n    lst2 = []\n    for i in range(n):\n        lst1 = []\n        for r in range(i+1):\n            lst1.append(factorial(i)//(factorial(r)*factorial(i-r)))\n        lst2.append(lst1)\n    \n    return lst2\n\n"
B25EE059_q29,5,5,100.00,<output>Check if you're correctly handling the edges of the triangle by adding the first and last elements of each row.</output>,"def pascal_triangle(n):\n    if n <= 0:\n        return []\n    triangle = [[1]]\n    for i in range(1, n):\n        row = [1]\n        for j in range(1, i):\n            row.append(triangle[i-1][j-1] + triangle[i-1][j])\n        row.append(1)\n        triangle.append(row)\n    return triangle"
B25CS043-q29,5,5,100.00,<output>Consider adding an initial row with 1 element when generating the first row of Pascal's triangle to ensure correct indexing.</output>,"def pascal_triangle(n):\n    if n <= 0:\n        return []\n    triangle = [[1]]\n    for i in range(1, n):\n        prev = triangle[-1]\n        row = [1]\n        for j in range(1, len(prev)):\n            row.append(prev[j - 1] + prev[j])\n        row.append(1)\n        triangle.append(row)\n    return triangle"
B25CS021_q29,3,5,60.00,<output>Consider initializing each row with 1 instead of using a list comprehension that creates an array of zeros.</output>,"def pascal_triangle(n):\n    lst=[[1]]\n    if n==1:\n        return lst\n\n    for i in range(1,n):\n        list_1 = [0]*(i+1)\n        k=lst[i-1]\n        for j in range(i+1):\n            if j==0 or j==i:\n                list_1[j]=1\n            else:\n                list_1[j]=k[j-1]+k[j]\n        lst.append(list_1)\n\n    print(lst) "
B25EC028_q29,0,5,0.00,"<output>Consider initializing each row with a list containing 1 instead of just [1], as this ensures that the first element is always correctly set to 1.</output>","def pascal_triangle(n):\n    if n<=0:\n        return []\n    tri = [[1]]\n    for i in range(1,n):\n        pre = tri[-1]\n        new = [1]\n        for j in range(len(pre)-1):\n            new.append(pre[j]+pre[j+1])\n        new.append(1)\n        tri.append(new)\n    return tri\nprint(pascal_triangle(5))"
B25EE004_q29,3,5,60.00,"<output> The function is recursively calling itself without any base case to stop the recursion, leading to an infinite loop and exceeding the maximum recursion depth. Consider adding a condition to return the result when the row index 'i' exceeds the input 'n'. </output>","def pascal_triangle(n,res=[[1]],i=1):\n    if i==n:\n        return res\n    i+=1\n    lst=[]\n    for j in range (i):\n        if j==0 or j==i-1:\n            lst.append(1)\n        else:\n            lst.append(res[i-2][j-1]+res[i-2][j])\n    res.append(lst)\n    return pascal_triangle(n,res,i)\n                       \n            \n    \n        "
B25CS054_q29,3,5,60.00,"<output>Consider modifying your function to return rows instead of the entire triangle at once, as the current implementation only generates the first row.</output>","def pascal_triangle(n):\n    pascal = [[1]]\n    helper(2, n, pascal)\n    return pascal\n\ndef helper(x, n, pascal):\n    if (x>n): return\n    l = [1]\n    for i in range(1,x-1):\n        l.append(pascal[x-2][i-1]+pascal[x-2][i])\n    l.append(1)\n    pascal.append(l)\n    helper(x+1,n,pascal)\n\n"
B25MM027_q29,0,5,0.00,<output>Check if the condition for adding elements to the row is correct by ensuring that `prev_row[j]` and `prev_row[j-1]` exist before performing arithmetic operations.</output>,"def pascal_triangle(n):\n    if n <= 0:\n        return []\n    triangle = [[1]]  \n    for i in range(1, n):\n        prev_row = triangle[-1]\n        row = [1] \n        for j in range(1, len(prev_row)):\n            row.append(prev_row[j - 1] + prev_row[j])\n        row.append(1)  \n        triangle.append(row)\n    return triangle\nprint(pascal_triangle(1))\nprint(pascal_triangle(5))\nprint(pascal_triangle(0))\n\n"
B25DS031_q29,5,5,100.00,"<output>Make sure to initialize the first row of Pascal's triangle correctly by using `prev = [1]` instead of just `prev`, as the current implementation only appends `[1]` to the new row.</output>","def pascal_triangle(n):\n """"""\n Return the first n rows of Pascal’s triangle as a list of lists.\n For n <= 0, return [].\n """"""\n if n<=0:\n     return []\n t=[[1]]\n for i in range(1,n):\n     prev=t[-1]# last row of t\n     new=[1]\n     for j in range(1,len(prev)):\n         new.append(prev[j-1]+prev[j])\n     new.append(1)\n     t.append(new)\n return t\n\n \n \n \n "
B25DS036_q29,5,5,100.00,<output>Consider adding an initial row of all ones to handle the case when n is 1.</output>,"def pascal_triangle(n):\n    if n <= 0:\n        return []\n    tri = [[1]]\n    for r in range(1, n):\n        prev = tri[-1]\n        row = [1] + [prev[i-1] + prev[i] for i in range(1, r)] + [1]\n        tri.append(row)\n    return tri\n"
B25DS003_q29,5,5,100.00,<output>It seems like you're missing the `nc` function which is used to calculate the combination. Make sure it's defined and correctly implemented.</output>,"def factorial(n):\n    if n==0:\n        return 1\n    output =1\n    for i in range(2,n+1):\n        output = output*i\n    return output\n    \ndef nc(n,r):\n    return int(factorial(n)/(factorial(r)*factorial(n-r)))\n\ndef pascal_triangle(n):\n    output=[]\n    if n>=1:\n        output=[[1]]\n    for i in range(1,n):\n        pascal = [nc(i,r) for r in range(i+1)]\n        output.append(pascal)\n    return output\n\n"
B25MT024_q29,0,5,0.00,"<output>The issue lies in the way you're handling the last element of each row. You're appending `1` to `new_row` twice, which is incorrect and causes the variable `prev_row` to be referenced before assignment.</output>","def pascal_triangle(n):\n    triangle=[[1]]\n    for i in range(1,n):\n        prev_row = triangle[-1]\n        new_row=[1]\n    for j in range(1, len(prev_row)):\n        new_row.append(prev_row[j - 1] + prev_row[j])    \n        new_row.append(1) \n        triangle.append(new_row)\n    return triangle "
B25CS011_q29,3,5,60.00,<output>Consider using conditional statements to handle each row individually instead of combining all rows at once.</output>,"def pascal_triangle(n):\n    pascals = [[1],[1,1]]\n    if n ==1:\n        return [[1]]\n    if n ==2:\n        return pascals\n    else:\n        for i in range(n-2):\n            test = []\n            for j in range(len(pascals[-1])-1):\n                test.append(pascals[-1][j]+pascals[-1][j+1])\n            test.insert(0,1)\n            test.append(1)\n            pascals.append(test)\n        return pascals\n                \n"
B25CS026_q29,0,5,0.00,"<output> Consider using the bitwise AND operator (&) instead of multiplication (*) to combine the factorials in the calculation of each element in Pascal's triangle, as this will ensure correct integer results.</output>","def pascal_triangle(n):\n    list1 = []\n    def f(n):\n        if n == 0:\n            return 1\n        else:\n            factorial = n * f(n-1)\n\n        return factorial\n    if n>0:\n        list1.append([1])\n    else:\n        return []\n    for i in range(1,n+1):\n        r = 0\n        list2 = []\n        while i>=r:\n            list2.append((f(i))//((f(i-r)*f(r))))  # here i am use binomial function for pascal triangle\n            r += 1\n        \n        list1.append(list2)\n\n    return list1\n\nprint(pascal_triangle(3))\nprint(pascal_triangle(5))\n\n\n"
B25EC044_Q29,0,5,0.00,<output>Consider using conditional statements with if-elif-else instead of nested lists to improve readability and logic flow.</output>,"\n\ndef pascal_triangle(n):\n    L=[]\n    test1=[]\n    if n>0:\n        for i in range(1,n+1):\n            test2=[]\n            if i==1:\n                test1=[1]\n                L.append(test1)\n            elif i==2:\n                test1=[1,1]\n                L.append([test1])\n            else:\n                test2.append(1)\n                for j in range(i-2):\n                    test2.append(test1[j]+test1[j+1])\n                test2.append(1)\n                test1=test2.copy()\n                L.append(test2)\n    return L\n\nprint(pascal_triangle(6))\n# [[1], [1,1], [1,2,1], [1,3,3,1], [1,4,6,4,1]]              \n            \n    \n"
B25DS017_q29,0,5,0.00,"<output>Consider using a dynamic approach to generate Pascal's triangle, such as the nested list or matrix representation, instead of relying on string manipulation and exponentiation.</output>","def pascal_triangle(n):\n    lst=[]\n    if n<=0:\n        return []\n    else:\n        for i in range(0,n):\n            lst.append([int(x) for x in str(11**i)])\n        return lst\nprint(pascal_triangle(5))\n            \n        "
B25ME008_Q29,2,5,40.00,<output>Consider changing `count` to `n + 1` in the while loop condition to correctly generate Pascal's triangle.</output>,"def pascal_triangle(n):\n    default = [[1], [1,1]]\n\n    count  = 3\n    while count<=n:\n        nlist = [1]\n        for i in range(1, count-1):\n            x = default[count-2]\n            sumx = x[i-1]+x[i]\n            nlist.append(sumx)\n\n        nlist.append(1)\n        default.append(nlist)\n        count+=1\n    \n    return default"
B25MT022_q29,5,5,100.00,"<output>Consider adding an initial row with [1] to handle the case when n is 1, as your current code only generates rows for n > 1.</output>","29.\ndef pascal_triangle(n):\n  \n    if n <= 0:\n        return []\n\n    triangle = [[1]]              # first row\n\n    for i in range(1, n):\n        prev_row = triangle[-1]\n# each row starts and ends with 1\n        row = [1]\n# middle elements are sums of adjacent elements above\n        for j in range(1, len(prev_row)):\n            row.append(prev_row[j - 1] + prev_row[j])\n        row.append(1)\n        triangle.append(row)\n\n    return triangle"
B25EE021_q29,2,5,40.00,<output>Check if the condition `n > 0` is correct and consider using `if n >= 1:` to ensure that at least one row is generated.</output>,"def pascal_triangle(n):\n    if n > 0:\n        L = [[1],[1,1]]\n        for i in range(n):\n            L.append([1]+ [L[-1][j]+L[-1][j+1] for j in range(len(L[-1])-1)] +[1])\n        return L    \n    else:\n        return []\n    \n\n    "
B25CS020_q29,5,5,100.00,"<output> The issue lies in the line where you're combining elements of the previous row. You should use `prev_row[j]` instead of `prev_row[j - 1] + prev_row[j]`, as this will result in incorrect calculations and lead to incorrect values in your triangle. </output>","def pascal_triangle(n):\n    if n <= 0:\n        return []\n    \n    triangle = [[1]]  \n    \n    for i in range(1, n):\n        prev_row = triangle[-1]\n        row = [1]  \n        \n       \n        for j in range(1, len(prev_row)):\n            row.append(prev_row[j - 1] + prev_row[j])\n        \n        row.append(1)  \n        triangle.append(row)\n    \n    return triangle\n"
B25EC001_q29,1,5,20.00,"<output> The issue lies in how you're generating each row of Pascal's triangle as a string, which is not necessary and causes the rows to be represented incorrectly; consider using a list comprehension instead. </output>",def pascal_triangle(n):\n    x  =[]\n    for i in range(n+1):\n        y = str(11**i)\n        z = []\n        for j in y:\n            z.append(int(j))\n        x.append(z)\n    return x
