student_id,tests_passed,tests_total,score_percentage,semantic_summary,code_snippet
B25ME011_q29,0,5,0.00,"<output> Consider using a temporary list to store the row values before appending them to `pascal_list`, as modifying `row` directly may affect its indices when iterating over it in the next iteration.</output>","import math\ndef pascal_triangle(n):\n    """"""\n    returning the first n rows of Pascal's Triangle as a list of lists\n    \n    """"""\n    pascal_list = []\n    if n<=0:\n        return []\n    for i in range(n):\n        row = []\n        for j in range (i+1):\n            row.append((math.comb(i,j)))\n        pascal_list.append(row)\n    return pascal_list\nprint(pascal_triangle(5))\n            \n        \n    \n    "
B25ME014_q29.py,0,5,0.00,"<output>Check for side effects in your function, as modifying the 'ls' list within the loop affects the output of subsequent rows.</output>","def pascal_triangle(z):\n    """"""\n    Return the first n rows of Pascal’s triangle as a list of\n    lists.\n    For n <= 0, return [].\n    """"""\n    ls = []\n    for x in range(z):\n        gd = []\n        for y in range(x+1):\n            digit = fact(x)/(fact(y)*fact(x-y))\n            gd.append(int(digit))\n        ls.append(gd)\n    return ls\n    pass\n\ndef fact(num):\n    if num == 1 or num == 0:\n        return 1\n    else:\n        return num*fact(num-1)\n"
B25CS056_q29,5,5,100.00,<output> Check if you're printing intermediate calculations instead of using them to populate your Pascal's triangle rows.  </output>,"def pascal_triangle(n):\n    """"""\n    Return the first n rows of Pascal’s triangle as a list of\n    lists.\n    For n <= 0, return [].\n    """"""\n    def fact(n):\n        if n < 2:\n            return 1\n        else:\n            return n*fact(n-1)\n    \n    pascal = []\n    if n>0:\n        pascal.append([1])\n        for i in range(1,n):\n            row = []\n            for j in range(i+1):\n                row.append(int(fact(i)/(fact(i-j)*fact(j))))\n                print((fact(i)/(fact(i-j)*fact(j))))\n            pascal.append(row)\n    return pascal\n\n# print(pascal_triangle(5))"
B25ME026_q29,5,5,100.00,"<output>Check if you're correctly calculating the factorial function (`fact(i)`) and its usage, as incorrect values can lead to inaccurate results in Pascal's triangle.</output>",def fact(n):\n    if n==0 or n==1:\n        return 1\n    else:\n        return n*fact(n-1)\n\ndef pascal_triangle(n):\n    _list=[]\n    for i in range(n):\n        row=[]\n        for j in range(i+1): \n            item=fact(i)//(fact(j)*fact(i-j)) \n            row.append(item)\n        _list.append(row)\n    return _list\n\n
B25EE051_q29,5,5,100.00,"<output> The issue lies in the combination of boolean operators in your code. In Python, `and` and `or` are used as logical operators, but they don't behave like their counterparts in mathematics. You should use bitwise operators (`&`, `|`, `^`) instead to perform element-wise operations. </output>","def pascal_triangle(n):\n\n    if n <= 0:\n        return []\n    res = [[1]]\n    for row in range(1, n):\n        prev = res[-1]\n        new = [1]\n        for i in range(1, len(prev)):\n            new.append(prev[i-1] + prev[i])\n        new.append(1)\n        res.append(new)\n    return res\n"
B25CS022_q29,5,5,100.00,"<output>Consider the impact of modifying the `rows` list while iterating over it in the inner loop, as this could potentially cause unexpected behavior.</output>","def pascal_triangle(n):\n    """"""\n    Return the first n rows of Pascal's triangle as a list of lists.\n    For n <= 0, return [].\n    """"""\n    if n <= 0:\n        return []\n\n    rows = [[1]]\n    for _ in range(1, n):\n        prev = rows[-1]\n        row = [1] + [a + b for a, b in zip(prev, prev[1:])] + [1]\n        rows.append(row)\n    return rows"
B25EE035_Q29,0,5,0.00,"<output>When calculating each row of Pascal's triangle, you should be using the previous row to generate the next one, but instead, you're appending individual elements from the previous row. Try modifying your code to use `result[-1]` and `result[-2]` to access the last two rows.</output>","""""""\nReturn the first n rows of Pascal’s triangle as a list of\nlists.\nFor n <= 0, return [].\n""""""\ndef pascal_triangle(n):\n    result=[]\n    for i in range(1,n+1):\n        if i<3:\n            result.append(list(1 for x in range(i)))\n        else:\n            l=[1]\n            for k in range(1,i-1):\n                l.append(result[i-2][k-1]+result[i-2][k])\n            l.append(1)\n            result.append(l)\n    print(result)\n\n\npascal_triangle(5)\n# [[1], [1,1], [1,2,1], [1,3,3,1], [1,4,6,4,1]]\n"
B25ME034_q29,5,5,100.00,"<output>Consider adding an initial row of all ones to the triangle before starting the loop, as this is missing from your current implementation.</output>","\ndef pascal_triangle(n):\n\n    if n <= 0:\n        return []\n    \n    triangle = [[1]]\n    \n    for i in range(1, n):\n        prev_row = triangle[-1]\n\n        row = [1]\n\n        for j in range(1, len(prev_row)):\n            row.append(prev_row[j-1] + prev_row[j])\n        row.append(1) \n        triangle.append(row)\n    \n    return triangle\n"
B25ME021_q29,5,5,100.00,<output>Consider adding a base case for when n is 1 to handle the edge condition correctly.</output>,"def pascal_triangle(n):\n    if n <= 0:\n        return []\n    \n    triangle = [[1]]\n    for i in range(1, n):\n        prev = triangle[-1]\n        row = [1]\n        for j in range(1, len(prev)):\n            row.append(prev[j - 1] + prev[j])\n        row.append(1)\n        triangle.append(row)\n    return triangle\n"
S25MA014_q29,5,5,100.00,"<output>Consider using the bitwise XOR operator (^) to combine the conditions for generating each row of Pascal's triangle, as this will correctly handle cases where n is even or odd.</output>","def pascal_triangle(n):\n    if n<=0:\n        return []\n    triangle=[[1]]   \n    for i in range(1, n):\n        prev_row=triangle[-1]    \n        new_row=[1]                 \n        for j in range(1, len(prev_row)):\n            new_row.append(prev_row[j-1]+prev_row[j])\n        new_row.append(1)       \n        triangle.append(new_row)     \n    return triangle "
B25MM025_q29,0,5,0.00,"<output>Consider using a more robust method to calculate the binomial coefficient, such as `math.comb` (Python 3.8+) or manually calculating it without relying on division operations.</output>","def pascal_triangle(a):\n    def factorial(N):\n        if N==1 or N==0:\n            return 1 \n        else:\n            return N*factorial(N-1)\n    def n(i, j):\n        return factorial(i)/((factorial(i-j))*(factorial(j)))\n    lst1 = []\n    for b in range (a):\n        lst = []\n        for c in range (b+1):\n            lst.append(int(n(b,c)))\n        lst1.append(lst)\n    return lst1\nprint(pascal_triangle(4))"
S25MA008  Q29,0,5,0.00,<output>Consider adding explicit checks for edge cases where n is less than 1 to handle potential index out of range errors.</output>,"def pascal_triangle(n):\n    t=[[1]]\n    if n<=0:\n        return []\n    for i in range(1,n):\n        p=t[-1]\n        r=[1]\n        for j in range(1,len(p)):\n            r.append(p[j-1]+p[j])\n        r.append(1)\n        t.append(r)\n    return t\nprint(pascal_triangle(5))"
B25EC017_q29,5,5,100.00,"<output>Consider using list comprehension instead of nested loops to generate rows, as this will improve readability and efficiency.</output>","def pascal_triangle(n):\n    if n <= 0:\n        return []\n    elif n == 1:\n        return [[1]]\n    elif n == 2:\n        return [[1], [1, 1]]\n    \n    l = [[1], [1, 1]]\n    \n    for i in range(n-2):\n        prev = l[-1]\n        new_row = [1]\n        for j in range(len(prev) - 1):\n            new_row.append(prev[j] + prev[j + 1])\n        new_row.append(1)\n        l.append(new_row)\n    return l\n    \n"
B25EC043_q29,0,5,0.00,<output> The issue lies in the fact that you're appending `prev_list` to itself instead of using its values to calculate the next row. Change `[i for i in current_list]` to `[current_list[j] for j in range(i)]` to fix this.</output>,"def pascal_triangle(n):\n    pascal_list=[]\n    current_list=[]\n    prev_list=[]\n    for i in range(n):\n        if i ==0:\n            current_list.append(1)\n            pascal_list.append(current_list)\n            current_list=[]\n        elif i ==1:\n            current_list.append(1)\n            current_list.append(1)\n            pascal_list.append(current_list)\n            prev_list=[i for i in current_list]\n            current_list=[]\n        else:\n            current_list.append(1)\n            for j in range(1,i):\n                current_list.append(prev_list[j-1]+prev_list[j])\n            current_list.append(1)\n            pascal_list.append(current_list)\n            prev_list=[i for i in current_list]\n            current_list=[]\n    return pascal_list\nprint(pascal_triangle(7))"
B25DS033_Q29,0,5,0.00,"<output>Consider adding a check to ensure that `n` is a positive integer, as the current implementation will produce incorrect results for non-integer or negative inputs.</output>","def pascal_triangle(n):\n    \n    if n <= 0:\n        return []\n    \n    triangle =[[1]]\n    for i in range (1,n):\n        prev = triangle[-1]\n        row = [1]\n        for j in range(1,len(prev)):\n            row.append(prev[j-1]+prev[j])\n        row.append(1)\n        triangle.append(row)\n    return triangle\n\nprint(pascal_triangle(5))"
B25ME030_q29,0,5,0.00,"<output>Consider using string formatting instead of concatenating strings with '+' operator, as it can lead to performance issues and potential errors.</output>","def pascal_triangle(n):\n    k=[]\n    m=[]\n    for i in range(0,n):\n        k.append(11**i)\n    for ele in k:\n        m.append(list(map(int,str(ele))))\n    return m\nprint(pascal_triangle(5))"
B25ME009_q29,5,5,100.00,"<output> Modifying `triangle` while iterating over it in the inner loop might cause unexpected results, as you're using `triangle[i - 1][j - 1]` and `triangle[i - 1][j]`, which could lead to accessing elements out of bounds or revisiting previously computed values. </output>","""""""\nReturn the first n rows of Pascal’s triangle as a list of\nlists.\nFor n <= 0, return [].\n""""""\ndef pascal_triangle(n):\n    if n <= 0:\n        return []\n    \n    triangle = []\n    \n    for i in range(n):\n        row = []\n        for j in range(i + 1):\n            if j == 0 or j == i:\n                row.append(1)\n            else:\n                left = triangle[i - 1][j - 1]\n                right = triangle[i - 1][j]\n                row.append(left + right)\n        triangle.append(row)\n    \n    return triangle"
B25MT030_q29,5,5,100.00,"<output>Consider adding an initial 1 to each row for Pascal's triangle, as the first and last elements of every row are always 1.</output>",def pascal_triangle(n):\n    \n    if n <= 0:\n        return []    \n    triangle = []\n    \n    for i in range(n):\n        row = [1]  \n        \n        if i > 0:\n            prev_row = triangle[i - 1]\n            for j in range(len(prev_row) - 1):\n                row.append(prev_row[j] + prev_row[j + 1])\n        \n        if i > 0:\n            row.append(1)       \n        triangle.append(row)\n    \n    return triangle
B25MT023-Q 29,0,5,0.00,"<output>The issue lies in the way you're handling the first and last row of Pascal's triangle. Currently, your code starts with `triangle = [[1]]` but should begin with a single element, `1`. Also, when generating new rows, ensure that the first and last elements are always `1`, regardless of the length of the previous row.</output>","def pascal_triangle(n):\n    if n <= 0:\n        return []   # agar n 0 ya negative hai to empty list return karo\n\n    triangle = [[1]]   # first row hamesha [1] hoti hai\n\n    for i in range(1, n):\n        prev_row = triangle[-1]  # last row ko le lo\n        new_row = [1]  # har row ka start 1 hota hai\n\n        # beech ke numbers calculate karo (sum of two upper numbers)\n        for j in range(1, len(prev_row)):\n            new_row.append(prev_row[j - 1] + prev_row[j])\n\n        new_row.append(1)  # har row ka end bhi 1 hota hai\n        triangle.append(new_row)\n\n    return triangle\n\nprint(pascal_triangle(5))"
B25EE033_q29,5,5,100.00,"<output>Check if you're correctly handling the case when `n` is 1, as your current implementation returns an empty list for `n <= 0`, but should return a list with only one row containing [1].</output>","def pascal_triangle(n):\n    \n    if n <= 0:\n        return []\n\n    triangle = [[1]]  # first row\n\n    for i in range(1, n):\n        prev_row = triangle[-1]\n        # Each middle element is the sum of two elements above it\n        row = [1] + [prev_row[j] + prev_row[j + 1] for j in range(len(prev_row) - 1)] + [1]\n        triangle.append(row)\n\n    return triangle\n"
B25DS027_q29,5,5,100.00,"<output>It seems like you're trying to build Pascal's triangle rows as strings, but you should be using integers instead.</output>","def pascal_triangle(n):\n    result=[]\n    if n<=0:\n        return []\n    for i in range(0,n):\n        b=[]\n        s=11**i\n        a=str(s)\n        for i in a:\n            b.append(i)\n        result.append(b)\n    return result\n    \n\n        \n        "
B25EE037_q29,0,5,0.00,"<output> The issue lies in the recursive function call where you're using `f(i) // (f(r) * f(i - r))`, which is incorrect because it should be `f(i-1) * f(i-r)` instead, as per the combination formula of Pascal's triangle. </output>","def pascal_triangle(n):\n    L=[]\n    def f(n):\n        if n == 1:\n            return 1\n        elif n==0:\n            return 1\n        else:\n            return n*f(n-1)\n    if n>0:\n        L.append([1])\n    else:\n        return []\n    for i in range(1,n):\n        L1 = []\n        for r in range(i + 1):\n            L1.append(f(i) // (f(r) * f(i - r)))\n        L.append(L1)\n    return L\nprint(pascal_triangle(5))\n            \n        "
B25EE028_q29,3,5,60.00,"<output> The student's code is missing the initial row of Pascal's triangle (with a single 1), which is typically included in the first row of the triangle. Ensure that the loop starts with an empty list and appends the correct values to it. </output>","def pascal_triangle(n):\n    i = 2\n    result_lst = [[1],[1,1]]\n    if n == 1:\n        result_lst = [[1]]\n        return result_lst\n    elif n == 2 :\n        result_lst = [[1],[1,1]]\n        return result_lst\n    else:\n        while i != n :\n            result = []\n            pre = result_lst[-1]\n            result.append(pre[0])\n            for j in range(i-1):\n                result.append(pre[j]+pre[j+1])\n            result.append(pre[-1])\n            result_lst.append(result)\n            i += 1\n        return result_lst"
B25MT010_q29,0,5,0.00,<output>Consider using the `math.comb` function to calculate combinations instead of manually handling indices and sums.</output>,def pascal_triangle(n):\n    new_list=[]\n    for i in range(n):\n        perm=[]\n        for j in range(n):\n            if i-1>0 and j-1>=0 and i>j: \n                sum=new_list[i-1][j-1]+new_list[i-1][j]\n                perm.append(sum)\n            else:\n                perm.append(1)\n            if i==j:\n                break\n        new_list.append(perm)\n    return(new_list)\nprint(pascal_triangle(5))\n            \n    
B25ME045_q29,3,5,60.00,"<output>Consider using list comprehension to generate each row of Pascal's triangle, as this can be more efficient and avoid potential issues with string concatenation.</output>","def pascal_triangle(n,res=[[1]],i=1):\n    if i==n:\n        return res\n    i+=1\n    lst=[]\n    for j in range (i):\n        if j==0 or j==i-1:\n            lst.append(1)\n        else:\n            lst.append(res[i-2][j-1]+res[i-2][j])\n    res.append(lst)\n    return pascal_triangle(n,res,i)\n                       \n            \n    \n        "
B25DS043_q29,0,5,0.00,"<output>Check the inner loop's range to ensure it covers all elements of the row, as the current implementation may produce incorrect results due to an off-by-one error.</output>","def pascal_triangle(n):\n    """"""\n    Return the first n rows of Pascal's triangle as a list of\n    lists.\n    For n <= 0, return [].\n    """"""\n    if n <= 0:\n        return []\n    \n    triangle = []\n    for i in range(n):\n        row = []\n        for j in range(i + 1):\n            if j == 0 or j == i:\n                row.append(1)\n            else:\n                row.append(triangle[i-1][j-1] + triangle[i-1][j])\n        triangle.append(row)\n    \n    return triangle\nprint(pascal_triangle(5))"
B25DS010_q29,2,5,40.00,"<output> The loop condition should be `count < n` instead of `count <= n`, as it will cause the function to include rows beyond the first `n` rows in Pascal's triangle. </output>","def pascal_triangle(n):\n    start = [[1], [1,1]]\n\n    count  = 3\n    while count<=n:\n        nlist = [1]\n        for i in range(1, count-1):\n            x = start[count-2]\n            sumx = x[i-1]+x[i]\n            nlist.append(sumx)\n\n        nlist.append(1)\n        start.append(nlist)\n        count+=1\n    \n    return start\n"
B25EE042_q29,5,5,100.00,"<output> When calculating the values for `triangle[i - 1][j]`, consider that you're accessing an element in the list before it's fully generated, which might be causing incorrect results due to the iterative nature of your approach.</output>",def pascal_triangle(n):\n    if n <= 0:\n        return []\n\n    triangle = []\n\n    for i in range(n):\n        row = []\n        for j in range(i + 1):\n            if j == 0 or j == i:\n                row.append(1)\n            else:\n                row.append(triangle[i - 1][j - 1] + triangle[i - 1][j])\n        triangle.append(row)\n\n    return triangle\n
B25EE034_q29,5,5,100.00,<output> The condition `j < i` should be `j <= i` to correctly calculate the next row of Pascal's triangle. </output>,"def pascal_triangle(n):\n    ans=[]\n    list=[]\n    for i in range(n):\n        if i==0:\n            ans.append([1])\n        else:\n            for j in range(i+1):\n                if j==0:\n                    list.append(1)\n                elif j<i:\n                    list.append(prev_list[j]+prev_list[j-1])\n                elif j==i:\n                    list.append(1)\n            prev_list=list.copy()\n            ans.append(list)\n            list=[]\n    print(ans)\n\n# pascal_triangle(5)\n#  # [[1], [1,1], [1,2,1], [1,3,3,1], [1,4,6,4,1]]"
B25ME016_q29,0,5,0.00,N/A,No Code Found
B24DS035_Q29,5,5,100.00,"<output>Consider using the bitwise XOR operator (^) to combine the two elements from the previous row instead of adding them, which could introduce incorrect values due to integer overflow.</output>","def pascal_triangle(n):\n    if n <= 0:\n        return []\n\n    triangle = [[1]]  \n\n    for i in range(1, n):\n        prev_row = triangle[-1]\n        row = [1] + [prev_row[j] + prev_row[j + 1] for j in range(len(prev_row) - 1)] + [1]\n        triangle.append(row)\n\n    return triangle\n    pass"
B25EE055_q29,3,5,60.00,"<output>Consider initializing the first row of the triangle with [1] instead of just [1], as your current implementation will result in an empty list for the first row.</output>","def pascal_triangle(n):\n    lst=[[1]]\n    for _ in range(n-1):\n        lst.append([])\n    for i in range (1,n):\n        for j in range (0,i+1):\n            if j==0 or j==i :\n                lst[i].append(1)\n            else:\n                lst[i].append(lst[i-1][j-1]+lst[i-1][j])\n    return lst\n\n "
B25DS034_q29,5,5,100.00,<output>Consider using the bitwise XOR operator (^) to calculate the combination of rows in Pascal's triangle instead of manually adding elements.</output>,"\ndef pascal_triangle(n):\n    \n    if n <= 0:\n        return []\n    triangle = [[1]]\n    for i in range(1, n):\n        row = [1]\n        for j in range(1, i):\n            row.append(triangle[i - 1][j - 1] + triangle[i - 1][j])\n        row.append(1)\n        triangle.append(row)\n    return triangle\n\n"
B25ME051_q29,0,5,0.00,"<output> Check if you're correctly handling edge cases where n is 1, as your current implementation returns an empty list for this input.</output>","def pascal_triangle(n):\n    if n <= 0:\n        return []\n    result = [[1]]\n    for i in range(1, n):\n        prev = result[-1]\n        row = [1]\n        for j in range(1, len(prev)):\n            row.append(prev[j - 1] + prev[j])\n        row.append(1)\n        result.append(row)\n    return result\n\nprint(pascal_triangle(5))"
B25MM018_q29,0,5,0.00,"<output>Consider adding a condition to handle the case when `i` equals 1 separately, as your current implementation doesn't append the first row correctly.</output>","def pascal_triangle(n):\n    if n <= 0:\n        return []\n    triangle = [[1]]\n    for i in range(1, n):\n        prev = triangle[-1]\n        row = [1]\n        for j in range(1, i):\n            row.append(prev[j-1] + prev[j])\n        row.append(1)\n        triangle.append(row)\n    return triangle\nprint(pascal_triangle(5))"
B25CS010_q29,5,5,100.00,"<output> You are missing an initial row of all ones in your recursive call when `n` equals 1, causing incorrect results for the first element in each subsequent row.</output>","def pascal_triangle(n):\n    """"""\n    Return the first n rows of Pascal’s triangle as a list of\n    lists.\n    For n <= 0, return [].\n    """"""\n    if n <= 1:\n        return [] if n <= 0 else [[1]]\n    last = pascal_triangle(n - 1)\n    return last + [[1 if i == 0 or i == n - 1 else last[-1][i - 1] + last[-1][i] for i in range(n)]]\n"
B25CS060_q29,5,5,100.00,<output>Consider using `math.comb` instead of manual factorial calculations to simplify and improve performance.</output>,"import math\ndef pascal_triangle(n):\n    if n<=0:\n        return []\n    result=[]\n    for i in range (n):\n        inner_list=[]\n        for j in range(0,i+1):\n            value=(math.factorial(i))/(math.factorial(j)*math.factorial(i-j))\n            inner_list.append(int(value))\n        result.append(inner_list)\n    return result\n\n    \n            \n        "
B25CS028_q29,0,5,0.00,"<output> Check if your code handles the case when `n` is 1 correctly. Currently, your function returns an empty list for `n = 1`, but it should return a list with only one row containing the number 1. </output>","def pascal_triangle(n):\n    if n <= 0:\n        return []\n\n    triangle = [[1]]\n    for i in range(1, n):\n        prev = triangle[-1]\n        row = [1]\n        for j in range(1, len(prev)):\n            row.append(prev[j - 1] + prev[j])\n        row.append(1)\n        triangle.append(row)\n\n    return triangle\n    pass\nprint(pascal_triangle(5))\n\n"
B25MT029_Q29,0,5,0.00,"<output>Verify that you are correctly converting between integers and floats when calculating `y(N, R)`, as this is likely causing a type mismatch.</output>","def pascal_triangle(n):\n    def fact(num):\n        return num*fact(num-1) if num>1 else 1 if num==0 or num==1 else """"\n    y = lambda x,y : int(fact(x)/(fact(x-y)*fact(y)))\n    return  [[(y(N ,R)) for R in range(N+1)] for N in range(n)]\n\nprint(pascal_triangle(5))"
B25EC039_q29,5,5,100.00,"<output>Consider initializing `lst` with a single-element list `[1]` instead of an empty list `[]`, as the first row of Pascal's triangle should always start with `1`.</output>","def pascal_triangle(n):\n    lst=[]\n    if n <= 0:\n        return []\n    for i in range(0,n):\n        lst1=[]\n        for j in range(0,i+1):\n            if j==i or j==0:\n                lst1.append(1)\n            else:\n                lst1.append(lst[i-1][j-1]+lst[i-1][j])\n        lst.append(lst1)\n    return lst\n"
B25EC036_q29,5,5,100.00,"<output> Check the iteration condition in your while loop, as you are currently iterating 'n' times instead of 'n-1', which would cause an IndexError when trying to access `prev[i + 1]`. </output>",def pascal_triangle(n):\n    if n <= 0:\n        return []\n    rows = [[1]]\n    while len(rows) < n:\n        prev = rows[-1]\n        interior = [prev[i] + prev[i+1] for i in range(len(prev)-1)]\n        rows.append([1] + interior + [1])\n    return rows\n\n
B25DS011_q29,0,5,0.00,"<output>Verify that `l[i - 1]` is a list, not an integer, before attempting to access its elements with indexing (`j - 1`).</output>","def pascal_triangle(n):\n    l=[]\n    for i in range(0,n):\n        le=[]\n        for j in range(0,i+1):\n            if(i-1>=0 and j-1>=0 and j<len(l[i-1])):\n                x=l[i-1][j-1]+l[i-1][j]\n            else:\n                x=1\n            le.append(x)\n        l.append(le)\n    return l\n\nprint(pascal_triangle(5))\n # [[1], [1,1], [1,2,1], [1,3,3,1], [1,4,6,4,1]]"
B25EE022_q29,0,5,0.00,"<output>Be cautious of the assumption that `n` represents the number of rows, not the number of elements in each row.</output>","def pascal_triangle(n):\n    lst=[]\n    if n<=0:\n        return []\n    else:\n        for i in range(0,n):\n            lst.append([int(x) for x in str(11**i)])\n        return lst\nprint(pascal_triangle(5))\n            \n        "
B25MM004_q29,5,5,100.00,<output>Consider adding an initial row of all ones when n is 1 to handle the edge case correctly.</output>,"def pascal_triangle(n):\n    if (n <= 0):\n        \n        return []\n    result = [[1]]\n    for i in range(1,n):\n        prev = result[-1]\n        newrow = [1]\n        for j in range(len(prev) - 1):\n            newrow.append(prev[j] + prev[j + 1])\n        newrow.append(1)\n        result.append(newrow)\n    return result\n\n\n"
