student_id,tests_passed,tests_total,score_percentage,semantic_summary,code_snippet
B25MM020_q29,0,5,0.00,"<output>Consider modifying your function to return the entire Pascal's triangle instead of just the first 'a' rows, and adjust the loop accordingly.</output>","def pascal_triangle(a):\n    def factorial(N):\n        if N==1 or N==0:\n            return 1 \n        else:\n            return N*factorial(N-1)\n    def ncr(i, j):\n        return factorial(i)/((factorial(i-j))*(factorial(j)))\n    lst1 = []\n    for b in range (a):\n        lst = []\n        for c in range (b+1):\n            lst.append(int(ncr(b,c)))\n        lst1.append(lst)\n    return lst1\n        \n\n        \n\nprint(pascal_triangle(6))\n\n\n\n\n        \n\n"
B25ME012_q29,0,5,0.00,"<output>Check the loop construct in the inner for loop where you're iterating from 1 to `i`, it should be up to `n` not `i` to generate all rows correctly.</output>","def pascal_triangle(n):\n    main_list=[]\n    \n    for i in range (n):\n        new_row=[1]\n        if main_list:\n            last_row=main_list[-1]\n            for j in range (1,i) :\n                new_row.append(last_row[j-1]+last_row[j])\n            new_row.append(1)\n        main_list.append(new_row)\n    return main_list\nprint(pascal_triangle(5))    "
B25MT017_q29,5,5,100.00,"<output>Pay close attention to how you initialize and update each row in the triangle; specifically, consider the first element of each row.</output>","def pascal_triangle(n):\n    triangle = []\n    for i in range(n):\n        row = [1] * (i + 1)\n        for j in range(1, i):\n            row[j] = triangle[i - 1][j - 1] + triangle[i - 1][j]\n        triangle.append(row)\n    return triangle"
B25EE031_q29,0,5,0.00,"<output>Consider using the `and` operator to combine boolean values instead of relying on implicit boolean conversions. For example, instead of `if n <= 0:`, use `if not n:`</output>","def pascal_triangle(n):\n    if n<=0:\n        return []\n    Mylist=[[1]]\n    for i in range(1,n):\n        Thislist=Mylist[-1]\n        Addrow=[1]\n        for j in range(1,len(Thislist)):\n            Addrow.append(Thislist[j-1]+Thislist[j])\n        Addrow.append(1)\n        Mylist.append(Addrow)\n    return Mylist\nprint(pascal_triangle(5))\n    \n        \n            \n"
B25EC022_q29,0,5,0.00,"<output>Check if you're correctly handling the edge case where n is 1, as your code currently returns an empty list for this input.</output>","def pascal_triangle(n):\n    if n <= 0:\n        return []\n    tri = [[1]]\n    for _ in range(1, n):\n        prev = tri[-1]\n        row = [1] + [prev[i] + prev[i + 1] for i in range(len(prev) - 1)] + [1]\n        tri.append(row)\n    return tri\n\n\nfor row in pascal_triangle(5):\n    print(row)\nprint(""-"" * 60)\n"
B25EC037_q29,5,5,100.00,"<output>Consider using a more Pythonic approach to calculate the binomial coefficients, such as the `math.comb` function, which is available in Python 3.8 and later versions.</output>","\ndef pascal_triangle(n):\n    def factorial(m):\n        ans=1\n        if m==0:\n            return 1\n        for i in range(1,m+1):\n            ans*=i\n        \n        return ans\n    req_list=[]\n    for i in range(n):\n        lst=[]\n        for j in range(i+1):\n            lst.append(int(factorial(i)/(factorial(j)*factorial(i-j))))\n        \n        req_list.append(lst)\n    return req_list\n\n\n\n        \n        \n        \n "
B25CS033_q29,5,5,100.00,"<output> Re-examine the inner loop where you calculate `ith_row.append(ncr(i, j))`. Make sure that `ncr` function does not modify any external data structures, as this could lead to unpredictable behavior and incorrect results.</output>","def factorial(n):\n    if n==0 or n==1:\n        return 1\n    return n*factorial(n-1)\n\ndef ncr(n,r):\n    return int(factorial(n)/(factorial(r)*factorial(n-r)))\n\ndef pascal_triangle(n):\n    """"""\n    Return the first n rows of Pascal’s triangle as a list of\n    lists.\n    For n <= 0, return [].\n    """"""\n    p_tri = []\n    for i in range(n):\n        ith_row = []\n        for j in range(i+1):\n            ith_row.append(ncr(i,j))\n        p_tri.append(ith_row)\n\n    return p_tri\n"
B25EC014_q29,5,5,100.00,"<output>Consider adding explicit type hints for the `prev` and `row` variables to ensure they match the expected data types, as this could potentially lead to incorrect results or runtime errors.</output>","def pascal_triangle(n):\n    """"""\n    Return the first n rows of Pascal’s triangle as a list of lists.\n    For n <= 0, return [].\n    """"""\n    if n <= 0:\n        return []\n\n    triangle = [[1]]  # first row\n\n    for i in range(1, n):\n        prev = triangle[-1]\n        # Each new row starts and ends with 1\n        row = [1]\n        # middle elements = sum of two above elements\n        for j in range(1, len(prev)):\n            row.append(prev[j - 1] + prev[j])\n        row.append(1)\n        triangle.append(row)\n\n    return triangle\n"
B25MT015_q29,5,5,100.00,"<output> Consider that the `result` list is being modified during iteration, which can cause issues with indexing and result preservation. Instead, create a new row and append it to the `result` list at the end of each iteration. </output>",def pascal_triangle(n):\n    \n    if n <= 0:\n        return []\n    result = []\n    for i in range(n):\n        row = []\n        for j in range(i+1):\n            if j == 0:\n                row.append(1)\n            elif j == i:\n                row.append(1)\n            else:\n                \n                val = result[i-1][j-1] + result[i-1][j]\n                row.append(val)\n        result.append(row)\n    return result
B25ME010_q29,5,5,100.00,"<output>Consider initializing each row of Pascal's triangle with a new list instead of reusing the same inner list (`lisn = []`), to avoid overwriting previously computed values.</output>","def pascal_triangle(n):\n    lis=[]\n    for i in range(0,n):\n        lisn=[]\n        for j in range(0,i+1):\n            if i==j or j==0:\n                lisn.append(1)\n            else:\n                lisn.append((lis[i-1][j-1])+(lis[i-1][j]))\n        lis.append(lisn)\n    return(lis)\n"
B25DS020_Q29,5,5,100.00,"<output> The issue lies in the line where you're trying to access `result[i - 1][j - 1]`, which is out of bounds because Python list indices start at 0, not 1. You should use `result[i - 1][j]` instead. </output>","def pascal_triangle(n):\n    if n<=0:\n        return []\n    else:\n         result=[]\n         for i in range(n):\n            row=[1]*(i+1)\n            for j  in range(1,i):\n                row[j]=result[i-1][j-1]+result[i-1][j]\n            result.append(row)\n         return result\n\n    "
B25ME043_q29,5,5,100.00,<output>Check if the condition `n <= 0` is correctly used to handle invalid inputs and consider using an `if-else` statement instead of just assigning an empty list when `n` is less than or equal to zero.</output>,"def pascal_triangle(n) :\n    lst=[]\n    if n<=0 :\n        return []\n    lst=[[1]]\n    for i in range(n-1):\n        before=lst[-1]\n        row=[1]\n        for j in range(1, len(before)) :\n            row.append(before[j-1] + before[j])\n        row.append(1)\n        lst.append(row)\n    return lst       "
B25ME003_q29,0,5,0.00,"<output>Consider adding a base case to handle the condition when n is 1 separately, as it would return [1] instead of an empty list.</output>","def pascal_triangle(n):\n    if n <= 0:\n        return []\n    triangle = [[1]]  \n    for i in range(1, n):\n        prev = triangle[-1]\n        row = [1]  \n        for j in range(1, len(prev)):\n            row.append(prev[j - 1] + prev[j])\n        row.append(1)  \n        triangle.append(row)\n    return triangle\n#one example\nprint(pascal_triangle(5)) #output-[[1], [1, 1], [1, 2, 1], [1, 3, 3, 1], [1, 4, 6, 4, 1]]"
B25ME013_q29,5,5,100.00,<output> You are missing the first row in your Pascal's triangle (with a single '1') when initializing `pas_tri`. Start with `pas_tri = [[1]]` instead of `pas_tri = [[1]]`. </output>,"def pascal_triangle(n):\n    if n<=0:\n        return []\n    pas_tri=[[1]]\n    for i in range (1,n):\n        lst=[]\n        lst.append(1)\n        for j in range (1,i):\n            lst.append(pas_tri[i-1][j-1]+pas_tri[i-1][j])\n        lst.append(1)\n        pas_tri.append(lst)\n    return pas_tri\n            \n            \n            \n        "
B25EE012_q29,4,5,80.00,"<output>Consider initializing the first row of the triangle with [1] instead of just [1], as your current code starts with an empty list for the first row.</output>","def pascal_triangle(n):\n    if n == 0:\n        return []\n    triangle = [[1]]\n    \n    for i in range (1,n):\n        prv = triangle [-1]\n        row = [1]\n        for j in range (1,i):\n            row.append(prv[j-1] + prv[j])\n            \n        row.append(1)\n        triangle.append(row)\n        \n    return triangle\n"
B25EE017_q29,5,5,100.00,"<output> The issue lies in the inner loop where you're using `t[i - 1][j - 1]` and `t[i - 1][j]`, which is incorrect because it's trying to access elements from a row that hasn't been generated yet. </output>","def pascal_triangle(n):\n    t = []\n    for i in range(n):\n        row = [1]*(i + 1)\n        for j in range(1,i):\n            row[j] = t[i - 1][j - 1] + t[i - 1][j]\n        t.append(row)\n    return t"
B25ME027_Q29,5,5,100.00,"<output> The issue lies in the line `for j in range(1, i):`, where you're generating rows up to index `i`. However, the first row of Pascal's triangle should always have its elements at indices 0 and 1. Change this to `for j in range(i):` to correctly generate each row. </output>","def pascal_triangle(n):\n\n    if n <= 0:\n        return []\n\n    \n    triangle = [[1]]\n\n    \n    for i in range(1, n):\n        prev_row = triangle[-1]   \n        new_row = [1]\n        \n        \n        for j in range(1, i):\n            new_row.append(prev_row[j - 1] + prev_row[j])\n\n        new_row.append(1)         \n        triangle.append(new_row)  \n\n    return triangle\n"
B25EE018_Q29,2,5,40.00,"<output> The issue lies in the way you're handling the first and last elements of each row. In Pascal's triangle, these elements are always 1, but your code is using the boolean operators incorrectly, which might be causing an incorrect calculation.</output>","def pascal_triangle(n):\n    if n <= 0:\n        return []\n    triangle = [[]]\n    for i in range(1, n):\n        prev_row = triangle[-1]\n        row = [1] + [prev_row[j] + prev_row[j + 1] for j in range(len(prev_row) - 1)] + [1]\n        triangle.append(row)\n    return triangle\n\n#test cases\nif __name__ == ""__main__"":\n    print(pascal_triangle(5))"
B25DS038_q29,0,5,0.00,<output>Check the loop bounds in your function to ensure that you are not accessing out-of-bounds indices when generating Pascal's triangle.</output>,"def rotate_matrix(matrix):\n    n = len(matrix)\n    for i in range(n):\n        for j in range(i, n):\n            matrix[i][j], matrix[j][i] = matrix[j][i], matrix[i][j]\n    for x in matrix:\n        x.reverse()\n    return matrix\n"
B25CS037_q29,5,5,100.00,"<output>Consider the initial row of the triangle being initialized with a length of `i + 1` instead of just `i`, which would match the correct pattern in Pascal's triangle.</output>","def pascal_triangle(n):\n\n    triangle = []\n    for i in range(n):\n        row = [1] * (i + 1)\n        for j in range(1, i):\n            row[j] = triangle[i - 1][j - 1] + triangle[i - 1][j]\n        triangle.append(row)\n    return triangle"
B25CS023_Q29,5,5,100.00,"<output>Consider handling the case when n equals 1 separately, as your current implementation returns an empty list for n=1.</output>","def pascal_triangle(n):\n    """"""\n    Return the first n rows of Pascal’s triangle as a list of\n    lists.\n    For n <= 0, return [].\n    """"""\n    import math\n    if n<=0:\n        return []\n    a=[[1]]\n    for i in range(1,n):\n        b=[]\n        for j in range(i+1):\n            b.append(math.comb(i,j))\n        a.append(b)\n    return a\n\n    "
B25DS018_q29,0,5,0.00,"<output>Consider using the `math.comb` function to calculate combinations instead of manual calculations, as it can help avoid off-by-one errors and ensure accurate results.</output>","def pascal_triangle(n):\n    list = []\n    for i in range(n):\n        row = [1] * (i + 1)\n        for j in range(1, i, 1):\n            row[j] = list[i - 1][j - 1] + list[i - 1][j]\n        list.append(row)\n\n    return list\n\nprint(pascal_triangle(5))  # [[1], [1,1], [1,2,1], [1,3,3,1], [1,4,6,4,1]]"
B25DS022_q29,0,5,0.00,"<output>Consider adding an initial row of all ones to handle the case when n is 1, as your current implementation only generates rows for n > 1.</output>","def pascal_triangle(n):\n    """"""\n    Return the first n rows of Pascal’s triangle as a list of lists.\n    For n <= 0, return [].\n    """"""\n    if n <= 0:\n        return []\n\n    triangle = [[1]]  # First row\n\n    for m in range(1, n):\n        prev_row = triangle[-1]\n        new_row = [1]  # Start with 1\n        for k in range(1, len(prev_row)):\n            new_row.append(prev_row[k - 1] + prev_row[k])\n        new_row.append(1)  # End with 1\n        triangle.append(new_row)\n\n    return triangle\n\n\n# Test Case\nprint(pascal_triangle(5))\n"
B25CS038-Q29,0,5,0.00,"<output> Make sure to handle the case when `n` is 1 correctly, as your current implementation will return an empty list for `n=1`, whereas the expected output should be [[1]]. </output>","def pascal_triangle(n):\n    \n    if n <= 0:\n        return []\n\n    triangle = [[1]]  \n\n    for i in range(1, n):\n        prev_row = triangle[-1]\n        row = [1]\n        for j in range(1, len(prev_row)):\n            row.append(prev_row[j - 1] + prev_row[j])\n        row.append(1)\n        triangle.append(row)\n\n    return triangle\nprint(pascal_triangle(5))"
B25MT001_Q29,0,5,0.00,<output>Consider using the combination formula directly to calculate each row of Pascal's triangle instead of manually calculating factorials and iterating over ranges.</output>,"def factorial(n):\n    if n < 0:\n        raise ValueError\n    if n == 0 or n == 1:\n        return 1\n    \n    result = 1\n    for i in range(2, n + 1):\n        result *= i\n    return result\n\ndef pascal_triangle(n):\n    if n == 1:\n        return [[1]]\n    \n    output_list = [[1]]  \n    \n    for i in range(2, n + 1):\n        output_list1 = [1]  \n        for j in range(1, i - 1):  \n            k = int(factorial(i - 1) / (factorial(j) * factorial(i - 1 - j)))\n            output_list1.append(k)\n        output_list1.append(1)  \n        output_list.append(output_list1)\n    \n    return output_list\n\nprint(pascal_triangle(6))\n\n\n\n\n\n    \n    \n\n"
B25MT025_q29,5,5,100.00,"<output> The issue lies in the incorrect use of indices when accessing elements from the previous row. In Pascal's triangle, each element is calculated as the sum of the two directly above it. The correct line should be `row.append(triangle[i - 1][j] + triangle[i - 1][j - 1])`, not `triangle[i - 1][j - 1] + triangle[i - 1][j]`. </output>","def pascal_triangle(n):\n    if n <= 0:\n        return []\n    triangle = [[1]]\n    for i in range(1, n):\n        row = [1]\n        for j in range(1, i):\n            row.append(triangle[i-1][j-1] + triangle[i-1][j])\n        row.append(1)\n        triangle.append(row)\n    return triangle\n"
B25ME002_q29,3,5,60.00,"<output> The issue lies in the indexing of the list `l` when accessing its elements. In Python, lists are 0-indexed, meaning the first element is at index 0, not 1. Therefore, when trying to access `l[i - 1][j]`, it should be `l[i - 1][j - 1]`. </output>","def pascal_triangle(n):\n    l=[]\n    if(n<=0):\n        return [[]]\n    l=[[1]]\n    l1=[]\n    for i in range(1,n,1):\n        l1.append(1)\n        for j in range(len(l[i-1])-1):\n            l1.append(l[i-1][j]+l[i-1][j+1])\n        l1.append(1)\n        l.append(l1)\n        l1=[]\n    return l"
B25DS015_q29,3,5,60.00,"<output> The issue lies in the incorrect use of `while` loop condition. Instead of `i != n`, it should be `i < n`, as the loop needs to run `n-1` times to generate `n` rows. </output>","def pascal_triangle(n):\n    res = [[1],[1,1]]\n    i = 2\n    if n == 1:\n        res = [[1]]\n        return res\n    elif n == 2:\n        res = [[1],[1,1]]\n        return res\n    else:\n        while i != n:\n            s = []\n            p = res[-1]\n            s.append(p[0])\n            for q in range(i-1):\n                s.append(p[q]+p[q+1])\n            s.append(p[-1])\n            res.append(s)\n            i += 1\n        return res\n    \n"
B25ME057_q29,5,5,100.00,<output>Consider adding an initial 0 to each row to correctly represent Pascal's triangle.</output>,"def pascal_triangle(n):\n    if n <= 0:\n        return []\n    tri= [[1]]  \n    for i in range(1, n):\n        prev_r = tri[-1]\n        row = [1] \n        for j in range(1, len(prev_r)):\n            row.append(prev_r[j - 1] + prev_r[j])\n        row.append(1)\n        tri.append(row)\n    return tri"
B25EE036_q29,0,5,0.00,"<output>Consider using the bitwise XOR operator (^) to combine adjacent elements instead of adding them, as this is a common convention when working with Pascal's triangle.</output>","def pascal_triangle(n):\n    """"""\n    Return the first n rows of Pascal’s triangle as a list of lists.\n    """"""\n    if n <= 0:\n        return []\n\n    triangle = [[1]]\n\n    for i in range(1, n):\n        prev = triangle[-1]\n        row = [1]\n        for j in range(1, len(prev)):\n            row.append(prev[j - 1] + prev[j])\n        row.append(1)\n        triangle.append(row)\n\n    return triangle\n\nprint(pascal_triangle(5))"
B25CS046_q29,5,5,100.00,"<output>Be cautious when using division in your loop, as it may cause loss of precision and affect the result.</output>","def pascal_triangle(n):\n    l=[]\n    if n<=0:\n        return []\n    else:\n        for r in range(1,n+1):\n            x=[]\n            k=1\n            for m in range(1,r+1):\n                x.append(int(k))\n                k*=(r-m)/m\n            l.append(x)\n        return l   "
B25MT007_q29,0,5,0.00,"<output>Be cautious when generating random numbers, as the use of `11 ** i` could potentially produce incorrect results due to integer overflow.</output>","def pascal_triangle(n):\n    lst=[]\n    if n<=0:\n        return []\n    else:\n        for i in range(0,n):\n            lst.append([int(x) for x in str(11**i)])\n        return lst\nprint(pascal_triangle(5))"
B25MT032_q29,5,5,100.00,"<output>Consider adding an initial row with [1] to handle the case when n is 1, as your current implementation only includes rows starting from index 1.</output>","def pascal_triangle(n):\n    if n <= 0:\n        return []\n\n    triangle = [[1]]  # First row\n\n    for i in range(1, n):\n        prev_row = triangle[-1]\n        \n        new_row = [1]\n       \n        for j in range(1, len(prev_row)):\n            new_row.append(prev_row[j - 1] + prev_row[j])\n        new_row.append(1)\n        triangle.append(new_row)\n\n    return triangle\n\n#print(pascal_triangle(7))"
B25MM006_q29,5,5,100.00,"<output> Make sure that you are not modifying the `triangle` list while iterating over its rows, as this can cause unexpected behavior and incorrect results.</output>","def pascal_triangle(n):\n    if n <= 0:\n        return []\n    \n    triangle = [[1]]  \n\n    for i in range(1, n):\n        prow = triangle[-1]\n        nrow = [1]\n        for j in range(1, len(prow)):\n            nrow.append(prow[j-1] + prow[j])\n        nrow.append(1)\n        triangle.append(nrow)\n\n    return triangle\n"
b25me058_q29,5,5,100.00,"<output> Consider using the bitwise XOR operator (^) to combine the top two elements of each row in Pascal's triangle instead of adding them, as this maintains the correct binary pattern required for generating Pascal's triangle. </output>","def pascal_triangle(n):\n    if n<=0:\n        return []\n\n    trian=[[1]] \n    for i in range(1,n):\n        prev=trian[-1]\n        row=[1]\n        for j in range(1, len(prev)):\n            row.append(prev[j-1]+prev[j])\n        row.append(1)\n        trian.append(row)\n\n    return trian\n"
B25EE053_q29,5,5,100.00,<output>Consider using `or` instead of `<=` for the initial condition to correctly handle cases where `n` is 0.</output>,def pascal_triangle(n):\n    if n<=0:\n        return []\n    \n    triangle=[[1]]\n    for i in range(n-1):\n        previousRow=triangle[len(triangle)-1]\n        newRow=[1]\n        for j in range(len(previousRow) - 1):\n            new_element = previousRow[j] + previousRow[j+1]\n            newRow.append(new_element)\n        newRow.append(1)\n        triangle.append(newRow)\n    return triangle
B25MM012_Q29,5,5,100.00,"<output>Consider using the bitwise XOR operator (^) to combine adjacent elements in each row of Pascal's triangle instead of adding them together, as this is the traditional method for calculating binomial coefficients.</output>","def pascal_triangle(n):\n    if n <= 0:\n        return []\n\n    triangle = [[1]]  \n\n    for i in range(1, n):\n        prev_row = triangle[-1]\n        new_row = [1]\n\n        \n        for j in range(1, len(prev_row)):\n            new_row.append(prev_row[j-1] + prev_row[j])\n\n        new_row.append(1)\n        triangle.append(new_row)\n\n    return triangle"
B25ME056_q29,0,5,0.00,"<output>Print statements are used instead of returning values, which means the function does not return the result as required.</output>","def pascal_triangle(n):\n    for i in range(n):\n        num = 1\n        for j in range(i + 1):\n            print(num, end=' ')\n            num = num * (i - j) // (j + 1)\n        print()\n\n"
B25MT014_q29,4,5,80.00,"<output> The issue lies in the line where you're generating new rows for the triangle. You're currently using `range(1, i)`, which will skip the first element of each row because it starts from 1 and goes up to `i`. It should be `range(i)` instead. </output>","def pascal_triangle(n):\n    if n == 0:\n        return []\n    triangle = [[1]]\n    for i in range(1, n):\n        prev_row = triangle[-1]\n        new_row = [1]\n        for j in range(1, i):\n            new_row.append(prev_row[j-1] + prev_row[j])\n        new_row.append(1)\n        triangle.append(new_row)\n    return triangle"
B25EE058_q29,4,5,80.00,<output>Consider using the bitwise XOR operator (^) to calculate the next row in Pascal's triangle instead of combining elements with addition and indexing.</output>,"def pascal_triangle(n):\n    if n<=0:\n        return []\n    elif n==1:\n        return [1]\n    elif n==2:\n        return [[1],[1,1]]\n    else:\n        lst=[[1],[1,1]]\n        for i in range(1,n-1):\n             arb=[lst[i][k]+lst[i][k+1] for k in range(len(lst[i])-1)]\n             arb=[1]+arb+[1]\n             lst.append(arb)\n        return lst\n             \n            \n"
B25ME005_q29,3,5,60.00,"<output>Consider using the bitwise AND operator (&) instead of the logical AND operator (and), as the latter can short-circuit and affect the iteration order.</output>","def pascal_triangle(n):\n    main = [[1],[1,1]]\n    temp = [1,1]\n    wanted = []\n    if n<0:\n        return False\n    if n == 0:\n        return []\n    elif n == 1:\n        return main[0]\n    elif n == 2:\n        return main\n    for x in range(2,n):\n        wanted.append(1)\n        for y in range(0,len(temp)-1):\n            \n            z = temp[y] + temp [y+1]\n            wanted.append(z)\n        wanted.append(1)\n        main.append(wanted)\n        temp = wanted\n        wanted = []\n    return main\n"
b25cs040.q29,0,5,0.00,<output>Check if you are using a variable name that is not defined in your import statement; 'b25cs040' seems to be the package name but it's not used anywhere.</output>,"def pascal_triangle(n):\n    triangle = []\n    for i in range(n):\n        row = [1] * (i + 1)\n        for j in range(1, i):\n            row[j] = triangle[i-1][j-1] + triangle[i-1][j]\n        triangle.append(row)\n    return triangle\n\nfor row in pascal_triangle(5):\n   print(row)"
B25EC034_q29,5,5,100.00,<output>Consider changing `if n <= 0:` to `if n < 1:` to ensure that the function handles cases where `n` is exactly zero correctly.</output>,"def pascal_triangle(n):\n    if n <= 0:\n        return []\n\n    triangle = [[1]] \n    for i in range(1, n):\n        old_ro = triangle[-1] \n        new_ro = [1] \n        for j in range(1, len(old_ro)):\n            new_ro.append(old_ro[j - 1] + old_ro[j])\n        new_ro.append(1) \n        triangle.append(new_ro)\n    return triangle"
B25CS045_Q29,0,5,0.00,<output>Check if you're correctly indexing into the previous row when calculating each element in the current row.</output>,"def pascal_triangle (n):\n    if n < 0:\n        return ()\n    triangle = []\n    for i in range(n):\n        row = [1] * (i + 1)\n        for j in range(1, i):\n            row[j] = triangle[i - 1][j - 1] + triangle[i - 1][j]\n        triangle.append(row)\n    return triangle\nprint(pascal_triangle(5))"
