student_id,tests_passed,tests_total,score_percentage,semantic_summary,code_snippet
B25CS014_q29,0,5,0.00,<output> Check if `n` is 0 before entering the loop to avoid indexing errors when accessing `prev_row[j - 1]`. </output>,"def pascal_triangle(n):\n    """"""\n    Return the first n rows of Pascal’s triangle as a list of lists.\n    For n <= 0, return [].\n    """"""\n    if n <= 0:\n        return []\n\n    triangle = [[1]]  # first row\n\n    for i in range(1, n):\n        prev_row = triangle[-1]\n        # Generate next row using adjacent sums\n        row = [1]\n        for j in range(1, len(prev_row)):\n            row.append(prev_row[j - 1] + prev_row[j])\n        row.append(1)\n        triangle.append(row)\n\n    return triangle\nprint(pascal_triangle(5))\n\n"
B25CS061_q29,5,5,100.00,"<output> The student's code is missing the initial row with a single 1 when n equals 0, which should be handled to avoid index errors and ensure correct output. </output>","def pascal_triangle(n):\n    final = []\n    for i in range(n):\n        if i == 0:\n            final.append([1])\n        else:\n            prev = final[-1]\n            new_row = [1]\n            for j in range(1, len(prev)):\n                new_row.append(prev[j - 1] + prev[j])\n            new_row.append(1)\n            final.append(new_row)\n    return final\n"
Q29 B25MM007,5,5,100.00,"<output> The issue lies in the initialization of the first row of Pascal's triangle. Currently, it is initialized with only one element '1', whereas it should be initialized with a list containing this single element to match the problem description.</output>","def pascal_triangle(n):\n    """"""\n    Return the first n rows of Pascal’s triangle as a list of lists.\n    For n <= 0, return [].\n    """"""\n    if n <= 0:\n        return []\n\n    triangle = [[1]]  # First row\n\n    for i in range(1, n):\n        prev_row = triangle[-1]\n        new_row = [1]\n\n        # Generate middle values\n        for j in range(1, len(prev_row)):\n            new_row.append(prev_row[j - 1] + prev_row[j])\n\n        new_row.append(1)\n        triangle.append(new_row)\n\n    return triangle\n\n\n# Example test case\nif __name__ == ""__main__"":\n    print(pascal_triangle(5))\n    # Expected: [[1], [1,1], [1,2,1], [1,3,3,1], [1,4,6,4,1]]\n"
B25MM002_q29,5,5,100.00,"<output>Consider adding an initial row of all ones to your triangle when n is 1, as this is the base case for generating Pascal's triangle.</output>","def pascal_triangle(n):\n    if n<= 0:\n        return []\n    triangle = [[1]]\n    for i in range(1, n):\n        prev = triangle[-1]\n        row = [1]\n        for j in range(1, len(prev)):\n            row.append(prev[j-1] + prev[j])\n        row.append(1)\n        triangle.append(row)\n    return triangle\n\n    \n    "
{B25MM017}_q29,5,5,100.00,<output>Consider using `or 0` instead of just `0` when initializing the triangle and row lists to handle cases where n is zero.</output>,"#Q29\n\n\n\ndef pascal_triangle(n):\n    if n <= 0:\n        return []\n    triangle = [[1]]\n    for i in range(1, n):\n        prev = triangle[-1]\n        row = [1]\n        for j in range(1, len(prev)):\n            row.append(prev[j - 1] + prev[j])\n        row.append(1)\n        triangle.append(row)\n    return triangle\n\n"
B25EE030-q29,0,5,0.00,"<output> The issue lies in the fact that you're using `prev[j - 1] + prev[j]` to calculate each element in the row, but this approach is incorrect for generating Pascal's triangle. The correct formula should be `prev[j - 1] * (n - i) // i`, where `i` is the current row index. </output>","def pascal_triangle(n):\n    if n <= 0:\n        return []\n    tri=[[1]]   \n\n    for i in range(1, n):\n        prev=tri[-1]        \n        row=[1]\n        for j in range(1, len(prev)):\n            row.append(prev[j - 1] + prev[j])\n\n        row.append(1)              \n        tri.append(row)      \n\n    return tri\n\nprint(pascal_triangle(5))\n"
B25ME018_q29,5,5,100.00,<output>Consider adding explicit checks for the base cases where n = 1 and n = 2 separately to handle them correctly before proceeding with the rest of the triangle construction.</output>,"def pascal_triangle(n):\n    """"""\n    Return the first n rows of Pascal’s triangle as a list of\n    lists.\n    For n <= 0, return [].\n    """"""\n    if n<=0:\n        return []\n    \n    triangle =[]\n    for i in range(n):\n        row =[1]  #Every row starts with 1\n    \n        #Middle elements\n        if i>0:\n            prev_row =triangle[i-1]\n            for j in range(len(prev_row)-1):\n                row.append(prev_row[j] +prev_row[j+1])\n\n        #Every row ends with 1\n        if i>0:\n            row.append(1)\n\n        triangle.append(row)\n    return triangle\n'''\nprint(pascal_triangle(5))\n# [[1], [1,1], [1,2,1], [1,3,3,1], [1,4,6,4,1]]\n'''"
B25DS032_q29,0,5,0.00,"<output> Consider adding a condition to handle the case when `i` equals 1 separately, as this is where the first row of Pascal's triangle should be added directly without the nested loop. This might help resolve the issue with the current implementation. </output>","def pascal_triangle(n):\n    if n <= 0:\n        return []\n    \n    triangle = [[1]]\n    \n    for i in range(1, n):\n        prev_row = triangle[-1]\n        new_row = [1]\n        for j in range(1, i):\n            new_row.append(prev_row[j-1] + prev_row[j])\n        new_row.append(1)\n        triangle.append(new_row)\n        \n    return triangle\n\nprint(pascal_triangle(5))"
B25DS041_q29,0,5,0.00,<output>Consider adding an initial 0 to each row of Pascal's triangle by prepending it before generating the new row.</output>,"def pascal_triangle(n):\n    \n    if n <= 0:\n        return []\n\n    triangle = [[1]]  \n\n    for i in range(1, n):\n        \n        k = triangle[-1]   \n        new_row = [1]         \n\n        for j in range(1, len(k)):\n            \n            new_row.append(k[j - 1] + k[j])\n\n        new_row.append(1)\n        \n        triangle.append(new_row)\n\n    return triangle\n\nprint(pascal_triangle(5))"
B25EC041_q29,5,5,100.00,<output>Check that `l[i - 1]` is a list before trying to access its elements with indexing (`j - 1`) and consider using the `get()` method for safe dictionary lookups.</output>,"def pascal_triangle(n):\n    l=[]\n    for i in range(0,n):\n        le=[]\n        for j in range(0,i+1):\n            if(i-1>=0 and j-1>=0 and j<len(l[i-1])):\n                x=l[i-1][j-1]+l[i-1][j]\n            else:\n                x=1\n            le.append(x)\n        l.append(le)\n    return l\n            "
B25DS023_q29,5,5,100.00,"<output> The student's code is generating rows for `b` instead of `z`, causing it to produce incorrect values and resulting in an incomplete Pascal's triangle.</output>","def pascal_triangle(n):\n    import math\n    def combination(x,y):\n        c = int(math.factorial(x)/(math.factorial(y)*math.factorial(x-y)))\n        return c\n    def making_list(z):\n        lst = []\n        a = 0\n        while a<=z:\n            lst.append(combination(z,a))\n            a = a + 1\n        return lst\n    if n<=0:\n        return []\n    else:\n        b = 0\n        final_list = []\n        while b<n:\n            final_list.append(making_list(b))\n            b = b + 1\n        return final_list\n\n"
B25CS012_q29,4,5,80.00,"<output> Consider using the bitwise XOR operator (^) to combine elements when generating each row, as this will correctly handle the addition of adjacent elements while avoiding potential integer overflow issues with large numbers.</output>","def pascal_triangle(n):\n    if n<=0:\n        return []\n    elif n==1:\n        return [1]\n    elif n==2:\n        return [[1],[1,1]]\n    else:\n        list=[[1],[1,1]]\n        for i in range(1,n-1):\n             arb=[list[i][k]+list[i][k+1] for k in range(len(list[i])-1)]\n             arb=[1]+arb+[1]\n             list.append(arb)\n        return list\npascal_triangle(5)\n # [[1], [1,1], [1,2,1], [1,3,3,1], [1,4,6,4,1]]"
B25ME028_q29,0,5,0.00,"<output>Verify that you are printing the values instead of returning them, as the problem requires the function to return a list of lists.</output>","def pascal_triangle(n):\n    for i in range(n):\n        num=1\n        for j in range(i+1):\n            print(num,end="" "")\n            num = num*(i-j)//(j+1)\n        print()\n    "
B25CS017_Q29,5,5,100.00,"<output> The student's code is correctly generating Pascal's triangle rows but may be missing the first row, which should contain only 1. Consider adding an initial row to the triangle before the loop starts.</output>","def pascal_triangle(n):\n    if n <= 0:\n        return []\n    triangle = [[1]]\n    for i in range(1, n):\n        row = [1]\n        for j in range(1, i):\n            row.append(triangle[i-1][j-1] + triangle[i-1][j])\n        row.append(1)\n        triangle.append(row)\n    return triangle"
S25MA018_q29,5,5,100.00,"<output> The issue lies in the line where you calculate the middle element of each row. You're using `prev[j] + prev[j + 1]`, but this will only work correctly if the length of the previous row is even, which isn't guaranteed for all rows in Pascal's triangle. </output>","def pascal_triangle(n):\n    if n <= 0:\n        return []\n    triangle = [[1]]\n    for i in range(1, n):\n        prev = triangle[-1]\n        row = [1] + [prev[j] + prev[j + 1] for j in range(len(prev) - 1)] + [1]\n        triangle.append(row)\n    return triangle\n"
B25ME035_Q29,0,5,0.00,"<output>Consider using `prev[j]` instead of `prev[j - 1] + prev[j]` when calculating the middle elements of each row, as this would correctly handle cases where the row index is equal to the column index.</output>","def pascal_triangle(n):\n    if n <= 0:\n        return []\n    triangle = [[1]]  \n    for i in range(1, n):\n        prev= triangle[-1]\n        row = [1]\n        for j in range(1, len(prev)):\n            row.append(prev[j - 1] + prev[j])\n        row.append(1)\n        triangle.append(prev)\n    return triangle\nprint(pascal_triangle(5))"
B25EC015_q29,0,5,0.00,"<output>Reassign 'd' as a nonlocal variable in the outer scope using 'nonlocal d', so that changes made to it within the inner loops persist across iterations.</output>","def fac(n):\n    if n==1 or n==0:\n        return(1)\n    return(n*fac(n-1))\ndef pascal_triangle(m):\n    if m==1:\n        return [1]\n    elif m>1:\n        d=[]\n        for n in range(1,m+1):\n            p=[]\n            for r in range(n):\n                s=(fac(n-1))/(fac(r)*fac(n-r-1))\n                p.append(int(s))\n            d.append(p)\n    return d\nprint(pascal_triangle(5))\n"
B25CS008_Q29,5,5,100.00,<output>Consider adding an initial 0 to each row of the triangle to correctly represent Pascal's triangle.</output>,"def pascal_triangle(n):\n\n    if n <= 0:\n        return []\n\n    triangle = [[1]]\n\n    for i in range(1, n):\n        prev_row = triangle[-1]\n        row = [1]\n        for j in range(1, len(prev_row)):\n            row.append(prev_row[j - 1] + prev_row[j])\n        row.append(1)\n        triangle.append(row)\n\n    return triangle"
B25CS050_q29,4,5,80.00,"<output>Check if you are correctly initializing each row with a list containing 1s, as this is crucial to the generation of Pascal's triangle.</output>","def pascal_triangle(n):\n    if n == 0:\n        return []\n    triangle = [[1]]\n    \n    for i in range (1,n):\n        prv = triangle [-1]\n        row = [1]\n        for j in range (1,i):\n            row.append(prv[j-1] + prv[j])\n            \n        row.append(1)\n        triangle.append(row)\n        \n    return triangle\n"
B25EE016_q29,5,5,100.00,"</output> The issue lies in the condition for generating each row of the triangle; you should be checking up to `i`, not `i - 1` when appending elements to the current row. Change `range(1, i)` to `range(1, i + 1)`.","def pascal_triangle(n):\n    if n <= 0:\n        return []\n\n    triangle = [[1]] \n\n    for i in range(1, n):\n        prev_row = triangle[-1]\n        row = [1]  \n\n        for j in range(1, i):\n            row.append(prev_row[j - 1] + prev_row[j])\n\n        row.append(1) \n        triangle.append(row)\n\n    return triangle"
B25EE003_q29,5,5,100.00,"<output>Consider using the bitwise XOR operator (^) to combine elements instead of adding them, as this will ensure that the intermediate results do not overflow and produce incorrect values.</output>","##q29\ndef pascal_triangle(n):\n    if n <= 0:\n        return []\n    triangle = [[1]]\n    for i in range(1, n):\n        prev = triangle[-1]\n        row = [1] + [prev[j - 1] + prev[j] for j in range(1, len(prev))] + [1]\n        triangle.append(row)\n    return triangle\n"
B25EE025_q29,0,5,0.00,"<output>Check the loop construct in the inner iteration; it should be `range(i)`, not `range(1, i)`, to ensure all elements are generated correctly.</output>","def pascal_triangle(n):\n    if n <= 0:\n        return []\n\n    triangle = []\n    for i in range(n):\n        row = [1] * (i + 1)\n\n        for j in range(1, i):\n            row[j] = triangle[i - 1][j - 1] + triangle[i - 1][j]\n        \n        triangle.append(row)\n\n    return triangle\n\n#example\nprint(pascal_triangle(5))"
B25DS025_q29,5,5,100.00,"<output> The issue lies in the fact that you are modifying the `a` list while iterating over it, which can cause unpredictable behavior and incorrect results.</output>","def pascal_triangle(n):\n    """"""\n    Return the first n rows of Pascal's triangle as a list of\n    lists.\n    For n <= 0, return [].\n    """"""\n    if n <= 0:\n        return []\n    a=[[1]]\n    for i in range(n-1):\n        b=[]\n        b.append(1)\n        b.append(1)\n        for j in range(1,len(a[i])):\n            b.insert(j,a[i][j]+a[i][j-1])\n        a.append(b)\n    return a"
B25MM001_Q29,0,5,0.00,<output>The loop that generates each row of Pascal's triangle should start from 0 instead of 1 to correctly calculate the first n rows.</output>,"def pascal_triangle(n: int) -> list[list[int]]:\n   \n    if n <= 0:\n        return []\n\n    triangle = [[1]]\n    \n    \n    for i in range(1, n):\n       \n        previous_row = triangle[-1]\n        \n        current_row = [1]\n        \n        for j in range(len(previous_row) - 1):\n            new_val = previous_row[j] + previous_row[j+1]\n            current_row.append(new_val)\n         \n        current_row.append(1)\n        \n        triangle.append(current_row)\n        \n    return triangle\n\nprint(pascal_triangle(5))"
B25ME017_q29,1,5,20.00,"<output> The issue lies in the way you're converting each character of the string '11 ** i' to an integer, which is not necessary and might cause incorrect results due to leading zeros.</output>",def pascal_triangle(n):\n    a  =[]\n    for i in range(n+1):\n        b = str(11**i)\n        c = []\n        for j in b:\n            c.append(int(j))\n        a.append(c)\n    return a
B25ME059_q29,3,5,60.00,"<output> The issue lies in the incorrect combination of boolean operators. In Python, `or` has a short-circuit behavior, meaning it only evaluates the second operand if the first operand is false. This can lead to unexpected results when combining conditions. </output>","def pascal_triangle(n):\n    list1=[[1]]\n    if(n==1):\n        return list1\n    elif(n==2):\n        list1.append([1,1])\n        return list1\n    else:\n        list1.append([1,1])\n        for i in range(3,n+1):\n            a=[]\n            for j in range(i-2):\n                a.append(list1[-1][j]+list1[-1][j+1])\n            a.insert(0,1)\n            a.append(1)\n            # print(a)\n            list1.append(a)\n        return list1"
B25EC024_q29,5,5,100.00,"<output> The issue lies in the fact that you're appending to `first_row` even when `n` is 1, which results in an extra row being added. Change `for i in range(1, n):` to `for i in range(1, n - 1):` to fix this.</output>","def pascal_triangle(n):\n    if n <= 0 :\n        return []\n    first_row = [[1]]\n    for i in range(1, n):\n        prev_row = first_row[-1]\n        new_row = [1]\n        \n        for j in range(1, len(prev_row)):\n            new_row.append(prev_row[j -1] + prev_row[j])\n        new_row.append(1)\n        first_row.append(new_row)\n\n    return first_row \n       \npascal_triangle(5)"
B25EE046_q29,5,5,100.00,"<output> Consider using `if` statements to conditionally add rows to the triangle instead of relying on the boolean nature of the list append operation, as this can lead to unexpected behavior when the list is empty or contains non-numeric values.</output>","def pascal_triangle(n):\n    if n <= 0:\n        return []\n    triangle = [[1]] \n    for i in range(1, n):\n        pre_r = triangle[-1]\n        r = [1]\n        for j in range(1, len(pre_r)):\n            r.append(pre_r[j - 1] + pre_r[j])\n        r.append(1)\n        triangle.append(r)\n\n    return triangle\n\n"
B25DS026.q29,0,5,0.00,<output> You forgot to import the necessary module 'math' which is required for calculating binomial coefficients using the formula `nCr = n! / (r!(n-r)!)`. Make sure to add `import math` at the beginning of your code. </output>,"def pascal_triangle(n):\n    if n <= 0:\n        return []\n    triangle = [[1]]\n    for i in range(1, n):\n        prev_row = triangle[-1]\n        row = [1]\n        for j in range(1, i):\n            row.append(prev_row[j - 1] + prev_row[j])\n        row.append(1)\n        triangle.append(row)\n    return triangle\nprint(pascal_triangle(5))"
B25DS016_q29,5,5,100.00,"<output>Check that you're not modifying the `triangle` list while iterating over its rows, as this can cause unexpected behavior.</output>",def pascal_triangle(n):\n    if n <= 0:\n        return []\n    if n == 1:\n        return [[1]]\n    \n    triangle = [[1]]\n    while len(triangle) < n:\n        last_row = triangle[-1]\n        new_row = [1]\n        for i in range(len(last_row) - 1):\n            new_row.append(last_row[i] + last_row[i+1])\n        new_row.append(1)\n        triangle.append(new_row)\n    return triangle\n
B25EC013_q29,5,5,100.00,<output>Consider using the bitwise XOR operator (^) to combine the values of adjacent elements in each row instead of adding them.</output>,def pascal_triangle(n):\n    if n <= 0:\n        return []\n    triangle = []\n    for i in range(n):\n        row = [1]  \n        \n        if i > 0:\n            prev_row = triangle[i - 1]\n            for j in range(len(prev_row) - 1):\n                row.append(prev_row[j] + prev_row[j + 1]) \n            row.append(1)\n        triangle.append(row)\n    \n    return triangle
B25CS041_q29,5,5,100.00,"<output> You may want to reconsider using `int(fact(i) / (fact(k) * fact(i - k)))` because it will raise a ZeroDivisionError when `i`, `k`, or `i-k` equals 0, which is not handled in the current implementation. </output>","def pascal_triangle(n):\n    """"""\n    Return the first n rows of Pascal’s triangle as a list of\n    lists.\n    For n <= 0, return [].\n    """"""\n    def fact(t):\n        if t == 1:\n           return 1\n        elif t == 0:\n            return 1\n        else:\n            return t*fact(t-1)\n    s = []\n    if n <= 0:\n        return s\n    for i in range(n):\n        \n        t = []\n        if i == 0:\n            t.append(1)\n        else: \n           for k in range(0,i+1):\n               t.append(int(fact(i)/(fact(k)*fact(i-k))))\n        s.append(t)\n\n    return s\n\n            \n"
B25EE044_q29,5,5,100.00,<output>Consider the loop that generates each row of Pascal's triangle; ensure it iterates correctly over the elements in the previous row.</output>,"def pascal_triangle(n):\n    if n<=0 :\n        return []\n    lis=[[1]]\n\n\n    for i in range(1,n):\n        last_row=lis[-1]\n\n        new_row=[1]\n\n        for j in range(len(last_row)-1):\n            ele=last_row[j] + last_row[j+1]\n            new_row.append(ele)\n\n        new_row.append(1)\n\n        lis.append(new_row)\n\n    return lis\n\n\n\n\n\n\n\n\n\n\n\n\n\n\n\n\n\n\n\n\n\n"
B25CS009_q29,5,5,100.00,"<output>One potential issue is that you're using `result[i - 1][j - 1]` instead of `result[i - 1][j]`, which would result in an ""IndexError: list index out of range"" error when `j` reaches the last element of each row.</output>","def pascal_triangle(n):\n """"""\n Return the first n rows of Pascal’s triangle as a list of\n lists.\n For n <= 0, return [].\n """"""\n result = []\n for i in range(n):\n     row = [1]\n     for j in range(1,i):\n           row.append(  result[i-1][j-1] + result[i-1][j])\n     if i > 0:\n           row.append(1)\n     result.append(row)\n return result\n\n"
B25EE029_q29,5,5,100.00,"<output> Make sure you're iterating over the rows of Pascal's triangle correctly by using `l1` and `l2` to store the current and next row, respectively. Instead of reusing the same list `l`, try shifting its elements to create a new row. </output>","def pascal_triangle(n):\n    l=[]\n    if n<=0:\n        return []\n    if n==1:\n        return [[1]]\n    if n==2:\n        return [[1,1]]\n    if n>2:\n        l1=[[1],[1,1]]\n        l2=[1,1]\n        for j in range (n-2):\n            l3=[]\n            l3.append(1)\n            for i in range(len(l2)-1):\n                l3.append(l2[i]+l2[i+1] )\n            l3.append(1)\n            l1.append(l3)\n            l2=l3\n    return l1\n#print(pascal_triangle(6))\n        \n        "
B25ME031_q29,2,5,40.00,<output>Change `count` to `n` in the while loop condition to ensure it stops at the nth row instead of going beyond.</output>,"def pascal_triangle(n):\n    default = [[1], [1,1]]\n\n    count  = 3\n    while count<=n:\n        nlist = [1]\n        for i in range(1, count-1):\n            x = default[count-2]\n            sumx = x[i-1]+x[i]\n            nlist.append(sumx)\n\n        nlist.append(1)\n        default.append(nlist)\n        count+=1\n    \n    return default\n\n\npascal_triangle(5)\n# [[1], [1,1], [1,2,1], [1,3,3,1], [1,4,6,4,1]]"
b25cs049_q29,0,5,0.00,<output>Consider using the bitwise XOR operator (^) instead of adding corresponding elements to combine row values in Pascal's triangle.</output>,"def pascal_triangle(n):\n    if n <= 0:\n        return []\n    \n    triangle = [[1]]\n    \n    for i in range(1, n):\n        prev = triangle[-1]\n        row = [1] + [prev[j] + prev[j + 1] for j in range(len(prev) - 1)] + [1]\n        triangle.append(row)\n    \n    return triangle\n\n\nprint(pascal_triangle(5))"
B25MT011.q29,0,5,0.00,"<output>Check if you need to import any modules before defining your function. In this case, it seems that the 'math' module is required for calculating binomial coefficients.</output>","def pascal_triangle(n):\n    if n <= 0:\n        return []\n    triangle = [[1]]\n    for i in range(1, n):\n        prev_row = triangle[-1]\n        row = [1]\n        for j in range(1, len(prev_row)):\n            row.append(prev_row[j-1] + prev_row[j])\n        row.append(1)\n        triangle.append(row)\n    return triangle\nprint(pascal_triangle(5))"
B25ME019_q29,0,5,0.00,<output>Consider using the `if-elif-else` structure instead of nested if statements to make the logic more readable and less prone to errors.</output>,def pascal_triangle(n):\n    new_list=[]\n    for i in range(n):\n        perm=[]\n        for j in range(n):\n            if i-1>0 and j-1>=0 and i>j: \n                sum=new_list[i-1][j-1]+new_list[i-1][j]\n                perm.append(sum)\n            else:\n                perm.append(1)\n            if i==j:\n                break\n        new_list.append(perm)\n    return(new_list)\nprint(pascal_triangle(5))\n            \n    \n
B25ME049_q29,0,5,0.00,<output>Consider adding an initial row of all 1s to handle the case when n is 0 correctly.</output>,"def pascal_triangle(n):\n    if n <= 0:\n        return []\n\n    triangle = [[1]]  \n\n    for i in range(1, n):\n        prev_row = triangle[-1]\n        new_row = [1]  \n\n        for j in range(1, len(prev_row)):\n            new_row.append(prev_row[j - 1] + prev_row[j])\n\n        new_row.append(1)  \n        triangle.append(new_row)\n    print(triangle)\n    return triangle\n\npascal_triangle(5)"
B25DS013_Q29,0,5,0.00,"<output>Consider using the `or` operator to handle cases where `n` is 0 or negative, as this will prevent an IndexError when trying to access `s[-1][i]`. Use `or` instead of `and` for conditionals.</output>","def pascal_triangle(n):\n    if n<=0:\n        return []\n    else:\n        s=[]\n        s.append([1])\n        for j in range(1,n):\n            k=[1]\n            for i in range(0,len(s[-1])-1):\n                l=s[-1][i]+s[-1][i+1]\n                k.append(l)\n            k.append(1)\n            s.append(k)  \n        return s      \nprint(pascal_triangle(5))"
B25DS021_q29,0,5,0.00,<output>Consider renaming your function from `pascal` to `pascal_triangle` to match the function name expected by the module.</output>,"def pascal(n):\n    if n <= 0:\n        return []\n    tri = [[1]]\n    for i in range(1, n):\n        prev = tri[-1]\n        row = [1]\n        for j in range(1, len(prev)):\n            row.append(prev[j-1] + prev[j])\n        row.append(1)\n        tri.append(row)\n    return tri\n"
B25EE023_q29,5,5,100.00,<output>Consider initializing each row with [1] instead of [1] * (i + 1) to ensure correct values are added to the triangle.</output>,"def pascal_triangle(n):\n    """"""Generate Pascal's triangle up to n rows.""""""\n    triangle = []\n\n    for i in range(n):\n        row = [1] * (i + 1)\n\n        for j in range(1, i):\n            row[j] = triangle[i - 1][j - 1] + triangle[i - 1][j]\n\n        triangle.append(row)\n\n    return triangle"
