student_id,tests_passed,tests_total,score_percentage,semantic_summary,code_snippet
B25MM026_q26,0,5,0.00,"<output>Verify that all values are integers before summing them, as non-integer values will result in TypeError when trying to add.</output>","def merge_sum(dict1, dict2):\n    result = dict1.copy()  \n    for key, value in dict2.items():\n        if key in result:\n            result[key] += value\n        else:\n            result[key] = value\n    return result\n#one example\nprint(merge_sum({""a"":10,""b"":5}, {""b"":7,""c"":3})) #output- {'a': 10, 'b': 12, 'c': 3}"
B25CS018_q26,0,5,0.00,<output>Check if the key exists in both dictionaries before trying to access its value.</output>,"def merge_sum(dict1, dict2):\n    \n    dict = {}\n    \n    for key in dict1:\n        if key in dict2:\n            dict[key] = dict1[key] + dict2[key]\n        else:\n            dict[key] = dict1[key]\n            \n    for key in dict2:\n        if key not in dict:\n            dict[key] = dict2[key]\n            \n    return dict\n\nprint(merge_sum({'a':10, 'b':5}, {'b':7, 'c':3}))\n    "
B25EC043_q26,0,5,0.00,"<output>Consider using a single loop to iterate through both dictionaries simultaneously, rather than two separate loops. This would simplify your code and make it more efficient.</output>","def merge_sum(dict1, dict2):\n    merge_dict={}\n    for i in dict1:\n        if i in dict2:\n            merge_dict[i]=dict1[i]+dict2[i]\n        else:\n            merge_dict[i]=dict1[i]\n    for i in dict2:\n        if i not in merge_dict:\n            merge_dict[i]=dict2[i]\n    return merge_dict\nprint(merge_sum({'a':10,'b':5}, {'b':7,'c':3}))"
B25MM009(q26),0,5,0.00,"<output>Verify that you are adding integers together, not strings or other data types, when merging values for shared keys.</output>","def merge_sum(dic1,dic2):\n    k={}\n    for key in dic1:\n        if key in dic2:\n                k[key]=dic1[key]+dic2[key]\n        else:\n            k[key]=dic1[key]\n    for key1 in dic2:\n        if key1 not in k :\n            k[key1]=dic2[key1]\n    return k\nprint(merge_sum({'a':10,'b':5},{'b':7,'c':3}))\n"
B25EE051_q26,3,5,60.00,"<output>Ensure that you are comparing values from both dictionaries using their keys, not just any common value.</output>","def merge_sum(dict1, dict2):\n    dict3 = {}\n    for i in dict1:\n        for j in dict2:\n            if i==j :\n                dict3[i] = dict1[i] + dict2[j]\n            elif i not in dict3:\n                dict3[i] = dict1[i]\n            elif j not in dict3 :\n                dict3[j] = dict2[j]\n    return dict3"
B25EE055_q26,5,5,100.00,"<output>Verify that you are adding integers, not strings, when summing values for shared keys.</output>","def merge_sum(dict1,dict2):\n    dict3=dict(dict1)\n    for i in dict2 :\n        if i in dict3:\n            dict3[i] = dict3[i] + dict2[i]\n        else:\n            dict3[i] = dict2[i]\n    return dict3\n               \n\n"
B25CS042_Q26,0,5,0.00,"<output> Check if you're adding strings and integers together, as this could lead to unexpected results. Make sure both values are integers before performing arithmetic operations. </output>","def merge_sum(dict1, dict2):\n    dict3=dict1.copy()\n    for key,value in dict2.items():\n        if key in dict3:\n            dict3[key] = dict3[key] + value\n        else:\n            dict3[key] = value\n            \n    return dict3\n\nprint(merge_sum({""a"":10,""b"":5}, {""b"":7,""c"":3}))\n                "
B25EC045_q26,0,5,0.00,"<output>Verify that you are adding integers and not strings, as the problem states that values are integers.</output>","def merge_sum(dict1, dict2):\n    dic = {}\n    for keys, values in dict1.items():\n        dic[keys] = values\n    for keys, values in dict2.items():\n        if keys in dic:\n            dic[keys] += dict2[keys]\n        else:\n            dic[keys] = values\n    return dic\nprint(merge_sum({'a':10,'b':5}, {'b':7,'c':3}))"
B25ME008_Q26,5,5,100.00,<output>Check if you're correctly handling cases where a key is present in one dictionary but not the other. Consider using the `get()` method or a conditional statement to ensure both values are summed when shared keys exist.</output>,"def merge_sum(dict1, dict2):\n    merged_dict = {}\n\n    for k in dict1.keys():\n        if k in dict2.keys():\n            value = dict1[k]+dict2[k]\n        else:\n            value = dict1[k]\n        merged_dict[k]=value\n    \n    for k in dict2.keys():\n        if k not in merged_dict.keys():\n            value = dict2[k]\n            merged_dict[k] = value\n    \n    return merged_dict"
B25EC041_q26,5,5,100.00,"<output>Check if the condition `i == j` is correctly capturing the shared key between the two dictionaries, ensuring that the same key from both dictionaries is added together.</output>","def merge_sum(dict1, dict2):\n    dict3={}\n    for i in dict1:\n        dict3[i]=dict1[i]\n        for j in dict2:\n            if(i==j):\n                dict3[i]+=dict2[i]\n            else:\n                dict3[j]=dict2[j]\n    return dict3\n    "
B25EE025_q26,0,5,0.00,<output>Check if the key exists in both dictionaries before trying to access it.</output>,"def merge_sum(dict1, dict2):\n    result = {}\n\n    for key in dict1:\n        result[key] = dict1[key]\n\n    for key in dict2:\n        if key in result:\n            result[key] = result[key] + dict2[key]\n        else:\n            result[key] = dict2[key]\n\n    return result\n\n#example\nprint(merge_sum({'a':10, 'b':5}, {'b':7, 'c':3}))"
B25CS007_q26,0,5,0.00,"<output>When using the `dict()` function, be aware that it creates a new dictionary and does not modify the original dictionaries (`dict1` and `dict2`). To avoid this issue, consider using dictionary comprehension or the `{**dict1, **dict2}` syntax to merge the dictionaries directly.</output>","# Q26\ndef merge_sum(dict1,dict2):\n    merged_dict = dict(dict1)\n    \n    for k,v in dict2.items():\n        if k in merged_dict:\n            merged_dict[k] += v\n        else:\n            merged_dict[k] = v\n\n    return merged_dict\n\nprint(merge_sum({'a':10,'b':5},{'b':7,'c':3}))"
S25MA004_q26,0,5,0.00,"<output> Ensure that all values being added are integers by using the `isinstance()` function or type casting, as attempting to add a non-integer value can result in unexpected output. </output>","def merge_sum(dict1, dict2):\n    """""" Merge two dictionaries whose values are integers.For keys present in both, sum their values.""""""\n    \n    d = dict1.copy()\n    for k, v in dict2.items():\n        d[k] = d.get(k, 0) + v\n    return d\nprint(merge_sum({""a"":10,""b"":5},{""b"":7,""c"":3}))"
B25ME046_q26,0,5,0.00,<output>Verify that the values being summed are integers by checking if `dict2[key]` is an integer before performing the addition.</output>,"def merge_sum(dict1,dict2):\n    dict3={}\n    for key in dict1:\n        dict3[key]=dict1[key]\n    for key in dict2:\n        if key in dict3:\n            dict3[key]+=dict2[key]\n        else:\n            dict3[key]=dict2[key]\n    return dict3\nprint(merge_sum({""a"":10,""b"":5},{""b"":7,""c"":3}))#{'a': 10, 'b': 12, 'c': 3}"
B25DS035_q26,0,5,0.00,"<output>Be cautious when iterating over dictionary keys, as the iteration order may not be predictable in Python 3.x.</output>","def merge_sum(dict1,dict2):\n    d={}\n    m1=dict1.keys()\n    m2=dict2.keys()\n    for i in m1:\n        for j in m2:\n            if i in m2:\n                if i==j:\n                    d[i]=dict1[i]+dict2[i]\n                elif i!=j and j not in m1:\n                    d[j]=dict2[j]\n                elif i!=j and j in m1:\n                    continue\n            else:\n                d[i]=dict1[i]\n    return d\nprint(merge_sum({'a':10,'b':5}, {'b':7,'c':3}))\n                "
S25MA008 Q26,0,5,0.00,"<output> Verify that both `dict1` and `dict2` are dictionaries before iterating over their items, as non-dictionary values will cause errors when trying to access or modify dictionary keys.</output>","def merge_sum(dict1, dict2):\n    d=dict1.copy()\n    for k,v in dict2.items():\n        if k in d:\n            d[k]+=v\n        else:\n            d[k]=v\n    return d\nprint(merge_sum({'a':10,'b':5}, {'b':7,'c':3}))"
B25CS046_q26,5,5,100.00,"<output>Verify that you are adding integers together, not strings, by checking the data type of `value` before performing the addition.</output>","def merge_sum(dict1,dict2):\n    dict3={}\n    for key,value in dict1.items():\n        if key in dict2.keys():\n            dict3[key] = dict1[key]+dict2[key]\n        else:\n            dict3[key] = dict1[key]\n    for key, value in dict2.items():\n        if key not in dict3.keys():\n            dict3[key]= dict2[key]\n            \n    return dict3"
q26,5,5,100.00,"<output> Ensure that both dictionary values are integers before attempting to sum them, as non-integer values can lead to unexpected results or errors.</output>","def merge_sum(dict1, dict2):\n    result = dict1.copy()\n    for key in dict2:\n        if key in result:\n            result[key] += dict2[key]\n        else:\n            result[key] = dict2[key]\n    return result\n"
B25ME001_q26,3,5,60.00,"<output>When iterating over the keys of `dict1` and `dict2`, consider using the `.keys()` method, which returns a view object displaying a list of all the keys available in the dictionary. This can help avoid potential issues with modifying the dictionary while iterating over it.</output>","def merge_sum(dict1,dict2):\n    dic = {}\n    for i in dict1 :\n        dic[i] = dict1[i]\n    \n    for j in dict2:\n        if j not in dic.keys():\n            dic[j] = dict2[j]\n        else:\n            pass\n    return dic"
B25ME012_q26,0,5,0.00,"<output>Consider adding an 'elif' condition to handle cases where a key is present in both dictionaries, but with different data types.</output>","def merge_sum(dict1,dict2):\n    new_dict={}\n    for i in dict1:\n        if i in dict2:\n            new_dict[i]=dict1[i]+dict2[i]\n        else:\n            new_dict[i]=dict1[i]\n    for j in dict2:\n        if j not in new_dict:\n            new_dict[j]=dict2[j]\n    return new_dict        \nprint(merge_sum({'a':10,'b':5},{'b':7,'c':3}))  "
B25CS033_q26,5,5,100.00,"<output> Verify that both `dict1` and `dict2` are dictionaries, not strings or other data types, before attempting to access their values. This is crucial for ensuring the correct operation of your merge function.</output>","def merge_sum(dict1, dict2):\n    """"""\n    Merge two dictionaries whose values are integers.\n    For keys present in both, sum their values.\n    Return a new dictionary without mutating inputs.\n    """"""\n    dic = dict1\n    for key in dict2:\n        if key in dic:\n            dic[key] += dict2[key]\n        else:\n            dic[key] = dict2[key]\n    return dic\n\n"
B25EE037_q26,0,5,0.00,"<output>Instead of appending values to the lists `L1` and `L2`, consider using a set to eliminate duplicates and improve efficiency.</output>","def merge_sum(dict1, dict2):\n    L1=[]\n    L2=[]\n    L=[]\n    D={}\n    for values in dict1:\n        L1.append(values)\n    for values in dict2:\n        L2.append(values)\n    for i in L1:\n        for j in L2:\n            if i==j:\n                L.append(i)\n    for i in L:\n        D[i] = dict1[i] + dict2[i]\n    for i in L1:\n        if i not in L:\n            D[i] = dict1[i]\n    for i in L2:\n        if i not in L:\n            D[i] = dict2[i]\n    return D\nprint(merge_sum({""a"":10,""b"":5}, {""b"":7,""c"":3}))\n\n\n\n        \n    \n    \n    \n    "
B25DS021_q26,0,5,0.00,"<output>Check if the function name in the code matches the problem statement (""merge_dicts"" instead of ""merge_sum"").</output>","def merge_dicts(d1, d2):\n    new = d1.copy()\n    for k in d2:\n        if k in new:\n            new[k] += d2[k]\n        else:\n            new[k] = d2[k]\n    return new\n"
B25EE046_q26,5,5,100.00,"<output>Use `dict1.get()` or dictionary comprehension to handle cases where a key is present in one dictionary but not the other, ensuring consistent behavior for all shared keys.</output>","def merge_sum(dict1,dict2):\n    dict0={}\n    for i in dict1:\n        if i in dict2:\n            dict0[i]=dict1[i]+dict2[i]\n        else:\n            dict0[i]=dict1[i]\n    for j in dict2:\n        if j not in dict1:\n            dict0[j]=dict2[j]\n    return dict0\n"
S25MA002_Q26,0,5,0.00,"<output>Verify that both inputs are dictionaries and their values are integers, as specified in the problem description.</output>","def merge_sum(dict1, dict2):\n\n    result = dict1.copy()\n\n    for k, v in dict2.items():\n        if k in result:\n            result[k] += v\n        else:\n            result[k] = v\n\n    return result\n\nprint(merge_sum({'a':10,'b':5}, {'b':7,'c':3}))"
B25DS014_q26,5,5,100.00,"<output> The student should ensure that they correctly handle cases where a key exists in only one of the input dictionaries, using `dict1.get(i)` or `dict2.get(i)` instead of just `i`, to avoid potential KeyError exceptions. </output>","def merge_sum(dict1,dict2):\n    dict={}\n    s=set()\n    for i in dict1.keys():\n        s.add(i)\n    for i in dict2.keys():\n        s.add(i)\n    for i in s:\n        if i in dict1.keys() and i in dict2.keys():\n            dict.update({i:dict1[i]+dict2[i]})\n        elif i in dict1.keys():\n            dict.update({i:dict1.get(i)})\n        else:\n            dict.update({i:dict2.get(i)})\n    return dict"
B25MT011.q26,0,5,0.00,<output>It seems you're trying to create a new dictionary by appending values from different lists instead of summing them up directly.</output>,"def merge_sum(dict1, dict2):\n    q={}\n    a=list(dict1.keys())\n    b=list(dict2.keys())\n    c=list(dict1.values())\n    d=list(dict2.values())\n    e=[]\n    f=[]\n    for i in range(len(a)):\n        for j in range(len(a)):\n            if a[i]==b[j]:\n                e.append(c[i]+d[j])\n                f.append(a[i])\n                break\n            else:\n                e.append(c[i])\n                e.append(d[j])\n                f.append(a[i])\n                f.append(b[j])\n    for k in range(len(f)):\n        q[f[k]]=e[k]\n    return q\nprint(merge_sum({'a':10,'b':5}, {'b':7,'c':3}))\n    "
B25MT007_ q26,0,5,0.00,"<output> To avoid a KeyError when accessing shared key values, ensure you check if the key exists in both dictionaries before attempting to sum its value. Consider using the `in` operator or dictionary's built-in `get()` method to safely access keys. </output>","def merge_sum(dict1,dict2):\n    dict={}\n    for key in dict1:\n        if key in dict2:\n            dict[key]=dict1[key]+dict2[key]\n            \n        else:\n            dict[key]=dict1[key]\n            \n            \n    for key in dict2:\n        if key not in dict1:\n            dict[key]=dict2[key]\n            \n    return dict\n\nprint(merge_sum({'a':10,'b':5},{'b':7,'c':3}))"
B25DS004_q26,5,5,100.00,<output> The issue lies in the line `if keys == key:` where you're comparing the keys of both dictionaries using string equality instead of value equality. Change it to `if dict1.get(key) == dict2.get(key):` to ensure you're summing values for shared keys. </output>,"def merge_sum(dict1,dict2):\n    for keys in dict1:\n        for key in dict2:\n            if keys == key:\n                dict2[key] = dict1[keys] + dict2[key]\n    dict1.update(dict2)\n    return dict1\n\n"
B25ME032_q26,5,5,100.00,<output> The issue lies in the way you're handling keys from both dictionaries; you should iterate over the union of keys instead of iterating separately over each dictionary's keys. Consider using `dict1.keys() | dict2.keys()` to get the combined set of keys.</output>,"def merge_sum(dict1, dict2):\n    lst1=list(dict1.keys())\n    lst2=list(dict2.keys())\n    ndict={}\n    for i in range( len(lst1)):\n        if dict2.get(lst1[i])!=None:\n            ndict[lst1[i]]=dict1[lst1[i]]+dict2[lst1[i]]\n        else:\n            ndict[lst1[i]]=dict1[lst1[i]]\n    for i in range(len(lst2)):\n                   if dict1.get(lst2[i])==None:\n                        ndict[lst2[i]]=dict2[lst2[i]]\n    return ndict\n\n"
B25EE048_q26,5,5,100.00,"<output>When iterating over `second`, consider using a set intersection to ensure you're only updating keys present in both dictionaries.</output>","def merge_sum(dict1, dict2):\n    first = list(dict1.keys())\n    second = list(dict2.keys())\n    new_one = dict1.copy()\n    for s in second:\n        if s in first:\n            new_one[s] = dict1[s] + dict2[s]\n        else:\n            new_one[s] = dict2[s]\n    return new_one\n"
B25ME031_q26,5,5,100.00,"<output>Consider adding a check for `dict2[k]` when `k` is not present in `merged_dict`, to ensure that values from both dictionaries are summed correctly.</output>","def merge_sum(dict1, dict2):\n    merged_dict = {}\n\n    for k in dict1.keys():\n        if k in dict2.keys():\n            value = dict1[k]+dict2[k]\n        else:\n            value = dict1[k]\n        merged_dict[k]=value\n    \n    for k in dict2.keys():\n        if k not in merged_dict.keys():\n            value = dict2[k]\n            merged_dict[k] = value\n    \n    return merged_dict\n\nmerge_sum({'a':10,'b':5}, {'b':7,'c':3}) # {’a’:10, ’b’:12, ’c’:3}"
B25EC004_Q26,5,5,100.00,"<output> Ensure that both input dictionaries are expected to contain only integers by validating their values before performing arithmetic operations, as mixing strings with integers can lead to unexpected results. </output>","def merge_sum(dict1, dict2):\n    result = dict1.copy()\n    for key, value in dict2.items():\n        if key in result:\n            result[key] += value\n        else:\n            result[key] = value\n    return result"
B25ME037_q26,5,5,100.00,"<output> Ensure that you check if a key exists in both dictionaries before attempting to sum its values, as your current implementation will raise a KeyError when encountering a unique key in one of the input dictionaries.</output>","def merge_sum(dict1, dict2):\n    result = dict1.copy()\n    for key, value in dict2.items():\n        result[key] = result.get(key, 0) + value\n    return result\n"
B25DS017_q26,0,5,0.00,"<output> The issue lies in the fact that you're iterating over the keys using their indices (`range(0, len(dict1))` and `range(0, len(dict2))`) instead of directly comparing them. This means you'll never find a match between keys from both dictionaries. Instead, use `zip()` to iterate over the keys in parallel. </output>","def merge_sum(dict1,dict2):\n    keys1=list(dict1.keys())\n    keys2=list(dict2.keys())\n    for i in range(0,len(dict1)):\n        for j in range(0,len(dict2)):\n            if keys1[i] == keys2[j]:\n                dict2[keys2[j]]=dict1[keys1[i]]+dict2[keys2[j]]\n    dict1.update(dict2)\n    return dict1\nprint(merge_sum({""a"":10,""b"":5},{""b"":7,""c"":3}))\n                \n                \n            "
B25DS033_Q26,0,5,0.00,"<output>Check if the `dict1` and `dict2` are being modified simultaneously, as this could lead to unexpected behavior.</output>","def merge_sum(dict1, dict2):\n    \n    result = dict(dict1)\n    for key, value in dict2.items():\n        result[key] = result.get(key,0) + value\n    return result\n\nprint (merge_sum({'a':10,'b':5},{'b':7,'c':3}))"
B25DS025_q26,5,5,100.00,"<output>Verify that both inputs are dictionaries and their values are integers, as specified in the problem description.</output>","def merge_sum(dict1, dict2):\n    """"""\n    Merge two dictionaries whose values are integers.\n    For keys present in both, sum their values.\n    Return a new dictionary without mutating inputs.\n    """"""\n    dict3 = dict1.copy()\n    for key, value in dict2.items():\n        if key in dict3:\n            dict3[key] += value\n        else:\n            dict3[key] = value\n    return dict3"
B25EC037_q26,0,5,0.00,<output>Verify that you are not accidentally adding strings to integers by ensuring all values are integers before summing. Check if `dict2` contains any non-integer values.</output>,"def merge_sum(dict1, dict2):\n    dict3 = dict1.copy()   # start with first dictionary\n    for key, value in dict2.items():\n        if key in dict3:\n            dict3[key] += value   # add values if key exists\n        else:\n            dict3[key] = value\n    return dict3\nprint(merge_sum({'a':10,'b':5}, {'b':7,'c':3}))"
B25CS045_Q26,0,5,0.00,"<output>Be cautious of modifying the dictionary while iterating over its items, as this can lead to unexpected results due to the iteration order.</output>","def merge_sum(dict1, dict2):\n    merged_dict = dict1.copy()\n    for key, value in dict2.items():\n        if key in merged_dict:\n            merged_dict[key] += value\n        else:\n            merged_dict[key] = value\n    return merged_dict\nprint(merge_sum({'a': 10, 'b': 5}, {'b': 7, 'c': 3}))"
B25CS020_q26,5,5,100.00,"<output>Consider adding an else clause to handle cases where a key exists in both dictionaries, using the sum of their values.</output>","def merge_sum(dict1,dict2):\n    dict3 = {}\n    for i in dict1:\n        if i not in dict2:\n            dict3[i] = dict1[i]\n            \n        else:\n            dict3[i] = dict1[i] + dict2[i]\n            \n    for j in dict2:\n        if j not in dict3:\n            dict3[j] = dict2[j]\n        \n    return dict3\n\n"
B25EC015_q26,0,5,0.00,"<output> You should use `dict.get()` instead of `if` statements to handle missing keys, as it is more concise and idiomatic in Python. </output>","def merge_sum(dict1,dict2):\n    d={}\n    for keys in dict1.keys():\n        if keys in dict2:\n            d[keys]=dict1[keys]+dict2[keys]\n        elif keys not in dict2:\n            d[keys]=dict1[keys]\n    for keys in dict2:\n        if keys not in dict1:\n            d[keys]=dict2[keys]\n    return(d)\n            \nprint(merge_sum({""a"":10,""b"":5},{""b"":7,""c"":3}))"
B25EC012_q26,5,5,100.00,"<output>Verify that you are using integers for both `dict1` and `dict2`, as the problem requires summing their values for shared keys.</output>","def merge_sum(dict1, dict2):\n    result = dict1.copy()\n    for k, v in dict2.items():\n        if k in result:\n            result[k] += v\n        else:\n            result[k] = v\n    return result\n"
B25ME002_q26,5,5,100.00,"<output> The issue lies in the line where you're updating the values for shared keys; you should be using `dict1[i] + dict2[i]` instead of just `dict1[i]`, as you want to sum the values, not assign them. </output>","def merge_sum(dict1,dict2):\n    set1=set(dict1.keys())\n    set2=set(dict2.keys())\n    l=list(set1 & set2)\n    dict={}\n    for i in dict1:\n        if(i in l):\n            continue\n        dict[i]=dict1[i]\n    for i in dict2:\n        if(i in l):\n            continue\n        dict[i]=dict2[i]\n    for i in l:\n        dict[i]=dict1[i]+dict2[i]\n    return dict\n"
B25EE036_q26,0,5,0.00,"<output>Check if the key exists in `dict1` before trying to access its value with `dict1[k]`, as this could raise a KeyError.</output>","def merge_sum(dict1,dict2):\n    """"""\n    Merge two dictionaries whose values are integers.\n    For keys present in both, sum their values.\n    Return a new dictionary without mutating inputs.\n    """"""\n    ans = {}\n    for key, value in dict1.items():\n        ans.update({key : value})\n    for k, v in dict2.items():\n        if k in ans.keys():\n            ans[k] = dict1[k]+v\n        else:\n            ans.update({k : v})\n    return ans\n\nprint(merge_sum({'a':10,'b':5},{'b':7,'c':3}))"
{B25CS013}_q26,2,5,40.00,"<output> The variable name 'result' should be consistently spelled as 'results', indicating a typo that's causing the NameError. Ensure all variable names match exactly in your code. </output>","#Q26\n\n\n\ndef merge_sum(dict1, dict2):\n    results = dict1.copy()\n    for k, v in dict2.items():\n        results[k] = result.get(k, 0) + v\n    return results\n\n"
B25EE060_q26,1,5,20.00,"<output>Check if you're iterating over the keys of `dict1` and then checking if they exist in `dict2`, which is unnecessary. Instead, directly iterate over the union of keys from both dictionaries.</output>","def merge_sum(dict1, dict2):\n    merge_dict = {}\n    for i in dict1:\n        if i in dict2.keys():\n            merge_dict[i] = dict1[i] + dict2[i]\n        else:\n            merge_dict[i] = dict1[i]\n    for i in dict2:\n        if i not in dict1.keys():\n            merge_dict[i] = dict2[i]\n        return merge_dict\n\n"
B25CS036_q26,5,5,100.00,"<output> When accessing dictionary values, ensure you check if the key exists before attempting to use it, as your code does not handle cases where a key is missing from one of the input dictionaries.</output>","def merge_sum(dict1, dict2):\n    """"""\nMerge two dictionaries whose values are integers.\nFor keys present in both, sum their values.\nReturn a new dictionary without mutating inputs.\n""""""\n    dic = {}\n    for first in dict1.keys():\n        found = False\n        for second in dict2.keys():\n            if first == second:\n                dic[first] = dict1[first] + dict2[second] \n                found = True\n        if not found:\n            dic[first] = dict1[first]  \n    for second in dict2.keys():\n        if second not in dic.keys():          \n            dic[second] = dict2[second]\n    return dic\n"
