student_id,tests_passed,tests_total,score_percentage,semantic_summary,code_snippet
B25MT032_q26,5,5,100.00,"<output>Verify that both inputs are integers before summing their values, as using non-integer values can lead to unexpected results.</output>","def merge_sum(dict1, dict2):\n    \n    result = dict1.copy()  \n\n    for key, value in dict2.items():\n        if key in result:\n            result[key] += value\n        else:\n            result[key] = value\n\n    return result\n\n#print(merge_sum({'a': 10, 'b': 5}, {'b': 7, 'c': 3}))"
B25DS031_q26,5,5,100.00,"<output>Verify that the values being summed are integers, not strings or other data types, as this would result in unexpected behavior and incorrect results.</output>","def merge_sum(dict1, dict2):\n """"""\n Merge two dictionaries whose values are integers.\n For keys present in both, sum their values.\n Return a new dictionary without mutating inputs.\n """"""\n z=dict1.copy()\n for k1,v1 in dict2.items():\n     if k1 not in z:\n         z[k1]=v1\n     else:\n         z[k1]+=v1\n return z\n"
B25MM002_q26,5,5,100.00,"<output> Make sure that the values being added are integers by using the `get()` method with a default value of 0, and avoid using string concatenation or addition. </output>","def merge_sum(dic1, dic2):\n    result = dic1.copy()\n    for k, v in dic2.items():\n        result[k] = result.get(k, 0) + v\n    return result\n"
B25CS016_q26,5,5,100.00,"<output>Consider adding a check to ensure that both inputs are dictionaries, and handle any potential TypeError that may occur when trying to access dictionary keys.</output>","def merge_sum(dict1, dict2): \n    """"""\n    Merge two dictionaries whose values are integers. \n    For keys present in both, sum their values.\n    Return a new dictionary without mutating inputs. \n    """"""\n    merge_dict = {}\n    for i in dict1:\n        if i in dict2.keys():\n            merge_dict[i] = dict1[i] + dict2[i]\n        else:\n            merge_dict[i] = dict1[i]\n\n    for i in dict2:\n        if i not in dict1.keys():\n            merge_dict[i] = dict2[i]\n\n    return merge_dict\n\n"
B25CS005_q26,5,5,100.00,"<output>Consider adding an else clause after each if statement to handle cases where a key is present in one dictionary but not the other, ensuring that all keys are included in the merged dictionary.</output>","def merge_sum(dict1, dict2): \n    merge_dict = {}\n    for i in dict1:\n        if i in dict2.keys():\n            merge_dict[i] = dict1[i] + dict2[i]\n        else:\n            merge_dict[i] = dict1[i]\n\n    for i in dict2:\n        if i not in dict1.keys():\n            merge_dict[i] = dict2[i]\n\n    return merge_dict\n\n"
B25EE024_q26.py,0,5,0.00,<output>Check if the key exists in both dictionaries before trying to access it.</output>,"def merge_sum(dict1,dict2):\n    for k in dict1 :\n        if k not in dict2:\n            dict2[k]=dict1[k]\n        else:\n            dict2[k]+=dict1[k]\n            \n    return dict2\n"
B25MT018_q26,0,5,0.00,"<output>Verify that both inputs are integers before attempting to add them, as mixing non-integer values can lead to unexpected results.</output>","def merge_sum(dict1, dict2):\n    dict3=dict1.copy()\n    for key,value in dict2.items():\n        dict3[key]=dict3.get(key,0) + value\n    return dict3\n\nprint(merge_sum({""a"":10,""b"":5}, {""b"":7,""c"":3}))\n"
B25ME041_q26,5,5,100.00,<output>Check if the key exists in both dictionaries before trying to sum its values.</output>,"def merge_sum(dict1, dict2):\n    result={}\n    for key in dict1:\n        result[key]=dict1[key]\n    for key in dict2:\n        if key in result:\n            result[key]=result[key]+dict2[key] \n        else:\n            result[key]=dict2[key]\n    return result "
B25DS013_Q26,0,5,0.00,"<output>Be cautious when using `del` to remove items from dictionaries while iterating over their keys; consider using a different approach, such as creating a copy of the dictionary and updating it instead.</output>","def  merge_sum(dict1,dict2):\n    a=dict1.keys()\n    b=list(a)\n    c=dict2.keys()\n    d=list(c)\n    l={}\n    for i in range(0,len(b)):\n        for j in range(0,len(d)):\n            if b[i]==d[j]:\n                l[b[i]]=dict1[b[i]]+dict2[d[j]]\n                del dict1[b[i]]\n                del dict2[d[j]]\n    l.update(dict1)\n    l.update(dict2) \n    return l                \nprint(merge_sum({'a':10,'b':5},{'b':7,'c':3}))"
B25DS029_q26,5,5,100.00,"<output> Ensure that both dictionary values are integers before summing them, as non-integer values can lead to unexpected results or errors. Verify that `dict2` only contains integer keys and values. </output>","def merge_sum(dict1, dict2):\n    """"""\n    Merge two dictionaries whose values are integers.\n    For keys present in both, sum their values.\n    Return a new dictionary without mutating inputs.\n    """"""\n    result = dict1.copy()\n    for key, value in dict2.items():\n        if key in result:\n            result[key] += value\n        else:\n            result[key] = value\n    return result\n\n\n# Test cases check\nif __name__ == ""__main__"":\n    d1 = {'a': 10, 'b': 5}\n    d2 = {'b': 7, 'c': 3}\n    print(merge_sum(d1, d2))  # Expected: {'a': 10, 'b': 12, 'c': 3}\n"
B25ME017_q26,0,5,0.00,"<output>One potential issue with this code is that it does not handle cases where one dictionary contains non-integer values, which could lead to type mismatches when trying to sum them.</output>","\ndef merge_sum(d1, d2):\n    d = {}\n    for key1, value1 in d1.items():\n        if key1 in d2:\n            d[key1] = value1 + d2[key1]\n        else:\n            d[key1] = value1\n\n    for key2, value2 in d2.items():\n        if key2 not in d:\n            d[key2] = value2\n    return d\nprint(merge_sum({'a':10,'b':5},{'b':7,'c':3}))\n"
B25EE057_q26,0,5,0.00,"<output>Consider adding a check to ensure that both dictionaries have the same keys before attempting to merge them, as your current implementation will add duplicate keys from `dic2` to the result.</output>","def merge_sum(dic1, dic2):\n    p = {}\n    for k in dic1:\n        if k in dic2:\n            p[k] = dic1[k] + dic2[k]\n        else:\n            p[k] = dic1[k]\n    for k in dic2:\n        if k not in dic1:\n            p[k] = dic2[k]\n    return p\n\n\nprint(merge_sum({'a': 10, 'b': 5}, {'b': 7, 'c': 3}))"
B25CS022_q26,5,5,100.00,"<output>Verify that both inputs are dictionaries and their values are integers, as the problem statement explicitly mentions.</output>","def merge_sum(dict1,dict2):\n    """"""\n    Merge two dictionaries whose values are integers.\n    For keys present in both, sum their values.\n    Return a new dictionary without mutating inputs.\n    """"""\n    d=dict(dict1)\n\n    for k,v in dict2.items():\n        d[k]=d.get(k,0)+v\n    return d"
B25CS034_q26,5,5,100.00,"<output>Check if the key exists in the 'result' dictionary before trying to access it, e.g., `if key in result:`, to avoid KeyError.</output>","def merge_sum(dict1,dict2):\n    result = dict1  \n    for key, value in dict2.items():\n        if key in result:\n            result[key] += value\n        else:\n            result[key] = value\n\n    return result\n\n"
B25ME006_Q26,0,5,0.00,"<output>Be cautious when using the `copy()` method on dictionaries, as it creates a shallow copy and does not prevent modification of the original dictionary.</output>","\ndef merge_sum(dict1,dict2):\n    x=dict1.copy()\n    for i,j in dict2.items():\n        if i in x:\n            x[i]+=j\n        else:\n            x[i]=j\n\n    return x\nprint(merge_sum({'a':10,""b"":5},{""b"":7,""c"":3}))\n"
B25MT026_q26,5,5,100.00,"<output>Verify that all values being summed are integers, as non-numeric inputs can cause unexpected behavior.</output>","def merge_sum(dict1, dict2):\n    """"""\n    Merges two dictionaries with integer values\n    For keys present in both, sums their values\n    Returns a new dictioary without mutating inputs\n    """"""\n\n    merged = dict1.copy()\n\n    for key in dict2:\n\n        if key in merged:\n            merged[key] += dict2[key]\n        else:\n            merged[key] = dict2[key]\n\n    return merged\n\n\n# print(merge_sum({'a': 10, 'b': 5}, {'b': 5, 'c': 3}))\n"
B25ME023 q26,5,5,100.00,<output>Check if you're correctly handling cases where a key is present in both dictionaries by using the correct operator (`in`) and ensuring the condition accurately captures the problem's requirement.</output>,"def merge_sum(dict1, dict2):\n    result = dict(dict1)\n    for key, value in dict2.items():\n        if key in result:\n            result[key] += value\n        else:\n            result[key] = value\n    return result\n"
B25MT014_q26,5,5,100.00,"<output> Ensure that both dictionary values are integers before attempting to sum them, as using non-numeric data can result in unexpected behavior or errors. </output>","def merge_sum(dict1, dict2):\n    result = dict1.copy()  # avoid mutating input\n    for k, v in dict2.items():\n        result[k] = result.get(k, 0) + v\n    return result"
B25EE026_q26,5,5,100.00,"<output> Verify that you are adding integers by using the `isinstance()` function or type checking, as mixing strings and integers can lead to unexpected results.</output>","""""""\n Mergetwodictionarieswhosevaluesareintegers.\n Forkeyspresentinboth,sumtheirvalues.\n Returnanewdictionarywithoutmutatinginputs.\n""""""\ndef merge_sum(dict1,dict2):\n    dic=dict1\n    a=[]\n    key1=dict1.keys()\n    key2=dict2.keys()\n    for i in key2:\n        if i in key1:\n            if type(dict1[i])==type(dict2[i]):\n                   dic[i]=dict1[i]+dict2[i]\n        else:\n            dic[i]=dict2[i]\n    return dic"
B25MT023 - Q 26,0,5,0.00,"<output>Check if the condition `key in result` is correctly capturing the shared key between `dict1` and `dict2`, as it may not be necessary to check for existence before updating the value.</output>","def merge_sum(dict1, dict2):\n    result = {}   \n\n    for key, value in dict1.items():\n        result[key] = value\n\n    for key, value in dict2.items():\n        if key in result:\n            result[key] += value    \n        else:\n            result[key] = value     \n\n    return result\n\nprint(merge_sum({'a': 10, 'b': 5}, {'b': 7, 'c': 3}))\n"
B25CS059_q26,5,5,100.00,"<output> Be cautious when using the `dict()` function, as it creates a copy of the dictionary and does not modify the original dictionary (`dict1`), potentially causing unexpected behavior.</output>","def merge_sum(dict1,dict2):\n    d=dict(dict1)\n    for i in dict2:\n        if i in d:\n            d[i]+=dict2[i]\n        else:\n            d[i]=dict2[i]\n    return d\n"
B25DS020_Q26,3,5,60.00,"<output> The issue lies in the inner loop where you're iterating over `dic2` and trying to access its values using `dic2[j]`, which is incorrect because dictionary keys are unique. Instead, consider using the `.get()` method or a dictionary comprehension to merge the values. </output>","def merge_sum(dic1,dic2):\n    dic={}\n    for i in dic1:\n        for j in dic2:\n            if i==j:\n                dic[i]=dic1[i]+dic2[j]\n            else:\n                if i and j not in dic:\n                         dic[i]=dic1[i]\n                         dic[j]=dic2[j]\n    return dic\n\n                \n        "
B25MT015_q26,5,5,100.00,"<output> Make sure to handle potential type mismatches when adding values, as the problem statement assumes integer values. For example, if `dict1[k]` is an integer and `dict2[k]` is a string, you'll get a TypeError. </output>","def merge_sum(dict1, dict2):\n    \n    new_dict = {}\n    \n    for k in dict1:\n        new_dict[k] = dict1[k]\n        \n    for k in dict2:\n        if k in new_dict:\n            new_dict[k] = new_dict[k] + dict2[k]\n        else:\n            new_dict[k] = dict2[k]\n\n    return new_dict\n\n"
B25EC044_Q26,0,5,0.00,"<output>Be cautious when using dictionary iteration and modification simultaneously, as this can cause unexpected behavior.</output>","\n\ndef merge_sum(dict1,dict2):\n    d={}\n    for i,j in dict1.items():\n        d[i]=j\n    for k,l in dict2.items():\n        if k in d:\n            d[k]+=l\n        else:\n            d[k]=l\n    return d\n\nprint(merge_sum({'a':10,'b':5},{'b':7,'c':3}))\n"
B25CS019_q26,5,5,100.00,"<output>Be cautious of modifying the dictionary during iteration, as this can cause unexpected behavior and incorrect results.</output>","def merge_sum(dict1,dict2) :\n    for key,value in dict2.items() :\n        if key in dict1 :\n            value1 = value + dict1[key]\n            dict1[key] = value1\n        else:\n            dict1[key] = value\n    return dict1\n"
B25MT008_q26,5,5,100.00,"<output> Reconsider the condition in `new_dict.update({i: dict1[i] + dict2[i]})` to correctly handle cases where both dictionaries have non-integer values, as the problem statement explicitly states that values are integers.</output>","def merge_sum(dict1, dict2):\n    new_dict = {\n        }\n    for i in dict1:\n        if i in dict2:\n            new_dict.update({i:(dict1[i]+dict2[i])})\n        else:\n            new_dict[i] = dict1[i]\n    for j in dict2:\n        if j not in dict1:\n            new_dict[j] = dict2[j]\n    return new_dict"
B25DS027_q26,5,5,100.00,<output>Consider adding a check to ensure that both inputs are dictionaries before proceeding with the merge operation.</output>,"def merge_sum(dict1, dict2):\n    result = dict1.copy()\n    for key,value in dict2.items():\n        result[key]=result.get(key,0) + value\n    return result    \n    \n    \n    \n    \n    "
B25CS056_q26,5,5,100.00,"<output> When summing values for shared keys, ensure that both dictionary values are integers by using `dict.get()` or accessing elements via indexing (`[]`) instead of the `.items()` method, which returns key-value pairs as tuples containing strings. </output>","def merge_sum(dict1, dict2):\n    """"""\n    Merge two dictionaries whose values are integers.\n    For keys present in both, sum their values.\n    Return a new dictionary without mutating inputs.\n    """"""\n    dict3 = {}\n    for key, value in dict1.items():\n        if key not in dict3:\n            dict3[key] = value\n    \n    for key, value in dict2.items():\n        if key in dict1:\n            dict3[key] = value+dict1[key]\n        else:\n            dict3[key] = value\n    return dict3\n\n# print(merge_sum({""a"":10,""b"":5}, {""b"":7,""c"":3}))"
{B25MM017}_q26,2,5,40.00,"<output> The variable 'result' should be 'results', as it's being used later in the function. This is a simple typo, which could lead to incorrect results if not caught.</output>","#Q26\n\n\n\ndef merge_sum(dict1, dict2):\n    results = dict1.copy()\n    for k, v in dict2.items():\n        results[k] = result.get(k, 0) + v\n    return results\n\n\n"
B25EC038_Q26,0,5,0.00,"<output>The issue lies in printing the keys instead of using them to create a new dictionary, which should be done by directly iterating over the shared keys with `for key in key1 if key in key2:` and `for key in key2 if key not in key1:`, respectively.</output>","def merge_sum(dic1, dic2):\n    key1 = list(dic1.keys())\n    key2 = list(dic2.keys())\n    print(key1)\n    print(key2)\n    dict3 = {}\n    for i in key1:\n        if i in key2:\n            dict3[i] = dic1[i] + dic2[i]\n        else:\n            dict3[i] = dic1[i]\n    for j in key2:\n        if j not in dict3:\n            dict3[j] = dic2[j]\n    print(dict3)\n    \nmerge_sum({""a"":10,""b"":5},{""b"":7,""c"":3})\n"
B25EC008_q26,5,5,100.00,"</output> The issue lies in the fact that you're updating `dict1`'s values with `dict2`'s values, which is not the intended behavior. You should be summing their values instead. Change `value += dict2[key]` to `value += dict2[key] + value`.","def merge_sum(dict1, dict2):\n    new_dict={}\n    for key,value in dict1.items():\n        if key in dict2.keys():\n            value+=dict2[key]\n            new_dict[key]=value\n        else:\n            new_dict[key]=value\n    for key,value in dict2.items():\n        if key not in dict1:\n            new_dict[key]=value\n    print(dict1)\n    print(dict2)\n    return new_dict\n        \n        \n"
B25EC013_q26,0,5,0.00,<output>Consider using the `in` operator to check for key existence in dictionaries instead of comparing with `not in`. This will provide a more Pythonic and efficient way to handle shared keys.</output>,"def merge_sum(dict1, dict2):\n    new_d=dict()\n    for keys in dict1:\n        if keys not in new_d:\n            new_d[keys]=dict1[keys]\n    for keys in dict2:\n        if keys in new_d:\n            new_d[keys]+=dict2[keys]\n        else:\n            new_d[keys]=dict2[keys]\n    return new_d\nprint(merge_sum({'a':10,'b':5}, {'b':7,'c':3}))"
B25ME051_q26,0,5,0.00,"<output> Ensure that you are checking for existence of key in both dictionaries before trying to access its value, as `dict1[key]` will raise a KeyError if the key does not exist. For example: `if key in dict1 and key in dict2:`</output>","def merge_sum(dict1, dict2):\n    new_dict = dict1.copy()\n    for key, value in dict2.items():\n        if key in new_dict:\n            new_dict[key] += value\n        else:\n            new_dict[key] = value\n    return new_dict\n\nprint(merge_sum({'a':10,'b':5}, {'b':7,'c':3}))"
B25CS043-q26,2,5,40.00,"<output> The variable name 'result' should be consistent with the loop variable 'k', so change 'result' to 'v' in the line `results[k] = result.get(k, 0) + v` to fix the NameError.</output>","def merge_sum(dict1, dict2):\n    results = dict1.copy()\n    for k, v in dict2.items():\n        results[k] = result.get(k, 0) + v\n    return results\n\n"
B25CS011_q26,5,5,100.00,"<output>Verify that you are not adding strings and integers together, as this would result in a TypeError. Ensure all values being added have the same data type.</output>","def merge_sum(dict1, dict2):\n    dict3 = {}\n    for key,value in dict1.items():\n        dict3[key] = value\n        for k,v in dict2.items():\n            if key == k:\n                dict3[k] += v\n            else:\n                dict3[k] = v\n    return dict3\n"
B25DS002_q26,5,5,100.00,"<output> Ensure that the values being summed are integers by using the `isinstance()` function or type casting, as attempting to sum a non-integer value with an integer may result in unexpected behavior.</output>","def merge_sum(dict1,dict2):\n    \n    dict={}\n    for i in dict1:\n        dict[i] = dict1[i]\n\n    for i in dict2:\n        if i in dict:\n            dict[i] += dict2[i]\n        else:\n            dict[i] = dict2[i]\n    return dict\n\n\n\n    "
B25ME056_q26,5,5,100.00,"<output> Ensure that both `dict1` and `dict2` are dictionaries, as the code assumes their values are integers. Verify that all keys present in `dict2` also exist in `dict1`, otherwise, a KeyError will be raised.</output>","def merge_sum(dict1, dict2):\n    """"""\n    Merge two dictionaries whose values are integers.\n    For keys present in both, sum their values.\n    Return a new dictionary without mutating inputs.\n    """"""\n    merged = dict1.copy()  # avoid mutating the first dict\n    for key, value in dict2.items():\n        merged[key] = merged.get(key, 0) + value\n    return merged\n"
B25EE001_q26,5,5,100.00,"<output>Re-examine the line `merged = dict1.copy()` as it may be modifying the original dictionary `dict1` while iterating over `dict2`, which could lead to unexpected behavior.</output>","def merge_sum(dict1, dict2):\n    \n    merged = dict1.copy()\n    \n    for key, value in dict2.items():\n        merged[key] = merged.get(key, 0) + value\n        \n    return merged"
B25DS008_q26,0,5,0.00,"<output>Verify that both inputs are dictionaries and their values are integers, as the problem statement requires summing integer values for shared keys.</output>","def merge_sum(dict1, dict2):\n    d=dict1.copy()\n    for k,v in dict2.items():\n        if k in d:\n            d[k]+=v\n        else:\n            d[k]=v\n    return d\nprint(merge_sum({'a':10,'b':5}, {'b':7,'c':3}))"
B25CS041_q26,5,5,100.00,<output>Check if the key exists in both dictionaries before trying to sum its values.</output>,"def merge_sum(dict1, dict2):\n    """"""\n    Merge two dictionaries whose values are integers.\n    For keys present in both, sum their values.\n    Return a new dictionary without mutating inputs.\n    """"""\n    d = {}\n    for i in dict1:\n        if i in dict2:\n            d[i] = dict1[i] + dict2[i]\n        else:\n            d[i] = dict1[i]\n    for i in dict2:\n        if i not in dict1:\n            d[i] = dict2[i]\n    return d\n            \n"
<B25CS024>_q26,5,5,100.00,"<output> Be cautious when modifying the original dictionary (`dict1`) within the loop, as this can cause unexpected side effects and incorrect results.</output>","# Q26\ndef merge_sum(dict1,dict2):\n    merged_dict = dict(dict1)\n    \n    for k,v in dict2.items():\n        if k in merged_dict:\n            merged_dict[k] += v\n        else:\n            merged_dict[k] = v\n\n    return merged_dict\n\nmerge_sum({'a':10,'b':5},{'b':7,'c':3})"
B25CS014_q26,0,5,0.00,"<output> When merging two dictionaries, ensure that you are comparing values of the same data type (e.g., integers) when summing shared keys. In your code, you're adding `v1` (an integer) to `v2` (also an integer), but if either value is a string, this will result in a TypeError.</output>","def merge_sum(dict1, dict2):\n    dict = {}\n    for (k1,v1) in dict1.items():\n        dict[k1]=v1\n    for (k2,v2) in dict2.items():\n        if k2 in dict:\n            dict[k2] = v1+v2\n        else:\n            dict[k2] = v2\n    return dict\nd1={'a':10,'b':5}\nd2={'b':7,'c':3}\nprint(merge_sum(d1,d2))\n"
B25CS062_q26,0,5,0.00,"<output> The issue lies in the fact that you're trying to access `dict1[key]` and `dict2[key]` without checking if these keys exist in both dictionaries. To safely access dictionary keys, consider using the `.get()` method or an `if key in dict1 and key in dict2:` check before accessing them. </output>","def merge_sum(dict1,dict2):\n    dict={}\n    for key in dict1:\n        if key in dict2:\n            dict[key]=dict1[key]+dict2[key]\n            \n        else:\n            dict[key]=dict1[key]\n            \n            \n    for key in dict2:\n        if key not in dict1:\n            dict[key]=dict2[key]\n            \n    return dict\n\nprint(merge_sum({'a':10,'b':5},{'b':7,'c':3}))"
B25DS003_q26,5,5,100.00,"<output>Check if you are updating the original dictionary (`dict1`) with the merged values, as this would lead to incorrect results.</output>","def merge_sum(dict1, dict2):\n    output= dict1.copy()\n    output.update(dict2)\n    for key in dict1:\n        if key in dict2:\n            output[key] = dict1[key] +dict2[key]\n    return output\n    "
B25EC035_q26,0,5,0.00,"<output> In your current implementation, you're incorrectly assuming that a key present in `dict1` must also be present in `dict2`, which is not necessarily true for merging dictionaries. Consider revising the condition to include keys from both dictionaries. </output>","def merge_sum(dict1 ,dict2):\n    ndict = {}\n    for i in dict1:\n        if i in dict2:\n            ndict[i] = dict1[i] + dict2[i]\n        else:\n            ndict[i] = dict1[i]\n    for i in dict2:\n        if i in dict1:\n            continue\n        else:\n            ndict[i] = dict2[i]\n    return ndict\n\nprint(merge_sum({'a':10,'b':5}, {'b':7,'c':3}))"
B25MM028_q26,0,5,0.00,"<output>Verify that you are summing integers, not strings or other data types, as the problem statement explicitly mentions integer values.</output>","def merge_sum(dict1, dict2):\n    result=dict1.copy()\n    for key, value in dict2.items():\n        if key in result:\n            result[key]+=value\n        else:\n            result[key]=value\n    return result\nprint(merge_sum({""a"":10, ""b"":5}, {""b"":7, ""c"":3}))"
B25MT002_q26,0,5,0.00,"<output> Make sure to initialize a variable before using it, as 'result' is not defined anywhere in your function. Instead of 'result', use 'res' which is already declared as the result dictionary.</output>","def merge_sum(dict1, dict2):\n    """"""\n    Merge two dictionaries whose values are integers.\n    For keys present in both, sum their values.\n    Return a new dictionary without mutating inputs\n    we can create a new dictionart where we create\n    a copy of the first one and iterate throught the second to sum value of the common key and add new ones\n    \n    """"""\n    res=dict1.copy()\n    for key,value in dict2.items():\n        if key in result:\n            #key exists in both dict,sum the values\n            res[key]+= value\n        else:\n            res[key] = value\n"
B25EC007_q26,5,5,100.00,"<output>Consider adding a check to ensure that both `dict1` and `dict2` are dictionaries, as your function does not currently handle non-dictionary inputs.</output>","def merge_sum(dict1,dict2):\n    new_dict={}\n    new_dict.update(dict1)\n    for k,v in dict2.items() :\n        if k in new_dict :\n            new_dict[k]+=v\n        else :\n            new_dict[k]=v\n    return new_dict\n            "
B25DS039_Q26,5,5,100.00,"<output>It seems that you're correctly updating the dictionary with shared keys and adding their values together, but the problem asks to sum values for shared keys, not add them. Try changing `D[i] += dict2[i]` to `D[i] = D.get(i, 0) + dict2[i]`.</output>","def merge_sum(dict1,dict2):\n    D={}\n    D.update(dict1)\n    for i in dict2:\n        if i in D:\n            D[i]+=dict2[i]\n        else:\n            D.update({i:dict2[i]})\n    return D\n"
