student_id,tests_passed,tests_total,score_percentage,semantic_summary,code_snippet
B25ME043_q26,5,5,100.00,"<output>Make sure to check for shared keys with existing values in `dict1` before adding new values from `dict2`, as this could lead to incorrect results.</output>","def merge_sum(dict1, dict2) :\n    result=dict(dict1)\n    for key, value in dict2.items() :\n        if key in result :\n            result[key]+=value\n        else :\n            result[key]=value\n    return result       "
B25ME045_q26,5,5,100.00,"<output> Review your code's handling of shared keys. Currently, it only sums values for keys present in both dictionaries; consider adding a check to also handle cases where a key is unique to one dictionary.</output>","def merge_sum(dict1,dict2):\n    new_dict={}\n    new_dict.update(dict1)\n    for k,v in dict2.items() :\n        if k in new_dict :\n            new_dict[k]+=v\n        else :\n            new_dict[k]=v\n    return new_dict\n            "
B25EE058_q26,5,5,100.00,"<output>When iterating over `dict1` and `dict2`, consider using dictionary views (e.g., `.keys()`, `.values()`) instead of the keys themselves, as they are immutable and won't cause issues with modification during iteration.</output>","def merge_sum(dict1,dict2):\n    Sum=dict()\n    for i in dict1:\n        if i in dict2 and i not in Sum:\n            Sum[i]=dict1[i]+dict2[i]\n        else:\n            Sum[i]=dict1[i]\n\n    for j in dict2:\n        if j not in dict1:\n            Sum[j]=dict2[j]\n\n    return Sum\n"
B25EE030-q26,0,5,0.00,"<output> Ensure that the key exists in both dictionaries before trying to access it, using `dict1.get()` or a similar method to avoid KeyError. For instance, you can modify your code to use `r[key] = dict1.get(key, 0) + dict2[key]`. </output>","def merge_sum(dict1,dict2):\n    r={}\n    for key in dict1:\n        r[key]=dict1[key]\n    for key in dict2:\n        if key in r:\n            r[key]=r[key]+dict2[key]\n        else:\n            r[key]=dict2[key]\n    return r\n\n#example\nprint(merge_sum({'a':10,'b':5},{'b':7,'c':3}))\n    \n        \n    "
B25ME005_q26,5,5,100.00,<output>Check if you are modifying a copy of the original dictionary (`dict1`) instead of the original dictionary itself.</output>,"def merge_sum(dict1, dict2):\n    first = list(dict1.keys())\n    second = list(dict2.keys())\n    new_one = dict1.copy()\n    for s in second:\n        if s in first:\n            new_one[s] = dict1[s] + dict2[s]\n        else:\n            new_one[s] = dict2[s]\n    return new_one\n"
B25MT021_q26,0,5,0.00,"<output>Ensure that you are checking for both addition and subtraction of values for shared keys in your 'if' statement, as the problem requires summing values.</output>","def merge_sum(dict1, dict2):\n    new_dict = dict1.copy()\n    for key, value in dict2.items():\n        if key in new_dict:\n            new_dict[key] += value\n        else:\n            new_dict[key] = value\n    return new_dict\n\nprint(merge_sum({'a':10,'b':5}, {'b':7,'c':3}))"
B25CS061_q26,5,5,100.00,<output>Verify that you are comparing integers with strings by checking if both values have the same type before performing the addition.</output>,"def merge_sum(dict1, dict2):\n    result = dict1.copy()\n\n    for key, value in dict2.items():\n        if key in result:\n            result[key] += value\n        else:\n            result[key] = value\n\n    return result\n"
B25ME018_q26,5,5,100.00,"<output> To avoid the KeyError when accessing shared keys, ensure that you check if a key exists in both dictionaries before trying to sum its values. Consider using the `get()` method or an if-else statement to handle this scenario. </output>","def merge_sum(dict1, dict2):\n    """"""\n    Merge two dictionaries whose values are integers.\n    For keys present in both, sum their values.\n    Return a new dictionary without mutating inputs.\n    """"""\n    merge=dict()\n    for key1 in dict1:\n        merge[key1] =dict1[key1]\n    for key2 in dict2:\n        if key2 not in merge:\n            merge[key2] =dict2[key2]\n        else:\n            merge[key2] +=dict2[key2]\n    return merge\n'''\nprint(merge_sum({'a':10,'b':5}, {'b':7,'c':3}))\n# {’a’:10, ’b’:12, ’c’:3}\n'''"
B25EE043_q26,0,5,0.00,"<output>Be cautious when using the `get()` method, as it returns the value for a given key if it exists in the dictionary; otherwise, it returns a default value (in this case, 0). This might not be the expected behavior when summing values for shared keys.</output>","def merge_sum(dict1, dict2):\n    merged = dict1.copy() \n    for key, value in dict2.items():\n        merged[key] = merged.get(key, 0) + value\n    return merged\nprint(merge_sum({'a': 10, 'b': 5}, {'b': 6, 'c': 3}))"
B25ME016_q26,0,5,0.00,"<output>Verify that the values being added are integers, as non-integer values can cause unexpected results.</output>","def merge_sum(dict1, dict2):\n   \n    result = dict1.copy()  \n    for key, value in dict2.items():\n        if key in result:\n            result[key] += value\n        else:\n            result[key] = value\n    return result\nd1 = {'a': 2, 'b': 3}\nd2 = {'b': 4, 'c': 5}\n\nprint(merge_sum(d1, d2))\nprint(d1)  \nprint(d2) \n"
B25DS015_q26,5,5,100.00,"<output> Be cautious when using the `in` operator on dictionary keys, as it returns an iterator, which may not be what you expect when iterating over the dictionary items in your loop.</output>","def merge_sum(dict1,dict2):\n    for j,k in dict2.items():\n        if j in dict1:\n            dict1[j] = dict1[j] + dict2[j]\n        else:\n            dict1[j] = k\n    return dict1"
B25DS023_q26,5,5,100.00,"<output> Be cautious when using the `get()` method with mutable default values, as it can modify the original dictionary unexpectedly.</output>","def merge_sum(dict1, dict2):\n    for i in dict2:\n        if i in dict1:\n            dict1[i]= dict1.get(i) + dict2.get(i)\n        else:\n            dict1[i]= dict2.get(i)\n    return dict1\n\n"
B25EE007_q26,5,5,100.00,<output>Consider adding an 'in' check to ensure that a key exists in both dictionaries before attempting to access its value.</output>,"def merge_sum(dict1,dict2):\n    dict3=dict({})\n    for i in dict1.keys():\n        if(i in dict2.keys()):\n            dict3[i]=dict1[i]+dict2[i]\n        else:\n            dict3[i]=dict1[i]\n    for j in dict2.keys():\n        if(j not in dict3.keys()):\n            dict3[j]=dict2[j]\n    return dict3\n\n"
B25EE028_q26,5,5,100.00,"<output>Be cautious of modifying the dictionary while iterating over its items, as this can cause unexpected behavior and incorrect results.</output>","def merge_sum(dict1, dict2):\n    for k,v in dict2.items():\n        if k in dict1:\n            dict1[k] = dict1[k] + dict2[k]\n        else:\n            dict1[k] = v\n    return dict1"
B25ME009_q26,5,5,100.00,<output>Check if the key exists in both dictionaries before trying to add its value.</output>,"""""""\nMerge two dictionaries whose values are integers.\nFor keys present in both, sum their values.\nReturn a new dictionary without mutating inputs.\n""""""\ndef merge_sum(dict1, dict2):\n    result = {}\n    for key in dict1:\n        result[key] = dict1[key]\n    for key in dict2:\n        if key in result:\n            result[key] = result[key] + dict2[key]\n        else:\n            result[key] = dict2[key]\n    return result"
B25DS041_q26,0,5,0.00,"<output>Check if you're correctly handling cases where a key exists in both dictionaries; ensure that when a key is present in both, you're summing their values.</output>","def merge_sum(dict1, dict2):\n    \n    summation = {}\n    \n    for key in dict1:\n        \n        summation[key] = dict1[key]\n        \n    for key in dict2:\n       \n        if key in summation:\n            \n            summation[key] = summation[key] + dict2[key]\n            \n        else:\n            summation[key] = dict2[key] \n        \n    return summation\n\nprint(merge_sum({""a"": 10, ""b"": 5}, {""b"":7, ""c"": 3}))\n    "
B25CS021_q26,5,5,100.00,"<output>Consider adding a check to ensure that both inputs are dictionaries before attempting to merge them, as your current code will fail if either input is not a dictionary.</output>","def merge_sum(dict1, dict2):\n    d=dict()\n    for i in dict1:\n        if i in dict2:\n            d[i]=dict1[i]+dict2[i]\n        else:\n            d[i]=dict1[i]\n\n    for i in dict2:\n        if i not in d:\n            d[i]=dict2[i]\n\n    print(d)"
B25ME021_q26,5,5,100.00,"<output>Consider adding a condition to handle cases where both dictionaries have the same key, and the operation should be performed in reverse order.</output>","def merge_sum(dict1, dict2):\n    result = dict1.copy()\n    for key, value in dict2.items():\n        result[key] = result.get(key, 0) + value\n    return result\n"
B25CS026_q26,0,5,0.00,<output> Check if the key exists in both dictionaries before trying to access its value to avoid KeyError. </output>,"def merge_sum(dict1,dict2):\n    d = {}\n    for k,v in dict1.items():\n        if k not in dict2.keys():\n            d[k] = v\n        else:\n            d[k] = v + dict2[k]\n    for k,v in dict2.items():\n        if k not in dict1.keys():\n            d[k] = v\n                \n                \n    return d\nprint(merge_sum({'a':10,'b':5},{'b':7,'c':3}))"
B25EC025_q26,0,5,0.00,"<output>Verify that the values in `dict2` are integers before trying to add them to values in `result`, as non-integer values could cause unexpected behavior.</output>","def merge_sum(dict1, dict2):\n    result = dict1.copy()  \n    for key, value in dict2.items():\n        if key in result:\n            result[key] += value \n        else:\n            result[key] = value \n    return result\na = {'a': 10, 'b': 5}\nb = {'b': 7, 'c': 3}\n\nprint(merge_sum(a, b))\n"
B25MT022_q26,5,5,100.00,"<output>Be cautious when using the `get()` method, as it returns `None` if the key is not found in the dictionary, which could lead to incorrect results.</output>","26.\ndef merge_sum(dict1, dict2):\n\n    merged = dict1.copy()                        # make a copy to avoid modifying original\n\n    for key, value in dict2.items():\n        merged[key] = merged.get(key, 0) + value\n\n    return merged"
B25DS016_q26,5,5,100.00,"<output> Make sure to check for cases where a key exists in only one of the input dictionaries, as this is not handled by your current implementation.</output>","def merge_sum(dict1, dict2):\n    new_dict = dict1.copy()\n    for key, value in dict2.items():\n        if key in new_dict:\n            new_dict[key] += value\n        else:\n            new_dict[key] = value\n    return new_dict\n\n"
B25ME057_q26,5,5,100.00,"<output>Verify that the values being added are integers, as non-integer values can lead to unexpected results.</output>","def merge_sum(dict1, dict2):\n    res = dict1.copy() \n    for key, value in dict2.items():\n        if key in res:\n            res[key] += value  \n        else:\n            res[key] = value    \n    return res"
B25EC026_q26,5,5,100.00,"<output>Check if you're using `dict1` as a mutable default argument in your function definition, which can cause unexpected behavior.</output>","def merge_sum(dict1,dict2):\n    merge=dict1\n    l=list(dict2.keys())\n    for i in l:\n        if merge.get(i)==None:\n            merge.update({i:dict2[i]})\n        else:\n            merge[i]+=dict2[i]\n    return merge\n"
B25DS018_q26,0,5,0.00,"<output> Check if you're using `dict1[key]` instead of `a` and `b` when summing shared keys, as this will result in incorrect values being stored in `dict3`. </output>","def merge_sum(dict1,dict2):\n    dict3 = {}\n    for key,values in dict1.items():\n        if(key in dict2.keys()):\n            a = dict1[key]\n            b = dict2[key]\n            c = a + b\n            dict3[key] = c\n\n        else:\n            dict3[key] = dict1[key]\n\n    for key,values in dict2.items():\n        if(key not in dict3.keys()):\n            dict3[key] = dict2[key]\n\n    return dict3\n\nprint(merge_sum({'a':10,'b':5},{'b':7,'c':3}))"
B25EE023_q26,0,5,0.00,"<output> Pay close attention to the data types when merging values for shared keys, as mixing integers and strings could lead to unexpected results.</output>","def merge_sum(dict1 ,dict2):\n    result = dict1.copy()\n    for (key,value) in dict2.items():\n        if key in result:\n            result[key] += value\n        else:\n            result[key] = value\n    return result\nprint(merge_sum({'a': 10, 'b': 5}, {'b': 7, 'c': 3}))\n"
B25EE031_Q26,0,5,0.00,"<output>Consider modifying your code to handle cases where a key exists in only one of the input dictionaries, using the correct operation for that scenario (e.g., addition for shared keys and concatenation or replacement for non-shared keys).</output>","def merge_sum(dict1, dict2):\n    Mydict={}\n    for i in dict1:\n        if i in dict2:\n            Mydict[i]=dict1[i]+dict2[i]\n        else:\n            Mydict[i]=dict1[i]\n    for j in dict2:\n        if j not in dict1:\n            Mydict[j]=dict2[j]\n    return Mydict\nprint(merge_sum({'a':10,'b':5}, {'b':7,'c':3}))\n"
B25ME035_Q26,0,5,0.00,"<output> Ensure that you are adding the values for shared keys when their values in both dictionaries have the same data type, not just checking for equality of values. </output>","def merge_sum(dict1, dict2):\n    final = dict1.copy()  \n    for key, value in dict2.items():\n        if key in final:\n            final[key] = final[key]+value\n        else:\n            final[key] = value\n    return final\nprint(merge_sum({'a': 10, 'b': 5}, {'b': 7, 'c': 3}))"
B25DS019_q26,5,5,100.00,"<output>Consider using a set to store unique keys from both dictionaries instead of manually checking for existence, as this can lead to inefficient lookups and potential errors.</output>","def merge_sum(dict1,dict2):\n    dict1_keys=[]\n    dict2_keys=[]\n    total={}\n    for keys1 in dict1:\n        dict1_keys+=[keys1]\n    for keys2 in dict2:\n        dict2_keys+=[keys2]\n    for key1 in dict1_keys:\n        if key1 in dict2_keys:\n            total[key1]=dict1[key1]+dict2[key1]\n        else:\n            total[key1]=dict1[key1]\n    for key2 in dict2_keys :\n        if key2 not in dict1_keys:\n            total[key2]=dict2[key2]\n    return total\n"
b25cs040.q26,0,5,0.00,<output>It seems like the issue is with the function name 'merge_sum' not matching the module name 'b25cs040'. The correct function name should be consistent with the module name.</output>,"def merge_sum(dict1, dict2):\n    result = dict1.copy()\n    for key, value in dict2.items():\n        result[key] = result.get(key, 0) + value\n    return result\n\n\n\nd1 = {'a': 10, 'b': 5}\nd2 = {'b': 7, 'c': 3}\nprint(merge_sum(d1, d2))  "
B25CS055_q26,5,5,100.00,<output>Check if the key exists in both dictionaries before attempting to sum its values.</output>,"def merge_sum(dict1,dict2):\n    """"""\n    Merge two dictionaries whose values are integers.\n    For keys present in both, sum their values.\n    Return a new dictionary without mutating inputs.\n    """"""\n    dict1_ = dict1\n    dict2_= dict2\n    for i in dict1_:\n        for j in dict2_:\n            if i==j:\n                dict1_[i]=dict1_[i]+dict2[j]\n    for a in dict2_:\n        if a not in dict1_:\n            dict1_.update({a:dict2_[a]})\n    return dict1_"
B25EE017_q26,5,5,100.00,<output>Consider adding a default value for keys present in only one dictionary to ensure correct merging.</output>,"def merge_sum(dict1,dict2):\n    merge = {}\n    for key in dict1.keys()|dict2.keys():\n        merge[key] = dict1.get(key,0)+dict2.get(key,0)\n    return merge"
B25EC028_q26,0,5,0.00,"<output> The issue lies in using `dict1.copy()` to create a new dictionary, which creates a shallow copy and can lead to unexpected behavior when modifying the original dictionary's values. Instead, use `dict1` directly as it is already mutable. </output>","def merge_sum(dict1,dict2):\n    new_dict=dict1.copy()\n    for i,j in dict2.items():\n        if i in new_dict:\n            new_dict[i]+=j\n        else:\n            new_dict[i]=j\n    return new_dict\nprint(merge_sum({""a"":10,""b"":5},{""b"":7,""c"":3}))"
b25me058_q26,5,5,100.00,"<output> Ensure that both dictionary values are integers before performing addition, as non-integer values can cause type mismatch errors. </output>","def merge_sum(dict1, dict2):\n    dict3={}\n    for key, value in dict1.items():\n        dict3[key]=value\n    for key, value in dict2.items():\n        if key in dict3:\n            dict3[key]+=value\n        else:\n            dict3[key]=value\n\n    return dict3"
B25CS023_Q26,5,5,100.00,"<output> When accessing dictionary values, ensure you check if the key exists before attempting to use it, as your code doesn't handle cases where a key is missing from one of the input dictionaries.</output>","def merge_sum(dict1, dict2):\n    """"""\n    Merge two dictionaries whose values are integers.\n    For keys present in both, sum their values.\n    Return a new dictionary without mutating inputs.\n    """"""\n    m={}\n    for i in list(dict1.keys()):\n        if i in list(dict2.keys()):\n            m[i]=dict1[i]+dict2[i]\n        else:\n            m[i]=dict1[i]\n    for i in list(dict2.keys()):\n        if i not in list(dict1.keys()):\n            m[i]=dict2[i]\n    return m \n"
B25EE053_q26,5,5,100.00,"<output>Be cautious when iterating over dictionaries, as modifying the dictionary during iteration can cause unexpected behavior.</output>","def merge_sum(dict1, dict2):\n    merged = dict1.copy()\n    for key, value in dict2.items():\n        if key in merged:\n            merged[key]+= value\n        else:\n            merged[key] = value\n    return merged"
B25DS043_q26,5,5,100.00,<output>Ensure that you check if a key exists in the `dict1` or `dict2` before trying to access its value to avoid KeyError.</output>,"def merge_sum(dict1, dict2):\n    """"""\n    Merge two dictionaries whose values are integers.\n    For keys present in both, sum their values.\n    Return a new dictionary without mutating inputs.\n    """"""\n    result = {}\n    for key, value in dict1.items():\n        result[key] = value\n    for key, value in dict2.items():\n        if key in result:\n            result[key] += value\n        else:\n            result[key] = value\n    return result\n"
B25EE015_Q26,0,5,0.00,"<output>Verify that `dict2` only contains integers, as non-integer values will cause a TypeError when trying to add them to existing values in `merge`.</output>","def merge_sum(dict1, dict2):\n    """"""\nMerge two dictionaries whose values are integers.\nFor keys present in both, sum their values.\nReturn a new dictionary without mutating inputs.\n""""""\n    merge = dict1.copy() \n    for key, value in dict2.items():\n        if key in merge:\n            merge[key] += value\n        else:\n            merge[key] = value\n    return merge\n\n\n\nprint(merge_sum({'a': 10, 'b': 5}, {'b': 7, 'c': 3}))  \nprint(merge_sum({'x': 1}, {'y': 2}))                   \nprint(merge_sum({}, {'a': 5}))                         \n"
B25EC020_q26,5,5,100.00,"<output>Verify that the values in `dict2` are integers before performing arithmetic operations, as non-integer values may cause unexpected results.</output>","\ndef merge_sum(dict1, dict2):\n    result = dict1.copy()\n    for k, v in dict2.items():\n        result[k] = result.get(k, 0) + v\n    return result\n"
b25cs049_q26,0,5,0.00,"<output> Be cautious when using the `get()` method on a dictionary, as it returns `None` by default if the key is not found, which could lead to incorrect results in your merged dictionary.</output>","def merge_sum(dict1, dict2):\n    merged = dict1.copy()\n    for k, v in dict2.items():\n        merged[k] = merged.get(k, 0) + v\n    return merged\n\n\nprint( merge_sum({'a':10,'b':5},{'b':7,'c':3}))\n #{’a’:10,’b’:12,’c’:3}"
B25ME049_q26,0,5,0.00,<output> Verify that the values being added are integers by checking if `dict2[key]` is indeed an integer before attempting to add it to `result[key]`. </output>,"def merge_sum(dict1, dict2):\n    result = dict1.copy() \n    for key, value in dict2.items():\n        if key in result:\n            result[key] += value  \n        else:\n            result[key] = value  \n    return result\n\n\n\nprint(merge_sum({'a': 10, 'b': 5}, {'b': 7, 'c': 3}))\n"
B25EC042_q26,0,5,0.00,"<output>Be cautious when iterating over and modifying the same dictionary simultaneously, as this can cause unexpected behavior.</output>","def merge_sum(dict1,dict2):\n    for i in dict1.keys():\n        if i in dict2.keys():\n            dict1[i]=(dict1[i])+(dict2[i])\n    for j in dict2.keys():\n        if j not in dict1.keys():\n            dict1[j]=dict2[j]\n    return dict1\nprint(merge_sum({'a':10,'b':5}, {'b':7,'c':3}))"
B25ME014_q26.py,0,5,0.00,"<output> The issue lies in the fact that you're trying to use `dict1` as a function (`fnf = dict1.copy()`), which is not allowed. Instead, use `dict1` directly and rename it to something else to avoid confusion. </output>","\ndef merge_sum(dict1, dict2):\n    """"""\n    Merge two dictionaries whose values are integers.\n    For keys present in both, sum their values.\n    Return a new dictionary without mutating inputs.\n    """"""\n    fnf = dict1.copy() \n\n    for key, value in dict2.items():\n        fnf[key] = fnf.get(key, 0) + value \n\n    return fnf\n    pass\n    \n\n\n\n\n\n\n\n\n\n\n\n\n\n\n\n\n\n"
B25MM023_q26,5,5,100.00,<output>Consider adding a check to ensure the key exists in `dict1` before attempting to access its value.</output>,"def merge_sum(dict1,dict2):\n     result=dict1\n     for key, value in dict2.items():\n        if key in result:\n            result[key]+=value\n        else:\n            result[key]=value\n     return result\nmerge_sum({'a':10,'b':5},{'b':7,'c':3})"
B25EE022_q26,0,5,0.00,"<output> Ensure that you check if the key exists in both dictionaries before attempting to access its value to avoid a KeyError. For example, use `dict1.get(key)` and `dict2.get(key)`.  </output>","def merge_sum(dict1,dict2):\n    dict={}\n    for key in dict1:\n        if key in dict2:\n            dict[key]=dict1[key]+dict2[key]\n            \n        else:\n            dict[key]=dict1[key]\n            \n            \n    for key in dict2:\n        if key not in dict1:\n            dict[key]=dict2[key]\n            \n    return dict\n\nprint(merge_sum({'a':10,'b':5},{'b':7,'c':3}))"
B25MM016_Q26,0,5,0.00,<output>Verify that the values being added together are integers by ensuring both `dic1[key]` and `dic2[key]` have been initialized with integer values.</output>,"def merge_sum(dic1,dic2):\n    k={}\n    for key in dic1:\n        if key in dic2:\n                k[key]=dic1[key]+dic2[key]\n        else:\n            k[key]=dic1[key]\n    for key1 in dic2:\n        if key1 not in k :\n            k[key1]=dic2[key1]\n    return k\nprint(merge_sum({'a':10,'b':5},{'b':7,'c':3}))\n"
B25DS022_q26,0,5,0.00,"<output> You are not handling the case where a key is present in both dictionaries but has different values. Consider adding a check to ensure that you're using the same value from each dictionary, or handle this ambiguity by raising an exception. </output>","def merge_sum(dict1, dict2):\n    """"""\n    Merge two dictionaries whose values are integers.\n    For keys present in both, sum their values.\n    Return a new dictionary without mutating inputs.\n    """"""\n    result = {}\n\n    # Add keys from dict1\n    for key in dict1:\n        result[key] = dict1[key]\n\n    # Add keys from dict2, summing if necessary\n    for key in dict2:\n        if key in result:\n            result[key] += dict2[key]\n        else:\n            result[key] = dict2[key]\n\n    return result\n\n# Test case\nprint(merge_sum({'a': 10, 'b': 5}, {'b': 7, 'c': 3}))\n\n"
B25MM030_Q26,0,5,0.00,"<output>Be cautious when using the `dict()` constructor, as it creates a new dictionary and does not modify the original dictionaries passed to the function.</output>","def merge_sum(dict1, dict2):\n    \n    result = dict(dict1)\n    for key, value in dict2.items():\n        result[key] = result.get(key,0) + value\n    return result\n\nprint (merge_sum({'a':10,'b':5},{'b':7,'c':3}))\n\n"
B25DS030_q26,5,5,100.00,"<output>Be cautious when iterating over a dictionary and modifying its values simultaneously, as this can lead to unexpected results due to the nature of Python's dictionary iteration.</output>","def merge_sum(dict1,dict2):\n    for i in dict1:\n        if i in dict2:\n            dict2[i]=dict2[i]+dict1[i]\n        else:\n            dict2[i]=dict1[i]\n    return dict2"
B25DS026.q26,0,5,0.00,"<output>Check that all values in both dictionaries are integers, as the problem statement assumes.</output>","def merge_sum(dict1, dict2):\n    result = dict1.copy()\n    for k, v in dict2.items():\n        result[k] = result.get(k, 0) + v\n    return result\nprint(merge_sum({'a': 10, 'b': 5}, {'b': 7, 'c': 3}))\n"
B25ME059_q26,5,5,100.00,"<output> Reconsider the condition `i in dict1.keys() and i in dict2.keys()` to ensure it correctly identifies shared keys between both dictionaries, as it currently includes keys present only in one dictionary. </output>","def merge_sum(dict1, dict2):\n    tk=set(dict1.keys()).union(set(dict2.keys()))\n    # print(tk)\n    dict3={}\n    for i in tk:\n        if(i in dict1.keys() and i in dict2.keys()):\n            dict3[i]=dict1[i]+dict2[i]\n        else:\n            try:\n                dict3[i]=dict1[i]\n            except:\n                dict3[i]=dict2[i]\n    return dict3"
