student_id,tests_passed,tests_total,score_percentage,semantic_summary,code_snippet
B25MM006_q26,5,5,100.00,"<output>Check if you're correctly handling shared keys by summing their values, and consider using a more straightforward approach to merge dictionaries.</output>","def merge_sum(dict1,dict2):\n    dict3={}\n    for i in dict1:\n        dict3[i]=dict1[i]\n        for j in dict2:\n            if i==j:\n                dict3[j]+=dict2[j]\n            else:\n                dict3[j]=dict2[j]\n    return dict3"
B25MT005_q26,5,5,100.00,"<output> Verify that the values being summed are integers, not strings or other non-numeric types. The `+=` operator can only be used with numeric types, so if either `dict1[key]` or `value` is a string, this will raise a TypeError.</output>","def merge_sum(dict1, dict2):\n    """"""\n    Merge two dictionaries whose values are integers.\n    For keys present in both, sum their values.\n    Return a new dictionary without mutating inputs.\n    """"""\n    result = dict1.copy()\n    for key, value in dict2.items():\n        if key in result:\n            result[key] += value\n        else:\n            result[key] = value\n    return result\n\n\n# Test cases check\nif __name__ == ""__main__"":\n    d1 = {'a': 10, 'b': 5}\n    d2 = {'b': 7, 'c': 3}\n    print(merge_sum(d1, d2))  # Expected: {'a': 10, 'b': 12, 'c': 3}\n"
B25ME004_q26,0,5,0.00,"<output> Make sure to verify that both values are integers before attempting to add them together, as mixing strings and integers can lead to unexpected results.</output>","def merge_sum(dict1,dict2):\n    dict3={}#creating an empty dictionary\n    for key,value in dict1.items():\n        dict3[key]=value\n    for k ,v in dict2.items():\n        if k in dict3:\n            dict3.update({k:dict3[k]+v})\n        else:\n            dict3[k]=v\n    return dict3\nprint( merge_sum({'a':10,'b':5},{'b':7,'c':3}))"
B25MT025_q26,5,5,100.00,"<output>Consider adding a condition to handle cases where keys are not present in either dictionary, as your current implementation will return 0 for such keys.</output>","def merge_sum(dict1, dict2):\n    keys=set(dict1.keys())|set(dict2.keys())\n    dict_final={x:dict1.get(x,0)+dict2.get(x,0) for x in keys}\n    return dict_final"
B25EE039_q26,5,5,100.00,"<output> Ensure that both dictionary values are integers before attempting to sum them, as using non-integer values can lead to unexpected results or errors. </output>","def merge_sum(dict1, dict2):\n    """"""\n    Merge two dictionaries whose values are integers.\n    For keys present in both, sum their values.\n    Return a new dictionary without mutating inputs.\n    """"""\n    result = dict1.copy()\n    for k, v in dict2.items():\n        result[k] = result.get(k, 0) + v\n    return result\n"
B25ME030_q26,0,5,0.00,"<output>When merging dictionaries with shared keys, you should sum the values only when the keys match exactly (`key1 == key2`), not just check for inequality (`if key1 != key2`).</output>","def merge_sum(dict1,dict2):\n    merge_dict = {}\n    for key1,value1 in dict1.items():\n        for key2,value2 in dict2.items():\n            if key1 != key2:\n                if key1 not in merge_dict:\n                    merge_dict[key1] = value1\n                if key2 not in merge_dict:\n                    merge_dict[key2] = value2\n            else:\n                merge_dict[key1] = value1 + value2\n    return merge_dict\nprint(merge_sum({""a"":10,""b"":5},{""b"":7,""c"":3}))"
B25MM004_q26,5,5,100.00,"<output> Be cautious when using the `copy()` method on a dictionary, as it creates a shallow copy, which may not be suitable for this problem since dictionaries are mutable objects and modifying one of their values could affect the original dictionary.</output>","def merge_sum(dict1,dict2):\n    output=dict1.copy()\n    for key,value in dict2.items():\n        if key in output:\n            \n            output[key]=output[key]+value\n        else:\n            output[key]=value\n    return output\n\n"
B25CS048_q26,5,5,100.00,"<output>Verify that both `dict1` and `dict2` are dictionaries, not strings or other data types, before attempting to sum their values.</output>","def merge_sum(dict1, dict2):\n    """"""\n    Merge two dictionaries whose values are integers.\n    For keys present in both, sum their values.\n    Return a new dictionary without mutating inputs.\n    """"""\n    dict3 = dict1.copy()\n    for key, value in dict2.items():\n        if key in dict3:\n            dict3[key] += value\n        else:\n            dict3[key] = value\n    return dict3\n            \n"
B25ME026_q26,5,5,100.00,"<output>Be cautious when using the `set()` function in combination with iteration, as it may cause unexpected side effects due to its internal implementation.</output>","def merge_sum(dict1, dict2):\n    _dict = {}\n    for k in set(dict1).union(set(dict2)): \n        _dict[k] = dict1.get(k, 0) + dict2.get(k, 0)\n    return _dict\n\n\n"
B25EC032_Q26,0,5,0.00,"<output>When accessing shared keys between two dictionaries, ensure to check if the key exists in both dictionaries before attempting to sum or assign a value to it.</output>","def merge_sum(dict1, dict2):\n    merged={}\n    for key in dict1:\n        if key in dict2:\n            merged[key]=dict1[key]+dict2[key]\n        else:\n            merged[key]=dict1[key]\n    for key in dict2:\n        if key not in dict1:\n            merged[key]=dict2[key]\n    return merged\n\n   \n\n\nprint(merge_sum({'a':10,'b':5}, {'b':7,'c':3}))\n\n            \n    \n"
B25DS032_q26,0,5,0.00,"<output>Be cautious when using the `get()` method, as it returns 0 instead of the actual value from `dict1` if the key is not present, which might affect the sum.</output>","def merge_sum(dict1, dict2):\n   \n    merged_dict = dict1.copy()\n    for key, value in dict2.items():\n        merged_dict[key] = merged_dict.get(key, 0) + value\n    return merged_dict\n\nprint(merge_sum({'a':10,'b':5}, {'b':7, 'c':3}))"
B25DS005_q26,0,5,0.00,<output>Check if the key exists in both dictionaries before trying to sum its values.</output>,"def merge_dict(dict1,dict2):\n    merge_dict = {}\n    for k,v in dict1.items():\n        for p,q in dict2.items() :\n            if k == p :\n                merge_dict[k] = v+ q\n            else:\n                merge_dict[k] = v\n                merge_dict[p] = q\n                \n    for k,v in dict1.items():\n        for p,q in dict2.items() :\n            if k == p :\n                merge_dict[k] = v+q\n                \n                \n    return merge_dict\n\n"
B25MT017_q26,5,5,100.00,"<output> Re-examine the condition where you're checking if the key exists in `merged` before updating its value, as this could potentially skip updating values for keys that are present in both dictionaries but have different initial values. </output>","def merge_sum(dict1, dict2):\n    merged = dict1.copy()\n    for key, value in dict2.items():\n        if key in merged:\n            merged[key] += value\n        else:\n            merged[key] = value\n    return merged"
B25DS011_q26,0,5,0.00,"<output>Check if the condition `i == j` in the nested for loop accurately captures that two dictionaries have shared keys by using `dict1.get(i, 0) + dict2.get(i, 0)` instead of manual key comparison.</output>","def merge_sum(dict1, dict2):\n    dict3={}\n    for i in dict1:\n        dict3[i]=dict1[i]\n        for j in dict2:\n            if(i==j):\n                dict3[i]+=dict2[i]\n            else:\n                dict3[j]=dict2[j]\n    return dict3\n\nprint(merge_sum({'a':10,'b':5},{'b':7,'c':3}))\n #{’a’:10,’b’:12,’c’:3}"
B25EC024_q26,5,5,100.00,"<output> When adding values for shared keys, consider using a single assignment instead of `new_dict[key] = value + new_dict[key]`, as this can lead to incorrect results due to potential data type inconsistencies (e.g., integer overflow). </output>","def merge_sum(dict1, dict2):\n    new_dict = {}\n    for key, value in dict1.items():\n        new_dict[key] = value\n    for key, value in dict2.items():\n        if key not in new_dict:\n              new_dict[key] = value\n\n        else:\n             new_dict[key] = value + new_dict[key]   \n    return new_dict   \nmerge_sum({""a"":1, ""b"" : 5}, {""b"": 7, ""c"" : 3})\n"
B25EE021_q26,0,5,0.00,<output>Check if the key exists in both dictionaries before trying to access its value.</output>,"def merge_sum(dict1, dict2):\n    d = {}\n    for item in dict1:\n        if item not in dict2:\n            d[item] = dict1[item]\n        else:\n            d[item] = dict1[item]+dict2[item]\n    for item in dict2:\n        if item not in dict1:\n            d[item] = dict2[item]        \n            \n    return d        \n\nprint(merge_sum({'a':10,'b':5}, {'b':7,'c':3}))"
B25EE045_q26,0,5,0.00,N/A,No Code Found
B25EC022_q26,0,5,0.00,"<output>Be cautious when using the `dict()` function in Python, as it creates a copy of the dictionary and may not be suitable for modifying the original dictionary while iterating over its items.</output>","def merge_sum(dict1, dict2):\n    merged = dict(dict1)\n    for k, v in dict2.items():\n        merged[k] = merged.get(k, 0) + v\n    return merged\n\n\nd1 = {'a': 10, 'b': 5}\nd2 = {'b': 7, 'c': 3}\nprint(""Merged sum:"", merge_sum(d1, d2)) \nprint(""-"" * 60)\n"
B25CS037_q26,5,5,100.00,"<output>Be cautious when using mutable default arguments in your function, as this can cause unexpected side effects.</output>","def merge_sum(dict1,dict2):\n    merged_dict = dict1.copy() \n    for key, value in dict2.items():\n        if key in merged_dict:\n            merged_dict[key] += value  \n        else:\n            merged_dict[key] = value  \n    return merged_dict"
B25ME013_q26,5,5,100.00,"<output>Consider adding an `elif` condition to handle cases where a key is present in only one of the input dictionaries, ensuring that values are summed correctly.</output>","def merge_sum(dict1,dict2):\n    keys=[]\n    merge_dict={}\n    for i in dict1.keys():\n        keys.append(i)\n    for i in dict2.keys():\n        if i not in keys:\n            keys.append(i)\n    for i in keys:\n        if i in dict1.keys() and i in dict2.keys():\n            merge_dict.update({i:(dict1[i]+dict2[i])})\n        elif i in dict1.keys():\n            merge_dict.update({i:dict1[i]})\n        else:\n            merge_dict.update({i:dict2[i]})\n    return merge_dict\n\n        "
B25DS006_q26,5,5,100.00,"<output> Ensure that both dictionary values are integers before attempting to sum them, as non-integer values can lead to unexpected results.</output>","def merge_sum(dict1, dict2):\n    result = dict1.copy()\n    for key, value in dict2.items():\n        if key in result:\n            result[key] += value\n        else:\n            result[key] = value\n    return result"
B25EE049_q26,5,5,100.00,"<output> Make sure to check if the key exists in both dictionaries before trying to access its value, using `dict1.get(key)` and `dict2.get(key)`, instead of directly accessing `dict1[item]` or `dict2[item]`. </output>","def merge_sum(dict1, dict2):\n    d = {}\n    for item in dict1:\n        if item not in dict2:\n            d[item] = dict1[item]\n        else:\n            d[item] = dict1[item]+dict2[item]\n    for item in dict2:\n        if item not in dict1:\n            d[item] = dict2[item]        \n            \n    return d        \n\n"
B25ME060_q26,4,5,80.00,<output>Check if the key exists in both dictionaries before trying to sum its value.</output>,"def merge_sum(dict1, dict2):\n    result = {}\n    for key1, val1 in dict1.items():\n        for key2, val2 in dict2.items():\n            if key1 == key2:\n                result[key1] = val1 + val2\n            else:\n                if key1 not in result:\n                    result[key1] = val1\n                if key2 not in result:\n                    result[key2] = val2\n                \n    return result\n\n\n            "
B25CS010_q26,5,5,100.00,"<output> In the line `{k: (v + dict2[k]) for k, v in dict1.items() if k in dict2}`, consider using the `get()` method to safely access `dict2[k]` and avoid a KeyError. </output>","def merge_sum(dict1, dict2):\n    """"""\n    Merge two dictionaries whose values are integers.\n    For keys present in both, sum their values.\n    Return a new dictionary without mutating inputs.\n    """"""\n    return {**{k: v for k, v in dict1.items() if k not in dict2}, **{k: v for k, v in dict2.items() if k not in dict1}, **{k: v + dict2[k] for k, v in dict1.items() if k in dict2}}\n"
B25MT003_q26,5,5,100.00,"<output> Make sure you're not creating a new dictionary (`dict(dict1)`) instead of using the `**` operator to unpack and merge dictionaries, as this can prevent changes to the original order of keys.</output>","def merge_sum(dict1, dict2):\n    result = dict(dict1)\n    for k, v in dict2.items():\n        result[k] = result.get(k, 0) + v\n    return result\n"
B25EE050_q26,5,5,100.00,"<output> To avoid the KeyError, always check if a key exists in the dictionary before trying to access its value, e.g., `if key in dict:`. </output>","def merge_sum(dict1, dict2):\n    dict = dict1.copy()\n    for key, value in dict2.items():\n        if key in dict:\n            dict[key] += value\n        else:\n            dict[key] = value\n    return dict\n"
B25MM013_q26,0,5,0.00,"<output> Ensure that you correctly handle cases where a key is present in only one of the input dictionaries, as your current implementation does not account for this scenario.</output>","def merge_sum(dict1,dict2):\n    new_dict={}\n    for key in dict1:\n        if key in dict2:\n            new_dict[key]=dict1[key]+dict2[key]\n        else:\n            new_dict[key]=dict1[key]\n    for key in dict2:\n        if key not in new_dict:\n            new_dict[key]=dict2[key]\n    return new_dict\n\nprint(merge_sum({'a':10,'b':5},{'b':7,'c':3}))\n"
B25EE044_q26,5,5,100.00,"<output>Consider adding a default value to handle cases where a key is present in only one of the dictionaries, ensuring that the function correctly sums values for shared keys.</output>","def merge_sum(dict1,dict2):\n    group =dict1.copy()\n\n    for key ,value in dict2.items():\n        group[key]=group.get(key,0) + value\n\n\n    return group\n  \n\n"
S25MA014_q26,0,5,0.00,"<output> Ensure that your merge function returns a dictionary, not None, by adding the return type hint and checking if the 'items' key exists before popping from it.  </output>","class Stack:\n    def __init__(self):\n        self.items=[]     \n    def push(self, item):\n        self.items.append(item)\n    def pop(self):\n        if not self.is_empty():\n            return self.items.pop()\n        else:\n            return None\n    def peek(self):\n        if not self.is_empty():\n            return self.items[-1]\n        else:\n            return None\n    def is_empty(self):\n        return len(self.items)==0\n    def size(self):\n        return len(self.items) "
B25EE012_q26,5,5,100.00,"<output>Check if the key exists in the output dictionary before trying to access it, to avoid a KeyError.</output>","def merge_sum( dict1 , dict2) :\n    \n    output = {}\n    \n    for key, value in dict1.items() :\n        output[key] = value\n        \n    for key, value in dict2.items() :\n        if key in output :\n            output[key] += value\n        else :\n            output[key] = value\n            \n    return output\n\n\n            "
B25EC021_q26,5,5,100.00,<output>Consider using a dictionary comprehension to simplify the update process and avoid potential issues with mutable default arguments.</output>,"def merge_sum(dict1 ={} , dict2={}):\n    new_dict,copy_dict = {},dict1.copy()\n    [new_dict.update({i : dict1[i] + dict2[i]}) for i in set(dict1.keys()).intersection(set(dict2.keys()))]\n    copy_dict.update(dict2)\n    copy_dict.update(new_dict)\n    return copy_dict\n"
B25EC009_q26,5,5,100.00,"<output>Check if the condition `i in dict2.keys()` is correctly capturing the shared keys between the two dictionaries, as it should be `i in dict2` instead of `dict1[i] in dict2.keys()`, which would incorrectly check for values in `dict1`.</output>","def merge_sum(dict1,dict2):\n    d = {}\n    for i,j in dict1.items():\n        if i in dict2.keys():\n            d[i] = j + dict2[i]\n        else:\n            d.update({i:j})\n    for u,v in dict2.items():\n        if u not in d.keys():\n            d.update({u:v})        \n    return d\n\n\n        \n"
B25DS001_q26,0,5,0.00,"<output>Verify that the values being added are integers, as non-numeric values can cause a TypeError when trying to add them.</output>","def mereg_sum(d1,d2):\n    md={}\n    a=d1.keys()\n    b=d2.keys()\n    for i in a:\n        if i in b:\n            md[i]=d1[i]+d2[i]\n        else:\n            md[i]=d1[i]\n    for j in b:\n        if j not in a:\n            md[j]=d2[j]\n    return md"
B25EC017_q26,5,5,100.00,"<output>Be cautious when using the `del` statement inside a loop, as it can cause unexpected side effects and lead to incorrect results.</output>","def merge_sum(dict1, dict2):\n    for i in list(dict1.keys()): \n        if i in dict2:\n            dict1[i] = dict1[i] + dict2[i]\n            del dict2[i]\n    for key, value in dict2.items():\n        dict1[key] = value\n    return dict1\n\n"
B25ME019_q26,0,5,0.00,"<output>Be cautious when iterating over a dictionary and modifying its contents simultaneously, as this can result in unexpected behavior.</output>","def merge_sum(dict1, dict2):\n    d={}\n    for (key1,value1) in dict1.items():\n        d[key1]=value1\n        for (key2,value2) in dict2.items():\n            if key2==key1:\n                d[key1]=value1+value2\n            else:\n                d[key2]=value2\n    print(d)\n        \n\n\nmerge_sum({'a':10,'b':5}, {'b':7,'c':3})"
B25EC034_q26,5,5,100.00,"<output> Be cautious when modifying a dictionary while iterating over it, as this can cause unexpected behavior due to the iteration order changing unexpectedly.</output>","def merge_sum(dict1, dict2):\n    l1 = dict1.copy()\n    for key, value in dict2.items():\n        if key in l1:\n            l1[key] += value\n        else:\n            l1[key] = value\n\n    return l1"
B25ME034_q26,5,5,100.00,"<output>Ensure that you correctly handle cases where a key exists in both dictionaries, using addition instead of concatenation to sum the values.</output>","def merge_sum(dict1, dict2):\n\n    new_dict = dict1.copy()  \n    \n    for key, value in dict2.items():\n        if key in new_dict:\n            new_dict[key] += value\n        else:\n            new_dict[key] = value\n    \n    return new_dict\n"
B25DS028_q26,5,5,100.00,"<output> When accessing shared keys in the two dictionaries, ensure you handle potential KeyErrors by checking if a key exists before attempting to use it. For instance, instead of `result[key] = dict2[key]`, consider using `if key in dict2: result[key] += dict2[key]`. </output>","def merge_sum(dict1, dict2):\n    result = {}\n    for key in dict1:\n        result[key] = dict1[key]\n    for key in dict2:\n        if key in result:\n            result[key] += dict2[key]\n        else:\n            result[key] = dict2[key]\n    return result"
B25CS032_q26,5,5,100.00,"<output> The issue lies in the fact that you're modifying `l2` and `l4` lists while iterating over them with indices, which can lead to unexpected results. Instead, consider using dictionaries to store key-value pairs directly from `dict1` and `dict2`. </output>","def merge_sum(dict1,dict2):\n	l1=[]\n	l2=[]\n	l3=[]\n	l4=[]\n	d={}\n	for(k,v) in dict1.items():\n		l1.append(k)\n		l2.append(v)\n	for (k1,v1) in dict2.items():\n		l3.append(k1)\n		l4.append(v1)\n	for i in range(0,len(l1)):\n		for j in range(0,len(l3)):\n			if l3[j]==l1[i]:\n				l2[i]=l2[i]+l4[j]\n				l4[j]=l2[i]\n	for k in range(0,len(l1)):\n		d[l1[k]]=l2[k]\n	for l in range(0,len(l3)):\n		d[l3[l]]=l4[l]\n	return(d)"
B25DS038_q26,0,5,0.00,<output>Check if the key exists in the dictionary before trying to access its value.</output>,"def invert_dict(d):\n    result = {}\n    for k, v in d.items():\n        result.setdefault(v, []).append(k)\n    return result\n"
B25ME029_q26,5,5,100.00,"<output>Be cautious when using the `update()` method on dictionaries, as it modifies the dictionary in-place, which could be unintended behavior if you're trying to create a new dictionary.</output>","def merge_sum(dict1, dict2):\n    newValue = 0\n    dic = {}\n    for value in dict1.keys():\n        if value in dict2.keys():\n            newValue = dict1[value] + dict2[value]  \n            dic.update({value : newValue})\n\n        else:\n            dic.update({value : dict1[value]})\n\n    for value in dict2.keys():\n        if value not in dict1.keys():\n            dic.update({value : dict2[value]})\n            \n    return dic\n\n    "
B25MT020_Q26,5,5,100.00,<output>Verify that the values being added are integers by checking if `value` is an integer before performing the addition.</output>,"# Filename: <YourID>_q26.py\n\ndef merge_sum(dict1, dict2):\n    """"""\n    Merge two dictionaries whose values are integers.\n    For keys present in both, sum their values.\n    Return a new dictionary without mutating inputs.\n    """"""\n    merged = dict1.copy()  # make a copy so dict1 is not mutated\n    for key, value in dict2.items():\n        merged[key] = merged.get(key, 0) + value\n    return merged\n\n\n# Example Test Case\nif __name__ == ""__main__"":\n    print(merge_sum({'a': 10, 'b': 5}, {'b': 7, 'c': 3}))\n    # Expected Output: {'a': 10, 'b': 12, 'c': 3}\n"
B25EC006_q26,5,5,100.00,<output>Check if the key exists in both dictionaries before trying to sum its values.</output>,"def merge_sum(dict1, dict2):\n    """"""\n    Merge two dictionaries whose values are integers.\n    For keys present in both, sum their values.\n    Return a new dictionary without mutating inputs.\n    """"""\n    new_dict = {}\n    for key,value in dict1.items():\n        flag=0\n        for key_,value_ in dict2.items():\n            if key==key_:\n                val = value+value_\n                new_dict[key]=val\n                flag=1\n        if flag==0:\n            new_dict[key]=value\n    for k,v in dict2.items():\n        if new_dict.get(k)==None:\n            new_dict[k]=v\n    return new_dict"
B25EE033_q26,5,5,100.00,"<output>Verify that the values being added are integers by using the `isinstance()` function or type checking, as mixing integer and string values can cause unexpected results.</output>","def merge_sum(dict1, dict2):\n    \n    \n    result = dict1.copy()  # make a shallow copy to avoid mutation\n    for key, value in dict2.items():\n        \n        if key in result:\n            result[key] += value\n        \n        else:\n            result[key] = value\n    \n    return result"
B25EC033_q26,0,5,0.00,"<output>Be cautious when using the `get()` method, as it may return `None` for keys that are not present in the dictionary, potentially leading to a TypeError when trying to add an integer value.</output>","def merge_sum(dict1, dict2):\n    merged = dict1.copy()  \n    for key, value in dict2.items():\n        merged[key] = merged.get(key, 0) + value\n    return merged\nprint(merge_sum({'a': 10, 'b': 5}, {'b': 7, 'c': 3}))"
B25EC014_q26,3,5,60.00,"<output> Ensure that you check for both keys being present in both dictionaries using `in` instead of `==`, and use a single loop to iterate through one dictionary, like this: `for key in dict1.keys():`. </output>","def merge_sum(dict1, dict2):\n    """"""\n    Merge two dictionaries whose values are integers.\n    For keys present in both, sum their values.\n    Return a new dictionary without mutating inputs.\n    """"""\n    new ={}\n    for a in dict1:\n        if (a in dict2) == True:\n            new.update({a:(dict1.get(a)+dict2.get(a))})\n        else:\n            new.update({a: dict1.get(a)})\n    \n    for b in dict2:\n        if b not in dict1 == True:\n            new.update({b:dict2.get(b)})\n            \n            \n    return new\n            \n"
B25EE059_q26,5,5,100.00,"<output> Check if you're correctly handling cases where a key is present in both dictionaries, and consider using a more explicit approach to combine values instead of relying on the `get()` method alone.</output>","def merge_sum(dict1, dict2):\n    result = dict1.copy()\n    for key, value in dict2.items():\n        result[key] = result.get(key, 0) + value\n    return result"
B25EC002_q26,5,5,100.00,<output> Pay close attention to how you handle keys that are present in one dictionary but not the other. Are you correctly skipping over those keys or leaving them as null/undefined values? </output>,"def merge_sum(dict1, dict2):\n    new_dict = dict()\n    for i in dict1:\n        if i in dict2:\n            new_dict[i] = dict1[i] + dict2[i]\n        else:\n            new_dict[i] = dict1[i]\n    for j in dict2:\n        if j not in new_dict:\n            new_dict[j] = dict2[j]\n    return new_dict\n"
B25CS054_q26,5,5,100.00,"<output>Consider adding a default value to handle cases where a key is present in one dictionary but not the other, ensuring that the sum is calculated correctly for shared keys.</output>","def merge_sum(dict1, dict2):\n    \n    keys = list(set(dict1.keys()).union(set(dict2.keys())))\n    new_dict = {}\n    for key in keys:\n        sum = 0\n        if key in dict1: sum += dict1.get(key)\n        if key in dict2: sum += dict2.get(key)\n\n        new_dict[key] = sum\n    \n    return new_dict\n\n"
