student_id,tests_passed,tests_total,score_percentage,semantic_summary,code_snippet
B25EE023_q8,1,5,20.00,"<output> The function is currently returning elements at even indices instead of odd, as indicated by the condition `i % 2 == 0`. </output>","def get_odd_indices(n):\n    """"""\n    This function takes a list n as input and returns a new list containing elements at odd indices.""""""\n    \n    return [n[i] for i in range(0 ,(len(n) )) if i%2==0]\n        \n    \n\n"
B25EE038_Q8,0,5,0.00,<output> The issue lies in the function name 'odd_indexed_elements' which does not match the expected function name 'get_odd_indices'. Ensure that the function name matches the problem statement. </output>,"def odd_indexed_elements(items):\n    return items[1::2]\n\n\nprint(odd_indexed_elements([10,20,30,40,50]))\nprint(odd_indexed_elements([""a"",""b"",""c""]))"
b25cs040.q8,0,5,0.00,<output>Try changing `numbers[i]` to `numbers[2*i+1]` to access the element at odd indices.</output>,"n = int(input(""How many elements you want to enter: ""))\n\nnumbers = []\nfor i in range(n):\n    num = input(""Enter element: "")\n    numbers.append(num)\n\nprint(""Elements at odd indices:"")\nfor i in range(len(numbers)):\n    if i % 2 != 0:  \n        print(numbers[i])\n"
B25EE033_q8,5,5,100.00,<output>Check if you're modifying the original list by using `append` instead of creating a new list to store the elements at odd indices.</output>,def get_odd_indices(items):\n    \n    odd_indices_list = []\n    \n    idx = 0\n\n    \n    for i in items:\n        if idx % 2 != 0:\n            odd_indices_list.append(i)\n        \n        idx = idx + 1\n\n    return odd_indices_list  
B25CS054_q8,5,5,100.00,"</output> The issue with your code is that it starts indexing from 1, but list indices in Python start at 0, so the first element is at index 0, not 1.","def get_odd_indices(items):\n    return [items[i] for i in range (1,len(items),2)]"
B25CS035_q8,5,5,100.00,<output>Consider adjusting the step size in the slice notation from 2 to 1 to start counting indices from 0 instead of 1.</output>,"def get_odd_indices(items):\n    """"""\n    Return elements from 'items' that are at odd indices (1,3,5,...).\n    """"""\n    return items[1::2]\n\n"
B25DS022_q8,0,5,0.00,"<output> The student's code snippet uses `items[1:l + 1:2]`, which starts indexing from the second element (index 1) and increments by 2. This will only return every other element, starting from the second one, not elements at odd indices. </output>","def get_odd_indices(items):\n    # Return elements from ’items’ that are at odd indices (1,3,5,...).\n    l=len(items)\n    k=items[1:l+1:2]\n    print(k)\n    return(k)\n    pass\n# test cases\nprint(get_odd_indices([10,20,30,40,50]))\nprint(get_odd_indices([""a"",""b"",""c""]))"
B25EE050_q8,5,5,100.00,"<output>Try changing the step size from 2 to 2, and then adjust the start index accordingly.</output>",def get_odd_indices(items):\n    return items[1::2]\n
<B25CS024>_q8,5,5,100.00,"<output> The issue lies in the fact that you're creating a new list using `lst = [items[i] for i in range(len(items)) if i % 2 != 0]`, but this doesn't modify the original list. Instead, consider using slicing to extract elements at odd indices directly from the original list.</output>","# Q8\ndef get_odd_indices(items):\n    lst = [items[i] for i in range(len(items)) if i%2 != 0]\n    return lst\n\nget_odd_indices([10,20,30,40,50])\nget_odd_indices(['a','b','c'])"
B25EC042_q8,0,5,0.00,"<output> The student's code starts indexing from 1 instead of 0, which means it will miss the first element at an odd index (the number itself). </output>","def get_odd_indices(items):\n    l=[]\n    for i in range(1,len(items)):\n        if i%2!=0:\n            l.append(items[i])\n    return l\nprint( get_odd_indices([10, 20,30, 40, 50]))\nprint( get_odd_indices([""a"", ""b"", ""c""]))"
B25Ec028_q8,0,5,0.00,"<output> The function is currently returning every other element, not just the ones at odd indices; try using `items[::2]` instead of `items[1::2]`. </output>","def get_odd_indices(items):\n    return items[1::2]\nprint(get_odd_indices([10,20,30,40,50]))\nprint(get_odd_indices([""a"",""b"",""c""]))"
B25CS044_Q8,5,5,100.00,<output>Consider using list slicing instead of appending individual elements to avoid modifying the original list.</output>,"def get_odd_indices(items):\n    """"""Return elements from ’items’ that are at odd indices (1,3,5,...)""""""\n    lst = []\n\n    for i in range(1,len(items),2):\n        lst.append(items[i])\n        \n    \n    return lst\n\nget_odd_indices([10, 20, 30, 40, 50]) # [20, 40]\nget_odd_indices([""a"", ""b"", ""c""]) # [""b""]"
B25ME039_q8,0,5,0.00,"<output> The issue lies in the function signature; you need to specify that 'items' is a required positional argument, so change `def get_odd_indices(items):` to `def get_odd_indices(items): return items[1::2]`. </output>",def get_odd_indices(items):\n    return items[1::2]\n\nget_odd_indices()
B25EC027_q8,0,5,0.00,"<output> The student's code uses slicing to get every other element starting from index 1 (nl = items[1::2]), which is incorrect because it should start from index 0 and step by 2 (nl = items[::2]) to get elements at odd indices. </output>","def get_odd_indices(items):\n    nl=items[1::2]\n    return nl\nprint(get_odd_indices([10,20,30,40,50]))\nprint(get_odd_indices(['a','b','c']))"
B25ME024_q08,5,5,100.00,"<output> The issue lies in the slicing step, where using `items[1::2]` would skip even indices and include only odd ones, but this approach assumes all elements are iterable. Consider using a list comprehension or iterating over the items directly to ensure each element is processed individually. </output>",def get_odd_indices(items):\n   \n    return items[1::2]\n\n\n
B25EE036_q8,0,5,0.00,"<output> Consider modifying your loop to start from index 0 instead of 1, as Python uses zero-based indexing, and you're currently skipping every other element. </output>","def get_odd_indices(items):\n    """"""\n    Return elements from ’items’ that are at odd indices\n    (1,3,5,...).\n    """"""\n    ans=[]\n    for i in range(1,len(items),2):\n        ans.append(items[i])\n    return ans\nprint(get_odd_indices([10,20,30,40,50]))\nprint(get_odd_indices([""a"",""b"",""c""]))\n"
B25DS030_q8 (1),5,5,100.00,"<output>Instead of using `range(len(items))`, try using `range(0, len(items), 2)` to only include odd indices.</output>","def get_odd_indices(items):\n  """"""Return elements from ’items’ that are at odd indices(1,3,5,...).""""""\n  l=[items[i] for i in range(len(items)) if i%2!=0]\n  return l"
B25CS018_q8,0,5,0.00,"<output> The issue lies in the range function where it stops one index short of the last element, causing the last odd-indexed element to be excluded from the output. Change `range(0, len(items) - 1)` to `range(len(items))` to include all elements. </output>","def get_odd_indices(items):\n    new_list = []\n    \n    for i in range(0,len(items)-1):\n        if (i%2 != 0):\n            new_list.append(items[i])\n    \n    return new_list\n\nprint(get_odd_indices([10, 20, 30, 40, 50]))\nprint(get_odd_indices([""a"", ""b"", ""c""]))"
B25EE060_q8,5,5,100.00,"<output> The issue lies in the line where you're using `range(len(items))`. This will include even indices as well, which is not what we want. Instead, use `range(0, len(items), 2)` to only get odd indices. </output>",def get_odd_indices(items):\n    Only_odds =[items[i] for i in range(len(items)) if i % 2 == 1]\n    return Only_odds
B25MT022_q8,0,5,0.00,"<output> The issue with your code is that you are using a step size of 2, which means you are only selecting every other element in the list. You should change `0::2` to `1::2` to get elements at odd indices. </output>","def get_odd_indices(items):\n    return items[0::2]\n\nprint(get_odd_indices([40, 50, 30, 20, 10]))"
B25EC034_q8,5,5,100.00,<output>Consider using list comprehension to create a new list with elements at odd indices instead of iterating over the original list and checking each element's index.</output>,def get_odd_indices(items):\n    l1 = []\n    for ele in items:\n        r = items.index(ele)\n        if r % 2 != 0:\n            l1.append(ele)\n        \n    return l1
B25EE042_q8,5,5,100.00,"<output>Try changing the step size from 2 to 1, so `return items[1::1]` instead.</output>",def get_odd_indices(items):\n    \n    return items[1::2]
B25MT007_q8,0,5,0.00,<output>Check if you are returning True instead of returning the actual value at odd indices.</output>,"def get_odd_indices(items):\n    new=[]\n    def odd(s):\n        if s%2!=0:\n            return True\n    for i in range(len(items)):\n        if odd(i)==True:\n            new.append(items[i])\n    return new\nprint(get_odd_indices([10, 20, 30, 40, 50]))  # [20, 40]\nprint(get_odd_indices([""a"", ""b"", ""c""]))       # [""b""]\n"
B25DS016_q8,5,5,100.00,<output>Check if you are using the correct indexing method to access elements at odd indices; consider using `items[i+1]` instead of `items[i]`.</output>,def get_odd_indices(items):\n    lst=[]\n    for i in range(len(items)):\n        if i%2!=0:\n            lst.append(items[i])\n    return lst\n\n        \n        
B25CS017_Q8,0,5,0.00,"<output> The student's code uses `n[i]` instead of `n[2*i - 1]`, which would access the element at an even index instead of an odd one, leading to incorrect results.</output>","def get_odd_indices(n):\n    a = []\n    for i in range(1,len(n),2):\n        a.append(n[i])\n    print(a)\nget_odd_indices([10, 20, 30, 40, 50]) \nget_odd_indices([""a"", ""b"", ""c""]) "
B25DS001_q8,5,5,100.00,"<output> The issue lies in the line `if c % 2 != 0`, which will never be true because `c` starts at 0 and is incremented by 1 each time, making it always even. </output>",def get_odd_indices(l):\n    c=0\n    m=[]\n    for i in l:\n        if c%2!=0:\n            m.append(i)\n        c+=1\n    return m
B25EE055_q8,5,5,100.00,"<output>Notice that the loop starts from index 1 instead of 0, which means it will skip the first element in the list.</output>","def get_odd_indices(items):\n    l=len(items)\n    lst=[]\n    for _ in range (1,l,2):\n        lst.append(items[_])\n    return lst\n\n\n        \n        \n     "
B25CS041_q8,5,5,100.00,"<output> The issue lies in using `items.index(i)` to check if an index is odd, which returns the index of the first occurrence of the item in the list, not its original position. Instead, use `enumerate` to get both the index and value of each item. </output>","def get_odd_indices(items):\n    """"""\n    Return elements from ’items’ that are at odd indices\n    (1,3,5,...).\n    """"""\n    return [i for i in items if items.index(i)%2 != 0]\n    \n"
B25CS039_q8,0,5,0.00,"<output> The issue lies in the range starting from 1 instead of 0, which skips the first element at an odd index (index 0) and results in incorrect output. Try changing `range(1, len(items), 2)` to `range(0, len(items), 2)`. </output>","def get_odd_indices(items):\n    return [items[x] for x in range(1,len(items),2)]\nprint(get_odd_indices([10, 20, 30, 40, 50])) # [20, 40]\nprint(get_odd_indices([]))"
B25EC039_q8,2,5,40.00,"<output> The issue lies in the range of the list indices, as it includes the last element (at index 1) which results in an ""IndexError: list index out of range"" because there is no element at index len(items). Consider changing the range to exclude the last element. </output>","def get_odd_indices(items):\n    return [items[i] for i in range(1,len(items)+1,2)]"
B25EC036_q8,5,5,100.00,"<output>Consider modifying the code to utilize list slicing instead of manual indexing, as it can simplify the process and avoid potential edge cases.</output>",def get_odd_indices(items):\n    new_items=[]\n    for i in range(len(items)):\n        if i%2!=0:\n            new_items.append(items[i])\n    return new_items\n
B25EC007_q8,3,5,60.00,"<output>Consider using list slicing to extract elements at odd indices, as it is more concise and efficient than iterating over the entire list.</output>",def get_odd_indices(items):\n    if len(items)<2 :\n        return None\n    odd=[]\n    for i in range (len(items)) :\n        if i%2==1 :\n            odd.append(items[i])\n    return odd\n            \n
B25EC006_q8,5,5,100.00,<output>Consider using list comprehension to create a new list with elements at odd indices instead of appending to an empty list.</output>,"def get_odd_indices(items):\n    """"""\n    Return elements from 'items' that are at odd indices\n    (1,3,5,...).\n    """"""\n    l=[]\n    for i in range(len(items)):\n        if i%2 != 0:\n            l.append(items[i])\n    return l"
B25EE002_q08,1,5,20.00,"<output> The issue lies in using the modulus operator (`%`) on a list, which is not defined for lists. Instead, iterate over the indices of the list and access elements at those specific positions. </output>",def get_odd_indices(n):\n    result = []\n    for i in range(len(n)):\n        if n%2!=0:\n            result.append(n[i])\n    return result\n            
B25ME009_q8,5,5,100.00,<output>Check if you're actually modifying the original list by using append() instead of creating a new list with the elements at odd indices.</output>,"""""""\nReturn elements from ’items’ that are at odd indices\n(1,3,5,...).\n""""""\ndef get_odd_indices(items):\n    result = []\n    for i in range(len(items)):\n        if i % 2 == 1:\n            result.append(items[i])\n    return result\n"
B25ME018_q8,5,5,100.00,<output>Consider changing `n += 2` to `n += 1` to correctly access elements at odd indices.</output>,"def get_odd_indices(items):\n    """"""\n    Return elements from ’items’ that are at odd indices\n    (1,3,5,...).\n    """"""\n    \n    n=1\n    res=[]\n    while n < len(items):\n        element= items[n]\n        res.append(element)\n        n +=2\n    return res\n    \n'''\nprint(get_odd_indices([10, 20, 30, 40, 50])) # [20, 40]\nprint(get_odd_indices([""a"", ""b"", ""c""])) # [""b""]\n'''"
B25ME008_Q8,5,5,100.00,"<output> Ensure that you are appending elements to a new list instead of modifying the original 'items' list using its indexing (e.g., `req_list.append(items[i])` should be `req_list.append(items[2*i+1])`). </output>",def get_odd_indices(items):\n    count = len(items)\n    req_list = []\n    i = 0\n    while i<count:\n        if i%2!=0:\n            req_list.append(items[i])\n        i+=1\n    \n    return req_list
B25CS029_q8,5,5,100.00,"<output> The issue lies in the fact that you're using `range(len(items))` which includes even indices, whereas you should only consider odd indices by starting from 1 and ending at `len(items) - 1`. </output>",def get_odd_indices(items):\n    return [items[i] for i in range(len(items)) if i%2 != 0]\n            
B25EE044_q8,5,5,100.00,"<output> Start your list comprehension with `items[::2]` instead of `items[1::2]`, as you want to include even indices (0, 2, 4, ...) in the result. </output>","def get_odd_indices(items):\n    """"""\n    Returnelementsfromitemsthatareatoddindices\n    (1,3,5,...).""""""\n    \n    s=items[1::2]\n    return s\n\n\n"
B25DS043_q8,5,5,100.00,<output>Consider using slicing to extract elements at odd indices instead of appending individual elements.</output>,"def get_odd_indices(items):\n """""" Return elements from 'items' that are at odd indices (1,3,5,...). """"""\n list=[]\n for i in range(1, len(items), 2):\n    list.append(items[i])\n return list\n"
B25CS050_q8,2,5,40.00,<output>Check if you are using the correct variable name 'items' instead of 'itmes' in your code.</output>,def get_odd_indices(items):\n    list2=[]\n    for i in range (len(items)):\n        if (i%2!=0):\n            list2.append(itmes(i))\n    return list2
B25EC032_Q8,0,5,0.00,<output>Check if the student's code is correctly identifying and appending elements at odd indices instead of even indices.</output>,"def get_odd_indices(lst):\n    new_list=[]\n    for i in range(len(lst)):\n        if i%2==0:\n            continue\n        else:\n            new_list.append(lst[i])\n    return new_list\n\n\nprint(get_odd_indices([10, 20, 30, 40, 50])) \nprint(get_odd_indices([""a"", ""b"", ""c""]))\nprint(get_odd_indices([0,1,2,3,4,5,6,7,8,9]))\n\n    "
B25CS036_q8,5,5,100.00,"<output> Ensure that you are correctly iterating over the indices in your while loop. Instead of `i = i + 2`, consider using `enumerate` to get both the index and value of each item, then append the item at odd indices to `list1`. </output>","def get_odd_indices(items):\n    """"""\nReturn elements from ’items’ that are at odd indices\n(1,3,5,...).\n""""""\n    i = 1\n    list1 = []\n    while i < len(items):\n        list1.append(items[i])\n        i = i + 2\n    return list1\n   \n"
B25EC020_q8,5,5,100.00,"<output> The student's code is attempting to access elements at odd indices, but the indexing syntax used (n[1::2]) will only select every other element starting from index 1, effectively selecting even-indexed elements instead of odd-indexed ones. </output>",def get_odd_indices(n):\n    return n[1::2]\n
B25MT015_q8,5,5,100.00,"<output> The function should start from index 1 and step by 2, but the current implementation starts from index 0 and steps by 2, effectively skipping the first element. Change `items[1::2]` to `items[1::2, None]`. </output>",def get_odd_indices(items):\n    return items[1::2]
B25ME017_q8,5,5,100.00,<output>Consider using list slicing to extract elements at odd indices instead of iterating over the entire list.</output>,def get_odd_indices(l:list):\n    a = []\n    for i in range(len(l)):\n        if i%2 !=0:\n            a.append(l[i])\n    return a\n
B25CS011_q8,5,5,100.00,<output>Start your list comprehension from index 0 instead of 1 to include elements at odd indices.</output>,"def get_odd_indices(items):\n  return [items[i] for i in range(1,len(items),2)]\n\n"
B25ME048_q8,5,5,100.00,<output>Consider using slicing to extract elements at odd indices instead of manually iterating over the list.</output>,"def get_odd_indices(items):\n    """"""\nReturn elements from ’items’ that are at odd indices\n(1,3,5,...).\n    """"""\n    nlist=[]\n    for i in range(len(items)):\n        if i%2!=0:\n            nlist.append(items[i])\n    return nlist\n\n"
B25CS056_q8,5,5,100.00,"<output> The issue lies in the fact that you're using `items[i]` to access elements at odd indices, but this will only work correctly if the list is 0-indexed. Since Python lists are 0-indexed, you should use `items[2*i-1]` instead.</output>","def get_odd_indices(items):\n    """"""\n    Return elements from ’items’ that are at odd indices\n    (1,3,5,...).\n    """"""\n    item = []\n    for i in range(1, len(items), 2):\n        item.append(items[i])\n    return item\n\n# print(get_odd_indices([""a"", ""b"", ""c""]))"
B25MM006_q8,5,5,100.00,"<output> The issue lies in the range function, which starts from 1 instead of 0, thus skipping the first element at even indices. </output>","def get_odd_indices(items):\n    L=[]\n    for i in range(1,len(items),2):\n        L.append(items[i])\n    return L          "
{B25CS013}_q8,0,5,0.00,"<output> The student's code is attempting to find the maximum number, but it should be finding elements at odd indices of the list instead. Consider using list slicing (e.g., `numbers[1::2]`) to achieve this. </output>","def find_max(numbers):\n    if not number:\n        return None\n    maxmium=number[0]\n    for num in number:\n        if num>maximum:\n            maximum=num\n    return maximum\nprint(find_max([2,3,5,1,7,9]))"
B25MT026_q8,1,5,20.00,<output>Consider adjusting the range in your list comprehension to start from 0 instead of 1 to accurately reflect odd indices.</output>,"def get_odd_indices(items):\n    ""Return elements from ’items’ that are at odd indices""\n\n    odd_items = [ items[idx - 1] for idx in range(1, len(items) + 1, 2) ]\n\n    return odd_items\n\n\n# print(get_odd_indices([10, 20, 30, 40, 50])) # [20, 40]\n# print(get_odd_indices([""a"", ""b"", ""c""])) # [""b""]\n"
B25EE053_q08,5,5,100.00,"</output> The student's code is attempting to access every other element in the list, but starting from index 1 instead of 0, which would result in missing the first element.",def get_odd_indices(items):\n    odd=list(items[1:len(items):2])\n    return odd
S25MA014_q8,0,5,0.00,<output>Consider modifying your function to return the elements at odd indices instead of calculating the factorial.</output>,"def factorial_recursive(n):\n    p=1\n    if n==0 or n==1:\n        return 1\n    else:\n        for i in range(1,n+1):\n            p=p*(i)\n        return p"
B25CS009_q8,5,5,100.00,"<output> The issue lies in the implementation where you are using `l.append(items[i])` instead of `l.insert(i, items[i])`, which would incorrectly add elements to the end of the list instead of at the odd indices.</output>","def get_odd_indices(items):\n """"""\n Returnelementsfrom’items’thatareatoddindices\n (1,3,5,...).\n """"""\n l = []\n for i in range(len(items)) :\n     if i%2 != 0 :\n         l.append(items[i])\n return l \n         \n"
B25EE054_q8,5,5,100.00,<output>Check if you are modifying the original list while iterating over it; consider using a copy instead.</output>,def get_odd_indices(items):\n    l=[]   \n    for i in items:\n        a=items.index(i)\n        if a%2!=0:\n            l.append(i)\n    return l
B25ME014_q8.py,0,5,0.00,"<output> You are using `items[1:l + 1:2]` which starts indexing from index 1 instead of 0, resulting in missing the first element at an odd index (which is actually at index 0). Try changing it to `items[::2]`. </output>","def get_odd_indices(items):\n    """"""\n    Return elements from ’items’ that are at odd indices\n    (1,3,5,...).\n    """"""\n    l=len(items)\n    k=items[1:l+1:2]\n   \n    return(k)\n    pass\n\n\n\n"
B25DS013_Q8,0,5,0.00,"<output>Consider using slicing instead of appending elements to a new list, as this can be more efficient and aligns with Python's list indexing behavior.</output>","def get_odd_indices(items):\n    l=[]\n    for i in range(0,len(items)):\n        if i%2!=0:\n            l.append(items[i])\n    return l\nprint(get_odd_indices([10, 20, 30, 40, 50])) \nprint(get_odd_indices([""a"", ""b"", ""c""]))        "
B25MT014_q8,1,5,20.00,"<output> Your function should return every other element, starting from the first one (index 0), which means you need to step by 2 in the list comprehension. Change `::2` to `::1` to fix the issue.</output>",def get_odd_indices(items):\n\n    return items[::2]
B25MT021_q8,0,5,0.00,<output> Make sure to return a slice of the list instead of appending individual elements to avoid modifying the original list. </output>,"def get_odd_indices(items):\n    result = []\n    for i in range(len(items)):\n        if i % 2 == 1:\n            result.append(items[i])\n    return result\n\nprint(get_odd_indices([10, 20, 30, 40, 50]))\nprint(get_odd_indices([""a"", ""b"", ""c""]))"
B25MM018_q8,0,5,0.00,"<output> The function should start with `return []` instead of just `return`, because the problem asks for elements at odd indices, which means an empty list is expected when no such element exists. </output>","def get_odd_indices(items):\n    \n    \n    return items[1::2]\n\nprint(get_odd_indices([10,20,30,40,50,60]))"
B25CS030_q8,5,5,100.00,"<output> Make sure to iterate over the indices of the list using enumerate instead of range, so that you can access both the index and the value in a single step. </output>",def get_odd_indices(items):\n    result = []\n    for i in range(len(items)):\n        if i%2==1:\n            result.append(items[i])\n    return result\n\n
B25DS018_q8,0,5,0.00,"<output> The issue lies in starting the loop from index 1 instead of 0, which means it's skipping the first element of the list at even indices. </output>","def get_odd_indices(items):\n    newlist = []\n    for i in range(1,len(items),2):\n        newlist.append(items[i])\n\n    return newlist\n\nprint(get_odd_indices([10,20,30,40,50]))\nprint(get_odd_indices([""a"",""b"",""c""]))"
B25EE051_q8,5,5,100.00,<output> Make sure to increment the index by 1 (`count += 1`) instead of 2 (`count += 2`) when accessing elements from the list at odd indices.</output>,def get_odd_indices(items):\n    count = 1\n    listy = []\n    while count < len(items):\n        listy.append(items[count])\n        count += 2\n    return listy\n
B25MM028_q8,0,5,0.00,"<output> Consider using list slicing to extract elements at odd indices, as this approach is more concise and efficient than iterating over the entire list. </output>","def get_odd_indices(items):\n    odd_indices=[]\n    for i in range(len(items)):\n        if i%2!=0:\n            odd_indices.append(items[i])\n    return odd_indices\nprint(get_odd_indices([10, 20,30,40,50]))\nprint( get_odd_indices([""a"",""b"",""c""]))"
B25CS004_q8,5,5,100.00,<output>Start your loop from index 0 instead of 1 to include elements at odd indices.</output>,def get_odd_indices(items):\n    ans=[]\n    i=1\n    while(i<len(items)):\n        ans.append(items[i])\n        i+=2\n    return ans
B25MT003_q8,2,5,40.00,"<output> The issue lies in the fact that you are using `range(1, len(items), 2)` to start indexing from index 1, but you should be starting from index 0 to include odd indices. Try changing it to `range(0, len(items), 2)`. </output>","def get_odd_indices(items):\n    new=[]\n    for i in range(1, len(items), 2):\n        new.append(i)\n        \n    return  new\n"
