student_id,tests_passed,tests_total,score_percentage,semantic_summary,code_snippet
B25ME035_Q8,0,5,0.00,"<output> The loop should iterate from 0 to l-1 instead of l-1 to l, as Python uses zero-based indexing and you want to check all indices within the list's bounds. </output>","def get_odd_indices(items):\n    l=len(items)\n    for a in range(l-1,-1,-1):\n        if a%2==0:\n            items.pop(a)\n    print(items)\nget_odd_indices([10,20,30,40,50])"
B25CS028_q8,0,5,0.00,"<output>Check if you're actually modifying the original list by appending elements to `odd_list`, as this might not be the intended behavior according to the problem statement.</output>","def get_odd_indices(items):\n    l = len(items)\n    odd_list = []\n    for i in range(0,l):\n        if i%2 != 0:\n            odd_list.append(items[i])\n    return odd_list\n    pass\nprint(get_odd_indices([10,20,30,40,50]))\nprint(get_odd_indices([""a"",""b"",""c""]))"
B25EE029_q8,5,5,100.00,"<output> The issue lies in using `items.index(item)` to find the index of each item, which has a time complexity of O(n) and can be slow for large lists. Instead, consider using a single pass through the list with an index variable. </output>",def get_odd_indices(items):\n    x=[]\n    for item in items:\n        l=items.index(item)\n        if l%2!=0:\n            x.append(item)\n    return x\n\n            \n    
B25EE043_q8,0,5,0.00,<output> Make sure to use `lst[k]` instead of `new_lst[k]` when accessing elements in the original list within the loop. </output>,"def get_odd_indices(lst):\n    new_lst=[]\n    for k in range (len(lst)):\n        if k%2!=0:\n            new_lst.append(lst[k])\n    return new_lst\nprint(get_odd_indices([10,9,1983]))"
B25EC013_q8,5,5,100.00,"<output>Check if you are using the correct method to access and manipulate elements in the list, as `items.index(item)` may not be the most efficient way to achieve this.</output>",def get_odd_indices(items):\n    lst=[]\n    for item in items:\n        if items.index(item)%2==0:\n            pass\n        else:\n            lst.append(item)\n    return lst
B25MT027_q8,5,5,100.00,"<output> The issue lies in the fact that you're using `append` to add elements to the list, which modifies the original list and doesn't create a new one. Instead, use slicing to create a new list with only the odd-indexed elements. </output>","def get_odd_indices(items):\n    l=[]\n    for i in range(0,len(items)):\n        if i%2!=0:\n            l.append(items[i])\n    return l\n""""""\nReturn elements from ’items’ that are at odd indices\n(1,3,5,...).\n""""""\npass\n"
B25DS040_q8,5,5,100.00,"<output> The function should start from index 0 and step by 2, not from index 1, so change `items[1::2]` to `items[::2]`. </output>",def get_odd_indices(items):\n    return items[1::2]
B25MT029_Q8,0,5,0.00,"<output> The issue lies in the fact that you're not actually returning the new list, but instead printing it directly, so change `print(new)` to `return new`. </output>","def get_odd_indices(items):\n    new = []\n    for i in range(0, len(items)):\n        if i % 2 == 0:\n            pass\n        else:\n            new.append(items[i])\n    print(new)\nget_odd_indices([10,20,30,40,50]) \nget_odd_indices([""a"",""b"",""c""]) "
B25EC019_q8,5,5,100.00,"<output> The issue lies in using `items[i]` to access elements at odd indices, as this will skip every other element starting from the first one. Instead, use `items[2*i-1]` to correctly access elements at odd indices.</output>","def get_odd_indices(items):\n    """"""\n    Return elements from ’items’ that are at odd indices\n    (1,3,5,...).\n    """"""\n    odd_indexed_items = []\n    for i in range(1, len(items), 2):\n        odd_indexed_items.append(items[i])\n    return odd_indexed_items\n\n"
b25me058_q8,5,5,100.00,"<output> Be cautious when using `append` to add elements to a list in Python, as it can lead to inefficient memory usage and potential issues with maintaining the original order of elements. Consider using `extend` instead, which is more suitable for adding multiple elements at once.</output>",def get_odd_indices(items):\n    lst=[]\n    for i in range(len(items)):\n        if i%2!=0:\n            lst.append(items[i])\n    return lst
B25CS033_q8,5,5,100.00,"<output> The issue lies in the starting index of 1, which skips the first element (at index 0) and does not include elements at even indices as required by the problem statement.</output>","def get_odd_indices(items):\n    """"""\n    Return elements from ’items’ that are at odd indices\n    (1,3,5,...).\n    """"""\n    return [items[i] for i in range(1, len(items), 2)]\n"
B25ME033_Q8,0,5,0.00,"<output> The issue lies in starting the loop from index 1 instead of 0, which skips the first element at an odd index (the last element in the list). </output>","def get_odd_indices(items):\n    l=[]\n    n=len(items)\n    for i in range(1,n,2):\n        l.append(items[i])\n    return l\nx=[10,20,30,40,50]\nprint(get_odd_indices(x))\n        \n"
B25MT019_q8,5,5,100.00,"<output> The student's code starts indexing from 1 instead of 0, which means it will miss the first element at an odd index (index 0). </output>","#B25MT019_q8\ndef get_odd_indices(items:list):\n    s=[]\n    l=len(items)\n    for i in range(1,l,2):\n        s.append(items[i])\n    return s\nget_odd_indices([10,20,30,40,50]) #[20,40]\nget_odd_indices([""a"",""b"",""c""]) #[""b""]"
B25EC014_q8,5,5,100.00,"<output> The student's code uses `items.index(a)`, which has a time complexity of O(n), making it inefficient for large lists. Consider using list slicing instead, such as `[a for i, a in enumerate(items) if i % 2 != 0]`. </output>","def get_odd_indices(items):\n    """"""\n    Return elements from ’items’ that are at odd indices\n    (1,3,5,...).\n    """"""\n    return [a for a in items if items.index(a) %2 ==1]\n\n\n"
B25ME001_q8,5,5,100.00,"<output> The student's code should iterate over the range of indices from 1 to len(items) - 1 instead of 0 to len(items), because list indices in Python are 0-based. </output>","def get_odd_indices(items):\n    lst = []\n    for i in range(0,len(items)):\n        if i%2 != 0 :\n            lst.append(items[i])\n    return lst\n"
s25ma010_q8,0,5,0.00,"<output> Check if you are returning the new list correctly by using the return keyword instead of just printing it, as the function's purpose is to return elements at odd indices, not print them.</output>","def odd_indices(items):\n    new_list=[]\n    for i in range(len(items)):\n        if i%2 != 0 :\n            new_list.append(items[i])\n    return new_list\nprint(odd_indices([10,20,30,40,50]))\n"
B25EE056_q8,0,5,0.00,"<output> The issue lies in using `items.index(i)` to check if an index is odd, which returns the index of the first occurrence of `i` in the list. Instead, consider using a loop that iterates over the indices of the list. </output>","def get_odd_indices(items):\n  new_items=[]\n  for i in items:\n      if (items.index(i))%2!=0:\n        new_items.append(i)\n  return new_items\nprint(get_odd_indices([10,20,30,40,50]))\nprint(get_odd_indices([""a"",""b"",""c""]))"
B25EE025_q8,0,5,0.00,<output>Check if you are correctly using the append method to add elements to your result list.</output>,"def get_odd_indices(items):\n    result = []\n    for i in range(len(items)):\n        if i % 2 != 0:\n            result.append(items[i])\n    return result\n\n#example\nprint(get_odd_indices([10,20,30,40,50]))\nprint(get_odd_indices([""a"",""b"",""c""]))"
B25ME013_q8,5,5,100.00,"<output>Check if the student correctly handles the indexing and iteration of the input list, considering that Python uses zero-based indexing.</output>",def get_odd_indices(items):\n    lst=[]\n    i=1\n    n=len(items)\n    while (i<=(n-1)):\n        lst.append(items[i])\n        i=i+2\n    return lst
B25DS015_q8,5,5,100.00,"<output> The issue lies in starting the loop from index 1 instead of 0, as list indices in Python start at 0, not 1. Try changing `range(1, l, 2)` to `range(0, l, 2)`. </output>","def get_odd_indices(items):\n    l = len(items)\n    res = []\n    for i in range(1,l,2):\n        res.append(items[i])\n    return res\n"
B25EE059_q8,5,5,100.00,"<output> The student's code is attempting to access elements at odd indices, but the step size in slicing (2) means it will only access every other element, starting from the second one. Try changing `items[1::2]` to `items[1::2:2]` to get elements at odd indices. </output>",def get_odd_indices(items):\n    return items[1::2]
B25DS002_q8,5,5,100.00,"<output> Check if your code correctly handles lists with even length; when the last element is at an odd index, it should be included in the result, not excluded. </output>",def get_odd_indices(items):\n    n = len(items)\n    odd_items = []                     \n    for i in range(n):\n        if i % 2!=0:              \n            odd_items.append(items[i])\n    return odd_items              \n\n
B25ME041_q8,5,5,100.00,<output> Make sure to start your loop from 1 instead of 0 to correctly access elements at odd indices. </output>,"def get_odd_indices(items):\n    l=[]\n    for i in range(0,len(items)):\n        if i%2!=0:\n            l.append(items[i])\n    return l"
B25EE034_q8,5,5,100.00,"<output> The function should start its indexing from 0, not 1, to correctly identify elements at odd indices. </output>","def get_odd_indices(items):\n    ans =[]\n    for i in range (1,len(items),2):\n        ans.append(items[i])\n    return ans\n\n# print(get_odd_indices([10,20,30,40,50])) #[20,40]\n# print(get_odd_indices([""a"",""b"",""c""])) #[""b""]"
B25MM001_Q8,0,5,0.00,"<output>Try changing the step size in the slicing operation from 2 to 1, like this: `return items[1::1]` to access elements at odd indices.</output>","def get_odd_indices(items):\n    return items[1::2]\nprint(get_odd_indices([10, 20, 30, 40, 50]))\nprint(get_odd_indices([""a"", ""b"", ""c""]))\n"
B25ME006_Q8,0,5,0.00,"<output> The issue lies in using `items.index(i)`, which has a time complexity of O(n), causing the function to become inefficient for large lists. Instead, consider using list slicing with a step value to directly access elements at odd indices. </output>","def get_odd_indices(items):\n    x=[]\n    for i in items:\n        if items.index(i)%2!=0:\n            x.append(i)\n        else:\n            continue\n    return x\nprint(get_odd_indices([10,20,30,40,50]))\nprint(get_odd_indices([""a"",""b"",""c""]))"
B25MT020_Q8,0,5,0.00,"<output> The issue lies in the step size of 2, which skips even indices and excludes odd ones; consider changing it to 1 to access every other index starting from the first one.</output>","def get_odd_indices(items):\n    return items[1::2]\n    pass\nprint(get_odd_indices([1,3,5,7,5,6]))"
B25MM030_Q8,0,5,0.00,"<output> The function should start by iterating over the list with enumerate, which allows you to access both the index and value of each element, like this: `def get_odd_indices(items):    return [items[i] for i in range(len(items)) if i % 2 != 0];</output>","def get_odd_indices(items):\n    items=items[1::2]\n    return items\n\nprint (get_odd_indices([10,20,30,40,50]))\nprint (get_odd_indices([""a"",""b"",""c""]))              \n"
B25EC022_q8,0,5,0.00,"<output>Start your list comprehension with `items[::2]` instead of `[items[i] for i in range(1, len(items), 2)] to correctly access elements at odd indices.</output>","def get_odd_indices(items):\n    return [items[i] for i in range(1, len(items), 2)]\n\nprint(get_odd_indices([10, 20, 30, 40, 50]))"
B25DS006_q8,5,5,100.00,"<output> The issue lies in the range function where it starts from index 1 instead of 0, which excludes even-indexed elements and results in an incomplete output.</output>","def get_odd_indices(items):\n    result=[]\n    for i in range(1,len(items),2):\n        result.append(items[i])\n    return result"
B25EC038_Q8,0,5,0.00,"<output> Check the function name in your code, as 'odd_indexes' does not match the expected function name 'get_odd_indices'.</output>","def odd_indexes(items):\n    odd = []\n    for i in range(len(items)):\n        if i%2 == 0:\n            odd = odd\n        else:\n            odd.append(items[i])\n    return odd\nprint(odd_indexes([10,20,30,40,50]))\nprint(odd_indexes([""a"", ""b"", ""c""]))"
B25ME049_q8,0,5,0.00,<output>Consider using slicing to extract elements at odd indices instead of appending them individually.</output>,"def get_odd_indices(items):\n    item = []\n    for i in range(len(items)):\n        if i%2 != 0:\n            item.append(items[i])\n    print(item)\nget_odd_indices([10, 20, 30, 40, 50])\nget_odd_indices([""a"", ""b"", ""c""])"
B25MT011.q8,0,5,0.00,<output> The function should be modified to handle lists with different data types and lengths by using indexing instead of appending individual elements. </output>,"def get_odd_indices(items):\n    lst=[]\n    for i in range(len(items)):\n        if i%2!=0:\n            lst.append(items[i])\n    return lst\nprint(get_odd_indices([10, 20, 30, 40, 50]) )\nprint(get_odd_indices([""a"", ""b"", ""c""]))"
B25ME028_q8,0,5,0.00,"</output> The issue with your code is that you're printing the elements instead of returning them, which means they won't be included in the output of the function. Try changing `print(items[i])` to `return items[i]`.","def get_odd_indices(items):\n    for i in range(len(items)):\n        if i%2 != 0:\n            print(items[i])\n        \n\n# Test Cases:\nprint(get_odd_indices([10, 20, 30, 40, 50]))\nprint(get_odd_indices([""a"", ""b"", ""c""])) "
B25EC035_q8,0,5,0.00,"<output> The loop should start from `1` instead of `2` to include elements at odd indices, not just those starting from `i = 2`. </output>","def get_odd_indices(n):\n    if n == []:\n        return ""Empty list""\n    else:\n        l = []\n        for i in range(2,len(n),2):\n            l.append(i)\n    return l\n\nprint(get_odd_indices([]))"
B25MT017_q8,2,5,40.00,"<output> Make sure to iterate over the indices using `range(len(list))` instead of `list`, as you're trying to access elements at odd indices, not even ones.  </output>",def get_odd_indices(list):\n    return [index for index in range(len(list)) if index % 2 != 0]
b25cs015.q8,0,5,0.00,"<output>It seems like you're trying to access every other element in the list, but you should be using `items[1::2]` instead of `items[1::]`. Try changing the code to `return items[1::2]` to get elements at odd indices.</output>",def get_odd_indices(items):\n    return items[1::2]\n
B25EC001_q8,5,5,100.00,"<output> The issue lies in the step size of 2, which is skipping every other element instead of selecting elements at odd indices (1-based indexing). Change `items[1::2]` to `items[1::2, ::2]`. </output>",def get_odd_indices(items):\n    return items[1::2]
B25ME043_q8,5,5,100.00,<output>Use `items[i]` instead of `items.index(i)` to access elements at their indices.</output>,def get_odd_indices(items) :\n    p=[]\n    for i in items :\n        if items.index(i)%2!=0 or items.index(i)==1 :\n            p.append(i)\n    return p
S25MA018_q8,0,5,0.00,<output> Ensure that you are modifying a copy of the original list instead of the original list itself by using `new_l = items[:]` before your loop. This is necessary to avoid changing the original list's indices as you're iterating over it. </output>,"def get_odd_indices(items):\n    new_l=[]\n    a=len(items)\n    for i in range(a):\n        if i%2==1:\n            new_l.append(items[i])\n    return new_l\nprint(get_odd_indices([""a"", ""b"", ""c""]))\n            "
b25me047_q8,5,5,100.00,"<output> Make sure to handle the case where the index `i` is equal to the length of the list, as this would result in an ""IndexError: list index out of range"" exception. Consider adding a condition to check if `i` is less than the length of the list before accessing `items[i]`. </output>",def get_odd_indices(items):\n    odditems = []\n    for i in range(len(items)):\n        if i % 2 != 0:\n            odditems.append(items[i])\n    return odditems\n \n 
B25MT009_Q8,5,5,100.00,"<output> The issue lies in the range starting from 1 instead of 0, which skips the first element at an odd index (the last element in the list). </output>","def get_odd_indices(items):\n    l = list()\n    for i in range(1, len(items), 2):\n        l.append(items[i])\n    return l"
B25EC045_q8,0,5,0.00,"<output> The student's code uses list comprehension to create a new list with elements at odd indices, but it does not exclude even indices as required by the problem description.</output>","def get_odd_indices(items):\n    lst = [items[i] for i in range(len(items)) if i%2==1]\n    return lst\nprint(get_odd_indices([10, 20, 30, 40, 50]))\nprint(get_odd_indices([""a"", ""b"", ""c""]))"
B25CS060_q8,5,5,100.00,<output>Check if you are correctly indexing into the original list instead of trying to convert the index itself to an integer.</output>,def get_odd_indices(items):\n    new_list=[]\n    for i in range (len(items)):\n        if i%2!=0:\n            new_list.append(items[int(i)])\n    return new_list\n\n
B25CS026_q8,0,5,0.00,<output> The issue lies in the line `if i % 2 == 0:` where you're skipping elements at even indices instead of odd ones. Change it to `if i % 2 != 0:` to get the desired output.</output>,"def get_odd_indices(items):\n    final_list = []\n    for i in range (len(items)):\n        if i%2 == 0:\n            continue\n        else:\n            final_list.append(items[i])\n    return final_list\n\nprint(get_odd_indices([10,20,30,40,50]))\nprint(get_odd_indices([""a"",""b"",""c""]))\n\n\n            "
B25EC002_q8,5,5,100.00,"<output>Notice that the student's code uses `lst.append(items[i])` to add elements to the list, which modifies the original list in-place. This might be causing unexpected behavior when returning a copy of the modified list.</output>",def get_odd_indices(items):\n    lst= []\n    for i in range(len(items)):\n        if i%2 != 0:\n            lst.append(items[i])\n    return lst\n
B25MM002_q8,5,5,100.00,"<output>Use slicing with step -1 to get elements at odd indices, i.e., `return items[::2]`. This will return every other element starting from the first one.</output>",def get_odd_indices(items):\n    return items[1::2]\n\n\n    \n\n    
B25MM015_Q8,0,5,0.00,"<output>Check if you are correctly indexing and accessing elements in the list, as using `items[i]` will return a single element instead of the entire item.</output>","def get_odd_indices(items):\n    \n    \n   result = []\n   for i in range(len(items)):\n       if i%2 ==1:\n           result.append(items[i])\n   return result\n\nprint(get_odd_indices([10,20,30,40,50]))\n"
B25DS029_q8,5,5,100.00,<output> Start by checking the step size in your slice operation; try using `items[1::2]` instead of `items[1::4]`. </output>,"def get_odd_indices(items): # To get the odd indiced items\n    """"""\n    Return elements from 'items' that are at odd indices (1,3,5,...).\n    """"""\n    return items[1::2]  # ODD indiced will be in the output list\n"
B25DS003_q8,5,5,100.00,"<output>Try changing the step size from 2 to 1, i.e., `return items[::2]`, to get elements at odd indices.</output>",def get_odd_indices(items):\n    return items[1::2]
B25CS020_q8,5,5,100.00,<output>Consider using list slicing to extract elements at odd indices instead of iterating over the entire list.</output>,def get_odd_indices(items):\n    new_list = []\n    for i in range(len(items)):\n        if i % 2 != 0:\n            new_list.append(items[i])\n            \n    return new_list\n\n\n            
B25ME057_q8,0,5,0.00,"<output> The student's code starts indexing from 1 instead of 0, which is why it misses elements at even indices (0-based indexing). </output>","def get_odd_indices(items):\n    answer=[]\n    for i in range (1,len(items)):\n        if i%2 !=0:\n            answer.append(items[i])\n    return answer\nprint(get_odd_indices([1,2,5,9,78,0,8,8,7,8,6]))"
B25EE052_q8,0,5,0.00,"<output> Start your function by iterating over the indices of the input list using enumerate to get both index and value, then check if the index is odd. If it's odd, append the corresponding element to a new list. </output>","def get_odd_indices(items):\n    new_list = items[1::2]\n    return new_list\n\nprint(get_odd_indices([10, 20, 30, 40, 50]))\n# [20, 40]\nprint(get_odd_indices([""a"", ""b"", ""c""]))\n# [""b""]\n    "
B25CS022_q8,5,5,100.00,"</output> The issue lies in the fact that list indices in Python start at 0, so the code is actually returning elements from even indices (2, 4, 6, ...), not odd ones.","def get_odd_indices(items):\n    """"""\n    Return elements from 'items' that are at odd indices (1,3,5,...).\n    """"""\n    return [items[x] for x in range(1,len(items),2)]"
B25EE020_q8,5,5,100.00,"<output> It appears you're iterating over every other element in the list, but this will skip the first element (at index 0), which is an odd index. Try changing `items[1::2]` to `items[::2]`. </output>",def get_odd_indices(items):\n    return [x for x in items[1::2]]
B25CS038-Q8,0,5,0.00,"<output> The function name in the student's code should match the problem statement, changing 'get_odd_indicate' to 'get_odd_indices'.</output>","def get_odd_indicate(s):\n    sa=s[1::2]\n    return sa\nprint(get_odd_indicate([1,2,3,3,4,8,5]))"
q8,5,5,100.00,"<output> The issue lies in the fact that you're using `append` to add elements to the result list, whereas you should be returning the elements directly from the original list at odd indices. Try changing `result.append(items[i])` to `return items[i]`. </output>",def get_odd_indices(items):\n    result = []\n    for i in range(len(items)):\n        if i % 2 == 1:\n            result.append(items[i])\n    return result\n
B25CS021_q8,5,5,100.00,"<output> The issue lies in starting the iteration from index 1 instead of 0, which means the first element at an odd index (at index 0) is being skipped. Change `range(1, len(items), 2)` to `range(0, len(items), 2)` to fix this. </output>","def get_odd_indices(items):\n    new_list=[]\n    for i in range(1,len(items),2):\n        new_list.append(items[i])\n\n    return new_list"
B25EE006.Q8,0,5,0.00,<output>It seems you are using a variable name `items` but your function definition expects an argument `item`. Try renaming the variable to match the parameter in the function.</output>,def get_odd_indices(items):\n    l=[]\n    for i in range(len(items)):\n        if i%2!=0:\n            l.append(items[i])\n    return l\n
B25MT008_q8,5,5,100.00,"<output> The student's code only accesses elements at odd indices (2n + 1), but the problem requires elements at actual odd indices (2n + 1 is always an odd index, but the list indices start from 0). The student should adjust their indexing to use `items[2 * n + 1]` instead of just `items[2 * n + 1]`. </output>",def get_odd_indices(items):\n    lst = []\n    [lst.append(items[2*n+1]) for n in range(len(items)) if 2*n+1<len(items)]\n    return lst
B25CS012_q8,5,5,100.00,"<output> Make sure to start your indexing from 1 instead of 0 by changing `for i in range(len(items)):` to `for i in range(1, len(items)+1):` to correctly identify elements at odd indices.</output>","def get_odd_indices(items):\n    """"""\n    Return elements from ’items’ that are at odd indices\n    (1,3,5,...).\n    """"""\n    l=[]\n    for i in range(len(items)):\n        if i%2!=0:\n            l.append(items[i])\n    return l\nget_odd_indices([10, 20, 30, 40, 50]) # [20, 40]\nget_odd_indices([""a"", ""b"", ""c""]) # [""b""]\n"
B25CS008_Q8,0,5,0.00,"<output>Consider adjusting the range in your list comprehension to start at 0 instead of 1, as Python uses zero-based indexing.</output>","def get_odd_indices(items):\n    return [items[x] for x in range(1,len(items),2)]\n    \nprint(get_odd_indices([1,2,3,4,5,6]))"
B25ME021_q8,0,5,0.00,"<output> The issue lies in the line `items = items[::2]`, which only takes every 2nd element, effectively removing all elements at odd indices. Consider changing this to `items = items[1::2]` to include only the elements at odd indices. </output>","#get odd indexed elements\ndef get_odd_indices(items):\n    items = items[::2]\n    return items\nprint(get_odd_indices([1,2,3,4,5,6,7,8,9,10]))\n"
B25EE017_q8,0,5,0.00,"<output>Try using `range(len(items))` instead of `range(len(items))`, as the latter is exclusive of the last index, which will result in missing elements at odd indices.</output>",def get_odd_indices(items):\n    return(items[i] for i in range(len(items)) if i % 2 != 0)\n    
B25ME031_q8,5,5,100.00,"<output> The student's code correctly identifies odd indices but fails to handle cases where there are no elements at those indices, as the list will be empty and result will also be empty. Consider adding a check for an empty list before attempting to access its elements. </output>","def get_odd_indices(items):\n    result = []\n    for i in range(len(items)):\n        if i % 2 == 1:   \n            result.append(items[i])\n    return result\nget_odd_indices([10, 20, 30, 40, 50]) # [20, 40]\nget_odd_indices([""a"", ""b"", ""c""]) # [""b""]"
B25EC044_Q8,0,5,0.00,"<output> The student's implementation is iterating over all elements, but it should only iterate over odd indices, starting from 0 and incrementing by 2. </output>","\n\ndef get_odd_indices(items):\n    a=0\n    L=[]\n    for i in items:\n        if a%2==1:\n            L.append(i)\n        a+=1\n    return L\n\nprint(get_odd_indices([10, 20, 30, 40, 50])) # [20, 40]\nprint(get_odd_indices([""a"", ""b"", ""c""])) # [""b""]\n            \n"
