student_id,tests_passed,tests_total,score_percentage,semantic_summary,code_snippet
B25EE028_q8,5,5,100.00,"<output> The issue lies in the use of `len(items)` as the upper bound for the loop, which will cause an off-by-one error when trying to access elements at odd indices, as list indices in Python start from 0. </output>",def get_odd_indices(items):\n    result_items = []\n    for i in range(len(items)):\n        if i%2 != 0:\n            result_items.append(items[i])\n    return result_items
B25MM025_q8,0,5,0.00,"<output> The issue lies in the incorrect indexing; odd indices are represented by 2*i + 1, but you're only considering even multiples of i (i.e., 0, 2, 4, ...), effectively skipping every other element. </output>","\ndef get_odd_indices(items):\n    lst=[]\n    for i in range(0,len(items)//2):\n        lst.append(items[2*i+1])\n    print(lst)\nget_odd_indices(['1','2','3','4','5'])"
B25ME010_q8,5,5,100.00,<output>Consider using list comprehension to create a new list with elements at odd indices instead of appending to an existing list.</output>,def get_odd_indices(items):\n    lis=[]\n    for i in range(len(items)):\n        if i%2!=0:\n            lis.append(items[i])\n    return lis 
{B25MM017]}_q8,0,5,0.00,"<output> You are looking for elements at odd indices, but your current implementation is designed to find the maximum value in a list, not extract specific elements. Consider modifying your function to iterate over the list with an index variable and check if the index is odd. </output>",def find_max(numbers):\n    if not numbers:\n        return None\n    maxmium=numbers[0]\n    for num in numbers:\n        if num>maximum:\n            maximum=num\n    return maximum\n
B25MT018_q8,5,5,100.00,"<output> The issue lies in the `continue` statement after an even index, which skips over elements at even indices entirely, effectively ignoring half of the list's content.</output>","def get_odd_indices(items):\n    l1=[]\n    for i in range(0,len(items)):\n        if i%2!=0:\n            l1.append(items[i])\n        else:\n            continue\n    return l1\n\n"
B25CS042_Q8,5,5,100.00,"<output> Make sure to start building your list from an index that allows you to capture elements at odd indices correctly; currently, the code starts from index 0 and only includes elements when i is odd. </output>","def get_odd_indices(items):\n    list1=[]\n    for i in range(len(items)):\n        if i%2!=0:\n            list1.append(items[i])\n    return list1\nget_odd_indices([1,2,3,4,5,6])\nget_odd_indices([""a"", ""b"", ""c""])"
B25EC041_q8,5,5,100.00,"<output> The student's code starts from index 1 instead of 0, missing elements at even indices. </output>","def get_odd_indices(items):\n    l=[]\n    for i in range(1,len(items),2):\n        l.append(items[i])\n    return l"
B25ME004_q8,0,5,0.00,<output>Consider using list slicing to extract elements at odd indices instead of manually looping over the list.</output>,"def get_odd_indices(items):\n    lst=[]#creating an empty list\n    for i in range(0,len(items)):\n        if i%2!=0:\n            lst.append(items[i])#if i is odd then it will add value of i\n    return lst\nprint(get_odd_indices([10,20,30,40,50]))\nprint(get_odd_indices([""a"",""b"",""c""]))"
B25ME002_q8,5,5,100.00,"<output>Use a step-by-step approach to iterate through the list and select elements at odd indices, ensuring that you're considering all possible cases.</output>",def get_odd_indices(items):\n    l=[items[i] for i in range(len(items)) if i%2==1]\n    return l\n
B25ME060_q8,5,5,100.00,"<output>Consider using list slicing to extract elements at odd indices, as this approach is more concise and Pythonic.</output>","def get_odd_indices(items):\n    result = []\n    for i in range(0, len(items)):\n        if i%2 != 0:\n            result.append(items[i])\n    return result\n\n"
B25ME034_q8,5,5,100.00,"<output> Check if your loop iterates over all indices of the list, including the last one when the length is even, to ensure you're capturing elements at odd indices correctly.</output>",def get_odd_indices(items):\n    length=len(items)\n    new_items=[]\n    for i in range(length):\n        if length%2==0:   #odd no elements\n            if i%2!=0:\n                new_items.append(items[i])\n    \n\n        if length%2!=0:   #even no elements\n            if i%2!=0:\n                new_items.append(items[i])\n    return(new_items)\n\n\n\n\n\n\n\n
B25EC010_q8,5,5,100.00,"<output>Try using `items[1::2]` instead of `items[::2]`, as the latter returns every even-indexed element, whereas you want to return only the elements at odd indices.</output>",def get_odd_indices(items):\n    return items[1::2]\n
B25MT004_q8,0,5,0.00,"<output> The issue lies in the line `items = items[1::2]`, where you're only skipping every other element, but the problem requires elements at odd indices, which means starting from index 0 and stepping by 2. </output>","def get_odd_indices(items):\n    items=items[1::2]\n    return items\nprint(get_odd_indices(['a','b','c']))\nprint(get_odd_indices([10,20,30,40,50]))"
B25CS059_q8,5,5,100.00,"<output> The function is currently returning every other element, not just the ones at odd indices; try changing `items[1::2]` to `items[1::2][::-1]`. </output>",def get_odd_indices(items):\n    return items[1::2]\n
B25MT006_Q8,0,5,0.00,<output>Check if you're using `append` to add elements to the list correctly and consider using slicing instead.</output>,"def get_odd_indices(items):\n    odd_indiced_list = []\n    for i in range(len(items)):\n        if i % 2 == 0:\n            pass\n        else:\n            odd_indiced_list.append(items[i])\n    return odd_indiced_list\nprint( get_odd_indices([10,20,30,40,50]))\nprint( get_odd_indices([""a"",""b"",""c""]))"
B25CS046_q8,5,5,100.00,"<output> The student's code correctly identifies odd indices but fails to exclude even indices, as indicated by the lack of runtime error; consider modifying the condition to `if i % 2 == 1` to achieve the desired result. </output>",def get_odd_indices(items):\n    k=[]\n    for i in range(len(items)):\n        if i%2!=0:\n            k.append(items[i])\n    return k        
B25MT005_q8,5,5,100.00,"<output> The issue lies in the fact that Python uses zero-based indexing, meaning the first element is at index 0, not 1. To fix this, change `items[1::2]` to `items[1::2, ::2]`, or simply use `items[::2]`. </output>","def get_odd_indices(items): # To get the odd indiced items\n    """"""\n    Return elements from 'items' that are at odd indices (1,3,5,...).\n    """"""\n    return items[1::2]  # ODD indiced will be in the output list\n"
B25EE012_q8.__1,0,5,0.00,<output> Make sure to pass a collection (like a list) as an argument to your function instead of trying to create one from it using `list(items)`. </output>,def get_odd_indices(items):\n    my_list = list(items)\n    odd_index_elements = my_list[1::2]\n    return odd_index_elements\n
B24DS035_Q8,5,5,100.00,"<output> The issue lies in the range of the list indices, as Python uses zero-based indexing, so the first element is at index 0, not 1. Change `range(1, len(items), 2)` to `range(0, len(items) - 1, 2)` to correctly access elements at odd indices. </output>","def get_odd_indices(items):\n    return [items[i] for i in range(1, len(items), 2)]\n    pass"
S25MA004_q8,0,5,0.00,"<output> The list comprehension should use `items[i]` instead of `items[1::2]`, where `i` is the odd index, to correctly access elements at odd indices.</output>","def get_odd_indices(items):\n    """"""\nReturn elements from ""items"" that are at odd indices\n(1,3,5,....)\n""""""\n    l = [items]\n    return items[1::2]\nprint(get_odd_indices([10,20,30,40,50]))\nprint(get_odd_indices([""a"",""b"",""c""]))\n    \n    "
B25EC033_q8,0,5,0.00,"<output> The issue lies in the fact that you're starting your loop from index 1 (inclusive) instead of 0 (exclusive), which means you're missing the first element at an odd index. Change `range(1, len(items))` to `range(0, len(items)-1, 2)` to fix this. </output>","def get_odd_indices(items):\n    l=[]\n    for i in range(1, len(items), 2):\n        l.append(items[i])\n    return l\nprint(get_odd_indices([10,20,30]))"
B25EC025_q8,0,5,0.00,"<output> Make sure to handle the case where `i` is 0, which would be an even index, by not appending anything to the result list. This will ensure your function returns only elements at odd indices. </output>","def get_odd_indices(items):\n    result = []\n    for i in range(len(items)):\n        if i % 2 == 1:\n            result.append(items[i])\n    return result\nprint(get_odd_indices([10,20,30,40,50]))"
B25EC043_q8,5,5,100.00,"<output> Check if your loop iterates over the indices of the list instead of its elements, and adjust the condition accordingly to access the correct elements at odd indices.</output>",def get_odd_indices(items):\n    ans_list=[]\n    for i in range (len(items)):\n        if i%2!=0:\n            ans_list.append(items[i])\n    return(ans_list)
B25EE009_q8,5,5,100.00,"<output> Consider using list slicing to extract elements at odd indices, as this approach is more concise and efficient than iterating over the entire list with a loop.</output>","def get_odd_indices(items):\n    q=[]\n    for i in range(0,len(items)):\n        if i%2!=0:\n            q.append(items[i])\n    return q\n"
B25ME019_q8,0,5,0.00,"<output> The issue lies in the fact that you're printing the elements instead of returning them, which is required by the problem statement. Change `print(items[i])` to `return items[i]`. </output>","def get_odd_indices(items):\n	for i in range(len(items)):\n		if i % 2 != 0:\n			print(items[i])\nprint(get_odd_indices([1,2,7,9,5,7,3,9,0]))"
B25MM012_Q8,5,5,100.00,"<output> The issue lies in the fact that Python list indices start at 0, not 1, so the code should use `i % 2 == 0` instead of `i % 2 == 1` to include elements at odd indices. </output>","def get_odd_indices(items):\n    """"""\n    Return elements from 'items' that are at odd indices (1, 3, 5...).\n    """"""\n    result = []\n    for i in range(len(items)):\n        if i % 2 == 1:\n            result.append(items[i])\n    return result"
B25CS062_q8,0,5,0.00,"<output>Start your code by slicing the list from index 0, not 1, to include all elements in the calculation.</output>","def get_odd_indices(items):\n    items=items[1::2]\n    return items\nprint(get_odd_indices(['a','b','c']))\nprint(get_odd_indices([10,20,30,40,50]))"
B25EE039_q8,5,5,100.00,"<output>Try accessing the elements at odd indices by using `items[2::2]` instead of `items[1::2]`, where the step size is doubled to skip every other element.</output>","def get_odd_indices(items):\n    """"""\n    Return elements from 'items' that are at odd indices (1,3,5,...).\n    """"""\n    return items[1::2]\n"
B25ME007_q8,5,5,100.00,"<output> Make sure to iterate over the indices of the list, not the items themselves, by changing `items[i]` to `items[len(items) - i - 1]`. </output>","def get_odd_indices(items):\n    items_new=[]\n    for i in range(len(items)):\n        if i%2!=0:\n            items_new.append(items[i])\n    return items_new\nget_odd_indices([10, 20, 30, 40, 50])\nget_odd_indices([""a"", ""b"", ""c""])"
B25ME011_q8,0,5,0.00,"<output> The student's code correctly identifies odd indices but fails to exclude even indices, as it appends all elements at odd indices instead of only those at actual odd positions.</output>","def get_odd_indices(items):\n    """"""\n    returning elements from 'items' that are at odd indices\n    \n    """"""\n    odd_indices_list = []\n    for i in range(len(items)):\n        if (i%2!= 0):\n           odd_indices_list.append(items[i])\n    return odd_indices_list\nprint(get_odd_indices([10,20,30,40,50]))\nprint(get_odd_indices([""a"",""b"",""c""]))"
B25EE007_q8,5,5,100.00,"<output> The issue lies in the fact that you're using `range(0, len(items))`, which generates even indices, whereas you want to consider odd indices; use `range(1, len(items), 2)` instead. </output>","def get_odd_indices(items):\n    out=[]\n    for i in range(0,len(items)):\n        if(i%2!=0):\n            out.append(items[i])\n    return out \n\n"
B25CS019_q8,5,5,100.00,<output> The student's code should be modified to start indexing from 1 instead of 0 by changing `i % 2 == 1` to `i % 2 != 0`. </output>,def get_odd_indices(items):\n    lst = [items[i] for i in range(len(items)) if i%2 == 1]\n    return lst\n
B25DS035_q8,0,5,0.00,<output>Consider using a slice to extract elements at odd indices instead of iterating over the entire list.</output>,"def get_odd_indices(items):\n    l=[]\n    for i in range(0,len(items)):\n        if i%2!=0:\n            l.append(items[i])\n        else:\n            continue\n    return l\nprint(get_odd_indices([10,20,30,40,50]))\nprint(get_odd_indices([""a"",""b"",""c""]))\n"
B25ME027_Q8,1,5,20.00,"<output> The condition `if i % 2 == 0` is selecting even indices, not odd ones; try changing it to `if i % 2 != 0`. </output>",def get_odd_indices(items):\n    L=[]\n    for i in range(len(items)):\n        if i%2==0:\n            L.append(items[i])\n    return L
B25EE012_q8.,0,5,0.00,<output> The issue lies in the way you're passing the input to your function; you should pass a sequence (like a list) instead of an item from it. </output>,def get_odd_indices(items):\n    my_list = list(items)\n    odd_index_elements = my_list[1::2]\n    return odd_index_elements\n
B25EC021_q8,5,5,100.00,"<output>Consider using a list comprehension with enumerate to access elements at specific indices, as indexing in Python starts from 0.</output>",def get_odd_indices(items):\n    return [x for x in items if items.index(x)%2!=0]\n
B25DS024_Q8,0,5,0.00,"<output> The student's code is skipping even indices instead of odd ones, as the range function starts from 1 and ends at len(items), effectively selecting every other element starting from the second one (index 1). </output>","def get_odd_indices(items):\n    return [items[i] for i in range(1, len(items), 2)]\n\nprint(get_odd_indices([10,20,30,40,50]))#[20,40]\nprint(get_odd_indices([""a"",""b"",""c""])) #[""b""]"
B25ME030_q8,0,5,0.00,"<output>Consider using list slicing to extract elements at odd indices, as it's more concise and efficient than iterating over the entire list.</output>","def get_odd_indices(n):\n    odd_indices=[]\n    for i in range(len(n)):\n        if i%2!=0:\n            odd_indices.append(n[i])\n    return odd_indices\nprint(get_odd_indices([1,2,3,4,5,6,7,8,9,10101,999999]))\nprint(get_odd_indices([10,20,30,40,50])) \nprint(get_odd_indices([""a"",""b"",""c""]))\n"
B25CS034_q8,5,5,100.00,<output>Consider modifying the range to start from 0 instead of 1 to correctly access elements at odd indices.</output>,"def get_odd_indices(items):\n    list = []\n    for i in range(1,len(items),2):\n        list.append(items[i])\n    return list\n\n"
B25ME050_q8,0,5,0.00,<output> Make sure to adjust the index calculation to correctly identify odd indices by using `i % 2 != 0` instead of `(i + 1) % 2 != 0`. </output>,"def get_odd_indices(items):\n    l = []\n    for i in range (len(items)):\n        if (i+1)%2 != 0:\n            l.append(items[i])\n    return l\nprint(get_odd_indices([10,20,30,40,50]))\nprint(get_odd_indices([""a"",""b"",""c""]))"
B25DS012_Q8,5,5,100.00,<output>Try using list comprehension to create a new list with elements at odd indices instead of appending to an existing list.</output>,def get_odd_indices(items):\n    list_ = []\n    for a in range(len(items)):\n        if a%2 != 0:\n            list_.append(items[a])\n    return list_
B25DS005_q8,5,5,100.00,"<output> Start your loop from index 0 to correctly identify odd indices, as the current implementation starts from index 1 and misses the first element at an even index (index 0). </output>","def get_odd_indices(items):\n    odd_indices_list = []\n    for i in range (1,len(items)):\n        if i % 2 != 0 :\n            odd_indices_list.append(items[i])\n            \n    return odd_indices_list\n\n"
B25DS033_Q8,0,5,0.00,"<output> The code is attempting to access every other element in the list, but since it starts from index 1 and skips even indices, it will skip elements at odd indices. Consider starting from an index of 0 or using slicing with a step size of -2 to achieve this. </output>","def get_odd_indices(items):\n    items=items[1::2]\n    return items\n\nprint (get_odd_indices([10,20,30,40,50]))\nprint (get_odd_indices([""a"",""b"",""c""]))              \n\n"
B25EC009_q8,5,5,100.00,<output>Check if you're correctly handling the indices when appending elements to the lists 's' and 'l'.</output>,"def get_odd_indices(items):\n    s = []\n    l = []\n    if len(items)%2==0:\n        for i in range(1,len(items),2):\n            l.append(items[i])\n        return l\n    else:    \n        for i in range(1,len(items)-1,2):\n            s.append(items[i])        \n        return s\n        \n        "
B25MTO23 Q 8,0,5,0.00,"<output> The student's code is starting from index 1 instead of 0, so the slice should be `items[::2]` to get elements at odd indices.</output>","def get_odd_indices(items):\n    result = items[1:len(items):2]\n    return result\nprint(get_odd_indices([10, 20, 30, 40, 50])) \nprint(get_odd_indices([""a"", ""b"", ""c""]))"
B25EE019_q8,1,5,20.00,"<output> The issue lies in the slicing step, where you're using `items[::2]`, which returns every other element starting from the first one. Instead, you should use `items[1::2]` to start from the second element and return every other one. </output>",def get_odd_indices(items):\n\n    return items[::2]
B25DS008_q8,0,5,0.00,<output>Check if you are using the `append` method correctly to add elements to your list `l`. Consider using a more Pythonic approach with list comprehension instead.</output>,"def get_odd_indices(items):\n    l=[]\n    for i in range(len(items)):\n        if i%2!=0:\n            l.append(items[i])\n    return l\nprint(get_odd_indices([10, 20, 30, 40, 50]))\nprint(get_odd_indices([""a"", ""b"", ""c""]))"
B25EE021_q8,0,5,0.00,"<output>Consider using enumerate to get both index and value of each item, as the current implementation relies on the index being available after the list has been iterated over.</output>","def get_odd_indices(items):\n    return [i for i in items if items.index(i)%2==1]\n\n\nprint(get_odd_indices([""a"", ""b"", ""c""]))"
B25MM027_q8,0,5,0.00,"<output> The student's code correctly identifies and appends elements at odd indices, but it does not handle the case where the input list has an even number of elements, as the last element will be missed. Consider adding a conditional statement to include the middle element if the length of the list is odd. </output>","def get_odd_indices(items):\n    new_lis=[]\n    for i in range(len(items)):\n        if i%2!=0:\n            new_lis.append(items[i])\n    return new_lis\nprint(get_odd_indices([1,2,3,4,5,6,77,8]))\n                "
B25MT001_Q8,0,5,0.00,"<output>Consider modifying your function to start indexing from 1 instead of 0, as Python list indices are 0-based.</output>","def get_odd_indices(items):\n    output = []\n    for i in range(len(items)):\n       if i % 2 != 0:\n           output.append(items[i]) \n    return output\nprint(get_odd_indices([1,2,45,6,7,8]))"
B25ME045_q8,0,5,0.00,"<output> Make sure that the function 'get_odd_indices' actually exists in your code before trying to call it, as its presence seems to be required for this problem but is not defined anywhere in your provided code snippet.</output>",def median(numbers):\n    if numbers==[] :\n        return None\n    n=len(numbers)\n    if n%2==0 :\n        median=(numbers[(n//2)]+numbers[(n//2)-1])/2\n    elif n%2 !=0 :\n        median=numbers[(n-1)//2]\n    return median\n     \n     \n     \n     \n
B25ME029_q8,5,5,100.00,"<output>Use `items[i]` instead of just `items`, as indexing in Python starts at 0.</output>","def get_odd_indices(items):\n    lst = []\n    for i in range(1,len(items),2):\n        if i % 2 != 0:\n            lst.append(items[i])\n    return lst\n\n"
B25EE024_q8.py,0,5,0.00,"<output>Check if you are using a list comprehension instead of a traditional for loop, which can lead to incorrect indexing.</output>",def get_odd_indices(items):\n    h=[]\n    for k in range(len(items)):\n        if k%2!=0:\n            h.append(items[k])\n            \n    return h\n
B25DS017_q8,0,5,0.00,"<output> Ensure that you are modifying the original list by using indices instead of values when accessing and appending to it, as in `new_items.append(items[i])` should be replaced with `new_items.append(items[2*i+1])` to get elements at odd indices. </output>","def get_odd_indices(items):\n    new_items=[]\n    for i in range(0,len(items)):\n        if i%2!=0:\n            new_items.append(items[i])\n    return new_items\nprint(get_odd_indices([10,20,30,40,50]))\nprint(get_odd_indices([""a"",""b"",""c""]))\n    "
B25DS037_Q8.py,0,5,0.00,"<output> Make sure to return the list instead of printing it, as the function's purpose is to return elements at odd indices, not just print them. </output>","def get_odd_indices(items):\n    list = []\n    for i in range (len(items)):\n        if i%2 !=0:\n            list.append(items[i])\n    print(list)\n\nprint(get_odd_indices([10,20,30,40,50]))\nprint(get_odd_indices([""a"",""b"",""c""]))\n            "
S25MA008 Q8,0,5,0.00,<output>Consider using slicing to extract elements at odd indices instead of manually iterating over the list.</output>,"def get_odd_indices(items):\n    a=[]\n    n=len(items)\n    for i in range(n):\n        if i%2!=0:\n            a.append(items[i])\n    print(a)\nget_odd_indices([10,20,30,40,50])\nget_odd_indices([""a"",""b"",""c""])"
B25MM026_q8,0,5,0.00,"<output> Make sure to modify the line `list = []` to `result = []`, as you're trying to return a list (`return list`) but initializing it with an empty string (`list = []`). This will ensure that the function returns a list of elements at odd indices instead of modifying the original input list. </output>","def get_odd_indices(items):\n    list=[]\n    for i in range(0,len(items)):\n        if i%2==1:\n            list.append(items[i])            \n    return list\n#one example        \nprint(get_odd_indices([10,20,30,40,50])) #output [20,40]"
B25CS032_q8,5,5,100.00,"<output> Make sure to start your loop from 1 instead of 0 to get elements at odd indices, as Python uses zero-based indexing. </output>","def get_odd_indices(items):\n    l=[]\n    for i in range(0,len(items)):\n        if i%2!=0:\n            l.append(items[i])\n    return(l)"
B25DS038_q8,5,5,100.00,"<output>Try using `items[1::2, ::2]` instead of `items[1::2]`, which will return elements at both odd and even indices.</output>",def get_odd_indices(items):\n    return items[1::2]\n
B25DS026.q8,0,5,0.00,"<output>Try using `items[1::2]` instead of `items[1::2]`, since you are missing the colon (:) after the slice notation.</output>","def get_odd_indices(items):\n    return items[1::2]\nprint(get_odd_indices([10,20,30,40,50]))\nprint(get_odd_indices([""a"",""b"",""c""]))"
B25ME003_q8,0,5,0.00,"<output>Check if you're correctly using `append` to add elements to the list, as the issue might be with how you're populating it instead of appending.</output>","def get_odd_indices(items):\n    list=[]\n    for i in range(0,len(items)):\n        if i%2==1:\n            list.append(items[i])            \n    return list\n#one example        \nprint(get_odd_indices([10,20,30,40,50])) #output [20,40]"
B25CS037_q8,5,5,100.00,"<output> The issue lies in the fact that your function starts indexing from 1, but list indices in Python start at 0, so you should change `range(1, len(items), 2)` to `range(0, len(items) - 1, 2)` to correctly access elements at odd indices. </output>","def get_odd_indices(items):\n    return [items[i] for i in range(1, len(items), 2)]"
B25EE031_q8,0,5,0.00,<output> Make sure to access elements by their index using square brackets `[]` instead of dot notation `.` when indexing lists in Python. </output>,"def get_odd_indices(items):\n    Mylist=[]\n    for i in range(len(items)):\n        if i%2!=0:\n            Mylist.append(items[i])\n    return(Mylist)\nprint(get_odd_indices([10, 20, 30, 40, 50]))\nprint(get_odd_indices([""a"", ""b"", ""c""]))"
B25EE015_Q8,0,5,0.00,"<output> The issue lies in the line `l.append(n[i])`, where you're attempting to access a list element using its index, but lists are 0-indexed. This means that when `i` is even (e.g., 2, 4), it will be out of range for the list. </output>","def get_odd_indices(n):\n    l=[]\n    for i in range (0,len(n)):\n        if i%2==1:\n            l.append(n[i])\n    return l\nprint(get_odd_indices([1,2,3,4,5]))\nprint(get_odd_indices(['a','b','c']))"
B25CS010_q8,5,5,100.00,"<output> The issue lies in the fact that Python uses zero-based indexing, meaning the first element is at index 0, not 1. Therefore, the condition `i % 2 != 0` will skip the first element. </output>","def get_odd_indices(items):\n    """"""\n    Return elements from ’items’ that are at odd indices\n    (1,3,5,...).\n    """"""\n    return [items[i] for i in range(len(items)) if i % 2 != 0]\n"
B25EC011_Q8,5,5,100.00,"<output> Start by examining the index used when accessing elements in the list; it should be odd numbers (1, 3, 5, etc.) rather than even numbers (2, 4, 6, etc.), as the problem requires elements at ""odd indices"". </output>","def get_odd_indices(items):\n    """"""\n    Return elements from 'items' that are at odd indices (1,3,5,...).\n    """"""\n    return items[1::2]\n"
