student_id,tests_passed,tests_total,score_percentage,semantic_summary,code_snippet
B25MM020_q8,0,5,0.00,"<output> The issue lies in the fact that your function is returning an empty list when the input list has only one element, because `len(items)` equals 1 and `i` will never be even. Instead of using `range(len(items))`, consider using `enumerate` to get both index and value. </output>","a = eval(input(""Enter a list : ""))\n\ndef get_odd_indices(items):\n    return [items[i] for i in range (len(items)) if i%2!=0]\n\nprint(get_odd_indices(a))        \n"
B25DS034_q8,5,5,100.00,"<output>Check if you're returning all elements at odd indices, not just the first one.</output>",\ndef get_odd_indices(items):\n    \n    odd = []\n    for i in range(len(items)):\n        if i % 2 == 1:\n            odd.append(items[i])\n    return odd\n\n
B25EC018_q8,0,5,0.00,"<output>Consider using enumerate() to iterate over both index and value simultaneously, which can simplify the condition in your if statement.</output>","def get_odd_indices(items):\n    """"""\n    Return elements from ’items’ that are at odd indices\n    (1,3,5,...).\n    """"""\n    k=[]\n    for i in range(len(items)):\n        if i%2!=0:\n            k.append(items[i])\n    return k\n        \n        \nprint(get_odd_indices([10,20,30,40,50])) # [20, 40]\nprint(get_odd_indices([""a"", ""b"", ""c""])) # [""b""]"
B25EE057_q8,0,5,0.00,"<output> The issue lies in the fact that you're using `p[r]` to access elements, which assumes that indices are 0-based. However, in Python, list indices start at 1 when iterating over a range of numbers starting from 1. </output>","def get_odd_indices(p):\n    q=[]\n    for r in range(1,len(p)):\n        if r%2!=0:\n            q.append(p[r])\n    return q\nprint( get_odd_indices([10,20,30,40,50]))    \nprint(get_odd_indices([""a"",""b"",""c""]))    \n    "
B25DS039_Q8,5,5,100.00,<output>Start your loop from index 0 instead of 1 to include elements at odd indices.</output>,"def get_odd_indices(items):\n    l=[]\n    for i in range(1,len(items),2):\n        l.append(items[i])\n    return l\n"
B25CS002_q8,5,5,100.00,<output> The student's code only considers even indices and ignores odd ones; it should start the range from 0 to include all indices.</output>,"def get_odd_indices(items):\n    new=[]\n    for i in range(1,len(items),2):\n        new.append(items[i])\n    return new"
B25ME023 q8,5,5,100.00,"<output> The function should start from index 1 instead of 0, because the problem requires elements at odd indices, not even ones. </output>",def get_odd_indices(items):\n    return items[1::2]\n
B25MT030_Q8,5,5,100.00,"</output> The issue lies in the fact that the function is only returning elements at even indices, not odd ones, as indicated by the slice `items[1::2]`.",def get_odd_indices(items):\n    x=items[1::2]\n    return x
B25ME026_q8,5,5,100.00,<output>Use `items[i]` instead of `items.index(i)` to access elements at odd indices.</output>,def get_odd_indices(items):\n    new_list = []\n    l = len(items)\n    for i in items:\n        if items.index(i)%2!=0:\n            new_list.append(i)\n        else:\n            continue\n    return new_list\n\n
B25MT010_q8,0,5,0.00,"<output> The student's code is correctly identifying elements at odd indices, but it's not considering the case where the input list has only one element. The method should handle this edge case to ensure it works as expected for all possible inputs.</output>","def get_odd_indices(items):\n    perm=[]\n    for i in range(len(items)):\n        if i%2!=0:\n            perm.append(items[i])\n    return(perm)        \nprint(get_odd_indices(['a','b','c']))\n    "
B25MT024_q8,5,5,100.00,"<output>Consider using enumerate() to iterate over both index and value simultaneously, which can simplify the condition `if i % 2 == 1` to just `i % 2`, as Python's indexing starts at 0.</output>",def get_odd_indices(items):\n    odd_indices=[]\n    for i in range(len(items)):\n        if i%2==1:\n            odd_indices.append(items[i])\n    return odd_indices\n\n
B25EC017_q8,5,5,100.00,"<output> The issue lies in the starting index of your loop, which should be 0 to include elements at odd indices. Change `range(1, len(items), 2)` to `range(0, len(items), 2)`. </output>","def get_odd_indices(items):\n    l=[]\n    for i in range (1,len(items),2):\n        l.append(items[i])\n    return l\n\n        "
B25ME052_q8,0,5,0.00,"<output> The function name in the code snippet should match the problem statement, changing 'get_odd_indicates' to 'get_odd_indices'. </output>",def get_odd_indicates(items):\n    \n    return items[1::2]
B25CS051_q8,0,5,0.00,"<output>Check if you're using the correct indexing method in Python; the issue might be with `items[i]` instead of `items[len(items) - i - 1]`, which would return elements at odd indices.</output>","def get_odd_indices(items):\n    new_lst=[]\n    for i in range(len(items)):\n        if i%2!=0:\n            new_lst.append(items[i])\n            \n    return new_lst\n\nprint(get_odd_indices([""a"",""b"",""c""]))\n            "
B25ME046_q8,0,5,0.00,"<output> The issue lies in the fact that you are using `range(len(items))` which generates indices from 0 to `len(items) - 1`, but your problem requires elements at odd indices only, starting from index 1. </output>","def get_odd_indices(items):\n    odd_indices=[]\n    for i in  range(len(items)):\n        if i%2!=0:\n            odd_indices.append(items[i])\n    return odd_indices\nprint(get_odd_indices([10,20,30,40,50])) #[20,40]\nprint(get_odd_indices([""a"",""b"",""c""])) #[""b""]"
B25ME051_q8,0,5,0.00,"<output> The function should be modified to return only elements at odd indices using `result.append(items[i])` instead of `result = []`, and the initial assignment of an empty list should be removed, as it is not necessary. </output>","def get_odd_indices(items):\n    result = []\n    for i in range(len(items)):\n        if i % 2 == 1:\n            result.append(items[i])\n    return result\n\nprint(get_odd_indices([10, 20, 30, 40, 50]))\nprint(get_odd_indices([""a"", ""b"", ""c""]))"
B25EC004_Q8,2,5,40.00,"<output> The issue lies in the indexing pattern; instead of using `1::2`, consider using `::2` to start from the first element and step by 2, effectively selecting elements at odd indices. </output>",def get_odd_indices(*items):\n    return items[1::2]\n\n        
B25DS014_q8,5,5,100.00,<output>Start your loop from index 0 to include elements at odd indices.</output>,"def get_odd_indices(items):\n    l=[]\n    for i in range(1,len(items),2):\n        a=items[i]\n        l.append(a)\n    return l"
S25MA001__q8,0,5,0.00,"<output>Try changing the step size from 2 to 1 in the slicing operation, i.e., `items[1::1]`, to access elements at odd indices.</output>","def get_odd_indices(items):\n    return items[1::2]\n\ns1 = [1,2,3,4,5,7,87,8,9,0,9,7,6]\nr1 = get_odd_indices(s1)\nprint(r1)\n"
B25CS005_q8,0,5,0.00,"<output>Use function arguments instead of input() and avoid using the variable 'a' as the list index, since you're treating it like a dictionary.</output>","def get_odd_indices():\n    a=list(input(""enter input: ""))\n    b=[]\n    for i in range(len(a)):\n        while 2*i-1 <= len(a):\n            b.append(a[2*i-1])\n    print(b)\nget_odd_indices()"
B25MT025_q8,5,5,100.00,"<output>Start your code by iterating over the indices of the input list using `range(len(items))` instead of just `[1::2]`, which skips the first element and only considers every other index thereafter.</output>",def get_odd_indices(items):\n    items=[i for i in items[1::2]]\n    return items
B25DS010_q8,0,5,0.00,<output> The student's code should return a new list containing elements at odd indices without modifying the original list; consider using slicing to achieve this instead of appending to a separate list. </output>,"def get_odd_indicies(items):\n    odd_indicies=[]\n    for i in range(len(items)):\n        if i%2!=0:\n            odd_indicies.append(items[i])\n        else:\n            pass\n    return odd_indicies\nprint(get_odd_indicies([10,20,30,40,50]))\n    \n \n"
B25CS014_q8,0,5,0.00,"<output>Try changing the step size from 2 to 1 in the slice notation, e.g., `return items[1::1]`, to access elements at odd indices.</output>","def get_odd_indices(items):\n    return items[1::2]\nprint(get_odd_indices([1,2,3,4,7,6,5,7]))"
B25MT032_q8,5,5,100.00,"<output> The student's code snippet should start by iterating over the range of indices from 1 to the length of the input list, not from 0. This is because Python uses zero-based indexing, but the problem requires elements at odd indices. </output>","def get_odd_indices(items):\n    list1 = [items[i] for i in range(len(items)) if i%2!=0]\n    return list1\n\n#print(get_odd_indices([""a"", ""b"", ""c""]))\n    "
B25DS020_Q8,5,5,100.00,"<output> Ensure that you are modifying the original input list by using methods like `append()` or `extend()`, but in your code, you're creating a new empty list (`alist = []`) and appending elements to it. Instead, try using `items[i]` directly inside the loop. </output>",def get_odd_indices(items:list):\n    alist=[]\n    for i in range(len(items)):\n        if i%2!=0:\n            alist.append(items[i])       \n    return alist\n\n    
B25EE026_q8,5,5,100.00,"<output>Consider using list slicing to extract elements at odd indices, as it is more concise and efficient than iterating over the entire list.</output>",#Returnelementsfrom’items’thatareatoddindices\ndef get_odd_indices(items):\n    a=[]\n    for i in range(len(items)):\n        if i%2==1:\n            a.append(items[i])\n    return a
B25DS019_q8,5,5,100.00,<output>Consider using list slicing instead of iterating over the list's indices to access elements at odd positions.</output>,def get_odd_indices(items):\n    new_one=[]\n    for i in range(len(items)):\n        if i%2!=0:\n            new_one.append(items[i])\n    return new_one
B25EC008_q8,5,5,100.00,<output> The student's code correctly identifies odd indices but does not account for zero-based indexing; it should start from `i = 1` instead of `i = 0`. </output>,def get_odd_indices(items):\n    new_list=[]\n    for i in range(len(items)):\n        if(i%2!=0):\n            new_list.append(items[i])\n    return new_list\n\n\n            
B25EE004_q8,5,5,100.00,<output> You are currently appending elements at even indices instead of odd indices; try changing `i += 2` to `i += 1`. </output>,def get_odd_indices(items):\n    l=len(items)\n    i=1\n    lst=[]\n    while (i<l):\n        lst.append(items[i])\n        i+=2\n    return lst\n\n        \n        
B25DS011_q8,0,5,0.00,"<output> The student's code should start from the beginning of the list (`items[0]`) instead of the end (`items[r]`), since it's designed to return elements at odd indices.</output>","def get_odd_indices(items):\n    l = []\n    for r in range(len(items)) :\n        if r % 2 !=0:\n            l.append(items[r])\n\n    return l\n        \nprint( get_odd_indices([10,20,30,40,50]))\nprint(get_odd_indices([""a"",""b"",""c""]))\n\n        "
B25MM016_Q8,0,5,0.00,<output>Check if you are using `append` instead of slicing to extract elements at odd indices.</output>,"def odd_items(l):\n    odds=[]\n\n    for i in range(0,len(l)):\n        if i%2!=0:\n            odds.append(l[i])\n    return odds\nprint(odd_items([10,20,30,40,50]))\nprint(odd_items([""a"",""b"",""c""]))"
B25CS045_Q8,0,5,0.00,<output>Consider using list slicing instead of iterating over the entire list to get elements at odd indices.</output>,"def get_odd_indices(items):\n    odd_placed=[]\n    for i in range(len(items)):\n        if i%2!=0:\n            odd_placed.append(items[i])\n    print(odd_placed)\nget_odd_indices([10,20,30,40,50])"
B25EE013_q8,5,5,100.00,"<output> The student should check that they are appending elements to a new list (`l`) instead of modifying the original `items` list, as the function is supposed to return a new list containing elements at odd indices. </output>",""""""" Return elements from ’items’ that are at odd indices (1,3,5,...)\nget_odd_indices([10, 20, 30, 40, 50]) # [20, 40]\nget_odd_indices([""a"", ""b"", ""c""]) # [""b""]  """"""\n\ndef get_odd_indices(items):\n    l=[]\n    for i in range(len(items)):\n        if float(i%2)==0:\n            continue\n        else:\n            l.append(items[i])\n    return l\n"
B25ME056_q8,5,5,100.00,"<output>Try accessing elements at indices 1, 3, and 5 instead of using the slice notation [1::2], which starts from index 1 but skips every second element.</output>","def get_odd_indices(items):\n    """"""\n    Return elements from 'items' that are at odd indices (1, 3, 5, ...).\n    """"""\n    return items[1::2]\n"
B25DS036_q8,5,5,100.00,"<output> The function should start from the first element (index 0) instead of skipping the first one, so change `items[1::2]` to `items[::2]`. </output>",def get_odd_indices(items):\n    return items[1::2]\n
B25EE058_q8,5,5,100.00,<output> The issue lies in the line `if i % 2 == 0:` where you're skipping even indices instead of selecting odd ones; change it to `else: lst.append(items[i])` to include only odd indices. </output>,def get_odd_indices(items):\n    lst=[]\n    for i in range(len(items)):\n        if i%2==0:\n            continue\n        else:\n            lst.append(items[i])\n    return lst\n
B25EC024_q8,5,5,100.00,"<output> The issue lies in the line `new_lst = items[1:n - 1:2]`, where you're excluding the last element at an odd index. Change it to `new_lst = items[1:n:2]` to include all elements at odd indices. </output>","def get_odd_indices(items):\n    n = len(items)\n    if n % 2 == 0:\n       new_lst = items[1:n:2]\n       return new_lst\n    else:\n        new_lst = items[1:n-1:2]\n        return new_lst\nget_odd_indices([10,20,30,40,50])\nget_odd_indices([""a"",""b"",""c""])    "
B25CS047_q8,0,5,0.00,"<output>The issue lies in the range of the for loop, which starts at 1 and increments by 2, effectively skipping even indices.</output>","def get_odd_indices(items):\n    t=()\n    for i in range(1,len(items),2):\n        t+=i,\n    return t\nprint(get_odd_indices([1,2,3,4,5,6,7,8,9,10]))"
B25DS041_q8,0,5,0.00,"<output>Consider using list slicing to extract elements at odd indices, as it is more concise and efficient than iterating over the entire list.</output>","def get_odd_indices(items):\n    \n    output = []\n    \n    for i in range(len(items)):\n        \n        if i % 2 == 1:\n            \n            output.append(items[i])\n            \n    return output\n\nprint(get_odd_indices([10, 20, 30, 40, 50]))\nprint(get_odd_indices([""a"", ""b"", ""c""]))"
B25CS016_q8,5,5,100.00,"<output>Consider modifying your function to start indexing from 0 instead of 1, as Python's list indices are 0-based.</output>","def get_odd_indices(items):\n    """"""\n    Return elements from 'items' that are at odd indices\n    (1,3,5,...). \n    """"""\n    l = []\n    for i in range(len(items)):\n        if i%2 != 0:\n            l.append(items[i])\n\n    return l"
B25CS055_q8,5,5,100.00,"<output> In the function `get_odd_indices`, you're using step size 2 (`1::2`), which means it returns every other element. To get elements at odd indices, you should use a step size of 2 starting from index 0: `items[::2]`. This way, you'll correctly access elements at indices 1, 3, 5, etc. </output>","def get_odd_indices(items):\n    """"""\n    Return elements from 'items' that are at odd indices\n    (1,3,5,...).\n    """"""\n    return items[1::2]"
B25EE048_q8,5,5,100.00,"<output>Consider adjusting the range to start from 0 instead of 1, as Python uses zero-based indexing.</output>","def get_odd_indices(items):\n    ans=[]\n    for i in range(1,len(items),2):\n        ans.append(items[i])\n    return ans    "
B25EE049_q8,5,5,100.00,"<output> The issue with your code is that the range function starts from 1, so it will skip the first element at even indices, but you want to return elements at odd indices. Change the range to start from 0. </output>","def get_odd_indices(items):\n    \n    return [items[i] for i in range(1, len(items), 2)]\n "
B25EC012_q8,5,5,100.00,"<output> The issue lies in the range starting from 1 instead of 0, which skips the first element at an even index and leads to missing elements at odd indices. </output>","def get_odd_indices(items):\n    return [items[i] for i in range(1, len(items), 2)]\n\n"
B25ME032_q8,0,5,0.00,"<output> In your code, you are using `nlst.append(items[i])` to add elements to the list. However, when working with lists in Python, it's more efficient and idiomatic to use `append()` method directly on the list, rather than assigning a value to an element of the list. </output>",def get_odd_indices(items):\n    nlst=[]\n    n=len(items)\n    for i in range n:\n        if i%2==1:\n            nlst.append(items[i])\n            \n    return nlst
B25ME005_q8,5,5,100.00,<output> Start by checking if you're correctly indexing into the list using its zero-based indices instead of one-based indices.</output>,def get_odd_indices(items):\n        wanted = []\n        i = 1\n        while i<len(items):\n            wanted.append(items[i])\n            i = i + 2\n        return wanted\n        \n            \n\n    
B25MM008_Q8,0,5,0.00,"<output> The issue lies in the line `items = items[1::2]`, which starts indexing from 1 instead of 0, resulting in missing even-indexed elements. Try changing it to `items = items[::2]` to access elements at odd indices. </output>","def get_odd_indices(items):\n    items=items[1::2]\n    return items\n\nprint (get_odd_indices([10,20,30,40,50]))\nprint (get_odd_indices([""a"",""b"",""c""]))              "
(B25DS042)_Q8,0,5,0.00,"<output> Start your function by using `enumerate` to get both index and value from each item in the list. Then, iterate over the indices that are at odd positions (i.e., `i % 2 != 0`) and append the corresponding values to your result list. </output>","'''question no. 8 '''\ndef get_odd_indices(items):\n    items=list(items)\n    y=[]\n    for i in range(1,len(items),2):\n        y.append(items[i])\n\n    return y\n\nprint(get_odd_indices([10, 20, 30, 40, 50]))"
B25DS025_q8,5,5,100.00,"<output> The issue lies in using `items.index(i)` to check if the index is odd, as this returns the first occurrence of the item in the list, not its original index. Instead, use `enumerate` to get both the index and value of each item. </output>","def get_odd_indices(items):\n    """"""\n    Return elements from 'items' that are at odd indices\n    (1,3,5,...).\n    """"""\n    a=[]\n    for i in items:\n        if items.index(i) % 2 == 1: # if index is odd, then append the element to list 'a'.\n            a.append(i)\n    return a"
B25EC015_q8,5,5,100.00,"<output> Consider using list slicing to extract elements at odd indices, as it is more concise and efficient than iterating over the entire list. </output>",def get_odd_indices(n):\n    s=[]\n    for i in range(len(n)):\n        if i%2!=0:\n            s.append(n[i])\n    return(s)\n\n\n
B25EE018_Q8,5,5,100.00,"<output> The function should start the range from 0 instead of 1 to include elements at odd indices, as Python uses zero-based indexing. </output>","def get_odd_indices(items):\n    return [items[i] for i in range(1, len(items), 2)]\n\n# test cases\nif __name__ == ""__main__"":\n    print(get_odd_indices([10, 20, 30, 40, 50]))"
B25DS028_q8,5,5,100.00,"<output> The student's code is attempting to access every other element in the list, but it should only return elements at odd indices (1-based indexing), which means it should start from index 0 and step by 2. The corrected line should be `return items[::2]`. </output>",def get_odd_indices(items):\n    return items[1::2]\n
B25MM004_q8,5,5,100.00,<output> The issue lies in using `append` to modify the input list while iterating over it; consider creating a copy of the original list instead. </output>,def get_odd_indices(items):\n    m=len(items)\n    output=[]\n    for i in range(m):\n        if(i%2!=0):\n            output.append(items[i])\n    return output\n\n\n\n        \n        \n        
B25DS004_q8,5,5,100.00,"<output>Instead of using `append`, consider using slicing to extract elements at odd indices.</output>",def get_odd_indices(items):\n    lis = []\n    count = 1\n    while count < len(items):\n        lis.append(items[count])\n        count += 2\n    return lis\n    \n
B25DS021_q8,5,5,100.00,"<output> The student's code starts from index 1 instead of 0, which means it will miss the first element of the list and only consider every other element starting from the second one.</output>",def get_odd_indices(items):\n    new_items = []\n    i = 1\n    while i < len(items):\n        new_items.append(items[i])\n        i = i + 2\n    return new_items\n
B25MT002_q8,5,5,100.00,"<output>Consider using list comprehension instead of a for loop to create the new list, as it can simplify the indexing logic and eliminate potential off-by-one errors.</output>","def get_odd_indices(items):\n    """"""\n    Return elements from ’items’ that are at odd indices\n    (1,3,5,...)""""""\n    \n    lst=[]\n    for p in range(len(items)):\n        if p%2==1:\n            lst.append(items[p])\n            \n        \n    return lst\n        \n"
B25EE016_q8,0,5,0.00,<output>Check if you're using the correct method to access elements in a list by index; try `items[k]` instead of just `k`.</output>,"def get_odd_indices(items):\n    new_lst=[]\n    for k in range(len(items)):\n        if k%2!=0:\n            new_lst.append(items[k])\n            \n    return new_lst\n\nprint(get_odd_indices([""a"",""b"",""c""]))\n            \n"
B25MMO14_q8,0,5,0.00,"<output>The student's code is not correctly handling the variable 'n' and its impact on the loop condition, leading to an incorrect string length check.</output>","n=int(input('please enter any positive number'))\ndef construct_number():\n    for k in range (1,10**n):\n        if k%3==0:\n            if k%9!=0:\n                a=str(k)\n                if len(a)==n:\n                    break\n    print(k)\nconstruct_number()"
B25EC031_q8,5,5,100.00,"<output>Consider using enumerate to iterate over both index and value of each item in the list, which would allow you to check if the index is odd without manually calculating it.</output>","def get_odd_indices(items):\n    """"""\n    Return elements from ’items’ that are at odd indices (1,3,5,...).\n    """"""\n    output = []\n    for i in range(len(items)):\n        if i % 2 != 0:\n            output.append(items[i])\n    return output"
B25ME059_q8,5,5,100.00,"<output> Make sure to use `append` method instead of assigning directly to `list1`. For example, `list1.append(items[i])` should be used instead of `list1 = items[i]`. </output>",def get_odd_indices(items):\n    list1=[]\n    for i in range(len(items)):\n        if(i%2!=0):\n            list1.append(items[i])\n    return list1
B25DS023_q8,5,5,100.00,<output> The issue lies in the starting index of the range; it should be 0 to include all odd indices.</output>,"def get_odd_indices(items):\n    odditems = []\n    for i in range(1,len(items),2):\n        odditems.append(items[i])\n    return odditems\n"
B25CS023_Q8,5,5,100.00,<output>Consider using list slicing to extract elements at odd indices instead of manually iterating over the list.</output>,"def get_odd_indices(items):\n    """"""\n    Return elements from ’items’ that are at odd indices\n    (1,3,5,...).\n    """"""\n    a=[]\n    for i in range(len(items)):\n        if i%2!=0:\n            a.append(items[i])\n    return a\n"
B25EC037_q8,5,5,100.00,"<output>Start by checking if your loop should be iterating over indices from 0 to n-1 instead of 1 to n, as Python list indexing starts at 0.</output>","def get_odd_indices(items):\n    req=[]\n    if len(items)%2==1:\n        n=len(items)-1\n    else: \n        n=len(items)\n    for i in range(1,n,2):\n        req.append(items[i])\n    return req\n"
B25EE011_q8,0,5,0.00,"<output>Consider using enumerate to get both index and value of each item in the list, which would simplify your code and avoid potential issues with indexing.</output>","def get_odd_indices(items):\n    return [x for x in items if items.index(x)%2!=0]\n\nprint(get_odd_indices([10, 20, 30, 40, 50]))\nprint(get_odd_indices([""a"", ""b"", ""c""]))"
B25MM013_q8,0,5,0.00,<output> Make sure to handle the case when `i` equals 0 separately since it's an even index and you're trying to include elements at odd indices in your new list.</output>,"def get_odd_indices(items):\n    new_list=[]\n    for i in range(len(items)):\n        if(i%2!=0):\n            new_list.append(items[i])\n    return new_list\n\nprint(get_odd_indices([10,20,30,40,50]))\nprint(get_odd_indices([""a"",""b"",""c""]))\n"
B25EE003_q8,5,5,100.00,"<output> The issue lies in the starting index of 1, which skips the first element at an even index (0). Try changing `range(1, len(items), 2)` to `range(0, len(items) - 1, 2)` to include all elements. </output>","##q8\ndef get_odd_indices(items):\n    return [items[i] for i in range(1, len(items), 2)]\n"
B25EE030-q8,0,5,0.00,"<output> The issue lies in the step size of 2, which skips every other index instead of selecting only the odd indices. Change `1::2` to `::2` to achieve this.</output>","def get_odd_indices(items):\n    return items[1::2]\n\nprint(get_odd_indices([10,20,30,40,50]))\nprint(get_odd_indices([""a"", ""b"", ""c""]))\n\n\n"
