student_id,tests_passed,tests_total,score_percentage,semantic_summary,code_snippet
B25EE042_q8,0,10,0.00,"<output>Consider using the built-in `sorted()` function in combination with list slicing (e.g., `numbers[len(numbers) // 2]` for odd lengths and `(numbers[len(numbers)] + numbers[len(numbers) - 1]) / 2` for even lengths), as your current implementation modifies the original list while iterating over it, which can lead to incorrect results.</output>","def median(numbers):\n    """"""\n    Return the statistical median of the list 'numbers'. If the\n    list is empty, return\n    None. For an odd-length list, return the middle element.\n    For an even-length list,\n    return the average of the two middle elements.\n    """"""\n    l = len(numbers)\n    if numbers==[]:\n        return None\n    \n    elif l%2==0:\n        first_middle_term = numbers[l//2 -1]\n        second_middle_term = numbers[l//2]\n        average = (first_middle_term+second_middle_term)/2\n        return average\n    \n    else:\n        return numbers[int((l-1)/2)]\n    \nprint(median([1, 2, 3]))\nprint(median([1, 2, 3, 4]))\nprint(median([]))\nprint(median([5])) "
B25mm015_q8,0,10,0.00,"<output> Consider using a different approach, such as sorting the list in-place or using a data structure that supports efficient insertion and retrieval of elements, like a heap or balanced binary search tree, which can help mitigate potential issues with modifying a data structure while iterating over it.</output>","def find_median(nums):\n    nums = sorted(nums)\n    n = len(nums)\n    mid = n // 2\n\n    if n % 2 == 1:  # odd length\n        return nums[mid]\n    else:  # even length\n        return (nums[mid - 1] + nums[mid]) / 2\n\n\n# 🔹 Example usage\nprint(find_median([5, 2, 9, 1, 7]))     # 5\nprint(find_median([1, 2, 3, 4, 5, 6]))  # 3.5\n"
B25MT007_q8,0,10,0.00,"<output> When the list length is even, you're averaging two middle elements (`numbers[(n - 2) // 2]` and `numbers[n // 2]`) instead of the average of the two middle numbers themselves. Try using `(numbers[n // 2 - 1] + numbers[n // 2]) / 2` to get the correct result.</output>","def median(numbers):\n    n=len(numbers)\n    if numbers==[]:\n        return None\n    elif n%2!=0:\n        return numbers[(n-1)//2]\n    else:\n        return (numbers[(n-2)//2]+numbers[n//2])/2\nprint(median([1,2,3,4,5]))\nprint(median([1,2,3,4]))"
B25DS016_q8,0,10,0.00,"<output>When the list contains only one element, your code doesn't handle this case correctly and throws an IndexError because you're trying to access `numbers[n // 2]` when `n == 1`. You should add a special case to return the single element as is.</output>","def median(numbers): \n    numbers.sort()\n    n = len(numbers)\n    if n%2==1:   \n        return numbers[n//2]\n    if n%2==0:            \n        return (numbers[n//2-1] + numbers[n//2])/2\n    if n==0 :\n        return None\nprint(median([1, 2, 3]))      \nprint(median([1, 2, 3, 4]))\nprint(median([5]))      \n"
(q8)B25ME017,0,10,0.00,"<output> When calculating the average of two middle elements when the length of the list is even, you're adding the two middle elements together and then dividing by 2, which effectively doubles the result. Instead, you should be averaging them correctly by taking their arithmetic mean. </output>","#median\ndef median(l:list):\n    l.sort()\n    k=len(l)\n    if l==[]:\n        print(""error"")\n    elif k%2==0:\n        x=l[int(k/2)-1] + (l[int((k/2))])\n        return x/2\n    else:\n        return l[int((k+1)/2-1)]\n    \nprint(median([1,2,3,2,7,5,5,63,6,63,45,3,7]))\nprint(median([]))\n\n#sort function defined below but i used in-built function cause it is much efficient\n""""""\ndef sort_list(l: list):\n    m = max(l)\n    s = []\n    for i in range(m+1): \n        for j in l:\n            if j == i:\n                s.append(j)\n    return s \n\nprint(sort_list([8,9,38,9,3,2,8,9,3,2]))\n""""""\n\n"
B25DS001_q8,8,10,80.00,"<output> Make sure you're not modifying the input list by iterating over it and using the length (l) variable, as this can cause unexpected behavior.</output>",def median(numbers):\n    l=len(numbers)\n    s=0\n    if l==0:\n        return None\n    for i in numbers:\n        s=s+i\n    return s/l\n        \n
B25EE055_q8,6,10,60.00,"<output> When the length of the list is even, you're trying to access two middle elements using `numbers[(l - 1) // 2]` and `numbers[(l - 1) // 2 + 1]`, which will throw an ""IndexError: list index out of range"" error because lists in Python are 0-indexed. You should use `(l - 1) // 2` and `(l - 2) // 2` instead. </output>",def median(numbers) :\n    l=len(numbers)\n    \n    if l%2!=0 :\n        z= numbers[(l-1)//2]\n        return (z)\n    else:\n        a= int(numbers[((l-1)//2)])\n        b= int(numbers[((l-1)//2)+1])\n        z= (a+b)/2\n        return (z)\n        \n
B25CS041_q8,6,10,60.00,"<output>Consider using the built-in sorted function instead of manual indexing, as this approach avoids potential issues with list indices and makes the code more readable and maintainable.</output>","def median(numbers):\n    """"""\n    Return the statistical median of the list ’numbers’. If the\n    list is empty, return\n    None. For an odd-length list, return the middle element.\n    For an even-length list,\n    return the average of the two middle elements.\n    """"""\n    if len(numbers) == 0:\n        return None\n    elif len(numbers)%2 == 0:\n        return (numbers[(len(numbers)//2 -1)]+ numbers[len(numbers)//2])/2\n    else:\n        return numbers[(len(numbers)-1)//2]\n"
B25CS039_q8,6,10,60.00,"<output> The issue lies in the line `return (numbers[n - 1] + numbers[n]) / 2`, where you're returning the sum of two elements instead of their average, because Python uses zero-based indexing. </output>",def median(numbers):\n    '''if its empty we return None for odd length \n    return middle number for even length return avg of middle two\n    '''\n    if(len(numbers)==0):\n        return None\n    elif(len(numbers)%2==0):\n        n=int(len(numbers)/2)\n        return (numbers[n-1]+numbers[n])/2\n    else:\n        n=len(numbers)//2\n        return numbers[n]\n
B25DS022_Q8,0,10,0.00,"<output> Make sure the list `numbers` is not empty before attempting to access its elements, as this would cause an IndexError when trying to access the middle element(s). </output>","def median(numbers):\n    sort = sorted(numbers)\n    l = len(sort)\n    if l % 2 == 0:\n        return(sort[l//2 - 1] + sort[l//2]) / 2\n    else:   \n        return(sort[l//2])\n    pass    \nprint(median([1,2,3,4,]))"
B25EC039_q8,9,10,90.00,"<output>When calculating the average of two middle elements for an even-length list, consider using integer division (//) instead of regular division (/), as this will ensure you get whole numbers and avoid floating-point precision issues.</output>","def median(numbers):\n    sorted_num=sorted(numbers)\n    if numbers==[]:\n        return None\n    if len(numbers)%2==0:\n        return (sorted_num[int(len(numbers)/2)-1]+sorted_num[int(len(numbers)/2)])/2\n    else:\n        return sorted_num[int((len(numbers)+1)/2)-1]\nmedian([1, 2, 3]) # 2\nmedian([1, 2, 3, 4]) # 2.5\nmedian([]) # None\nmedian([5]) # 5"
B25EC036_q8,0,10,0.00,"<output> When the list length is even, you are returning the average of `numbers[m]` and `numbers[m - 1]`, but according to the problem statement, you should return the average of the two middle elements. Make sure to use `(m - 0.5)` instead of `(m - 1)`.  </output>","\n\ndef median(numbers):\n    n = len(numbers)\n    if n == 0:\n        return None\n    numbers.sort()\n    m = n // 2\n    if n % 2 == 1:\n        return numbers[m]\n    else:\n        return (numbers[m-1] + numbers[m]) / 2\n\n\n\n\nprint(median([1, 2, 3]))     \nprint(median([1, 2, 3, 4]))  \nprint(median([]))            \nprint(median([5]))            \n"
B25EC006_q8,6,10,60.00,"<output>When the length of the list is even, you should return the average of the two middle elements as floats, but in your code, you're using integers, which will truncate the decimal part. Try casting the numbers to floats before calculating the average.</output>","def median(numbers):\n    \n    """"""\n    Return the statistical median of the list ’numbers’. If the\n    list is empty, return\n    None. For an odd-length list, return the middle element.\n    For an even-length list,\n    return the average of the two middle elements.\n    """"""\n    \n    if numbers == []:\n        return None\n    \n    elif len(numbers)%2 != 0:            # for the list having odd no. of elements        \n        middle = len(numbers)//2\n        return numbers[middle]\n    \n    elif len(numbers)%2 == 0:            # for the list having even no. of elements \n        k = len(numbers)//2\n        average = (numbers[k-1] + numbers[k])/2\n        return average\n    \n    else:\n        return None\n    "
B25ME009_q8,9,10,90.00,"<output>Consider using the built-in `statistics` module, which provides a `median` function that handles both odd and even length lists correctly.</output>","def median(numbers):\n    numbers.sort()           # I arrange numbers from small to big\n    if len(numbers) == 0:            # If list empty, I give back None\n        return None\n    elif len(numbers) % 2 != 0:       # If odd count, I pick middle one\n        x = numbers[int((len(numbers) - 1) / 2)]\n        return x\n    else:                         # If even count, I take two middle and average\n        b = (numbers[int(len(numbers) / 2)] + numbers[int((len(numbers) / 2) - 1)]) / 2\n        return b"
B25ME018_q8,9,10,90.00,"<output>Consider using the built-in `statistics` module, which provides a `median` function that directly calculates the median without requiring manual indexing or sorting.</output>","def median(numbers):\n    """"""\n    Return the statistical median of the list ’numbers’. If the\n    list is empty, return\n    None. For an odd-length list, return the middle element.\n    For an even-length list,\n    return the average of the two middle elements.\n    """"""\n    numbers = sorted(numbers)\n    if numbers==[]:\n        return None\n    if len(numbers)%2 !=0:\n        return numbers[(len(numbers)-1)//2]\n    else:\n        return (numbers[len(numbers)//2] + numbers[(len(numbers)//2)-1])/2"
B25ME008_Q8,0,10,0.00,"<output> Make sure to iterate over the list using `enumerate` or index-based iteration instead of direct indexing, as modifying a list while iterating over it can cause unexpected results. </output>","def median(numbers):\n    x = len(numbers)\n    if x==0:\n        median = None\n    elif x%2==0:\n        av1 = numbers[(x)//2]\n        av2 = numbers[(x-2)//2]\n        median = (av1+av2)/2\n    else:\n        median = numbers[(x-1)//2]\n    \n    print(median)\n\nmedian([1, 2, 3])\nmedian([1, 2, 3, 4])\nmedian([])\nmedian([5])"
B25ME047_Q8 (1),0,10,0.00,"<output>Be cautious when iterating over and modifying the same list simultaneously, as this can cause unexpected behavior.</output>",def get_median(a):\n    if not a:\n        return None\n\n    l = len(a)\n    for i in range(l):\n        for j in range(l - 1):\n            if a[j] > a[j + 1]:\n                t = a[j]\n                a[j] = a[j + 1]\n                a[j + 1] = t\n    \n    mid = l // 2\n    if l % 2 == 0:\n        m = (a[mid - 1] + a[mid]) / 2\n    else:\n        m = a[mid]\n        \n    return m
B25CS029_q8,6,10,60.00,"<output>When the list length is even, consider using the `numpy` library's `median()` function or calculating the average of the two middle elements separately instead of averaging them directly in your code.</output>",def median(numbers):\n    if len(numbers) == 0:\n        return None\n    elif len(numbers)%2 == 0:\n        return (numbers[int((len(numbers))/2 -1)] + numbers[int((len(numbers))/2)])/2\n    else:\n        return numbers[int((len(numbers)-1)/2)]\n    
B25EE044_q8,6,10,60.00,"<output>When checking for even-length lists, consider using `l // 2` instead of `(l + 1) // 2` to avoid indexing out-of-bounds errors.</output>",def median(numbers):\n    list=numbers\n    l = len(list)\n    if l%2==0 and l!=0:\n        median= (list[(l+1)//2] +list[(l-1)//2])/2\n        return median\n    \n    elif l==0:\n         return None\n    \n    else:\n        median= list[((l+1)//2)-1]\n        return median\n    \n    \n
B25DS043_q8,0,10,0.00,"<output>Consider using the built-in `statistics` module in Python, which provides a `median` function that handles both odd and even length lists correctly.</output>","def median(numbers):\n    """"""\nReturn the statistical median of the list ’numbers’. If the\nlist is empty, return\nNone. For an odd-length list, return the middle element.\nFor an even-length list,\nreturn the average of the two middle elements.\n""""""\n    if not numbers:                            # If numbers is empty, return None\n        return None\n\n    sorted_numbers = sorted(numbers)\n    length = len(sorted_numbers)\n    mid = length // 2\n\n    if length % 2 == 1:\n        return sorted_numbers[mid]\n    else:\n        return (sorted_numbers[mid - 1] + sorted_numbers[mid]) / 2\n\nprint(median([1, 2, 3])) # 2\nprint(median([1, 2, 3, 4])) # 2.5\nprint(median([])) # None\nprint(median([5])) # 5"
B25ME004_Q8,0,10,0.00,"<output>Consider using the built-in `statistics` module, which provides a `median` function that handles both even and odd length lists correctly.</output>","def median(numbers):\n    if not numbers:\n        return None\n    numbers.sort()\n    n=len(numbers)\n    if n%2==0:\n        mid1=(n//2)-1\n        mid2=n//2\n        return (numbers[mid1]+numbers[mid2])/2.0\n    else:\n        return numbers[n//2]\n        \nprint(median([1, 2, 3])) # 2\nprint(median([1, 2, 3, 4])) # 2.5\nprint(median([])) # None\nprint(median([5])) # 5\n    "
B25MT015_q8,9,10,90.00,"<output>When the length of the list is even, you should return the average of the two middle elements as floats, not integers, by using `numbers[middle]` and `numbers[middle - 1]`, which are already floats.</output>",def median(numbers):\n    if not numbers:\n        return None\n    numbers = sorted(numbers)\n    l = len(numbers)\n    middle = l // 2\n    if l % 2 == 1:\n        return numbers[middle]\n    else:\n        return (numbers[middle - 1] + numbers[middle]) / 2
B25CS011_q8,6,10,60.00,"<output> The student's code modifies the list `numbers` by popping elements from both ends, which can cause the list to become unstable and lead to incorrect results when iterating over it later. Consider using a different approach that doesn't modify the original list, such as sorting a copy of the list or using a data structure like a deque. </output>","def median(numbers):\n    """"""here i pop first and last elements until 2 or 1\n       element remains and then i find their average""""""\n    if len(numbers) == 0:\n        return None\n    else:\n        while len(numbers)>2:\n            numbers.pop(0)\n            numbers.pop(-1)\n        ans = sum(numbers)/len(numbers)\n        return ans\n\n"
B25ME048_q8,6,10,60.00,<output>Consider using the built-in `sorted` function to sort the list instead of manually calculating the indices for the middle elements.</output>,"def median(numbers):\n    """"""\nReturn the statistical median of the list ’numbers’. If the\nlist is empty, return\nNone. For an odd-length list, return the middle element.\nFor an even-length list,\nreturn the average of the two middle elements.\n    """"""\n    n=len(numbers)\n    Lnumbers=list(numbers)\n    if n==0:\n        return None\n    elif n%2==0:        #even\n        a1=int((n/2)-1)\n        m1=Lnumbers[a1]\n        a2=int(n/2)\n        m2=Lnumbers[a2]\n        med=(m1+m2)/2\n        return med\n    else:\n        a3=int((n-1)/2)\n        med=Lnumbers[a3]\n        return med\n\n"
B25CS056_q8,6,10,60.00,"</output>  The student's code incorrectly calculates the average of two middle elements when the list length is even, as `numbers[len(numbers) // 2 - 1]` and `numbers[len(numbers) // 2]` are not guaranteed to be the exact middle elements.","def median(numbers):\n    """"""\n    Return the statistical median of the list ’numbers’. If the\n    list is empty, return\n    None. For an odd-length list, return the middle element.\n    For an even-length list,\n    return the average of the two middle elements\n    """"""\n\n    if len(numbers)%2 ==1:\n        return numbers[len(numbers)//2]             #for odd median = middle index\n    elif len(numbers) ==0:\n        return None\n    else:                                           #for even, it is avg of middlemosts\n        return (numbers[len(numbers)//2 - 1] + numbers[len(numbers)//2])/2\n    \n# print(median([1,2,3]))\n# print(median([1,2,3,4]))\n# print(median([]))\n# print(median([5]))"
B25MM006_q8,9,10,90.00,"<output> When using the `sort()` method, Python sorts the list in-place and modifies its original order. In your code, you're sorting the list before calculating the median, but then you're trying to access elements at indices that may not exist after the sort operation has been applied. </output>",#numbers = eval(input('Enter a list of numbers: '))\ndef median(numbers):\n    numbers.sort()\n    n=len(numbers)\n    if n%2==0:\n        med = (numbers[int(n/2)] + numbers[int((n/2)-1)])/2\n    else:\n        med = numbers[int((n-1)/2)]\n    return med\n#print(median(numbers))
B25MT026_q8,9,10,90.00,"<output>Be cautious of modifying the list while iterating over it, as this can cause unexpected behavior and incorrect results.</output>","def median(numbers):\n    """"""\n    Returns the statistical median of the list containing numeric values. \n    Returns None for empty list. \n\n    Odd-length list, middle element is median\n    Even-length list, avg of the two middle elements in median""""""\n\n\n    if not numbers:\n        return None\n    \n    length = len(numbers)\n\n    #Implementing Bubble Sort\n    for i in range(length):\n        for j in range(length - i - 1):\n\n            if int(numbers[j]) > int(numbers[j+1]):\n                numbers[j], numbers[j+1] = numbers[j+1], numbers[j]\n\n\n    #Finding Median in Sorted List\n    index = length//2\n\n    if length%2 == 0:\n        median = ( numbers[index] + numbers[index -1] ) / 2\n\n    else:\n        median = numbers[index]\n        \n    return median\n\n\n# print(median([1, 2, 3])) # 2\n# print(median([1, 2, 3, 4])) # 2.5\n# print(median([])) # None\n# print(median([5])) # 5\n\n\n\n"
B24MT001_Q8,9,10,90.00,"<output> The issue lies in the line `numbers = sorted(numbers)`, which sorts the list in-place and modifies the original list, causing unexpected behavior when calculating the median.</output>","def median(numbers):\n    """"""Return the statistical median of the list ’numbers’. If the\n    list is empty, return\n    None. For an odd-length list, return the middle element.\n    For an even-length list,\n    return the average of the two middle elements.""""""\n    n=len(numbers)\n    numbers=sorted(numbers)\n    if not numbers:\n        return None\n    elif n%2==1:\n        return numbers[int((n+1)/2) -1]\n    else: \n        return (numbers[n//2 -1]+numbers[n//2])/2 #i can even use int instead of // .\n    \n# print(median([1,2,3,4,5,6]))\n# print(median([4,5,6,7]))\n# print(median([1, 2, 3])) # 2\n# print(median([1, 2, 3, 4])) # 2.5\n# print(median([])) # None\n# print( median([5])) # 5\n\n\n"
B25EC020_Q8,9,10,90.00,"<output> Check that you're not modifying the list `numbers` after sorting, as this can cause an ""IndexError: list index out of range"" when trying to access its elements. Try using a copy of the list instead. </output>","#########################################################################\n#NAME: Kammuri Lok Prakash Chowdary\n#ID NO: B25EC020\n#Discipline: Electronics and Communication Engineering\n#institute Name: Indian Institute of Technology Bhilai\n#######################################################################################\n\ndef median(numbers):\n    numbers.sort()\n    q=len(numbers)\n    if q%2!=0:\n        return (numbers[int((q-1)/2)])\n    else:\n        return (numbers[int(q/2)]+numbers[int((q/2)-1)])/2\n\n(median([1,2,3,5]))"
B25CS013_q8,9,10,90.00,"<output>When the length of the list is even, you should return the average of the two middle elements as floats, but in your code, you are returning `(nums[mid - 1] + nums[mid]) / 2`, which will truncate the decimal part if `mid - 1` and `mid` have different decimal representations.</output>",def median(numbers):\n    if not numbers:  \n        return None\n    nums = sorted(numbers)  \n    n = len(nums)\n    mid = n // 2\n    if n % 2 == 1:   \n        return float(nums[mid])\n    else:           \n        return (nums[mid - 1] + nums[mid]) / 2
B25CS009_q8,6,10,60.00,"<output> When the list length is even, you should return the average of the two middle elements as floats, but in your code, you are casting them to integers and then averaging, which will truncate the decimal part. Try changing `int(n[l // 2 - 1])` to `n[l // 2 - 1]` and `int(n[l // 2])` to `n[l // 2]` to fix this issue.</output>","def median(numbers):\n  """"""\n  Return the statistical median of the list ’numbers’. If the list is empty, return\n  None. For an odd-length list, return the middle element. For an even-length list,\n  return the average of the two middle elements.\n  """"""\n  n = list(numbers)\n  l = len(n) \n  if l % 2 != 0 :\n     return n[(l+1)//2 - 1]\n    \n  elif l == 0 :\n      return None \n    \n  else : \n     return (int(n[ l//2 - 1]) + int(n[l//2 ])) /2\n \n"
B25EE054_q8,0,10,0.00,"<output>     Be cautious when using list indices, as they should be integers, not floats. Consider converting the length of the list to an integer before indexing into it. </output>",def median(numbers):\n    if len(numbers)==0:\n        return None\n    elif len(numbers)%2!=0:\n        return numbers[(len(numbers)-1)/2]\n    else:\n        b=numbers[len(numbers)/2]+numbers[(len(numbers)/2)-1]\n        return b\n
B25ME014_q8.py,0,10,0.00,"<output>Check for side effects in your code, such as modifying the input list directly, which could cause unexpected behavior and incorrect results.</output>","def median(numbers):\n    """"""\n    Return the statistical median of the list ’numbers’. If the\n    list is empty, return\n    None. For an odd-length list, return the middle element.\n    For an even-length list,\n    return the average of the two middle elements.\n    """"""\n    num=[]\n    \n    for number in numbers: # loop for arranging numbers of the 'numbers' list in accending order .\n        \n        if number==numbers[0]:\n            num.append(number)\n        \n        else:\n            \n            for nums in num:\n                if number < num: # for every number inserted or appended earlier, condition checks if that number is less then inserts elment in its position else apppends at last.\n                    num.insert(num.index(num) , number)\n                    break\n            else:\n                num.append(number)\n    \n    if len(num)%2==1: # for finding median take the element at the middle. Indexes are chosen accordingly.\n        median = num[int((len(num)-1)/2)]\n    else:\n        median = (num[int(len(num)/2-1)] + num[int(len(num)/2)])/2\n    \n    return median # returns median ."
B25DS013_Q8,0,10,0.00,"<output>When the length of the list is even, you should return the average of the two middle elements as a float, but your code prints the sum and then divides by 2. You should use `return (a + b) / 2` instead of `print((a + b) / 2)`.</output>","def median(numbers):\n    numbers.sort()\n    if len(numbers)==0:\n        print(""None"")\n    elif len(numbers)%2==0:\n        a=numbers[int(len(numbers)/2)-1]\n        b=numbers[int(len(numbers)/2)]\n        print((a+b)/2)\n    else:\n        print(numbers[int(len(numbers)/2)])\nmedian([1,2,3])\nmedian([1,2,3,4])\nmedian([])\nmedian([5])\n"
B25MT014_q8,9,10,90.00,"<output> Consider the case where the input list contains duplicate elements, which would affect the calculation of the median for an even-length list. You should check if the two middle elements are equal before averaging them.</output>","\n\ndef median(numbers: list) -> float | None:\n    """"""\n    Return the statistical median of the list 'numbers'. If the list is empty,\n    return None. For an odd-length list, return the middle element. For an\n    even-length list, return the average of the two middle elements.\n    """"""\n    if not numbers:\n        return None\n        \n    # Sort the list to find the middle element(s).\n    sorted_numbers = sorted(numbers)\n    n = len(sorted_numbers)\n    mid_index = n // 2\n    \n    # For an odd-length list, the median is the middle element.\n    if n % 2 == 1:\n        return float(sorted_numbers[mid_index])\n    # For an even-length list, it's the average of the two middle elements.\n    else:\n        return (sorted_numbers[mid_index - 1] + sorted_numbers[mid_index]) / 2.0"
B25MT021_q8,0,10,0.00,"<output>Consider using a list comprehension or the built-in `statistics` module instead of sorting the entire list, as this can be inefficient for large inputs.</output>","def median(numbers):\n    if numbers == []: \n        return None\n\n    numbers_sorted = sorted(numbers)\n    n = len(numbers_sorted)\n\n    if n % 2 == 1:\n        middle_index = n // 2\n        return numbers_sorted[middle_index]\n    else:\n        middle1 = numbers_sorted[n//2 - 1]\n        middle2 = numbers_sorted[n//2]\n        return (middle1 + middle2) / 2\nprint(median([1, 2, 3]))       # 2\nprint(median([1, 2, 3, 4]))    # 2.5\nprint(median([]))              # None\nprint(median([5]))             # 5\n"
