student_id,tests_passed,tests_total,score_percentage,semantic_summary,code_snippet
B25MM020_q8,0,10,0.00,"<output> When sorting the list of numbers, ensure that the original list is not modified by using a copy or iterating over a slice of the list instead of the entire list. </output>","a = eval(input(""Enter a list : ""))\n\ndef median(nums):\n    c = len(nums)\n    nums.sort()\n    if c%2!=0:\n        return nums[int((c+1)/2)-1]\n    else:\n        return float(((nums[int(c/2)-1]+nums[int(c/2)]))/2)\n\nprint(median(a))"
B25DS034_q8,0,10,0.00,"<output>Check if the list of numbers is being modified while iterating over it, as this could cause the iteration to skip or repeat elements, affecting the accuracy of the median calculation.</output>","\ndef median(numbers):\n\n\n    if len(numbers) == 0:\n        return None\n    \n    elif len(numbers) % 2 != 0:\n        \n        return numbers[(len(numbers) - 1)//2]\n    \n    elif (len(numbers) % 2 == 0) :\n        \n        average = ((numbers[len(numbers)//2] + numbers[len(numbers)//2 -1]) / 2)\n        return average \n\n\n#Test Cases:\nprint(median([1, 2, 3])) # 2\nprint(median([1, 2, 3, 4])) # 2.5\nprint(median([])) # None\nprint(median([5])) # 5\n\n\n\n"
B25EC018_q8,0,10,0.00,"<output>Consider using the built-in `sorted` function to sort the list in-place, rather than creating an iterator that may modify the original data structure.</output>","def median(numbers):\n    if len(numbers)%2!=0:\n        count=len(numbers)\n        k=numbers[count//2]\n        return k\n    elif len(numbers)%2==0 and len(numbers)!=0:\n        c=len(numbers)+1\n        k1=numbers[c//2]\n        d=len(numbers)-1\n        k2=numbers[d//2]\n        return (k1+k2)/2\n    else:\n        return None\n\nprint(median ([1,2,3]))\nprint(median ([1,2,3,4]))\nprint(median ([]))\nprint(median ([5]))"
B25DS039_Q8,6,10,60.00,"<output>Check if the list contains any duplicate elements, as using int() on a float could result in losing precision and incorrect calculations.</output>",def median(numbers):\n    if len(numbers)%2 !=0:                      #for odd length of list\n        print(numbers[len(numbers)//2]) \n    elif len(numbers)==0:                       #if list is empty\n        return None\n    else:                                       #for length of list is even  \n        a=int(numbers[len(numbers)//2])\n        b=int(numbers[(len(numbers)//2)-1])\n        k=(a+b)/2\n        return k\n
B25CS002_q8,9,10,90.00,"<output> The student's code modifies the input list by swapping elements, which affects the iteration order and causes incorrect results.</output>","def median(n):\n    if (len(n) == 0):\n        \n        return None \n        \n    for i in range(0,len(n)):\n        for t in range(0,len(n)):\n            if (n[i] < n[t]):\n                if (t< i):\n                    n[t] , n[i] = n[i], n[t]\n    if (len(n)%2 == 0) :\n        a = (n[i//2] + n[(i//2)+1])/2\n    else:\n        a = n[(i+1)//2]\n    \n    return a \n            "
B25ME026_q8,9,10,90.00,"<output> Avoid sorting the list in-place, as this modifies the original list and causes issues when calculating the median for even-length lists; instead, consider using a separate data structure or algorithm that preserves the original order of elements.</output>",def median(numbers):\n    numbers.sort()\n    l=len(numbers)\n    if l==0:\n        return None\n    elif l%2==0:\n        median=(numbers[int((l-2)/2)]+numbers[int((l)/2)])/2\n    else:\n        median=numbers[int((l-1)/2)]\n    return median       \n\n\n\n\n\n\n\n\n\n\n\n\n\n\n\n\n\n\n            \n\n\n            \n
B25MT010_q8,5,10,50.00,"<output>Check for floating-point division by using integer division (//) instead of regular division (/), as the list elements are integers or floats.</output>","def median(numbers):\n    """"""\n       Calculate the median of a;list first by arranging the numbers.\n    """"""   \n    for i in range(len(numbers)):\n        for j in range(0,len(numbers)-1-i):\n            if numbers[j] > numbers[j+1]:\n                numbers[j], numbers[j+1] = numbers[j+1], numbers[j]\n        \n    if len(numbers)%2==0:\n        median=(numbers[(len(numbers)/2)-1]+numbers[((len(numbers)/2))])/2\n    else:\n        median=numbers[int(((len(numbers)+1)/2)-1)]\n    return(median)\n\n"
B25MT024_q8,0,10,0.00,"<output>Consider the indexing in your code when dealing with even-length lists, as `a // 2` will be an integer index that skips one element from the middle.</output>","def median(numbers):\n    a=len(numbers)\n    if a==0:\n        return None\n    if a%2==0:\n        return (numbers[a//2-1]+numbers[a//2])/2\n    else:\n        return numbers[(a-1)//2]\nprint(median([1,2,3]))  #2\nprint(median([1,2,3,4])) #2.5\nprint(median([]))   #None\nprint(median([5]))  #5   \n"
b25cs005_q8,0,10,0.00,<output>Use function arguments instead of input() to get a list of numbers.</output>,a=list(input())\na.sort()\nprint(a)\nb=len(a)\nif b%2!=0:\n    print(a[b//2])\nelse:\n    c=b//2\n    d=c-1\n    e=int(a[c])+int(a[d])\n    print(e/2)
B25EC017_q8,6,10,60.00,"<output> When the length of the list is even, you should calculate the average by averaging the two middle elements correctly using `len(numbers) // 2` instead of `int(len(numbers) / 2)` to avoid potential integer division issues.</output>",l=[]\ndef median(numbers):\n    if(len(numbers)%2==1):\n        return numbers[int(len(numbers)/2)]\n    elif(numbers==l):\n        return None\n    else:\n        sum=float((numbers[int((len(numbers)/2))]+numbers[(int((len(numbers)/2))-1)])/2)\n        return sum
B25DS007_q8,0,10,0.00,"<output>When the length of the list is even, you should return the average of the two middle elements as floats, but in your code, you are adding integers and then dividing by 2, which will truncate the decimal part.</output>","def median(numbers):\n    if not numbers:\n        return None\n    numbers=sorted(numbers)\n    mid=len(numbers)//2\n    if len(numbers)%2 !=0:\n        return numbers[mid]\n    else:\n        return (numbers[mid]+numbers[mid-1])/2\n\n\nprint(median([1,2,3,4]))"
B25CS051_q8,0,10,0.00,"<output>Consider using the `numpy` library, which provides an efficient and accurate way to calculate the median of a list of numbers.</output>","def median(numbers):\n    if not numbers:\n        return None\n    numbers=sorted(numbers)\n    mid=len(numbers)//2\n    if len(numbers)%2 ==0:\n        return (numbers[mid-1]+numbers[mid])/2\n    else:\n        return numbers[mid]\n\n\nprint(median([1,2,3,4]))"
B25EE024.Q8,0,10,0.00,"<output> Check that you're not trying to divide by 1, which would be the case when `len(numbers)` is odd and you use `((len(numbers)+1)//2)-1` as your index. This will result in a division by zero error. </output>","""""""numbers=[]\nwhile True:\n    i = input(""Enter a number /0 to stop: "")\n    if  i == ""0"":\n        break\n    numbers.append(float(i))\nprint(numbers)\nnumbers.sort()""""""\nif len(numbers)==0:\n    median=None\nelif len(numbers)%2==0:\n    median=(numbers[len(numbers)//2 - 1]+numbers[len(numbers)//2])/2\nelif len(numbers)%2!=0:\n    median=numbers[((len(numbers)+1)//2)-1]\nprint(median)"
B25DS014_q8,9,10,90.00,"<output>When the length of the list is even, you should return the average of the two middle elements as floats, but in your code, you are adding them together and then dividing by 2, which can result in a loss of precision.</output>",def median(numbers):\n    numbers.sort()\n    if len(numbers)==0:\n        m=None\n    elif len(numbers)%2==0:\n        m=(numbers[int(len(numbers)/2)-1]+numbers[int(len(numbers)/2)])/2\n    else:\n        m=numbers[int((len(numbers)-1)/2)]\n    return m
"B25ME022_q8(P5,6)",0,10,0.00,"<output> Check for any side effects in the function, such as modifying the input list, because you're iterating over the same list twice: once with `len(number) % 2 != 0` and again with `len(number) % 2 == 0`. This could lead to unpredictable behavior.</output>","def median(number):\n    \n    if len(number)==0 :\n        return None \n    elif (len(number))%2 != 0 :\n        i= (len(number)+1)//2\n        middleterm=int(number[i-1])\n        return middleterm\n    elif (len(number))%2 ==0 :\n        z= (len(number))//2\n        midterm=(int(number[z]-1)+int(number[z]))/2\n        return midterm\n    \nprint(median([1, 2, 3])) # 2\nprint(median([1, 2, 3, 4])) # 2.5\nprint(median([])) # None\nprint(median([5])) # 5\n        \n    \n    "
b25me039_q8,0,10,0.00,"<output> The issue lies in the incorrect indentation and inconsistent spacing in your nested loops and variable assignments, which are causing the Python interpreter to misinterpret the code structure.</output>",def median(numbers):\n\n    length = len(numbers)\n\n    if length==0:\n        return None   \n    else:\n        for i in range (l):\n            for j in range (l-1):\n                if numbers[j]>numbers[j+1]:\n                    temp = numbers[j]\n                    numbers[j] = numbers[j+1]\n                    numbers[j+1] = temp\n        \n\n        x = int(length/2)\n        if l%2==0:\n            median = (numbers[x]+numbers[x+1])/2\n        else:\n            median = numbers[x]\n\n        return median
B25EC029.q8,0,10,0.00,<output>Make sure the function name 'median' matches exactly with the problem statement and not 'B25EC029'.</output>,"def median(numbers):\n    n=sorted(numbers)\n    l=len(n)\n    if n!=[]:\n     if l%2!=0:\n        m=((l+1)//2)\n        median1=n[m-1]\n        return median1\n     else:\n        m=l//2\n        p=(l//2)+1\n        median2=((l//2)+((l//2)+1))/2\n        return median2\n    \n      \nprint(median([1,2,3]))\nprint(median([1,2,3,4]))\nprint(median([]))\nprint(median([5]))"
B25CS014_q8,9,10,90.00,"<output>Consider using the built-in `statistics` module in Python, which provides a `median` function that automatically handles both odd and even lengths of lists.</output>","\ndef median(numbers):\n    """"""\n    Return the statistical median of the list 'numbers'.\n    If the list is empty, return None.\n    For an odd-length list, return the middle element.\n    For an even-length list, return the average of the two middle elements.\n    """"""\n    if not numbers:\n        return None\n    \n    nums = sorted(numbers)\n    n = len(nums)\n    mid = n // 2\n    \n    if n % 2 == 1:\n        return nums[mid]\n    else:\n        return (nums[mid - 1] + nums[mid]) / 2\n"
B25MT032_q8,0,10,0.00,"<output>Be cautious of off-by-one errors when indexing into the list, as your current implementation assumes that `len(numbers) / 2` will always yield an integer index.</output>",def median(numbers):\n    if (len(numbers) == 0):\n        return None\n    elif (len(numbers)%2==0):\n        median = (numbers[int((len(numbers))/2)]+numbers[int((len(numbers)/2)-1)])/2\n        return median\n    elif(len(numbers)%2 != 0):\n        median = numbers[int((len(numbers)-1)/2)]\n        return median\n  \nprint(median([5]))  
B25DS020_Q8,0,10,0.00,"<output>Consider using the built-in sorted function and indexing to access the middle elements, rather than relying on integer division and list indexing.</output>","def median(n):\n    if len(n)==0:\n        print(""none"")\n    else:\n        if len(n)%2!=0:#for no.of observation are odd\n            \n             return(n[len(n)//2])\n        else:#no.of observations are even\n            return(float((((n[len(n)//2])+n[len(n)//2-1]))/2))\nprint(median([1,2,3]))\n        \n        "
B25DS019_q8,5,10,50.00,"<output>When the length of the list is even, you should return the average of the two middle elements as a float by dividing their sum by 2, not just adding them together.</output>",def median(numbers):\n    if len(numbers)==0:\n        return None\n    elif numbers!=[]:\n        numbers.sort()\n        if len(numbers)%2==0:\n            n= int(numbers[int(len(numbers)/2)])+int(numbers[int(len(numbers)/2+1)])\n            return n\n        else:\n            y=int(numbers[int(len(numbers)/2)])\n            return y\n        \n            \n        
B25EE004_q8,9,10,90.00,"<output>Consider using the built-in `statistics.median()` function from Python's standard library, which handles both even and odd length lists correctly without requiring manual indexing.</output>",def median(numbers):\n    numbers.sort()\n    l=len(numbers)\n    if (l!=0):\n        if (l%2==0):\n            med=(numbers[l//2]+numbers[(l//2)-1])/2\n        else:\n            med=numbers[(l-1)//2]\n    else:\n        return None\n    return med\n\n\n        \n        \n        
B25DS011_q8,0,10,0.00,"<output>Check for potential off-by-one errors when indexing the list, as you're using `mid` and `mid - 1` without explicitly checking if these indices are within the bounds of the list.</output>","def median(nums):\n    l=len(nums)\n    mid=int(l/2)\n    if l%2==0 and l!=0:\n        return (nums[mid]+nums[mid-1])/2\n    elif l==0:\n        return None\n    else:\n        return nums[mid]\nprint(median([1,2,3]))\nprint(median([1,2,3,4]))\nprint(median([]))"
B25CS045_Q8,0,10,0.00,"<output> Consider using a set or other immutable data structure when sorting the list of numbers, as modifying the original list during iteration can affect its stability and lead to incorrect results.</output>","def median(numbers):\n    """"""Return the statistical median of the list ’numbers’. If thelist is empty, returnNone. For an odd-length list, return the middle element.For an even-length list,return the average of the two middle elements.""""""\n    if not numbers:\n        return None\n    sorted_numbers = sorted(numbers)\n    length = len(sorted_numbers)\n    middle = length // 2\n    if length % 2 == 1:\n        return sorted_numbers[middle]\n    else:\n        return (sorted_numbers[middle - 1] + sorted_numbers[middle]) / 2\ntest_cases = [[1,2,3,4]]\nfor case in test_cases:\n    print(f""median({case}) => {median(case)}"")"
B25EE013_q8,9,10,90.00,"<output>Consider using the built-in `statistics` module, which provides a `median` function that handles edge cases more elegantly than your implementation.</output>",def median(numbers):\n    if not numbers:   # if list is empty then None is returned\n        return None\n    \n    new = sorted(numbers)  # sorting the list in an acsending order\n    n = len(new)\n    m = n // 2\n\n    if n % 2 == 1:   # if the string is of odd length \n        return new[m]\n    else:            # if the string is of even length\n        return (new[m - 1] + new[m]) / 2\n    \n
B25EE056_Q8,0,10,0.00,"<output>Consider using the built-in `statistics.median` function or sorting the list first and then finding the middle element, as your implementation has a potential off-by-one error.</output>","def median(numbers):\n    if numbers!=[]:\n        s=sorted(numbers)\n        l=len(numbers)\n        if l%2==0:\n            median=(s[int(l/2)]+s[int((l/2)-1)])/2\n        else:\n            median=s[int(((l+1)/2)-1)]\n        return median\n         \nprint(median([1,2,3]))\nprint(median([1,2,3,4]))\nprint(median([]))\nprint(median([5]))\n        \n            "
B25ME035_q8,0,10,0.00,"<output>When the list length is even, you should return the average of the two middle elements using `(numbers[midterm - 1] + numbers[midterm]) / 2`, but instead, you're returning `numbers[midterm - 1]` which is one element short. Change it to `(numbers[midterm - 1] + numbers[midterm]) / 2`.</output>","def median(numbers):\n    if not numbers:\n        return None\n    numbers=sorted(numbers)\n    n=len(numbers)\n    midterm=n//2\n    if n%2==1:\n        return numbers[midterm]\n    else:\n        return(numbers[midterm-1]+numbers[midterm])/2\nprint(median([1,2,3]))"
B25MM017.q8,0,10,0.00,"<output>Check for any side effects or modifications in the list while iterating over it, as this could be causing the ModuleNotFoundError.</output>","def median(numbers):\n    if not numbers:\n        return None\n    nums = sorted(numbers)\n    n = len(nums)\n    mid = n // 2\n    if n % 2 == 1:\n        return nums[mid]\n    else:\n        return (nums[mid - 1] + nums[mid]) / 2\n\n\n# testing\nprint(median([1, 2, 3]))     # 2\nprint(median([1, 2, 3, 4]))  # 2.5\nprint(median([]))            # None\nprint(median([5]))           # 5"
B25ME056_q8,9,10,90.00,"<output>Use the built-in `statistics` module, which provides a `median` function that handles both odd and even-length lists correctly.</output>","def median(numbers):\n    """"""\n    Return the statistical median of the list ’numbers’. If the\n    list is empty, return\n    None. For an odd-length list, return the middle element.\n    For an even-length list,\n    return the average of the two middle elements.\n    """"""\n    a=len(numbers)\n    b=sorted(numbers)\n    if  not numbers :\n        return\n    if a%2!=0:\n        return(b[a//2]) # middle element\n    else:\n         return((b[a//2] + b[a//2 -1])/2 ) # avg of middle elements \n"
B25EE058_q8,1,10,10.00,"<output> The issue lies in the inner loop where you're iterating over `numbers` again, which is modifying the list while it's being iterated over, leading to incorrect results and the TypeError. Instead, directly use the sorted() function to sort the list. </output>","def median(numbers):\n    ascending_order_list=[]\n    a=0               #a is largest number in list\n    b=0               #b is lowest number in list\n    if numbers==[]:\n        return None\n    else:\n        for i in numbers:\n            a=max(a,i)\n            b=min(b,i)\n        for i in range(b,a+1):\n            for j in numbers:\n                if i==j:\n                    ascending_order_list.append(j)\n        length_of_list=len(ascending_order_list)\n        if length_of_list%2==0:\n            return (ascending_order_list[int(length_of_list/2)]+ascending_order_list[int((length_of_list/2)+1)])/2\n        elif length_of_list==1:\n            return ascending_order_list[0]\n        else:\n            return (ascending_order_list[int((length_of_list+1)/2)])\nmedian([1, 2, 3])\nmedian([1 , 2, 3, 4])\nmedian([])\nmedian([5])"
B25EC024_q8,6,10,60.00,"<output> The issue lies in the line `b = (numbers[a // 2 - 1] + numbers[a // 2]) / 2`, where you're attempting to access elements at index `a // 2 - 1` and `a // 2`. However, since list indices in Python start at 0, this is equivalent to accessing the elements before the middle element. To fix this, simply remove the `- 1` from the indices. </output>","def median(numbers):\n    """"""\nReturn the statistical median of the list ’numbers’. If the\nlist is empty, return\nNone. For an odd-length list, return the middle element.\nFor an even-length list,\nreturn the average of the two middle elements.\n""""""\n    a = len(numbers)\n    if a == 0 :\n        return None \n    elif a % 2 == 0 :\n        b = (numbers[a // 2 - 1] +  numbers[a // 2]) /2\n        return b\n \n    else:\n        c = numbers[a // 2]\n        return c\n    \n"
B25CS047_q8,0,10,0.00,"<output> Be cautious when using list indices, as your code attempts to access the element at `numbers[leng // 2 - 1]` even when `leng % 2 == 0`, which can lead to an ""IndexError: list index out of range"" error.</output>","def median(numbers):\n    leng=len(numbers)\n    if leng%2==0:\n        a=numbers[leng//2]+numbers[(leng//2)-1]\n        return a/2\n    else:\n        a=numbers[leng//2]\n        return a\nprint(median([1,2,3,4,5]))\nprint(median([1,2,3,4,5,6]))\n"
B25ME024_q8,9,10,90.00,"<output> Check for potential side effects when accessing elements in the list, as modifying the list while iterating over it can affect the median calculation.</output>",def median(numbers):\n    numbers.sort()\n    if len(numbers) == 0:\n        return None\n    elif len(numbers)%2!=0:\n        a=numbers[int((len(numbers)-1)/2)]\n        return a\n    else:\n        b=(numbers[int((len(numbers)/2)-1)]+numbers[int(len(numbers)/2)])/2\n        return b
B25DS041_q8,0,10,0.00,"<output> Reconsider using the original list 'numbers' instead of creating a new sorted copy, as this could potentially be an optimization issue and might also affect the correctness if the list is modified elsewhere in the program.</output>","def median(numbers):\n    """"""\n    Return the statistical median of the list 'numbers'. If the list is empty, return None.\n    For an odd-length list, return the middle element.\n    For an even-length list, return the average of hthe two middle elements.\n    """"""\n    \n    if len(numbers) == 0:\n        return None\n    \n    numbers = sorted(numbers)\n    n = len(numbers)\n    middle_number = n // 2\n    \n    if n % 2 == 1:\n        return numbers[middle_number]\n    else:\n        return (numbers[middle_number - 1] + numbers[middle_number]) / 2\n    \n    \nprint(median([1, 2, 3]))\nprint(median([1, 2, 3, 4]))\nprint(median([]))\nprint(median([5]))"
B25CS016_q8,9,10,90.00,"<output> When the list length is even, you should take the average of the two middle elements, but your code currently returns an integer result instead of a float by using `int()` around the division. Change `m = (numbers[int(len(numbers) / 2 - 1)] + numbers[int(len(numbers) / 2)]) / 2` to `m = (numbers[int(len(numbers) / 2 - 1)] + numbers[int(len(numbers) / 2)]) / 2.0` to ensure a float result.</output>",def median(numbers):\n    numbers.sort()\n    if len(numbers)==0:\n        return None\n    else:\n        if len(numbers)%2==0:\n            m=(numbers[int(len(numbers)/2-1)]+numbers[int(len(numbers)/2)])/2\n            return m\n        else:\n            m=numbers[int((len(numbers)+1)/2-1)]\n            return m 
B25MT006_q8,0,10,0.00,"<output> The issue lies in the fact that you're sorting the list of numbers, which modifies the original list and changes its indices, effectively making your mid index calculation incorrect for even-length lists.</output>","# q8\n\ndef median(numbers):\n    if len(numbers) == 0:\n        return None\n\n    numbers = sorted(numbers)\n    n = len(numbers)\n    mid = n // 2\n\n    if n % 2 == 1:   # odd length\n        return numbers[mid]\n    else:            # even length\n        middle1 = numbers[mid - 1]\n        middle2 = numbers[mid]\n        return (middle1 + middle2) / 2\n\n\n# Test cases\nprint(median([1, 2, 3]))       \nprint(median([1, 2, 3, 4]))    \nprint(median([]))              \nprint(median([5]))             \n"
B25CS055_q8,6,10,60.00,"<output>Consider using the built-in `sorted` function to sort the list of numbers in ascending order before calculating the median, as your current implementation does not handle even-length lists correctly.</output>","def median(numbers):\n    """"""\n    Return the statistical median of the list ’numbers’. If the\n    list is empty, return\n    None. For an odd-length list, return the middle element.\n    For an even-length list,\n    return the average of the two middle elements.\n    """"""\n    l=[]\n    if len(numbers)==0:\n        return None\n    elif(len(numbers)%2!=0):\n        return numbers[(len(numbers)//2)]\n    else:\n        return (numbers[(len(numbers)//2)-1] + numbers[(len(numbers)//2)])/2\n\n        \n    "
B25EE048_q8,9,10,90.00,"<output>Be cautious when using in-place sorting algorithms like Bubble Sort, as they modify the original list while iterating over it, which may cause unexpected results.</output>","def median(numbers):\n    for i in range(len(numbers)):\n        for x in range (0,len(numbers)-i-1):\n            if numbers[x]>numbers[x+1]:\n                numbers[x] , numbers[x+1] = numbers[x+1], numbers[x]\n    if numbers==[]:\n        return None\n    if len(numbers)%2!=0:\n        return numbers[(len(numbers)-1)//2]\n    else:\n        return (numbers[(len(numbers)//2)]+numbers[(len(numbers)//2)-1])/2\n""""""it first arranges the list in ascending order then it return the median"""""""
B25ME032_q8,5,10,50.00,"<output> Check for potential side effects when sorting the list, as the original list might be modified in-place, causing unexpected behavior.</output>",def median(numbers):\n    numbers.sort()\n    n=len(numbers)\n    if n==0:\n        return None\n    elif n%2==0:\n        return (numbers[n/2]+numbers[(n/2)-1])/2.0\n    else:\n        return numbers[n//2]\n
B25MT011_q8,0,10,0.00,"<output> When the list's length is even, you're returning the average of `mid1` and `mid2`, but since lists are 0-indexed in Python, `mid1` and `mid2` would actually be the elements at indices `len(numbers) // 2 - 1` and `len(numbers) // 2`, not the middle two elements. Adjust your calculation to `(numbers[(len(numbers)) // 2] + numbers[((len(numbers)) // 2) - 1]) / 2`. </output>","def median(numbers: list):\n    if len(numbers) == 0:\n        return None\n\n    numbers.sort()\n\n    if len(numbers) % 2 != 0:\n        mid = len(numbers) // 2\n        return numbers[mid]\n    else:\n        mid1 = len(numbers) // 2 - 1\n        mid2 = len(numbers) // 2\n        return (numbers[mid1] + numbers[mid2]) / 2\n    \nprint(median([1, 2, 3]))\nprint(median([1, 2, 3, 4])) \nprint(median([])) \nprint(median([5]))"
