student_id,tests_passed,tests_total,score_percentage,semantic_summary,code_snippet
B25DS012_q8,6,10,60.00,"<output> The issue lies in the line `return (numbers[len(numbers) // 2] + numbers[len(numbers) // 2 - 1]`, where you're attempting to access an index that doesn't exist when the list has only one element. This is because Python uses zero-based indexing, so when the length of the list is odd, `len(numbers) // 2` would be equal to the index of the middle element, not the element before it. </output>",def median(numbers):\n    if len(numbers) == 0:\n        return None\n    elif len(numbers)%2 == 1:\n        return numbers[(len(numbers)//2)]\n    else:\n        return (numbers[(len(numbers)//2)] + numbers[(len(numbers)//2)-1])/2
B25MM007_q8,9,10,90.00,"<output> When the list length is even, you're returning the average of two middle elements, but you should be returning the average of all two middle elements (i.e., `middle1` and `middle2`) instead of just adding them together. </output>",def median(numbers):\n    if numbers == []:\n        return None\n\n    numbers_sorted = sorted(numbers) \n    n = len(numbers_sorted)\n    if n % 2 == 1: \n        middle_index = n // 2\n        return numbers_sorted[middle_index]\n    else:\n        middle1 = numbers_sorted[n//2 - 1]\n        middle2 = numbers_sorted[n//2]\n        return (middle1 + middle2) / 2\n
B25EE019_q8,0,10,0.00,"<output> When the list length is even, you should return the average of the two middle elements as floats, but in your code, you're returning an integer result by performing floating-point division with no explicit float type specified. </output>","def median(numbers):\n    if not numbers:\n        return None\n    numbers=sorted(numbers)\n    mid=len(numbers)//2\n    if len(numbers)%2 ==0:\n        return (numbers[mid-1]+numbers[mid])/2\n    else:\n        return numbers[mid]\n\n\nprint(median([1,2,3,4]))"
B25DS008_q8,0,10,0.00,"<output> Consider using the built-in `sorted()` function instead of manual indexing, as your code modifies the original list when calculating the median, which could lead to incorrect results due to the iteration over a modified data structure.</output>","def median(numbers):\n    if len(numbers)%2==0 and len(numbers)!=0:\n        m=int((len(numbers)/2)-1)\n        n=m+1\n        med=(numbers[m]+numbers[n])/2\n    elif len(numbers)==0:\n        return None\n    else:\n        med=numbers[int((len(numbers)+1)/2)-1]\n    return med\nprint(median([1,2,3]))\nprint(median([1,2,3,4]))\nprint(median([]))\nprint(median([5]))"
B25EE021_q8,9,10,90.00,"<output> When the length of the list is even, you're subtracting 1 from the middle index in both cases (i.e., `numbers[int(len(numbers) / 2)]` and `numbers[int(len(numbers) / 2) - 1]`). This will cause you to miss one element when calculating the average for even-length lists. Try using `int(len(numbers) / 2)` instead of `int(len(numbers) / 2) - 1`.</output>","def median(numbers):\n    """"""\n    Return the statistical median of the list ’numbers’. If the\n    list is empty, return\n    None. For an odd-length list, return the middle element.\n    For an even-length list,\n    return the average of the two middle elements.\n    """"""\n    numbers.sort()\n    if len(numbers) == 0:\n        return None\n    if len(numbers) %2 != 0:\n        return numbers[int((len(numbers)+1)/2)-1]\n    else:\n        return (numbers[int(len(numbers)/2)-1]+numbers[int(len(numbers)/2)])/2\n\n"
B25EC015.q8,0,10,0.00,"<output>Check if the input list `n` is indeed passed by value and not by reference, as using `n[(l - 2) // 2]` could modify the original list.</output>",def median(n):\n	l=len(n)\n	m=0\n	if l==0:\n		return None\n	if l%2!=0:\n		m+=n[(l-1)//2]\n		return m\n	m+=(n[(l-2)//2]+n[l//2])/2\n	return m\n	\n\n	\n		
B25MM027_q8,0,10,0.00,"<output>Consider using the `numpy` library, which provides an efficient and accurate way to calculate the median of a list of numbers.</output>","###################################################################################################\n#SATYA RISHINDRA SONTHENA\n#B25MM027\n#MATERIAL SCIENCES AND METALLURGICAL ENGINEERING\n#INDIAN INSTITUTE OF TECHNOLOGY BHILAI\n###################################################################################################\ndef median(numbers):\n    if not numbers:\n        return None\n\n    sorted_nums = sorted(numbers)\n    n = len(sorted_nums)\n    mid = n // 2\n\n    if n % 2 == 1:\n        return sorted_nums[mid]\n    else:\n        return (sorted_nums[mid - 1] + sorted_nums[mid]) / 2\nprint(median([1, 2, 3]))  \n\n"
B25ME045_q8,6,10,60.00,"<output>When the list length is even, consider using `n // 2` and `n // 2 - 1` as indices for the two middle elements instead of `(n - 1) // 2`, which would skip one element.</output>",def median(numbers):\n    if numbers==[] :\n        return None\n    n=len(numbers)\n    if n%2==0 :\n        median=(numbers[(n//2)]+numbers[(n//2)-1])/2\n    elif n%2 !=0 :\n        median=numbers[(n-1)//2]\n    return median\n     \n     \n     \n     \n
B25ME029_q8,0,10,0.00,"</output> The issue lies in the fact that you're trying to access the list `numbers` inside itself, which is not allowed in Python. Instead of passing the input list as an argument, try returning it from a function and then pass that returned value to your median function.",\n#Use this for input : numbers = eval(input())\ndef median(numbers):\n    if len(numbers) % 2 == 0:\n        temp1 = int(len(numbers)/2 -1)\n        temp2 = int(len(numbers)/2)\n        num1 = numbers[temp1]\n        num2 = numbers[temp2]\n        median = (num1 + num2)/2\n        \n        return median \n    else:\n        temp = int((len(numbers)+ 1)/2) - 1\n        return numbers[temp]\n    \nprint(median(numbers))
B25DS017_q8,0,10,0.00,"<output>When the list length is even, you should return the average of the two middle elements as floats, not integers.</output>","def median(numbers):\n    n=len(numbers)\n    if numbers==[]:\n        return None\n    elif n%2!=0:\n        return numbers[(n-1)//2]\n    else:\n        return (numbers[(n-2)//2]+numbers[n//2])/2\nprint(median([1,2,3,4,5]))\nprint(median([1,2,3,4]))"
b25EC007_q8,0,10,0.00,"<output>Consider using a different approach for handling the case when the list length is even, as your current implementation uses `mid - 1` which could result in an index out of range error if the list has only one element.</output>","def median(numbers):\n    n = len(numbers)\n    \n    if n == 0:\n        return None\n    \n    numbers_sorted = sorted(numbers)\n    mid = n // 2\n    \n    if n % 2 == 1:\n        return numbers_sorted[mid]\n    else:\n        return (numbers_sorted[mid - 1] + numbers_sorted[mid]) / 2\n    \nprint(median([1, 2, 3]))     \n       \n   \n    \n"
B25MM026_q8,6,10,60.00,"<output> You are iterating over the list of numbers and modifying it at the same time by using slicing (`numbers[len(numbers) // 2]`), which is causing the issue.</output>",def median(numbers):\n    if numbers==[]:\n        return None\n    elif len(numbers)%2==0:\n        return (numbers[len(numbers)//2]+numbers[len(numbers)//2 -1])/2\n    elif len(numbers)%2!=0:\n        return numbers[len(numbers)//2]\n    
B25CS032_q8,0,10,0.00,"<output>Consider using a different approach for handling even-length lists, as your current implementation averages the two middle elements without considering whether they are actually the middle elements.</output>","def median(numbers):\n    l=len(numbers)\n    if l!=0:\n        if l%2==0:\n            m=(numbers[int((l/2)-1)]+numbers[int(l/2)])/2\n        if l%2!=0:\n            m=numbers[int(((l+1)/2)-1)]\n    if l==0:\n        m=""none""\n        \n    return(m)\nprint(median([1,2,3]))\nprint(median([1,2,3,4]))\nprint(median([]))\nprint(median([5]))"
B25DS026.q8,0,10,0.00,"<output>Check for any side effects in your code, as the `sorted()` function modifies the original list.</output>","def median(numbers):\n    if not numbers:\n        return None\n    numbers = sorted(numbers)\n    n = len(numbers)\n    mid = n // 2\n    if n % 2 == 0:\n        return (numbers[mid - 1] + numbers[mid]) / 2\n    return float(numbers[mid])\nprint(median([1, 2, 3]))\nprint(median([1, 2, 3, 4]))\nprint(median([]))\nprint(median([5]))"
B25ME003_q8,6,10,60.00,"<output> Be cautious of modifying the list while iterating over it, as this can cause unexpected behavior and incorrect results in your median calculation.</output>",def median(numbers):\n    if numbers==[]:\n        return None\n    elif len(numbers)%2==0:\n        return (numbers[len(numbers)//2]+numbers[len(numbers)//2 -1])/2\n    elif len(numbers)%2!=0:\n        return numbers[len(numbers)//2]\n    
B25CS037_q8,5,10,50.00,"<output>Try using `int(i / 2)` instead of `i / 2` when indexing the list, as Python treats floating-point numbers as invalid indices.</output>",def median(numbers):\n    i = len(numbers)\n    numbers.sort()\n    if i%2 == 0:\n        return (numbers[i/2 -1] + numbers[i/2 +1])/2\n    elif i == 0:\n        return None\n    else:\n        return numbers[int((i-1)/2)]\n    \n
B25EE031_q8,0,10,0.00,"<output>Consider using the built-in `sorted()` function to sort the list of numbers in-place, rather than creating an additional copy of the list with `list(numbers)`, as this could potentially modify the original data structure.</output>","def median(numbers):\n    numbers=list(numbers)\n    if len(numbers)==0:\n        return None\n    elif (len(numbers)%2)!=0:\n        Median=numbers[int((len(numbers)+1)/2)-1]\n        return Median\n    else:\n        Median=(numbers[int(len(numbers)/2)-1]+numbers[int((len(numbers)/2)+1)-1])/2\n        return Median\nprint(median([1, 2, 3]))\nprint(median([1, 2, 3,4]))\nprint(median([]))\nprint(median([5]))\n"
B25EE015_Q8,0,10,0.00,"<output> When the length of the list is even, you should return the average of the two middle elements as floats, but in your code, you're returning an integer result by dividing the sum of the two middle elements by 2. You need to ensure that this division results in a float value. </output>","""""""\nReturn the statistical median of the list ’numbers’. If the\nlist is empty, return\nNone. For an odd-length list, return the middle element.\nFor an even-length list,\nreturn the average of the two middle elements.\n""""""\ndef median(numbers):\n    if len(numbers)==0:\n        return None\n    elif len(numbers)%2!=0:\n        m=(numbers[len(numbers)//2])\n        return m\n    else:\n        n=len(numbers)//2\n        m=(numbers[n-1]+numbers[n])/2\n        return m\n    \nprint(median([1, 2, 3]))\nprint(median([1, 2, 3, 4]))\nprint(median([]))\nprint(median([5]))"
B25CS010_q8,6,10,60.00,"<output>Consider using the built-in `sorted()` function to sort the list in-place, rather than sorting a copy of the list, which could be unnecessary and inefficient.</output>","def median(numbers):\n    """"""\n    Return the statistical median of the list 'numbers'. If the\n    list is empty, return\n    None. For an odd-length list, return the middle element.\n    For an even-length list,\n    return the average of the two middle elements.\n    """"""\n    if len(numbers) == 0:\n        return None\n\n    if len(numbers) % 2 == 0:\n        a = numbers[len(numbers) // 2]\n        b = numbers[len(numbers) // 2 - 1]\n\n        return (a + b) / 2.0\n    else:\n        return numbers[len(numbers) // 2]\n"
B25EC003_Q8,6,10,60.00,"<output>Check that the list `numbers` is not being modified before calculating its median, as this could cause the indices used in your code to become invalid.</output>","import math\ndef median(numbers):\n	n=len(numbers)\n	if n%2==0:\n		t1=int(n/2)-1\n		m=(numbers[t1]+numbers[t1+1])/2\n	else:\n		t2=int((n-1)/2)\n		m=numbers[t2]\n	return m\nmedian([1,2,3])"
B25DS030_q8,0,10,0.00,"<output> The student's code snippet attempts to construct a number, but it does not define a function named `median`, which is required by the problem description. The correct approach would be to define the `median` function and use its return value instead of printing it directly. </output>","import random\ndef construct_number(N):\n   """"""Constructs an N-digit positive integer X such that:\n   1. It is divisible by 3.\n   2. It is not divisible by 9.\n   3. It has no leading zeros.\n   Returns any valid integer.""""""\n   b=N\n   a=random.randrange(10**(N-1),10**N)\n   if a%3==0 and a%9!=0 :\n       print(a)\n   else:\n       construct_number(b)\nconstruct_number(2)       "
B25EC038_q8.py,0,10,0.00,"<output> Make sure the function name `median` matches exactly with the problem statement, as Python will look for modules named after the function when trying to import it.</output>","def median(numbers):\n    l = len(numbers)\n    if l == 0:\n        return None\n    elif l%2 == 0:\n        a = numbers[(l//2)-1]\n        b = numbers[l//2]\n        median =float((a+b)/2)\n        return median\n    else:\n        c = numbers[(l-1)//2]\n        median = c\n        return median\n      \nprint(median([1, 2, 3]))\nprint(median([1, 2, 3, 4]))\nprint(median([ ]))\nprint(median([5]))"
(B25DS042)_(Q8),0,10,0.00,N/A,No Code Found
B25EE029_q8,9,10,90.00,"<output> When calculating the average of two middle elements for even-length lists, consider that list indices in Python start at 0, so `numbers[l // 2]` would be out of range. Instead, use `numbers[(l - 1) // 2]` and `numbers[(l - 2) // 2]`. </output>",def median(numbers):\n    numbers.sort()\n    l=len(numbers) \n    if l==0:\n        return None\n    if l%2!=0:\n        return numbers[(l-1)//2]\n    if l%2==0:\n        return (numbers[(l//2)-1] + numbers[l//2])/2\n\n\n    \n        \n    
B25EE043_q8,9,10,90.00,"<output>Consider using the built-in `statistics` module, which provides a `median` function that handles both odd and even lengths correctly.</output>",##############################################################################\n#Name:Purushotham Partha saradhi\n#Id no.:B25EE043\n#Discipline:Electrical Engineering\n#Institute name:Indian Institute of Technology Bhila\n###############################################################################\n\ndef median(nums):\n    if nums!=[]:\n        nums.sort()\n        sum=0\n        if len(nums)%2==0:\n            sum=int(nums[len(nums)//2])+int(nums[len(nums)//2-1])\n            M=sum/2\n        else:\n            M=int(nums[(len(nums))//2])\n        return M\n    else:\n        return None\n        \n        
B25EC013_q8,9,10,90.00,"<output>Consider using the built-in `statistics` module in Python, which provides a `median` function that handles both odd and even lengths of lists correctly.</output>",def median(numbers):\n    if not numbers:\n        return None\n    numbers.sort()\n    if len(numbers)%2==0:\n        med=(numbers[int((len(numbers)/2)-1)]+numbers[int((len(numbers)/2))])/2\n    else:\n        med=numbers[int(((len(numbers)+1)/2)-1)]\n    return med
B25MT027_q8,5,10,50.00,"<output> The issue lies in the line `numbers[int(a - 2 / 2)]`, where you're using integer division, which truncates the result and can lead to an out-of-range index. Use floating-point division instead (`a / 2`) to ensure accurate indexing. </output>","def median(numbers):\n    numbers.sort()\n    med=0\n    a=len(numbers)\n    if(a%2==0):\n        med=(numbers[int(a-2/2)]+numbers[int((a/2))])/2\n    elif(a%2==1):\n        med=(numbers[int((a-1)/2)])\n    return(med)\n'''numbers=eval(input('Enter a list'))\nprint(median(numbers))'''\n\n""""""\nReturn the statistical median of the list ’numbers’. If the list\nNone. For an odd-length list, return the middle element. For an e\nreturn the average of the two middle elements.\n""""""\npass \n"
B25DS040_q8,0,10,0.00,"<output> Make sure the input list `numbers` is not modified after sorting, as this could affect the indices used to access the middle elements when the length is even.</output>","def median(numbers):\n    if numbers == []:\n        return None\n\n    numbers_sorted = sorted(numbers) \n    n = len(numbers_sorted)\n    if n % 2 == 1: \n        middle_index = n // 2\n        return numbers_sorted[middle_index]\n    else:\n        middle1 = numbers_sorted[n//2 - 1]\n        middle2 = numbers_sorted[n//2]\n        return (middle1 + middle2) / 2\nprint(median([1, 3, 2]))\nprint(median([4, 1, 2, 3]))\nprint(median([]))\nprint(median([7]))\n"
B25MT029_Q8,0,10,0.00,"<output> The issue lies in the fact that you're trying to access elements of the list using their index, which will be out of range when the list has only one element (i.e., its length is odd), because `len(n) // 2` would then equal `0`, and attempting to access `n[0]` raises an IndexError. </output>","def median(n):\n    if (len(n))%2 == 0:\n        return (n[(len(n))//2] + n[len(n)//2 - 1]) / 2\n    else:\n        return n[len(n)//2]\nprint(median([1, 2, 3])) # 2\nprint(median([1, 2, 3, 4])) # 2.5\n'''print(median([]))''' # None\nprint(median([5])) # 5"
B25ME054_q8,9,10,90.00,"<output> When the list length is even, you're returning the average of two middle elements as floats, but you should be returning a float instead of an integer by using `(middle1 + middle2) / 2.0` or `((middle1 + middle2) / 2). </output>",def median(numbers):\n    n = len(numbers)\n    if n==0:\n        return None\n    sorted_numbers = sorted(numbers)\n    mid_index = n // 2\n    if n % 2 == 1:\n        return sorted_numbers[mid_index]\n    else:\n        middle1 = sorted_numbers[mid_index - 1]\n        middle2 = sorted_numbers[mid_index]\n        return (middle1 + middle2) / 2\n
B25EC019_q8,0,10,0.00,"<output> Check the indexing in your code, as `numbers[len(numbers)/2]` and `numbers[len(numbers)/2 -1)` should be `numbers[(len(numbers) - 1) // 2]` and `numbers[(len(numbers) // 2)]`, respectively. </output>","def median(numbers): \n	"""""" Return the statistical median of the list ’numbers’. If the list is empty, return None. For an odd-length list, return the middle element. For an even-length list, return the average of the two middle elements. """"""\n	if len(numbers) == 0:\n		return None\n	elif len(numbers) %2 != 0:\n		return number[(len(numbers) - 1)/2]\n	\n	else:\n		avg = (numbers[len(numbers)/2] + numbers[len(numbers)/2 -1)])/2\n		return avg\n		\nprint(median([1, 2, 3]))"
B25ME028_q8.py,0,10,0.00,"<output>Check if you are modifying the input list within your function, as this could be causing the unexpected behavior and ModuleNotFoundError.</output>","def median(num):\n    if len(num)==0:\n        return None\n    else:\n        if len(num)%2!=0:\n            median = num[len(num)//2]\n            return median\n        else:\n            x=len(num)//2\n            median= (num[x-1]+num[x])/2\n            return median\n        \n        \nprint(median([1, 2, 3]))\nprint(median([1,2,3,4]))\nprint(median([]))\nprint(median([5]))"
B25CS033_q8,6,10,60.00,"<output>Consider handling the case where the input list contains non-numeric values, as your function will return incorrect results or raise a TypeError if such values are present.</output>","def median(numbers:list):\n    """"""\n    Returns the statistical median of the list ’numbers’. If the\n    list is empty, returns\n    None. For an odd-length list, returns the middle element.\n    For an even-length list,\n    returns the average of the two middle elements.\n    """"""\n    length = len(numbers)\n    if length == 0:\n        return None\n    else:\n        if length % 2 == 0:\n            return (numbers[int(length/2 - 1)] + numbers[int(length/2)]) / 2\n        else:\n            return numbers[int((length-1)/2)]"
B25ME033_Q8,1,10,10.00,"<output> The issue lies in the inner loop where you're iterating over `numbers` again, which is modifying the list while it's being sorted. Instead, consider using a set or a separate data structure to keep track of unique elements. </output>","def median(numbers):\n    ascending_order_list=[]\n    a=0               #a is largest number in list\n    b=0               #b is lowest number in list\n    if numbers==[]:\n        return None\n    else:\n        for i in numbers:\n            a=max(a,i)\n            b=min(b,i)\n        for i in range(b,a+1):\n            for j in numbers:\n                if i==j:\n                    ascending_order_list.append(j)\n        length_of_list=len(ascending_order_list)\n        if length_of_list%2==0:\n            return (ascending_order_list[int(length_of_list/2)]+ascending_order_list[int((length_of_list/2)+1)])/2\n        elif length_of_list==1:\n            return ascending_order_list[0]\n        else:\n            return (ascending_order_list[int((length_of_list+1)/2)])\nmedian([1, 2, 3])\nmedian([1 , 2, 3, 4])\nmedian([])\nmedian([5])"
B25MT019_q8,0,10,0.00,"<output> You are modifying the list `l` by using `j = len(l)` and `median = (l[j // 2] + l[j // 2 - 1]) / 2`, which can lead to unpredictable behavior, especially when dealing with large lists. Instead, consider using a separate variable to store the length of the list and calculate the median without modifying it.</output>","#B25MT019_q8\ndef median(l:list[int]):\n    j=len(l)\n    if j==0:\n        print(""None"")\n    else:\n        if j%2==0:\n            median=(l[j//2]+l[(j//2)-1])/2# for odd\n            print(median)\n        else:\n            median=l[j//2]# for even \n            print(median)\nmedian([1,2,3])\nmedian([])\nmedian([1,2,3,4])\nmedian([5])"
B25EC014_q8,0,10,0.00,"<output> Check if the list `numbers` is actually a list and not a single element, as you're trying to access its elements with indexing (`numbers[int(L / 2 - 1)]`) which would work for a single-element list but not for a list of two or more elements. </output>","def median(numbers):\n    """"""\n    Return the statistical median of the list ’numbers’. If the\n    list is empty, return\n    None. For an odd-length list, return the middle element.\n    For an even-length list,\n    return the average of the two middle elements.\n    """"""\n    if len(numbers) != 0:\n        L = len(numbers)\n        if (L %2 ==0):\n            avg = (numbers[int((L/2)-1)] + numbers[int(L/2)]) / 2\n            return avg\n        \n        else:\n            return numbers[int(((L+1)/2)-1)]\n    \n    else:\n        return None\n    \nprint(median([5]))\n            \n        \n        \n        \n        \n        \n"
B25ME001_q8,0,10,0.00,"<output>Convert the input list `numbers` to a Python iterable (e.g., tuple, set) instead of converting it to a list using `list(numbers)`, which consumes extra memory and causes an EOFError.</output>","def  median(numbers):\n    a = list(numbers)\n    sum = 0\n    for i in range(0,len(a)):\n        sum = sum + int(a[i])\n        median = sum/len(a)\n    return median\n\nnumbers = input(""enter the numbers: "")\nprint(median(numbers))\n\n    \n"
B25EE025_q8,0,10,0.00,"<output>Consider using the `numpy` library, which provides an efficient way to calculate the median of a list of numbers without modifying the original data.</output>","def median(numbers):\n	if not numbers:\n		return None\n	\n	nums = sorted(numbers)\n	n = len(nums)\n	mid = n // 2\n	\n	if n % 2 == 1:\n		return nums[mid]\n	else:\n		return(nums[mid - 1] + nums[mid]) / 2\n# test cases\nprint(median([1,2,3]))\nprint(median([]))"
B25ME013_q8,0,10,0.00,"<output> Be cautious when using the index `l // 2` or `(l - 1) // 2`, as they will throw an ""IndexError: list index out of range"" error if the list length is zero, due to integer division in Python 3. Consider adding a check for this edge case before attempting to access the middle element.</output>","def median(numbers):\n    """"""\n    Return the statistical median of the list ’numbers’.\n    If the list is empty, return None. For an odd-length list,\n    return the middle element. For an even-return the average of\n    the two middle elements.\n    """"""\n    med=0.0\n    l=len(numbers)\n    if(l==0):\n            return None\n    for i in numbers:\n        if(l%2==0): #Median for even length list\n            med=((numbers[(l//2)]+numbers[((l//2)-1)])/2)\n            return med\n        else:#Median for odd length list\n            med=numbers[((l-1)//2)]\n            return med\nprint(median([1, 2, 3]))\nprint(median([1, 2, 3, 4]))\nprint(median([]))\nprint(median([5]))\n        "
B25DS015_q8,9,10,90.00,"<output> Check that the `sort_numbers` function modifies the original list, and consider using a different approach that doesn't rely on modifying the input list.</output>","def sort_numbers(lst):\n    #Keep the Numbers in Order\n    res = []\n    while len(lst) != 0:\n        p = lst[0]\n        for i in range(len(lst)):\n            if lst[i] < p:\n                p = lst[i]\n        res.append(p)\n        lst.remove(p)\n    return res\n\ndef median(numbers):\n    """"""\n    Return the statistical median of the list ’numbers’. If the listNone.\n    For an odd-length list, return the middle element. For an ereturn\n    the average of the two middle elements.\n    """"""\n    if numbers != []:\n        nl = sort_numbers(numbers)\n        p = nl\n        if len(p)%2 == 0:\n            return (p[int((len(p)/2)-1)]+p[int((len(p))/2)])/2\n        elif len(p)%2 == 1:\n            return p[int((len(p)-1)/2)]\n    else:\n        return None\n    \n#Test Cases:\n#print(median([1, 2, 3])) \n#print(median([1, 2, 3, 4])) \n#print(median([])) \n#print(median([5])) "
