student_id,tests_passed,tests_total,score_percentage,semantic_summary,code_snippet
B25CS030_q8,9,10,90.00,"<output> When the list length is even, you should return the average of the two middle elements as floats, but in your code, you're subtracting 1 from the mid index when accessing the second element, which will result in incorrect results. </output>",#Median of Numbers\n\ndef median(numbers):\n    n = len(numbers)\n    if n==0:\n        return None\n    numbers.sort()   # Sort the numbers to find the median\n    \n    mid = n//2\n    if n%2 == 1:\n        return numbers[mid]\n    else:\n        return (numbers[mid-1] + numbers[mid]) / 2\n    \n
B25DS018_q8,0,10,0.00,"<output>When the length of the list is even, you should return the average of the two middle elements as floats without converting them to integers.</output>","def median(numbers):\n    if not numbers:\n        return None\n    \n    sorted_numbers = sorted(numbers)\n    \n    l = len(sorted_numbers)\n    middle = l // 2     # Find the middle index\n    \n    if l % 2 == 1:\n        return float(sorted_numbers[middle])         # If the number of items is odd, return the middle number\n    else:\n        left_middle = sorted_numbers[middle - 1]      # If even number of items, return the average of the two middle numbers\n        right_middle = sorted_numbers[middle]\n        ans = (left_middle + right_middle) / 2\n        return ans\n    \n    pass\n\nprint(median([1, 2, 3, 4]))"
B25EE051_q8,9,10,90.00,"<output>Consider modifying your code to avoid using the `sorted()` function, which creates an intermediate sorted list and may not be necessary for this problem.</output>","def median(numbers):\n    """"""\n    Return the statistical median of the list 'numbers'. If the list is empty, return\n    None. For an odd-length list, return the middle element. For an even-length list,\n    return the average of the two middle elements.\n    """"""\n    if not numbers:\n        return None\n    sorted_values = sorted(numbers)\n    count = len(sorted_values)\n    midpoint = count // 2\n    if count % 2 == 1:\n        return sorted_values[midpoint]\n    else:\n        middle_avg = (sorted_values[midpoint - 1] + sorted_values[midpoint]) / 2\n        return middle_avg"
B25MM028_q8,0,10,0.00,"<output>Consider using the built-in `statistics` module, which provides a `median` function that handles even-length lists correctly and avoids potential issues with modifying a data structure while iterating over it.</output>","def median(numbers):                       \n    if len(numbers)==0:\n        print(""None"")\n        return None\n    numbers.sort()            #So that numbers are arranged in assending order\n    k = len(numbers)\n    middle = k // 2\n    if k%2!=0:           # To check for number of terms as it is even or odd\n        return float(numbers[middle])\n    else:\n        return float((numbers[middle - 1] + numbers[middle]) / 2)\n\n\nprint(median([1, 2, 3]))\nprint(median([1, 2, 3, 4]))\nprint(median([]))\nprint(median([5]))\n    "
B25CS004_q8,9,10,90.00,"<output>Be cautious of side effects when sorting the list, as this operation modifies the original list and could affect subsequent iterations.</output>",def median(numbers):\n    numbers.sort()\n    l=len(numbers)\n    if(l==0):\n        return None\n    if(l%2!=0):\n        return (numbers[int((l-1)/2)])\n    else:\n        return ((numbers[int((l-1)/2)]+numbers[int((l-1)/2)+1])/2)
B25MT003_q8,0,10,0.00,"<output> The issue lies in the fact that you're trying to access elements of the list using their index, but the problem statement asks for a function that operates on the entire list, not individual elements. Consider modifying your code to work with the list as a whole. </output>","def median(number):\n    l=len(number)\n    median=0\n    if(l%2==0):\n        median=(number[(l//2)-1]+number[(l//2)])/2\n        return median\n    else:\n        median=number[l//2]\n        return median\nprint(""median of the list "" ,median([1,2,5,4]))          "
B25MM025_q8,0,10,0.00,"<output>When calculating the median of an even-length list, you should use `nums[int(len(nums) / 2)]` instead of `nums[int(len(nums) / 2) - 1]`, because it would throw an EOFError due to accessing a non-existent element.</output>","nums=eval(input(""enter a list : ""))\ndef median(nums):\n    nums.sort()\n    if len(nums)%2!=0:\n        b=nums[int((len(nums)+1)/2)-1]\n        return b\n    else:\n        b=float(nums[int(len(nums)/2)-1]+nums[int(len(nums)/2)])/2\n        return b\nprint(median(nums))\n        \n   #first we entered list\n#arranged the list through sort\n#conditin used to check wether the length of list is odd or even\n#then applied median concept\n        "
B25DS021 q8,9,10,90.00,"<output>When the list length is even, you're averaging the two middle elements (`sorted_numbers[mid - 1]` and `sorted_numbers[mid]`) instead of their average. Try using `(sorted_numbers[mid - 1] + sorted_numbers[mid]) / 2.0` to ensure floating-point division.</output>","def median(numbers):\n    """"""\n    Return the median of numbers.\n    """"""\n    if not numbers:\n        return None\n    sorted_numbers = sorted(numbers)\n    n = len(sorted_numbers)\n    mid = n // 2\n    if n % 2 == 0:\n        return (sorted_numbers[mid - 1] + sorted_numbers[mid]) / 2\n    else:\n        return sorted_numbers[mid]\n"
B25ME010_q8,6,10,60.00,"<output>Consider using the built-in `sorted` function to sort the list of numbers before finding the median, as your current implementation only checks for even or odd length lists but does not handle sorting the list correctly.</output>",def median(numbers:list[int or float]):\n    median=0\n    n=len(numbers)                   \n    if n==0:                 #for empty list\n        return None\n    elif n%2==0:\n        x= numbers[int((n)/2)-1]     # calculating for even \n        y= numbers[int((n)/2)]\n        median=(x+y)/2\n    else:\n        median=numbers[int((n-1)/2)]          #calculating for odd\n    return median\n    \n    \n
B25MT018_q8,0,10,0.00,"<output>Consider sorting the list in-place instead of creating a temporary sorted copy, as this could potentially modify the original list and cause issues when iterating over it.</output>",def median(*numbers):\n    t=sorted(numbers)\n    n=len(t)\n    if n%2==0:\n        return float((t[n//2]+t[(n//2)-1])/2)\n    else:\n        return t[(n-1)//2]\n    return None\n\n    \n    \n 
B25MT016_q8,0,10,0.00,<output> The error occurs because the `List` type hint is not imported from the `typing` module. Add `from typing import List` at the top of your code snippet to fix this issue.</output>,"def median(nums: List[Union[int, float]]) -> Optional[Union[int, float]]:\n    """"""\n    Return the median of a list.\n    Odd count → middle number\n    Even count → average of two middle numbers\n    Empty list → None\n    """"""\n    if not nums:\n        return None\n    nums = sorted(nums)\n    n = len(nums)\n    mid = n // 2\n    if n % 2 == 1:\n        return nums[mid]\n    return (nums[mid - 1] + nums[mid]) / 2\n"
B25CS042_Q8,0,10,0.00,"<output>When the list length is even, you should return the average of the two middle elements as floats, but in your code, you're returning integers by using `numbers[mid - 1]` and `numbers[mid]`, which might lead to a loss of precision.</output>","def median(numbers):\n    """"""\n    Return the statistical median of the list ’numbers’. If the\n    list is empty, return\n    None. For an odd-length list, return the middle element.\n    For an even-length list,\n    return the average of the two middle elements.\n    """"""\n    n=len(numbers)\n    mid=n//2\n    if not numbers :\n        return ""None""\n    if (n%2==1):\n        return numbers[mid]\n    else:\n        return (numbers[mid-1] + numbers[mid])/2\n   \n    \nprint(median([1, 2, 3]))\nprint(median([1, 2, 3, 4]))\nprint(median([]))\nprint(median([5]))\n    "
B25EC041_q8,6,10,60.00,"<output>When the list length is even, you should return the average of the two middle elements, but instead, you're trying to access an index that doesn't exist for lists with less than 2 elements.</output>",def median(numbers):\n    if(len(numbers)%2==0):\n        return (numbers[len(numbers)//2]+numbers[len(numbers)//2-1])/2.0\n    else:\n        return numbers[len(numbers)//2]\n
B25ME002_q8,6,10,60.00,"<output>Check that the input list is not being modified within the function, as this could affect the calculation of the median.</output>",def median(numbers):\n    a=len(numbers)\n    if(a!=0):\n        if(a%2==1):\n            average=numbers[int((a-1)/2)]\n        else:\n            average=(numbers[int(a/2)]+numbers[int(a/2 - 1)])/2.0\n        return average\n    else:\n        return None\n
B25ME060_q8,6,10,60.00,"<output> When the length of the list is even, you are returning the sum of two middle elements instead of their average, because you're adding them together and then dividing by 2. Instead, calculate the average by dividing their sum by 2. </output>",def median(numbers) :\n    if numbers == []:\n        return None\n    if len(numbers)%2 == 0:\n        x = (numbers[len(numbers)//2] + numbers[len(numbers)//2 - 1])/2\n        return x\n    else:\n        y = numbers[(len(numbers))//2]\n        return y\n    \n\n    
B25ME034_q8,0,10,0.00,"<output>When the length of the list is even, you should calculate the average by dividing the sum of the two middle elements by 2, not by returning their sum.</output>",def median(numbers):\n    if len(numbers)==0:\n        return None\n    elif len(numbers)%2!=0:\n        return numbers[(len(numbers)-1)/2]\n    else:\n        b=numbers[len(numbers)/2]+numbers[(len(numbers)/2)-1]\n        return b\n
B25ee014_q8,9,10,90.00,"<output> When the list length is even, you are returning the average of `nums[mid - 1]` and `nums[mid]`, but according to the problem statement, you should return the average of the two middle elements. You need to change `mid - 1` to `mid`.  </output>",def median(numbers):\n    if not numbers:  \n        return None\n    nums = sorted(numbers)  \n    n = len(nums)\n    mid = n // 2\n    if n % 2 == 1:   \n        return float(nums[mid])\n    else:           \n        return (nums[mid - 1] + nums[mid]) / 2
B25CS023_q8,6,10,60.00,"<output> When the list length is even, you're returning the average of the two middle elements as a float, but in Python 3, the `/` operator performs floating-point division, so you should use `//` for integer division instead. </output>","def median(numbers):\n   """"""\n   Return the statistical median of the list ’numbers’. If the\n   list is empty, return\n   None. For an odd-length list, return the middle element.\n   For an even-length list,\n   return the average of the two middle elements.\n   """"""\n   a=len(numbers)\n   if a==0:\n       return None \n   elif a%2!=0:\n       return numbers[int((a+1)/2)-1]\n   elif a%2==0:\n       return 0.5*(numbers[int(a/2)]+numbers[int(a/2)-1])\n\n"
B25CS059_q8,6,10,60.00,"<output>Be cautious when using integer division (//) in Python, as it performs floor division and may not yield the exact average for even-length lists.</output>","def median(numbers):\n    """"""\n    Return the statistical median of the list ’numbers’. If the\n    list is empty, return\n    None. For an odd-length list, return the middle element.\n    For an even-length list,\n    return the average of the two middle elements.\n    """"""\n    x=len(numbers)\n    if x==0:\n        return None\n    elif x%2==0:\n        return (numbers[x//2-1]+numbers[x//2])/2\n    else:\n        return numbers[x//2]\n"
B25CS046_q8,6,10,60.00,"<output> When the list length is even, you are averaging two middle elements without considering that these elements should be the average of all numbers in the list, not just the two middle ones. Try using `numbers[y // 2 - 1]` and `numbers[y // 2]` instead. </output>",def median(numbers):\n    y = len(numbers)\n    if y == 0:\n        return None\n    elif y%2==0:\n        x= (numbers[-(y//2)] + numbers[-(y//2) -1])/2\n        return x\n    else:\n        x= numbers[int(y/2)]\n        return x
B25MT005_q8,9,10,90.00,"<output>When calculating the average of two middle elements for an even-length list, consider using integer division (//) instead of regular division (/), as this will ensure that the result is a float and not an approximation.</output>","def median(numbers):\n    """"""\n    Return the statistical median of the list ’numbers’.\n    If the list is empty, return None.\n    For an odd-length list, return the middle element.\n    For an even-length list, return the average of the two middle elements.\n    """"""\n    n = numbers\n    n.sort()  # Arrange the list in ascending or descending order\n    if len(n)==0:  # No element is present\n        return None\n    if len(n)%2!=0:  # Number of items are odd\n        p = n[(len(n)+1-1)//2]  # Making the count of numbers align with the human counting\n        # In the list middle number will be output\n    else:   # If even number of items\n        p = (n[(len(n)//2)-1] + n[len(n)//2])/2  # Average of the 2 middle numbers\n    \n    return p\n    \n\n"
B25EC033_q8,0,10,0.00,"<output> The issue lies in the way you're calculating the indices `a` and `b`. When the list length is even, you should use integer division (`//`) instead of floating-point division (`/`) to get the correct indices. </output>","numbers=[1,2,3,4]\ndef median(numbers):\n    med=0.00\n    length=len(numbers)\n    if length %2==0:\n        a=(length/2)-1\n        b=length/2\n        a=int(a)\n        b=int(b)\n        med=(numbers[a]+numbers[b])/2\n    else:\n        a=length//2\n        med=numbers[a]\n    return med\nprint(median(numbers))"
B25ME006_q8,0,10,0.00,"<output>Consider using the built-in `sorted` function instead of sorting the list in-place with `sort()`, as this avoids modifying the original list and ensures accurate results.</output>","def median(numbers):\n    x=numbers.sort()\n    x=len(numbers)\n    if x==0  or numbers==0:\n        return(""none"")\n    elif x %2==0:\n        y=(numbers[x//2-1]+numbers[(x//2)])/2\n        return(y)\n    elif x==0  or numbers==0:\n        return(""none"")\n\n    else:\n        y=numbers[(x)//2]\n        return(y)\nprint(median([1, 2, 3]))\nprint(median([1, 2, 3, 4])) \nprint(median([]))\nprint(median([5])) "
B25EE049_Q8,6,10,60.00,"</output> When the length of the list is even, consider using `len(numbers) // 2` instead of `int(len(numbers) / 2)` to avoid potential integer truncation issues.","def median(numbers):\n    if len(numbers)==0:\n        med=""none""\n    elif len(numbers)==1:\n        med=numbers[0]\n    elif len(numbers)%2==0:\n        med=(numbers[len(numbers)//2-1]+numbers[len(numbers)//2])/2\n    else:\n        med=numbers[int(len(numbers)/2)]\n    return med\n\n    "
B25EC043_q8,0,10,0.00,"<output> The issue lies in the fact that you are sorting the list and then trying to access its elements, which is modifying the original list during iteration. Instead, consider using a data structure like a set or a list comprehension to create a copy of the input list before processing it. </output>","def median(numbers):\n    numbers.sort()\n    if len(numbers)%2==0:\n        return (numbers[(len(numbers)//2)-1]+numbers[(len(numbers)//2)])/2\n    else:\n        return (numbers[(len(numbers)//2)])\n\n\nprint(median([1,2,3,4]))\n"
b25cs038 q8,9,10,90.00,"<output> Consider that the list of numbers is not being sorted in-place, but rather a copy of the original list is created using `sorted()`, which could potentially modify the original list if it contains mutable elements. This might lead to unexpected behavior or incorrect results. </output>",def median(numbers):\n    if not numbers:\n        return None\n    \n    numbers = sorted(numbers)\n    n = len(numbers)\n    mid = n // 2\n    \n    if n % 2 == 1:\n        return numbers[mid]\n    else:\n        return (numbers[mid - 1] + numbers[mid]) / 2
B25CS027_Q8,0,10,0.00,"<output>Make sure to return a value from your function, not print it.</output>","numbers = [1, 2, 3, 4]\n\nif not numbers:\n    print(None)\nelse:\n    numbers.sort()\n    n = len(numbers)\n    if n % 2 == 1:\n        print(numbers[n//2])\n    else:\n        print((numbers[n//2 - 1] + numbers[n//2]) / 2)\n"
B25EE009_q8,0,10,0.00,"<output> When using the `len()` function, it returns an integer value representing the number of items in the list. However, when checking if the length is even or odd, you should be comparing the result to 0 (not 1), as `len(numbers)` will always return a positive value for non-empty lists. </output>","def median(numbers):\n    p=len(numbers)\n    if p==0:\n        return None\n    elif p%2!=0:\n        median=numbers[p//2]\n        return median \n    else:\n        median=((numbers[int(p/2)]+numbers[int(p/2 - 1)])/2)\n        return median\nnumbers=list(eval(input(""enter the elems of list"")))\ns=median(numbers)\nprint(s)\n    "
B25ME019_q8,0,10,0.00,"<output>Consider using the built-in `statistics` module, which provides a `median` function that handles both odd and even lengths correctly.</output>","def median(numbers):\n	if not numbers:\n		return None\n	numbers = sorted(numbers)\n	p = len(numbers)\n	if p%2==0:\n		result=(numbers[(p//2)-1]+numbers[p//2])/2\n	else:\n		result=numbers[((p+1)//2)-1]	\n	return result\nprint(median([1, 2, 3]))		\nprint(median([1, 2, 3, 4]))	\nprint(median([]))\nprint(median([5]))"
B25CS062_q8,0,10,0.00,"<output>When the list length is even, you are averaging two middle elements but should be averaging the two middle numbers themselves, not their indices.</output>","def median(numbers):\n    n=len(numbers)\n    if numbers==[]:\n        return None\n    elif n%2!=0:\n        return numbers[(n-1)//2]\n    else:\n        return (numbers[(n-2)//2]+numbers[n//2])/2\nprint(median([1,2,3,4,5]))\nprint(median([1,2,3,4]))"
B25ME007_q8,9,10,90.00,"<output>Consider using the built-in `statistics` module, which provides a `median` function that handles even-length lists correctly.</output>","def median(numbers):\n    numbers=sorted(numbers)\n    n=len(numbers)\n    if n==0:\n        return None\n    if n%2!=0:\n        k=n//2\n        return numbers[k]\n    elif n%2==0:\n        k1=n//2 -1\n        k2=n//2\n        return (numbers[k1]+numbers[k2])/2\nmedian([1,2,3])\nmedian([1,2,3,4])\nmedian([])\nmedian([5])\n"
B25ME011_q8,0,10,0.00,<output> The issue lies in the line `elif l%2==0:` where you are using `(len(numbers))` instead of just `(len(numbers))//2`. The former will cause an error because it is trying to access an index that does not exist. </output>,"def median(numbers):\n    """"""\n    Return the median of the list 'numbers'. For odd length , return middle element.\n    for even length return the average of the two middle elements .\n    \n    """"""\n    \n    """"""\n    l=len(numbers)\n    if l==0:\n        num=""none""\n    elif l==1:\n        num=numbers[0]\n    elif l%2==0:\n        num =(((numbers[(len(numbers))//2]) +( numbers[(len(numbers)//2) -1])))/2\n    else:\n        num =(numbers[((len(numbers))+1)//2])\n    return num\nprint (median([1,2,3,4]))\nprint (median([1,2,3]))\nprint (median([]))\nprint (median([5]))\n        "
B25EE007_q8,1,10,10.00,"<output>When the list length is even, you are returning the sum of two middle elements instead of their average.</output>",def median(numbers):\n    if(len(numbers)==0):\n        return None\n    numbers.sort()\n    if(len(numbers)%2==0):\n        return (numbers[int(len(numbers)/2)]+numbers[int((len(numbers)/2) -1)])/2\n    else:\n        return numbers[int((len(numbers)-1)/2)]\n\nprint(median([]))
B25CS019_q8,0,10,0.00,"<output>When the length of the list is even, you should return the average of the two middle elements as floats, but your code is returning integers by using `numbers[n - 1]` and `numbers[n]`. You need to cast them to float before averaging.</output>","def median(numbers):         \n    numbers.sort()     # median can define for  ordered list only so sort rearrange list in ascending order\n    n = len(numbers)//2       \n    if len(numbers) == 0 :\n        return None\n    elif  len(numbers)%2 == 0 :   # if list as even number of obj then median is avg of n/2th and (n+1)/2 th term\n        median = (numbers[n-1] + numbers[n])/2\n        \n    else :                        # if list as odd number of obj then median is middle term\n        median = (numbers[n])\n        \n        \n    return median\n        \nprint(median([1,2,3]))\nprint(median([1,2,3,4]))\nprint(median([]))\nprint(median([5]))\n    \n            "
B25DS035_q8,0,10,0.00,"<output>When the length of the list is even, you should return the average of the two middle elements as a float by using `float()` instead of just casting to `int`. For example, `(numbers[len(numbers) // 2] + numbers[(len(numbers) - 1) // 2]) / 2.0</output>","def median(numbers):\n    if(numbers==[]):\n        return(""None"")\n    elif(len(numbers)%2==0):\n        m=(int(numbers[len(numbers)//2])+int(numbers[(len(numbers)-1)//2]))/2\n        return m\n    else:\n        m=int(numbers[(len(numbers)-1)//2])\n        return m\nprint(median([1,2,3]))\nprint(median([1,2,3,4]))\nprint(median([]))\nprint(median([5]))"
B25EC021_q8,6,10,60.00,"<output> The issue lies in the fact that you are trying to access elements at indices that may not exist, specifically when the list has only one element (i.e., `len(lst) // 2 - 1` is out of range). You should use the `sorted()` function to sort the list before accessing its elements. </output>",def median(lst):\n    if (len(lst))%2 ==0 : \n        return (lst[(len(lst)//2)] + lst[len(lst)//2 - 1]) /2\n    else : return lst[len(lst)//2]\n
B25DS024_Q8,0,10,0.00,"<output>Check that the input list has at least two elements before attempting to access its middle element, as this would result in an IndexError.</output>","def median(numbers):\n    numbers.sort()\n    n = len(numbers)\n    if n%2 == 1:\n        median = numbers[n//2]\n    else:\n        m1 = numbers[(n//2)-1] #indexing numbers []\n        m2 = numbers[n//2]\n        median = (m1+m2)/2\n        \n    return median\nprint(median([1,3,4,7]))\n    \n    \n    \n\n\n\n    \n\n    \n    "
B25CS034_q8,8,10,80.00,"<output> The issue lies in the line `numbers = (numbers[len(numbers) // 2 - 1] + numbers[len(numbers) // 2]) / 2`, which attempts to calculate the average of two middle elements before sorting the list. Since the list is not sorted, this approach will result in an IndexError because it tries to access indices that do not exist.</output>","def median(numbers):\n    """"""\nReturn the statistical median of the list ’numbers’. If the\nlist is empty, return\nNone. For an odd-length list, return the middle element.\nFor an even-length list,\nreturn the average of the two middle elements.\n""""""\n    u= (numbers[(len(numbers)//2)-1]+ numbers[len(numbers)//2])/2\n    numbers.sort()\n    if numbers ==0:\n        return None\n    if  (len(numbers))%2==1:\n        return numbers[((len(numbers)+1)//2)-1]\n    else :\n        return u\npass\n\n#median([1, 2, 3]) # 2\n#median([1, 2, 3, 4]) # 2.5\n# median([]) # None\n# median([5]) # 5\n"
B25ME050_q8,0,10,0.00,"<output>Consider handling the case where `numbers[mid - 1]` and `numbers[mid]` are equal, as this would result in an integer division when calculating the average.</output>","def median(numbers):\n    if numbers == []:\n        return None\n    numbers.sort()\n    n = len(numbers)\n    mid = n // 2\n    if n % 2 != 0:\n        return numbers[mid]\n    else:\n        return (numbers[mid - 1] + numbers[mid]) / 2\nprint(median([1,2,3]))\nprint(median([1,2,3,4]))\nprint(median([]))\nprint(median([5]))"
B25EE038.Q8,0,10,0.00,"<output>Check if you are using the same function name as specified in the problem statement, 'median_of_Numbers' instead of 'median'.</output>","def median_of_Numbers(Numbers):\n    """"""\n         Return the statistical median of the list ’numbers’. If the list\nNone. For an odd-length list, return the middle element. For an e\nreturn the average of the two middle elements.    """"""\n    \n     \n    L = len(Numbers)\n    if len(Numbers)%2 != 0:\n        output = Numbers[(L-1 )//2] # Middle term in numbers\n        return ""median is "" ,output\n    else:\n        output = (Numbers[L//2]+Numbers[L//2-1])/2\n        return ""median is "" ,output\n\n\n\nprint(median_of_Numbers([1,2,3]))\nprint(median_of_Numbers([1,2,3,4]))\nprint(median_of_Numbers([]))\nprint(median_of_Numbers([5]))\n        \n        "
shourya_q8,0,10,0.00,"<output> When the length of the list is even, you should return the average of the two middle elements as floats, but in your code, you are subtracting 1 from the index `m`, which will lead to incorrect results. Try changing `s[m - 1]` to `s[m]`.</output>","def median(numbers):\n    if not numbers:\n        return None\n    s = sorted(numbers)\n    n = len(s)\n    m = n // 2\n    if n % 2 == 1:\n        return s[m]\n    else:\n        return (s[m - 1] + s[m]) / 2\n\nprint(median([1, 2, 3]))"
B25MM009 Q8,0,10,0.00,"<output>Consider using the `numpy` library to handle numerical computations, and ensure that your function does not modify the original list while iterating over it.</output>","def median_nu(num: list[int or float]):\n    a = sorted(num)\n    d = len(a)  \n    if d % 2 == 0:\n        m=(a[d // 2 - 1] + a[d // 2]) / 2\n        return m\n    else:\n        m = a[d // 2]  \n        return m\nprint(median_nu([2, 3, 5, 6, 7]))\nprint(median_nu([1, 2, 3, 4, 5, 6]))\nprint(median_nu([2,4,5,6,8,10,11]))"
