student_id,tests_passed,tests_total,score_percentage,semantic_summary,code_snippet
"B25ME022_q4(p5,6)",0,10,0.00,"<output>The issue with your code is that it only checks for exact matches of types and values, but does not account for the fact that `0` can be represented as a float (`0.0`) or an integer (`1`). This means that numbers like `0.0` are incorrectly classified as falsey.</output>","def custom_bool(l):\n\n    if l is None:\n        return False\n\n    if l == 0:\n        return False\n\n    if type(l) in (str, list, tuple, dict, set, frozenset, bytes, bytearray):\n        if len(l) == 0:\n            return False\n\n\n    return True\nprint(custom_bool(0))        # False\nprint(custom_bool(1))        # True\nprint(custom_bool(""""))       # False\nprint(custom_bool(""hello""))  # True\nprint(custom_bool([]))       # False\nprint(custom_bool([1]))      # True\nprint(custom_bool(None))     # False"
B25EE020_q4,9,10,90.00,<output>Consider adding explicit checks for boolean values using `bool()` to ensure accurate behavior with conditional statements.</output>,def custom_bool(value):\n    if value==0 or value==0.0 or value is None:\n        return False\n    elif type(value) != int and len(value)==0:\n        return False\n    else:\n        return True
B25DS007_q4,0,10,0.00,<output>Use `and` instead of `not` to combine conditions in the if-else statement.</output>,"def custom_bool(value):\n    wrong=('',"""",0,[],{},range(0),frozenset(),set())\n    for value  not in wrong:\n        return True\n    else:\n        return False\n    \n"
B25ME030 Q4,0,10,0.00,"<output>Consider using Python's built-in `isinstance()` function to check if a value is an instance of the desired type, rather than directly comparing it to a list of values.</output>","def custom_bool(value):\n    list=[False,0,0.0,""None"",(),[],{}]\n    if value in list:\n        return False\n\n    else:\n        return True\nprint(custom_bool(67))\nprint(custom_bool(0))\nprint(custom_bool([]))\n\n"
B25EC017_q4,7,10,70.00,"<output> The student's code is missing the `not` operator to negate conditions properly, causing it to incorrectly return True for some values that should be False, such as empty strings or sets.</output>",def custom_bool(value):\n    if(value==0 or value==0.0 or value==[] or value=={} or value==set()):\n        return False\n    else:\n        return True\n
B25EE037_q4,9,10,90.00,"<output> The condition `if value` will only return True for non-zero values and non-empty collections, but it won't handle the case where the input is an empty string or other falsy values that don't have a numeric value or collection. </output>",def custom_bool(value):\n    if value:\n        return True\n    else:\n        return False\n\n
B25DS015_q4,9,10,90.00,"<output> Consider using the `not` operator to negate values instead of direct comparisons for `False` cases, which can improve readability and avoid potential issues with multiple `or` conditions.</output>","def custom_bool(value):\n    '''\n    Emulate Python’s built-in bool() without calling it.\n    Return Falsenumeric zeros (e.g. 0, 0.0), and\n    empty sequences or collections(and True otherwise.\n    '''\n    if (value == 0 or 0.0 or 0j):\n        return False\n    elif (value == """" or value == '' or value == None or value == False):\n        return False\n    elif (value == [] or value == () or value == {} or value == range(0) or value == set()):\n        return False\n    else:\n        return True\n\n#Test Cases:\n#print(custom_bool(0)) # False\n#print(custom_bool(1)) # True\n#print(custom_bool("""")) # False\n#print(custom_bool(""hello"")) # True\n#print(custom_bool([])) # False\n#print(custom_bool([1])) # True\n#print(custom_bool(None)) # False"
B25MM008_q4,0,10,0.00,<output>Consider adding explicit negations for `not` operator to correctly handle its behavior when applied to boolean values.</output>,"def custom_bool(value):\n    if value is None:\n        return False\n    if value == 0 or value == 0.0 :\n        return False\n    if value =="""" or value == [] :\n        return False\n    if value =={} or value == set():\n        return False\n    if value ==() :\n        return False\n    return True\n#test cases\n\nprint (custom_bool(0))\nprint (custom_bool(1))\nprint (custom_bool(""""))\nprint (custom_bool(""hello""))\nprint (custom_bool([]))\nprint (custom_bool([1]))\nprint (custom_bool(None))"
B25EE035.Q4,0,10,0.00,<output>It seems like you're missing the import statement for the `B25EE035` module. Make sure to add `from B25EE035 import *` at the top of your code.</output>,"\n""""""\nEmulate Python’s built-in bool() without calling it. Return\nFalse for None,\nnumeric zeros (e.g. 0, 0.0), and empty sequences or\ncollections (e.g. ’’, []),\nand True otherwise.\n""""""\ndef custom_bool(value):\n    if value is None:\n        return False\n    elif isinstance(value,(int,float,complex)):\n        if value==0:\n            return False\n        else:\n            return True\n    elif isinstance(value,(str,tuple,dict,list,set)) and len(value)==0:\n        return False\n    else:\n        return True\n\nprint(custom_bool(0)) \nprint(custom_bool(1))\nprint(custom_bool("""")) \nprint(custom_bool(""hello""))\nprint(custom_bool([]) )\nprint(custom_bool([1]))\nprint(custom_bool(None))\n"
B25MT021_q4,0,10,0.00,<output>Consider adding explicit `not` operator before each condition when combining boolean values to ensure correct order of operations.</output>,"def custom_bool(value):\n    if value is None:\n        return False\n    elif value == 0 or value == 0.0:\n        return False\n    elif value == """" or value == [] or value == ():\n        return False\n    else:\n        return True\nprint(custom_bool(0))\nprint(custom_bool(1))\nprint(custom_bool(""""))\nprint(custom_bool(""hello""))"
B25EC021_q4,5,10,50.00,"<output>Consider adding explicit `or` conditions to combine multiple checks for different value types, as your current implementation only checks one type at a time.</output>",def custom_bool(value):\n    if type(value) == (int or float):\n        if value !=0 : return True\n        else : return False\n    elif type(value) == (list or tuple or set or dict or str):\n        if len(value) != 0 : return True\n        else : return False\n    elif type(value) == bool:\n        return value\n    elif value == None :\n        return False\n    \n# print(custom_bool(None))\n
s25ma008_q4,0,10,0.00,<output>Consider using Python's built-in `bool()` function as a starting point for your implementation instead of manually checking types and values.</output>,"def custom_bool(v):\n    """"""Emulate Python’s built-in bool() without calling it. Return False for None,\n    numeric zeros (e.g. 0, 0.0), and empty sequences or collections (e.g. ’’, []),\n    and True otherwise.""""""\n    if type(v)==float:\n        if v!=0.0:\n            return True\n        else:\n            return False\n    elif type(v)==str:\n        if v!="""":\n            return True\n        else:\n            return False\n    elif type(v)==list:\n        if v!=[]:\n            return True\n        else:\n            return False\n    if type(v)==int:\n        if v!=0:\n            return True\n        else:\n            return False\n    else:\n        return False\nprint(custom_bool(0))\nprint(custom_bool(1))\nprint(custom_bool(""""))\nprint(custom_bool(""hello""))\nprint(custom_bool([]))\nprint(custom_bool([1]))\nprint(custom_bool(None))"
q4(B25MM016),0,10,0.00,"<output> The function `custombool` should be defined as a class method instead of a regular function to make it accessible from other classes in the same module, because Python looks for functions with the same name but different modules. </output>","def custombool(value):\n    if value in ("""",0,[],{},(),0.0):\n        return False\n    else:\n        return True\n\nprint(custombool(0))\nprint(custombool(12))\nprint(custombool(""kamal""))"
B25ME012_q4,0,10,0.00,<output>Consider adding explicit `not` before each condition to ensure correct logical order and avoid potential issues with short-circuiting behavior.</output>,"def custom_bool(value):\n    if(value==0 or value=='' or value==[] or value==None or value=={}):\n        return False\n    else:\n        return True\nprint(custom_bool(0))\nprint(custom_bool(1)) \nprint(custom_bool(""""))\nprint(custom_bool(""hello""))\nprint(custom_bool([]))\nprint(custom_bool([1]))\nprint(custom_bool(None))\nprint(custom_bool({})) \n"
B25DS018_q4,0,10,0.00,"<output> The issue lies in the order of conditional checks. Currently, you're checking for `None` and then for zero values, but it's more logical to check if the value is not zero first, before considering it as a boolean value. </output>","def custom_bool(value):\n    if type(value)!=int or (value==0) or (value==0.0):    # Return False for zero, None, empty string, or empty collections\n        \n        if (value==0) or (value==0.0):\n            return False\n        elif value is None:\n            return False\n        elif len(str(value))==0:\n            return False\n        elif len(value)==0:\n            return False\n        else:\n            return True\n    else:\n        return True\n    pass\n\nprint(custom_bool(0))\n\n#alternate code\n'''def custom_bool(value):\n    if value:\n        return True\n    else:\n        return False\n    \n    pass\nprint(custom_bool(0))'''"
B25DS024_Q4,0,10,0.00,"<output>Use `not` instead of `==` for negating values to avoid reassigning to `m`. For example, use `if not m == 0 or not m == 0.0 or ...`, which correctly checks if the value is not equal to zero.</output>","def custom_bool(value):\n    m = value\n    if m == 0 or m==0.0 or m =='' or m =="""" or m ==[] or m =={} or m ==() or m ==None or m == empty :\n        return False\n    else:\n        return True\n    \nprint(custom_bool(()))"
B25EE029_q4,9,10,90.00,<output>Consider adding explicit checks for numeric zeros and empty sequences to ensure consistent behavior for all input types.</output>,def custom_bool(value):\n    if value:\n        return True\n    else:\n        return False
B25CS011_q4,9,10,90.00,"<output> The issue lies in the fact that you're using `int(value) == 0` to check for numeric zeros, which will return `True` for non-integer numeric values. Instead, use `type(value) == float` and then check if `value` is zero. </output>","def custom_bool(value):\n    """"""here using the len function covered all of the empty lists\n       tuples sets part""""""\n    if type(value) == int or type(value) == float:\n        if int(value) == 0:\n            return False\n        else:\n            return True\n    elif value == None:\n        return False\n    elif len(value)==0:\n        return False\n    else:\n        return True\n\n\n"
B25EC028_Q4,0,10,0.00,"<output>Consider using the `not` operator to negate values instead of directly comparing them with `False`, as this can lead to implicit type conversions and incorrect results.</output>","def custom_bool(value):\n    t=type(value)\n    if(t==float):\n        if(value==0.0):\n            return False\n        else:\n            return True\n    elif(value==None or False):\n        return False\n    elif(t==int):\n        if(value==0):\n            return False\n        else:\n            return True\n    else:\n        if(len(value)==0):\n            return False\n        else:\n            return True\nprint(custom_bool(0))\nprint(custom_bool(1))\nprint(custom_bool(""""))\nprint(custom_bool(""hello""))\nprint(custom_bool([]))\nprint(custom_bool([1]))\nprint(custom_bool(None))"
B25MT029_Q4,6,10,60.00,"<output> Consider using Python's built-in `bool()` function to create the custom_bool function, as its implementation is already optimized for various edge cases.</output>","def custom_bool(n):\n    if n == 0 or n == """" :\n        return False\n    else:\n        return True\n        \n    "
B25CS023_q4,9,10,90.00,"<output> Consider using Python's built-in `bool()` function for comparison with `value`, as directly comparing with numeric values can lead to unexpected results due to floating-point precision issues.</output>","def custom_bool(value):\n    """"""\n    Emulate Python's built-in bool() without calling it. Return False for None,\n    numeric zeros (e.g. 0, 0.0), and empty sequences or collections (e.g. '', []),\n    and True otherwise.\n    """"""\n    if(value==0 or value==[] or value=="""" or value==None or value==() or value=={} or value==0.0):\n        return False\n    else:\n        return True\n    "
B25EC030_q4,9,10,90.00,"<output> The function should use the 'or' operator to combine its conditional checks, instead of separate 'if' statements, which can lead to incorrect results when evaluating nested boolean expressions.</output>","def custom_bool(x):\n    \n    # Check for None\n    if x is None:\n        return False\n    \n    # Check for numeric zero\n    if isinstance(x, (int, float)) and x == 0:\n        return False\n        \n    # Check for empty sequences or collections that have a length\n    \n    if hasattr(x, '__len__') and len(x) == 0:\n        return False\n        \n    \n    return True\n\n"
B25MT004_Q4,0,10,0.00,<output>Consider adding the `not` operator to your conditionals to correctly negate values and avoid potential issues with implicit boolean conversions.</output>,"def custom_bool(value):\n    if (value== 0 or value=="""" or value=='' or value==[] or value==() or value=={} or value==None ):\n        return False\n    else:\n        return True\nprint(custom_bool(0))\nprint(custom_bool(1))\nprint(custom_bool(""""))\nprint(custom_bool(""hello""))\nprint(custom_bool([]))\nprint(custom_bool([1]))\nprint(custom_bool(None))\n\n\n        "
B25EC041_q4,0,10,0.00,<output> The variable 'x' is used without being defined within the function scope; consider replacing it with the input value 'value'. </output>,"def custom_bool(value):\n    return not(x==[] or x==() or x=={} or x=="""" or x==set() or x==False or x==0 or x==None)"
B25DS017_q4,0,10,0.00,"<output>Consider using the 'not' operator to negate the condition instead of directly comparing values with '=='. For example, `return True if value != (False or None)`.</output>","def custom_bool(value):\n    if (value== 0 or value=="""" or value=='' or value==[] or value==() or value=={} or value==None ):\n        return False\n    else:\n        return True\nprint(custom_bool(0))\nprint(custom_bool(1))\nprint(custom_bool(""""))\nprint(custom_bool(""hello""))\nprint(custom_bool([]))\nprint(custom_bool([1]))\nprint(custom_bool(None))\n\n\n        "
B25MM007_q4,9,10,90.00,"<output> The issue lies in the incorrect use of `or` instead of `and` to combine multiple conditions. For example, checking if `value` is not equal to an empty string and also not equal to zero should be done using `and`, not `or`. </output>","def custom_bool(value):\n    """"""\n    Beginner style version of bool()\n    """"""\n    # check for None\n    if value == None:\n        return False\n    elif value == 0 or value == 0.0:\n        return False\n    elif value == """":\n        return False\n    elif value == []:\n        return False\n    elif value == ():\n       return False\n    elif value == {}:\n        return False\n    elif value == set():\n        return False\n    return True"
B25EE056_Q4,0,10,0.00,"<output>Consider adding explicit `or` conditions to handle cases where multiple types need to be checked for falsey values, such as `value == 0 or value == ''`, to ensure accurate boolean evaluation.</output>","def custom_bool(value):\n    if type(value)==str:\n        if value==' ':\n            return False\n        else:\n            return True\n    elif type(value)==int or type(value)==float:\n        if value==0:\n            return False\n        else:\n            return True\n    elif value==None or value==[]:\n        return False\n    else:\n        return True\n        \nprint(custom_bool(0))\nprint(custom_bool(1))\nprint(custom_bool("" ""))\nprint(custom_bool(""hello""))\nprint(custom_bool([]))\nprint(custom_bool([1]))\nprint(custom_bool(None))\n"
B25CS007_Q4,6,10,60.00,"<output>Try using the `in` operator to check if the value is in the list of falsy values, instead of iterating over them.</output>","def custom_bool(value):\n    wrong=('',"""",0,[],{},range(0),frozenset(),set())\n    for value in wrong:\n        return False\n    else:\n        return True\n    \n"
B25ME013_q4,0,10,0.00,"<output> The function should use the `not` operator to negate the value instead of directly assigning it to `check`, as this would always return `True` for non-zero values, but also include `None` and empty collections in the `True` category. </output>","def custom_bool(value):\n    check=True\n    if(value==0 or value==0.0 or value==[] or value==None or value==""""):\n        check=False\n    \n    return check\nprint(custom_bool(0))\nprint(custom_bool(1))\nprint(custom_bool(""""))\nprint(custom_bool(""hello""))\nprint(custom_bool([]))\nprint(custom_bool([1]))\nprint(custom_bool(None))"
B25MM002 q4,8,10,80.00,"<output> Consider using Python's built-in `bool()` function directly instead of manually implementing it, as this approach simplifies the logic and reduces potential errors. For example, you can use `bool(value)` to achieve the desired behavior. </output>","def custom_bool(value):\n    """"""\n    Emulate Python's bool() without calling it.\n    """"""\n    if value is None or value == 0 or value == 0.0 or value == '' or value == []:\n        return False\n    return True\n"
B25ME050_q4,0,10,0.00,<output>Consider using the `not` operator to negate the condition instead of directly returning `True` for all other values.</output>,"def custom_bool(value):\n    if value is None:\n        return False\n    elif value == 0 or value == 0.0 or value == """" or value == [] or value ==() or value == {} or value == set():\n        return False\n    else:\n        return True\nprint(custom_bool(0))\nprint(custom_bool(1))\nprint(custom_bool(""""))\nprint(custom_bool(""hello""))\nprint(custom_bool([]))\nprint(custom_bool([1]))\nprint(custom_bool(None))"
B25MM013_q4,0,10,0.00,<output> Consider using Python's built-in `bool()` function as a reference to ensure accurate handling of boolean values with different data types and edge cases.</output>,"#Custom Boolean Function\ndef custom_bool(value):\n    t=type(value)\n    if(t==int):\n        if(value==0):\n            return False\n        else:\n            return True\n    elif(t==float):\n        if(value==0.0):\n            return False\n        else:\n            return True\n    elif(value==None or False):\n        return False\n    else:\n        if(len(value)==0):\n            return False\n        else:\n            return True\nprint(custom_bool(0))\nprint(custom_bool(1))\nprint(custom_bool(""""))\nprint(custom_bool(""hello""))\nprint(custom_bool([]))\nprint(custom_bool([1]))\nprint(custom_bool(None))"
B25MT027_q4,3,10,30.00,<output>Check if you're correctly handling the cases for numeric zeros and empty collections. Make sure to return False immediately when encountering these values.</output>,"def custom_bool(value):\n    if(value==' '):\n        return False\n    else:\n        value=float(value)\n        if(value==False):\n            return False\n        else:\n            return True\n'''value=input('Enter anything')\nprint(custom_bool(value))'''\n""""""\nEmulate Python’s built-in bool() without calling it. Return False\nnumeric zeros (e.g. 0, 0.0), and empty sequences or collections (\nand True otherwise.\n""""""\npass\n"
B25DS014_q4,8,10,80.00,<output>Consider using Python's built-in `bool()` function as a comparison for your custom_bool function to ensure accurate boolean values.</output>,def custom_bool(value):\n    m=True\n    if type(value)==int or type(value)==float:\n        if int(value)==0:\n            m=False\n    elif value==None:\n        m=False\n    elif type(value)==list or type(value)==tuple or type(value)==str:\n        if len(value)==0:\n            m=False\n    return m
B25ME038_Q4,0,10,0.00,"<output>Consider using logical operators (`and`, `or`) instead of separate `if` statements to improve readability and avoid potential issues with the order of operations.</output>","value = ""hello""\n\nif value is None:\n    print(False)\nelif value == 0 or value == 0.0:\n    print(False)\nelif value == """" or value == [] or value == ():\n    print(False)\nelse:\n    print(True)\n"
B25EE054_q4,9,10,90.00,<output>Consider using Python's built-in `bool()` function directly instead of manually implementing it to avoid potential edge cases and ensure correct behavior for all possible input types.</output>,"def custom_bool(value):\n    if value == 0 or value == 0.0 :\n        return False\n    elif value == """" or value == [] or value == () or value == {} or value == set():\n        return False\n    elif value is None:\n        return False\n    else:\n        return True"
<B25CS024>_q4,0,10,0.00,"<output> The issue lies in the fact that `print` statements return `None`, which is considered False in Python's boolean context. You should modify your function to return a string instead of printing it, and use the `return` statement to make the output more explicit. </output>","def custom_bool(n):\n    if n:\n        print(""True"")\n    else:\n        print(""False"")\n\ncustom_bool(0)\ncustom_bool(1)\ncustom_bool('')\ncustom_bool(""hello"")\ncustom_bool([])\ncustom_bool([1])\ncustom_bool(None)"
B25CS022_q4,9,10,90.00,"<output> The issue lies in the incorrect use of parentheses around some values, which can lead to unexpected grouping and alter the intended boolean logic. For example, `value == 0` should be `value == 0`, not `value == 0()` or `value == []()`. Ensure correct spacing around operators for accurate results.</output>","def custom_bool(value):\n    """"""\n    Emulate Python's built-in bool() without calling it. Return False for None,\n    numeric zeros (e.g. 0, 0.0), and empty sequences or collections (e.g. '', []),\n    and True otherwise.\n    """"""\n    if(value==0 or value==[] or value=="""" or value==None or value==() or value=={} or value==0.0):\n        return False\n    else:\n        return True"
(B25DS042)_(Q4),0,10,0.00,"<output>Consider using the 'or' operator to chain multiple conditions together instead of nesting them with 'if', as this can lead to incorrect results when dealing with boolean values.</output>","def custombool(value):\n    \n    if value == 0 or value == 0.0:\n        return False\n    elif value in ([], {}, """", (), set()):\n        return False\n    elif value is None:\n        return False\n    else:\n        return True\n\n\n\nprint(custombool(0))   \n"
B25EC015.q4,0,10,0.00,"<output> The issue lies in the incorrect use of `type(n) == float or type(n) == int`, which should be `type(n) in (float, int)` to correctly check for both types. Additionally, the condition `n * 2 == 0` is unnecessary and can lead to incorrect results for non-integer values. </output>",def costum_bool(n):\n	if type(n)==float or type(n)==int:\n		if n*2==0:\n			return False\n		return True\n	elif n==None:\n		return False\n	elif len(n)==0:\n		return False\n	else:\n		return True\n		\n		
B25ME045_q4,5,10,50.00,"<output> The issue lies in the line `if type(value) in (list, tuple, set) and len(value == 0):`, where you're trying to apply the length check to a boolean value (`value == 0`), which is incorrect. Instead, use `len(value)` directly. </output>","def custom_bool(value):\n    if value == None :\n        return False\n    if type(value) in (int,str,float) and value==0 :\n        return False\n    if type(value) in (list,tuple,set) and len(value==0) :\n        return False\n    else :\n        return True\n    \n    "
B25MT024_q4,0,10,0.00,"<output> Check for missing `and` keyword when combining conditions. For example, `if value == 0 and len(value) > 0`, instead of `if value == 0 or len(value) == 0`. </output>","def custom_bool(value):\n    if value is None:\n        return False\n    if value==0:\n        return False\n    if len(value)==0:\n        return False\n    else:\n        return True\n    \nprint(custom_bool(0))   #False\nprint(custom_bool(1))   #True\nprint(custom_bool(""""))  #False\nprint(custom_bool(""hello""))  #True\nprint(custom_bool([]))   #False\nprint(custom_bool([1]))  #True\nprint(custom_bool(None))  #False\n"
B25MT006_q4,0,10,0.00,"<output> The issue lies in the order of operations for the `bool()`-like function. Currently, it checks if the value is `False` first and then returns `True` for any other value. However, according to Python's built-in `bool()`, you should check for truthiness (i.e., non-zero numeric values, non-empty collections) before checking for falsiness. </output>","# q4\n\ndef custom_bool(value):\n    if value is None:\n        return False\n\n    if value == 0 or value == 0.0:\n        return False\n\n    if value == """" or value == [] or value == () or value == {}:\n        return False\n\n    return True\n\n\n\nprint(custom_bool(0))     \nprint(custom_bool(1))       \nprint(custom_bool(""""))      \nprint(custom_bool(""hello"")) \nprint(custom_bool([]))      \nprint(custom_bool([1]))     \nprint(custom_bool(None))    "
