student_id,tests_passed,tests_total,score_percentage,semantic_summary,code_snippet
B25CS021_q4,4,10,40.00,<output>Use the `in` operator to check if the value is present in the dictionary instead of comparing it directly with other values.</output>,"def custom_bool(value):\n    d=dict()\n    d[""""]=False\n    d['False']=False\n    d['0']=False\n    d['None']=False\n    d['0.0']=False\n    d[""[]""]=False\n    d[""()""]=False\n\n    if value not in d:\n        return True\n    else:\n        return False\n\n\n\n"
MandeepRewar_B25DS021_q4,9,10,90.00,"<output>Consider adding explicit boolean values to your conditionals instead of using `None` and `False`, as this can lead to implicit type conversions that might not be immediately apparent.</output>","# Mandeep Rewar - B25DS021\n# Problem 4 - custom boolean evaluator (without calling bool())\nfrom typing import Any\n\ndef custom_bool(value: Any) -> bool:\n    """"""Emulate Python's truthiness rules without calling bool().\n\n    Rules used (subset of Python behaviour):\n    - None and False are falsy.\n    - Numeric zero (0, 0.0, 0j) is falsy.\n    - Empty sequences/collections (len == 0) are falsy.\n    - Everything else is truthy.\n    """"""\n    # None and exact False are falsy\n    if value is None or value is False:\n        return False\n\n    # Numeric zeros: int, float, complex\n    try:\n        # For complex numbers, .real == 0 and .imag == 0 indicates zero\n        if isinstance(value, (int, float, complex)) and value == 0:\n            return False\n    except Exception:\n        pass\n\n    # Objects with length: empty is falsy\n    try:\n        length = len(value)  # type: ignore\n        if length == 0:\n            return False\n    except TypeError:\n        # If object has no len(), ignore\n        pass\n\n    return True\n\nif __name__ == ""__main__"":\n    assert custom_bool([]) is False\n    assert custom_bool([1]) is True\n    assert custom_bool(0) is False\n    assert custom_bool(0.0) is False\n    assert custom_bool(None) is False\n    assert custom_bool('') is False\n"
B25MT018_q4,6,10,60.00,"<output> Consider adding an 'or' condition to handle cases where `value` is neither empty nor zero, as the current implementation only checks for emptiness and zeros, but not other types of falsy values like empty collections or falsey strings. </output>","def custom_bool(value):\n    if value in ["""",0]:\n        return False\n    return True\n"
B25EC029.q4,0,10,0.00,"<output> The student's code is attempting to compare the input value with multiple values in a list using `in`, which is incorrect. Instead, they should use separate comparisons for each condition, such as `if value not in [0, 0.0, ' ', [], None]:`. </output>","def custom_bool(value):\n     list=[0,0.0,"" "",[ ],None]\n     for item in list:\n          if value in list:\n              return False\n          else:\n              return True\n     \n     \nprint(custom_bool(0))\nprint(custom_bool(1))\nprint(custom_bool("" ""))\nprint(custom_bool(""hello""))\nprint(custom_bool([ ]))\nprint(custom_bool([1]))\nprint(custom_bool(None))\n    "
B25EC003_Q4,8,10,80.00,"<output>Consider using `not` instead of `in` to check for the falsy values, as it directly negates the boolean value and avoids potential issues with list membership.</output>","def custom_bool(value):\n	if value in [float(0),"""",[],None]:\n		return False\n	else:\n		return True\ncustom_bool(0)\ncustom_bool(1)\ncustom_bool("""")\ncustom_bool([])\ncustom_bool(""hello"")\ncustom_bool([1])\ncustom_bool(None)"
B25DS022_Q4,0,10,0.00,<output>Consider adding explicit `not` operator before combining boolean values with `and` and `or` to ensure correct logical flow.</output>,"def custom_bool(value):\n    if value in [0, 0.0, 0j,"""", None, (), [], {}, set()]:\n        return False\n    return True\npass\nprint(custom_bool(0))"
B25EE015_Q4,0,10,0.00,"<output> The issue lies in the order of operations for the `bool` function. In Python, the `bool()` function uses the following precedence: not (negation), and (conjunction), or (disjunction). However, your code is using a different order, which might lead to incorrect results for certain inputs.</output>","""""""\nFalse for None,\nnumeric zeros (e.g. 0, 0.0), and empty sequences or\ncollections (e.g. ’’, []),\nand True otherwise.\n""""""\ndef custom_bool(value):\n    if value is None:\n        return False\n    elif isinstance(value,(int,float,complex)):\n        if value==0:\n            return False\n        else:\n            return True\n    elif isinstance(value,(str,tuple,dict,list,set)) and len(value)==0:\n        return False\n    else:\n        return True\n\nprint(custom_bool(0)) \nprint(custom_bool(1))\nprint(custom_bool("""")) \nprint(custom_bool(""hello""))\nprint(custom_bool([]) )\nprint(custom_bool([1]))\nprint(custom_bool(None))\n"
B25DS025_q4,9,10,90.00,"<output> The issue lies in the use of `range(0)` as a falsy value. In Python, an empty range is considered falsey, but a single-element range (like `range(1)`) would be truthy. </output>","def custom_bool(value):\n    """"""\n    Emulate Python’s built-in bool() without calling it. Return\n    False for None,\n    numeric zeros (e.g. 0, 0.0), and empty sequences or\n    collections (e.g. ’’, []),\n    and True otherwise.\n    """"""\n    false_bools = ([],(),{},set(),range(0),'',0,False,None) # defining a set of False or empty sequences.\n    \n    if value in false_bools: # checking whether value lies in the false_bool tuple.\n        return False\n    \n    else:\n        return True # return True for any other sequence or element."
B25ME007_q4,8,10,80.00,"<output> The issue lies in the combination of conditions using `or` and `not`, which can lead to incorrect results when evaluating boolean values. For example, if `value` is an integer, `custom_bool(value)` will return `True` for non-zero integers due to the `else: return True` clause. However, this may not be the intended behavior, as it doesn't account for cases where `value` is a boolean value itself.</output>","def custom_bool(value):\n    if type(value) ==int or type(value) ==float:\n        if value==0:\n            return False\n        else:\n            return True\n    if type(value) in [str,list,tuple,dict,set]:\n        if len(value)==0:\n            return False\n        else:\n            return True\n    return True\ncustom_bool('')\ncustom_bool(0)\ncustom_bool([27])\ncustom_bool({})\n"
B25DS034_q4,0,10,0.00,"<output> The student's code is missing explicit boolean operators to combine conditions correctly, leading to potential incorrect results when evaluating complex values like lists or dictionaries.</output>","\ndef custom_bool(value):\n    if value is None:\n        return False\n\n    try:\n        if value == 0:\n            return False\n    except:\n        pass\n\n    try:\n        if len(value) == 0:\n            return False\n    except:\n        pass\n\n    return True\n\n\n# Test Cases:\nprint(custom_bool(0)) # False\nprint(custom_bool(1)) # True\nprint(custom_bool("""")) # False\nprint(custom_bool(""hello"")) # True\nprint(custom_bool([])) # False\nprint(custom_bool([1])) # True\nprint(custom_bool(None)) # False"
B25EC020_Q4,0,10,0.00,"<output> Consider adding explicit checks for numeric values and sequences using their respective comparison methods (`!=` for numbers and `!=` for sequences), as the current implementation only checks if the value is present in a predefined list, which may not cover all possible cases.</output>","###########################################################\n#NAME: Kammuri Lok Prakash Chowdary\n#ID NO: B25EC020\n#Discipline: Electronics and Communication Engineering\n#institute Name: Indian Institute of Technology Bhilai\n#######################################################################################\n\ndef custom_bool(value):\n    list1=[0,'',"""",[],(),{},' ',None]\n    if value in list1:\n        return False\n    else:\n        return True\nprint(custom_bool(None))"
B25MM017.q4,0,10,0.00,"<output>Consider combining your conditional checks using the `not` operator to negate each condition before applying it to the result of the function, which should improve the overall logic and avoid potential issues with short-circuiting.</output>","def custom_bool(value):\n    if value == 0 or value == 0.0:\n        return False\n    if value == """" or value == [] or value == () or value == {}:\n        return False\n    if value is None:\n        return False\n    return True\n\n\n# testing\nprint(custom_bool(0))     # False\nprint(custom_bool(1))     # True\nprint(custom_bool(""""))    # False\nprint(custom_bool(""hi""))  # True\nprint(custom_bool([]))    # False"
B25ME043_q4,0,10,0.00,"<output> Check if you're using 'or' instead of 'and' for combining conditions, as this would cause the function to incorrectly return True for values that should be False.</output>","def custom_bool(value):\n    if value is None:\n        return False    \n    if isinstance(value,(int, float)):\n        if value == 0:\n            return False\n    s = str(value)\n    if len(s) == 0:\n        return False\n    else :\n        return True\nprint(custom_bool(0))\nprint(custom_bool(1))\nprint(custom_bool(""""))\nprint(custom_bool(""hello"")) "
B25MT016_q4,1,10,10.00,<output>Import the `numbers` module to fix the NameError.</output>,"def custom_bool(value: object) -> bool:\n    """"""\n    A custom version of Python's bool().\n    Rules:\n      - None, 0, 0.0, 0j → False\n      - Empty list, tuple, string, dict, etc. → False\n      - Everything else → True\n    """"""\n    if value is None:\n        return False\n    if isinstance(value, numbers.Number):\n        return value != 0\n    if hasattr(value, ""_len_""):\n        return len(value) > 0\n    return True\n"
B25DS030_q4,0,10,0.00,"<output> Verify that the `a` variable is being converted from a numeric value to a string, and then back to a number when calculating `count`, as this could lead to unexpected results due to type mismatch.</output>","def check_armstrong(n):\n    """"""Checks if a 3-digit number is an Armstrong number.\n    An Armstrong number is one where the sum of its digits\n    cubed equals the number itself (e.g., 153 = 1ˆ3 + 5ˆ3 + 3ˆ3).\n    Prints an error for non-3-digit numbers.\n    Returns True if it is an Armstrong number, False otherwise.""""""\n    a=str(n)\n    count=0\n    if len(a)==3:\n        for i in a:\n            count+=(int(i))**3\n        if count==n:\n            print(True)\n        else:\n            return False\n    else:\n        print(""Error: Not a 3-digit number."")\n        return False        "
B25EE009_q4,0,10,0.00,"<output>Consider using the bitwise NOT operator (~) to implement `not` instead of directly comparing values, as this can help avoid potential issues with floating-point numbers and boolean comparisons.</output>","value=eval(input(""enter""))\ndef custom_bool(value):\n    if value in ([],"" "",0,0.0,(),{}):\n        return False\n    else:\n        return True\nh=custom_bool(value)\nprint(h)"
B25CS030_q4,9,10,90.00,"<output>Consider adding explicit `or` conditions for each type of value that should return False, to avoid relying on the implicit truthiness of certain types.</output>","#custom Boolean Function\n\ndef custom_bool(value):\n    if value is None:\n        return False\n    if isinstance(value, (int, float)) and value==0:\n        return False\n    if isinstance(value, (str, list, tuple, dict)) and len(value) == 0:\n        return False\n    else:\n        return True\n    \n    \n    "
B25CS054_q4,9,10,90.00,"<output> The issue lies in the order of your conditional checks; you're setting `boolean` to `True` by default and then immediately toggling it when any of the specified values are encountered, which is the opposite of what you want. Change `boolean = True` to `boolean = False` for a correct implementation. </output>","def custom_bool(value):\n\n    boolean = True # Assumes boolean to be true\n\n    # changes boolean to false in required cases\n    if value==0 or value==[] or value=="""" or value=={} or value==() or value==None:\n        boolean = False\n    \n    return boolean\n\n"
B25ME003_q4,9,10,90.00,"<output>Consider using the 'in' operator with sets of values to simplify your conditional checks, and avoid assigning values to variables that will be used as boolean conditions.</output>","def custom_bool(x):\n    f=0\n    if x in [[],{},'',None,0]:\n        f=1\n    else:\n        f=0\n    if f==0:\n        print(""True"")\n    elif f!=0:\n        print(""False"")\n    \n"
B25DS004_q4,8,10,80.00,"<output>Check for `None` before evaluating its length, as `len(None)` raises a `TypeError`. Use the conditional expression syntax to simplify the logic.</output>","def custom_bool(value):\n    try:\n        m = int(value)\n    except ValueError :\n        if len(value)== 0:\n            return(""False"")\n        else:\n            return(""True"")\n    except TypeError :\n        if len(value)== 0:\n            return(""False"")\n        else:\n            return(""True"")\n    else:\n        if m == 0:\n            return(""False"")\n        else:\n            return(""True"")\n        \n\n""""""\nFirst i picked out possible integers from value by using try and except\nThe value which had error must be string, list or something else\nfor which len can be used, so i put condition on it\nif len is 0, it will return false else true.\n"""""""
B25EE026_Q4,8,10,80.00,"<output> The issue lies in combining boolean values with numeric types using `len()` function which is applicable to sequences, not numbers. Instead, use the fact that `True` and `False` can be represented as integers (`1` and `0`) when used in a conditional statement. </output>",#WAP to give bool output\ndef custom_bool(value):\n    if value==None:#check for None\n        return False\n    elif value==0 or len(str(value))==0 or len(value)==0:#check for 0 or '' or []\n        return False\n    else:\n        return True
B25ME033_Q4,9,10,90.00,"<output> The issue lies with the order of conditions in the `if` statement; it should be `or` instead of `and`, as you want to return `False` when any of the conditions are met, not just all of them. </output>","def custom_bool(value):\n    if value==0 or value==0.0 or value=='' or value=="""" or value==() or value==[] or value=={} or value==None:\n        return False\n    else:\n        return True\ncustom_bool(0)\ncustom_bool(1)\ncustom_bool("""")\ncustom_bool(""hello"")\ncustom_bool([])\ncustom_bool([1])\ncustom_bool(None)"
B25ME018_q4,9,10,90.00,"<output> Consider adding explicit `or` conditions to handle the cases where `value_type` is one of the numeric types and `value` equals zero, as well as when `value_type` is a string and `value` equals an empty string. </output>","def custom_bool(value):\n    """"""\n    Emulate Python’s built-in bool() without calling it. Return\n    False for None,\n    numeric zeros (e.g. 0, 0.0), and empty sequences or\n    collections (e.g. ’’, []),\n    and True otherwise.\n    """"""\n    if value is None:\n        return False\n    value_type = type(value)\n    if value_type in (int,float,complex):\n        if value==0:\n            return False\n    elif value== '' or value== """" or value== [] or value== () or value== {}:\n        return False\n    return True"
B25EE049_Q4,9,10,90.00,"<output> The issue lies in the incorrect use of `in` operator for checking empty sequences and collections. Instead, you should check if the value is equal to an empty sequence or collection using the `==` operator, as shown below: `if value == '' or value == [] or value == {} or value == 0 or value == None:`</output>","def custom_bool(value):\n    """"""\n    Emulate Python’s built-in bool() without calling it. Return False numeric zeros (e.g. 0, 0.0), and empty sequences or collections (and True\n    otherwise.\n    \n    """"""\n    if value in ["""",[],{},0,None]:\n        return False\n    else:\n        return True"
B25EC032_ABHISHEK UJVAL_Q4,0,10,0.00,<output>Consider adding explicit boolean values for numeric zeros and empty collections to improve code readability and avoid potential issues with floating-point comparisons.</output>,"def custom_bool(value):\n    """"""Emulate Python’s built-in bool() without calling it. Return False\n       numeric zeros (e.g. 0, 0.0), and empty sequences or collections \n       and True otherwise""""""\n    if  value=="""" or value==0 or value==[] or value==() or value=={}:\n        return False\n    else:   #any value\n        return True\n    \n    \nprint(custom_bool(0))\nprint(custom_bool(1))\nprint(custom_bool(""""))\nprint(custom_bool(""hello""))\nprint(custom_bool([]))\nprint(custom_bool(0.0000000))\nprint(custom_bool(None))\n\n\n"
B25MT020_Q4,0,10,0.00,<output> Consider using Python's built-in `bool()` function instead of manually checking for specific types and values. This approach can simplify the code and reduce potential errors due to incorrect handling of edge cases.</output>,"def custom_bool(value):\n    """"""\n    Emulate Python’s built-in bool() without calling it.\n    Return False for None, numeric zeros, and empty sequences/collections.\n    Return True otherwise.\n    """"""\n    # Check for None\n    if value is None:\n        return False\n\n    # Check for numeric zeros\n    if isinstance(value, (int, float, complex)) and value == 0:\n        return False\n\n    # Check for empty sequences or collections\n    if isinstance(value, (str, list, tuple, dict, set, range)) and len(value) == 0:\n        return False\n\n    # Otherwise, it's truthy\n    return True\nprint (custom_bool(0))"
B25EC039_q4,9,10,90.00,"<output>Consider modifying your function to utilize Python's built-in `bool()` behavior when applied to individual values using the `and` and `or` operators, rather than directly comparing the input value to a list of falsy values.</output>","def custom_bool(value):\n    lst=[0,"""",'',None,False,[],{},set(),()]\n    if value in lst:\n        return False\n    else:\n        return True\ncustom_bool(0) # False\ncustom_bool(1) # True\ncustom_bool("""") # False\ncustom_bool(""hello"") # True\ncustom_bool([]) # False\ncustom_bool([1]) # True\ncustom_bool(None) # False\n"
B25DS013_Q4,0,10,0.00,"<output> You should use `and` instead of `or` to combine your conditional checks, as `or` would short-circuit and return immediately if the first condition is met, whereas you want all conditions to be evaluated before returning a result. </output>","def Custom_bool(value):\n    S=0\n           \n    if value==None or value==0 or value=="" "" or value==[]:\n        print(""False"")\n    else:\n        print(""True"")    \nCustom_bool(0)\nCustom_bool(1)\nCustom_bool("" "")\nCustom_bool(""hello"")\nCustom_bool([])\nCustom_bool([1])\nCustom_bool(None)\n        "
B25CS045_Q4,0,10,0.00,"<output> Check if you're using `==` for value comparison instead of `is`. In Python, `0` and `0.0` are considered equal to other numbers with the same value, not just zero. For example, `custom_bool(5) == custom_bool(5)` returns `True`, which is incorrect according to your requirements.</output>","def custom_bool(value):\n    """"""Emulate Python’s built-in bool() without calling it. ReturnFalse for None,numeric zeros (e.g. 0, 0.0), and empty sequences orcollections (e.g. ’’, []),and True otherwise.""""""\n    if value is None:\n        return False\n    if isinstance(value, (int, float)) and value == 0:\n        return False\n    if isinstance(value, (str, list, tuple, set, dict)) and len(value) == 0:\n        return False\n    return True\ntest_values = ([""hello""])\nfor val in test_values:\n    print(f""custom_bool({repr(val)}) => {custom_bool(val)}"")"
B25ME002_q4,9,10,90.00,"<output> Consider using Python's built-in `bool()` function directly instead of manually implementing it, as this would simplify the code and avoid potential logical flaws with conditional combinations.</output>","def custom_bool(value):\n    if(value=="""" or value==0.0 or value==[] or value==0 or value=='' or value==None or value==() or value == {}):\n        return False\n    else:\n        return True\n\n\n        "
B25EC014_q4,9,10,90.00,"<output> Consider using Python's built-in `bool()` function directly instead of implementing your own logic for boolean values, as it already handles the edge cases correctly and is less prone to errors.</output>","def custom_bool(value):\n    """"""\n    Emulate Python’s built-in bool() without calling it. Return\n    False for None,\n    numeric zeros (e.g. 0, 0.0), and empty sequences or\n    collections (e.g. ’’, []),\n    and True otherwise.\n    """"""\n    if type(value)==int or type(value)==float:\n        if float(value)==0.0:\n            return False\n        else:\n            return True\n    elif value==None:\n        return False\n    else:\n        if len(list(value))==0:\n            return False\n        else:\n            return True"
S25MA018_q4,0,10,0.00,<output>Consider adding explicit 'or' operator between all conditions to ensure correct logical combination of conditions.</output>,"def custom_bool(value):\n    if value == 0 or value == 0.0 or value =='' or value =="""" or value ==[] or value ==() or value == {} or value == None:\n        return False\n    else :\n        return True\nprint(custom_bool(0))\nprint(custom_bool(1))\nprint(custom_bool(""""))\nprint(custom_bool(""hello""))\nprint(custom_bool([]))\nprint(custom_bool([1]))\nprint(custom_bool(None))"
B25ME001_q4,9,10,90.00,"<output> The condition `if value in list:` is incorrect because it checks if the input value is equal to each element of the list, which will always return False for non-empty values and True for empty values. Instead, use a single comparison with None or zero. </output>","def custom_bool(value):\n    list=(0,0.0,0j,"""",[],(),{},set(),frozenset(),None,False)\n    if value in list:\n        return False\n    else:\n        return True"
B25CS044_Q4,9,10,90.00,<output> The issue lies in the use of string literals ('False') instead of boolean values (False) for return statements. Replace 'False' with False to fix the logical flow.</output>,"#B25CS044_Q8\n#Making custom boolean function\n\ndef custom_bool(value):\n    if value==0 or value==0.0:\n        return 'False'\n    elif value==None:\n        return 'False'\n    elif value=="""":\n        return 'False'\n    elif value==[]:\n        return 'False'\n    elif value==():\n        return 'False'\n    elif value=={}:\n        return 'False'\n    else:\n        return 'True'\n\n# custom bool(0) # False\n# custom bool(1) # True\n# custom bool("""") # False\n# custom bool(""hello"") # True\n# custom bool([]) # False\n# custom bool([1]) # True\n# custom bool(None) # False"
B25EC022_q4,0,10,0.00,"<output>Consider using the 'not' operator to invert the condition for numeric zeros and empty sequences, as this will ensure correct handling of boolean values.</output>","###########################################################################################################\n#KOYYA SUMANTH BABU\n#B25EC022\n#ELECTRONICS AND COMMUNICATION ENGINEERING\n#INDIAN INSTITUTE OF TECHNOLOGY BHILAI\n###########################################################################################################\n\ndef custom_bool(value):\n    if value is None:\n        return False\n    if isinstance(value, (int, float, complex)) and value == 0:\n        return False\n    if isinstance(value, (str, list, tuple, dict, set, range)) and len(value) == 0:\n        return False\n    return True\nprint (custom_bool(0))\n"
B25EC036_q4,0,10,0.00,"<output> The issue lies in the order of your conditional checks. You're checking for `None`, then for numeric zeros and empty collections, but you should be checking for these values first to ensure they return `False` before moving on to the more general case where all other values return `True`. </output>","def custom_bool(value):\n    \n    if value == 0 or value == 0.0:\n        return False\n                 \n   \n    elif value in ([], {}, """", (), set()):\n        return False\n    \n    \n    elif value is None:\n        return False\n    \n    \n    else:\n        return True\n\n\n\nprint(custom_bool(0))   \nprint(custom_bool(1))  \nprint(custom_bool(""""))  \nprint(custom_bool(""hell0""))\nprint(custom_bool([]))  \nprint(custom_bool([1]))\nprint(custom_bool(None)) \n"
B25EC024_q4,9,10,90.00,"<output> Consider adding explicit `or` conditions for numeric zeros and empty sequences/collections to ensure all falsy values are correctly identified. For example, `if value == 0 or value == 0.0 or (value is None and value == '') or (value is False and isinstance(value, bool)):`. </output>","def custom_bool(value):\n    """"""\nEmulate Python’s built-in bool() without calling it. Return\nFalse for None,\nnumeric zeros (e.g. 0, 0.0), and empty sequences or\ncollections (e.g. ’’, []),\nand True otherwise.\n""""""\n    if value == 0 or value == 0.0 or value == """" :\n        return False\n    if value is None :\n        return False\n    if value == [] or value == {} or value == () :\n        return False\n    else:\n        return True\n    \n"
