student_id,tests_passed,tests_total,score_percentage,semantic_summary,code_snippet
<B25DS005>_q4,0,10,0.00,"<output> The issue lies in your function's logic. Currently, you're checking if the input `x` is equal to each false value individually, but this approach doesn't account for the fact that `False` itself should be considered as a false value. </output>","x = input(""Enter for testing: "")\ndef costumbool(x):\n    falsevalues = [""0"",""0.0"","""",'',""None"",""{}"",""[]"",""set()""]\n    for i in falsevalues:\n        if x == i :\n            return False\n    return True\n\ny = costumbool(x)\nprint(y)\n"
B25MT003_q4,0,10,0.00,<output>Use the `in` operator to check if the value is present in the list instead of comparing with each item individually.</output>,"def custom_bool(value):\n     list=[0,0.0,"" "",[ ],None]\n     for item in list:\n          if value in list:\n              return False\n          else:\n              return True\n     \n     \nprint(custom_bool(0))\nprint(custom_bool(1))\nprint(custom_bool("" ""))\nprint(custom_bool(""hello""))\nprint(custom_bool([ ]))\nprint(custom_bool([1]))\nprint(custom_bool(None))\n    "
B25EE007_q4,9,10,90.00,"<output> The issue lies in the combination of boolean operators. You're using `if` statements for each condition separately, but you should use the `and` operator to combine them correctly.</output>",def custom_bool(value):\n    if(value is None):\n       return False\n    if(type(value)==int or type(value)==complex):\n        if(value==0):\n           return False\n        else :\n         return True\n    if(type(value)==float):\n        if(value==0.0):\n         return False\n        else :\n         return True\n    elif(type(value)==str or type(value)==list or type(value)==tuple or type(value)==dict or type(value)==set or type(value)==frozenset ):\n       if(len(value)==0 ):\n          return False\n       else:\n          return True\n   \n        \n\n    \n
B25CS048_q4,9,10,90.00,"<output> The condition `s == str` should be `s is str`, as you're checking for type identity, not equality of types. This ensures that `str` instances are correctly identified as such.</output>","def custom_bool(value):\n    """"""\nEmulate Python’s built-in bool() without calling it. Return\nFalse for None,\nnumeric zeros (e.g. 0, 0.0), and empty sequences or\ncollections (e.g. ’’, []),\nand True otherwise.\n""""""\n    s=type(value)\n    if value is None:\n        return False\n    elif s==int or s==float:\n        if value==0:\n            return False\n        else:\n            return True\n    elif s==str or s==list or s==tuple or s==dict or s==set:\n        if len(value)==0:\n            return False\n        else:\n            return True\n        \n\n"
B25CS026_q4,0,10,0.00,"<output> The student's code is missing explicit checks for numeric zeros and empty sequences/collections, which are crucial for the `custom_bool` function to return `False` as required. Consider adding these checks using conditional statements (e.g., `if value == 0`, `if not isinstance(value, str)`). </output>","def custom_bool(value):\n    """"""Emulate Python’s built-in bool() without calling it. Return\n    False for None,\n    numeric zeros (e.g. 0, 0.0), and empty sequences or\n    collections (e.g. ’’, []),\n    and True otherwise.\n    """"""\n    if value:\n        return True\n    else :\n        return False\n    \nprint(custom_bool(5))\nprint(custom_bool(''))\nprint(custom_bool([]))\nprint(custom_bool(0.0))\nprint(custom_bool(""hello""))"
B25MM025_q4,0,10,0.00,"<output> The condition `value == None` should be `value is None`, as `None` is a singleton object and `==` checks for equality of values, not identity. </output>","def custom_bool(value): \n    \n    if value == None or value == 0 or value == 0.0 or value == """" or value == () or value == [] or value == {} or value == '':\n        return False  \n    else:\n        return True\nprint(custom_bool(""None""))\n "
B25ME056_q4,9,10,90.00,"<output> The issue lies in the fact that your `custom_bool` function only checks if the value is truthy using the `if value:` condition, which will return True for all non-empty values. You should also consider the case where the value is an empty collection or a numeric zero. </output>",def custom_bool(value):\n    if value: \n        return True\n    else:\n        return False\n
B25DS010_Q4,8,10,80.00,<output> Consider adding explicit `not` operator to negate the condition when combining boolean values with `and` and `or`. </output>,"def custom_bool(value):\n    if value in (0, """", [], None):\n        return False\n    else:\n        return True\n\ncustom_bool(0)\ncustom_bool(1)\ncustom_bool("""")\ncustom_bool(""hello"")\ncustom_bool([])\ncustom_bool([1])\ncustom_bool(None)"
B25MT014_q4,9,10,90.00,"<output> Consider adding explicit negations for the 'not' operator to ensure correct handling of its behavior when applied to booleans. This could involve using `~` or `not` separately, rather than relying on Python's implicit short-circuiting behavior. </output>","\n\ndef custom_bool(value: any) -> bool:\n    """"""\n    Emulate Python's built-in bool() without calling it. Return\n    False for None, numeric zeros (e.g. 0, 0.0), and empty sequences or\n    collections (e.g. """", []), and True otherwise.\n    """"""\n    # Check for None.\n    if value is None:\n        return False\n        \n    # Check for numeric zeros.\n    if isinstance(value, (int, float)) and value == 0:\n        return False\n        \n    # Check for empty sequences/collections (e.g., string, list, tuple, dict).\n    if hasattr(value, '__len__') and len(value) == 0:\n        return False\n        \n    # All other values are considered True.\n    return True"
B25EE013_q4,9,10,90.00,"<output>Consider using the logical 'or' operator to combine multiple conditionals instead of sequential 'if' statements, as this can lead to incorrect results when dealing with boolean values.</output>","def custom_bool(value):\n    if value is None:    \n        return False\n    #For the input of None\n    if isinstance(value, (int, float, complex)) and value == 0:\n        return False\n    # Empty sequences/collections\n    if isinstance(value, (str, bytes, list, tuple, dict, set, range)) and len(value) == 0:\n        return False\n    return True\n\n"
B25EC009_Q4,0,10,0.00,<output>Consider adding explicit `and` and `or` operators to combine your conditional checks for more accurate logic.</output>,"def custom_bool(value):\n    """"""\n    Emulate Python's built-in bool() without calling it. Returns\n    False for None,\n    numeric zeros (e.g. 0, 0.0), and empty sequences or\n    collections (e.g. '', []),\n    and True otherwise.\n    """"""\n    if value == """":\n        return False\n    if value == 0 or value == 0.00 :\n        return False\n    if value == [] or value == {} or value == () or value == set() or value == '' :\n        return False\n    if value == None:\n        return False\n    else:\n        return True\n    \nprint(custom_bool(0))    \nprint(custom_bool(1))    \nprint(custom_bool([1]))    \nprint(custom_bool(""""))    \nprint(custom_bool(""hello""))    \nprint(custom_bool([]))    \nprint(custom_bool(""None""))    "
B25CS013_q4,9,10,90.00,"<output>Consider adding explicit `or False` to each condition to ensure correct short-circuiting behavior for `and` and `not`, e.g. `if not (value is None or isinstance(value, (int, float, complex)) and value == 0)`. This will help prevent potential issues with the logical flow.</output>","def custom_bool(value) -> bool:\n    if value is None:\n        return False\n   \n    if isinstance(value, (int, float, complex)) and value == 0:\n        return False\n    if hasattr(value, ""__len__"") and len(value) == 0:\n        return False\n    return True\n"
B25ME011_q4,0,10,0.00,"<output> In your `if` statement for tuples and dictionaries, you're using `o` instead of `0`, which is causing the NameError. Replace all instances of `o` with `0`. </output>","def custom_bool(value):\n    \n    if value is None :\n        return False\n    if type(value)==int or type(value)==float:\n        if value==0:\n            return False\n        else:\n            return True\n    if type(value)==str:\n        if value=="""":\n            return False\n        else:\n            return True\n    if type(value)==list:\n        if len(value)==0:\n            return False\n        else:\n            return True\n    if type(value)==set:\n        if len(value)==0:\n            return False\n        else:\n            return True\n    if type(value)==tuple:\n        if len(value)==o:\n            return False\n        else:\n            return True\n        \n    if type(value)==dict:\n        if len(value)==o:\n            return False\n        else:\n            return True\nprint(custom_bool(0))\nprint(custom_bool(1))\nprint(custom_bool(""""))\nprint(custom_bool(""hello""))\nprint(custom_bool([]))\nprint(custom_bool([1]))\nprint(custom_bool(None))\n    \n    \n    \n    \n    \n    \n    \n    \n    \n    \n    \n    \n    \n    \n    \n    \n    \n    \n    \n    \n    "
B25CS055_q4,9,10,90.00,"<output> Consider adding explicit 'or' conditions for numeric values and empty collections to ensure all cases are covered. For example, `elif value == 0 or value == 0.0 or (isinstance(value, list) and len(value) == 0)`, etc. </output>","def custom_bool(value):\n    """"""\n    Emulate Python’s built-in bool() without calling it. Return\n    False for None,\n    numeric zeros (e.g. 0, 0.0), and empty sequences or\n    collections (e.g. ’’, []),\n    and True otherwise.\n    """"""\n    if value==None:\n        return False\n    elif value==0 or value==0.0:\n        return False\n    elif type(value) in [list,str,dict,tuple]:\n        if len(value)==0:\n            return False\n        else:\n            return True\n    else:\n        return True\n\n"
B25EC038_q4.py,0,10,0.00,<output>Check for missing `elif` statements to cover all possible data types and their corresponding boolean values.</output>,"def custom_bool(value):\n    if type(value) == int:\n        if value==0:\n            return False\n        else:\n            return True\n    elif type(value) == str:\n            if len(value) ==0:\n                return False\n            else:\n                 return True\n    elif type(value) == list:\n             if len(value)==0:\n                 return False\n             else:\n                 return True\n    if value == None:\n             return False\n             \nprint(custom_bool(0))\nprint(custom_bool(1))\nprint(custom_bool(""""))\nprint(custom_bool(""hello""))\nprint(custom_bool([ ]))\nprint(custom_bool([1]))\nprint(custom_bool(None))\n    "
B25MT010_q4,9,10,90.00,"<output> The student's code snippet is missing the `or` operator to combine the conditions correctly, resulting in an incomplete logical flow. For example, the condition `value == None or isinstance(value, (int, float, complex)) and value == 0` should be rewritten as `not value or isinstance(value, (int, float, complex)) and value == 0`. This will ensure that all values are correctly identified as either True or False.</output>","def custom_bool(value):\n    """"""\n       returns none for value equals to None,empty tuple,dictionary,list,set,0 valued numbers.\n    """"""   \n    if value==None:\n        return(False)\n    elif isinstance(value,(int,float,complex)) and value==0:\n        return(False)\n    elif isinstance(value,(tuple,dict,list,str,set)) and len(value)==0:\n        return(False)\n    else:\n        return(True)\n    \n    \n    "
B25EE023_q4,8,10,80.00,"<output>Consider adding explicit parentheses around the conditions to ensure correct operator precedence when combining them with `and` and `or`. For example, `(value in (0, 0.0, [], (), '', None)) and not isinstance(value, str)`.</output>","def custom_bool(value):\n    if value in  (0,0.0,[],(),"""",'',None):\n        return False\n    else:\n        return True\n    \n"
B25MM006_q4,9,10,90.00,"<output> The student's code is missing the `not` operator when checking for the negation of a value that should return False, instead it only checks equality with 0/False values and empty collections.  </output>","#value = eval(input(""Enter anything: ""))\ndef custom_bool(value):\n    if value == 0 or value == 0.0 or value =='' or value =="""" or value ==[] or value ==() or value == {} or value == None:\n        return False\n    else :\n        return True\n#print(custom_bool(value))"
B25CS047_q4,0,10,0.00,"<output> The issue lies in the order of your conditional checks. Currently, you're checking for `None` first and then for empty collections or numeric zeros. However, according to the problem description, you should return `False` for these cases before returning `True` for all other values.</output>","def custom_bool(value):\n    if value is None:\n        return False\n    elif value in ({},[],'',()):\n        return False\n    elif value in (0,0.0):\n        return False\n    else:\n        return True\nprint(custom_bool([]))\nprint(custom_bool({1:'apple'}))"
B25EE025_q4,0,10,0.00,"<output> Consider adding explicit 'or' operators to combine your conditionals to ensure correct handling of all cases, especially when dealing with nested boolean operations.</output>","def custom_bool(value):\n	if value is None:\n		return False\n	if isinstance(value, (int,float,complex)) and value == 0:\n		return False\n	\n	if isinstance(value, (str,dict,list,tuple,set,frozenset,bytes,bytearray,range)):\n		return False\n	return True\n	\n# test cases\nprint(custom_bool(0))\nprint(custom_bool(1))"
B25EC026_q4,0,10,0.00,"<output> The issue lies in the `not` keyword at the beginning of the function, which is incorrectly negating the entire condition. Instead, you should use the `and` operator to chain the conditions together correctly. </output>","def boolCustom(x):\n    return not(x==[] or x==() or x=={} or x=="""" or x==set() or x==False or x==0 or x==None)\nprint(boolCustom(8))\n"
B25MT015_q4,0,10,0.00,<output>Consider using Python's built-in `bool()` function to simplify your implementation and avoid potential issues with multiple conditionals.</output>,"def custom_boolean(value):\n    if value is None:\n        return False\n    if value == 0 or value == 0.0:\n        return False\n    if value == """":\n        return False\n    if value == []:\n        return False\n    if value == ():\n        return False\n    if value == {}:\n        return False\n    if value == set():\n        return False\n    else:\n     return True\n"
B25DS011_q4,0,10,0.00,"<output> The student's code is missing the `not` operator to correctly handle negated values and combined conditions, which could lead to incorrect results for certain inputs.</output>","def custom_bool(a):\n    if (a == None or a == 0 or a == 0.0 or a == '' or a == []):\n        return False\n    else :\n        return True\n    \nprint(custom_bool(0))\nprint(custom_bool(1))\nprint(custom_bool(""""))\nprint(custom_bool(""hello""))\nprint(custom_bool(1))\nprint(custom_bool([1]))\nprint(custom_bool(None))"
B25MT009_Q4,8,10,80.00,"<output> The student's code uses `in` operator to check if the value is in the list of false values, but it should use the `not in` operator instead to correctly implement the ""not in"" behavior. </output>","false = ["""", '', [], None, False, 0, ()]\ndef custom_bool(value):\n    if value in false:\n        return False\n    else:\n        return True\n"
B25DS028_q4,8,10,80.00,"<output>Consider using Python's built-in `bool()` function as a reference to understand the expected behavior for different types of values, and ensure that you're applying the correct logical operators (`and`, `or`) in your implementation.</output>","def custom_bool(value):\n    """"""\n    Emulate Python’s built-in bool() without calling it. Return\n    False for None,\n    numeric zeros (e.g. 0, 0.0), and empty sequences or\n    collections (e.g. ’’, []),\n    and True otherwise.\n    """"""\n    a=True\n    if type(value)==int or type(value)==float:\n        if int(value)==0:\n            a=False\n    elif value==None:\n        a=False\n    elif value==[] or value==() or value=="""":\n        a=False\n    return a\n"
B25MT032_q4,8,10,80.00,"<output> Consider using the 'or' operator to chain multiple conditions together instead of listing them all individually. For example, `if value == 0 or value == '' or value == []`, which is more concise and readable. </output>","def custom_bool(value):\n    if(value==0 or value=='' or value==[] or value==0.0 or value==set() or value==None or value==""""):\n        return False\n    else:\n        return True\n\n\n"
B25MT007_q4,0,10,0.00,<output>Consider adding explicit `not` keyword before each condition when combining boolean operators to avoid implicit conversion issues.</output>,"def custom_bool(value):\n    if (value== 0 or value=="""" or value=='' or value==[] or value==() or value=={} or value==None ):\n        return False\n    else:\n        return True\nprint(custom_bool(0))\nprint(custom_bool(1))\nprint(custom_bool(""""))\nprint(custom_bool(""hello""))\nprint(custom_bool([]))\nprint(custom_bool([1]))\nprint(custom_bool(None))\n\n\n        "
B25EC018_q4,0,10,0.00,"<output> The student's code is missing the `bool()` conversion for numeric values and strings that are truthy or falsy, which would require using the `bool()` function to achieve the desired behavior.</output>","def custom_bool(value):\n    if isinstance(value,(list,tuple)):\n        if (len(value)==0):\n            return False\n        else:\n            return True\n    else:\n        if (value==0 or value is None or value=="" "" or value ==0.0):\n            return False\n        else:\n            return True\n        \nprint (custom_bool(0)) # False\nprint(custom_bool(1)) # True\nprint(custom_bool("" "")) # False\nprint(custom_bool(""hello"")) # True\nprint(custom_bool([])) # False\nprint(custom_bool([1])) # True\nprint(custom_bool(None))# False\n "
B25CS019_q4,0,10,0.00,"<output> The condition `if value == 0 or value == [] or value == () or value == {}` should be `if value in [None, 0, '', [], (), {}]`, as the current implementation only checks for exact matches but not membership in a list of allowed falsy values. </output>","def custom_bool(value):\n    a = False\n    if value == 0 or value == [] or value == ()or value == {} or value == None or value == """":\n        a = False\n    else:\n        a = True\n    return a\nprint(custom_bool(0))\nprint(custom_bool(1))\nprint(custom_bool(""""))\nprint(custom_bool(""hello""))\nprint(custom_bool([]))\nprint(custom_bool([1]))\nprint(custom_bool(None))\n\n"
B25CS041_q4,9,10,90.00,"<output> Consider using the `not` operator to negate values instead of directly comparing them to `False` or `0`, as this can lead to subtle bugs when dealing with boolean operations like `and` and `or`. For example, in your current implementation, `isinstance(value, (int, float, complex)) == True` will always return `True` because it's a comparison, not an equality check. Use `isinstance(value, (int, float, complex))` instead. </output>","def custom_bool(value):\n    """"""\n    Emulate Python’s built-in bool() without calling it. Return\n    False for None,\n    numeric zeros (e.g. 0, 0.0), and empty sequences or\n    collections (e.g. ’’, []),\n    and True otherwise.\n    """"""\n    if isinstance(value,(int,float,complex)) == True and value == 0:\n        return False\n    elif isinstance(value,(list,str,set,tuple,dict)) == True and len(value) == 0:\n        return False\n    elif isinstance(value,type(None)):\n        return False\n    return True\n"
B25EC043_q4,9,10,90.00,<output>Consider adding explicit boolean values for numeric zeros and empty sequences to ensure correct behavior.</output>,def custom_bool(value):\n    if type(value)==int or type(value)==float:\n        if float(value)==0.0:\n            return False\n        else:\n            return True\n    elif value==None:\n        return False\n    else:\n        if len(list(value))==0:\n            return False\n        else:\n            return True\n
B25ME024__q4,0,10,0.00,"<output>Consider modifying your code to use the 'not in' operator instead of 'in' for negating values, as this would correctly handle boolean-like inputs and avoid potential issues with truthiness.</output>","def custom_bool(value):\n    if value in ["""",0]:\n        return False\n    return True\nprint(custom_bool(76786))"
B25EE004_q4,0,10,0.00,"<output> Check if the `custom` function is being called with the correct argument name, as it's currently named 'custom' but the problem statement asks for 'custom_bool'. </output>",def custom(value):\n    if(value==0 or value==0.0 or value==[] or value==() or value=={}):\n       return False\n    else:\n        return True\n\n\n    
B25ME059_q4,9,10,90.00,"<output> Check if you're using the 'not' operator correctly to negate values that should return False. Instead of `if value in list1:`, try `if not value in list1:`.</output>","def custom_bool(value):\n    '''\n    i added the values for which we are going to return False and added normal if else\n    '''\n    list1=[0,0.0,[],(),{},None,""""]\n    if(value in list1):\n        return(False)\n    else:\n        return(True)"
B25CS059_q4,9,10,90.00,"<output> The student's code seems to be missing the cases where `value` is an empty string, list, tuple, dictionary, or numeric zero. They should add additional `if` statements to cover these edge cases. </output>","def custom_bool(value):\n    """"""\n    Emulate Python’s built-in bool() without calling it. Return\n    False for None,\n    numeric zeros (e.g. 0, 0.0), and empty sequences or\n    collections (e.g. ’’, []),\n    and True otherwise.\n    """"""\n    if value:\n        return True\n    else:\n        return False\n"
<B25CS036>__q4,0,10,0.00,<output>Consider adding explicit `or` operators between your conditionals to ensure correct logical flow for values like empty lists and sets.</output>,"def custom_bool(value):\n    if value == None :\n        return False\n    if value == (0) :\n        return False\n    if type(value) in [list , str , set ,dict , tuple] and len(value) == 0:\n        return False\n    else :\n        return True\nprint(custom_bool(0.0)) # False\nprint(custom_bool(1)) # True\nprint(custom_bool("""")) # False\nprint(custom_bool(""hello"")) # True\nprint(custom_bool([])) # False\nprint(custom_bool([1])) # True\nprint(custom_bool(None)) # False"
B25EC002_q4,9,10,90.00,<output>Consider adding explicit boolean values for numeric zeros and empty sequences to ensure accurate results.</output>,"def custom_bool(value):\n    """"""\n    Emulate Python’s built-in bool() without calling it. Return\n    False for None,\n    numeric zeros (e.g. 0, 0.0), and empty sequences or\n    collections (e.g. ’’, []),\n    and True otherwise.\n    """"""\n    if value is None:\n        return False\n    if isinstance(value, (int, float)):\n        return value!= 0\n    try:\n        return len(value)> 0\n    except TypeError:\n        return True\n"
B25CS046_q4,8,10,80.00,"<output>Consider adding explicit `or` conditions to handle cases where the value is an integer or float that would be considered False in Python's bool() function, such as -1, 0, or a very small negative number.</output>","def custom_bool(value):    \n    y= ["""",0,0.0,None,[]]\n    if value in y:\n          return False\n    return True\n          \n    \n\n"
B25ME035_q4,0,10,0.00,"<output>Consider using the `in` operator to check if a value is an empty collection instead of relying on the length of the collection, as this approach can be more concise and Pythonic.</output>","def custom_bool(value):\n    if value is None:\n        return False\n    if r(value,(int, float, complex)) and value==0:\n        return False\n    if r(value,(str,list,tuple,dict,set,frozenset,bytes,bytearray,range)):\n        if len(value)==0:\n            return False\n    else:\n        return True\nprint(custom_bool(0))"
B25ME049_q4,0,10,0.00,"<output> The issue lies in the incorrect use of `print` statements within the function, which is causing the program to output the boolean values instead of returning them. Instead, consider using a conditional expression or an if-else statement to return 'False' or 'True' directly. </output>","def custom_bool(n):\n    a = []\n    b = """"\n    if n == 0 or n == a or n==b:\n        print(""False"")\n    else:\n        print(""True"")\n    return n\n\ncustom_bool(0)\ncustom_bool(1)\ncustom_bool("""")\ncustom_bool(""Hello"")"
B25EE019_q4,6,10,60.00,"<output> You're iterating over a list of values that should be used to test for False conditions, but you're using the variable name `value` which is the same as your function parameter. This causes Python to get confused and always return True.</output>","def custom_bool(value):\n    wrong=('',"""",0,[],{},range(0),frozenset(),set())\n    for value in wrong:\n        return False\n    else:\n        return True\n    \n"
