student_id,tests_passed,tests_total,score_percentage,semantic_summary,code_snippet
B25EE044_q4,8,10,80.00,"<output>Consider combining your conditions using the `not` operator to negate each case instead of chaining multiple `if-elif` statements, which can lead to incorrect results for certain inputs.</output>","def custom_bool(value):\n    if []==value:\n        return False\n    elif {}==value:\n        return False\n    elif ()==value:\n        return False\n    elif """"==value:\n        return False\n    elif 0==value:\n        return False\n    else:\n        return True\n    \n"
B25MT030.Q4,0,10,0.00,"<output>Check if you're using the `or` operator correctly to combine your conditions. Currently, you're returning as soon as any condition is met, which is not how Python's boolean logic works.</output>","#n is the list given by user\ndef custom_bool(n):\n    if len(n)==0:\n        print(""False"")\n        return\n    for i in n:\n        if i==0:\n            print(""False"")\n            return\n        if i!=0 or type(i)==str:\n            print(""True"")\n            return"
B25MM001_Q4,0,10,0.00,<output> Consider using Python's built-in `bool()` function directly instead of trying to replicate its behavior manually. This would eliminate the need for explicit conditionals and make your code more concise and efficient.</output>,#Custom boolean \ndef customBool(s):\n    if s == 0:\n        return False\n    elif s == []:\n        return False\n    elif s == '':\n        return False\n    elif s == None:\n        return False\n    else: return True\n\nprint(customBool(0))\nprint(customBool(1))\nprint(customBool(''))\nprint(customBool('hello'))\nprint(customBool([]))\nprint(customBool(None))\n
B25MT002_q4,9,10,90.00,"<output> Consider using Python's built-in `bool()` function with its `or` operator to combine conditions for more concise and readable code. For example, instead of `isinstance(value, (int, float)) == True`, use `bool(isinstance(value, (int, float)))`. </output>","def custom_bool(value):\n    """"""\n    Emulate Python’s built-in bool() without calling it. Return False\n    numeric zeros (e.g. 0, 0.0), and empty sequences or collections (\n    and True otherwise.\n    #isinstance is used to check if a variable is of the mentioned data type\n    returning true or false\n    """"""\n    #check if the value is none (looking at the test cases)\n    if value is None:\n        return False\n    #check data typees like int and float if they are 0\n    if isinstance(value,(int,float))==True and value==0:\n        return False\n    #checks empty string,collection,tuple,dict,set\n    if isinstance(value,(str,list,tuple,dict,set))==True and len(value)==0:\n        return False\n    return True#all other cases are True\n\n\n"
B25MM004_q4,9,10,90.00,"<output> The student's code is missing the `not` operator to correctly negate values and handle cases where the value is neither True nor False, leading to incorrect results for certain inputs.</output>","def custom_bool(value):\n    if value is None:\n        return False\n    if value == 0 or value == 0.0:\n        return False\n    if value == """" or value == [] or value == () or value == {}:\n        return False\n\n    else:\n        return True\n    \n\n\n\n"
"B25ME026_q4,py",0,10,0.00,"<output>When checking for numeric zeros, consider using `isinstance(value, int)` to ensure you're dealing with an integer before trying to get its length.</output>",def custom_bool(value):\n    if value==None:\n        return False\n    elif value==0 or len(str(value))==0 or len(value)==0:\n        return False\n    else:\n        return True\n    \nprint(custom_bool(321))    
B25EE022_Q4,0,10,0.00,"<output> Consider adding explicit `or` conditions to combine multiple falsy values, as currently only one of them will be checked, leading to potential inconsistencies.</output>","def custom_bool(value):\n    if (value== 0 or value=="""" or value=='' or value==[] or value==() or value=={} or value==None ):\n        return False\n    else:\n        return True\nprint(custom_bool(0))\nprint(custom_bool(1))\nprint(custom_bool(""""))\nprint(custom_bool(""hello""))\nprint(custom_bool([]))\nprint(custom_bool([1]))\nprint(custom_bool(None))\n\n\n        "
B25ME041_q4,8,10,80.00,<output>Consider adding explicit `not` keyword before each condition to ensure correct logical flow and avoid potential issues with short-circuiting behavior.</output>,"def custom_bool(value):\n    if value==0 or value==0.0:\n        return False\n    elif value=="""" or value==() or value==[] or value==set() or value=={}:\n        return False\n    else:\n        return True"
B25CS051_q4,6,10,60.00,"<output> The loop iterates over a list of values that should be checked against the input value, but it does so incorrectly by using `for value in wrong:` instead of comparing each element to the input value. </output>","def custom_bool(value):\n    wrong=('',"""",0,[],{},range(0),frozenset(),set())\n    for value in wrong:\n        return False\n    else:\n        return True\n    \n"
B25DS029_q4,9,10,90.00,<output> Consider adding explicit `not` keyword before each boolean operator to ensure correct order of operations and avoid potential confusion with the implicit behavior of Python's `bool()` function.</output>,"def custom_bool(value):\n    """"""\n    Emulate Python’s built-in bool() without calling it.\n    Return False for None, numeric zeros (e.g. 0, 0.0),\n    and empty sequences or collections (e.g. ’’, []),\n    and True otherwise.\n    """"""\n    n = value\n    if n is None:\n        return False #given condition\n    if type(n) in (int, float, complex) and n == 0:\n        return False #checking if the numerical type inputs = 0\n    if type(n) in (list, tuple, dict, set, str):\n        if len(n) == 0: #checking if the above types are empty\n            return False\n    return True"
B25MM028_q4,0,10,0.00,<output>Consider adding explicit boolean values for the numeric and sequence checks to avoid potential type issues.</output>,"def custom_bool(value):    #define a function for custom bool\n    if value is None:\n        return False\n    elif type(value) in (int, float) and value == 0:       #For interger type and value is 0 or 0.0\n        return False\n    elif type(value) in (str, list, tuple, dict, set) and len(value) == 0:   #for all other types\n        return False\n    else:\n        return True\n    \n\nprint(custom_bool(0))\nprint(custom_bool(1))\nprint(custom_bool(""""))\nprint(custom_bool(""hello""))\nprint(custom_bool([]))\nprint(custom_bool([1]))\nprint(custom_bool(None))"
<B25CS031>_q4,0,10,0.00,"<output> The issue lies in the use of `==` for comparison, which checks for equality by value, rather than truthiness. Replace `v == 0 or v == ' ' or v == [] or v == None` with `not (v is not None and v != 0 and len(v) > 0)` to correctly evaluate the boolean values of numeric zeros and empty sequences.</output>","def custom_bool(v):\n    """"""\n        Emulate Python’s built-in bool() without calling it. Return False\nnumeric zeros (e.g. 0, 0.0), and empty sequences or collections (\nand True otherwise.\n                    """"""\n    if v == 0 or v == "" "" or v == [] or v == None:\n        return ""# False""\n    else:\n        return ""# True""\nprint(custom_bool(0))\nprint(custom_bool(1))\nprint(custom_bool("" ""))\nprint(custom_bool([]))\nprint(custom_bool(None))\nprint(custom_bool(""hello world""))"
B25ME054_q4,9,10,90.00,<output> The condition `if len(value) == 0` will be `False` for empty strings like `''. Try using the `str.strip()` method to remove leading and trailing whitespace before checking the length of a string. </output>,"def custom_bool(value):\n    if value is None:\n        return False\n    if isinstance(value, (int, float, complex)) and value == 0:\n        return False\n    try:\n        if len(value) == 0:\n            return False\n    except TypeError:\n        pass\n    return True"
B25CS008_Q4,0,10,0.00,N/A,No Code Found
B25CS037_q4,8,10,80.00,"<output> Check if you're using the correct operator for negation (`not`) instead of `!=`, as `0 != None` would evaluate to `True` and vice versa, which might not be the intended behavior. </output>","def custom_bool(value):\n    if value in [[],{},"" "",0,None]: \n        return False\n    else:\n        return True\n    \n"
B25MT017_q4,0,10,0.00,"<output> The function should use the 'or' operator to combine its conditions, ensuring that if any of the conditions return False, the function returns False. For example, `value is None or isinstance(value, (int, float)) and value == 0`, instead of using separate if statements. </output>","def custom_bool(value):\n    if value is None:\n        return False\n    if isinstance(value, (int, float)) and value == 0:\n        return False\n    if hasattr(value, '_len_') and len(value) == 0:\n        return False\n    return True\nprint(custom_bool(0))\nprint(custom_bool(1))\nprint(custom_bool(""""))\nprint(custom_bool(""hello""))\nprint(custom_bool([]))\nprint(custom_bool([1]))\nprint(custom_bool(None))"
B25EE042_q4,0,10,0.00,"<output> Consider using the logical operators `and` and `not` to combine your conditionals instead of a simple `if-else` structure, which may lead to incorrect results for values like `(True or False)` or `((False) or True)`. </output>","def custom_bool(value):\n    """"""\n    Emulate Python's built-in bool() without calling it. Return\n    False for None,\n    numeric zeros (e.g. 0, 0.0), and empty sequences or\n    collections (e.g. '', []),\n    and True otherwise.\n    """"""\n    if value in [None,0,0.0,[],{},(),""""]:\n        return False\n    else:\n        return True\n    \nprint(custom_bool(0))\nprint(custom_bool(1))\nprint(custom_bool(""""))\nprint(custom_bool(""hello""))\nprint(custom_bool([]))\nprint(custom_bool([1]))\nprint(custom_bool(None))"
B25CS002_q4,9,10,90.00,<output>Consider adding explicit `not` operator before each condition to ensure correct order of operations and avoid potential issues with short-circuiting behavior.</output>,"def custom_bool(value):\n    if value in [False, None, 0, 0.0, 0j, """", [], (), {}, set(), range(0)]:\n        return False\n    \n    else:\n        return True\n"
B25DS012_q4,9,10,90.00,"<output>Consider using Python's built-in `bool()` function directly instead of manually implementing it, as this will simplify the logic and avoid potential edge cases.</output>","def custom_bool(value):\n    if value == 0:\n        return False\n    elif value is None:\n        return False\n    elif not isinstance(value,int):\n        if len(value) == 0:\n            return False\n        else:\n            return True\n    else:\n        return True"
B25DS006_q4,9,10,90.00,"<output> The issue lies in the way you're combining your conditions using `or` and `is`. Specifically, when checking for `value == False`, it's unnecessary because `False` is already a boolean value. Also, using `is` instead of `==` to check for `None` might not be what you intend. </output>","def custom_bool(value):\n    if value=="""" or value==0 or value==0.0 or value is None or value==[] or value=={} or value==() or value==set() or value==range(0) or value==False:\n        return False\n    else:\n        return True\n"
B25CS033_q4,8,10,80.00,"<output> The student's code snippet is missing the `not` operator to correctly negate values, leading to incorrect results for some inputs.</output>","def custom_bool(value):\n    """"""\n    Emulates in-built bool() function.\n    """"""\n    return False if value in ['', [], 0, None] else True\n"
B25ME058_q4,0,10,0.00,"<output> Check for correctly placed parentheses around the triple-quoted string literal, as it seems to be causing the SyntaxError. Ensure that all conditional checks and return statements are properly nested and indented.</output>","def custom_bool(value):\n    if value==0 or value==0.0 or value==None or value=="""" or value==[] or value==() or value=={}:\n        return False\n    else:\n        return True\n'''emulates bool() fn. return false if value is 0, empty sequence or none. """""""
B25CS025_q4,9,10,90.00,"<output> The issue lies in the use of 'or' instead of 'and' before the conditionals that check for falsey values. This would cause the function to return True if any of the conditions were met, rather than requiring all of them to be true.</output>",def custom_bool(value):\n    '''i carried if else statement and returned false if it was any of the following '''\n    a=value\n    if a==0 or a==0.0 or a=='' or a==[] or a=={} or a==None or a==():\n        return False\n    else:\n        return True\n
B25EE050_q4,0,10,0.00,"<output> The issue lies in the fact that you're printing 'True' instead of returning it, which means the function will always print 'True', regardless of its actual value. You should change `print('True')` to `return True`.  </output>","def custom_bool(value):\n    if value in (""None"", 0, 0.0 ,"""", '',):\n        print(""False"")\n    else: print(""True"")\n    \ncustom_bool(0) # False"
B25CS014_q4,9,10,90.00,"<output> The student's code seems mostly correct but may be missing explicit handling for the `bool()` equivalent of the `not` operator, which is often used to negate a boolean value. Consider adding an additional condition to handle this case.</output>","def custom_bool(value):\n    """"""\n    Emulate Python’s built-in bool() without calling it.\n    Return False for None, numeric zeros (e.g. 0, 0.0), \n    and empty sequences or collections (e.g. '', [], {}), \n    and True otherwise.\n    """"""\n    # Case 1: None\n    if value is None:\n        return False\n    \n    # Case 2: Numeric zeros\n    if isinstance(value, (int, float, complex)) and value == 0:\n        return False\n    \n    # Case 3: Empty sequences/collections\n    if isinstance(value, (str, list, tuple, dict, set)) and len(value) == 0:\n        return False\n    \n    # Default case\n    return True\n"
B25ME051_Q4,9,10,90.00,"<output>Consider using the 'not' operator to negate the condition instead of assigning it to a variable 'a', as this would allow for more concise and Pythonic code.</output>","def custom_bool(value):\n    a=True\n    if value == None or value == 0 or value == 0.0 or value == """" or value == [] or value == () or value == {}:\n        a=False\n    return a"
B25CS034_q4,8,10,80.00,"<output>Consider using Python's built-in `bool()` function directly instead of implementing your own logic, as it already handles the required boolean behavior for various data types.</output>","def custom_bool(value):\n    """"""\nEmulate Python’s built-in bool() without calling it. Return\nFalse for None,\nnumeric zeros (e.g. 0, 0.0), and empty sequences or\ncollections (e.g. ’’, []),\nand True otherwise.\n""""""\n    if type(value)==int or type(value) ==float :\n        if int(value)==0:\n            return False\n        else :\n            return True\n    if value == None:\n        return False\n    elif value==[] or value==() or value=="""":\n        return False \n    else:\n        return True \n'''Test Cases:\n• custom bool(0) # False\n• custom bool(1) # True\n• custom bool("""") # False\n• custom bool(""hello"") # True\n• custom bool([]) # False\n• custom bool([1]) # True\n• custom bool(None) # False'''\n\n        \n"
B25MT019_q4,0,10,0.00,"<output> The condition `value == 0.0` should be `value != 0.0`, as comparing to zero with floating-point precision can lead to incorrect results due to rounding errors.</output>","#B25MT019_q4\n\ndef custom_bool(value): \n    # Check for false values - return False for these\n    if value is None or value == 0 or value == 0.0 or value == """" or value == () or value == []:\n        return False  # Changed from True to False\n    else:\n        return True   # Changed from False to True\n\n# Test all cases\nprint(""Test Results:"")\nprint(f""custom_bool(0) = {custom_bool(0)}"")       \nprint(f""custom_bool(1) = {custom_bool(1)}"")        \nprint(f""custom_bool('') = {custom_bool('')}"")      \nprint(f""custom_bool('hello') = {custom_bool('hello')}"")  \nprint(f""custom_bool([]) = {custom_bool([])}"")      \nprint(f""custom_bool([1]) = {custom_bool([1])}"")\nprint(f""custom_bool(None) = {custom_bool(None)}"")  "
B25DS026.q4,0,10,0.00,"<output> The issue lies in the fact that you're checking for empty collections using `isinstance(value, ...)` but then immediately checking if their length is 0. Since an empty collection in Python is considered Falsey, this condition will never be met. </output>","def custom_bool(value):\n    if value is None:\n        return False\n    if isinstance(value, (int, float)) and value == 0:\n        return False\n    if isinstance(value, (str, list, tuple, dict, set)) and len(value) == 0:\n        return False\n    return True\nprint(custom_bool(0))      \nprint(custom_bool(1))      \nprint(custom_bool(""""))     \nprint(custom_bool(""hello""))\nprint(custom_bool([]))     \nprint(custom_bool([1]))    \nprint(custom_bool(None))   "
B25DS032_q4,0,10,0.00,"<output>Consider using the bitwise NOT operator (~) to invert the value of `value` when combining conditions with 'not', as the current implementation may not handle all cases correctly.</output>","def custom_bool(value):\n    if value is None:\n        return False\n    if isinstance(value, (int, float, complex)) and value == 0:\n        return False\n    if hasattr(value, ""_len_"") and len(value) == 0:\n        return False\n    return True\n\n\nprint(custom_bool(0))\nprint(custom_bool(1))\nprint(custom_bool(""""))\nprint(custom_bool(""hello""))\nprint(custom_bool([]))\nprint(custom_bool([1]))\nprint(custom_bool(None))"
B25EE055_q4,7,10,70.00,"<output> The issue lies in using string literals for comparisons instead of boolean values. Replace `'False'`, `'True'` with `False` and `True` respectively, to correctly evaluate the boolean logic.</output>","def custom_bool(value):\n    if value == float(0) :\n        return (""False"")\n    elif value == []:\n        return (""False"")\n    elif value == (""""):\n        return (""False"")\n    elif value == (""None""):\n        return (""False"")\n    else :\n        return (""True"")  \n"
B25CS010_q4,8,10,80.00,"<output> Consider adding explicit `or` conditions to handle cases where `value` is an empty collection. For example, add `if value == [] or value == () or value == {}`, which would correctly return False for empty lists, tuples, and dictionaries. </output>","def custom_bool(value):\n    """"""\n    Emulate Python's built-in bool() without calling it. Return\n    False for None,\n    numeric zeros (e.g. 0, 0.0), and empty sequences or\n    collections (e.g. '', []),\n    and True otherwise.\n    """"""\n    if value in [None, 0, 0.0]:\n        return False\n\n    if str(type(value)) in [""<class 'list'>"", ""<class 'str'>"", ""<class 'tuple'>""]:\n        return len(value) != 0\n\n    return True\n"
B25DS003_q4,7,10,70.00,"<output> You're missing the `not` keyword when checking for negation, so change `value == '0' or value == None or value == [] or value == ''` to `not (value == '0' or value == None or value == [] or value == '')`. </output>",def custom_bool(value =0):\n    if type(value) == int or type(value)==float:\n        value = str(value) # changes integer or float to string\n    \n    \n    \n    if value =='0' or value ==None or value == [] or value =='':\n        return False\n    else :\n        return True\n\n\n    \n    
(q4)B25ME017,0,10,0.00,"<output> The issue lies in the return type of your function; it should be `bool` instead of `True`, to match Python's built-in behavior.</output>","#coustum bool\ndef coustum_bool(n):\n    bool = [0, 0.0, None , [] ,'' ,"""", () , {} , set() ,0j, False]\n    if n in bool:\n        return False\n    else :\n        return True\n\nprint(coustum_bool(0.0))\nprint(coustum_bool(0))\nprint(coustum_bool([]))\nprint(coustum_bool(""hello""))\nprint(coustum_bool(set()))"
B25EE058_q4,9,10,90.00,"<output> The issue lies in the use of multiple `or` conditions instead of using Python's built-in boolean logic operators (`and`, `or`, and `not`) to combine conditions, which can lead to incorrect results for certain inputs.</output>","def custom_bool(value):\n    if value==0 or value==0.0 or value=='' or value=="""" or value==() or value==[] or value=={} or value==None:\n        return False\n    else:\n        return True\ncustom_bool(0)\ncustom_bool(1)\ncustom_bool("""")\ncustom_bool(""hello"")\ncustom_bool([])\ncustom_bool([1])\ncustom_bool(None)"
B25CS062_q4,0,10,0.00,"<output>Consider using the `not` keyword to invert the condition when checking for boolean values, e.g., `value == 0` becomes `value != 0`, and similarly for other boolean checks.</output>","def custom_bool(value):\n    if (value== 0 or value=="""" or value=='' or value==[] or value==() or value=={} or value==None ):\n        return False\n    else:\n        return True\nprint(custom_bool(0))\nprint(custom_bool(1))\nprint(custom_bool(""""))\nprint(custom_bool(""hello""))\nprint(custom_bool([]))\nprint(custom_bool([1]))\nprint(custom_bool(None))\n\n\n        "
B25CS016_q4,7,10,70.00,<output>Consider adding explicit type checks for `None` and numeric zeros to ensure correct handling of these edge cases.</output>,"def custom_bool(value):\n    if str(type(value))==""<class 'int'>"":\n        if value==0:\n            return False\n        else:\n            return True\n    else:\n        if len(value)==0:\n            return False\n        else:\n            return True"
B25CS020_q4,9,10,90.00,"<output> Consider adding explicit `or` conditions to handle cases where `value` is an empty collection, as the current implementation only checks for non-zero numeric values and does not account for other types of empty collections. For example, you could add `if isinstance(value, (str, list, tuple, dict)): return False`, which would cover strings, lists, tuples, dictionaries, sets, and frozensets. </output>","def custom_bool(value):\n    if value is None :\n        return False\n    \n    if isinstance(value,(int,float,complex)):\n            return value != 0\n        \n        \n    if isinstance(value,(str,list,tuple,dict,set,frozenset,range)):\n        return len(value) != 0\n    \n    \n    return True\n"
B25ME034_q4,9,10,90.00,<output>Consider adding explicit boolean values to your comparisons instead of using equality operators to avoid potential type coercion issues.</output>,"def custom_bool(value):\n    if value == 0 or value == 0.0 :\n        return False\n    elif value == """" or value == [] or value == () or value == {} or value == set():\n        return False\n    elif value is None:\n        return False\n    else:\n        return True"
B25EC031_q4,8,10,80.00,"<output> Consider using Python's built-in `bool()` function to define your custom boolean logic for values like '0' and 0.0, as they behave differently in boolean context compared to their numeric counterparts. </output>","def custom_bool(value):\n    """"""\n    Emulate Python’s built-in bool() without calling it. Return False for None,\n    numeric zeros (e.g. 0, 0.0), and empty sequences orcollections (e.g. ’’, []),\n    and True otherwise.\n    """"""\n    if value in [0,0.0,'',[],{},()]:\n        return False\n    else:\n        return True\n    "
B25ME032_q4,9,10,90.00,"<output> The issue lies in how you're combining boolean values. In Python, `True` and `False` are treated as numbers (1 and 0 respectively) when used in logical operations. You should use the `bool()` function to convert your custom boolean values to their corresponding numeric representations before applying the logical operators. </output>","def custom_bool(value):\n    list=(0,0.0,0j,"""",[],(),{},set(),frozenset(),None,False)\n    if value in list:\n        return False\n    else:\n        return True"
B25EC006_q4,8,10,80.00,"<output> Consider using Python's built-in `bool()` function to determine the truthiness of values, as it already handles various edge cases and provides a more robust implementation than your custom logic.</output>","def custom_bool(value):\n    \n    """"""\n    Emulate Python’s built-in bool() without calling it. Return\n    False for None,\n    numeric zeros (e.g. 0, 0.0), and empty sequences or\n    collections (e.g. ’’, []),\n    and True otherwise.\n    """"""\n    l = [0 , """" , [] , None]\n    if value in l:\n        return False\n    else:\n        return True\n    \n"
B25MT008_q4,9,10,90.00,"<output>Consider using Python's built-in `bool()` function to compare values with `value` instead of hardcoding multiple values into the list, as this approach is prone to errors and makes the code less readable.</output>","def custom_bool(value):\n    list=(0,0.0,0j,"""",[],(),{},set(),frozenset(),None,False)\n    if value in list:\n        return False\n    else:\n        return True"
b25cs005_q4,0,10,0.00,"<output> The issue lies in the way you're handling the input. You're trying to read from `a` which is an empty list and then print False, but this will cause an EOFError because there's no more input to read. Instead, use a conditional statement to check if the length of `a` is 0. </output>",a=list(input())\nif a==[]:\n    print(False)\nif int(a[0])==0:\n    print(False)\nelse:\n    print(True)
B25DS027_q4,8,10,80.00,"<output> You should use the 'not in' operator instead of 'in', because it checks if value is NOT present in list1, which aligns with your desired behavior for `None`, numeric zeros and empty sequences/collections. </output>","def custom_bool(value):\n    list1 =[0,"""",[],None]\n    if value in list1:\n        return(False)\n    else: return(True)\n \n# custom_bool(0)\n# custom_bool(1)\n# custom_bool("""")\n# custom_bool(""hello"")\n# custom_bool([])\n# custom_bool([1])\n# custom_bool(None)"
