student_id,tests_passed,tests_total,score_percentage,semantic_summary,code_snippet
B25ee014_q6,8,8,100.00,"<output>Verify that the `total` variable is being added to numbers, not strings, by checking if the type of `item` is indeed numeric before incrementing `total`. This will ensure that non-numeric values are correctly ignored.</output>","def smart_sum(*args):\n    total = 0\n    \n    def helper(item):\n        nonlocal total\n        if isinstance(item, (int, float)):\n            total += item\n        elif isinstance(item, (list, tuple)):\n            for sub in item:\n                helper(sub)\n        else:\n            raise TypeError(f""Unsupported type: {type(item)}"")\n    \n    for arg in args:\n        helper(arg)\n    \n    return total\n"
B25CS035_q6,0,8,0.00,"<output> The issue lies in how you're handling non-numeric arguments; specifically, when encountering a list or tuple within another list or tuple, you should be aware that this could lead to infinite recursion if the inner structure is not properly flattened. Consider adding some form of validation to ensure your function can safely handle nested structures. </output>","def smart_sum(*args):\n    s=0\n    for i in args:\n        if type(i) in (int,float):\n            s+=i\n        else:\n            s+=smart_sum(*i) \n    return s\n\n#Test Cases:\nprint(smart_sum(1, 2, [3, 4], (5, 6))) # 21\nprint(smart_sum(10)) # 10\nprint(smart_sum([1, [2, 3]])) # 6"
<B25CS031>_q6,0,8,0.00,"<output>Check if you're modifying the inner lists or tuples directly; instead, consider using a different approach to flatten and sum the nested elements.</output>","def smart_sum(*args):\n    """"""\n       Sum all numeric inputs, including numbers contained inside lists\nthemselves may be nested arbitrarily). Non-numeric values are not\nReturn the sum as an int or float.\n                                  """"""\n    \n    s = 0\n    for arg in args:\n        if isinstance(arg,list):\n            for nums in arg:\n                if isinstance(nums,list):\n                    for num in nums:\n                        s += num\n                else:\n                    s += nums\n                    \n        elif isinstance(arg,tuple):\n            for nums_2 in arg:\n                s += nums_2\n        else:\n            s += int(arg)\n            \n    return s\nprint(smart_sum(1,2,[3,4],(5,6)))\nprint(smart_sum(10))\nprint(smart_sum([1,[2,3]]))"
B25ME032_q6,7,8,87.50,"<output>When handling non-numeric inputs, ensure that you are not attempting to add or multiply them with numeric values, as this can lead to type mismatches and incorrect results.</output>",def smart_sum(*args):\n    sum=0\n    for i in args:\n        if type(i)==int:\n            sum+=i\n        if type(i)==list:\n            sum+=smart_sum(*i)\n        if type(i)==tuple:\n            sum+=smart_sum(*i)\n    return sum
B25ME054_q6,8,8,100.00,"<output> Ensure that all arguments passed to `smart_sum` are numeric or lists/tuples containing only numeric elements, as non-numeric values can cause unexpected behavior or errors when trying to add them to the total.</output>","def smart_sum(*args):\n    total = 0\n    for arg in args:\n        if isinstance(arg, (int, float)):\n            total += arg\n        elif isinstance(arg, (list, tuple)):\n            total += smart_sum(*arg)\n    return total"
B25EE051_q6,8,8,100.00,"<output>Verify that the `item` variable is indeed a numeric value before attempting to add it to the result, as non-numeric values could lead to unexpected behavior or errors.</output>","def smart_sum(*inputs):\n    """"""\n    Sum all numeric inputs, including numbers contained inside lists or tuples\n    (which themselves may be nested arbitrarily).\n    Non-numeric values are not expected.\n    Return the sum as an int or float.\n    """"""\n    result = 0\n    for item in inputs:\n        if isinstance(item, (int, float)):\n            result += item\n        elif isinstance(item, (list, tuple)):\n            nested_sum = smart_sum(*item)\n            result += nested_sum\n    return result"
b25me039_q6,8,8,100.00,"<output>Make sure to handle non-numeric values by returning 0 or None when they are encountered, as simply ignoring them can lead to incorrect results.</output>","def smart_sum(*args):\n    def helper(x):\n        if isinstance(x, (int, float)):\n            return x\n        if isinstance(x, (list, tuple)):\n            return sum(helper(i) for i in x)\n        return 0\n    return sum(helper(a) for a in args)\n"
B25EC026_q6,4,8,50.00,"<output>Check that you're iterating over each element in the nested lists/tuples using a recursive approach, and avoid modifying the original list while iterating over it.</output>",def smart_sum(*args):\n    s=0\n    for i in args:\n        if type(i)==list or type(i)==tuple:\n            for j in i:\n                s+=j\n        else:\n            s+=i\n    return s\n
B25ME011_q6,0,8,0.00,"<output>Verify that `args` is correctly defined as a single value or a collection, and ensure it's not being passed multiple values at once.</output>","def smart_sum(args):\n    """"""\n    sum all nueric inputs , including numbers containes inside lists\n    \n    """"""\n    if isinstance(args,int):\n        return args\n    sum=0\n    for i in args:\n        if isinstance(i,(list,tuple)):\n            sum=sum + smart_sum(i)\n        else:\n            sum=sum+i\n    return sum\nprint(smart_sum((1,2,[3,4],(5,6))))\nprint(smart_sum(10))\nprint(smart_sum([1,[2,3]]))\n\n"
B25EC030_q6,8,8,100.00,"</output> The function should also handle cases where a non-numeric item is passed as an argument, instead of just ignoring it, to make the function more robust.","def smart_sum(*args):\n \n  total = 0\n  \n  \n  for item in args:\n    # Check if the item is a list or a tuple\n    if isinstance(item, (list, tuple)):\n      \n      total += smart_sum(*item)\n    else:\n      # This is the base case: if the item is just a number, add it.\n      total += item\n      \n  return total"
B25CS019_q6,0,8,0.00,"<output> Re-evaluate the line `a = str(n[i][j])` where `n[i]` is a list or tuple. Ensure that you're not attempting to convert non-numeric values to integers, as this will cause a TypeError. </output>","def smart_sum(args):\n    n = args\n    \n    if len(n) == 1 :   #single obj then take out 0 index obj to get output in int\n        sum = n[0]\n    else:\n        \n        for i in range (0 , len(n)):\n            sum = 0\n            if not  isinstance(n[i],list):\n                if not isinstance(n[i],tuple):  # if obj at index i is not list or tuple then obj can be added to sum \n                    a = (str(n[i]))\n                    b =int(a)\n                    sum = sum + b\n                else:\n                    for j in range(0,len(n[i])): # obj is tuple then take out every single obj in tuple and add to sum\n                          a = (str(n[i][j]))\n                          b =int(a)\n                          sum = sum + b               \n            else :\n                for k in range(0,len(n[i])):# obj is list then take out every single obj in list and add to sum\n                    a = (str(n[i][k]))\n                    b =int(a)\n                    sum = sum + b\n                    \n                            \n    return sum\n            \nprint(smart_sum([1,2,[3,4],(5,6)]))\nprint(smart_sum([10]))\nprint(smart_sum([1,[2,3]]))\n"
B25MT014_q6,8,8,100.00,<output>Verify that you are correctly handling non-numeric inputs by checking the `isinstance` conditions and ensuring they do not lead to unexpected operations.</output>,"\n\ndef smart_sum(*args):\n    """"""\n    Sum all numeric inputs, including numbers contained inside lists or tuples\n    (which themselves may be nested arbitrarily). Non-numeric values are not\n    expected. Return the sum as an int or float.\n    """"""\n    total = 0\n    for item in args:\n        if isinstance(item, (list, tuple)):\n            # If the item is a list or tuple, recursively call smart_sum\n            # on its elements by unpacking them.\n            total += smart_sum(*item)\n        elif isinstance(item, (int, float)):\n            # If the item is a number, add it to the total.\n            total += item\n    return total"
shourya_q6,8,8,100.00,<output>Verify that you are correctly handling non-numeric arguments by checking if they are lists or tuples before attempting to recursively add their elements.</output>,"def smart_sum(*args):\n    total=0\n    for y in args:\n        if type(y) in [int,float]:\n            total=total+y\n        elif type(y) in [list,tuple]:\n            total=total+smart_sum(*y)\n    return total\n\n"
B25DS006_q6,8,8,100.00,"<output>Make sure to handle nested lists and tuples by using `extend` method instead of `+`, as `+` will create a new list, whereas `extend` modifies the existing one.</output>","def smart_sum(*args):\n    sum=0\n    for i in range(len(args)):\n        if isinstance(args[i],(list,tuple)):\n            sum+=smart_sum(*args[i])\n        else:\n            sum+=args[i]\n    return sum\n"
B25ME033_Q6,8,8,100.00,"<output> The function should check if `p` and each element in `args` are lists or tuples before trying to call the `check_and_add` method on them, as this would result in a TypeError when trying to add an integer or float to a list or tuple. </output>","def check_and_add(q):\n    sum_partial=0\n    for i in q:\n        if type(i)==int or type(i)==float:\n            sum_partial+=i\n        elif type(i)==list or type(i)==tuple:\n            sum_partial+=check_and_add(i)\n    return sum_partial\ndef smart_sum(p,*args):\n    if type(p)==int or type(p)==float:\n            sum_final=p\n    elif type(p)==list or type(p)==tuple:\n            sum_final=check_and_add(p)\n    for i in args:\n        if type(i)==int or type(i)==float:\n            sum_final+=i\n        elif type(i)==list or type(i)==tuple:\n            sum_final+=check_and_add(i)\n    return sum_final\nsmart_sum(1, 2, [3, 4], (5, 6))\nsmart_sum(10)\nsmart_sum([1, [2, 3]])"
B25CS044_Q6,0,8,0.00,"<output>Passing `args` directly to `_sum` instead of using it as an iterable, causing the function to attempt to sum non-iterable values.</output>","#B25CS044_Q6\n#Sum all numeric inputs, including numbers contained inside liststhemselves may be nested arbitrarily\n\nargs=eval(input('Enter the data to be summed: '))\n\ndef smart_sum(args):\n    tot=0   #Defining variable to add individual sums of numbers or elements in a list or tuple\n    \n    def _sum(item):\n        total=0\n        \n        if type(item)==int or type(item)==float:    #Checking for numbers\n            total+=item\n        elif type(item)==list or type(item)==tuple: #Checking for lists\n            for num in item:\n                total+=_sum(num)\n        return total\n    \n    if type(args)==int:\n        tot=args     #Case if list only has one element\n    else:\n        for arg in args:\n            tot+=_sum(arg)\n        \n    print(tot)\n    \nsmart_sum(args)"
B25CS002_q6,8,8,100.00,"<output>Verify that you are correctly handling non-numeric arguments by checking for `type(n) == str` and ignoring them, rather than attempting to add or recursively process them.</output>",\ndef smart_sum(*args):\n    count = 0\n    for n in args:\n        if (type(n) == int or type(n) == float):\n            count = count + n\n        elif (type(n) == list or type(n) == tuple):\n            count = count + smart_sum(*n)\n    return count
B25EC010_q6,8,8,100.00,<output>Verify that you are correctly handling non-numeric arguments by checking if they are instances of tuple or list before attempting to recursively add their elements. This will prevent potential type errors and ensure the function behaves as expected.</output>,"def smart_sum(*args):\n    total=0\n    for x in args :\n         if type(x) in (int,float):\n             total=total+x\n         elif type(x) in (tuple,list):\n             total=total+smart_sum(*x)\n    return total\n\n\n\n"
B25EE009_q6,0,8,0.00,"<output> Check if your function `smart_sum` is correctly handling nested lists and tuples by using `extend()` instead of `sum()`, which causes the EOFError when trying to sum an empty list.</output>","m=list(eval(input(""enter the elements"")))\ndef smart_sum(m):\n    s=0\n    for i in m:\n        if isinstance(i,list)==True:\n            s=s+sum(i)\n        elif isinstance(i,tuple)==True:\n             s=s+sum(i)\n        else:\n            s=s+i\n    return s\nq=smart_sum(m)\nprint(q)\n    \n"
B25EE056_Q6,0,8,0.00,"<output> When checking if `sep_arg` is not an integer, you should check its type using `isinstance()` instead of comparing it with `type()`, as the latter returns the type object itself, not a boolean indicating whether an instance has that type. Use `isinstance(sep_arg, int)` to correctly identify integers in your list or tuple elements. </output>","def smart_sum(*args):\n    sum=0\n    for sep_arg in args:\n        if type(sep_arg)!=int:\n         for i in range(len(sep_arg)):\n            sum+=sep_arg[i]\n        else:\n            sum+=sep_arg\n    return sum\n  \nprint(smart_sum(1,2,[3,4],[5,6]))\nprint(smart_sum(10))\nprint(smart_sum(1,[2,3]))"
B25CS030_q6,8,8,100.00,"<output>Consider using a recursive function to flatten the input arguments and extract only numeric values, rather than relying solely on sorting.</output>","#Smart Sum\n\ndef sort_out(items):                    #Helper function to sort out the nessted lists/ tuples and collect all numbers.\n    sort = []\n    for i in items:\n        if isinstance(i, (int, float)): \n            sort.append(i)              # add one item\n        elif isinstance(i, (list, tuple)):\n            sort.extend(sort_out(i))    # rescursive call, extend(): add all items from an iterable\n    return sort\n\ndef smart_sum(*args):                   # * is used to collect multiple arguments in a single variable\n    sorted_list = sort_out(args)\n    return sum(sorted_list)\n    \n"
B25DS010_Q6,6,8,75.00,"<output> The issue lies in how you're handling non-numeric values; when a float is encountered, it's being treated as if it were iterable, resulting in the TypeError 'float' object is not iterable. Ensure that you only attempt to add numeric elements together.</output>","def smart_sum(*args):\n    sum = 0\n\n    for i in args:\n        if type(i)==int:\n            sum+=i\n        else:\n            for j in i:\n                if type(j)==int:\n                    sum+=j\n                else:\n                    for k in j:\n                        sum+=k\n    \n    return sum\n\nsmart_sum(1, 2, [3, 4], (5, 6))\nsmart_sum(10)\nsmart_sum([1, [2, 3]])"
B25ME049_q6,0,8,0.00,"<output>Check that the initial `sums` variable is being reassigned instead of added to, as it's initialized with 0 and then immediately overwritten on each recursive call.</output>","def smart_sum(*args):\n    sums = 0\n    def sum_recursive(item):\n        nonlocal sums\n        if isinstance(item, (int, float)):\n            sums = sums + item\n        elif isinstance(item, (list, tuple)):\n            for i in item:\n                sum_recursive(i)\n    for arg in args:\n        sum_recursive(arg)\n    print(sums)\n    return sums\n\nsmart_sum(1, 2, [3, 4], (5, 6))\nsmart_sum(10)\nsmart_sum([1, [2, 3]])"
B25ME008_Q6,6,8,75.00,"<output>When handling nested lists or tuples, ensure that you're only iterating over numeric values and not attempting to add non-numeric types to the sum.</output>","def smart_sum(*args):\n    sum = 0\n\n    for i in args:\n        if type(i)==int:\n            sum+=i\n        else:\n            for j in i:\n                if type(j)==int:\n                    sum+=j\n                else:\n                    for k in j:\n                        sum+=k\n    \n    return sum\n\nsmart_sum(1, 2, [3, 4], (5, 6))\nsmart_sum(10)\nsmart_sum([1, [2, 3]])"
B25DS032_q6,0,8,0.00,<output>Verify that the function handles non-numeric arguments correctly by checking if they are indeed lists or tuples before attempting to recursively call `smart_sum` on them.</output>,"def smart_sum(*args):\n    total = 0\n    for arg in args:\n        if isinstance(arg, (int, float)):\n            total += arg\n        elif isinstance( arg, (list, tuple)):\n            total += smart_sum(*arg)\n    return total\n\nprint(smart_sum(1, 2, [3, 4], (5, 6)))\nprint(smart_sum(10))\nprint(smart_sum([1, [2, 3]]))"
b25MM015_q6,0,8,0.00,"<output> Make sure to handle non-numeric inputs by using `isinstance(arg, (str, type(None)))` and raise a ValueError instead of ignoring them. </output>","def smart_sum(*args):\n    total = 0\n    for arg in args:\n        if isinstance(arg, (list, tuple)):\n            total += smart_sum(*arg)  # recursion for nested\n        elif isinstance(arg, (int, float)):\n            total += arg\n        else:\n            raise ValueError(f""Unsupported type: {type(arg)}"")\n    return total\n\n\n# 🔹 Example usage\nprint(smart_sum(1, 2, 3))                         # 6\nprint(smart_sum([1, 2, 3], (4, 5)))               # 15\nprint(smart_sum([1, [2, 3]], 4, (5, [6, 7])))     # 28\n"
B25MT022_q6,8,8,100.00,"<output>When handling nested lists or tuples, ensure that you correctly handle non-numeric elements by either ignoring them or explicitly converting them to numbers before addition.</output>","def smart_sum(*args):\n    \n    total = 0\n\n    for item in args:\n        if isinstance(item, (int, float)): \n            total += item\n        elif isinstance(item, (list, tuple)):  \n            total += smart_sum(*item)\n\n\n    return total\n"
B25DS029_q6,8,8,100.00,"<output>Check that `x` in the recursive call to `smart_sum` is indeed a tuple or list containing numeric elements, not just any type of iterable.</output>","def smart_sum(*args):\n    """"""\n    Sum all numeric inputs, including numbers contained inside\n    lists or tuples (which themselves may be nested arbitrarily).\n    Non-numeric values are not expected.\n    Return the sum as an int or float.\n    """"""\n    total = 0\n    for x in args:\n        if type(x) in (int, float):        \n            total += x #checking the int or float part and adding them first\n        if type(x) in (list, tuple):      \n            total += smart_sum(*x) #checking the inner lists and tuples and adding them\n    return total"
B25ME034_q6,8,8,100.00,<output>Verify that you're handling non-numeric values consistently by checking if `arg` is actually a list or tuple before attempting to recursively call `smart_sum()` on it.</output>,def smart_sum(*args):\n    total = 0\n    for arg in args:\n        if type(arg) == int or type(arg) == float:   \n            total += arg\n        elif type(arg) == list or type(arg) == tuple:  \n            total += smart_sum(*arg)\n        else:   \n            total += 0\n    return total\n
B25EC020_Q6,0,8,0.00,"<output>Check that `i` and `j` are numeric before attempting to add them to `sum`, as non-numeric values will raise a TypeError.</output>","###############################################################################\n#NAME: Kammuri Lok Prakash Chowdary\n#ID NO: B25EC020\n#Discipline: Electronics and Communication Engineering\n#institute Name: Indian Institute of Technology Bhilai\n#######################################################################################\nsum=0\ndef smart_sum(*args):\n    global sum\n    for i in args:\n        if type(i)==int:\n            sum+=i\n        else:\n            for j in range(len(i)):\n                sum+=i[j]\n    return sum\nprint(smart_sum(1,[2,3]))\n        "
B25EC007_q6,8,8,100.00,"<output>Verify that you are correctly handling non-numeric values by checking if `item` is actually a list or tuple before trying to recursively call `smart_sum` on it, and not just assuming it's numeric.</output>","def smart_sum(*args):\n    total = 0\n    for item in args:\n    \n        if isinstance(item,(int,float)):\n            total += item\n            \n        elif isinstance(item,(list,tuple)):\n            total += smart_sum(*item)\n        \n    return total\n\n"
B25DS043_q6,0,8,0.00,"<output>Be cautious when using recursion with mutable default arguments, as it can lead to unexpected behavior and type mismatches.</output>","def smart_sum(*args):\n    """"""\nSum all numeric inputs, including numbers contained inside\nlists or tuples (which\nthemselves may be nested arbitrarily). Non-numeric values\nare not expected.\nReturn the sum as an int or float.""""""\n    total = 0\n\n    def add_num(num):\n        nonlocal total\n        if isinstance(num, (list, tuple)):    #If num is a list or tuple, it iterates through its elements and calls add_num recursively.\n            for term in num:\n                add_num(term)\n        elif isinstance(num, (int, float)):\n            total += num\n        else:\n            raise TypeError(""smart_sum only supports ints, floats, lists, and tuples"")\n\n    for arg in args:\n        add_num(arg)\n\n    return total\n\nprint(smart_sum(1, 2, [3, 4], (5, 6))) # 21\nprint(smart_sum(10))                   # 10\nprint(smart_sum([1, [2, 3]]))          # 6"
B25CS037_q6,5,8,62.50,"<output> The issue lies in how you're handling the recursive calls within the `for` loop. Instead of using `smart_sum(i) == i`, it should be `sum += smart_sum(i)` to correctly accumulate the values. </output>",def smart_sum(args):\n    sum = 0\n    if type(args) == int or type(args) == float:\n        sum = args\n    else:\n        for i in args:\n            if type(i) == int or type(i)== float:\n                smart_sum(i) == i\n                sum+= i\n            elif type(i) == tuple or type(i) == list:\n                sum += smart_sum(i)\n    return sum\n        
B25MT009_Q6,8,8,100.00,"<output>Verify that the function handles non-numeric values by adding a conditional statement to check if `i` is of type int or float before attempting to add it to the sum, as ignoring non-numeric types may lead to incorrect results.</output>",''' if it is a list then we pass the content of the list as arguments to *args to  add the\nnested lists.'''\ndef smart_sum(*args):\n    s = 0\n    for i in args:\n        if type(i) == list or type(i) == tuple:\n            s += smart_sum(*i)\n        elif type(i) == int or type(i) == float:\n            s += i    \n    return s
B25ME030 Q6,0,8,0.00,"<output>Verify that the function handles non-numeric arguments by ignoring them, and ensure the recursive calls are correctly unpacked from nested lists or tuples.</output>","def smart_sum(*args):\n    total = 0\n    for x in args:\n        if type(x) == int or type(x) == float:   \n            total += x\n        elif type(x) == list or type(x) == tuple:  \n            total += smart_sum(*x)\n    return total\n\n\n\nprint(smart_sum(2,45, [4, 9], (9, 0)))   \nprint(smart_sum(678))                     \nprint(smart_sum([0, [9,4]]))            "
B25EC036_q6,0,8,0.00,"<output> Ensure that you handle non-numeric values by returning 0 or skipping them, as simply ignoring them can lead to incorrect results if they are part of the input. </output>","\ndef smart_sum(*args):\n    total = 0\n    for i in args:\n        if isinstance(i, (int, float)):        \n            total += i\n        elif isinstance(i, (list, tuple)):      \n            total += smart_sum(*i)              \n       \n    return total\n         \n\n\n\n         \n\n\nprint(smart_sum(1, 2, [3, 4], (5, 6)))   \nprint(smart_sum(10))                     \nprint(smart_sum([1, [2, 3]]))           \nprint(smart_sum((1, 2, (3, 4, [5]))))    \n \n\n\n\n"
B25EC015.q6,0,8,0.00,"<output>Check that `n` is indeed a list or tuple, and not a single number when calling `smart_sum`, as the function expects its first argument to be a sequence of numbers.</output>",def smart_sum(n):\n	s=0\n	for digits in n:\n		if type(digits)==int:\n			s+=digits\n		elif type(digits)==list:\n			s+=smart_sum(digits)\n		elif type(digits)==tuple:\n			s+=smart_sum(digits)\n	return s
B25DS020_Q6,0,8,0.00,"<output>Verify that you are correctly handling non-numeric values, such as strings or booleans, by adding a conditional statement to check if a value is numeric before attempting to add it to the sum.</output>","def smart_sum(*n):\n    sum=0\n    for i in n:\n        if type(i)==list or type(i)==tuple :\n             sum=sum+smart_sum(*i)            \n#if i is list then again call the function smart_sum\n        else:\n            sum=sum+i\n#sum of digit\n            \n    return(sum)\nprint(smart_sum(1, (5, 6)))\n            "
B25ME002_q6,0,8,0.00,"<output> Make sure that `smart_sums` is defined at the top level of the script, not inside another function. This will help ensure that it can be called as intended when using the `*args` syntax. </output>","def smart_sums(*args):\n    total = 0\n    for arg in args:\n        if isinstance(arg, int):\n            total += arg\n        elif isinstance(arg, (list, tuple)):\n            total += smart_sums(*arg)  \n    return total"
B25MT011_q6,0,8,0.00,"<output>Verify that the `flatten_and_sum` function correctly handles non-numeric elements by checking its return value when passed a non-numeric argument, such as a string or list containing strings.</output>","def smart_sum(*args):             \n    def flatten_and_sum(item):       \n        if isinstance(item, (int, float)):\n            return item\n        elif isinstance(item, (list, tuple)):\n            return sum(flatten_and_sum(x) for x in item)\n        else:\n            return 0\n\n    total = 0\n    for arg in args:\n        total += flatten_and_sum(arg)\n    return total\n\n\nprint(smart_sum(1, 2, [3, 4], (5, 6))) \nprint(smart_sum(10))\nprint(smart_sum([1, [2, 3]]))\n"
