student_id,tests_passed,tests_total,score_percentage,semantic_summary,code_snippet
B25CS025_q6,0,8,0.00,"<output> The recursive function seems to be missing a base case, which is necessary to stop the recursion and return the final sum. Consider adding a condition to handle when `index` becomes an empty list or tuple.</output>",def recursion(index):\n    '''i created a recursion function which will see if an index in the input was a list or a tuple \n    if yes i called the recursion function again else i added the sum'''\n    totsum = 0\n    for i in range(len(index)):\n        if type(index[i]) == list or type(index[i]) == tuple:\n            totsum=totsum+recursion(index[i])\n        else:\n            totsum=totsum +index[i]\n    return totsum\n\ndef smart_totsum(*args):\n    '''here i again used the same logic and calculated the sum'''\n    totsum = 0\n    for i in args:\n        if type(i) == list or type(i) == tuple:\n            totsum=totsum + recursion(i)\n        else:\n            totsum = totsum + i\n    return totsum\n\n
B25EC008_ q6,8,8,100.00,<output>Verify that the `total` variable is being updated correctly by checking its initial value and ensuring it's not being overwritten elsewhere in the code.</output>,"def smart_sum(*args):\n#Sums all numbers, including those nested in lists or tuples.\n    total = 0\n\n    def find_and_add(items):\n        nonlocal total\n        for item in items:\n            if isinstance(item, (int, float)):\n                total += item\n            elif isinstance(item, (list, tuple)):\n                find_and_add(item)\n\n    find_and_add(args)\n    return total\n\n\n"
B25CS029_q6,2,8,25.00,"<output> Recursively add numeric values within nested lists or tuples by using `sum()` function with a generator expression, e.g., `S = S + sum(i) for i in args if isinstance(i, (int, float))`, to avoid type mismatch errors. </output>",def smart_sum(*args):\n    S = 0\n    for i in args:\n        if type(i) == int:\n            S = S + 1\n        elif type(i) == list or tuple:\n            a = sum(i)\n            S = S + a\n    return S\n
B25EE019_q6,8,8,100.00,"<output>Verify that you are correctly handling non-numeric inputs by checking if `x` is indeed a number before attempting to add it to `total`. If `x` is not numeric, consider raising a meaningful error message instead of silently ignoring the input.</output>","def smart_sum(*args):\n    total=0\n    for x in args:\n        if type(x) in [int,float]:\n            total=total+x\n        elif type(x) in [list,tuple]:\n            total=total+smart_sum(*x)\n    return total\n\n"
(q6)B25ME017,0,8,0.00,"<output> The function `smart_sum` expects its arguments to be lists or tuples, but you're passing individual numbers directly, which is causing the TypeError when trying to add them. </output>","def smart_sum(n:list):\n    a = list(n)\n    b =[]\n    for i in range(0,len(a)):\n        if len(str(a[i]))==1:\n            b.append(a[i])\n        else:\n            for j in range(0,len(a[i])):\n                b.append(a[i][j])\n    sum = 0\n    for ele in b:\n        sum = sum + int(ele)\n        \n    return sum\n\nprint(smart_sum([1,2,3,4,5,[3,4,5],[8,9,2]]))"
b25me036_q6,8,8,100.00,"<output>Verify that you are correctly handling non-numeric values by checking if `item` is actually a list or tuple before trying to recursively call `smart_sum()` on it, and consider adding a type check for the returned value from `*item` to ensure it's numeric.</output>","def smart_sum(*args):\n    """"""\n    Recursively sum all numeric inputs, including numbers inside lists/tuples (nested arbitrarily).\n    """"""\n    total = 0\n    for item in args:\n        if isinstance(item, (int, float)):\n            total += item\n        elif isinstance(item, (list, tuple)):\n            total += smart_sum(*item)\n    return total\n"
B25MT018_q6,0,8,0.00,"<output>Initialize the sum variable before using it, e.g., `sum = 0` instead of `sum = o`.</output>","def smart_sum(*args):\n    sum=o\n    for i in args:\n        if isinstance(i,(int,float)):   # to check if i is int float\n            sum=sum+i\n        elif isinstance(i,(list,tuple)):   # to check if i is tuple or list\n            sum=sum+smart_sum(*i)\n    return sum\n            \n            \n\n         \n     \n     \n\n\n\n        \n        "
B25EE026_Q6,8,8,100.00,"<output> The issue lies in the fact that you're trying to add a list/tuple to the sum, which is not numeric. This happens when `i` is a nested list or tuple containing non-numeric values. You need to ensure that only numbers are added to the sum. </output>",#WAP to find smart sum\nsum=0\ndef smart_sum(*args):\n    global sum\n    for i in args:\n        tp=type(i)#check for data type\n        if tp==int or tp==float:#add if int or float\n            sum+=i\n        elif tp==list or tp==tuple:#go inside in case of list or tuple\n            smart_sum(*i)#recursion\n    return sum
B25DS040_q6,0,8,0.00,"<output>Consider modifying the line `if type(item) == int or type(item) == float:` to handle cases where `item` is actually a list or tuple, as this condition would incorrectly skip over nested numeric values.</output>","def smart_sum(*args):\n    total = 0\n    stack = list(args)\n    \n    while stack:\n        item = stack.pop(0)\n        if type(item) == int or type(item) == float:\n            total += item\n        elif type(item) == list or type(item) == tuple:\n            for elem in item:\n                stack.append(elem)\n    \n    return total\nprint(smart_sum(1, 2, 3))\nprint(smart_sum([1, 2, 3], 4))\nprint(smart_sum())\n"
B25CS020_q6,3,8,37.50,"<output> Make sure the function `smart_sum` takes only one positional argument, as indicated by its name and the problem description. This will ensure that it can handle variable numbers of arguments correctly.</output>",def smart_sum(args):\n    j = 0\n    l = 0\n    \n    for i in args:\n        if type(i) == int:\n            j = j + i\n        else:\n            for k in i:\n                l = l + k\n        \n        \n    m = l + j\n    return m\n\n            \n            \n    
B25EE057_Q6,0,8,0.00,"<output> The function `smart_sum` should be modified to handle cases where it is called with a single non-numeric argument, as this would result in a TypeError when trying to add the number to the total. For example, if `smart_sum('a', 1)` were called, it would fail because 'a' is not numeric.</output>","def smart_sum(*args):             #define a function for smart sum\n    def flatten_and_sum(item):       #again define a function for flatten and sum of items\n        if isinstance(item, (int, float)):\n            return item\n        elif isinstance(item, (list, tuple)):\n            return sum(flatten_and_sum(x) for x in item)\n        else:\n            return 0\n\n    total = 0\n    for arg in args:\n        total += flatten_and_sum(arg)\n    return total\n\n\nprint(smart_sum(1, 2, [3, 4], (5, 6))) \nprint(smart_sum(10))\nprint(smart_sum([1, [2, 3]]))\n"
B25EE021_q6,8,8,100.00,"<output>When checking for numeric values, ensure that you handle potential list or tuple elements correctly by using `any()` function along with conditional statements to filter out non-numeric types.</output>","def smart_sum(*args):\n    """"""\n    Sum all numeric inputs, including numbers contained inside lists themselves may be nested arbitrarily).\n    Non-numeric values are not Return the sum as an int or float.\n    """""" \n    total = 0\n    for arg in args:\n        if type(arg) in [int, float]:\n            total += arg\n        elif type(arg) in [list, tuple]:  \n            total += smart_sum(*arg)       \n    return total\n"
B25EE025_q6,0,8,0.00,"<output>Verify that the function handles non-numeric arguments by ignoring them and not attempting to perform arithmetic operations with them, as this could lead to unexpected results or errors.</output>","def smart_sum(* args):\n	total = 0\n	\n	for arg in args:\n		if isinstance(arg, (int, float)):\n			total += arg\n		elif isinstance(arg, (list, tuple)):\n				total += smart_sum(*arg)\n			\n	return total\n# test cases\nprint(smart_sum(10))\nprint(smart_sum([1,[2,3]]))\n"
B25MM023_q6,8,8,100.00,"<output> Ensure that all elements being added together are numeric, as attempting to add non-numeric values will result in a TypeError. For example, if `smart_sum(1, 2, 'a')` is called, it should raise an error instead of returning a float value. </output>","def smart_sum(*args):\n    sum = 0\n    for i in args:\n        if isinstance(i, (int, float)):\n            sum+=i\n        elif isinstance(i, (list, tuple)):\n            sum+=smart_sum(*i)\n    return sum\n\n"
B25DS001_q6,4,8,50.00,"<output>When handling nested lists or tuples, ensure that you are iterating over each element individually, rather than treating the entire list as a single value.</output>","def smart_sum(*args):\n    s=0\n    for i in args:\n        if  isinstance(i,int):\n            s=s+i\n        \n        else:\n            for j in i:\n                s=s+j\n    return s\n\n#smart_sum(1,2,[3,4],(5,6))\n\n    \n        \n"
b25cs038 q6,8,8,100.00,"<output>Verify that you are correctly handling non-numeric arguments by checking if `item` is not a list or tuple before attempting to add it to `total`. This can be achieved with an additional conditional statement, such as `elif isinstance(item, str): total += 0`, ensuring that non-numeric values do not affect the sum.</output>","def smart_sum(*args):\n    total = 0\n    \n    def recursive_sum(item):\n        nonlocal total\n        if isinstance(item, (int, float)):\n            total += item\n        elif isinstance(item, (list, tuple)):\n            for sub_item in item:\n                recursive_sum(sub_item)\n    \n    for arg in args:\n        recursive_sum(arg)\n    \n    return total"
B25CS026_q6,8,8,100.00,"<output>Check that the `sum` function correctly handles nested structures by testing it with a known example, such as `[1, 2, [3, 4], (5, 6)]`, and verify that non-numeric values are ignored.</output>","def smart_sum(*args):\n    """"""\n    Sum all numeric inputs, including numbers contained inside\n    lists or tuples (which themselves may be nested arbitrarily).\n    Non-numeric values are not expected.\n    Return the sum as an int or float.\n    """"""\n\n    def sum(item):\n        total = 0\n        \n        if type(item) == int or type(item) == float:\n            total = total + item\n        \n        elif type(item) == list:\n            for i in item:\n                total = total + sum(i)\n        elif type(item) == tuple:\n            for j in item:\n                total = total + sum(j)\n        return total\n\n    total1 = 0\n    for k in args:\n        total1 = total1 + sum(k)\n\n    return total1\n    \n    \n\n\n"
B25MT005_q6,8,8,100.00,"<output>Verify that you're correctly handling nested lists and tuples by checking the type of each element before attempting to add it to the total; if `x` is a list or tuple, recursively call `smart_sum` on its elements.</output>","def smart_sum(*args):\n    """"""\n    Sum all numeric inputs, including numbers contained inside\n    lists or tuples (which themselves may be nested arbitrarily).\n    Non-numeric values are not expected.\n    Return the sum as an int or float.\n    """"""\n    total = 0  # Initialize total to 0\n    for x in args:\n        t = type(x)  # For easy coding\n        if (t is int or t is float):  # Type is int or float   \n            total += x\n        if (t is list or t is tuple):  # Type is list or tuple    \n            total += smart_sum(*x)    # Final sum\n    return total  # Total will be output\n\n"
B25EC044_Q6,0,8,0.00,"<output>Check that you're not modifying the original lists or tuples while recursing over them; instead, create new lists to accumulate the results.</output>","\n\n\n\ndef smart_sum(*args):\n    def insidelist(n):\n        l=0\n        t=type(n)\n        if t is list:\n            for i in range(len(n)): #if the element is single number we return the number if it is a list or tuple we return the sum of the list or tuple and at the end we return the sum of all the values we counted earlier\n                l=l+n[i]\n                return l           \n        elif t is tuple:\n            for i in range(len(n)):\n                l += n[i]\n                return l\n        else:\n            return n\n          \n    total = 0\n    for item in args:\n        total=total+insidelist(item)\n    return total\n\nprint(smart_sum(1, 2, [3, 4],(5, 6)))\n"
B25ME051_Q6,8,8,100.00,"<output> Make sure to handle non-numeric arguments by ignoring them, rather than relying on the `global` keyword or modifying built-in functions like `sum`. For example, if you pass a string argument, it should simply be skipped without affecting the sum of numeric values.</output>",sum=0\ndef smart_sum(*args):\n    global sum\n    for i in args:\n        tp=type(i)#check for data type\n        if tp==int or tp==float:#int or float\n            sum+=i\n        elif tp==list or tp==tuple:#list or tuple\n            smart_sum(*i)#recursion\n    return sum\n
B25EE058_q6,8,8,100.00,<output>Consider modifying your recursive function call to `check_and_add(i[0])` instead of `check_and_add(i)` to correctly handle nested lists and tuples.</output>,"def check_and_add(q):\n    sum_partial=0\n    for i in q:\n        if type(i)==int or type(i)==float:\n            sum_partial+=i\n        elif type(i)==list or type(i)==tuple:\n            sum_partial+=check_and_add(i)\n    return sum_partial\ndef smart_sum(p,*args):\n    if type(p)==int or type(p)==float:\n            sum_final=p\n    elif type(p)==list or type(p)==tuple:\n            sum_final=check_and_add(p)\n    for i in args:\n        if type(i)==int or type(i)==float:\n            sum_final+=i\n        elif type(i)==list or type(i)==tuple:\n            sum_final+=check_and_add(i)\n    return sum_final\nsmart_sum(1, 2, [3, 4], (5, 6))\nsmart_sum(10)\nsmart_sum([1, [2, 3]])"
B25EC027_q6,3,8,37.50,<output>Verify that you are correctly handling the variable number of positional arguments by checking if each argument is indeed a list or tuple when recursively calling `smart_sum` on its elements.</output>,"""""""\nSum all numeric inputs, including numbers contained inside\nlists or tuples (which\nthemselves may be nested arbitrarily). Non-numeric values\nare not expected.\nReturn the sum as an int or float.\n""""""\ndef smart_sum(args):\n    s=0\n    for i in args:\n        if (type(i)==int or type(i)==float):\n            s+=i\n        elif (type(i)==list or type(i)==tuple):\n            for a in i:\n                s=s+a\n    return s\n'''args=eval(input('input:'))\nprint(smart_sum(args))'''\n"
B25CS011_q6,8,8,100.00,"<output>Consider adding a conditional statement to check if `i` is an instance of numbers (either int or float) before attempting to add its value to `sums`, as the current implementation will throw a TypeError when encountering non-numeric types.</output>","def funsum(nist):\n    """"""This function returns sum of the elements\n       input""""""\n    sums=0\n    if type(nist)== int or type(nist)== float:\n        sums = nist\n    else:\n        for i in nist:\n            sums += funsum(i)\n    return sums\n    \ndef smart_sum(*args):\n    """"""returns final answer""""""\n    sums=0\n    for i in args:\n        sums += funsum(i)\n    return sums\n "
B25EC018_q6,0,8,0.00,"<output> The function seems to be correctly handling nested lists and tuples, but it's missing a crucial step: converting the sum result back to a float if there are any non-numeric values in the input. This could lead to an incorrect result or loss of precision for inputs containing decimal numbers. </output>","def smart_sum(*args):\n    def k(x):\n        if isinstance(x,(list,tuple)):\n            return sum(k(v) for v in x )\n        else:\n            return int(x)\n    return sum(k(v)for v in args)\n    \n\nprint(smart_sum(1,[2,3]))"
B25EC014_q6,0,8,0.00,"<output>Check that you are not using `localsum` which is a local variable inside the recursive function, instead use a different name for the accumulator.</output>","def smart_sum(*args):\n    """"""\n    Sum all numeric inputs, including numbers contained inside\n    lists or tuples (which\n    themselves may be nested arbitrarily). Non-numeric values\n    are not expected.\n    Return the sum as an int or float.\n    """"""\n     def recursive_sum(ele):\n         localsum=0\n         for i in ele:\n             if type(i)==list or type(i)==tuple:\n                 localsum=localsum+recursive_sum(i)\n             else:\n                 localsum=localsum+i\n         return localsum\n     sum=0\n     for j in args:\n         if type(j)==list or type(j)==tuple:\n                 sum=sum+recursive_sum(j)\n         else:\n                 sum=sum+j\n                \n     return sum\n\nprint(smart_sum([1, [2, 3]]))\n                 \n             \n             "
B25CS027_Q6,0,8,0.00,"<output> Consider handling the case where the input is an empty list or a non-list/numeric value, as this could lead to an infinite recursion or incorrect results in your `smart_sum` function.</output>","data = [1, [2, 3], (4, 5)]\n\ndef calc(x):\n    total = 0\n    for i in x:\n        if isinstance(i, (int, float)):\n            total += i\n        elif isinstance(i, (list, tuple)):\n            total += calc(i)\n    return total\n\nprint(calc(data))\n"
B25EC031_q6,8,8,100.00,"<output>Be cautious when handling nested lists or tuples, as they can contain non-numeric values that may cause unexpected behavior.</output>","def smart_sum(*args):\n    """"""\n    Sum all numeric inputs, including numbers contained inside\n    lists or tuples (which\n    themselves may be nested arbitrarily). Non-numeric values\n    are not expected.\n    Return the sum as an int or float.\n    """"""\n    sum = 0\n\n    for arg in args:\n        if type(arg) in (int, float):\n            sum += arg\n        elif type(arg) in (list, tuple):\n            sum += smart_sum(*arg)\n    \n    return sum\n"
B25ME003_q6,8,8,100.00,"<output>Verify that the function handles non-numeric arguments by ignoring them, and ensure that all numeric values are added correctly, even when they appear within nested lists or tuples.</output>","def smart_sum(*args):\n    s=0\n    for i in args:\n        if isinstance(i,(int,float)):\n            s+=i\n        elif isinstance(i,(list,tuple)):\n            s+=smart_sum(*i)\n    return s\n\n    \n    \n        "
s25ma008_q6,0,8,0.00,"<output> Make sure `arg` is a single value, not a function or another argument, by changing the function definition to `def smart_sum(*args):`. </output>","sum = 0 \ndef smart_sum(arg):\n    global sum\n    if type(arg) == int or type(arg) == float:\n        sum+=arg\n    elif type(arg)==list or type(arg) == tuple:\n        for n in arg:\n            if type(n) == int:\n                sum+=n\n            elif type(n) == list:\n                sum=smart_sum(n)\n            elif type(n) == tuple:\n                sum=smart_sum(n)\n    return sum\n        \nprint(smart_sum((1,2,3,[4,5],(6,7))))"
B25EE011_q6,0,8,0.00,"<output>Verify that all elements being added to `total` are indeed numeric, as non-numeric values could lead to unexpected results or errors.</output>","def smart_sum(*args):\n    total = 0\n    for i in args:\n        if isinstance(i,(int, float)):\n            total += i\n        elif isinstance(i,(list,tuple)):\n            total+=smart_sum(*i)\n    return total\n\nprint(smart_sum(1, 2, [3, 4], (5, 6)))\nprint(smart_sum(10))\nprint(smart_sum([1, [2, 3]]))\n"
B25MT006_q6,0,8,0.00,"<output>Verify that you are correctly handling non-numeric values by checking for `type(value)` equal to `(int, float)` before attempting to add them to the total.</output>","#q6\n\ndef smart_sum(*args):\n    total = 0\n\n    for value in args:\n        if isinstance(value, (int, float)):\n            total += value\n        elif isinstance(value, (list, tuple)):\n            # use recursion to handle nested lists/tuples\n            total += smart_sum(*value)\n\n    return total\n\n\n# Test cases\nprint(smart_sum(1, 2, [3, 4], (5, 6)))     \nprint(smart_sum(10))                       \nprint(smart_sum([1, [2, 3]]))              \n"
B25EE038.Q6,0,8,0.00,"<output>Make sure to handle nested lists correctly by using a recursive approach within your function, such as calling `smart_sum` on each element in the list.</output>","def smart_sum(*args):\n    """"""\n       Sum all numeric inputs, including numbers contained inside lists\nthemselves may be nested arbitrarily). Non-numeric values are not\nReturn the sum as an int or float.\n                                  """"""\n    \n    s = 0\n    for arg in args:\n        if isinstance(arg,list):\n            for nums in arg:\n                if isinstance(nums,list):\n                    for num in nums:\n                        s += num\n                else:\n                    s += nums\n                    \n        elif isinstance(arg,tuple):\n            for nums_2 in arg:\n                s += nums_2\n        else:\n            s += int(arg)\n            \n    return s\nprint(smart_sum(1,2,[3,4],(5,6)))\nprint(smart_sum(10))\nprint(smart_sum([1,[2,3]]))"
B25CS041_q6,8,8,100.00,"<output>When calling `smart_sum()` with a non-numeric argument, such as a list or tuple, it will attempt to recursively call itself on that value. Instead, ensure the function only attempts to sum numeric values directly, and handle non-numeric inputs by ignoring them.</output>","def smart_sum(*args):\n    """"""\n    Sum all numeric inputs, including numbers contained inside\n    lists or tuples (which\n    themselves may be nested arbitrarily). Non-numeric values\n    are not expected.\n    Return the sum as an int or float.\n    """"""\n    \n    s = 0\n    for i in args:\n        if isinstance(i,(int,float,complex)):\n            s += i\n        else:\n            s += smart_sum(*i)\n                \n    return s\n    \n"
B25ME009_q6,8,8,100.00,"<output>Consider adding error handling to ensure that the function can handle cases where `args[i]` is not a number, such as a string or other non-numeric type.</output>","def smart_sum(*args):\n    sum=0\n    for i in range(len(args)):\n        if isinstance(args[i], (list, tuple)):  # If item is list or tuple, call again\n            sum += smart_sum(*args[i])\n        else:\n            sum += args[i]  # If item is number,  add it to sum\n    return sum  \n"
B25CS056_q6,8,8,100.00,<output>Verify that you are correctly handling nested lists or tuples by checking if `add_data` is defined before using it; ensure its return value can be added to the total sum.</output>,"def smart_sum(*args):\n    """"""\n    Sum all numeric inputs, including numbers contained inside\n    lists or tuples (which themselves may be nested arbitrarily). \n    Non-numeric values are not expected.\n    Return the sum as an int or float.\n    """"""\n    sum = 0\n    for arg in args:\n        if type(arg) == list or type(arg) == tuple:         #Checking the type\n            sum += add_data(arg)                   #if iterable send to given function\n        else:\n            sum += arg                             #else:  add them\n    return sum\n    \n\ndef add_data(arg):\n    """"""\n    Recursively checks the given input again,\n    Till the point we get non-iterable types\n    Also calculates sum for iterables\n    """"""                                  \n    add = 0\n    for i in arg:\n        if type(i) == list or type(i) == tuple:\n            add += add_data(i)\n        else:\n            add+= i\n    return (add)\n\n# print(smart_sum(10))\n# print(smart_sum(1, 2, [3, 4], (5, 6)))\n# print(smart_sum([1, 2, [3, 4], (5, 6)]))\n# print(smart_sum([1, [2, 3]]))\n"
B25ME060_q6,8,8,100.00,"<output> Ensure that all arguments passed to `smart_sum` are either numeric values or lists/tuples containing only numeric values, as non-numeric types will cause a TypeError when attempting to add them to the total.</output>","def smart_sum(*args):\n    total = 0\n    for i in args:\n        if isinstance(i, (int,float)):\n            total += i\n        elif isinstance(i, (list,tuple)):\n            total += smart_sum(*i)\n            \n    return total\n\n            "
B25MM021_q6,8,8,100.00,"<output>It appears that the `sort_out` function is not correctly handling nested lists and tuples, causing it to return a non-numeric list instead of a numeric one.</output>","#Smart Sum\n\ndef sort_out(items):                    #Helper function to sort out the nessted lists/ tuples and collect all numbers.\n    sort = []\n    for i in items:\n        if isinstance(i, (int, float)): \n            sort.append(i)              # add one item\n        elif isinstance(i, (list, tuple)):\n            sort.extend(sort_out(i))    # rescursive call, extend(): add all items from an iterable\n    return sort\n\ndef smart_sum(*args):                   # * is used to collect multiple arguments in a single variable\n    sortedlist = sort_out(args)\n    return sum(sortedlist)\n    \n"
B25MT004_q6,0,8,0.00,"<output>Verify that you're correctly handling nested lists or tuples by checking if `x` is actually iterable before calling `smart_sum(*x)`, as this could lead to infinite recursion if the inner list/tuple contains non-numeric values.</output>",def smart_sum(*args):\n    total = 0\n    for x in args:\n        t = type(x)\n        if (t is int or t is float):     \n            total += x\n        if (t is list or t is tuple):      \n            total += smart_sum(*x)\n    return total\n\nprint(smart_sum())
