student_id,tests_passed,tests_total,score_percentage,semantic_summary,code_snippet
B25EC035_q6,0,8,0.00,"<output> When handling nested lists or tuples, ensure that you're recursively calling `ltd` only on numeric elements by checking the type of each element before attempting to add it to the sum. For example, instead of `l += n[i]`, consider using a conditional statement like `if isinstance(n[i], (int, float)) else l += n[i]`. </output>","""""""\nSum all numeric inputs, including numbers contained inside\nlists or tuples (which\nthemselves may be nested arbitrarily). Non-numeric values\nare not expected.\nReturn the sum as an int or float.\n""""""\n\ndef smart_sum(*args):\n    def ltd(n):\n        l = 0\n        t =type(n)\n        if t is list:\n            for i in range(len(n)):\n                l += n[i]\n            return l\n        elif t is tuple:\n            for i in range(len(n)):\n                l += n[i]\n            return l\n        \n        else:\n            return n\n    \n    tatol = 0\n    for item in args:\n        tatol += ltd(item)\n    return tatol\n\nprint(smart_sum(1, 2, [3, 4],(5, 6)))"
B25EC039_q6,8,8,100.00,"<output>Be cautious when passing non-numeric values to `smart_sum`, as they may not be handled correctly, and consider adding type checks for the arguments passed to the function.</output>","def smart_sum(*args):\n    ans=0\n    for i in args:\n        if isinstance(i,int) or isinstance(i,float):\n            ans+=i\n        else:\n            ans+=smart_sum(*i)\n    return ans\nsmart_sum(1, 2, [3, 4], (5, 6)) # 21\nsmart_sum(10) # 10\nsmart_sum([1, [2, 3]]) # 6"
B25MT015_q6,8,8,100.00,"<output>Consider handling non-numeric elements more explicitly, as the current implementation will not correctly handle nested lists or tuples containing non-numeric values.</output>",def smart_sum(*args):\n    total = 0\n    \n    for item in args:\n        if type(item) == int or type(item) == float:\n            total = total + item\n        elif type(item) == list or type(item) == tuple:\n            for element in item:\n                if type(element) == list or type(element) == tuple:\n                    for nested_element in element:\n                        if type(nested_element) == list or type(nested_element) == tuple:\n                            for deep_element in nested_element:\n                                if type(deep_element) == int or type(deep_element) == float:\n                                    total = total + deep_element\n                        else:\n                            if type(nested_element) == int or type(nested_element) == float:\n                                total = total + nested_element\n                else:\n                    if type(element) == int or type(element) == float:\n                        total = total + element\n    \n    return total
B25CS046_q6,0,8,0.00,<output>Check if you are correctly handling nested lists and tuples by using recursion to flatten them before adding their elements.</output>,"def smart_sum(*args):\n    ''' Sum all numeric inputs,including no.s in contained inside lists or tuples(which themselves may be nested arbitrarily). Non - numeric are not expected.\n        returns the sums as int or float'''\n    sum=0\n    for item in args:\n        if type(item)==list:\n            for x in item:\n                sum+=x\n        elif type(item)==tuple:\n            for x in item:\n                sum+=x\n        else:\n            sum +=item\n    return sum\nprint(smart_sum(37,34))      \n     \n"
B25MT020_Q6,0,8,0.00,<output>Verify that you are correctly handling nested lists or tuples by checking if `item` is a tuple and has at least two elements before trying to unpack it with `*item`. This will prevent potential errors when dealing with deeply nested structures.</output>,"def smart_sum(*args):\n    """"""\n    Sum all numeric inputs, including numbers contained inside\n    lists or tuples (which themselves may be nested arbitrarily).\n    Non-numeric values are not expected.\n    Return the sum as an int or float.\n    """"""\n    total = 0\n    for item in args:\n        if isinstance(item, (int, float)):\n            total += item\n        elif isinstance(item, (list, tuple)):\n            total += smart_sum(*item)  # Unpack and recurse\n    return total\nprint(smart_sum(1, 2, [3, 4], (5, 6)))  "
B25CS060_q6,0,8,0.00,"<output> Ensure that all elements being added to the sum are numeric, as attempting to add a non-numeric value (like a list or tuple) will raise a TypeError. For example, adding `[1, 2]` and `3` together would result in a TypeError.</output>","def smart_sum(*args):\n	sum=0\n	for i in args:\n		if type(i) in [list,tuple]:\n			sum+=smart_sum(*i)\n				\n		else:\n			sum+=i\n			\n	return sum\n\n#test cases\nprint(smart_sum(1, 2,[3,4],(5, 6)))\nprint(smart_sum([1, [2, 3]]))	\nprint(smart_sum(10))"
B25ME038_Q6,0,8,0.00,<output>Consider handling the case where the input is an empty list or contains only non-numeric elements by adding a check at the beginning of your function to return 0 in such cases.</output>,"data = [1, [2, 3], (4, 5)]\n\ndef calc(x):\n    total = 0\n    for i in x:\n        if isinstance(i, (int, float)):\n            total += i\n        elif isinstance(i, (list, tuple)):\n            total += calc(i)\n    return total\n\nprint(calc(data))\n"
B25EC019_q6,0,8,0.00,"<output>Check that all elements being added together are numeric, and handle non-numeric values by either ignoring them or raising an error.</output>","def smart_sum(*args): \n	"""""" sum all numeric inputs, including numbers contained inside lists or tuples (which themselves may be nested arbitrarily). Non-numeric values are not expected. Return the total as an int or float. """"""\n	total = 0\n	\n	for element in args:\n		if isinstance(element, (int, float)):\n			total += element\n		\n		elif isinstance(element, (list, tuple)):\n			for i in element:\n				total += smart_sum(i)\n		\n	return total\n	\nprint(smart_sum(1, [8,5], (1,5,9),5))"
B25EC002_q6,8,8,100.00,"<output> Ensure that when handling nested lists or tuples, you are correctly unpacking their contents into separate arguments for your function, rather than trying to pass the entire list or tuple as a single argument. For example, `smart_sum(1, 2, [3, 4], (5, 6))` should be used instead of `smart_sum([1, 2, 3, 4], (5, 6))`. This will prevent incorrect data types from being added to the sum.</output>","def smart_sum(*args):\n    """"""\n    Sum all numeric inputs, including numbers contained inside\n    lists or tuples (which\n    themselves may be nested arbitrarily). Non-numeric values\n    are not expected.\n    Return the sum as an int or float.\n    """"""\n    sum=0\n    for i in args:\n        \n        if isinstance(i,(int,float)):\n            sum+=i\n        elif isinstance(i,(list, tuple)):\n            sum+= smart_sum(*i)\n    return sum\n"
B25MT031_q6,8,8,100.00,"<output>Verify that you are correctly handling non-numeric arguments by checking if each argument is indeed a number before attempting to sum it. For example, ensure that the `flatten_sum` function returns 0 or a default value when encountering a string instead of trying to add it to the total.</output>","def smart_sum(*args):\n    """"""\n    Sum all numeric inputs, including nested lists/tuples.\n    """"""\n    def flatten_sum(item):\n        if isinstance(item, (int, float)):\n            return item\n        elif isinstance(item, (list, tuple)):\n            return sum(flatten_sum(sub) for sub in item)\n        return 0  # Should not occur if input is valid\n\n    return sum(flatten_sum(arg) for arg in args)\n"
B25DS028_q6,8,8,100.00,"<output> When handling nested lists or tuples, ensure that you're recursively calling `smart_sum` with a single argument (`*i`) rather than unpacking it into separate variables. This will prevent potential type mismatches and allow the function to correctly handle nested inputs.</output>","def smart_sum(*args):\n    """"""\n    Sum all numeric inputs, including numbers contained inside\n    lists or tuples (which\n    themselves may be nested arbitrarily). Non-numeric values\n    are not expected.\n    Return the sum as an int or float.\n    """"""\n    sum = 0\n    for i in args:\n        if isinstance(i, (int, float)):\n            sum += i\n        else:\n            sum += smart_sum(*i)\n    return sum\n"
B25EC022_q6,0,8,0.00,"<output>Verify that the function handles non-numeric values by ignoring them, and ensure all numeric values are added correctly when nested within lists or tuples.</output>","#########################################################################################\n#KOYYA SUMANTH BABU\n#B25EC022\n#ELECTRONICS AND COMMUNICATION ENGINEERING\n#INDIAN INSTITUTE OF TECHNOLOGY BHILAI\n#########################################################################################\n\n\n\n\n\n\ndef smart_sum(*args):\n    total = 0\n    for item in args:\n        if isinstance(item, (int, float)):\n            total += item\n        elif isinstance(item, (list, tuple)):\n            total += smart_sum(*item)  \n    return total\nprint(smart_sum(1, 2, [3, 4], (5, 6)))  "
B25ME048_q6,4,8,50.00,"<output>Verify that the `args` parameter is being passed correctly, checking for both positional and keyword arguments. Ensure that all numeric values are properly converted to floats before addition.</output>","def smart_sum(args):\n    """"""\n    Sum all numeric inputs, including numbers contained inside\n    lists or tuples (which\n    themselves may be nested arbitrarily). Non-numeric values\n    are not expected.\n    Return the sum as an int or float.\n    """"""\n    cnt=0\n    for i in args:\n        if type(i) in (int, float):\n            cnt += i\n        if type(i) in (list, tuple):\n            cnt += smart_sum(i)\n        \n    return cnt\n\n\n\n        "
B25ME001_q6,7,8,87.50,"<output>When handling nested lists or tuples, ensure that you're checking for numeric elements within those structures by using `if type(i) == (int, float)` instead of just `if type(i) == int`, to avoid adding non-numeric values to the sum.</output>",def smart_sum(*args):\n    sum=0\n    for i in args:\n        if type(i)==int:\n            sum+=i\n        if type(i)==list:\n            sum+=smart_sum(*i)\n        if type(i)==tuple:\n            sum+=smart_sum(*i)\n    return sum
B25EE053_q6,8,8,100.00,"<output> The issue lies in how you're handling nested lists and tuples; instead of extending the list with its contents, try using recursion or iteration to flatten these structures into individual numbers for addition. </output>",def smart_sum(*args):\n    items = list(args)\n    total_sum = 0\n    while items:\n        current_item = items.pop()\n        itemType = type(current_item)\n        if itemType == int or itemType == float:\n            total_sum += current_item\n        elif itemType == list or itemType == tuple:\n            items.extend(current_item)\n\n    return total_sum\n\n
B25EE029_q6,8,8,100.00,"<output> The issue lies in the recursive call to `smart_sum` when a nested list or tuple is encountered. Instead of using `summ = summ + smart_sum(*element)`, you should use `summ += sum(element) if isinstance(element, (list, tuple)) else element`. This ensures that each number in the nested lists or tuples is added individually. </output>","def smart_sum(*args):\n    summ = 0\n    for element in args:\n        # If the element is a list or tuple, call smart_sum recursively\n        if type(element) == list or type(element) == tuple:\n            summ = summ + smart_sum(*element)\n        else:\n            summ = summ + element\n\n    return summ\n"
B25EE003.q6,0,8,0.00,"<output> Ensure that all inputs passed to `smart_sum` are either numbers or lists/tuples containing only numbers, and avoid passing modules as arguments.</output>","def smart_sum(*args):\n    total=0\n    for num in args:\n        if type(num)==int or type(num)==float:\n            total=total+num\n           \n        elif type(num)==list or type(num)==tuple:\n            total=total+smart_sum(*num)\n            \n    return total\n    \n    \nprint(smart_sum(1,2,[3,4],(5,6)))\nprint(smart_sum(10))\nprint(smart_sum(1,[2,3]))"
B25ME012_q6,0,8,0.00,"<output> Ensure that all elements being added together are numeric by checking the data type before adding, as non-numeric values can cause unexpected results or errors. </output>","def smart_sum(*args):\n    sum=0\n    for i in args:\n        if(isinstance(i,(tuple,list))):\n            sum=sum+smart_sum(*i) #will keep calling the function and add the characters of list and tuples and then to final sum\n        elif(isinstance(i,(int,float))): #will directly add numbers\n             sum=sum+i\n    return(sum)    \n      \nprint(smart_sum(1, 2, [3, 4], (5, 6)))\nprint(smart_sum(10))\nprint(smart_sum([1,[2,3]]))\n"
B25EE013_q6,4,8,50.00,"<output> The issue lies in the function's parameter list, which currently accepts only one argument (`data`), but you're trying to pass multiple values when calling `smart_sum()` (e.g., `4`, `(1, 2)`). </output>","def smart_sum(data):\n    sum = 0\n    for num in data:\n        if isinstance(num, (list, tuple)):\n            sum += smart_sum(num)  # recursively sum nested list/tuple\n        else:\n            sum += num  # add the element\n    return sum\n"
B25ME050_q6,0,8,0.00,"<output> Make sure to handle potential `TypeError` exceptions when dealing with non-numeric arguments, especially when recursively processing nested lists or tuples. </output>","def smart_sum(*args):\n    total = 0\n    for arg in args:\n        if type(arg) == int or type(arg) == float:\n            total += arg\n        elif type(arg) == list or type(arg) == tuple:\n\n            inner_total = smart_sum(*arg)\n            total += inner_total\n    return total\nprint(smart_sum(1,2,[3,4],(5,6)))"
B25MT021_q6,0,8,0.00,"<output> Check that you're not trying to add non-numeric values to the total, and ensure that nested lists or tuples are being handled correctly. For example, if `x` is a list containing a string and an integer, your current code will throw a TypeError when trying to add those two values together.</output>","def smart_sum(*args):\n    total = 0\n    for x in args:\n        if type(x) == int or type(x) == float:\n            total = total + x\n        elif type(x) == list or type(x) == tuple:\n            total = total + smart_sum(*x)\n    return total\nprint(smart_sum(1, 2, 3))                  # 6\nprint(smart_sum([1, 2, 3], 4))             # 10\nprint(smart_sum(1, (2, 3), [4, [5, 6]]))  # 21\nprint(smart_sum())                          # 0"
B25MT024_q6,0,8,0.00,"<output>The issue lies in the `addval` function, where you are returning 0 for non-numeric values instead of recursively summing them. Instead, use the `sum` function with a generator expression to simplify the logic.</output>","def smart_sum(*args):\n    def addval(x):\n        if type(x) == int or type(x) == float:\n            return x\n        elif type(x) == list or type(x) == tuple:\n            s = 0\n            for item in x:\n                s = s+ addval(item) \n        return 0   \n    total = 0\n    for arg in args:\n        total =total+ addval(arg)\n    return total\nprint(smart_sum(1,2,[3,4],(5,6)))   #21\nprint(smart_sum(10))   #10\nprint(smart_sum([1, [2,3]]))    #6\n    "
B25ME027_q6,8,8,100.00,"<output>Verify that you are correctly handling non-numeric values by checking the return type of `smart_sum` for different input scenarios, such as passing a single number, a list of numbers, and a list containing both numbers and non-numbers.</output>","def smart_sum(*args):\n    s=0\n    for i in args:\n        if isinstance(i,(int,float)):\n            s+=i\n        elif isinstance(i,(list,tuple)):\n            s+=smart_sum(*i)\n    return s\n\n    \n    \n        "
B25ME035_q6,8,8,100.00,"<output>Verify that you are correctly handling non-numeric arguments by checking if `item` is not an instance of `(int, float)` before trying to add it to the sum; if it's a list or tuple, recursively call `helper` on its elements.</output>","def smart_sum(*args):\n    s=0\n    def helper(item):\n        nonlocal s\n        if isinstance(item,(int, float)):\n            s=s+item\n        \n         \n        elif isinstance(item,(list, tuple)):\n                for sub in item:\n                    helper(sub)\n    for a in args:\n        helper(a)\n    return s\nsmart_sum(1,2,[3,4],(5,6))"
B25ME024_q6,8,8,100.00,"<output> The issue lies in the line `total += 0`, where you're adding zero to non-numeric values that are not explicitly converted to numbers. Instead, consider using a conditional expression or the `isinstance()` function to handle these cases more elegantly.</output>",def smart_sum(*args):\n    total = 0\n    for arg in args:\n        if type(arg) == int or type(arg) == float:   \n            total += arg\n        elif type(arg) == list or type(arg) == tuple:  \n            total += smart_sum(*arg)\n        else:   \n            total += 0\n    return total\n
"B25ME022_q6(P5,6)",0,8,0.00,"<output> Ensure that you handle non-numeric values by using a conditional statement to skip over them, rather than relying on type checking alone. For example, check if `x` is an instance of `int`, `float`, or `list` before attempting to add it to the total.</output>","def smart_sum(*args):\n    total = 0\n    for x in args:\n        if type(x) == int or type(x) == float:   \n            total += x\n        elif type(x) == list or type(x) == tuple:  \n            total += smart_sum(*x)\n    return total\n\n\n\nprint(smart_sum(1, 2, [3, 4], (5, 6)))   # 21\nprint(smart_sum(10))                     # 10\nprint(smart_sum([1, [2, 3]]))            # 6"
B25MT017_q6,0,8,0.00,<output>Verify that the `smart_sum` function correctly handles non-numeric values by checking if it returns an error when given a list containing both numeric and non-numeric elements.</output>,"def smart_sum(*args):\n    sum = 0\n    for value in args:\n        if isinstance(value, (int, float)):\n            sum += value\n        elif isinstance(value, (list, tuple)):\n            sum += smart_sum(*value)\n    return sum\n        \nprint(smart_sum(1, 2, [3, 4], (5, 6)))\nprint(smart_sum(10))\nprint(smart_sum([1, [2, 3]]))"
B25MM009 Q6,0,8,0.00,"<output> Verify that you are correctly handling nested lists and tuples, as well as non-numeric elements, by checking the type of each element before attempting to add it to the sum. For example, if a list contains both numbers and strings, the function will only return the sum of the numbers. </output>","def smart_sum(*args):\n    sum=0\n    for i in args:\n\n        if type(i)==float or type(i)==int:\n            sum=sum+i\n\n        elif type(i)==tuple or type(i)==list:\n            sum=sum+smart_sum(*i)\n\n    return sum\n \n \nprint(smart_sum(1, 2, [3, 4], (5, 6))) \nprint(smart_sum(10,(1,2))) \nprint(smart_sum([1, [2, 3]]))"
B25DS027_q6,0,8,0.00,"<output> The issue lies in the incorrect usage of `append` and `join`. Instead of appending lists to each other using `append`, you should be adding elements directly. Also, when joining elements with commas, you're trying to join an integer with a string, which is causing the error. </output>","def smart_sum(args):\n    sum =0\n    for i in args:\n        \n        if isinstance(i,list):\n            a=[]\n            a.append(i)\n            for i in a :\n                b ="","".join(i)\n                list1=[]\n                list1.append(b)\n            return list1\n           \n        elif isinstance(i,tuple):\n            c=[]\n            c.append(i)\n            for i in c:\n                d = "","".join(c)\n                list2 =[]\n                list2.append(d)\n            return list2\n        \n        else:\n            e=[]\n            e.append(i)\n            return e\n           \n    j=[]\n    j=(list1 + list2 + e, sep=="","")\n    for i in j:\n        sum += i\n     \n    return sum\n        \n# smart_sum([1, 2, [3, 4], (5, 6)])\n#  smart sum(10) \n#  smart sum([1, [2, 3]]\n        \n    \n        "
B25MM020_q6,8,8,100.00,"<output> The function should also handle non-numeric values that are not enclosed in lists or tuples, by ignoring them. For example, if `smart_sum(1, 2, 'a', 3)` is called, the function should return `4`, but it currently returns `6` due to the addition of `'a'`.  </output>","def smart_sum(*args):\n    total = 0\n    for x in args:\n        if type(x) in (list, tuple):   \n            total += smart_sum(*x)     \n        else:  \n            total += x                 \n    return total\n\n\n"
B25DS018_q6,0,8,0.00,"<output> The function `smart_sum` currently uses recursive calls to `sum_of_list` and `sum_of_tuple`, but these functions are not defined anywhere in the code. Make sure to define these helper functions to correctly handle nested lists and tuples. </output>","def sum_of_list(lst):\n    total = 0\n    for num in lst:\n        if type(num) in (list, tuple):   #checks if tuple or list present inside list also\n            total += smart_sum(num)\n        else:\n            total += num\n    return total\n    pass\n\ndef sum_of_tuple(tup):\n    total = 0\n    for num in tup:\n        if type(num) in (list, tuple):      #checks if tuple or list present inside tuple also\n            total += smart_sum(num)\n        else:\n            total += num\n    return total\n    pass\n\ndef smart_sum(*args):\n    total_sum = 0\n    \n    for i in args:\n        if type(i) == list:\n            total_sum = total_sum + sum_of_list(i)\n        elif type(i) == tuple:\n            total_sum = total_sum + sum_of_tuple(i)\n        else:\n            total_sum = total_sum + i\n\n    return total_sum\n    pass\n\n\nprint(smart_sum(1, 2, [3, 4,], (5, 6)))\n"
q6(B25MM016),0,8,0.00,"<output> Make sure that `smartsum` and `smart_sum` are spelled consistently; Python is case-sensitive, so try renaming the function to match one of these exact names. </output>","def smartsum(*args):\n    sum=0\n    for i in args:\n\n        if type(i)==float or type(i)==int:\n            sum=sum+i\n\n        elif type(i)==tuple or type(i)==list:\n            sum=sum+smartsum(*i)\n\n    return sum\n \n \nprint(smartsum(1, 2, [3, 4], (5, 6))) \nprint(smartsum(10,(1,2))) \nprint(smartsum([1, [2, 3]]))"
B25Me045_q6,8,8,100.00,"<output>When handling nested lists or tuples, ensure that you're checking for numeric values within them correctly; try using `isinstance` instead of `type(x) in`, as the latter may not behave as expected when dealing with subclasses.</output>","def smart_sum(*args):\n    total=0\n    for x in args :\n         if type(x) in (int,float):\n             total=total+x\n         elif type(x) in (tuple,list):\n             total=total+smart_sum(*x)\n    return total\n\n\n\n"
B25EC034_q6,8,8,100.00,"<output>Verify that the `element` variable is indeed numeric before attempting to add it to the total, as non-numeric values will cause a TypeError.</output>","def smart_sum(*args):\n    total = 0\n    for element in args:\n        if isinstance(element, (list, tuple)):\n            total += smart_sum(*element)\n        elif isinstance(element, (int, float)):\n            total += element\n    \n    return total"
B25ME013_q6,0,8,0.00,"<output>Check if you're correctly handling nested lists and tuples, as the function should add up all numeric elements regardless of their depth.</output>","def smart_sum(*args):\n    """"""\n    Sum all numeric inputs, including numbers contained inside\n    lists (lists themselves may be nested arbitrarily).\n    Non-numeric values are not added. Return the sum as an int or\n    float.\n    """"""\n    global s\n    s=0\n    def add(value):\n        global s\n        ty=type(value)\n        if (ty==int or ty==float): #Add number to sum if value is an int or float\n            s=s+value\n        elif (ty==list or ty==tuple): #If value is a list, check each item in the list\n            for i in value:#Call function again for each item in list\n                add(i)\n    for arg in args:\n        add(arg)\n    return s\n\nprint(smart_sum(1, 2, [3, 4], (5, 6)))\nprint(smart_sum(10))\nprint(smart_sum(1, [2, 3]))"
B25DS015_q6,8,8,100.00,"<output>Verify that you are correctly handling non-numeric inputs by checking if `arg` is not a list, tuple, or set before trying to recursively call `smart_sum()` on it.</output>","def smart_sum(*args):\n    '''\n    Sum all numeric inputs, including numbers contained\n    inside liststhemselves may be nested arbitrarily.\n    Non-numeric values are notReturn the sum as an int or float.\n    '''\n    res = 0\n    for arg in args:\n        if type(arg) == int or type(arg) == float :\n            res += arg\n        elif type(arg) == list or type(arg) == tuple or type(arg) == set:\n            res += smart_sum(*arg)\n    return res\n\n#Test Cases:\n#print(smart_sum(1, 2, [3, 4], (5, 6)))\n#print(smart_sum(10))\n#print(smart_sum([1, [2, 3]])) "
B25ME059_q6,5,8,62.50,"<output>Convert the entire input list to a single string using `join()` or `str.join()`, and then iterate over each character to check if it's a number. If it is, convert it to an integer; otherwise, ignore it.</output>","def smart_sum(*args):\n    '''\n    i first made an empty list and then added the elements given by user inside the new list. then i converted the list into string including all the brackets and comas. then i made another list consisting all the non number elements that the list can have and thus seperated the numbers from the list and then added then using for loop.\n    '''\n    c=0\n    j=0\n    y=[]\n    y.append(args)\n    y=str(y)\n    z=[""["",""]"","","",""("","")"","""","" ""]\n    while(j<len(y)):\n        if(y[j] not in z):\n            c=c+int(y[j])\n        j+=1\n    return c"
