student_id,tests_passed,tests_total,score_percentage,semantic_summary,code_snippet
B25MT007_q6,0,8,0.00,"<output>When handling nested lists or tuples, ensure that you recursively call `smart_sum` with the correct arguments, not just unpacking them into separate variables.</output>","def smart_sum(*args):\n    count = 0\n    for i in args:\n        data_type = type(i)\n        if data_type is int or data_type is float:     \n            count += i\n        if data_type is list or data_type is tuple:      \n            count += smart_sum(*i)\n    return count\n\nprint(smart_sum(1, 2, [3, 4], (5, 6)))\nprint(smart_sum(10))\nprint(smart_sum([1, [2, 3]]))\n  "
B25EC045_q6,0,8,0.00,"<output> Ensure that you are checking the type of each argument before attempting to add it to the sum, as the function will fail if it encounters a non-numeric value. </output>","def smart_sum(*args):\n    sum = 0\n    for i in (args):\n        sum = sum + i\n    return sum\nprint(smart_sum(*(1,*[2,3])))\nprint(smart_sum(10))\nprint(smart_sum(*(1,2,*[3,4],*(5,6))))"
B25EE015_Q6,0,8,0.00,"<output>Be cautious when handling nested lists or tuples, as the current implementation does not account for potential non-numeric elements within these structures.</output>","""""""\nSum all numeric inputs, including numbers contained inside\nlists or tuples (which\nthemselves may be nested arbitrarily). Non-numeric values\nare not expected.\nReturn the sum as an int or float.\n""""""\ndef smart_sum(*args):\n    sum=0\n    \n    \n    for arg in args:\n        if type(arg)==int or type(arg)==float:\n            sum=sum+arg\n        elif type(arg)==tuple or type(arg)==list:\n           for j in arg:\n             sum=sum+smart_sum(j)\n    return sum\nprint(smart_sum(1,2,[3,4],(5,6)))\nprint(smart_sum(10))\nprint(smart_sum([1,[2,3]]))"
B25MT032_q6,8,8,100.00,"<output> The function should explicitly check for potential type mismatches by using try-except blocks or ensuring that all numeric elements are converted to numbers before addition, as attempting to add a non-numeric value can raise a TypeError. </output>","def smart_sum(*args):\n    sum = 0\n    for i in args:\n        if type (i) in ((int,float)):         # if input is a number\n            sum += i\n        elif type (i) in ((list,tuple)):      # if input is a list/tuple\n            sum += smart_sum(*i)                # recursion by functin calling\n    return sum\n\n"
B25EE042_q6,0,8,0.00,"<output> To ensure the function handles nested lists or tuples correctly, verify that you're checking for `list` and `tuple` types using `isinstance()` instead of just `type()`, as `type()` can return a subclass of `list` or `tuple`. For example, check if `x` is an instance of `int`, `float`, `list`, or `tuple` before trying to access its elements. This will prevent potential errors when dealing with unexpected input types.</output>","def smart_sum(*args):\n    """"""\n    Sum all numeric inputs, including numbers contained inside\n    lists or tuples (which\n    themselves may be nested arbitrarily). Non-numeric values\n    are not expected.\n    Return the sum as an int or float.\n    """"""\n    total = 0\n    items = list(args)   \n    while items:\n        x = items.pop()\n        if type(x) == int or type(x) == float:\n            total += x\n        elif type(x) == list or type(x) == tuple:\n            items.extend(x)   \n        else:\n            raise TypeError(""Unsupported type: "" + str(type(x)))\n\n    return total\n\nprint(smart_sum(1, 2, [3, 4], (5, 6)))\nprint(smart_sum(10)) \nprint(smart_sum([1, [2, 3]])) \n"
B25EE036_q6,0,8,0.00,"<output> When handling nested lists or tuples, ensure that you're not trying to add non-numeric values to the sum. For example, if `i` is a list containing both numbers and strings, the function will throw an error when it encounters the string. </output>","def smart_sum(*args):\n    """"""\n    Sum all numeric inputs, including numbers contained inside\n    lists or tuples (which\n    themselves may be nested arbitrarily). Non-numeric values\n    are not expected.\n    Return the sum as an int or float\n    """"""\n    s=0\n    for i in args:\n        if type(i) == int or type(i) == float:   # numbers\n            s += i\n        elif type(i) == list or type(i) == tuple:  # lists/tuples\n            s += smart_sum(*i)   # recursion if they are nested\n    return s\nprint(smart_sum([1, 2, [3, 4], (5, 6)]))\nprint(smart_sum(10))\nprint(smart_sum([1, [2, 3]]))"
B25CS021_q6,4,8,50.00,"<output>Verify that the function `smart_sum` accepts only one positional argument, and ensure that it can handle both numeric values and nested lists/tuples containing numbers, but not mixed data types.</output>",def smart_sum(args):\n    sum = 0\n    for element in args:\n        if type(element)==list:\n            sum += smart_sum(element)\n\n        elif type(element)==tuple:\n            sum += smart_sum(element)\n\n        else:\n            y=int(element)\n            sum += y\n\n\n    return sum\n
B25MM008_q6,0,8,0.00,"<output>Check that the recursive call to `smart_sum` is being passed a sequence of numbers, not another function call.</output>","def smart_sum(*args):\n    total = 0\n    for arg in args:\n        if type(arg) in [int, float]:\n            total += arg\n        elif type(arg) in [list, tuple]:\n            total += smart_sum(*arg)  # recursion\n    return total\n\n#test case\nprint (smart_sum(1, 2, [3, 4], (5, 6)))\nprint (smart_sum(10))\nprint (smart_sum(1, [2,3]))"
B25EC017_q6,0,8,0.00,<output>Verify that you are correctly handling nested lists or tuples by checking if each element is indeed numeric before attempting to add it to the total.</output>,def smart_total(args):\n    if(type(args)==int):\n        return args\n    args=list(args)\n    global total\n    n=0\n    while(n==0):\n        total=0\n        n=1\n        for i in range (len(args)):\n            if(type(args[i])==float or type(args[i])==int):\n                total += args[i]\n            elif(type(args[i])==list or type(args[i])==float):\n                a=args[i]\n                for j in range(len(a)):\n                    args.append(a[j])\n                args.remove(args[i])\n                n=0\n    return total\n\n    \n                 
B25EE034_q6,6,8,75.00,"<output> Make sure you're not trying to add a list or another iterable directly to the sum, as this will cause a TypeError. Instead, use the built-in functions like len() for lists and sum() for iterables. </output>","def smart_sum(*args):\n    sum = 0\n\n    for val in args:\n        if type(val)==int:\n            sum+=val\n        else:\n            for value in val:\n                if type(value)==int:\n                    sum+=value\n                else:\n                    for val1 in value:\n                        sum+=val1\n    \n    return sum\n\nsmart_sum(1, 2, [3, 4], (5, 6))\nsmart_sum(10)\nsmart_sum([1, [2, 3]])\n"
B25ME031_Q6,0,8,0.00,N/A,No Code Found
B25MM025_q6,8,8,100.00,"<output> To ensure the function handles non-numeric values correctly, verify that you're checking the type of each variable before attempting to add it to the total; for example, `if isinstance(x, (int, float)):` instead of `if type(x) in (list, tuple):`. </output>","def smart_sum(*args):\n    total = 0\n    for x in args:\n        if type(x) in (list, tuple):   \n            total += smart_sum(*x)     \n        else:  \n            total += x                 \n    return total"
B25DS034_q6,0,8,0.00,"<output>Instead of directly adding `args[i]` to `total_all`, consider using a recursive approach where you call `adder()` on each element individually before adding it to the total.</output>","\ndef smart_sum(*args):\n\n    def adder(value):\n        \n        if type(value) == list:\n            total = 0\n            i = 0\n            while i < len(value):   \n                total += adder(value[i])\n                i += 1\n            return total\n\n        elif type(value) == tuple:\n            total = 0\n            i = 0\n            while i < len(value):\n                total += adder(value[i])\n                i += 1\n            return total\n\n        else:\n            return value\n\n    total_all = 0\n    i = 0\n    while i < len(args):\n        total_all += adder(args[i])\n        i += 1\n\n    return total_all\n\n#Test Cases:\nprint(smart_sum(1, 2, [3, 4], (5, 6))) # 21\nprint(smart_sum(10)) # 10\nprint(smart_sum([1, [2, 3]])) # 6\n\n\n\n\n\n\n\n\n\n\n\n\n\n"
B25DS007_q6,8,8,100.00,"<output>Verify that the `total` variable is being reassigned instead of added to, as the initial value of `total` is set to 0 and then immediately overwritten in each iteration.</output>","def smart_sum(*args):\n    total=0\n    for x in args:\n        if type(x) in [int,float]:\n            total=total+x\n        elif type(x) in [list,tuple]:\n            total=total+smart_sum(*x)\n    return total\n\n\n            "
B25ME029_q6,8,8,100.00,"<output> The issue lies in the recursive call to `smart_sum` within itself, which causes an infinite recursion and leads to a stack overflow error. Instead, consider using a loop to iterate over each element in the list or tuple, and recursively call `smart_sum` on any nested elements. </output>",def smart_sum(*args):\n    TotalSum = 0\n    for i in args:\n        if type(i) == list or type(i) == tuple:\n            for j in range(len(i)):\n                if type(i[j]) == list or type(i[j]) == tuple:\n                    TotalSum += smart_sum(*i[j])\n                else:\n                    TotalSum = TotalSum + i[j]\n        else:\n            TotalSum = TotalSum + i\n    return TotalSum\n
B25ME028_q6.py,0,8,0.00,"<output> Make sure that all arguments passed to `smart_sum` are indeed lists or tuples, as the function relies on recursive calls for nested lists/tuples. The error message suggests that Python is unable to find a module named 'B25ME028_q6', which indicates that this argument might not be a list or tuple but rather an external module being referenced, thus causing a type mismatch.</output>","def smart_sum(*args):\n    total = 0\n    for arg in args:\n        if isinstance(arg, (int, float)):\n            total += arg\n        elif isinstance(arg, (list, tuple)):\n            total += smart_sum(*arg)  # unpack list/tuple for recursion\n    return total\n\n# Test cases\nprint(smart_sum(10))\nprint(smart_sum(1, 2, [3, 4], (5, 6)))   \nprint(smart_sum([1, [2, 3]]))             "
<B25CS024>_q6,0,8,0.00,"<output> The issue lies in the line `sum += smart_sum(i)`, where you're trying to add the result of recursively calling `smart_sum` on a single integer value. This is incorrect because integers cannot be iterated over, hence the TypeError. Instead, you should only call `smart_sum` when `i` is a list or tuple. </output>","def smart_sum(arguments):\n    sum = 0\n    for i in arguments:\n        if isinstance(i, int):\n            sum += i\n        elif isinstance(i, (tuple, list)):\n            sum += smart_sum(i)\n    return sum\n\nprint(smart_sum((1, 2, [3, 4], (5, 6))))\nprint(smart_sum(10))\nprint(smart_sum(1,[2,3]))"
B25MT003_q6,0,8,0.00,"<output> When handling nested lists or tuples, ensure that all elements are numeric before attempting to add them together; otherwise, you'll encounter type mismatches like the one in your error message.</output>","def smart_sum(*args):\n    sum=0\n    for num in args:\n        if isinstance(num,(list)):\n            sum+=smart_sum(*num)\n        else:\n                sum+=num\n    return sum\nprint(smart_sum([1,2,[2,3]]))    "
B25DS017_q6,0,8,0.00,"<output> When handling nested lists or tuples, ensure that you're recursively calling `smart_sum` with the correct number and type of arguments. For example, in the line `count += smart_sum(*i)`, if `i` is a list or tuple containing non-numeric values, it will cause a TypeError when trying to unpack it into separate arguments for `smart_sum`.</output>","def smart_sum(*args):\n    count = 0\n    for i in args:\n        data_type = type(i)\n        if data_type is int or data_type is float:     \n            count += i\n        if data_type is list or data_type is tuple:      \n            count += smart_sum(*i)\n    return count\n\nprint(smart_sum(1, 2, [3, 4], (5, 6)))\nprint(smart_sum(10))\nprint(smart_sum([1, [2, 3]]))\n  "
B25EE004_q6,4,8,50.00,"<output>Check that `data` is indeed iterable and has numeric elements before attempting to add it to `sum`. Ensure `database` is also correctly unpacked as positional arguments, not passed by value.</output>",sum=0\ndef smart_sum(database):\n    global sum\n    for data in database:\n        m=type(data)\n        if (type(data)==type(1)):\n            sum +=data\n        elif(type(data)==type([1])):\n            smart_sum(data)\n            \n    return sum        \n        \n    
B25CS022_q6,4,8,50.00,"<output> Check if you're correctly unpacking the arguments in your function definition. You are currently using `args` as a single value and then trying to access its elements with `args[i]`, which is incorrect. Instead, use `*args` to unpack the positional arguments and then iterate over them. </output>","def smart_sum(args):\n    """"""\n    Sum all numeric inputs, including numbers contained inside lists or tuples (which\n    themselves may be nested arbitrarily). Non-numeric values are not expected.\n    Return the sum as an int or float.\n    """"""\n    new_list=[]\n    sum2=0\n    sum1=0\n    if(type(args)==int):\n        return args\n    for i in range(0,len(args)):\n        if(type(args[i])!=list and type(args[i])!=tuple):\n            sum1=sum1+args[i]\n    for i in range(0,len(args)):\n        if(type(args[i])==list or type(args[i])==tuple):\n            new_list.append(args[i])\n\n    for i in range(0,len(new_list)):\n        for j in range(0,len(new_list[i])):\n            sum2=sum2+new_list[i][j]\n    return sum2+sum1"
B25EC029.q6,0,8,0.00,"<output>Check that you're passing the correct arguments to `smart_sum` and verify that nested lists/tuples are being unpacked correctly, avoiding any potential type mismatches.</output>","def smart_sum(*args):\n    total=0\n    for num in args:\n        if type(num)==int or type(num)==float:\n            total=total+num\n           \n        elif type(num)==list or type(num)==tuple:\n            total=total+smart_sum(*num)\n            \n    return total\n    \n    \nprint(smart_sum(1,2,[3,4],(5,6)))\nprint(smart_sum(10))\nprint(smart_sum(1,[2,3]))"
B25CS008_Q6,0,8,0.00,"<output>Verify that you are not adding NoneType values to the sum; ensure all inputs, including nested lists and tuples, are numeric before adding them.</output>","# def is_iterable(input_):\n#     try:\n#         iter(input_)\n#         return True\n#     except:\n#         return False\n        \n# def are_all_non_iter(input_):\n#     count = 0\n#     for i in input_:\n#         if is_iterable(i):\n#             break\n#         else:\n#             count += 1\n#     if count == len(input_):\n#         return (True)\n#     else:\n#         return (False)\n        \n# def make_all_non_iter(input_):\n#     list_ = []\n#     for i in input_:\n#         if is_iterable(i):\n#             list_.extend(i)\n#         else:\n#             list_.append(i)\n#     return list_\n\n\n\n# def happened(list1):\n#     while are_all_non_iter(list1) == False:\n#         if is_iterable(list1):\n#             list2 = make_all_non_iter(list1)\n#             list1 = list2\n#     return list1\n\n        \n# def smart_sum(*args):\n#     sum = 0\n#     for i in range(0,len(args)):\n#         if is_iterable(args[i]):\n#             listx = happened(args[i])\n#             for j in listx:\n#                 sum += j\n#         else:\n#             sum += args[i]\n#     return sum\n\ndef smart_sum(*nums):\n    sum = 0\n    for i in nums:\n        if type(i) in [int, float]:\n            sum += i\n        elif type(i) in [list, tuple]:\n            sum += smart_sum(*i)\n    \n            \n\nprint(smart_sum(1, 2, [3, 4], (5, 6)))\nprint(smart_sum(10)) \nprint(smart_sum([1, [2, 3]])) \nprint(smart_sum(1,2,3,4))\nprint(smart_sum(1,[2,3],[4,5],(6,7,8)))\nprint(smart_sum([1,[2,[3,[4,[5,[6,[7,[8,[9]]]]]]]]]))"
B25MT016_q6,0,8,0.00,<output>Import the Union type from the typing module to resolve the NameError.</output>,"def smart_sum(*args) -> Union[int, float]:\n    """"""\n    Add up numbers, even if they are inside lists/tuples at any depth.\n    Example: smart_sum([1, 2], (3, [4, 5])) → 15\n    """"""\n\n    def helper(x):\n        if isinstance(x, numbers.Number):\n            return x\n        if isinstance(x, (list, tuple)):\n            return sum(helper(i) for i in x)\n        return 0  # ignore non-numeric stuff\n\n    total = sum(helper(a) for a in args)\n    # Return int if result is whole, else float\n    return int(total) if float(total).is_integer() else float(total)\n"
<B25DS005>_q6,0,8,0.00,"<output> The issue lies in the fact that you're appending all elements to a list (`sumlist`) and then iterating over it again to calculate the sum. Instead, consider using a single variable to accumulate the sum directly from the input iterable. </output>",import ast\nenterinputastuple = input('enter args : ' )\nx = ast.literal_eval(enterinputastuple)#converts string to tuple\ndef smart_sum(x):\n    sumlist = []\n    smartsum =0\n    for i in x:\n        if type(i) == list :\n            for j in i:\n                sumlist.append(j)\n        elif type(i) == tuple :\n            for j in i :\n                sumlist.append(j)\n        else :\n            sumlist.append(i)\n    for i in sumlist:\n        smartsum = smartsum + i\n            \n    return smartsum\n\ny = smart_sum(x)\n\nprint(y)\n        \n    \n        \n        \n\n
B25DS023_q6,8,8,100.00,<output>Recursively handle nested lists by using a more explicit approach to flatten the input arguments before processing them.</output>,def smart_sum(*args):\n    sum = 0\n    for i in args:\n        if type(i)==list or type(i)==tuple:\n            sum = sum + smart_sum(*i)\n        else:\n            sum = sum + i\n    return sum\n
B25ME018_q6,8,8,100.00,"<output>Check that the function handles potential non-numeric values by ensuring all elements being added are indeed numbers, and consider using a try-except block to catch and handle exceptions.</output>","def smart_sum(*args):\n    """"""\n    Sum all numeric inputs, including numbers contained inside\n    lists or tuples (which\n    themselves may be nested arbitrarily). Non-numeric values\n    are not expected.\n    Return the sum as an int or float.\n    """"""\n    sum=0\n    for i in args:\n        if type(i) is int or type(i) is float:\n            sum += i\n        elif type(i) is list or type(i) is tuple:\n            sum += smart_sum(*i)\n    return sum"
B25EC003_Q6,4,8,50.00,"<output>Pass the input arguments directly to the function instead of assigning them to local variables, like `n = value` and `l = len(n)`. This will ensure that the function receives the correct number of arguments.</output>","def smart_sum(value):\n	n=value\n	l=len(n)\n	s=0\n	for i in range(l):\n		if type(n[i])==int:\n			s=s+n[i]\n		if type(n[i])==list:\n			s=s+smart_sum(n[i])\n		if type(n[i])==tuple:\n			s=s+smart_sum(n[i])\n	return s\nsmart_sum([1,2,[3,4],(5,6)])"
B25MM027_q6,0,8,0.00,"<output> Verify that you are correctly handling non-numeric values, as the function should ignore them and only add up numeric elements. For example, if the input contains both integers and strings, ensure your function behaves as expected when encountering such a value.</output>","###################################################################################################\n#SATYA RISHINDRA SONTHENA\n#B25MM027\n#MATERIAL SCIENCES AND METALLURGICAL ENGINEERING\n#INDIAN INSTITUTE OF TECHNOLOGY BHILAI\n###################################################################################################\ndef smart_sum(*args):\n    total = 0\n    for item in args:\n        if isinstance(item, (int, float)):\n            total += item\n        elif isinstance(item, (list, tuple)):\n            total += smart_sum(*item)  \n    return total\nprint(smart_sum(1, 2, [3, 4], (5, 6)))  "
S25MA018_q6,0,8,0.00,"<output> Make sure `arg` is always passed as a single value, not multiple arguments, by adjusting your function call when calling `smart_sum`. For example, instead of `smart_sum(1, 2)`, use `smart_sum([1, 2])`. </output>","sum = 0 \ndef smart_sum(arg):\n    global sum\n    if type(arg) == int or type(arg) == float:\n        sum+=arg\n    elif type(arg)==list or type(arg) == tuple:\n        for i in arg:\n            if type(i) == int:\n                sum+=i\n            elif type(i) == list:\n                sum=smart_sum(i)\n            elif type(i) == tuple:\n                sum=smart_sum(i)\n    return sum\n\nprint(smart_sum(10)) # 10\nprint(smart_sum([1, [2, 3]]))\n            "
B25CS014_q6,8,8,100.00,"<output> Ensure that you handle non-numeric values consistently by either ignoring them or converting them to a numeric type before addition, as your current implementation raises a TypeError when encountering unsupported types.</output>","\ndef smart_sum(*args):\n    """"""\n    Sum all numeric inputs, including numbers contained inside\n    lists or tuples (which themselves may be nested arbitrarily).\n    Non-numeric values are not expected.\n    Return the sum as an int or float.\n    """"""\n    total = 0\n\n    for arg in args:\n        if isinstance(arg, (int, float)):\n            total += arg\n        elif isinstance(arg, (list, tuple)):\n            total += smart_sum(*arg)  # unpack and recurse\n        else:\n            raise TypeError(f""Unsupported type: {type(arg)}"")\n\n    return total"
B25EE049_Q6,8,8,100.00,"<output>Check that you're correctly handling non-numeric arguments by adding a conditional statement to raise a ValueError when encountering a non-numeric argument, rather than trying to add it directly.</output>","def smart_sum(*args):\n    """"""\n    Sum all numeric inputs, including numbers contained inside lists themselves may be nested arbitrarily).\n    Non-numeric values are not Return the sum as an int or float.\n    """""" \n    to = 0\n    for arg in args:\n        if type(arg) in [int, float]:\n            to =to+ arg\n        elif type(arg) in [list, tuple]:  \n            to =to+ smart_sum(*arg)       \n    return to\n"
B25DS014_q6,8,8,100.00,"<output> Make sure to handle non-numeric arguments by ignoring them or raising an error, as simply passing them to `smart_sum` could lead to incorrect results or crashes. For example, adding a string to the sum would produce unexpected output.</output>","def smart_sum(*args):\n    sum = 0\n    for i in args:\n        if isinstance(i, (int, float)):\n            sum += i\n        else:  # if it's a list/tuple (or any iterable)\n            sum += smart_sum(*i)\n    return sum"
B25ME007_q6,8,8,100.00,"<output>Verify that you are correctly handling non-numeric values, such as strings or lists, by adding a conditional statement to check if `i` is indeed a list or tuple before recursively calling `smart_sum()`.</output>","def smart_sum(*args):\n    total=0\n    for i in args:\n        if type(i) in [int,float]:\n            total+=i\n        elif type(i) in [list,tuple]:\n            total+=smart_sum(*i)\n    return total\nsmart_sum(1,2,[3,4],(5,6))\nsmart_sum(10)\nsmart_sum([1,[2,3]])"
B25EE060_q6,8,8,100.00,"<output>Verify that you are correctly handling the types of variables when adding numbers, and consider using a try-except block to catch type errors during recursion.</output>",def smart_sum(*args):\n    Sum = 0\n    for Number in args:\n        if type(Number) == list or type(Number) == tuple:\n            Sum += smart_sum(*Number)\n        else:\n            Sum += Number\n    return Sum
B25EC006_q6,4,8,50.00,"<output> The issue lies in the way you're calling your function; it should be `smart_sum(*l)` instead of `smart_sum(l)`, and also ensure that all elements are numeric by using a conditional statement to filter out non-numeric values. </output>","def smart_sum(l):\n    \n    """"""\n    Sum all numeric inputs, including numbers contained inside\n    lists or tuples (which\n    themselves may be nested arbitrarily). Non-numeric values\n    are not expected.\n    Return the sum as an int or float.\n    """"""\n\n    s = 0\n    for e in l:\n        if (type(e) == list) or (type(e)==tuple):\n            s += smart_sum(e)\n        else:\n            s += e\n    return s\n"
B25CS007_Q6,8,8,100.00,"<output>Verify that you are correctly handling non-numeric values by checking if they are actually lists or tuples before trying to recursively add their elements, as a single non-numeric value can still cause a TypeError.</output>","def smart_sum(*args):\n    total=0\n    for x in args:\n        if type(x) in [int,float]:\n            total=total+x\n        elif type(x) in [list,tuple]:\n            total=total+smart_sum(*x)\n    return total\n\n"
B25MM013_q6,0,8,0.00,"<output> Ensure that you handle potential non-numeric types by using a try-except block or isinstance checks, as simply checking for numeric types might not catch all edge cases. </output>","#Smart Sum\ndef smart_sum(*args):\n    sum=0\n    for i in args:\n        if(isinstance(i,int)):    #As By using type() there is an error I searched for an alternative for type()\n            sum=sum+i\n        elif(isinstance(i,float)):\n            sum=sum+i\n        elif(isinstance(i,list)):\n            sum=sum+smart_sum(*i)\n        elif(isinstance(i,tuple)):\n            sum=sum+smart_sum(*i)\n    return sum\nprint(smart_sum(1,2,[3,4],(5,6)))\nprint(smart_sum(10))\nprint(smart_sum([1,[2,3]]))"
