student_id,tests_passed,tests_total,score_percentage,semantic_summary,code_snippet
B25MT005_q20,5,5,100.00,<output>Check if the list comprehension is correctly filtering out zeros and consider using an alternative approach that handles this edge case explicitly.</output>,"def valid_sudoku_rows(board):  #Sudoku rows\n    """"""\n    Return True iff each row has no duplicate numbers among 1..9.\n    Zeros are blanks and ignored. 'board' is 9x9 (list of lists).\n    """"""\n    for row in board:  # Using the loops\n        # numbers in the row\n        nums = [n for n in row if n != 0]\n        \n        if len(nums) != len(set(nums)):\n            return False\n    return True\n\n"
B25EE053_q20,5,5,100.00,"<output> The issue lies in the fact that your function is designed to work with rows of numbers 1-9 without zeros. However, the problem statement explicitly mentions ignoring zeros. You should modify your code to handle zeros by adding a check for them before attempting to add the number to the set. </output>",def valid_sudoku_rows(board):\n    for row in board:\n        present = set()\n        for num in row:\n            if num == 0:\n                continue\n            if num in present:\n                return False\n            present.add(num)\n    return True
B25EC045_q20,0,5,0.00,"<output> The student's code incorrectly uses `==` for comparing values instead of using a set to store unique numbers per row, leading to incorrect duplicate detection. </output>","def valid_sudoku_rows(boards):\n    boolean = True\n    for i in range(len(boards)):\n        for j in range(len(boards[i])):\n            for k in range(len(boards[i])):\n                if(boards[i][k] == 0):\n                    continue\n                if(j == k):\n                    continue\n                if(boards[i][j] == boards[i][k]):\n                    boolean = False\n                    break\n    if(boolean):\n        return True\n    else:\n        return False\nprint(valid_sudoku_rows([[5,3,0],[6,0,0],[0,9,8]]))\nprint(valid_sudoku_rows([[5,3,3],[6,0,0],[0,9,8]]))\n"
B25MT018_q20,5,5,100.00,"<output> Make sure to check if you are modifying a copy or the original list when appending items to `l1`, as your current implementation modifies the original list by using `append` method on it.</output>",def valid_sudoku_rows(board):\n    for i in board:\n        l1=[]\n        for item in i:\n            if item!=0:\n                if item in l1:\n                    return False\n                l1.append(item)\n    return True\n\n\n            \n
B25ME014_q20.py,0,5,0.00,"<output> Make sure the 'board' is a list of lists where each inner list represents a row in the Sudoku board. Currently, you're iterating over individual numbers instead of entire rows.</output>","def valid_sudoku_rows(board):\n    """"""\n    Return True iff each row has no duplicate numbers among\n    1..9.\n    Zeros are blanks and ignored. 'board' is 3x3 (list of\n    lists).\n    """"""\n    ls=[]\n    for num in board:\n        for k in num:\n            if k!=0:\n                ls.append(k)\n    if len(ls)==len(set(ls)):\n        return True\n    else:\n        return False\n        pass"
B25EE036_q20,0,5,0.00,"<output>Use the `in` operator instead of `count()` to check if an element exists in a list, as `count()` is not applicable to lists.</output>","def valid_sudoku_rows(board):\n    """"""\n    Return True iff each row has no duplicate numbers among 1..9.\n    """"""\n    flag = 1\n    for row in board:\n        for number in row:\n            if number!=0:\n                if row.count(number)>1:\n                    flag = 0\n                    break\n                \n    return (flag==1)      \nprint(valid_sudoku_rows([[5,3,0],[6,0,0],[0,9,8]]))\nprint(valid_sudoku_rows([[5,3,3],[6,0,0],[0,9,8]]))"
B25MM002_q20,5,5,100.00,"<output> Check if the row contains any zeros before attempting to remove them, as this could lead to a KeyError when trying to convert non-numeric values to set. </output>",def valid_sudoku_rows(board):\n    for row in board:\n        nums = [x for x in row if x != 0]\n        if len(nums) != len(set(nums)):\n            return False\n        return True\n
B25EC033_q20,0,5,0.00,"<output> Make sure to handle the case where `num` is 0 before checking if it's in the `seen` set, as using `in` on 0 would raise a TypeError.  </output>","def valid_sudoku_rows(board):\n    for row in board:\n        seen = set()\n        for num in row:\n            if num == 0:\n                continue\n            if num in seen:\n                return False\n            seen.add(num)\n    return True\nprint(valid_sudoku_rows([[5,3,0],[6,0,0],[0,9,8]]))"
B25ME024_q20,5,5,100.00,<output> Check if the row contains any numbers outside the range 1-9 before processing them to avoid KeyError. </output>,def valid_sudoku_rows(board):\n    for row in board:\n        nums = [x for x in row if x != 0]\n        if len(nums) != len(set(nums)):\n            return False\n    return True\n\n\n\n
B25ME049_q20,0,5,0.00,"<output> The function is currently returning False as soon as it encounters a non-zero number in the row, which is incorrect. It should continue checking the rest of the numbers to see if there are any duplicates before making a decision. </output>","def valid_sudoku_rows(board):\n\n    for row in board:\n        seen = set()\n        for num in row:\n            if num != 0:             \n                if num in seen:        \n                    return False\n                seen.add(num)\n    return True\nprint(valid_sudoku_rows([[5,3,0],[6,0,0],[0,9,8]])) \nprint(valid_sudoku_rows([[5,3,3],[6,0,0],[0,9,8]]))"
B24DS035_Q20,5,5,100.00,"<output> The issue lies in the line `if i.count(j) > 1:`, where `i` is a row and `j` is an element within that row. Instead, you should be checking if `j` appears more than once in the entire row. </output>",def valid_sudoku_rows(board):\n    for i in board:\n        for j in i :\n            if j ==0:\n                pass\n            else:\n                if i.count(j)>1:\n                    return False\n    return True\n    pass
B25DS007_Q20,0,5,0.00,"<output> The issue lies in the fact that your function does not handle cases where zeros are present in the row, which can lead to a KeyError when trying to access non-existent numbers. You should add checks for zeros before attempting to process them. </output>","def valid_sudoku_rows(board):\n    for row in board:\n        nums = [n for n in row if n != 0]   \n        if len(nums) != len(set(nums)):     \n            return False\n    return True\n\nboard = [\n    [5,3,0,0,7,0,0,0,0],\n    [6,0,0,1,9,5,0,0,0],\n    [0,9,8,0,0,0,0,6,0],\n    [8,0,0,0,6,0,0,0,3],\n    [4,0,0,8,0,3,0,0,1],\n    [7,0,0,0,2,0,0,0,6],\n    [0,6,0,0,0,0,2,8,0],\n    [0,0,0,4,1,9,0,0,5],\n    [0,0,0,0,8,0,0,7,9]\n]\nprint(valid_sudoku_rows(board))  "
B25CS051_q20,5,5,100.00,<output>Check if the row contains any numbers outside the range 1-9 before trying to process them.</output>,def valid_sudoku_rows(board):\n    for row in board:\n        seen = set()\n        for num in row:\n            if num == 0:       \n                continue\n            if num in seen:   \n                return False\n            seen.add(num)\n    return True
B25EC036_q20,5,5,100.00,"<output> The issue lies in the way you're trying to add elements to the set 'trye'. In Python, you can't use a variable name that starts with a number or a special character like '_' for dictionary keys. Try renaming it to something like 'numbers'. </output>",def valid_sudoku_rows(board):\n \n    for row in board:\n        trye = set()\n        for element in row:\n            if element == 0:\n                continue       # if the particular if is false the it will move on\n            if element in trye:\n                return False\n            trye.add(element)  # method to add element in set\n    return True\n\n\n\n\n\n
B25EE059_q20,5,5,100.00,"<output> Check if the board is a 2D list of integers before attempting to iterate over its rows and numbers, as the current implementation assumes all elements are accessible via indexing (e.g., `row[0]`, `row[1]`, etc.).</output>",def valid_sudoku_rows(board):\n    for row in board:\n        seen = set()\n        for num in row:\n            if num != 0:\n                if num in seen:\n                    return False\n                seen.add(num)\n    return True\n
B25DS041_q20,0,5,0.00,"<output>Check if the number 0 is present in the 'seen' set before trying to add it, as attempting to add a non-existent key will raise a KeyError.</output>","def valid_sudoku_rows(board):\n    \n    for row in board:\n        \n        seen = set()\n        \n        for i in row:\n            \n            if i == 0:\n                \n                continue\n            \n            if i < 1 or i > 9:\n                \n                return False\n            \n            if i in seen:\n                \n                return False\n            \n            seen.add(i)\n            \n    return True\n\nprint(valid_sudoku_rows([[5, 3, 0], [6, 0, 0], [0, 9, 8]]))\nprint(valid_sudoku_rows([[5, 3, 3], [6, 0, 0], [0, 9, 8]]))           \n            \n        \n        \n        \n        "
B25CS036_q20,5,5,100.00,<output>Check if the row index 'i' is within the bounds of the inner list before accessing its element at index 'j'.</output>,"def valid_sudoku_rows(board):\n    """"""\nReturn True iff each row has no duplicate numbers among\n1..9.\nZeros are blanks and ignored. ’board’ is 9x9 (list of\nlists).\n""""""\n    b = True\n    for bo in board:\n        for i in range (len(bo)):\n            if bo[i] == 0:\n                continue\n            else :\n                for j in range(len(bo)):\n                    if i == j or bo[j] == 0:\n                        continue\n                    elif bo[i] == bo[j]:\n                        b = False\n    return b\n\n"
B25ME008_Q20,5,5,100.00,"<output> The issue lies in the inner loop where you're iterating over the same row (`item`) multiple times, causing incorrect comparisons and leading to false positives. Instead, iterate over each number in the row only once.</output>",def valid_sudoku_rows(board):\n    for item in board:\n        count = 0\n        for i in item:\n            c = 0\n            if i==0:\n                continue\n            else:\n                for j in item:\n                    if i == j:\n                        c+=1\n            if c>1:\n                break\n        count += c\n        if count>1:\n            break\n    \n    if count<=1:\n        return True\n    else:\n        return False
B25EE050_q20,5,5,100.00,"<output> Make sure to check if the 'num' in the list is actually an integer before trying to convert it to a number. The code does not handle non-integer values, which could result in a KeyError when trying to access the 'int()' function. </output>",def valid_sudoku_rows(board):\n    for row in board:\n        numbers = [num for num in row if num != 0]\n        if len(numbers) != len(set(numbers)):\n            return False  \n    return True \n
B25ME019_q20,0,5,0.00,"<output> The student's code incorrectly uses `i.remove(m)` which removes all occurrences of `m` from the list, not just one, causing incorrect duplicate checks and leading to incorrect results.</output>","def valid_sudoku_rows(board):\n    flag=0\n    for i in board:\n        for m in i:\n            if m==0:\n                i.remove(m)        \n        perm=i.copy()\n        if len(perm)==len(list(set(i))):\n            continue\n        else:\n            flag=1\n            return(False)\n    if flag==0:\n        return(True)\nprint(valid_sudoku_rows([[5,3,1],[6,0,0],[0,9,8]]))    \n"
B25DS017_q20,0,5,0.00,"<output>Consider adding error handling when accessing the value at index 0 of each row in your code, as it will raise a KeyError if that index does not exist.</output>","\ndef valid_sudoku_rows(board):\n   \n    for row in board:\n        s = set()\n        for val in row:\n            if val == 0:\n                continue\n            if val in s:\n                return False\n            s.add(val)\n    return True\n\nprint(valid_sudoku_rows([[5,3,0],[6,0,0],[0,9,8]]))"
B25MT025_q20,1,5,20.00,<output>Check if the indices used in `board[i][j]` and `board[k][i]` are within the valid range of 0-8 before accessing them.</output>,def valid_sudoku_rows(board):\n    for i in range(9):\n        for j in range(9):\n           for k in range(9):\n                if board[i][j]==board[i][k] and j!=k and board[i][j]!=0 and board[i][k]!=0:\n                    return False\n                elif board[j][i]==board[k][i] and j!=k and board[j][i]!=0 and board[k][i]!=0:\n                    return False\n    return True          \n                    
B25ME043_q20,5,5,100.00,"<output>Check if you are using `append` correctly to add elements to your list. Currently, you're checking if an element is not in the list before adding it.</output>",def valid_sudoku_rows(board) :\n    for i in board :\n        lst=[]\n        for j in i :\n            if j!=0 :\n                if j in lst :\n                    return False\n                elif j not in lst :\n                    lst.append(j)\n    return True
B25DS031_q20,5,5,100.00,"<output> Ensure that you are not using the `in` operator with a list (like `if n in num:`) which will raise a TypeError because `n` is an integer, not a string. Instead, check if `n` exists in the set directly. </output>","def valid_sudoku_rows(board):\n """"""\n Return True iff each row has no duplicate numbers among\n 1..9.\n Zeros are blanks and ignored. ’board’ is 9x9 (list of\n lists).\n """"""\n for row in board:\n     num=[n for n in row if n!=0]\n     if len(num)!= len(set(num)):\n         return False\n return True\n"
B25ME027_Q20,5,5,100.00,"<output> Check if the element exists in the list before comparing its count, as using `in` with a list will raise an IndexError instead of returning False when the element is not found.</output>","def valid_sudoku_rows(board):\n    f=0\n    for i in board:\n        for e in i:\n            if e in [1,2,3,4,5,6,7,8,9] and i.count(e)>1:\n                f=1\n    if f==1:\n        return False\n    else:\n        return True\n    \n    "
B25ME006_Q20,0,5,0.00,"<output>Check if the value of each cell exists in the set before adding it, and consider using a more efficient data structure like a list or array to store duplicates.</output>","def valid_sudoku_rows(board):\n    for i in board:\n       duplicates=set()\n       for j in i:\n           if j!=0:\n               if j in duplicates:\n                   return False\n               duplicates.add(j)\n       return True\nprint(valid_sudoku_rows([[5,3,0],[6,0,0],[0,9,8]]))\nprint(valid_sudoku_rows([[5,3,3],[6,0,0],[0,9,8]]))"
B25CS026_q20,0,5,0.00,"<output>Check for duplicates by comparing each number to every other number, not just consecutive ones.</output>","def valid_sudoku_rows(board):\n    """"""\n    Return True iff each row has no duplicate numbers among\n    1..9.\n    Zeros are blanks and ignored. ’board’ is 9x9 (list of lists).\n    """"""\n    list1 = [] #Make empty list\n    for i in board:\n        for j in i:\n            if j != 0:  #Condition that remove 0\n                list1.append(j)\n            else:\n                continue\n    flag = 0\n    for k in range(len(list1)-1):\n        if list1[k] == list1[k+1]:\n            flag = 1\n            break\n        else:\n            flag = 0\n    if flag == 0:\n        return True\n    else:\n        return False\n    \nprint(valid_sudoku_rows([[5,3,0],[6,0,0],[0,9,8]]))\nprint(valid_sudoku_rows([[5,3,3],[6,0,0],[0,9,8]]))\n\n                "
B25EE011_q20,0,5,0.00,"<output>Don't forget to check if the number is in the range 1-9 before trying to compare it with 'seen', as your code will throw a KeyError when encountering numbers outside this range.</output>","def valid_sudoku_rows(board):\n    for row in board:\n        seen=set()\n        for num in row:\n            if num!=0:\n                if num in seen:\n                    return False\n                seen.add(num)\n    return True\n\nprint(valid_sudoku_rows([[5,3,0],[6,0,0],[0,9,8]]))\nprint(valid_sudoku_rows([[5,3,3],[6,0,0],[0,9,8]]))"
B25CS034_q20,3,5,60.00,"<output> Check for incorrect usage of 'self' when calling the function, as the student's code does not seem to be using a class, but the problem description suggests it should be.</output>","def valid_sudoku_rows(board):\n    a=True\n    for i in board:\n        for k in range(0,3):\n            if i[k]==0:\n                a=True\n            elif i[0]==i[1] and i[1]==i[2] and i[0]==i[2]:\n                a=False\n            else:\n                a=True\n    return a\n            \n            \n           \n            \n\n"
B25CS021_q20,2,5,40.00,"<output> Make sure to check if the key exists in the dictionary before trying to access its value with `d[board[i][j]]`, as this can cause an IndexError when the key is not found. </output>",def valid_sudoku_rows(board):\n    for i in range (9):\n        d=dict()\n        for j in range (9):\n            if board[i][j]==0:\n                continue\n\n            if board[i][j] not in d:\n                d[board[i][j]]=1\n            else:\n                return False\n\n    for j in range (9):\n        d=dict()\n        for i in range (9):\n            if board[i][j] == 0:\n                continue\n\n            if board[i][j] not in d:\n                d[board[i][j]] = 1\n            else:\n                return False\n\n    return True
B25DS024_Q20,5,5,100.00,<output> The issue lies in removing elements from the list `lst` while iterating over it; this can cause unexpected behavior and incorrect results because the indices of the remaining elements change after removal. Consider using a set instead of a list to store unique numbers. </output>,"def valid_sudoku_rows(board):\n    lst = [1,2,3,4,5,6,7,8,9]\n    for i in board:\n        for j in i:\n            if j != 0:\n                if j not in lst:\n                    return False\n                else:\n                    lst.remove(j)\n    return True\n"
B25EE045_q20,0,5,0.00,<output> Check if you're iterating over the column index instead of the row index when checking for duplicate numbers in each row. </output>,"def valid_sudoku_rows(board):\n    for i in range (0,9):\n        for j in range (0,9):\n            if board[i][j]!=0:\n                if (board[i].count(board[i][j]))>1:\n                    return False\n    return True\nprint( valid_sudoku_rows([[5,3,3],[6,0,0],[0,9,8]]))\n"
B25EE015_Q20,0,5,0.00,"</output> The issue lies in the incorrect comparison of `row[i]` with `row[j]`, which is comparing an integer value (the number on the board) with another integer value. Instead, you should compare the actual values represented by these numbers, taking into account their positions on the board.","\ndef valid_sudoku_rows(board):\n    """"""\n    Return True iff each row has no duplicate numbers among 1..9.\n    Zeros are blanks and ignored. 'board' is 9x9 (list of lists).\n    """"""\n\n    \n    for row in board:\n        \n        for i in range(len(row)):\n            if row[i] == 0:\n                continue  \n            for j in range(i + 1, len(row)):\n                if row[i] == row[j] and row[i] != 0:\n                    return False  \n    return True \n\n\n\n\nprint(valid_sudoku_rows([[5, 3, 0],[6, 0, 0],[0, 9, 8]]))\n    \n\nprint(valid_sudoku_rows([[5, 3, 3],[6, 0, 0],[0, 9, 8]]))\n   \n\n    "
B25EE027_Q20,5,5,100.00,"<output> You're missing the column check. Ensure you iterate over all columns in each row and add them to your set, not just the rows. </output>","def valid_sudoku_rows(board):\n    """"""Return True iff each row has no duplicate numbers among\n    1..9.\n    Zeros are blanks and ignored. ’board’ is 9x9 (list of\n    lists)""""""\n    for i in range(3):\n        s = set()\n        for j in range(len(board[i])):\n            if board[i][j] == 0:\n                continue\n            if board[i][j]in s:\n                return False\n            s.add(board[i][j])\n    return True \n    \n        \n\n# print(valid_sudoku_rows([[5,3,3],[6,0,0],[0,9,8]]))"
B25ME011_q20,0,5,0.00,</output> The issue lies in the fact that your function is named `valid_sudoko_rows` but it's being called as `valid_sudoku_rows`. Python is case-sensitive and treats 's' and 'S' as different characters.,"def valid_sudoko_rows(board):\n    for row in board:\n        seen = set()\n        for num in row:\n            if num !=0:\n                if num in seen:\n                    return False\n                seen.add(num)\n    return True\nprint(valid_sudoko_rows([[5,3,0],[6,0,0],[0,9,8]]))\nprint(valid_sudoko_rows([[5,3,3],[6,0,0],[0,9,8]]))"
B25EE039_q20,5,5,100.00,"</output> The issue lies in the fact that your current implementation assumes all non-zero numbers are unique, but it doesn't account for the case where a row contains only zeros. You need to handle this edge case by checking if the length of `nums` is equal to 9 before comparing its length with the set's size.","def valid_sudoku_rows(board):\n    """"""\n    Return True iff each row has no duplicate numbers among 1..9.\n    Zeros are blanks and ignored. 'board' is 9x9 (list of lists).\n    """"""\n    for row in board:\n        nums = [n for n in row if n != 0]\n        if len(nums) != len(set(nums)):\n            return False\n    return True\n"
B25EE055_q20,5,5,100.00,"<output>Check if the key exists in the dictionary before trying to access it with `d[board[i][j]]`, instead of directly using `not in d` which would raise a KeyError.</output>",def valid_sudoku_rows(board):\n    for i in range (3):\n        d=dict()\n        for j in range (3):\n            if board[i][j]==0:\n                continue\n\n            if board[i][j] not in d:\n                d[board[i][j]]=1\n            else:\n                return False\n    return True\n\n
B25CS029_q20,5,5,100.00,"<output> The issue lies in the line `if len(set([ele for ele in row if ele != 0])) != len([ele for ele in row if ele != 0]):`, where you're trying to access elements of a list without checking if they exist first, which is causing a KeyError. </output>",def valid_sudoku_rows(board):\n    for row in board:\n        if len(set([ele for ele in row if ele!= 0])) != len([ele for ele in row if ele!= 0]):\n            return False\n    return True\n\n
B25CS016_q20,0,5,0.00,"<output> The issue lies in the inner loop where you're comparing `i[j]` with every other element in the row (`k != j`). Instead, you should compare it only with the previously seen numbers (`seen`) to avoid duplicate checks. </output>","def valid_sudoku_rows(board): \n    """"""\n    Return True iff each row has no duplicate numbers among 1..9. \n    Zeros are blanks and ignored. 'board' is 9x9 (list of lists). \n    """"""\n    for i in board:\n        for j in range(len(i)):\n            if i[j] == 0:\n                pass\n            else:\n                for k in range(len(i)):\n                    if k != j:\n                        if i[k] == i[j]:\n                            return False\n        \n    return True\n\nprint(valid_sudoku_rows([[5,3,3],[6,0,0],[0,9,8]]))"
B25EC020_q20,5,5,100.00,<output>Check if the value is None before trying to compare it with other values.</output>,# Q20 - valid_sudoku_rows\ndef valid_sudoku_rows(board):\n    for row in board:\n        seen = set()\n        for val in row:\n            if val == 0:\n                continue\n            if val < 0:\n                return False\n            if val in seen:\n                return False\n            seen.add(val)\n    return True\n
B25MT020_Q20,0,5,0.00,<output>Check if the list comprehension in each row is correctly filtering out zeros.</output>,"def valid_sudoku_rows(board):\n    for row in board:\n        nums = [n for n in row if n != 0]\n        if len(nums) != len(set(nums)):\n            return False\n    return True\n    pass\nprint(valid_sudoku_rows([[5,3,0],[6,0,0],[0,9,8]]))"
B25ME041_q20,5,5,100.00,"</output> The issue lies in the fact that your function is designed to work with 2D lists, but you're passing it a 1D list representing a row. You should modify the function to accept a 1D list as well.  </output>",def valid_sudoku_rows(board):\n    for row in board:\n        numbers = [] \n        for num in row:\n            if num != 0:  \n                if num in numbers:\n                    return False  \n                else:\n                    numbers.append(num)\n    return True 
B25MT032_q20,4,5,80.00,"<output>Check if you're returning True as soon as you find a duplicate number (which isn't necessary), instead, return False once you've found a duplicate.</output>","def valid_sudoku_rows(board):\n    for i in board:\n        a = list(set(i))\n        if len(a) == 2:\n            for k in range(2):\n                if a[k] == 0:\n                    \n                    return True\n                else:\n                     \n                     return False\n        else:\n            return True\n        \n#print(valid_sudoku_rows([[5,3,3],[6,0,0],[0,9,8]]))        "
B25ME003_q20,0,5,0.00,"<output>Check for 'self' usage in class methods, as it might be causing the issue.</output>","def valid_sudoku_rows(board):\n    for row in board:\n        used_num = []\n        for num in row:\n            if num == 0:\n                continue        \n            if num in used_num:     \n                return False\n            used_num.append(num)\n    return True\n#example\nprint(valid_sudoku_rows([[5,3,0],[6,0,0],[0,9,8]])) #output- True\nprint(valid_sudoku_rows([[5,3,3],[6,0,0],[0,9,8]])) #output- False\n\n"
