student_id,tests_passed,tests_total,score_percentage,semantic_summary,code_snippet
B25EE013_q20,5,5,100.00,"<output> Make sure to check if you're using `append` correctly when adding elements to the list `l`, as this could potentially lead to incorrect results due to the order of operations.</output>",""""""" Return True iff each row has no duplicate numbers among 1-9\nZeros are blanks and ignored. board is 9x9 (list of lists)\nvalid_sudoku_rows([[5,3,0],[6,0,0],[0,9,8]]) # True\nvalid_sudoku_rows([[5,3,3],[6,0,0],[0,9,8]]) # False  """"""\n\ndef valid_sudoku_rows(board):\n    l=[]\n    for element in board:\n        if isinstance(element, list):\n            for sub_element in element:\n                if sub_element in l and sub_element!=0:\n                    return False\n                elif sub_element in l and sub_element==0:\n                    continue\n                else:    \n                    l.append(sub_element)\n    return True"
B25EC006_q20,5,5,100.00,"<output> The issue lies in removing elements from the list `l` while iterating over it with `for j in i:`, causing unexpected behavior and potential errors. Instead, use a set to keep track of unique numbers. </output>","def valid_sudoku_rows(board):\n    """"""\n    Return True if feach row has no duplicate numbers among\n    1..9.\n    Zeros are blanks and ignored.'board' is 9x9 (list of\n    lists).\n    """"""\n    l=[1,2,3,4,5,6,7,8,9]\n    flag = 1\n    for i in board:\n        for j in i: \n            if j in l:\n                l.remove(j)\n            elif j==0:\n                continue\n            else:\n                flag = 0\n    if flag==1:\n        return True\n    else:\n        return False"
B25DS014_q20,5,5,100.00,"<output> The outer loops are iterating over each element in the 2D list, but the inner loop should be iterating over each column instead of each row to check for duplicates within a row. </output>","def valid_sudoku_rows(nums):\n    flag=True\n    for i in range(len(nums)):\n        for j in range(len(nums)):\n            for k in range(j+1,len(nums)):\n                if nums[i][j]==nums[i][k] and nums[i][j]!=0:\n                    flag=False\n    for i in range(len(nums)):\n        for j in range(len(nums)):\n            for k in range(j+1,len(nums)):\n                if nums[j][i]==nums[k][i] and nums[j][i]!=0:\n                    flag=False\n    return flag"
B25ME046_q20,0,5,0.00,<output>Check if you're comparing the values at indices `a` and `b` instead of the actual row elements.</output>,"def valid_sudoku_rows(s:list):\n    for row in s:\n        a=0\n        while a<len(row):\n            b=a+1\n            while b<len(row):\n                if row[a]==row[b]:\n                    if row[a]==row[b]==0:\n                        pass\n                    else:\n                        return False\n                b=b+1\n            a=a+1\n        return True\nprint(valid_sudoku_rows([[5,3,0],[6,0,0],[0,9,8]])) #True\nprint(valid_sudoku_rows([[5,3,3],[6,0,0],[0,9,8]])) #False"
B25MT014_q20,5,5,100.00,"<output> The issue lies in the assumption that all numbers in each row are non-zero; consider adding a check to handle zeros as well, such as `if num == 0: continue`, to avoid unnecessary comparisons and potential KeyError. </output>",def valid_sudoku_rows(board):\n    for row in board:\n        seen_numbers = set()\n        for num in row:\n            if num != 0:\n                if num in seen_numbers:\n                    return False\n                seen_numbers.add(num)\n    return True
B25MT009_Q20,4,5,80.00,<output>Try removing `elem.remove(0)` because 0 was never added to the set in the first place.</output>,def valid_sudoku_rows(row):\n    elem = set()\n    for i in row:\n        elem.update(i)\n    elem.remove(0)\n    flag = True\n    for i in elem:\n        for j in row:\n            c = j.count(i)\n            if c > 1:\n                flag = False\n                break\n        if flag == False:\n            break\n    return flag
B25CS044_Q20,5,5,100.00,"</output> The issue lies in the incorrect assumption that all non-zero numbers are unique; however, zeros can be present and still cause a duplicate. Consider adding checks for zero values when determining duplicates.","#B25CS044_Q20\n\ndef valid_sudoku_rows(board):\n    """"""\n    Return True iff each row has no duplicate numbers among 1..9.\n    Zeros are blanks and ignored. 'board' is 9x9 (list of lists).\n    """"""\n    \n    for row in board:\n        # Filter out zeros (blanks)\n        numbers = [num for num in row if num != 0]\n        \n        # Check if all numbers are in valid range 1-9\n        for num in numbers:\n            if num < 1 or num > 9:\n                return False\n        \n        # Check for duplicates\n        if len(numbers) != len(set(numbers)):\n            return False\n    \n    return True\n\nvalid_sudoku_rows([[5,3,0],[6,0,0],[0,9,8]]) # True\nvalid_sudoku_rows([[5,3,3],[6,0,0],[0,9,8]]) # False"
b25cs049_q20,0,5,0.00,"</output> The issue lies in the fact that your function is returning True as soon as it encounters a row with no duplicates, but it should continue to check all rows before making a determination.","def valid_sudoku_rows(board):\n     for row in board:\n         nums = [x for x in row if x != 0]\n         if len(nums) != len(set(nums)):\n             return False\n         return True\n        \n        \nprint(valid_sudoku_rows([[5,3,0],[6,0,0],[0,9,8]])) #True\nprint(valid_sudoku_rows([[5,3,3],[6,0,0],[0,9,8]])) #False        "
B25EE034_q20,5,5,100.00,<output>Check if the number is within the range 1-9 before adding it to the set.</output>,"def valid_sudoku_rows(board):\n    for row in board:\n        seen = set()\n        for num in row:\n            if num != 0:\n                if num in seen:\n                    return False\n                seen.add(num)\n    return True\n        \n# print(valid_sudoku_rows([[5,3,0],[6,0,0],[0,9,8]])) #True\n# print(valid_sudoku_rows([[5,3,3],[6,0,0],[0,9,8]])) #False"
B25DS021_q20,5,5,100.00,"<output> Check if the board is represented as a 2D list of integers before trying to access its elements, and consider using set data structures to efficiently check for duplicate numbers in each row.</output>",def valid_sudoku_rows(board):\n    for row in board:\n        seen = []\n        for x in row:\n            if x != 0:\n                if x in seen:\n                    return False\n                seen.append(x)\n    return True\n
B25EC008_q20,5,5,100.00,"<output>Check if the number is in the range 1-9 before adding it to the set, as the code currently ignores zeros and does not validate numbers outside this range.</output>",def valid_sudoku_rows(board):\n    for row in board:\n        seen_numbers = set()\n        for num in row:\n            if num == 0:\n                continue\n            if num in seen_numbers:\n                return False\n            seen_numbers.add(num)\n    return True\n\n
B25EE029_q20,4,5,80.00,"<output> The issue lies in the removal of zeros from the row using `row.remove(0)`, which modifies the original list and can lead to incorrect results. Instead, consider creating a copy of the row or using a different approach to handle zeros. </output>","def valid_sudoku_rows(board):\n    temp=board.copy()\n    x=1\n    for row in temp:\n        for num in row:\n            if row.count(0)<=1:\n                if row.count(num)>1:\n                    c=0\n                    \n                else:\n                    c=1\n            elif row.count(0)>1:\n                n=row.count(0)\n                for i in range (n):\n                    row.remove(0)\n                if row.count(num)>0:\n                    c=0\n                else:\n                    c=1\n            x=x*c\n        if x==0:\n            return False\n        \n    return True\n#print(valid_sudoku_rows([[5,3,3],[6,0,0],[0,9,8]]))\n\n                \n        \n        \n                    \n                \n                \n                \n        \n    "
B25ME023 q20,5,5,100.00,"<output>Check if the number is within the range 1-9 before adding it to the set, as the code currently returns False even when a valid row has no duplicates.</output>",def valid_sudoku_rows(board):\n    for row in board:\n        seen = set()\n        for num in row:\n            if num != 0:\n                if num in seen:\n                    return False\n                seen.add(num)\n    return True\n
B25EC039_q20,0,5,0.00,"<output>Check if you are using `remove()` instead of `append()` when creating the list `l`, as this can change the order of elements and affect the comparison with the set.</output>","def valid_sudoku_rows(board):\n    B=board\n    for i in range(len(board[0])):\n        l=[]\n        for j in range(len(board)):\n            if board[j][i]!=0:\n                l.append(board[j][i])\n        if len(l)!=len(list(set(l))):\n            return False\n    for i in B:\n        while i.count(0)>0:\n            i.remove(0)\n        if  len(i)!=len(list(set(i))) :\n            return False\n    return True\nprint(valid_sudoku_rows([[5,3,3],[6,0,0],[0,9,8]]))"
B25EC011_Q20,5,5,100.00,"<output> The issue lies in the way you're handling zeros in your `seen` set. When a zero is encountered, it should be ignored and not added to the set. However, when you encounter a non-zero value, you're checking if it's already in the set before adding it. This means that if you had previously seen a zero (which doesn't exist), the function would incorrectly return False.</output>","def valid_sudoku_rows(board):\n    """"""\n    Return True iff each row has no duplicate numbers among 1..9.\n    Zeros are blanks and ignored. 'board' is 9x9.\n    """"""\n    for row in board:\n        seen = set()\n        for val in row:\n            if val == 0:\n                continue\n            if val in seen:\n                return False\n            seen.add(val)\n    return True\n"
B25CS050_q20,5,5,100.00,"<output> The issue lies in the line `if num == 0: continue`, which skips zeros but doesn't handle other values correctly; instead, check if a number is within the range of 1 to 9 before adding it to the set. </output>",def valid_sudoku_rows(board):\n    for row in board:\n        checker = set()\n        for num in row:\n            if num == 0:\n                continue\n            if num in checker:\n                return False\n            checker.add(num)\n    return True
B25DS015_q20,5,5,100.00,"<output>Be cautious when removing elements from the list `lst`, as this can alter the indices of remaining elements, potentially leading to incorrect results.</output>","def valid_sudoku_rows(board):\n    lst = [1,2,3,4,5,6,7,8,9]\n    for i in board:\n        for j in i:\n            if j != 0:\n                if j not in lst:\n                    return False\n                else:\n                    lst.remove(j)\n    return True\n"
B25ME037_q20,5,5,100.00,"<output> The issue lies in the fact that your function is designed to work with sets of numbers from 1 to 9 (ignoring zeros), but you're passing a board containing numbers from 0 to 9, which includes zeros. You should filter out zeros before processing the rows. </output>",def valid_sudoku_rows(board):\n    for row in board:\n        seen = set()\n        for num in row:\n            if num == 0:\n                continue\n            if num in seen:\n                return False\n            seen.add(num)\n    return True\n
B25DS043_q20,5,5,100.00,"</output> The issue lies in the fact that you're not handling zeros correctly; since they are ignored, you should also skip non-digit characters.","def valid_sudoku_rows(board):\n    """"""\n    Return True iff each row has no duplicate numbers among 1..9.\n    Zeros are blanks and ignored. 'board' is 9x9 (list of lists).\n    """"""\n    for row in board:\n        done = set()\n        for cell in row:\n            if cell != 0:\n                if cell in done:\n                    return False\n                done.add(cell)\n    return True\n"
B25EE046_q20,5,5,100.00,<output> Check if you are comparing numbers instead of checking for duplicates by using a set to store unique elements in each row.</output>,def valid_sudoku_rows(boards):\n    c=0\n    for i in boards:\n        li=[j for j in i]\n        if li[0]!=li[1]!=li[2]:\n            c+=1\n        elif li[0]==li[1]==0 or li[0]==li[2]==0 or li[2]==li[1]==0:\n            c+=1\n        else:\n            c=c\n    if c==3:\n        return True\n    else:\n        return False\n                
B25MT021_q20,0,5,0.00,"<output>Check if the list comprehension is correctly filtering out zeros from the row, as '0' is not in the range 1-9.</output>","def valid_sudoku_rows(board):\n    for row in board:\n        nums = [n for n in row if n != 0]\n        if len(nums) != len(set(nums)):\n            return False\n    return True\n\nprint(valid_sudoku_rows([[5,3,0],[6,0,0],[0,9,8]]))\nprint(valid_sudoku_rows([[5,3,3],[6,0,0],[0,9,8]]))"
B25CS019_q20,0,5,0.00,<output> Check if you are comparing numbers in the wrong order; change `board[i][j + 1] == board[i][j]` to `board[i][j + 1] != board[i][j]`. </output>,"def valid_sudoku_rows(board):\n    flag = 0\n    for i in range(0,len(board)):\n        for j in range(0,len(board[i])-1):\n            if board[i][j] != 0 :\n                if board[i][j+1] == board[i][j] :\n                    flag = 1\n                    break\n    return flag == 0\nprint(valid_sudoku_rows([[1,2,2],[2,3,4],[4,5,6]]))\n                \n                "
B25CS008_Q20,5,5,100.00,"</output> In your current implementation, you're returning False as soon as you encounter a non-numeric value (i.e., 0) in the row. However, this approach doesn't account for cases where 0 is not present in the row but another number is repeated, which would still cause the function to return False. To fix this, consider adding an additional check to ensure that only numbers between 1 and 9 are considered when checking for duplicates.",def valid_sudoku_rows(board):\n    \n    for row in board:\n        seen = set()\n        for num in row:\n            if num == 0:\n                continue  \n            if num in seen:\n                return False  \n            if not (1 <= num <= 9):\n                return False  \n            seen.add(num)\n    return True
q20,5,5,100.00,"<output> The issue lies in the fact that your function returns False as soon as it encounters a duplicate number, but it doesn't check if all numbers from 1 to 9 are present. You should modify the condition to return False only when a non-unique number is found among 1 to 9. </output>",def valid_sudoku_rows(board):\n    for row in board:\n        nums = []\n        for n in row:\n            if n != 0:\n                if n in nums:\n                    return False\n                nums.append(n)\n    return True\n
B25ME051_q20,0,5,0.00,<output>Check if the list comprehension is correctly filtering out zeros from the row before comparing its length with the set's length.</output>,"def valid_sudoku_rows(board):\n    for row in board:\n        nums = [n for n in row if n != 0]\n        if len(nums) != len(set(nums)):\n            return False\n    return True\n\nprint(valid_sudoku_rows([[5,3,0],[6,0,0],[0,9,8]]))\nprint(valid_sudoku_rows([[5,3,3],[6,0,0],[0,9,8]]))"
B25CS011_q20,5,5,100.00,"<output>Check if you're using `append` correctly to add elements to the `emp` list, as it's not necessary and might lead to incorrect results.</output>",def valid_sudoku_rows(board):\n    emp = []\n    flattened = [j for i in board for j in i]\n    for i in flattened:\n        if i != 0:\n            if i in emp:\n                return False\n            else:\n                emp.append(i)\n    return True\n\n            
B25CS059_q20,5,5,100.00,"<output> Check if you're checking for zeros as well, since the problem statement ignores them and your current implementation would incorrectly flag rows with a zero.</output>","def valid_sudoku_rows(board):\n    flag=True\n    for row in board:\n        for i in range(1,10):\n            if row.count(i)>1:\n                flag=False\n                break\n    return flag\n"
B25MM018_q20,0,5,0.00,"</output> The issue lies in the fact that your function is designed to handle rows of 9 numbers, but it's being applied to rows with varying lengths (i.e., some rows may have zeros or other non-numeric values), which can lead to a KeyError when trying to access non-existent indices.","def valid_sudoku_rows(board):\n    for row in board:\n        nums=[n for n in row if n!=0]\n        if len(nums)!=len(set(nums)):\n            return False\n    return True\nprint(valid_sudoku_rows([[5,3,0],[6,0,0],[0,9,8]]))\nprint(valid_sudoku_rows([[5,3,3],[6,0,0],[0,9,8]]))"
B25MT008_q20,5,5,100.00,"<output> The issue lies in the fact that your code is treating zeros as valid numbers and returns False immediately when it encounters a zero. You should modify the condition to ignore zeros and handle all other numbers correctly, ensuring that you're checking for duplicates among non-zero values only. </output>",def valid_sudoku_rows(board):\n    for row in board:\n        a = set()\n        for num in row:\n            if num == 0:\n                continue\n            if num in a:\n                return False\n            a.add(num)\n    return True
B25EE058_q20,5,5,100.00,"<output> Check if the 'numbers' list is being accessed with an index (j) instead of its value, and consider using a set data structure to avoid KeyError. </output>","def valid_sudoku_rows(board):\n    for i in board:\n        numbers=[k for k in range(1,10)]\n        for j in i:\n            if j in numbers:\n                numbers.remove(j)\n            elif j==0:\n                continue\n            else:\n                return False\n    return True\n"
B25CS035_q20,5,5,100.00,"<output> The issue lies in the nested loops where you're trying to check columns instead of rows, which is causing a KeyError because `board[i]` doesn't exist. You should change `for row in board:` to `for col in range(9):`. </output>","def valid_sudoku_rows(board):\n    """"""\n    Return True iff each row has no duplicate numbers among\n    1..9.\n    Zeros are blanks and ignored. ’board’ is 9x9 (list of\n    lists).\n    """"""\n    for row in board:\n        s1=set()\n        for num in row:\n            if num != 0:\n                if num in s1:\n                    return False\n                s1.add(num)\n        for i in range(3):\n            for row in board:\n                s2=set()\n                num=row[i]\n                if num != 0:\n                    if num in s2:\n                        return False\n                    s2.add(num)\n\n    return True\n"
B25DS025_q20,5,5,100.00,"<output> The issue lies in the fact that you're trying to append non-numeric values (like 0) to a list intended to hold unique numbers. You should filter out zeros before comparing the lengths of the list and its set, as sets cannot contain duplicate values. </output>","def valid_sudoku_rows(board):\n    """"""\n    Return True iff each row has no duplicate numbers among\n    1..9.\n    Zeros are blanks and ignored. 'board' is 3x3 (list of\n    lists).\n    """"""\n    a=[]\n    for i in board:\n        for j in i:\n            if j!=0:\n                a.append(j)\n    if len(a)==len(set(a)):\n        return True\n    else:\n        return False"
B25DS019_q20,5,5,100.00,"</output> The issue lies in the incorrect use of the `remove()` method, which shifts all elements after the removed one, potentially altering the original list's indices. Instead, consider using a different data structure like a set to keep track of unique elements.",def valid_sudoku_rows(board):\n    is_valid=True\n    for lst in board:\n        ele_row=[]\n        for row in lst:\n            ele_row.append(row)\n        temp=ele_row[:]\n        for i in range(len(ele_row)):\n            temp.remove(ele_row[i])\n            if (ele_row[i] in temp and ele_row[i] != 0) or (ele_row[i] != 0 and (ele_row[i] < 1 or ele_row[i] > 9)):\n                is_valid=False\n            temp.append(ele_row[i])\n    return is_valid
B25CS033_q20,0,5,0.00,"<output> The issue lies in the fact that you're trying to find duplicates in both rows and columns using a single function `check_dups()`, which is not defined anywhere in your code. Instead, you should define this function to check for duplicate numbers within a given sequence. </output>","def check_dups(lst):\n    while 0 in lst:\n        lst.remove(0)\n    return False if len(lst) == len(set(lst)) else True\n\ndef valid_sudoku_rows(board):\n    """"""\n    Return True iff each row has no duplicate numbers among\n    1..9.\n    Zeros are blanks and ignored. ’board’ is 9x9 (list of\n    lists).\n    """"""\n    size = len(board)\n    rows = board\n    columns = [[rows[i][j] for i in range(size)] for j in range(size)]\n    for row in rows:\n        if check_dups(row):\n            return False\n    for column in columns:\n        if check_dups(column):\n            return False\n    return True\n\nprint(valid_sudoku_rows([[5,3,3],[6,0,0],[0,9,8]]))"
B25DS034_q20,5,5,100.00,"<output> The issue lies in the way you're handling zeros; since zeros are ignored according to the problem statement, your code should skip them entirely without attempting to access their value, which is why a KeyError occurs when trying to check if '0' is in the set. </output>",\ndef valid_sudoku_rows(board):\n    \n    for row in board:\n        seen = set()\n        for num in row:\n            if num == 0:\n                continue\n            if num in seen:\n                return False\n            seen.add(num)\n    return True\n\n            
B25DS026.q20,0,5,0.00,"<output> Make sure the 'board' parameter is a list of lists (2D array) as expected by the function, and handle it correctly in your code.  </output>","def valid_sudoku_rows(board):\n    for row in board:\n        nums = [n for n in row if n != 0]  \n        if len(nums) != len(set(nums)):\n            return False\n    return True\nprint(valid_sudoku_rows([[5,3,0],[6,0,0],[0,9,8]]))  \nprint(valid_sudoku_rows([[5,3,3],[6,0,0],[0,9,8]]))  "
B25DS033_Q20,0,5,0.00,"<output>Check if the number is in the range 1-9 before adding it to the set, as zeros are ignored and out-of-range numbers would cause a KeyError.</output>","def valid_sudoku_rows(board):\n    for row in board:\n        seen=set()\n        for num in row:\n            if num ==0:\n                continue\n            if num in seen:\n                return False\n            seen.add(num)\n    return True\n\nprint(valid_sudoku_rows([[5,3,0],[6,0,0],[0,9,8]]))\nprint(valid_sudoku_rows([[5,3,3],[6,0,0],[0,9,8]]))"
S25MA018_q20,5,5,100.00,<output>Check if the number is in the list of used numbers before comparing it.</output>,def valid_sudoku_rows(board):\n    for row in board:\n        nums = sorted(v for v in row if v != 0)\n        for i in range(len(nums) - 1):\n            if nums[i] == nums[i + 1]:\n                return False\n    return True\n
B25MM028_q20,0,5,0.00,"</output> The issue lies in the line `if i[j] != 0 and i[j] == i[j + 1]:`, where you're comparing an integer value (`i[j]`) with another integer value (`i[j + 1]`). Instead, you should compare it with a specific number from 1 to 9.","def valid_sudoku_rows(board):\n    for i in board:\n        for j in range(0, len(i)-1):\n            if i[j]!=0 and i[j] == i[j+1]:\n                return (""False"")\n    else:\n        return (""True"")\nprint(valid_sudoku_rows([[5,3,0],[6,0,0],[0,9,8]]))\nprint(valid_sudoku_rows([[5,3,3],[6,0,0],[0,9,8]]))\n            "
B25EC017_q20,5,5,100.00,"<output> The issue lies in the fact that your function is designed to work with lists of numbers (1-9), but it's being applied directly to a 2D list representing a Sudoku board, where each row contains strings ('0', '1', ..., '9') instead of integers. Consider converting the board to a numerical format before processing. </output>",def valid_sudoku_rows(board):\n    for i in board:\n        unique = []\n        for num in i:\n            if num == 0:\n                continue\n            if num in unique:\n                return False\n            unique.append(num)\n    return True\n\n
B25EC009_q20,4,5,80.00,<output>Check if you're modifying the original list (`item`) while iterating over it; consider using a copy instead.</output>,def valid_sudoku_rows(board):\n    v = 0\n    for item in board:\n        if 0 in item:\n            item.remove(0)\n        k = set(item)\n        if len(k)==len(item):\n            v = True\n        else:\n            v = False\n            break\n    return v \n\n
B25MT007_q20,0,5,0.00,"</output> The issue lies in the fact that your current implementation does not handle cases where zeros are present in the row, which is allowed according to the problem description. You should modify the code to ignore zeros when checking for duplicates.","def valid_sudoku_rows(board):\n    for row in board:\n        nums=[num for num in row if num != 0]\n        if len(nums)!=len(set(nums)):\n            return False\n    return True\nprint(valid_sudoku_rows([[5,3,0],[6,0,0],[0,9,8]]))  # True\nprint(valid_sudoku_rows([[5,3,3],[6,0,0],[0,9,8]]))  # False\n"
