student_id,tests_passed,tests_total,score_percentage,semantic_summary,code_snippet
B25EC007_q20,2,5,40.00,"<output> Make sure to check if the board index is within range before accessing it with `board[i][j]`, as the error occurs when trying to access an element outside the 9x9 grid. </output>",def valid_sudoku_rows(board):\n    for i in range (9):\n        d=dict()\n        for j in range (9):\n            if board[i][j]==0:\n                continue\n\n            if board[i][j] not in d:\n                d[board[i][j]]=1\n            else:\n                return False\n\n    for j in range (9):\n        d=dict()\n        for i in range (9):\n            if board[i][j] == 0:\n                continue\n\n            if board[i][j] not in d:\n                d[board[i][j]] = 1\n            else:\n                return False\n\n    return True
B25ME017_q20,0,5,0.00,"<output> Check if the student is correctly handling zero values in the input rows, as zeros are ignored according to the problem statement.  </output>","def valid_sudoku_rows(board: list):\n    for row in board:\n        ans = set()\n        for num in row:\n            if num != 0:\n                if num in ans:\n                    return False\n                ans.add(num)\n    return True\nprint(valid_sudoku_rows([[5,3,0],[6,0,0],[0,9,8]]))\n"
B25CS025_q20,5,5,100.00,"<output>Check if you are comparing `i[j]` with `i[k]`, but you should be comparing `j` and `k` separately to check for duplicates in the row.</output>","def valid_sudoku_rows(board):\n    for i in board:\n        for j in range(len(i)):\n            if i[j] == 0:\n                continue \n            for k in range(j + 1, len(i)):\n                if i[j] == i[k]:\n                    return False\n    return True\n"
B25MM027_q20,0,5,0.00,"<output> Check if the row index is within the valid range (0-8) before accessing the board, as indexing starts at 0 in Python.  </output>","def valid_sudoku_rows(board):\n    for row in board:\n        seen = set()\n        for num in row:\n            if num == 0:  \n                continue\n            if num < 1 or num > 9 or num in seen:\n                return False\n            seen.add(num)\n    return True\nboard = [\n    [5, 3, 0, 0, 7, 0, 0, 0, 0],\n    [6, 0, 0, 1, 9, 5, 0, 0, 0],\n    [0, 9, 8, 0, 0, 0, 0, 6, 0],\n    [8, 0, 0, 0, 6, 0, 0, 0, 3],\n    [4, 0, 0, 8, 0, 3, 0, 0, 1],\n    [7, 0, 0, 0, 2, 0, 0, 0, 6],\n    [0, 6, 0, 0, 0, 0, 2, 8, 0],\n    [0, 0, 0, 4, 1, 9, 0, 0, 5],\n    [0, 0, 0, 0, 8, 0, 0, 7, 9]\n]\n\nprint(valid_sudoku_rows(board))  \n"
B25ME010_q20,5,5,100.00,"</output> The issue lies in the fact that you're iterating over all columns (`col`) instead of a single column, causing an out-of-range error when trying to access `board[row][j]`. Change it to iterate only over the current row's index.","def valid_sudoku_rows(board):\n    for row in range(len(board)):\n        for col in range(len(board)):\n            x=board[row][col]\n            if x!=0:\n                for i in range(row+1,len(board)):\n                    if board[i][col]==x:\n                        return False\n                for j in range(col+1,len(board)):\n                    if x==board[row][j]:\n                        return False\n    return True\n"
B25MM026_q20,0,5,0.00,<output>Check if you are comparing integers with strings by using `str(num)` or `int(num)` to ensure consistent data types.</output>,"def valid_sudoku_rows(board):\n    for row in board:\n        used_num = []\n        for num in row:\n            if num == 0:\n                continue        \n            if num in used_num:     \n                return False\n            used_num.append(num)\n    return True\n#example\nprint(valid_sudoku_rows([[5,3,0],[6,0,0],[0,9,8]])) #output- True\nprint(valid_sudoku_rows([[5,3,3],[6,0,0],[0,9,8]])) #output- False\n\n"
B25MT004_q20,0,5,0.00,"<output> Make sure to handle the case when `val` is not in the range 1-9 before trying to add it to the set `s`, as this could lead to a KeyError if `val` is outside of this range. </output>","\ndef valid_sudoku_rows(board):\n   \n    for row in board:\n        s = set()\n        for val in row:\n            if val == 0:\n                continue\n            if val in s:\n                return False\n            s.add(val)\n    return True\n\nprint(valid_sudoku_rows([[5,3,0],[6,0,0],[0,9,8]]))"
B25EE044_q20,5,5,100.00,"<output>Check if you're comparing integers with zero values, as this will always return True due to Python's truthiness rules.</output>",def valid_sudoku_rows(board):\n\n    for row in board:\n        for i in range(3):\n            if row[i]>9 or row[i]<0:\n                return False\n\n    for row in board:\n        if row[0]==row[1] or row[1]==row[2] or row[2]==row[0]:\n            if row[0]==row[1]==0 or row[1]==row[2]==0 or  row[2]==row[0]==0:\n                return True\n            return False\n        \n    return True\n
B25EC031_q20,5,5,100.00,"<output> The issue lies in the fact that you're trying to sort and compare lists of numbers (temp_list) with a row that contains zeros. Since zeros are ignored, the sorted rows will not have the same order as the original rows, causing the comparison to fail. </output>","def valid_sudoku_rows(board):\n    """"""\n    Return True iff each row has no duplicate numbers among\n    1..9.\n    Zeros are blanks and ignored. ’board’ is 9x9 (list of\n    lists).\n    """"""\n    zero_less_board = []\n    for row in board:\n        new_row = []\n        for i in row:\n            if i != 0:\n                new_row.append(i)\n        zero_less_board.append(new_row)    \n    for row in zero_less_board:\n        temp_list = list(set(row))\n        row.sort()\n        temp_list.sort()\n        if row != temp_list:\n            return False\n    return True"
B25DS008_q20,0,5,0.00,"<output>Use a set instead of a list to check for duplicates, as sets automatically eliminate duplicates and provide faster lookup times.</output>","def valid_sudoku_rows(board):\n    no=[]\n    t=0\n    for i in board:\n        for j in i:\n            if j>0 and j<10:\n                if j not in no:\n                    no.append(j)\n                    t=1\n                else:\n                    t=0\n                    return False\n    if t==1:\n        return True\nprint(valid_sudoku_rows([[5,3,0],[6,0,0],[0,9,8]]))\nprint(valid_sudoku_rows([[5,3,3],[6,0,0],[0,9,8]]))"
B25MT017_q20,0,5,0.00,"<output>Check if the board is a list of lists before iterating over it, as the function 'valid_sudoku_rows' seems to be defined but not accessible.</output>",def valid_suduku_rows(board):\n    for row in board:\n        seen = set()\n        for num in row:\n            if num != '.':\n                if num in seen:\n                    return False\n                seen.add(num)\n    return True
B25DS010_q20,5,5,100.00,<output>Check if you're using `item` as a reference to modify it instead of creating a copy.</output>,def valid_sudoku_rows(board):\n    for item in board:\n        count = 0\n        for i in item:\n            c = 0\n            if i==0:\n                continue\n            else:\n                for j in item:\n                    if i == j:\n                        c+=1\n            if c>1:\n                break\n        count += c\n        if count>1:\n            break\n    \n    if count<=1:\n        return True\n    else:\n        return False\n
B25MT026_q20,5,5,100.00,<output>Check if the board is a 2D list and iterate over each row to compare its elements without using 'in' keyword or any other set data structure.</output>,"def valid_sudoku_rows(board):\n    pass\n\ndef valid_sudoku_rows(board):\n    """"""Returns True if the given sudoku row is valid.""""""\n    \n    for row in board:\n        nums = [x for x in row if x != 0]  \n        if len(nums) != len(set(nums)):\n            return False\n    return True\n\n\n\n'''\nprint(valid_sudoku_rows([[5,3,0],[6,0,0],[0,9,8]]))     # True\nprint(valid_sudoku_rows([[5,3,3],[6,0,0],[0,9,8]]))     # False\n\n\nboard_valid = [\n    [5, 3, 0, 0, 7, 0, 0, 0, 0],\n    [6, 0, 0, 1, 9, 5, 0, 0, 0],\n    [0, 9, 8, 0, 0, 0, 0, 6, 0],\n    [8, 0, 0, 0, 6, 0, 0, 0, 3],\n    [4, 0, 0, 8, 0, 3, 0, 0, 1],\n    [7, 0, 0, 0, 2, 0, 0, 0, 6],\n    [0, 6, 0, 0, 0, 0, 2, 8, 0],\n    [0, 0, 0, 4, 1, 9, 0, 0, 5],\n    [0, 0, 0, 0, 8, 0, 0, 7, 9]\n]\n\nboard_invalid = [\n    [5, 3, 5, 0, 7, 0, 0, 0, 0],\n    [6, 0, 0, 1, 9, 5, 0, 0, 0],\n    [0, 9, 8, 0, 0, 0, 0, 6, 0],\n    [8, 0, 0, 0, 6, 0, 0, 0, 3],\n    [4, 0, 0, 8, 0, 3, 0, 0, 1],\n    [7, 0, 0, 0, 2, 0, 0, 0, 6],\n    [0, 6, 0, 0, 0, 0, 2, 8, 0],\n    [0, 0, 0, 4, 1, 9, 0, 0, 5],\n    [0, 0, 0, 0, 8, 0, 0, 7, 9]\n]\n\nprint(valid_sudoku_rows(board_valid))       # True\nprint(valid_sudoku_rows(board_invalid))     # False\n'''"
B25CS060_q20,5,5,100.00,<output>Check if you're using `append` correctly to add numbers to your new list; consider using a set instead for efficient duplicate checking.</output>,def valid_sudoku_rows(board):\n    new_list=[]\n    for i in board:\n        for j in i:\n            if j!=0:\n                new_list.append(j)\n    for num in new_list:\n        if new_list.count(num)!=1:\n            return False\n    return True\n\n        \n        \n    
B25CS010_q20,5,5,100.00,"<output> The issue lies in the line `i.index(j) != k`, which will raise a KeyError when `j` is 0 (since `index()` cannot find an index of zero). Instead, you should check if `j` is not equal to 0 before comparing it with its index. </output>","def valid_sudoku_rows(board):\n    """"""\n    Return True iff each row has no duplicate numbers among\n    1..9.\n    Zeros are blanks and ignored. ’board’ is 9x9 (list of\n    lists).\n    """"""\n    # Question only mentions rows, even though there are many more rules in sudoku?\n    return [len([j for k, j in enumerate(i) if i.index(j) != k and j != 0]) > 0 for i in board].count(True) == 0\n"
B25ME056_q20,5,5,100.00,"</output> The issue lies in the fact that you're treating each number (1-9) as a key in a set, but sets in Python can only contain hashable elements. Since numbers are not hashable, this will result in a KeyError when trying to add a non-hashable element to the set.","def valid_sudoku_rows(board):\n    """"""\n    Return True iff each row has no duplicate numbers among 1..9.\n    Zeros are blanks and ignored. 'board' is 9x9 (list of lists).\n    """"""\n    for row in board:\n        seen = set()\n        for num in row:\n            if num == 0:\n                continue\n            if num in seen:\n                return False\n            seen.add(num)\n    return True\n"
S25MA002_Q20,0,5,0.00,"<output> Use `known_value.add(val)` instead of `known_value`.add(val)`, which is missing a closing parenthesis and will raise a KeyError.  </output>","def valid_sudoku_rows(board):\n\n    for row in board:\n        known_value = set()\n        for val in row:\n            if val == 0:\n                continue\n            if val in known_values:\n                return False\n            known_value`.add(val)\n    return True\n\nprint(valid_sudoku_rows([[5,3,0],[6,0,0],[0,9,8]]))\nprint(valid_sudoku_rows([[5,3,3],[6,0,0],[0,9,8]]))\n"
B25DS018_q20,0,5,0.00,"<output> The problem lies with the usage of 'continue' inside the for loop, which causes the function to return as soon as it finds a row with duplicates, instead of checking all rows. Instead, use a conditional statement to break out of the loop when a duplicate row is found. </output>","def valid_sudoku_rows(board):\n    def number_repeat_checker(row):\n        filtered_row = [num for num in row if num != 0]\n        new_set = set(filtered_row)\n        new_row = list(new_set)\n        if(len(filtered_row) == len(new_row)):\n            return True\n        else:\n            return False\n        \n    for row in board:\n        if(number_repeat_checker(row) == True):\n            continue\n        else:\n            return False\n        \n    return True\n\nprint(valid_sudoku_rows([[5,3,0],[6,0,0],[0,9,8]]))\nprint(valid_sudoku_rows([[5,3,3],[6,0,0],[0,9,8]]))"
B25MT002_q20,5,5,100.00,"<output> The issue lies in the way you're handling zeros (blanks) in the board; instead of ignoring them, your code is treating them as a valid number and potentially returning False for rows containing only zeros. Consider adding a check to exclude zeros from the 'seen' set when initializing it. </output>","def valid_sudoku_rows(board):\n    """"""\n    Return True iff each row has no duplicate numbers among\n    1..9.\n    Zeros are blanks and ignored. ’board’ is 9x9 (list of lists )\n \n    """"""\n    for row in board:\n        \n        seen=set()#empty set to track the elemts which r seen\n        \n        for i in row:\n            if i==0:#to skip the blanck cells\n                continue\n            if i in seen:\n                return False\n            \n            seen.add(i)\n    \n    return True\n"
B25EE021_q20,5,5,100.00,<output> Check if you are using `append` method to add elements to your list instead of creating a new list with each row as in the problem description.  </output>,def valid_sudoku_rows(board):\n    L = [i for j in board for i in j]\n    for i in L:\n        if i == 0:\n            continue\n        else:\n            if i in L[L.index(i)+1:]:\n                return False\n        \n    return True    \n\n
B25EC026_q20,5,5,100.00,"<output> Check if your code is correctly handling zeros, as they are ignored in the problem statement and should not trigger the duplicate check.</output>",def valid_sudoku_rows(board):\n    for i in board:\n        for j in i:\n            if j==0:\n                continue\n            if i.count(j)>1 or j<0 or j>9:\n                return False\n    return True\n
B25MT029_Q20,0,5,0.00,"<output> Check that you're using a list comprehension to create a new list without duplicates, rather than modifying the original list with `append` or other methods.</output>","def valid_sudoku_rows(board):\n    for lst in board:\n        r = [n for n in lst if n != 0]\n        if len(r) != len(set(r)):\n            return False\n        return True\n    \nprint(valid_sudoku_rows([[5,3,0],[6,0,0],[0,9,8]])) \nprint(valid_sudoku_rows([[5,3,3],[6,0,0],[0,9,8]]))"
S25MA008  Q20,0,5,0.00,"<output>Check if you're using `append` to add new elements to the list `n`, as this can lead to incorrect results due to the order in which elements are added.</output>","def valid_sudoku_rows(board):\n    n=[]\n    t=0\n    for i in board:\n        for j in i:\n            if j>0 and j<10:\n                if j not in n:\n                    n.append(j)\n                    t=1\n                else:\n                    t=0\n                    return False\n    if t==1:\n        return True\nprint(valid_sudoku_rows([[5,3,0],[6,0,0],[0,9,8]]))\nprint(valid_sudoku_rows([[5,3,3],[6,0,0],[0,9,8]]))"
B25DS020_Q20,4,5,80.00,"<output> Check for duplicate numbers within each row, not just zero counts, by comparing individual numbers instead of their counts.</output>",def valid_sudoku_rows(board):\n    for i in board:\n        for j in i:\n            if i.count(0)>1:\n                return True \n            else:\n                if i.count(j)>1:\n                    return False
B25MM015_Q20,5,5,100.00,<output>Check if you are using `append` to add elements to the list correctly and consider using a set to store unique numbers instead.</output>,def valid_sudoku_rows(board):\n    lst = []\n    for i in range(len(board)):\n        for j in range (len(board)):\n            if board[i][j] != 0:\n                lst.append(board[i][j])\n    if len(lst)==len(set(lst)):\n        return True\n    else:\n        return False
B25EE035_Q20,0,5,0.00,<output>Check if you're using a set to keep track of unique numbers in each row instead of comparing values directly.</output>,"""""""\nReturn True iff each row has no duplicate numbers among\n1..9.\nZeros are blanks and ignored. ’board’ is 9x9 (list of\nlists).\n""""""\ndef valid_sudoku_rows(board):\n    for items in board:\n        for i in range(len(items)):\n            for j in range(i+1,len(items)):\n                if items[i]!=items[j]:\n                    continue\n                else:\n                    if items[i]==0:\n                        return True\n                    else:\n                        return False\nprint(valid_sudoku_rows([[5,3,0],[6,0,0],[0,9,8]]))#true\nprint(valid_sudoku_rows([[5,3,3],[6,0,0],[0,9,8]]))#false\n"
B25CS012_q20,5,5,100.00,"<output>Check if you're comparing individual digits with the list of numbers (1-9), instead compare each digit with its corresponding value in the row.</output>","def valid_sudoku_rows(board):\n    for i in board:\n        nums=[k for k in range(1,10)]\n        for j in i:\n            if j in nums:\n                nums.remove(j)\n            elif j==0:\n                continue\n            else:\n                return False\n    return True\n\nvalid_sudoku_rows([[5,3,0],[6,0,0],[0,9,8]]) #True\nvalid_sudoku_rows([[5,3,3],[6,0,0],[0,9,8]]) #False"
B25CS056_q20,5,5,100.00,"<output> The issue lies in the fact that your code is treating zeros as non-zero values and not considering them when checking for duplicates. To fix this, you should modify the condition to ignore zeros by changing `if j != 0:` to `if j == 0:`, so that zeros are included in the set of numbers being checked. </output>","def valid_sudoku_rows(board):\n    """"""\n    Return True iff each row has no duplicate numbers among 1..9.\n    Zeros are blanks and ignored. ’board’ is 9x9 (list of lists).\n    """"""\n\n    t = []\n    for i in board:\n        for j in i:\n            if j != 0:\n                t.append(j)\n    \n    if len(t) == len(set(t)):\n        return True\n    else:\n        return False\n\n# print(valid_sudoku_rows([[5,3,3],[6,0,0],[0,9,8]]))"
B25EC014_q20,4,5,80.00,"<output> Check if you're trying to access the index of an empty list or tuple instead of the actual value. Instead of `x[0]`, use `x` as it's a set, and similarly for `x[1]` and `x[2]`. This will correctly check for duplicate numbers in each row. </output>","def valid_sudoku_rows(board):\n    """"""\n    Return True iff each row has no duplicate numbers among\n    1..9.\n    Zeros are blanks and ignored. ’board’ is 9x9 (list of\n    lists).\n    """"""\n    \n    for a  in board:\n        while ((0 in a) ==True):\n            a.remove(0)\n    \n    \n    def equal(x):\n        a = len(x)\n        \n        if a ==1:\n            return False\n        if a ==2:\n            if x[0] != x[1]:\n                return False\n            else:\n                return True\n        if a ==3:\n            if x[0] != x[1] and x[1] != x[2] and x[2] != x[0]:\n                return False\n        \n            else:\n                return True\n    \n    \n    \n    if equal(board[0]) == False and equal(board[1]) == False and equal(board[2]) == False:\n        return True\n    else:\n        return False\n    \n\n"
B25EE019_q20,5,5,100.00,"<output> Check if the row index is within the valid range (0-8) before accessing the board's corresponding row, as out-of-bounds indices may cause an IndexError. </output>",def valid_sudoku_rows(board):\n    for row in board:\n        seen_numbers = set()\n        for num in row:\n            if num != 0:\n                if num in seen_numbers:\n                    return False\n                seen_numbers.add(num)\n    return True
B25EC038_Q20,0,5,0.00,"<output>Check if you're iterating over each row individually, not just taking every 9th element from the entire board.</output>","def valid_sudoku_rows(board):\n    a = []\n    for i in range(3):\n        b = board[i]\n        for j in range(3):\n            a.append(b[j])\n    for k in range(9):\n        c = a[k]\n        for i in range(k+1,9):\n            d = a[i]\n            if c == 0:\n                pass\n            else:\n                if c == d:\n                    return False\n    return True\n            \n            \n    \nprint(valid_sudoku_rows([[5,3,0],[6,0,0],[0,9,8]]))\nprint(valid_sudoku_rows([[5,3,3],[6,0,0],[0,9,8]]))"
B25EC042_q20,0,5,0.00,"<output>Make sure to iterate over each row in the board and check for duplicates individually, rather than collecting all non-zero numbers into a single list.</output>","def valid_sudoku_rows(board):\n    list=[]\n    l=len(board)\n    for i in range(0,l):\n        for J in board[i]:\n            if J!=0:\n                list.append(J)            \n    if len(list)!=len(set(list)):\n        return False    \n    return True\nprint(valid_sudoku_rows([[5,3,0],[6,0,0],[0,9,8]]))\nprint(valid_sudoku_rows([[5,3,3],[6,0,0],[0,9,8]]))"
B25EE031_q20,0,5,0.00,"<output>Check if the set is being created with numbers from 1 to 9 only (excluding zeros), not all possible digits (0-9).</output>","def valid_sudoku_rows(board):\n    for i in board:\n        Myset=set()\n        for j in i:\n            if j==0:\n                continue\n            if j in Myset:\n                return False\n            else:\n                Myset.add(j)\n    return True\n'''I have used the continue statement to skip the iteration whenever j==0'''\nprint(valid_sudoku_rows([[5,3,0],[6,0,0],[0,9,8]]))\nprint(valid_sudoku_rows([[5,3,3],[6,0,0],[0,9,8]]))"
B25ME035_Q20,0,5,0.00,<output> Check if the row contains any zeros before attempting to check for duplicates of non-zero numbers. </output>,"def valid_sudoku_rows(board):\n    for r in board:\n        visible_nums = set()\n        for num in r:\n            if num != 0:  \n                if num in visible_nums:\n                    return False\n                visible_nums.add(num)\n    return True\nprint(valid_sudoku_rows([[5,3,0],[6,0,0],[0,9,8]])) \nprint(valid_sudoku_rows([[5,3,3],[6,0,0],[0,9,8]]))"
B25MM025_q20,0,5,0.00,<output>Use set() to check for duplicates instead of comparing individual elements.</output>,"def valid_sudoku_row(board):\n    a=list(board[0])\n    b=list(board[1])\n    c=list(board[2])\n    s=0\n    d=0\n    l=0\n    for i in a:\n        for j in b:\n            for k in c:\n                if i==0 or j==0 or k==0:\n                   d=0\n                else:\n\n                    if i==j:\n                        s+=1\n                    elif i==k:\n                        s+=1\n                    elif j==k:\n                        l+=1\n                    else:\n                        d=0\n    if s==0 and l==0:\n        print('True')\n    else:\n        print('false')\n                     \n                \nvalid_sudoku_row([[1,3,0],[3,4,5],[6,7,8]])\n\n    "
B25EE004_q20,2,5,40.00,"<output> Make sure to check if the key exists in the dictionary before trying to access it, using `if key not in d` instead of `if board[i][j] not in d`. </output>",def valid_sudoku_rows(board):\n    for i in range (9):\n        d=dict()\n        for j in range (9):\n            if board[i][j]==0:\n                continue\n\n            if board[i][j] not in d:\n                d[board[i][j]]=1\n            else:\n                return False\n\n    for j in range (9):\n        d=dict()\n        for i in range (9):\n            if board[i][j] == 0:\n                continue\n\n            if board[i][j] not in d:\n                d[board[i][j]] = 1\n            else:\n                return False\n\n    return True
B25ME016_q20,0,5,0.00,<output>Check if the 'board' parameter is defined before accessing its elements.</output>,"def valid_sudoku_rows(board):\n    \n    for row in board:\n        s = set()\n        for num in row:\n            if num == 0:  \n                continue\n            if num in s:  \n                return False\n            s.add(num)\n    return True\nboard1= [\n    [5,3,5,0,7,0,0,0,0],  \n]+board1[1:]\nprint(valid_sudoku_rows(board1))"
B25ME009_q20,5,5,100.00,"<output>Check if the number is in the range 1-9 before comparing it with 'seen', as the code currently returns False when any non-zero number is encountered.</output>","""""""\nReturn True iff each row has no duplicate numbers among\n1..9.\nZeros are blanks and ignored. ’board’ is 9x9 (list of\nlists).\n""""""\ndef valid_sudoku_rows(board):\n    for row in board:\n        seen = []\n        for num in row:\n            if num != 0:\n                if num in seen:\n                    return False\n                seen.append(num)\n    return True\n "
B25EC002_q20,5,5,100.00,"<output> You are correctly checking if the numbers 1-9 appear more than once in each row, but you're not considering that zeros are ignored. To fix this, add a condition to skip zero when checking for duplicates. </output>",def valid_sudoku_rows(board):\n\n    for row in board:\n        seen_lst = []\n        for num in row:\n            if num == 0:  \n                continue\n            if num in seen_lst: \n                return False\n            seen_lst.append(num)\n    return True\n
B25MM012_Q20,0,5,0.00,"</output> The issue lies in the fact that your function is designed to work with lists of numbers, but the Sudoku board is a 2D list where each number can be a string. You should convert all numbers to integers before comparing them.","def valid_sudoku_rows(board):\n    for row in board:\n        nums = [n for n in row if n != 0]   \n        if len(nums) != len(set(nums)):     \n            return False\n    return True\n\nboard = [\n    [5,3,0,0,7,0,0,0,0],\n    [6,0,0,1,9,5,0,0,0],\n    [0,9,8,0,0,0,0,6,0],\n    [8,0,0,0,6,0,0,0,3],\n    [4,0,0,8,0,3,0,0,1],\n    [7,0,0,0,2,0,0,0,6],\n    [0,6,0,0,0,0,2,8,0],\n    [0,0,0,4,1,9,0,0,5],\n    [0,0,0,0,8,0,0,7,9]\n]\nprint(valid_sudoku_rows(board))  "
