student_id,tests_passed,tests_total,score_percentage,semantic_summary,code_snippet
B25CS023_Q20,5,5,100.00,"<output> The issue lies in the fact that you're treating each number as if it's from a dictionary (using `in s`), but numbers are not keys in sets; they are elements. You should use set comparison directly (`n in s`) or check for existence before adding to the set. </output>","def valid_sudoku_rows(board):\n    """"""\n    Return True iff each row has no duplicate numbers among\n    1..9.\n    Zeros are blanks and ignored. ’board’ is 9x9 (list of\n    lists).\n    """"""\n    for row in board:\n        s = set()\n        for n in row:\n            if n != 0:\n                if n in s:\n                    return False\n                s.add(n)\n    return True"
B25EE025_q20,0,5,0.00,"<output> The issue lies in the line `if num in numbers:` where you're trying to check if a number exists in the list. However, the list is initialized with `numbers = []` which means it's an empty list and therefore doesn't contain any numbers yet. You should initialize it as `numbers = set()` because sets in Python can efficiently store unique values. </output>","def valid_sudoku_rows(board):\n    for row in board:\n        numbers = []\n\n        for num in row:\n            if num == 0:\n                continue\n\n            if num in numbers:\n                return False\n            numbers += [num]\n\n    return True\n\n#example\nprint(valid_sudoku_rows([[5,3,0], [6,0,0], [0,9,8]]))\nprint(valid_sudoku_rows([[5,3,3], [6,0,0], [0,9,8]]))"
B25CS002_q20,0,5,0.00,"<output>Make sure to append elements to the list correctly using `lst.append(n)` instead of just assigning `n` to `lst`, as in `lst = n`. This will ensure that `lst` remains a list and not just a single element.</output>",def valid_sudoko_rows(board):\n    for i in board:\n        lst = []\n        for n in i:\n            if (n != 0):\n                if n in lst:\n                    return False\n                else:\n                    lst.append(n)\n    return True
B25EE022_q20,0,5,0.00,"<output>Be cautious when using `append` to add elements to your list, as it modifies the original list and can lead to incorrect results.</output>","def valid_sudoku_rows(board):\n    list=[]\n    l=len(board)\n    for i in range(0,l):\n        for element in board[i]:\n            if element!=0:\n                list.append(element)\n            \n    if len(list)!=len(set(list)):\n        return False\n    \n    return True\n\nprint(valid_sudoku_rows([[5,3,0],[6,0,0],[0,9,8]]))\nprint(valid_sudoku_rows([[5,3,3],[6,0,0],[0,9,8]]))"
B25CS054_q20,5,5,100.00,<output>Check if the board is a 2D list and ensure that each row has exactly 9 elements before accessing its elements.</output>,"def valid_sudoku_rows(board):\n    n = len(board)\n\n    for i in range (n):\n        for j in range (n):\n            if board[i][j]==0: continue\n            if is_duplicate(board, i, j, n): return False\n\n    return True\n\ndef is_duplicate (board, i, j, n):\n    for k in range (n):\n        if board[i][k] == board[i][j] and k!=j: return True\n\n\n"
B25ME034_q20,5,5,100.00,<output>Check if you're using `append` correctly to add elements to your `elements` list.</output>,def valid_sudoku_rows(board):\n    elements=[]\n    for list in board :\n        for element in list:\n            if element ==0:\n                continue\n            if element not in elements:\n                elements.append(element)\n            else:\n                return False\n    return True\n
B25MM016_Q20,0,5,0.00,"<output> Check for incorrect string concatenation, as adding strings to rows might be causing incorrect results due to Python's implicit type conversion between integers and strings.</output>","def valid_sudoku_rows(s):\n    for row in s:\n        for ele in row:\n            if ele!=0:\n                if row.count(ele)>1:\n                    return False\n\n    return True\nprint(valid_sudoku_rows([[5,3,0],[6,0,0],[0,9,8]]))\n"
B25EC037_q20,0,5,0.00,<output> Make sure to handle duplicates correctly by using a set to keep track of unique numbers instead of appending them to a list and then converting it back to a set. </output>,"def valid_sudoku_rows(board):\n    req_lst=[]\n    for i in board:\n        for j in i:\n            if j==0:\n                pass\n            else: \n                req_lst.append(j)\n    # now we will chk if numbers are duplicate or not. best method sets\n    set_lst=set(req_lst)\n    dup_lst=list(set_lst)\n    if len(dup_lst)==len(req_lst):\n        return True\n    return False\nprint(valid_sudoku_rows([[5,3,3],[6,0,0],[0,9,8]]))"
B25ME045_q20,2,5,40.00,"<output> The issue lies in the repeated initialization of the dictionary `d` within each row iteration, causing an IndexError when trying to access the key '0' which doesn't exist. Instead, initialize `d` once before the loop and check for existence before using it. </output>",def valid_sudoku_rows(board):\n    for i in range (9):\n        d=dict()\n        for j in range (9):\n            if board[i][j]==0:\n                continue\n\n            if board[i][j] not in d:\n                d[board[i][j]]=1\n            else:\n                return False\n\n    for j in range (9):\n        d=dict()\n        for i in range (9):\n            if board[i][j] == 0:\n                continue\n\n            if board[i][j] not in d:\n                d[board[i][j]] = 1\n            else:\n                return False\n\n    return True
B25EE001_q20,5,5,100.00,<output>Check if the row contains all numbers from 1 to 9 before adding them to the set.</output>,def valid_sudoku_rows(board):\n    \n    for row in board:\n        seen = set()\n        for num in row:\n            if num == 0:\n                continue\n            if num in seen:\n                return False\n            seen.add(num)\n    return True
B25EE037_q20,0,5,0.00,"<output>Check if you're comparing adjacent numbers in the same row by checking `board[i][j]` and `board[i][j + 1]`, but also consider that there are no zeros ignored, so you should compare all numbers from 1 to 9.</output>","def valid_sudoku_rows(board):\n    l = len(board)\n    for i in range(l):\n        for j in range(l - 1):  \n            if board[i][j] == board[i][j + 1] and board[i][j] != 0:\n                return False   \n    return True  \n\n\nprint(valid_sudoku_rows([[5,3,0],[6,0,0],[0,9,8]]))\nprint(valid_sudoku_rows([[5,3,3],[6,0,0],[0,9,8]])) "
B25CS062_q20,0,5,0.00,"<output> The issue lies in the fact that your current implementation doesn't account for rows with only zeros; it returns False immediately, whereas a valid row should return True since there are no duplicates among non-zero numbers. Consider adding a check to handle such cases. </output>","def valid_sudoku_rows(board):\n    for row in board:\n        nums=[num for num in row if num != 0]\n        if len(nums)!=len(set(nums)):\n            return False\n    return True\nprint(valid_sudoku_rows([[5,3,0],[6,0,0],[0,9,8]]))  # True\nprint(valid_sudoku_rows([[5,3,3],[6,0,0],[0,9,8]]))  # False\n"
B25ME059_q20,5,5,100.00,<output>Check if you're using `append` instead of adding elements to a set directly.</output>,def valid_sudoku_rows(board):\n    list1=[n for ele in board for n in ele]\n    n=list1.count(0)\n    if(n!=0):\n        count=n+len(set(list1))-1\n    else:\n        count=len(set(list1))\n    if(count==9):\n        return True\n    else:\n        return False
B25EE043_q20,0,5,0.00,<output>Check if the row contains all numbers from 1 to 9 before adding them to the set.</output>,"def valid_sudoku_rows(board):\n    for row in board:\n        seen = set()\n        for num in row:\n            if num == 0:\n                continue\n            if num in seen: \n                return False\n            seen.add(num)\n    return True\nprint(valid_sudoku_rows([[5,3,0],[6,0,0],[0,9,8]])) \nprint(valid_sudoku_rows([[5,3,3],[6,0,0],[0,9,8]])) "
B25EE006.Q20,0,5,0.00,<output>Check if the 'num' variable is an integer before comparing it with other numbers in the set.</output>,\ndef valid_sudoku_rows(board):\n   \n    for row in board:\n        seen = set()\n        for num in row:\n            if num == 0:      # blanks\n                continue\n            if num in seen:   # duplicate \n                return False\n            seen.add(num)\n    return True\n
B25EC035_q20,0,5,0.00,"<output>Check if you are using `append` correctly to add elements to the list, as it seems that only non-zero numbers are being added.</output>","def valid_sudoku_rows(board):\n    l = []\n    for i in board:\n        for j in i:\n            if j in l:\n                return False\n            if j == 0:\n                continue\n            else:\n                l.append(j)\n    return True\n\nprint(valid_sudoku_rows([[1,2,3],[4,5,6],[7,8,9]]))\nprint(valid_sudoku_rows([[1,0,0],[4,2,6],[7,0,9]]))"
B25MT030_q20,5,5,100.00,<output>Check if you're using `append` correctly to add numbers to your set; consider using a different data structure like a set instead.</output>,def valid_sudoku_rows(board):\n    rows=len(board)\n    columns=len(board[0])\n    x=[]\n    for i in range (rows):\n        for j in range (columns):\n            y=board[i][j]\n            if y!=0:\n                if y in x:\n                    return False\n                x.append(y)\n    return True
B25EE017_q20,3,5,60.00,"<output> Check if the row contains any zeros before attempting to remove them, as your current implementation will raise a KeyError when encountering a zero. </output>",def valid_sudoku_rows(board):\n    for row in board:\n        nums = [ i for i in row if i !='.']\n        if len(nums) != len(set(nums)):\n            return False\n    return True
B25EE031_Q20,0,5,0.00,"<output> The issue lies in your code's handling of zeros (0), which are ignored in the problem statement but not properly skipped in your implementation. You should add a check to skip zero values when checking for duplicates, like so: `if j == 0 or j in Myset`, instead of just `if j in Myset`. </output>","def valid_sudoku_rows(board):\n    for i in board:\n        Myset=set()\n        for j in i:\n            if j==0:\n                continue\n            if j in Myset:\n                return False\n            else:\n                Myset.add(j)\n    return True\n'''I have used the continue statement to skip the iteration whenever j==0'''\nprint(valid_sudoku_rows([[5,3,0],[6,0,0],[0,9,8]]))\nprint(valid_sudoku_rows([[5,3,3],[6,0,0],[0,9,8]]))"
B25CS055_q20,5,5,100.00,"<output> The issue lies in the `count_elements` function where you're trying to add an element from the set `s` back into it. This is incorrect because sets only allow unique elements, so you should be using a dictionary instead of a set to count occurrences. </output>","def valid_sudoku_rows(board):\n    """"""\n    Return True iff each row has no duplicate numbers among\n    1..9.\n    Zeros are blanks and ignored. 'board' is 9x9 (list of\n    lists).\n    """"""\n    def count_elements(e,list):\n        count=0\n        for i in list:\n            if i==e:\n                count+=1\n        return count\n    flag=1\n    for i in board:\n        s = set()\n        for j in i:\n            if j>0 and j<=9:\n                s.add(j)\n        for e in s:\n            if count_elements(e,i)!=1:\n                flag=0\n    if flag==1:\n        return True\n    else:\n        return False"
B25EC021_q20,5,5,100.00,<output>Consider using a set data structure to check for duplicates in each row instead of manually comparing elements.</output>,"def valid_sudoku_rows(board):\n    rev = [[x,y,z] for one,x in enumerate(board[0]) for two,y in enumerate(board[1]) for three,z in enumerate(board[2]) if one==two==three]\n    def check(lst):\n        count = 0\n        for i in lst:\n            a ,b,c = i\n            print(a ,b,c)\n            if  (a==b and b!=0 and a !=0) or (a==c and a!=0 and c !=0) or (b == c and b!=0 and c !=0): \n               return False \n        return True\n     \n    return check(board) and check(rev)\n"
B25EC024_q20,5,5,100.00,"<output>Check if the number is within the range 1-9 before adding it to the set, as using a set with non-integer values could raise an error.</output>","def valid_sudoku_rows(boards):\n    for row in boards:\n        new_set = set()\n        for num in row:\n            if num == 0:\n                continue\n            if num in new_set:\n                return False\n            new_set.add(num)\n    return True\n\nvalid_sudoku_rows([[5,3,0],[6,0,0],[0,9,8]])\nvalid_sudoku_rows([[5,3,3],[6,0,0],[0,9,8]])\n"
B25DS028_q20,5,5,100.00,<output>Use the number 0 instead of None when initializing the 'seen' list and consider using a set data structure for efficient lookups.</output>,def valid_sudoku_rows(board):\n    for row in board:\n        seen = []\n        for n in row:\n            if n != 0:\n                if n in seen:\n                    return False\n                seen.append(n)\n    return True
B25CS039_q20,0,5,0.00,"<output>Check if you're counting individual numbers (1-9) instead of sets of numbers that appear in each row, as `i.count(x)` counts occurrences of a single number, not sets.</output>","def valid_sudoku_rows(board):\n    flag=True\n    for i in board:\n        if any(i.count(x)>1 for x in range(1,10)):\n            flag=False\n            break\n    return flag\nprint(valid_sudoku_rows([[5,3,0],[6,0,0],[0,9,8]])) # True\nprint(valid_sudoku_rows([[5,3,3],[6,0,0],[0,9,8]])) # False"
B25MM004_q20,5,5,100.00,"<output>Check if the number is in the alphabet list before appending it, and consider using a set instead of a list for faster lookups.</output>",def valid_sudoku_rows(board):\n    \n    \n    for row in board:\n        \n        alpha=[]\n        for num in row:\n            \n            if num != 0:\n                \n                if num in alpha:\n                    \n                    return False\n                alpha.append(num)\n    return True\n\n\n
B25MM008_Q20,0,5,0.00,"<output> The issue lies in the fact that your function is designed to check rows of a Sudoku board, but it's currently returning False as soon as it encounters a non-zero number in the row, which might not be the intended behavior. Consider modifying the function to return True if all numbers in the row are unique and zero is ignored. </output>","def valid_sudoku_rows(board):\n    for row in board:\n        seen=set()\n        for num in row:\n            if num ==0:\n                continue\n            if num in seen:\n                return False\n            seen.add(num)\n    return True\n\nprint(valid_sudoku_rows([[5,3,0],[6,0,0],[0,9,8]]))\nprint(valid_sudoku_rows([[5,3,3],[6,0,0],[0,9,8]]))\n\n"
B25MT024_q20,5,5,100.00,<output> Make sure to handle the case where a row contains a zero (0) before checking if any number is repeated in the set of seen numbers. This will prevent KeyError when trying to access 'num' which could be None. </output>,def valid_sudoku_rows(board):\n    for row in board:\n        seen = set()\n        for num in row:\n            if num == 0: \n                continue\n            if num in seen:\n                return False\n            seen.add(num)\n    return True\n
B25MT001_Q20,5,5,100.00,"<output> You're close! Instead of using `numbers` directly in the second loop, try iterating over a set of unique numbers and check if each number is present in the set. This will help you avoid any potential KeyError. </output>","\n\ndef valid_sudoku_rows(board):\n    """"""\n    Return True iff each row has no duplicate numbers among 1..9.\n    Zeros are blanks and ignored. 'board' is 9x9 (list of lists).\n    """"""\n    \n    for row in board:\n        # Filter out zeros (blanks)\n        numbers = [num for num in row if num != 0]\n        \n        # Check if all numbers are in valid range 1-9\n        for num in numbers:\n            if num < 1 or num > 9:\n                return False\n        \n        # Check for duplicates\n        if len(numbers) != len(set(numbers)):\n            return False\n    \n    return True\n\nvalid_sudoku_rows([[5,3,0],[6,0,0],[0,9,8]]) # True\nvalid_sudoku_rows([[5,3,3],[6,0,0],[0,9,8]]) # False"
B25ME028_q20,0,5,0.00,"<output>Check if the row contains any zeros before processing it, as zeros are ignored in the problem statement.</output>","'''set(row) means removing the duplicate values\nlen(row) means number of elements in the row\nlen(set(row)) means number of unique elements\n'''\n\ndef valid_sudoku_rows(board):\n    for row in board:\n        numbers = [x for x in row if x != 0]\n        if len(numbers) != len(set(numbers)):\n            return False\n    return True\n\n\nprint(valid_sudoku_rows([[5,3,0],[6,0,0],[0,9,8]]))  #True\nprint(valid_sudoku_rows([[5,3,3],[6,0,0],[0,9,8]]))  #False\n"
B25ME030_q20,0,5,0.00,"<output> Check if your loop is iterating over each number individually, not the entire row at once. Instead of comparing `ele[i]` with `ele[j + 1]`, compare it with every other element in the row. </output>","def valid_sudoku_rows(b):\n    for ele in b:\n        for i in range(0,len(ele)):\n            for j in range(0,(len(ele)-1)):\n                if ele[i]==ele[j+1]and  ele[i]==ele[j]!=0:\n                    return False\n    return True\nprint(valid_sudoku_rows([[5,3,0],[6,0,0],[0,9,8]])) \nprint(valid_sudoku_rows([[5,3,3],[6,0,0],[0,9,8]]))"
B25EC034_q20,5,5,100.00,"<output>Use `in` operator instead of `==` to check if the number is in the list, as it's more efficient and Pythonic.</output>",def valid_sudoku_rows(board):\n    for row in board:\n        o = []  \n        \n        for num in row:\n            if num == 0:\n                continue  \n            if num in o:\n                return False  \n            o.append(num)  \n    \n    return True  
B25DS027_q20,5,5,100.00,"<output> The issue lies in the fact that you're using 0 as an invalid number, but your input board contains zeros which are ignored. You should ignore these zeros when checking for duplicates, so change `if num == 0: continue` to `if num == 0 or num == None: continue`. </output>",def valid_sudoku_rows(board):\n    \n    for row in board:\n        seen = set()\n        for num in row:\n            if num == 0:\n                continue\n            if num in seen:\n                return False\n            seen.add(num)\n    return True
B25EE016_q20,5,5,100.00,"<output> Check if the row index is within the valid range (0-8) before accessing it in the board, as an out-of-range index will raise a KeyError. </output>",def valid_sudoku_rows(board):\n    for row in board:\n        seen = set()\n        for num in row:\n            if num == 0:       \n                continue\n            if num in seen:   \n                return False\n            seen.add(num)\n    return True
B25MM020_q20,0,5,0.00,<output>Check if you're using `append` to add elements to the list correctly and consider using a set to store unique numbers instead of comparing lengths.</output>,"def valid_sudoku_rows(board):\n    lst = []\n    for i in range(len(board)):\n        for j in range (len(board)):\n            if board[i][j] != 0:\n                lst.append(board[i][j])\n    if len(lst)==len(set(lst)):\n        return True\n    else:\n        return False \n\n\n\n\n\n\n\nprint(valid_sudoku_rows([[5,3,0],[6,0,0],[0,9,8]]))\nprint(valid_sudoku_rows([[5,3,3],[6,0,0],[0,9,8]]))"
B25EE049_q20,5,5,100.00,"<output> The issue lies in using `L.index(i) + 1` to get the next index, which can lead to incorrect results if the same number appears multiple times before the current one. Instead, use a set to keep track of seen numbers. </output>",def valid_sudoku_rows(board):\n    L = [i for j in board for i in j]\n    for i in L:\n        if i == 0:\n            continue\n        else:\n            if i in L[L.index(i)+1:]:\n                return False\n        \n    return True    \n\n\n
B25EE054_q20,5,5,100.00,"<output> Check if the row contains all numbers from 1 to 9 before adding them to the set, as using `num in s` will raise a KeyError when encountering a zero or an out-of-range number. Use `if num not in s and num >= 1 and num <= 9:` instead. </output>",def valid_sudoku_rows(board):\n    \n    for row in board:\n        s = set()\n        for num in row:\n            if num == 0:  \n                continue\n            if num in s:  \n                return False\n            s.add(num)\n    return True
B25EE018_Q20,0,5,0.00,"<output>Check if the number is in the set before trying to add it, as attempting to add a non-integer value will raise an error.</output>","def valid_sudoku_rows(board):\n    for row in board:\n        seen = set()\n        for num in row:\n            if num == 0:\n                continue\n            if num in seen:\n                return False\n            if not 1 <= num <= 9:\n                return False\n            seen.add(num)\n    return True\n\nprint(valid_sudoku_rows([[5, 3, 0], [6, 0, 0], [0, 9, 8]]))"
B25DS036_q20,5,5,100.00,<output>Check if the set(s) is a subset of the list (i) before comparing their lengths.</output>,def valid_sudoku_rows(board):\n    for i in board:\n        while 0 in i:\n            i.remove(0)\n\n        s=set()\n        for j in i:\n            s.add(j)\n        if len(s)!=len(i):\n            return False\n    return True        \n
B25DS032_q20,0,5,0.00,"<output> Make sure to check if the cell value is in the range of 1-9 before comparing it with 'seen_digits', as '.' is a valid value in Sudoku and can cause incorrect results. </output>","def valid_sudoku_rows(board):\n    for row in board:\n        seen_digits = set()\n        for cell in row:\n            if cell != '.':\n                if cell in seen_digits:\n                    return False\n                seen_digits.add(cell)\n        return True\n\nprint(valid_sudoku_rows([[5,3,0],[6,0,0],[0,9,8]]))\nprint(valid_sudoku_rows([[5,3,3],[6,0,0],[0,9,8]]))"
B25MM009(q20),0,5,0.00,<output>Check if you're comparing integers with strings by converting `ele` to an integer before counting.</output>,"def valid_sudoku_rows(s):\n    for row in s:\n        for ele in row:\n            if ele!=0:\n                if row.count(ele)>1:\n                    return False\n\n    return True\nprint(valid_sudoku_rows([[5,3,0],[6,0,0],[0,9,8]]))\nprint(valid_sudoku_rows([[5,3,3],[6,0,0],[0,9,9]]))"
B25ME005_q20,1,5,20.00,"<output> Make sure to check if the index exists before trying to access it, as the error occurs when `board[x][y]` is 0 (which can happen in the first iteration of the row) and you're using `x` as an index for another variable. </output>","def valid_sudoku_rows(board):\n    for x in range(0,9):\n        for y in range(0,9):\n            for j in range(y+1,9):\n                if board[x][y]!= 0 and board[x][y] == board[x][j]:\n                    return False\n                \n    return True\n"
B25DS005_q20,5,5,100.00,<output>Check if the set is initialized with all numbers from 1 to 9 before adding each number from the row.</output>,def valid_sudoku_rows(board):\n    for rows in board:\n        p = set()\n        for num in rows:\n            \n            if num != 0:\n                if num in p:\n                    return False\n                p.add(num)\n    return True\n\n
B25EE056_q20,0,5,0.00,"<output>Check if you're using `append` correctly to add elements to your lists; instead, consider using `extend`. This can help prevent duplicates from being added.</output>","def valid_sudoku_rows(matrix):\n  count1=0\n  c1=0\n  for j in range(0,len(matrix[0]),1):\n    new_list=[]\n    for i in range(0,len(matrix),1):\n      if matrix[i][j]!=0:\n        if matrix[i][j] not in new_list:\n            new_list.append(matrix[i][j])\n        else:\n            count1+=1\n    if count1!=0:\n        c1+=1\n  if c1==0:\n   c2=0\n   count2=0\n   for j in range(0,len(matrix),1):\n    new_list2=[]\n    for i in range(0,len(matrix[0]),1):\n     if matrix[j][i]!=0:\n        if matrix[j][i] not in new_list2:\n            new_list2.append(matrix[j][i])\n        else:\n            count2+=1\n    if count2!=0:\n        c2+=1\n   if c2==0:\n      return True\n   else:\n      return False\n    \nprint(valid_sudoku_rows([[5,3,0],[6,0,0],[0,9,8]]))\nprint( valid_sudoku_rows([[5,3,3],[6,0,0],[0,9,8]]))\n"
B25DS006_q20,5,5,100.00,<output>Check if you're using `list1.count(x)` correctly and consider using a set to keep track of unique numbers instead.</output>,def valid_sudoku_rows(board):\n    for i in range(len(board)):\n        list1=board[i]\n        set1=set(list1)\n        for x in set1:\n            if x==0 or x==None:\n                pass\n            elif list1.count(x)>1:\n                return False\n    return True\n\n
B25DS023_q20,5,5,100.00,"<output> Check if you're comparing individual elements (`j`) instead of entire rows (`i`), which seems to be the source of your logic error.</output>","def valid_sudoku_rows(board):\n    a = True\n    for i in board:\n        for j in i:\n            if j==0:\n                pass\n            else:\n                if i.count(j)!=1:\n                    a = False\n                    break\n    if a==False:\n        return False   \n    else:\n        for k in range(len(board)):\n            for l in range(k+1,len(board)):\n                if board[k][0]!=0 and board[l][0]!=0:\n                    if board[k][0]==board[l][0]:\n                        a = False\n                        break\n                if board[k][-1]!=0 and board[l][-1]!=0:\n                    if board[k][-1]==board[l][-1]:\n                        a = False\n                        break\n    if a==False:\n        return False\n    else:\n        return True\n"
